combined,language,queue
Ozi achọrọ na Ngwọta Nchedo Data Ahụike [SEP] Nwere ike ịnye ngwọta zuru ezu maka ịchekwa data ahụike na gburugburu ụlọ ọgwụ? Anyị na-achọ ụzọ a pụrụ ịdabere na ya ma dị irè iji kpuchido ozi ndị ọrịa dị mkpa. A ga-enwe ekele dị ukwuu maka nka gị n'akụkụ a. Biko kesaa ozi na ihe ndị dị mkpa iji nyere anyị aka melite usoro nchekwa data anyị.,ibo,General Inquiry
"Mbelata na ndị ahịa Engagement ọnụego hụrụ [SEP] The ahịa ahịa njikọ ọnụego nke ahịa ụlọ ọrụ belatara, ikekwe n'ihi ochie digital atụmatụ. Anyị emelitere ọdịnaya na n'ozuzu ụzọ.",ibo,General Inquiry
"Nsogbu na Investment Optimization Ngwá Ọrụ [SEP] Ndewo Nkwado ndị ahịa, m na-eche nsogbu ihu na data nchịkọta ngwá ọrụ eji maka ego njikarịcha. Ngwá ọrụ na-emepụta ihe na-atụghị anya ya pụta, nke nwere ike ịbụ n'ihi na nso nso software mmelite. M gbalịrị ịtọgharịa ngwá ọrụ na nyochaa data input, ma ọ dị mwute ikwu, nsogbu ahụ adịghị edozi. Ndị a na-atụghị anya mmepụta na-akpata nsogbu na ego mkpebi usoro na m na-echegbu na ha nwere ike iduga na suboptimal ego nhọrọ. M ga-enwe ekele dị ukwuu maka enyemaka gị na idozi nke a nsogbu.",ibo,General Inquiry
"Njikọ Njikọ maka WooCommerce na Sage Accounting Systems [SEP] Mgbe ị na-agakwuru Nkwado Ndị Ahịa gbasara ikike njikọta maka ikpo okwu SaaS anyị, WooCommerce na Sage Accounting systems, anyị ga-enwe ekele dị ukwuu maka ozi zuru ezu banyere sistemụ ndị dị ugbu a, gụnyere API, plugins, na ngwaọrụ ndị dịnụ. Anyị nwekwara mmasị ịghọta njedebe ọ bụla ma ọ bụ ihe achọrọ maka usoro njikọta. Ọzọkwa, ị nwere ike inye nduzi banyere usoro nhazi akọwapụtara na ihe enyemaka ọ bụla dịnụ iji hụ na usoro njikọta na-enweghị nsogbu? Anyị na-atụ anya ịnụ nzaghachi ka anyị na-enyocha otu nyiwe a nwere ike isi gboo mkpa e-azụmahịa na akaụntụ anyị.",ibo,General Inquiry
"Arịrịọ maka Imeziwanye Ngwaọrụ Njikwa Project na Ngwakọta PowerPoint [SEP] Ana m ede iji rịọ maka nkwalite maka ngwá ọrụ njikwa ọrụ, kpọmkwem iji tinye njikọta na PowerPoint maka ngwaahịa ndị edepụtara. A na-atụ anya na njikọta a ga-eme ka ahụmịhe onye ọrụ dịkwuo mma. Site n'ikwe ndị ọrụ ohere ịnweta ma jikwaa ọrụ na-enweghị nsogbu n'ime ngwa ọrụ ahụ, ọ ga-eme ka arụpụta ihe na arụmọrụ dịkwuo elu. Ekwenyere m na nkwalite a ga-abara ndị ọrụ uru nke ukwuu, si otú ahụ melite afọ ojuju n'ozuzu na ngwá ọrụ ahụ.",ibo,General Inquiry
"Nkọwa banyere AutoCAD 2022 SaaS [SEP] Na-achọ ozi gbasara njikọta nke AutoCAD 2022 SaaS maka njikwa ọrụ. Ọ ga-amasị m ma ọ bụrụ na ị nwere ike ịkọwapụta uru njikọta a ga-enye ndị otu anyị. Ugbu a, anyị na-eji AutoCAD maka imewe na SaaS maka njikwa ọrụ, anyị na-achọkwa ime ka ọrụ anyị dịkwuo mma site na ijikọ sistemụ abụọ ahụ. Biko gwa m ihe ndị dị mkpa anyị kwesịrị ime iji mee ka nke a mee. Ana m atụ anya nzaghachi gị.",ibo,General Inquiry
"Arịrịọ maka ikike nchebe netwọk [SEP] Ezigbo ndị ọrụ nkwado ndị ahịa,\n\nM na-atụ anya na ozi a ruru gị nke ọma. Ana m arịọ n'ụzọ iwu kwadoro maka mgbanwe metụtara ịnweta, nhazi, na njikọta nke ngwaọrụ nchebe netwọk nke ụlọ ọrụ ahụ na-eji. Mgbanwe ndị a dị mkpa iji kwado ọrụ ntinye nke gụnyere nyocha dị elu, ịme ihe nlereanya oge, na usoro ọrụ ntinye ego dabere na iwu ezubere maka ọrụ ego.\n\nNrụ ọrụ anyị dị ugbu a na-enye usoro nchekwa dị mkpa, mana ka ikike nyocha ego na-aga n'ihu, ọ dị mkpa ka anyị mee ka nchebe netwọk anyị sie ike.",ibo,General Inquiry
"Ihe ngwọta ngwanrọ na-arụ ọrụ nke ọma na-eme ka ndị ahịa nwee ike ịhazi ihe ndị a. Ihe kpatara ya bụ na ọ bụghị ihe niile ka mma, ọ bụ ezie na ọ bụ ihe dị mkpa, ọ bụ ihe dị mkpa, ọ bụrụ na ị nwere ike ịhazi ihe ndị ahụ.",ibo,General Inquiry
Arịrịọ maka enyemaka ahịa dijitalụ [SEP] Nye nduzi maka itinye usoro ahịa dijitalụ n'ọrụ,ibo,General Inquiry
"Nchegbu Banyere Digital Engagement [SEP] Ịnagide ọdịda a na-atụghị anya ya na ọnụọgụgụ njikọ aka dijitalụ, nke na-emetụta atụmatụ uto ika anyị. O yiri ka mgbanwe ndị na-adịbeghị anya na algorithms mgbasa ozi dijitalụ nwere ike ịbụ ihe kpatara ya. Mgbe anyị gbanwere mgbasa ozi na-elekwasị anya ma gbanwee ọdịnaya anyị, anyị chọpụtara ụfọdụ mma. Achọrọ m enyemaka iji dozie nsogbu a.",ibo,General Inquiry
"Nkwupụta Nhazi Ụlọ Ọrụ [SEP] Ezigbo ndị ọrụ nkwado ndị ahịa,\n\nAna m achọ ịrịọ maka mmelite na nhazi nhazi nke ugbu a dịka egosiri na ndekọ anyị maka ụlọ ọrụ ahịa. Ụlọ ọrụ ahụ enweela mgbanwe dị ukwuu n'oge na-adịbeghị anya, ọ dịkwa mkpa iji hụ na akwụkwọ anyị na-egosipụta nhazi ọhụrụ ndị a n'ụzọ ziri ezi. M ga-enwe ekele maka enyemaka gị na mmelite nke ozi a.\n\nNa mbido, m ga-achọ ịkọwa ọrụ na ọrụ ndị emelitere na ngalaba dị iche iche nke ụlọ ọrụ ahụ. Dịka ọmụmaatụ, Ngalaba Okike ugbu a na-elekwasị anya na ịmepụta ọdịnaya, na ọrụ akọwapụtara nke ọma iji melite arụmọrụ na ịza ajụjụ.",ibo,General Inquiry
Meziwanye njirimara onye ọrụ maka njikarịcha igodo na ahụmịhe onye ọrụ [SEP] Ị rịọ maka mmelite nke njirimara onye ọrụ iji melite igodo na melite ahụmịhe onye ọrụ maka ngwanrọ njikwa ọrụ. Nke a ga-aba uru dị ukwuu maka arụpụta ọrụ nke ndị otu na afọ ojuju n'ozuzu na ngwá ọrụ ahụ.,ibo,General Inquiry
"Improving Investment Optimization Through Data Analytics [SEP] Ndewo, ana m agwa gị banyere ọrụ nyocha data na njikarịcha ego. Nwere ike ịnye nkọwa ndị ọzọ banyere otu nyocha data si eme ka ọrụ ndị a dịkwuo mma? M ga-enwe ekele dị ukwuu maka ozi gbasara ngwaọrụ na usoro eji eme nyocha data na ịme mkpebi itinye ego. Na mgbakwunye, m ga-achọ ịma otú nyocha data si enyere aka ịchọpụta ọnọdụ na usoro ahịa, yana otu o si enye aka na atụmatụ itinye ego n'ozuzu ya. Daalụ maka enyemaka gị, ana m atụ anya nzaghachi gị.",ibo,General Inquiry
"Ihe omuma nke ohere na usoro data ahụike [SEP] N'oge gara aga, a nwara ịnwale nnweta na-enweghị isi na usoro data ahụike. O nwere ike ịbụ n'ihi usoro nchekwa emebi emebi. N'agbanyeghị mmelite ngwanrọ, nsogbu ahụ ka dị ma achọrọ enyemaka.",ibo,General Inquiry
"Nkwekọrịta Data Nche [SEP] A chọpụtala ihe mberede nchekwa nwere ike imetụta usoro data ahụike nke ụlọ ọgwụ. Nnyocha mbụ na-egosi na mmebi ahụ nwere ike ịbụ nsonaazụ nke usoro iwu ochie. A na-agba mbọ ịmegharị netwọk ahụ ma soro ndị ọrụ aka rụkọọ ọrụ iji dozie nsogbu ahụ. Nnyocha miri emi dị mkpa iji nyochaa oke nke mmebi ahụ ma tinye usoro nchebe iji gbochie nlọghachi. Nchedo nke data ahụike bụ ihe kachasị mkpa; yabụ, a na-eme ihe kwesịrị ekwesị iji nọgide na-enwe usoro ziri ezi. Ndị ọrụ ahụ na-arụsi ọrụ ike iji dozie ọnọdụ ahụ.",ibo,General Inquiry
"Meziwanye Ihe Nchebe Maka Nchedo Data Ahụike [SEP] Nkwado ndị ahịa, biko melite usoro nchebe iji chebe data ahụike na sistemụ ụlọ ọgwụ anyị iji gbochie mmebi nwere ike ime. Ọ dị oke mkpa iji kpuchido ozi ndị ọrịa na igbochi nnweta na-enweghị ikike. M ga-enwe ekele ma ọ bụrụ na ị nwere ike ịtụle itinye usoro ndị dị mkpa iji hụ na nchekwa nke usoro data ahụike anyị. A na-enwe ekele maka uche gị na okwu a dị mkpa.",ibo,General Inquiry
"Nsogbu na ịnweta Medical Records [SEP] Nkwado ndị ahịa, ana m akwadebe akụkọ banyere nchegbu nchekwa nwere ike ịdị n'ime sistemụ ụlọ ọgwụ. Onye na-ahụ maka ahụike ahụ enweela nsogbu ịnweta ndekọ ahụike, ikekwe n'ihi esemokwu ngwanrọ ma ọ bụ usoro nchekwa emebi emebi. Ugboro iji dozie nsogbu ahụ site na itinye patches, ịme nyocha sistemụ, na nyochaa ikikere onye ọrụ enwebeghị ihe ịga nke ọma. Isiokwu ahụ ka na-edozibeghị, na-ewelite nchegbu banyere nchekwa nke ozi nzuzo nke ndị ọrịa. A ga-enwe ekele dị ukwuu maka enyemaka gị.",ibo,General Inquiry
"Enyemaka achọrọ na Digital Ngwá Ọrụ Integration Issue [SEP] Nkwado ndị ahịa,\n\nAnyị na-enwe nsogbu ebe njikọ nke ụlọ ọrụ ahịa anyị n'ofe ọtụtụ nyiwe dijitalụ akpaghasịrị. Ọ dị ka mmelite ndị na-adịbeghị anya akpatala nsogbu ndakọrịta, na-eduga na nkwụsị nke ọrụ. N'agbanyeghị usoro mbụ nke idozi nsogbu dịka ịmalitegharịa ngwaọrụ na nyochaa nsụgharị ngwanrọ, nsogbu ahụ ka dị. Anyị na-eche na nsogbu ahụ nwere ike ịbụ mgbagwoju anya ma chọọ nyocha miri emi. Biko ị nwere ike inye ndụmọdụ banyere nzọụkwụ ndị ọzọ iji dozie nke a?",ibo,General Inquiry
"Nsogbu Njikọ Intermittent Chọpụta N'ofe Ngwaọrụ Dị Iche Iche [SEP] Anyị na-enwe nsogbu njikọ njikọ na-emetụta mmekọrịta data n'etiti ọtụtụ ngwaọrụ ndị jikọtara. Nsogbu ahụ nwere ike isi na API overloads ma ọ bụ njehie nhazi netwọk pụta. Ugboro iji dozie nsogbu ahụ site na ịhapụ caches, rebooting ngwaọrụ netwọk, na nyochaa igodo API enwebeghị ihe ịga nke ọma. Anyị ga-enwe ekele ma ọ bụrụ na ị nwere ike nyochaa okwu a ma nye azịza ya na nkasi obi gị. Biko mee ka anyị mara ma ọ bụrụ na achọrọ ozi ndị ọzọ iji nyere aka na nsogbu.",ibo,General Inquiry
"Enyemaka achọrọ maka Digital Tools Integration Problem [SEP] Nkwado ndị ahịa, ana m agwa gị banyere nchegbu banyere njikọta nke ụlọ ọrụ ahịa anyị n'ofe nyiwe dijitalụ dị iche iche. O yiri ka mmelite ndị na-adịbeghị anya emeela ka nsogbu dakọtara, na-akpaghasị usoro ọrụ anyị. N'agbanyeghị nsogbu mbụ dị ka ịmalitegharịa ngwaọrụ na nyochaa nsụgharị ngwanrọ, nsogbu ahụ ka dị. Echere m na nsogbu ahụ dị mgbagwoju anya ma nwee ike ịchọ nyocha miri emi. Biko nwee ike inye ndụmọdụ banyere nzọụkwụ ndị ọzọ?",ibo,General Inquiry
"Nkwado maka Ajụjụ Nchikota Ego [SEP] Nkwado ndị ahịa, <br>Algorithm anyị na-eme ka ego dị mma na-arụpụta nsonaazụ na-ekwekọghị ekwekọ, ikekwe n'ihi isi mmalite data emebi emebi. Anyị anwaala ịmegharị algorithm na ime ka data dị ọhụrụ, mana nsogbu ahụ na-aga n'ihu. <br>Anyị ga-enwe ekele dị ukwuu maka enyemaka gị na idozi okwu a, nke na-emetụta mkpebi itinye ego anyị. Biko mee ka anyị mara nzọụkwụ ndị ọzọ iji dozie nsogbu ahụ. <br>Daalụ maka nkwado gị. <br>N'eziokwu, [Aha Gị]",ibo,General Inquiry
"Ngwa ngwa gwa onye ọrụ banyere mmelite usoro onboarding [SEP] Ezigbo nkwado ndị ahịa, m na-ede iji rịọ maka mmelite banyere usoro onboarding maka usoro nhazi ọrụ. Usoro a dị mgbagwoju anya ma na-eduga na ọnụego dị elu, nke na-adịghị mma maka itinye aka na nghọta. Ana m atụ aro ụzọ dị mfe, gụnyere nkuzi mmekọrịta na ntuziaka doro anya, ebe ọ bụ na ndị a ga-eme ka ahụmịhe onye ọrụ dịkwuo mma ma gbaa ume itinye aka na-arụsi ọrụ ike. Ekwenyere m na mmelite dị mkpa maka ọganiihu nke ikpo okwu. Na-atụ anya ịnụ gị n'oge na-adịghị anya.",ibo,General Inquiry
"Nkwado maka Enhancing Data Analytics Tools [SEP] Achọrọ m enyemaka iji melite ngwaọrụ nyocha data maka njikarịcha ego ka mma. Karịsịa, enwere m mmasị iji Mini-Beamer, PyTorch, Keras, na Cassandra 4.0 iji mee mkpebi ndị ọzọ. M ga-enwe ekele dị ukwuu maka enyemaka ọ bụla ị nwere ike inye. Daalụ maka nkwado gị.",ibo,General Inquiry
"Ọrụ Nlekọta Ndị Ahịa edepụtala nsogbu na arụmọrụ sava n'oge awa kachasị elu, ebe ndị ọrụ chere oge ibu nwayọ nwayọ ihu. A na-enyo na nsogbu ahụ nwere ike ịbụ n'ihi ibu ọrụ nke sava. Ndị otu gbalịrị idozi nsogbu ahụ site na ịmegharị sava, nke nyere naanị enyemaka nwa oge. Achọrọ ngwọta na-adịgide adịgide iji dozie isi ihe kpatara ya. N'agbanyeghị mbọ iji chọpụta nsogbu dị n'okpuru, ihe kpatara ya ka na-agwụ ike. Enyemaka gị n'inyocha okwu a ga-enwe ekele dị ukwuu.",ibo,General Inquiry
"Nkwado ndị ahịa a hụrụ n'anya, anyị na-arịọ ngwa ngwa ka e mee ka usoro nchebe dịkwuo mma maka ijikwa data ahụike na usoro ụlọ ọgwụ anyị iji hụ na ha kwekọrọ na nchebe data.",ibo,General Inquiry
"Nkwado achọrọ maka Microsoft Dynamics 365 Integration [SEP] Ana m achọ nduzi banyere ijikọ Microsoft Dynamics 365 maka nyocha data na njikarịcha ego. Nwere ike ịnye usoro zuru ezu na omume kachasị mma maka njikọta a? M ga-enwe ekele maka ozi gbasara ngwaọrụ, ihe onwunwe, na akwụkwọ nwere ike inye aka nweta ebumnuche a. Na mgbakwunye, enwere echiche ma ọ bụ nsogbu akọwapụtara iji mara n'oge usoro njikọta? Ebumnuche m bụ iji leverage nchịkọta data iji mee ka mkpebi itinye ego mara ma melite arụmọrụ azụmahịa n'ozuzu ya. Daalụ maka oge gị na enyemaka gị. Ana m atụ anya nzaghachi gị.",ibo,General Inquiry
"Enhance Data Analytics Software for Investment [SEP] Chọọ enyemaka na njikarịcha nke data nchịkọta software iji melite ego azum gafee anyị ngwaahịa akara. Nke a ga-enyere aka na-eme ihe ọmụma mkpebi na mma arụmọrụ. Anyị ga-enwe ekele nduzi na otú iji ngwá ọrụ na software n'ụzọ dị irè, na-emeghe ka ndị ọzọ na-akwado ego nwere ike ịbụ dị.",ibo,General Inquiry
"Data Breach in Hospital Systems [SEP] Nkwado ndị ahịa na-akọ banyere ihe mgbapụta data nwere ike imetụta ọtụtụ sistemụ ụlọ ọgwụ. Ihe kpatara enyo nwere ike ịbụ patches nche ochie. Mgbalị iji dozie nsogbu ahụ gụnyere imelite Malwarebytes na Kaspersky, ịrụ nyocha malware, na nyochaa nhazi firewall. N'agbanyeghị usoro ndị a, nsogbu ahụ ka na-edozibeghị. Enyemaka na-eduzi nzọụkwụ ndị ọzọ iji dozie nsogbu a ga-enwe ekele. Biko nye ndụmọdụ banyere ihe ndị ọzọ iji kpuchido sistemụ ahụ. Onye ahịa ahụ nwere nchegbu banyere ihe egwu nwere ike ma na-achọ ibelata ha.",ibo,General Inquiry
"Nchegbu banyere nchekwa na API [SEP] Òtù anyị ezutewo mgbalị ịnweta usoro data ahụike na-enweghị ikike n'ihi API ndị ezighi ezi n'etiti Zapier na Xero. N'agbanyeghị imeziwanye ntọala firewall na ịme nyocha nche, anyị ka na-eche ihe egwu ihu. Anyị chọrọ enyemaka n'ịchekwa API ndị a iji gbochie mmebi n'ọdịnihu.",ibo,General Inquiry
"Nsogbu Server [SEP] Nsogbu na dashboards ọrụ. O nwere ike ịbụ n'ihi ihe nkesa ibu mgbe ọhụrụ mmelite, na-eduga na downtime. Server e rebooted, cache ọcha, na mmelite e reversed.",ibo,General Inquiry
"Nnyocha maka ikike nchebe netwọk [SEP] Ezigbo ndị ọrụ nkwado ndị ahịa,\n\nEnwere m obi ike na ozi a ruru gị nke ọma. Ana m arịọ n'ụzọ iwu kwadoro maka mgbanwe metụtara ịnweta, nhazi, na njikọta nke ngwaọrụ nchebe netwọk nke nzukọ anyị na-eji. Mgbanwe ndị a dị mkpa iji kwado ọrụ ntinye nke gụnyere nyocha dị elu, ụdị oge, na usoro ọrụ ntinye ego dabere na iwu nke emere maka usoro ego anyị.\n\nNrụ ọrụ anyị dị ugbu a na-enye atụmatụ nchekwa dị mkpa, mana ka ikike nyocha ego anyị na-emepewanye, ọ dị mkpa ka anyị mee ka usoro nchebe netwọk anyị sie ike.",ibo,General Inquiry
Nchedo nke nchekwa nchekwa ahụike [SEP] Ịdepụta arịrịọ maka usoro nchekwa ka mma iji chebe ozi ahụike n'ime akụrụngwa ụlọ ọgwụ ma hụ na echedo data nzuzo.,ibo,General Inquiry
"Nkwupụta ihe omume: Mmebi nchekwa data na nso nso a [SEP] Ezigbo nkwado ndị ahịa, ana m enyefe akụkọ ihe omume gbasara mmebi metụtara ndekọ ahụike nke onye na-ahụ maka ahụike ahụike echekwara n'ime sistemụ ụlọ ọgwụ, nke nwere ohere na-enweghị ikike. Ihe kpatara enyo bụ ihe ndị emebi emebi. Anyị gbalịrị imelite ngwanrọ ahụ ma mee nyocha malware, mana nsogbu ahụ ka dị. Anyị na-echegbu onwe anyị banyere nsonaazụ nwere ike ịpụta nke mmebi a ma rịọ enyemaka gị iji dozie nsogbu ahụ ngwa ngwa. Biko nye ndụmọdụ banyere nzọụkwụ ndị ọzọ iji chekwaa sistemụ anyị ma chebe ozi ndị ọrịa.",ibo,General Inquiry
Nchọpụta Ngwaahịa Teknụzụ [SEP] Ị nwere ike inye nkọwa banyere atụmatụ dijitalụ iji mee ka uto nke ika dịkwuo elu?,ibo,General Inquiry
Tsaro Tsaro Tsaro Tsaro Tsaro Tsaro Tsaro Tsaro Tsaro Tsaro Tsaro Tsaro Tsaro Tsaro Tsaro Tsaro Tsaro Tsaro Tsaro Tsaro Tsaro Tsaro Tsaro Tsaro Tsaro Tsaro Tsaro Tsaro Tsaro Tsaro Tsaro Tsaro Tsaro Tsaro Tsaro Tsaro Tsaro Tsaro Tsaro Tsaro Tsaro Tsaro Tsaro Tsaro Tsaro Tsaro Tsaro Tsaro Tsaro Tsaro Tsaro Tsaro Tsaro Tsaro Tsaro Tsaro Tsaro Tsaro Tsaro Tsaro Tsaro Tsaro Tsaro Tsaro Tsaro Tsaro Tsaro Tsaro Tsaro Tsaro Tsaro Tsaro Tsaro Tsaro Tsaro Tsaro Tsaro Tsaro Tsaro Tsaro Tsaro Tsaro Tsaro Tsaro Tsaro Tsaro Tsaro Tsaro Tsaro Tsaro Tsaro Tsaro Tsaro Tsaro Tsaro Tsaro Tsaro Tsaro Tsaro,hau,Human Resources
Gano Yunkurin Samun izini mara izini [SEP] An gano yunkurin samun damar izini mara izini a cikin hanyar sadarwar asibiti. Wannan na iya faruwa ne saboda tsoffin yarjejeniyoyin tsaro. Mun sabunta bayanan shiga kuma mun gudanar da binciken tsaro na asali. An bincika batun sosai don hana faruwa a nan gaba.,hau,Human Resources
"Tambaya game da Zaɓuɓɓukan Haɗuwa don IBM Cloud [SEP] Neman bayani game da zaɓuɓɓukan haɗin kai don gudanar da aikinmu SaaS akan IBM Cloud. Kuna iya ba da cikakkun bayanai game da zaɓuɓɓukan haɗin kai, APIs, webhooks, da haɗin haɗin da aka riga aka gina? Hakanan, da fatan za a raba duk wata takaddar jagora da za ta iya taimakawa a cikin tsarin haɗin kai.",hau,Human Resources
"Matsalar Monday.com Tools a ranar Litinin [SEP] Abokin ciniki Support,<br>Ajenar talla ta fuskanci matsalolin hadewa da Monday.com kayan aiki a ranar Litinin, wanda ya katse aiki da gudanar da aikin. Yana iya zama saboda kwanan nan software updates. Ya zuwa yanzu, mu troubleshooting kokarin sun hada da sake farawa aikace-aikace da kuma duba ga karfinsu updates, amma matsalolin har yanzu suna ci gaba.<br>Mun damu da cewa wannan zai iya shafar aikin deadlines da overall yi. Za mu yi matukar godiya idan za ka iya duba a cikin wannan al'amari gaggawa da kuma samar da wani bayani ko shiriya don warware matsalar.<br>Don Allah ka ba da shawara.",hau,Human Resources
"Sabuntawa ta kwanan nan ya haifar da gazawar hadewar samfurori da yawa [SEP] Bayyana matsala tare da hadewar samfurori da yawa, kamar iOS da Linux, wanda ba zato ba tsammani ya gaza bayan sabuntawar dandamali na kwanan nan. Dalilin da zai iya haifar da rikice-rikice da aka gabatar da sabuntawa ta kwanan nan.",hau,Human Resources
"Taimako Bincike don yiwuwar keta bayanai [SEP] Akwai yiwuwar keta bayanai a cikin tsarin mai ba da kiwon lafiya, wanda zai iya kasancewa saboda rashin damar samun damar da ba a ba da izini ba.",hau,Human Resources
"Ana buƙatar taimako tare da Dabarun Dijital [SEP] Kayan aikin dabarun dijital na kwanan nan sun hana mu aikinmu, wanda ya haifar da jinkiri a cikin ƙididdigar ci gaban alamarmu. Wannan matsalar na iya kasancewa saboda matsalolin dacewa da ke tasowa daga sabuntawar software na kwanan nan zuwa tsarinmu na yanzu. Mun riga mun gwada sake shigar da aikace-aikacen da tabbatar da jituwa da tsarin, amma waɗannan matakan ba su magance matsalar ba. Muna buƙatar taimakonku don magance wannan matsalar da kuma dawo da kamfen ɗinmu a hanya.",hau,Human Resources
Matsalar fasaha tare da Software na saka hannun jari [SEP] Akwai matsala a cikin software na inganta saka hannun jari,hau,Human Resources
"Taimako da ake buƙata tare da Kalubalen Tallace-tallace na Dijital [SEP] Abokan ciniki na abokin ciniki, Ina neman taimako tare da ayyukan tallanmu na dijital. Kamfanin tallanmu yana da wahalar haɓaka haɓakar alama ta hanyar dabarun dijital. Ko da bayan sabunta shirye-shiryen kamfen, inganta SEO, da haɓaka ƙoƙarin kafofin watsa labarun, ci gaba yana da iyakance. Matsalar na iya fitowa daga rashin bayyananniyar nazarin masu sauraro ko abubuwan da ba su dace ba. Mun gwada hanyoyi daban-daban, amma sakamakon ya ci gaba da zama mara gamsarwa. Ina godiya da shawararku da shawarwarinku don magance waɗannan batutuwan.",hau,Human Resources
"Neman Bayani akan Kayan Haɗin SaaS [SEP] Shin yana yiwuwa a haɗa SAP ERP, Salesforce CRM tare da maganin SaaS? Shin zaku iya ba da cikakkun bayanai game da APIs da ke akwai, jadawalin aiwatarwa, da duk wani bayani mai dacewa?",hau,Human Resources
Rails Tallafi don Gudanar da Kubernetes [SEP] Shin zaku iya ba da taimako don haɗa Ruby on Rails 6.1 scalable aikin gudanarwa SaaS a cikin yanayin Kubernetes? Ina buƙatar taimako tare da saitawa da daidaitawa.,hau,Human Resources
"Jagora kan Amfani da OBS Studio don Bayanan Bayanai na Zuba Jari [SEP] Ya ku goyon bayan abokin ciniki, Ina neman jagora kan yadda ake amfani da OBS Studio 27 don gabatar da bayanan saka hannun jari ta hanyar da ke da ban sha'awa da kuma bayani. Kuna iya sanar da ni game da fasali da kayan aikin da ke cikin software wanda zai taimaka mini ƙirƙirar irin waɗannan gabatarwa? Bugu da ƙari, zan yi godiya ga duk wata shawara ko ayyuka da za su iya taimaka mini in yi amfani da OBS Studio 27 yadda ya kamata don wannan dalili. Ina fatan samun jagororinku da duk albarkatun da zaku iya bayarwa. Na gode da lokacinku da taimakonku. Ina fatan jin ku nan da nan.",hau,Human Resources
"Inganta Tsaro don Bayanan Likitoci [SEP] Tallafin Abokin Ciniki, don tattaunawa kan hanyoyin kare bayanan likita a cikin kayan aikin asibiti. A halin yanzu yana amfani da SAP ERP da SQL Server don sarrafa bayanan marasa lafiya tare da bayanan masu mahimmanci. Bukatar cikakkun bayanai don tabbatar da sirrin, mutunci, da wadatar waɗannan bayanan. Suna damuwa game da yiwuwar keta tsaro kuma suna son ɗaukar matakan tsayayye don kare bayanan marasa lafiya. Musamman, suna sha'awar koyon hanyoyin ɓoyewa, sarrafawa, da tsarin dubawa.",hau,Human Resources
Neman Bayyanawa akan Dabarun Tallace-tallace na Dijital don Kayayyakin Wasanni [SEP] Shin zaku iya ba da ƙarin bayani game da dabarun dijital don tallata kayayyakin wasan? Na gode!,hau,Human Resources
"HDMI Cable Connection Troubles [SEP] Dear Abokin ciniki Support Team,\n\nIna neman taimako game da wani gaggawa da kuma ci gaba da matsala tare da na ASUS Xonar AE sound card. Kwanan nan, na'urar ba zato ba tsammani daina watsa audio via da HDMI tashar. Ina zargin matsalar iya zama alaka da Belkin Ultra HD High-Speed HDMI cable a cikin amfani, kamar yadda matsalar ta taso ba tare da wani a bayyane canje-canje a saitin ko software.\n\nA matsayin mataki na farko, na tabbatar da cewa da HDMI na USB da aka haɗa yadda ya kamata don tabbatar da dace lamba.",hau,Human Resources
Matsalar da ke tattare da jinkirin sarrafa lissafin albashi [SEP] An yi korafi game da jinkirin sarrafa lissafin albashi. Wataƙila matsalar tsarin ta kasance sanadin. Mun sake nazarin software da bayanan ma'aikata amma har yanzu ba mu sami mafita ba.,hau,Human Resources
Tallafi da ake buƙata don Ayyukan Nazarin Bayanai [SEP] Shin kuna son ƙarin sani game da ayyukan nazarin bayananmu?,hau,Human Resources
"Tambaya Game da Tsaron Tsaron Bayanai na Likita [SEP] Akwai wani lamari da ya shafi yiwuwar samun damar shiga ba tare da izini ba zuwa tsarin bayanan likitancinmu. Wannan mai yiwuwa saboda rashin ingantattun yarjejeniyoyin tsaro da raunin software. Mun sabunta software kuma mun sake nazarin bayanan shiga, gano wasu rashin daidaito. Muna buƙatar taimakonku don ƙarin bincike da haɓaka matakanmu na tsaro.",hau,Human Resources
"Sha'awar Software na Nazarin Bayanai [SEP] Wani ma'aikaci ya ba da rahoton matsaloli tare da software na nazarin bayanai, wanda ke haifar da jinkiri a inganta saka hannun jari. Matsalar na iya tasowa saboda sabuntawar tsarin kwanan nan.",hau,Human Resources
"Kamfanin Kasuwanci ya fuskanci kalubale na hadewa da bayanan saka hannun jari [SEP] Kamfanin kudi ya fuskanci matsaloli wajen hada bayanai a cikin samfurori da yawa, wanda ya shafi nazarin bayanan saka hannun jari. Dalilin da aka gano shine rikice-rikice tsakanin sigar software.",hau,Human Resources
Taimako tare da Crash na Data Analytics Tool [SEP] Kayan aikin nazarin bayanai ya sami matsala yayin nazarin saka hannun jari saboda sabuntawar software mara jituwa.,hau,Human Resources
"Tallafin Abokan Ciniki na Human Resources [SEP] Taimakon Abokin Ciniki ya ba da rahoton wani abin da ya faru da ya shafi jerin gwano na HR wanda ya shafi dandamali na SaaS. Dalilin da ake zargin shine yiwuwar yawan sabar saboda kuskuren sanyi. Matakai na gyara matsala sun haɗa da sake farawa da sabis, sake duba rajista, da haɓaka albarkatu. Duk da waɗannan ƙoƙarin, matsalar ba a warware ta ba kuma tana buƙatar ƙarin taimako. Da fatan za a sake nazarin halin da ake ciki kuma bayar da mafita a farkon lokacin da ya dace. Bugu da ƙari, za a yaba da jagora kan hana irin waɗannan abubuwan a nan gaba. Da fatan za a sanar da mu.",hau,Human Resources
