combined,language,queue
"Security Operations Center DevSecOps Surveillance Notification Issue [SEP] Dear Support Team,\n\nWe are currently facing a persistent problem involving the SOC DevSecOps surveillance of Ubuntu 20.04 systems used in IoT medical devices. It seems that potential network sensor misconfigurations may have caused a series of continuous alerts. We have already rebooted the associated services and examined the SOC dashboard; however, the issues continue. Kindly assist us in diagnosing and resolving this problem promptly to ensure the seamless operation of device monitoring.\n\nWe appreciate your quick support.\n\nBest regards,\n[Your Name]",en,Human Resources
"Detection of Unauthorized Access Attempt [SEP] An unauthorized access attempt was detected on the hospital's network. This may have occurred due to outdated security protocols. We have updated access credentials and conducted a basic security audit. The issue has been thoroughly investigated to prevent future occurrences. Our team is working diligently to ensure the security of the network. Please stay updated on the developments. If you have any questions or concerns regarding this matter, please let us know.",en,Human Resources
"Inquiry on Integration Options for IBM Cloud [SEP] Seeking information on integration options available for our project management SaaS on IBM Cloud. Could you provide details on available integration options, APIs, webhooks, and pre-built connectors? Also, please share any documentation guides that could assist in the integration process.",en,Human Resources
"Problem with Monday.com Tools on Monday [SEP] Customer Support,<br>The marketing agency encountered integration difficulties with Monday.com tools on Monday, which has disrupted the workflow and project management. It may be due to recent software updates. So far, our troubleshooting efforts have included restarting applications and checking for compatibility updates, but the issues still persist.<br>We are concerned as this may affect project deadlines and overall performance. We would greatly appreciate it if you could look into this matter urgently and provide a solution or guidance to resolve the issue.<br>Please",en,Human Resources
"Recent Update Caused Multiple Product Integration Failures [SEP] Reporting a problem with multiple product integrations, such as iOS and Linux, which unexpectedly failed after the recent platform update. The likely cause appears to be conflicts introduced by the latest update. Troubleshooting efforts including system restarts and patch verifications have not resolved the issue. We would appreciate prompt assistance to resolve this matter. Please advise on the necessary steps to address the problem.",en,Human Resources
"Support Inquiry for Possible Data Breach [SEP] There appears to be a potential data breach in the healthcare provider's system, which may be due to an unauthorized access vulnerability.",en,Human Resources
"Required Assistance with Digital Strategy [SEP] Our recent campaign has been hampered by digital strategy tools that have malfunctioned, resulting in delays in our brand growth metrics. This issue might be due to compatibility problems arising from recent software updates to our existing systems. We have already tried reinstalling the applications and verifying system compatibility, but these steps did not resolve the problem. We require your assistance to resolve this issue and get our campaign back on track.",en,Human Resources
Technical Issue with Investment Software [SEP] There was a crash in the investment optimization software,en,Human Resources
"Assistance Needed with Digital Marketing Challenges [SEP] Dear Customer Support, I am seeking help with our digital marketing initiatives. Our marketing agency is having difficulty boosting brand growth through digital strategies. Even after updating campaign plans, improving SEO, and ramping up social media efforts, progress remains limited. The issue might stem from unclear target audience analysis or inconsistent content. We have tried various methods, but the results continue to be unsatisfactory. I would be grateful for your advice and recommendations to address these issues.",en,Human Resources
"Request for Information on SaaS Integration Capabilities [SEP] Is it possible to integrate SAP ERP, Salesforce CRM with a SaaS solution? Could you provide details on the available APIs, implementation timelines, and any other relevant information?",en,Human Resources
Rails Support for Kubernetes Deployment [SEP] Can you offer assistance with integrating a Ruby on Rails 6.1 scalable project management SaaS within a Kubernetes environment? I require help with deployment setup and configuration.,en,Human Resources
"Guidance on Using OBS Studio for Investment Data Presentations [SEP] Dear customer support, I am seeking guidance on how to utilize OBS Studio 27 for presenting investment data in a way that is both engaging and informative. Could you please inform me about the features and tools available in the software that would help me create such presentations? Additionally, I would be grateful for any tips or practices that could help me use OBS Studio 27 effectively for this purpose. I am looking forward to your guidance and any resources you can provide. Thank you for your time and assistance. I look forward to hearing back soon.",en,Human Resources
"Enhancing Security for Medical Data in Hospitals [SEP] Customer Support, reaching out to discuss methods for securing medical data within hospital infrastructure. Currently using SAP ERP and SQL Server to manage patient records with sensitive information. Need details to ensure the confidentiality, integrity, and availability of this data. Concerned about potential security breaches and want to take proactive measures to protect patients' information. Specifically, interested in learning about encryption methods, access controls, and auditing processes.",en,Human Resources
Request for Clarification on Digital Promotion Strategies for Gaming Products [SEP] Could you provide more details on digital strategies to promote gaming products? Thank you!,en,Human Resources
"HDMI Cable Connection Troubles [SEP] Dear Customer Support Team,\n\nI am reaching out for help concerning an abrupt and ongoing issue with my ASUS Xonar AE sound card. Recently, the device suddenly ceased transmitting audio via the HDMI port. I suspect the problem may be related to the Belkin Ultra HD High-Speed HDMI cable in use, as the issue arose without any noticeable changes to the setup or software.\n\nAs an initial step, I verified that the HDMI cable was properly connected to ensure proper contact.",en,Human Resources
Problem with Delayed Payroll Processing [SEP] There have been complaints about payroll processing delays. A system glitch might be the cause. We have reviewed the software and employee data but have not found a solution yet.,en,Human Resources
Support Required for Data Analytics Services [SEP] Would you like to know more about our data analytics services?,en,Human Resources
"Query Regarding Medical Data Security Incident [SEP] There was an incident involving potential unauthorized access to our medical data systems. This is likely due to inadequate security protocols and software vulnerabilities. We have updated the software and reviewed access logs, identifying some anomalies. We need your assistance to further investigate and enhance our security measures.",en,Human Resources
"Concerns with Data Analytics Software [SEP] An employee has reported issues with the data analytics software, which is causing delays in investment optimization. The problem might have arisen due to recent system updates. The team has already restarted the software and checked for updates, but the issue still persists. We would greatly appreciate your assistance in resolving this matter as soon as possible to minimize delays.",en,Human Resources
"Financial Corporation Encounters Integration Challenges with Investment Data [SEP] A financial corporation faced difficulties integrating data across multiple products, impacting their investment data analysis. The probable cause identified was conflicts between software versions. Efforts to resolve the problem involved rebooting systems and updating essential applications.",en,Human Resources
Assistance with Crash of Data Analytics Tool [SEP] The data analytics tool encountered a crash during investment analysis due to incompatible software updates.,en,Human Resources
"Human Resources Concern [SEP] Customer Support reports an incident affecting the HR queue impacting the SaaS platform. The suspected cause is a potential server overload due to a configuration mistake. Troubleshooting steps included restarting services, reviewing logs, and scaling resources. Despite these efforts, the problem remains unresolved and requires further assistance. Kindly review the situation and offer a solution at your earliest convenience. Additionally, guidance on preventing similar incidents in the future would be appreciated. Please keep us informed.",en,Human Resources
"Digital Strategies Completely Unsuccessful [SEP] The digital strategies employed by the marketing agency did not succeed in enhancing brand growth, likely due to ineffective targeting. Efforts such as campaign modifications were made, yet results remain unchanged. Despite these efforts, the brand's online visibility has improved somewhat, but engagement metrics continue to be low. It is crucial to re-evaluate the targeting methods and consider alternative strategies to reach the intended audience. A thorough analysis of the campaign's performance and a revised action plan are necessary to achieve the desired results.",en,Human Resources
"Assistance with Marketing Support [SEP] Marketing digital initiatives have been hindered by software compatibility issues and team collaboration challenges. These problems may stem from outdated tools and differing operating systems. Updates have been attempted, as well as team training.",en,Human Resources
"Urgent Update Needed for Digital Marketing Plans [SEP] Dear Customer Support, I am writing to request an update on the digital marketing strategies, as they impact multiple products. Our objective is to boost brand visibility and increase customer engagement. Currently, the strategies are not delivering the expected results, so a reassessment of our approach is necessary. I would like to arrange a meeting with the marketing team to discuss possible adjustments and the implementation of new tactics. These could include social media campaigns, email marketing, and search engine optimization. I believe that with the right strategy, we can achieve our goals.",en,Human Resources
Rails and Kubernetes Integration Assistance [SEP] Can you offer guidance on integrating a Ruby on Rails 6.1-based scalable project management SaaS with Kubernetes? I require support with deployment setup and configuration.,en,Human Resources
"HR-Related Concern [SEP] Customer Support is documenting an incident report related to the HR queue impacting the SaaS platform. The problem is believed to be caused by a server overload due to a configuration mistake. Troubleshooting steps included restarting services, reviewing logs, and increasing resources. Despite these efforts, the problem continues, and assistance is needed to resolve it. Kindly look into this matter and offer a solution at your earliest convenience. Your guidance to prevent similar incidents in the future would be appreciated. Please inform us of any updates.",en,Human Resources
"Support Request for Data Security Incident [SEP] An incident involving data security has affected the hospital's systems, likely due to outdated software vulnerabilities. Despite updating security settings and scanning for breaches, the issues continue. Assistance in resolving this matter is needed.",en,Human Resources
"Enquiry About Customization Options for SaaS Project Management Features [SEP] Could you furnish details on the customization options for SaaS project management features? I am keen to learn about a platform that can be tailored to meet specific requirements. Please provide information on the available features, limitations, and any constraints.",en,Human Resources
"Concern About Data Breach in Hospital Systems [SEP] A data breach has been identified in the hospital's systems, which could expose medical records. This issue might be due to obsolete security protocols and insufficient staff oversight. It is recommended to update software, provide staff training, and enhance data protection to ensure security.",en,Human Resources
"Concern Regarding Monday.com Integration Issues [SEP] Customer Support, <br>Our marketing agency encountered integration problems with Monday.com tools on Monday, which impacted workflow and project management. It might be related to recent software updates. Despite our troubleshooting, such as restarting applications and verifying compatibility updates, the issues persist. <br>We are concerned as this may affect project deadlines and overall performance. We would greatly appreciate it if you could look into this matter urgently and provide a solution or guidance to resolve the issue. <br>Please",en,Human Resources
Concern about Data Analytics Tool [SEP] The data analytics tool is generating inconsistent results. Recent software updates might be causing data input errors. Efforts to revert to previous versions and validate input data were unsuccessful.,en,Human Resources
Potential Data Breach in Healthcare System [SEP] There is a potential data breach detected in the healthcare system. Unauthorized access may have occurred due to outdated security protocols. An initial audit has been conducted and software has been updated.,en,Human Resources
Data Analytics Problem Leads to Setbacks in Investment Optimization [SEP] An issue with data analytics resulted in delays in the investment optimization procedures.,en,Human Resources
"Unauthorized Intrusion into Hospital Networks [SEP] We have encountered multiple unauthorized intrusion attempts into our hospital networks, potentially due to insufficient credential security policies. We are addressing this issue by resetting user passwords, enhancing system monitoring, and taking it very seriously to prevent further incidents. We will continue to observe the situation and implement additional security measures as necessary. Protecting patient data remains our highest priority. Please keep us informed of any new developments.",en,Human Resources
"Employee facing connectivity problems with WhatsApp Desktop on Acer Predator XB273K Monitor [SEP] Apologies for the connectivity issues with WhatsApp Desktop on your Acer Predator XB273K Monitor. Could you please provide more details, any error messages, and the troubleshooting steps you have already taken? I would like to schedule a call at <tel_num> for your convenience to assist with this matter.",en,Human Resources
"Assistance Required for ActiveCampaign and Squarespace Integration [SEP] Dear Customer Support, I am seeking guidance on integrating ActiveCampaign with Squarespace to optimize my marketing automation workflows. I am attempting to set up the integration but am encountering difficulties in getting it to function properly. Could you please provide detailed, step-by-step instructions or direct me to helpful resources to complete the integration? Additionally, I would appreciate any best practices or tips for effectively using ActiveCampaign with Squarespace to create efficient marketing automation processes. Thank you for your time and assistance. I look forward to your response.",en,Human Resources
"Financial Organization Encounters Integration Challenges with Investment Data [SEP] The financial organization faced difficulties integrating data across different products, impacting investment data analysis. Potential reason identified: software version mismatches. Efforts to resolve included system restarts and updating essential applications.",en,Human Resources
"Clarification on AR Brille Integration Compatibility [SEP] Hi Customer Support, I'm writing to inquire about the compatibility of the AR-Brille project management software with other systems. Could you provide detailed information on how these systems can work together seamlessly? I am particularly interested in understanding the technical requirements as well as any potential limitations. Additionally, I would appreciate any documentation or resources that could help me better understand the integration process. I am looking forward to your response as we explore how AR-Brille can enhance our project management capabilities. Thank you for your time and assistance. I am excited to learn more about this innovative solution.",en,Human Resources
"Integration with Docker [SEP] Customer Support, interested in understanding how Docker is integrated into the SaaS project management platform. Could you provide detailed information on how Docker is used within the platform? This would be greatly appreciated, especially regarding the benefits it brings, such as improved deployment efficiency and enhanced collaboration. Additionally, could you share specific requirements or recommendations for using Docker with the platform? Thank you for your time and assistance. I look forward to hearing back soon.",en,Human Resources
Discrepancies in Investment Data Analysis [SEP] A financial organization encountered irregularities in their investment data analysis outcomes. The preliminary steps to resolve this involved updating the software and restarting the system.,en,Human Resources
"Assistance with Medical Data Security Protocols [SEP] Customer Support is reaching out to inquire about best practices for safeguarding medical information within hospital systems on WhatsApp Desktop. As you may be aware, medical data is extremely sensitive and demands careful management concerning its storage and security. We would be grateful for guidance on how to maintain confidentiality, integrity, and availability of this data. Specifically, we are interested in understanding the encryption techniques, access restrictions, and data backup strategies in place to protect medical information. Furthermore, we would like to discuss...",en,Human Resources
Problem with Investment Data Analysis [SEP] A financial organization encountered disruptions impacting the analysis of investment data across several products. The potential reason identified is integration conflicts. The initial steps taken included restarting the impacted software and verifying connectivity to cloud services. Further investigation is ongoing.,en,Human Resources
Potential Data Compromise [SEP] A potential data compromise has been detected in the hospital's systems.,en,Human Resources
"Incident Report: Exposure of Healthcare Provider Data [SEP] Customer Support,<br><br>We are notifying you of a potential data exposure incident impacting the hospital's systems. The issue appears to be linked to misconfigured network settings, which may have permitted unauthorized access to sensitive information.<br><br>Our preliminary audit involved adjusting firewall configurations, which has fully resolved the problem. We seek your assistance to verify that security measures are properly in place. We would appreciate your guidance and support to help us resolve this matter promptly.",en,Human Resources
"Issue with Access to SaaS Functionality Reported [SEP] There has been a sudden failure in accessing critical SaaS functionalities, which might be due to a server overload configuration issue. An attempt was made to restart the affected applications.",en,Human Resources
Alert on Security Incident [SEP] Noted unauthorized access attempts occurred,en,Human Resources
Issue with Team Meeting Scheduling Conflict Today [SEP] There is an internal scheduling conflict due to poor management practices.,en,Human Resources
"Recent Update Causes Failure in Multiple Product Integrations [SEP] Reporting an issue where several product integrations, such as iOS and Linux, have unexpectedly failed after the recent platform update. The probable cause appears to be conflicts introduced by the latest update. Troubleshooting efforts, including system restarts and patch verifications, have not resolved the problem. We would appreciate prompt assistance in resolving this matter. Please advise on the necessary steps to address the issue.",en,Human Resources
Report of Security Incident Submitted [SEP] A security incident has been detected and is impacting the integrity of medical data.,en,Human Resources
"Request for Insights on Digital Strategies to Enhance Brand Growth [SEP] Dear Customer Support, I am inquiring about digital strategies to enhance brand growth. Specifically, I am interested in learning how to utilize Squarespace and Slack to achieve our goals. Could you provide guidance on how to leverage these tools to increase our brand's visibility and engagement? I would appreciate any tips or recommendations you can offer. Additionally, I am keen to know how the integration of Squarespace and Slack can work together to support brand growth. Thank you for your time and assistance. I look forward to hearing from you.",en,General Inquiry
"Problem with Digital Engagement [SEP] Facing an unexpected decline in digital engagement metrics which is affecting our brand growth strategies. The recent modifications to digital ad algorithms might be the cause. After making adjustments to ad targeting and revising the content, there was some improvement. I need help in resolving this issue.",en,General Inquiry
"Healthcare Data Concern [SEP] Encountered a possible data security risk within hospital systems due to outdated software and weak access controls. Upgraded the software, strengthened password protocols, and conducted basic security scans, which yielded limited insights.",en,General Inquiry
Problem with Investment Data Analysis Tools [SEP] An issue has arisen with the investment data analysis tools. Recent software updates and configuration changes might be the cause. We have restarted the affected systems and checked for updates.,en,General Inquiry
"Concerns About Digital Engagement Metrics [SEP] Customer Support,\n\nOur marketing agency has observed a notable decrease in digital engagement metrics across various platforms. This decline could be attributed to recent strategy adjustments or potential technical issues with the tools we use. We have already reviewed our content strategies and checked our tool integrations, implementing immediate solutions. However, the decline in engagement has been consistent over the past few weeks, which we are concerned might affect our overall marketing performance.\n\nWe would appreciate your assistance in identifying the root cause of this issue.",en,General Inquiry
Enhance Data Analytics Performance [SEP] Improve data analytics to optimize investment strategies.,en,General Inquiry
"Server Challenges [SEP] Facing problems with project dashboards. Suspect server overload due to a recent update, leading to downtime. Already restarted the server, cleared the cache, and reverted the update.",en,General Inquiry
Investment Optimization Model Problem Detected [SEP] The investment optimization model is producing suboptimal suggestions because of outdated data inputs. Refreshing the datasets should resolve the issue.,en,General Inquiry
Properly Safeguarding Medical Data [SEP] Seeking details on securing medical data with Surface Pro and SQL Server integration.,en,General Inquiry
Request for Updating Product Integration Options [SEP] I am writing to request an update on the integration options for our products. We aim to enhance compatibility with existing SaaS tools to improve project management and streamline our workflow. We would greatly appreciate it if you could look into this matter and provide a solution as soon as possible. Thank you for your time and assistance.,en,General Inquiry
"Concern About Irregular Outcomes in Investment Optimization Tool [SEP] Hello Customer Support, I have been encountering inconsistent outcomes with the investment optimization analytics tool. The issue might be due to recent changes in the data sources. After attempting to refresh the data sources and recalibrate the analytics model, the problem still persists. I have also checked for software updates and ensured that the system meets all necessary requirements. However, the inconsistent outcomes continue to impact my ability to make informed investment decisions. Could you please assist in resolving this issue?",en,General Inquiry
"Server Performance Concern [SEP] Customer Support reports an issue with server performance during peak hours. Users encountered occasional slow loading times, likely due to server overload. The team attempted to reboot the servers, which offered only temporary relief. A long-term solution requires identifying the root cause of the problem. Efforts to pinpoint the exact issue have so far been unsuccessful. Your assistance in examining this matter would be highly appreciated.",en,General Inquiry
"Concerns with Digital Engagement Metrics [SEP] Customer Support,\n\nOur marketing agency has observed a notable decline in digital engagement metrics across various platforms. The decrease might be due to recent strategy changes or technical issues with the tools we use. We have already reviewed our content strategies and checked our tool integrations, implementing immediate solutions. The decline in engagement has been consistent over the past few weeks and we are concerned it may impact our overall marketing performance.\n\nWe would appreciate your assistance in identifying the cause of this decline.",en,General Inquiry
