combined,language,queue
"Enyemaka Achọrọ na Digital Marketing Challenges [SEP] Ezigbo Nkwado Ndị Ahịa, ana m achọ enyemaka na atụmatụ ahịa dijitalụ anyị. Ụlọ ọrụ ahịa anyị na-enwe nsogbu ịkwalite uto nke ika site na atụmatụ dijitalụ. Ọbụna mgbe emelitere atụmatụ mkpọsa, melite SEO, ma gbasaa mbọ mgbasa ozi mmekọrịta, ọganihu ka dị oke. Ihe ịma aka ahụ nwere ike isi na nyocha ndị na-ege ntị na-edochaghị anya ma ọ bụ ọdịnaya na-ekwekọghị ekwekọ. Anyị anwalela ụzọ dị iche iche, mana nsonaazụ ya ka na-enweghị isi. M ga-enwe ekele maka ndụmọdụ na ndụmọdụ gị iji dozie nsogbu ndị a.",ibo,Human Resources
"Arịrịọ maka Ozi na SaaS Integration Capabilities [SEP] Ọ ga-ekwe omume ijikọ SAP ERP, Salesforce CRM na ngwọta SaaS? ị nwere ike inye nkọwa gbasara API dịnụ, usoro mmejuputa oge, na ozi ọ bụla ọzọ dị mkpa?",ibo,Human Resources
Rails Nkwado maka Kubernetes Ntinye [SEP] Nwere ike ịnye enyemaka na ijikọta a Ruby on Rails 6.1 scalable oru ngo management SaaS n'ime a Kubernetes gburugburu ebe obibi? M mkpa enyemaka na deployment ntọlite na nhazi.,ibo,Human Resources
"Nduzi banyere iji OBS Studio maka Nkwupụta Data Ntinye ego [SEP] Ezigbo nkwado ndị ahịa, ana m achọ nduzi banyere otu esi eji OBS Studio 27 maka ịnye data itinye ego n'ụzọ na-adọrọ mmasị ma na-enye ihe ọmụma. Biko ị nwere ike ịgwa m banyere atụmatụ na ngwaọrụ dị na ngwanrọ ahụ nke ga-enyere m aka ịmepụta ihe ngosi dị otú ahụ? Na mgbakwunye, m ga-enwe ekele maka ndụmọdụ ọ bụla ma ọ bụ omume ọ bụla nwere ike inyere m aka iji OBS Studio 27 rụọ ọrụ nke ọma maka nzube a. Ana m atụ anya nduzi gị na ihe ọ bụla ị nwere ike inye. Daalụ maka oge gị na enyemaka gị. Ana m atụ anya ịnụ gị n'oge na-adịghị anya.",ibo,Human Resources
"Imekwu nchebe maka data ahụike n'ụlọ ọgwụ [SEP] Nkwado ndị ahịa, na-agakwuru iji tụlee ụzọ maka ịchekwa data ahụike n'ime akụrụngwa ụlọ ọgwụ. Ugbu a na-eji SAP ERP na SQL Server iji jikwaa ndekọ ndị ọrịa na ozi dị nro. Achọrọ nkọwa iji hụ na nzuzo, iguzosi ike n'ezi ihe, na nnweta nke data a. Nchegbu banyere mmebi nchekwa nwere ike ime ma chọọ ịme ihe proactive iji kpuchido ozi ndị ọrịa. Karịsịa, ndị nwere mmasị ịmụ banyere usoro nzuzo, njikwa ohere, na usoro nyocha.",ibo,Human Resources
Arịrịọ maka nkọwa banyere Usoro Nkwalite Digital maka Ngwaahịa Egwuregwu [SEP] Nwere ike ịnye nkọwa ndị ọzọ banyere usoro dijitalụ iji kwalite ngwaahịa egwuregwu? Daalụ!,ibo,Human Resources
"HDMI Cable Connection Troubles [SEP] Ezigbo ndị ọrụ nkwado ndị ahịa,\n\nAna m achọ enyemaka banyere nsogbu mberede na na-aga n'ihu na kaadị ụda ASUS Xonar AE m. N'oge na-adịbeghị anya, ngwaọrụ ahụ kwụsịrị na mberede izipu ọdịyo site na ọdụ ụgbọ mmiri HDMI. Echere m na nsogbu ahụ nwere ike ịbụ nke metụtara eriri Belkin Ultra HD High-Speed HDMI na-eji, ebe nsogbu ahụ bilitere n'enweghị mgbanwe ọ bụla a na-ahụ anya na nhazi ma ọ bụ ngwanrọ.\n\nDị ka nzọụkwụ mbụ, m nyochara na eriri HDMI jikọtara nke ọma iji hụ na kọntaktị kwesịrị ekwesị.",ibo,Human Resources
Nsogbu na Delayed Payroll Processing [SEP] E nweela mkpesa banyere igbu oge nhazi ụgwọ ọrụ. Nsogbu usoro nwere ike ịbụ ihe kpatara ya. Anyị enyochaala ngwanrọ na data ndị ọrụ mana anyị ahụbeghị ngwọta.,ibo,Human Resources
Nkwado achọrọ maka Ọrụ Nchịkọta Data [SEP] Ị ga-achọ ịmatakwu banyere ọrụ nyocha data anyị?,ibo,Human Resources
"Ajụjụ Banyere Ihe Omume Nchedo Data Ahụike [SEP] Enwere ihe omume metụtara ohere ịnweta usoro data ahụike anyị. Nke a nwere ike ịbụ n'ihi usoro nchekwa na-ezughị ezu na nrụrụ ngwanrọ. Anyị emelitere ngwanrọ ahụ ma nyochaa ndekọ nnweta, na-achọpụta ụfọdụ anomalies. Anyị chọrọ enyemaka gị iji nyochaa ma melite usoro nchebe anyị.",ibo,Human Resources
"Nchegbu na Data Analytics Software [SEP] Otu onye ọrụ kọrọ nsogbu na data nchịkọta software, nke na-akpata igbu oge na ego njikarịcha. The nsogbu nwere ike ibilite n'ihi na nso nso usoro mmelite. The otu esesịn rebooted software na-elele maka mmelite, ma nsogbu ka na-adịgide adịgide. Anyị ga-enwe ekele dị ukwuu maka enyemaka gị na-edozi nke a okwu ngwa ngwa o kwere omume iji belata igbu oge.",ibo,Human Resources
"Ụlọ ọrụ ego na-ezute nsogbu nke ijikọta na data itinye ego [SEP] Ụlọ ọrụ ego na-eche nsogbu ihu na ijikọta data n'ofe ọtụtụ ngwaahịa, na-emetụta nyocha data itinye ego ha. Ihe kpatara kpatara ya bụ esemokwu dị n'etiti nsụgharị ngwanrọ. Mgbalị iji dozie nsogbu ahụ gụnyere ịghachite usoro na imelite ngwa ndị dị mkpa.",ibo,Human Resources
Enyemaka na Crash nke Data Analytics Ngwá Ọrụ [SEP] Ngwá ọrụ nyocha data zutere mkpọka n'oge nyocha ego n'ihi mmelite ngwanrọ na-ekwekọghị ekwekọ.,ibo,Human Resources
"Human Resources Concern [SEP] Nkwado ndị ahịa na-akọ banyere ihe merenụ nke metụtara ahịrị HR nke na-emetụta usoro SaaS. Ihe kpatara enyo bụ ibu ọrụ ihe nkesa nwere ike ibu n'ihi njehie nhazi. Nzọụkwụ idozi nsogbu gụnyere ịmaliteghachi ọrụ, nyochaa ndekọ, na ịba ụba ihe onwunwe. N'agbanyeghị mbọ ndị a, nsogbu ahụ ka na-edozibeghị ma chọọ enyemaka ọzọ. Biko nyochaa ọnọdụ ahụ ma nye azịza ya na ngwa ngwa ị nwere ike. Na mgbakwunye, a ga-enwe ekele maka nduzi banyere igbochi ihe ndị yiri ya n'ọdịnihu. Biko mee ka anyị mara.",ibo,Human Resources
"Usoro dijitalụ n'ụzọ zuru ezu na-enweghị ihe ịga nke ọma [SEP] Usoro dijitalụ nke ụlọ ọrụ ahịa ji mee ihe enweghị ike ịkwalite uto nke ika, ikekwe n'ihi ebumnuche na-adịghị mma. Emere mgbalị dịka mgbanwe mkpọsa, ma nsonaazụ ya ka na-agbanwe agbanwe. N'agbanyeghị mbọ ndị a, ọhụụ nke ika ahụ dị n'ịntanetị ka mma, mana ọnụọgụ njikọ aka na-aga n'ihu dị ala. Ọ dị oke mkpa iji nyochaa usoro iche iche na ịtụle usoro ndị ọzọ iji ruo ndị na-ege ntị. Ọ dị mkpa iji nyochaa arụmọrụ mkpọsa ahụ nke ọma na atụmatụ ọrụ a gbanwere iji nweta nsonaazụ a chọrọ.",ibo,Human Resources
"Enyemaka na Nkwado Ahịa [SEP] Ejirila nsogbu ngwanrọ na nsogbu ndị metụtara mmekọrịta ndị otu gbochie mmemme dijitalụ ahịa. Nsogbu ndị a nwere ike isi na ngwaọrụ ndị emebi emebi na sistemụ arụmọrụ dị iche iche pụta. A nwalere mmelite, yana ọzụzụ otu.",ibo,Human Resources
"Akụkọ dị mkpa maka atụmatụ ahịa dijitalụ [SEP] Ezigbo nkwado ndị ahịa, m na-ede iji rịọ maka mmelite na atụmatụ ahịa dijitalụ, ebe ọ bụ na ha na-emetụta ọtụtụ ngwaahịa. Ebumnuche anyị bụ ịkwalite ọhụụ nke ika na ịbawanye njikọ ndị ahịa. Ugbu a, atụmatụ ndị ahụ anaghị enye nsonaazụ a tụrụ anya ya, yabụ nyocha nke ụzọ anyị dị mkpa. Achọrọ m ịhazi nzukọ na ndị ahịa ahịa iji kwurịta mgbanwe ndị enwere ike ime na itinye n'ọrụ usoro ọhụrụ. Ndị a nwere ike ịgụnye mgbasa ozi mgbasa ozi mmekọrịta, ahịa email, na njikarịcha njin ọchụchọ. Ekwenyere m na site na atụmatụ ziri ezi, anyị nwere ike iru ebumnuche anyị.",ibo,Human Resources
Rails na Kubernetes Integration Assistance [SEP] Ị nwere ike inye nduzi banyere ijikọ a Ruby on Rails 6.1 dabeere scalable oru ngo management SaaS na Kubernetes? M mkpa nkwado na deployment ntọlite na nhazi.,ibo,Human Resources
"Nchegbu metụtara HR [SEP] Nkwado ndị ahịa na-edekọ akụkọ ihe mere eme metụtara ahịrị HR nke na-emetụta usoro SaaS. A na-eche na nsogbu ahụ bụ ihe nrụgide nke ihe nkesa n'ihi njehie nhazi. Nzọụkwụ idozi nsogbu gụnyere ịmaliteghachi ọrụ, nyochaa ndekọ, na ịba ụba ihe onwunwe. N'agbanyeghị mbọ ndị a, nsogbu ahụ na-aga n'ihu, enyemaka dịkwa mkpa iji dozie ya. Biko lelee okwu a ma nye azịza ya na ngwa ngwa ị nwere ike. A ga-enwe ekele maka nduzi gị iji gbochie ihe ndị yiri ya n'ọdịnihu. Biko gwa anyị maka mmelite ọ bụla.",ibo,Human Resources
"Nkwado arịrịọ maka ihe mberede nchekwa data [SEP] Ihe mberede metụtara nchekwa data emetụtala sistemụ ụlọ ọgwụ, ikekwe n'ihi adịghị ike ngwanrọ emebi emebi. N'agbanyeghị mmelite ntọala nchekwa na nyocha maka mmebi, nsogbu ahụ na-aga n'ihu. Enyemaka dị mkpa iji dozie okwu a.",ibo,Human Resources
"Ajụjụ Banyere Nhọrọ Nhazi maka atụmatụ SaaS Project Management [SEP] Nwere ike ịnye nkọwa gbasara nhọrọ nhazi maka atụmatụ SaaS ọrụ njikwa? Achọrọ m ịmatakwu banyere ikpo okwu nke nwere ike ịhazi iji gboo ihe ndị achọrọ. Biko nye ozi gbasara atụmatụ dịnụ, mmachi, na mgbochi ọ bụla.",ibo,Human Resources
"Nchegbu Banyere Nkwụsị Data na Sistemụ Ụlọ Ọgwụ [SEP] A chọpụtawo nkwụsị data na sistemụ ụlọ ọgwụ, nke nwere ike ikpughe ndekọ ahụike. Nsogbu a nwere ike ịbụ n'ihi usoro nchekwa emebi emebi na nlekọta ndị ọrụ na-ezughị ezu. A na-atụ aro ka emelite ngwanrọ, nye ọzụzụ ndị ọrụ, ma melite nchedo data iji hụ na nchekwa.",ibo,Human Resources
"Nchegbu Banyere Monday.com Integration Issues [SEP] Nkwado ndị ahịa, <br>Anyị ahịa ụlọ ọrụ zutere nsogbu nke mwekota na Monday.com ngwaọrụ na Monday, nke emetụta workflow na oru ngo management. Ọ nwere ike ịbụ metụtara na-adịbeghị anya software mmelite. N'agbanyeghị anyị nsogbu nchọpụta, dị ka restarting ngwa na-enyocha ndakọrịta mmelite, nsogbu na-adịgide. <br>Anyị na-echegbu ebe ọ bụ na nke a nwere ike imetụta oru ngo deadlines na n'ozuzu arụmọrụ. Anyị ga-enwe ekele dị ukwuu ma ọ bụrụ na ị nwere ike anya na nke a ngwa ngwa na-enye a ngwọta ma ọ bụ nduzi iji dozie nsogbu. <br> Biko.",ibo,Human Resources
Nchegbu banyere Data Analytics Ngwá Ọrụ [SEP] Ngwá ọrụ nyocha data na-emepụta nsonaazụ na-ekwekọghị ekwekọ. Mmelite ngwanrọ na-adịbeghị anya nwere ike ịkpata njehie ntinye data. Mgbalị iji laghachi na nsụgharị ndị gara aga ma nyochaa data ntinye enweghị ihe ịga nke ọma.,ibo,Human Resources
Enwere ike ịdaba na Data na Healthcare System [SEP] Enwere ike ịchọpụta ịdaba na data na usoro ahụike. Enweghi ikike nwere ike ịbụ n'ihi usoro nchekwa ochie. Emere nyocha mbụ ma melite ngwanrọ.,ibo,Human Resources
Nsogbu nyocha data na-eduga na ọdịda na njikarịcha itinye ego [SEP] Nsogbu na nyocha data rụpụtara igbu oge na usoro njikarịcha itinye ego.,ibo,Human Resources
"Enweghị ikike ịbanye na netwọk ụlọ ọgwụ [SEP] Anyị ezutela ọtụtụ mbọ ịbanye na netwọk ụlọ ọgwụ anyị, nke nwere ike ịbụ n'ihi na iwu nchekwa njirimara ezughi oke. Anyị na-edozi nsogbu a site na ịtọgharịa paswọọdụ onye ọrụ, melite nlekota usoro, ma were ya nke ọma iji gbochie ihe omume ndị ọzọ. Anyị ga-aga n'ihu na-ele ọnọdụ ahụ anya ma tinye usoro nchebe ndị ọzọ dị mkpa. Ichedo data ndị ọrịa ka bụ ihe kachasị mkpa anyị. Biko mee ka anyị mara banyere mmepe ọ bụla.",ibo,Human Resources
"Onye ọrụ na-eche nsogbu njikọ na WhatsApp Desktop na Acer Predator XB273K Monitor [SEP] Gbaghara maka nsogbu njikọ na WhatsApp Desktop na Acer Predator XB273K Monitor gị. Biko ị nwere ike ịnye nkọwa ndị ọzọ, ozi njehie ọ bụla, na usoro idozi nsogbu ị meworo? Achọrọ m ịhazi oku na <tel_num> maka nkasi obi gị iji nyere aka na nke a.",ibo,Human Resources
"Enyemaka achọrọ maka ActiveCampaign na Squarespace Integration [SEP] Ezigbo nkwado ndị ahịa, ana m achọ nduzi banyere ijikọ ActiveCampaign na Squarespace iji melite usoro ọrụ akpaaka ahịa m. Ana m anwa ịtọlite njikọta ahụ mana enwere m nsogbu na-eme ka ọ rụọ ọrụ nke ọma. Biko nye m ntuziaka zuru ezu, nzọụkwụ site na nzọụkwụ ma ọ bụ duzie m na akụ bara uru iji mezue njikọta ahụ? Na mgbakwunye, m ga-enwe ekele maka omume kachasị mma ma ọ bụ ndụmọdụ maka iji ActiveCampaign na Squarespace mee ihe n'ụzọ dị irè iji mepụta usoro akpaaka ahịa dị irè. Daalụ maka oge na enyemaka gị. Ana m atụ anya nzaghachi gị.",ibo,Human Resources
"Òtù ego na-ezute nsogbu nke mwekota na data itinye ego [SEP] Òtù ego ahụ chere nsogbu ihu n'ịjikọta data n'ime ngwaahịa dị iche iche, na-emetụta nyocha nke data itinye ego. A chọpụtara ihe kpatara ya: ndakọrịta nsụgharị ngwanrọ. Mgbalị iji dozie gụnyere ịmaliteghachi usoro na imelite ngwa ndị dị mkpa.",ibo,Human Resources
"Nkọwapụta na AR Brille Integration Ndakọrịta [SEP] Ndewo Nkwado ndị ahịa, Ana m ede iji jụọ maka ndakọrịta nke ngwanrọ njikwa ọrụ AR-Brille na sistemụ ndị ọzọ. Nwere ike ịnye ozi zuru ezu banyere otu sistemụ ndị a nwere ike isi rụọ ọrụ ọnụ? Enwere m mmasị karịsịa ịghọta ihe ndị achọrọ na teknụzụ yana njedebe ọ bụla nwere ike. Na mgbakwunye, m ga-enwe ekele maka akwụkwọ ọ bụla ma ọ bụ ihe onwunwe ọ bụla nwere ike inyere m aka ịghọta usoro njikọta nke ọma. Ana m atụ anya nzaghachi gị ka anyị na-enyocha otu AR-Brille nwere ike isi mee ka ikike njikwa ọrụ anyị dịkwuo elu. Daalụ maka oge na enyemaka gị. Enwere m obi ụtọ ịmụtakwu banyere ngwọta ọhụrụ a.",ibo,Human Resources
"Integration na Docker [SEP] Nkwado ndị ahịa, nwere mmasị ịghọta otú Docker si ejikọta na usoro nhazi ọrụ SaaS. Nwere ike ịnye ozi zuru ezu banyere otu esi eji Docker n'ime ikpo okwu? Nke a ga-enwe ekele dị ukwuu, ọkachasị gbasara uru ọ na-eweta, dị ka mma arụmọrụ mmejuputa na mma collaboration. Na mgbakwunye, ị nwere ike ịkọrọ kpọmkwem chọrọ ma ọ bụ ndụmọdụ maka iji Docker na ikpo okwu? Daalụ maka oge gị na enyemaka. M na-atụ anya ịnụ azụ n'oge na-adịghị anya.",ibo,Human Resources
Ihe ndị dị iche na nyocha nke data itinye ego [SEP] Otu ụlọ ọrụ ego hụrụ ihe ndị na-adịghị mma na nsonaazụ nyocha nke data itinye ego ha. Nzọụkwụ mbụ iji dozie nke a gụnyere imelite ngwanrọ na ịmaliteghachi usoro ahụ.,ibo,Human Resources
"Enyemaka na Medical Data Security Protocols [SEP] Nkwado ndị ahịa na-agakwuru iji jụọ maka omume kachasị mma maka ịchekwa ozi ahụike n'ime sistemụ ụlọ ọgwụ na WhatsApp Desktop. Dị ka ị nwere ike ịma, data ahụike dị oke mkpa ma chọọ nlekọta nke ọma gbasara nchekwa na nchekwa ya. Anyị ga-enwe ekele maka nduzi banyere otu esi echekwa nzuzo, iguzosi ike n'ezi ihe, na nnweta nke data a. Karịsịa, anyị nwere mmasị ịghọta usoro nzuzo, mgbochi ịnweta, na usoro ndabere data dị maka ichedo ozi ahụike. Ọzọkwa, anyị ga-achọ ịkọwa...",ibo,Human Resources
Nsogbu na Nchịkọta Data Investment [SEP] Otu ụlọ ọrụ ego zutere nkwụsị nke na-emetụta nyocha nke data itinye ego n'ọtụtụ ngwaahịa. Ihe kpatara a ga-eji chọpụta bụ esemokwu njikọta. Nzọụkwụ mbụ e mere gụnyere ịmalitegharịa ngwanrọ metụtara ya na nyocha nke njikọ na ọrụ igwe ojii. Nnyocha ndị ọzọ na-aga n'ihu.,ibo,Human Resources
Ihe ize ndụ nke data nwere ike ịbịara [SEP] A chọpụtawo ihe ize ndụ nke data nwere ike ịbịara ndị ụlọ ọgwụ.,ibo,Human Resources
"Akụkọ ihe mere eme: Ngosipụta nke data nke ndị na-ahụ maka ahụike [SEP] Nkwado ndị ahịa,<br><br>Anyị na-agwa gị banyere ihe omume ngosi data nwere ike imetụta sistemụ ụlọ ọgwụ. O yiri ka nsogbu ahụ nwere njikọ na ntọala netwọk ezighi ezi, nke nwere ike ikwe ka ịnweta ozi dị nro.<br><br>Nnyocha mbụ anyị gụnyere ịhazigharị nhazi firewall, nke edoziwo nsogbu ahụ kpamkpam. Anyị na-achọ enyemaka gị iji nyochaa na usoro nchebe dị mma. Anyị ga-enwe ekele maka nduzi na nkwado gị iji nyere anyị aka idozi okwu a ngwa ngwa.",ibo,Human Resources
"Nsogbu na Access to SaaS Functionality Reported [SEP] E nwere ọdịda mberede na ịnweta ọrụ SaaS dị oke mkpa, nke nwere ike ịbụ n'ihi nsogbu nhazi nhazi ihe nkesa. Emere mgbalị iji malitegharịa ngwa ndị metụtara.",ibo,Human Resources
Alert on Security Incident [SEP] E kwuru na e nwere mgbalị ndị a na-anaghị ekwe ka ha banye n'ebe ahụ,ibo,Human Resources
Nsogbu na-enwe na ịhazi usoro ihe omume nke nzukọ ndị otu Taa [SEP] Enwere esemokwu nke ime atụmatụ ihe omume n'ime ụlọ n'ihi omume nchịkwa na-adịghị mma.,ibo,Human Resources
"Mmelite na-adịbeghị anya Akpata ọdịda na ọtụtụ ngwaahịa Integrations [SEP] Akụkọ banyere nsogbu ebe ọtụtụ ngwaahịa integrations, dị ka iOS na Linux, na-atụghị anya na-emezughị mgbe na-adịbeghị anya na-emelite ikpo okwu. The probable cause seems to be conflicts introduced by the latest update. Troubleshooting efforts, including system restarts and patch verifications, have not resolved the problem. We would appreciate prompt assistance in solving this matter. Biko nye ndụmọdụ na ihe ndị dị mkpa nzọụkwụ iji dozie nsogbu.",ibo,Human Resources
Akụkọ banyere ihe mberede nchekwa E zigara [SEP] A chọpụtawo ihe mberede nchebe ma na-emetụta iguzosi ike n'ezi ihe nke data ahụike.,ibo,Human Resources
"Rịọ maka nghọta na Digital Strategies to Enhance Brand Growth [SEP] Ezigbo Nkwado Ndị Ahịa, ana m ajụ maka atụmatụ dijitalụ iji mee ka uto nke ika dịkwuo elu. Karịsịa, enwere m mmasị ịmụ etu esi eji Squarespace na Slack iji nweta ebumnuche anyị. Nwere ike ịnye nduzi banyere otu esi eji ngwaọrụ ndị a iji mee ka ọhụụ na njikọ aka nke ika anyị dịkwuo elu? Aga m enwe ekele maka ndụmọdụ ma ọ bụ ndụmọdụ ọ bụla ị nwere ike inye. Na mgbakwunye, enwere m mmasị ịmata etu njikọta nke Squarespace na Slack nwere ike isi rụọ ọrụ ọnụ iji kwado uto ika. Daalụ maka oge na enyemaka gị. Ana m atụ anya ịnụ gị.",ibo,General Inquiry
"Nsogbu na Digital Engagement [SEP] Ịnagide ọdịda a na-atụghị anya ya na ọnụọgụgụ njikọ aka dijitalụ nke na-emetụta atụmatụ uto nke ika anyị. Mgbanwe ndị na-adịbeghị anya na algorithms mgbasa ozi dijitalụ nwere ike ịbụ ihe kpatara ya. Mgbe emechara mgbanwe na mgbasa ozi ezubere iche na nyochaa ọdịnaya, enwere ụfọdụ mma. Achọrọ m enyemaka iji dozie nsogbu a.",ibo,General Inquiry
Healthcare Data Concern [SEP] zutere ihe ize ndụ nchekwa data nwere ike ime n'ime usoro ụlọ ọgwụ n'ihi ngwanrọ ochie na njikwa nnweta adịghị ike.,ibo,General Inquiry
Nsogbu na Ngwaọrụ Nchịkọta Data Ntinye ego [SEP] Nsogbu bilitere na ngwa ọrụ nyocha data ntinye ego. Mmelite ngwanrọ na mgbanwe nhazi na nso nso a nwere ike ịbụ ihe kpatara ya. Anyị amaliteghachila sistemụ ndị metụtara ma chọpụta maka mmelite.,ibo,General Inquiry
"Nchegbu Banyere Digital Engagement Metrics [SEP] Nkwado ndị ahịa,\n\nAgency anyị na-ahụ maka ahịa ahụ chọpụtara na ọnụọgụ ọnụọgụ ọnụọgụ ọnụọgụ ọnụọgụ ọnụọgụ ọnụọgụ ọnụọgụ ọnụọgụ ọnụọgụ ọnụọgụ ọnụọgụ ọnụọgụ ọnụọgụ ọnụọgụ ọnụọgụ ọnụọgụ ọnụọgụ ọnụọgụ ọnụọgụ ọnụọgụ ọnụọgụ ọnụọgụ ọnụọgụ ọnụọgụ ọnụọgụ ọnụọgụ ọnụọgụ ọnụọgụ ọnụọgụ ọnụọgụ ọnụọgụ ọnụọgụ ọnụọgụ ọnụọgụ ọnụọgụ ọnụọgụ ọnụọgụ ọnụọgụ ọnụọgụ ọnụọgụ ọnụọgụ ọnụọgụ ọnụọgụ ọnụọgụ ọnụọgụ ọnụọgụ ọnụọgụ ọnụọgụ ọnụọgụ ọnụọgụ ọnụọgụ ọnụọgụ ọnụọgụ ọn",ibo,General Inquiry
Meziwanye arụmọrụ nyocha data [SEP] Meziwanye nyocha data iji bulie usoro itinye ego.,ibo,General Inquiry
"Ihe ịma aka nke ihe nkesa [SEP] Ịnagide nsogbu na dashboards ọrụ. Echere na ihe nkesa karịrị ibu n'ihi mmelite na-adịbeghị anya, na-eduga na oge nkwụsị. Amalitelarị ọrụ ahụ, kpochapụ cache, ma gbanwee mmelite ahụ.",ibo,General Inquiry
Ihe nchọgharị nke mmepụta ihe na-arụ ọrụ na-arụ ọrụ na-arụ ọrụ na-arụ ọrụ na-arụ ọrụ na-arụ ọrụ na-arụ ọrụ na-arụ ọrụ na-arụ ọrụ na-arụ ọrụ na-arụ ọrụ na-arụ ọrụ na-arụ ọrụ na-arụ ọrụ na-arụ ọrụ na-arụ ọrụ na-arụ ọrụ na-arụ ọrụ na-arụ ọrụ na-arụ ọrụ na-arụ ọrụ na-arụ ọrụ na-arụ ọrụ na-arụ ọrụ na-arụ ọrụ na-arụ ọrụ na-arụ ọrụ na-arụ ọrụ na-arụ ọrụ na-arụ ọrụ na-arụ ọrụ na-arụ ọrụ na-arụ ọrụ na-arụ ọrụ na-arụ ọrụ na-arụ ọrụ na-arụ ọrụ na-arụ ọrụ na-arụ ọrụ na-arụ ọrụ na-arụ ọrụ na-arụ ọrụ na-arụ ọrụ na-arụ ọrụ na-arụ ọrụ na-arụ ọrụ na-arụ ọrụ na-,ibo,General Inquiry
Nchebe ziri ezi nke data ahụike [SEP] Ịchọ nkọwa banyere nchekwa nke data ahụike na njikọta Surface Pro na SQL Server.,ibo,General Inquiry
Arịrịọ maka Mmelite Ngwaahịa Ntinye Nhọrọ [SEP] Ana m ede akwụkwọ iji rịọ maka mmelite banyere nhọrọ njikọta maka ngwaahịa anyị. Anyị na-achọ ime ka nkwekọ dịkwuo na ngwaọrụ SaaS dị ugbu a iji melite njikwa ọrụ na imeziwanye usoro ọrụ anyị. Anyị ga-enwe ekele dị ukwuu ma ọ bụrụ na ị nwere ike ileba anya n'okwu a ma nye azịza ya ozugbo enwere ike. Daalụ maka oge gị na enyemaka gị.,ibo,General Inquiry
"Nchegbu Banyere Nsonaazụ Na-adịghị Mma na Ngwá Ọrụ Nchịkọta Ego [SEP] Ndewo Nkwado Ndị Ahịa, m na-ahụ nsonaazụ na-ekwekọghị na ngwa nyocha nyocha ntinye ego. Nsonaazụ ahụ nwere ike ịbụ n'ihi mgbanwe ndị na-adịbeghị anya na isi mmalite data. Mgbe m nwara imelite isi mmalite data na ịmegharị usoro nyocha, nsogbu ahụ ka dị. M enyochakwala maka mmelite ngwanrọ ma hụ na sistemụ ahụ na-emezu ihe niile achọrọ. Agbanyeghị, nsonaazụ na-ekwekọghị na-emetụta ikike m ime mkpebi itinye ego n'ụzọ ziri ezi. Biko ị nwere ike inyere aka dozie nsogbu a?",ibo,General Inquiry
"Nkwado ndị ahịa na-akọ akụkọ nsogbu na arụmọrụ sava n'oge awa kachasị elu. Ndị ọrụ zutere oge ụfọdụ nke nwayọ nwayọ, ikekwe n'ihi ibu ọrụ nke sava. Ndị otu gbalịrị ịmalitegharịa sava ahụ, nke nyere naanị enyemaka nwa oge. Ngwọta ogologo oge chọrọ ịchọpụta isi ihe kpatara nsogbu ahụ. Mgbalị iji chọpụta nsogbu ahụ n'ụzọ ziri ezi enwebeghị ihe ịga nke ọma. A ga-enwe ekele dị ukwuu maka enyemaka gị n'inyocha okwu a.",ibo,General Inquiry
"Nchegbu banyere Digital Engagement Metrics [SEP] Nkwado ndị ahịa,\n\nAgency anyị na-ahụ maka ahịa ahụ achọpụtala mbelata dị ịrịba ama na ọnụọgụ ọnụọgụ ọnụọgụ ọnụọgụ ọnụọgụ ọnụọgụ ọnụọgụ ọnụọgụ ọnụọgụgụ ọnụọgụgụ ọnụọgụgụ ọnụọgụgụ ọnụọgụgụ ọnụọgụgụ ọnụọgụgụ ọnụọgụgụ ọnụọgụgụ ọnụọgụgụ ọnụọgụgụ ọnụọgụgụ ọnụọgụgụ ọnụọgụgụgụ ọnụọgụgụ ọnụọgụgụgụ ọnụọgụgụgụ ọnụọgụgụgụ ọnụọgụgụgụ ọnụọgụgụgụ ọnụọgụgụgụ ọnụọgụgụgụgụ ọnụọgụgụgụgụgụ ọnụọgụgụgụgụgụgụgụgụgụgụgụgụgụgụgụgụgụgụgụgụgụgụgụgụgụgụ",ibo,General Inquiry
"Nyochaa atụmatụ ahịa dijitalụ maka mmepe mmepe [SEP] Na-arịọ maka mmelite na usoro ahịa dijitalụ nke ezubere iji kwalite mgbasawanye ika n'ime egwuregwu, Smart Home, na Software. Ọ bụ ezie na atụmatụ ndị dị ugbu a na-eweta ụfọdụ nsonaazụ, ọ dị ka ọ dị mma ịtụle ma gbanwee ụzọ anyị iji nọgide na-asọmpi n'ahịa. M ga-enwe ekele ma ọ bụrụ na ị nwere ike ikwu atụmatụ ọhụrụ anyị nwere ike ịmụta.",ibo,General Inquiry
Mbelata na mmekọrịta ika N'agbanyeghị Digital Marketing Initiatives [SEP] Ụlọ ọrụ ahịa ahụ hụrụ mbelata na ọkwa njikọ aka. A na-eme mgbanwe na atụmatụ atụmatụ ọdịnaya iji mee ka njikọ aka dịkwuo elu.,ibo,General Inquiry
"Nsogbu na Data Analytics Platform [SEP] Nkwado ndị ahịa na-akọ na usoro nyocha data nke ụlọ ọrụ ahụ na-enwe ọganihu dị nwayọ, ikekwe n'ihi olu ajụjụ dị elu. A na-enyocha ibu sistemụ, a na-ehichapụ caches, mana nsogbu ahụ ka dị. Iji dozie nke a, anyị na-atụ aro ịbawanye ikike sava iji jikwaa okporo ụzọ na-arịwanye elu ma na-ebuli ajụjụ nchekwa data iji belata ibu sistemụ. Ndị otu anyị dị njikere inyere aka mejuputa azịza ndị a. Biko gwa anyị ma ọ bụrụ na ịchọrọ enyemaka ọzọ. Daalụ.",ibo,General Inquiry
