subject,body,answer,type,queue,priority,language,version,tag_1,tag_2,tag_3,tag_4,tag_5,tag_6,tag_7,tag_8
Issue with Server Intermittent Outages,"Dear Customer Support, there were unexpected server outages during peak time windows, leading to issues with user access and limited resource allocation due to increased traffic. Attempts to restart the server, optimize load balancing settings, and address the interruption were made but were not fully successful. These outages caused significant disruptions to the service and potential negative impacts on users. We appreciate your prompt attention to this matter and look forward to a solution being provided to prevent such occurrences in the future. Thank you for your attention to this issue.",We have received your email regarding the server outage issue and will immediately address the matter. Please contact us at <tel_num> for further discussion on a suitable solution.,Incident,Technical Support,high,de,400,Outage,Performance,Network,Recovery,IT,Tech Support,,
Concern Over Delays in Payroll Processing,We have received several complaints about delayed payroll processing. A potential system glitch might be the cause. We have reviewed the software and employee data but have not yet found a solution.,We are investigating the issue. Please provide the relevant payroll dates and any error messages for assistance.,Incident,Human Resources,medium,en,400,HR,Employee,IT,Tech Support,Performance,Disruption,,
Probleme mit Dateiuploads: Anwendung abstürzt,"Sehr geehrte Kundensupport, ich bin bei der Anwendung ein Problem mit Dateiuploads begegnet. Die Anwendung bricht beim Versuch, Projektdateien hochzuladen, ab. Das Problem behält sich trotz mehrfacher Versuche und Reduzierung der Dateigröße bestehen. Ich vermute, dass es sich auf die Serverbelastung zurückführen könnte. Die Anwendung läuft unter Microsoft Word iOS 15, andere Apps sind unbeeinflusst. Ich habe bereits verschiedene Schritte zur Lösung des Problems unternommen, die jedoch nicht effektiv waren. Ich schätze es, einen Lösungsvorschlag zu erhalten und Anweisungen zur Problembehebung zu erhalten. Bitte informieren Sie mich.","Um das abstürzende Problem mit Dateiuploads weiter zu erforschen, bitte geben Sie Ihre Kontonummer an, um eine Anrufzeit zu vereinbaren: <tel_num>. Wir werden weitere Details besprechen, um mögliche Lösungen zu finden. <acc_num> beziehen.",Problem,Technical Support,medium,de,400,Bug,Crash,Performance,Tech Support,,,,
Problem with API Integration,"We are facing integration errors with third-party products on our SaaS platform due to compatibility issues with recent API updates. We have verified the API keys and reviewed the error logs, but the issue still persists.",I would be glad to assist with the integration issue. Could you please provide more details on the API updates and any relevant error logs for further investigation and troubleshooting?,Incident,Customer Service,high,en,400,Bug,Performance,Documentation,Tech Support,,,,
Bericht über abstürzende Software,Bitte helfen Sie,"Sehr geehrter Kunde, wir sind bereit, den abstürzenden Software-Impakt zu beheben. Könnten Sie bitte mehr über das Problem berichten? Wir sind bereit, die Diagnose und den Suchansatz für eine Lösung zu unterstützen. Möchten Sie möglicherweise bald telefonisch in eine weitere Diskussion einsteigen?",Incident,IT Support,high,de,400,Bug,Crash,Performance,IT,Tech Support,,,
Detected Incident of Unauthorized Network Access,"We are reporting an incident of unauthorized access detected on the network. Several devices and applications have been impacted, likely due to outdated security protocols. We have attempted to address the issue by enhancing firewall settings and updating software, but the problem continues to persist. We would greatly appreciate any assistance in identifying the root cause and implementing a solution to prevent future incidents. This incident has caused significant disruptions, and we are eager to restore full security functionality as soon as possible.","Thank you for reaching out regarding the unauthorized access incident on the network. We apologize that the issue persists despite our efforts to update the firewall settings and software. To better assist you, could you please provide detailed information about the incident, including the date and time it occurred, the specific devices and applications affected, and any error messages encountered. This information will help us identify the root cause of the issue. We would like to schedule a call at your earliest convenience.",Incident,Technical Support,high,en,400,Security,Network,Bug,Performance,IT,Tech Support,,
Issues Affecting Digital Marketing Strategies,Facing problems,We apologize for the disruptions to your digital marketing strategies. Please provide more details about the issues you are experiencing so we can assist you further.,Incident,Customer Service,medium,en,400,Feedback,IT,Tech Support,,,,,
Customer Inquiry on Digital Strategies,"Customer Support, seeking assistance with digital strategies for brand growth. Could you provide details on methods and techniques to enhance brand awareness and engagement? Particularly interested in learning about social media and content marketing approaches. Appreciate your prompt assistance and look forward to hearing back soon.","Thank you for reaching out to our customer support team regarding digital strategies for brand growth. We utilize various methods to increase brand awareness and engagement, including social media and content marketing approaches. We would be happy to provide more information on the techniques and methods we use. For your convenience, we are available to discuss further at a time that suits you. Please let us know a suitable time to contact at <tel_num>.",Request,Customer Service,medium,en,400,Feedback,Sales,IT,Tech Support,,,,
Growth in Brand Through Digital Marketing,"Dear Customer Support, I am writing to inquire about the digital marketing strategies your company employs to promote brand growth. Could you provide more information on the techniques and tools used, as well as how to enhance brand presence and engagement? I am particularly interested in learning about the use of Social Media, Content Marketing, and Search Engine Optimization in your digital marketing efforts. Additionally, I would like to know about any success stories or case studies you can share to demonstrate the effectiveness of your digital marketing strategies. I look forward to hearing more about your approaches to digital marketing.","Dear [Name], thank you for your interest in our digital marketing strategies. We would be pleased to discuss this in more detail. Please provide a convenient time window for a call. I can reach you at [Phone Number] to see how we can support your brand growth strategies.",Request,IT Support,high,de,400,Feedback,Sales,IT,Tech Support,,,,
Sicherheitslücke gemeldet,"Erhebliche Sicherheitslücke Einfluss auf medizinische Daten in IT-Systemen eines Krankenhauses, möglicherweise aufgrund von veralteten Software-Vulnerabilittäten.","Bestätigung der Meldung einer Sicherheitslücke, bei der medizinische Daten in den IT-Systemen des Krankenhauses betroffen sind, möglicherweise aufgrund von veralteten Software-Vulnerabilittäten. Bitte den Sicherheitsteam umgehend die Meldung zu übermitteln. Die Untersuchung der Sache soll fortgesetzt werden, und wir bitten Sie um weitere Details zur Sicherheitslücke, einschließlich der Erkennungsdaten und eventuell erhaltenen Fehlermeldungen. Sie können sich telefonisch an Nummer <tel_num> oder per E-Mail kontaktieren, falls weitere Diskussionen erforderlich sind. <acc_num> wurde Ihre Rückfrage notiert.",Incident,Technical Support,high,de,400,Security,IT,Tech Support,,,,,
Issues with SaaS-Integration,"Facing difficulties with the integration of our project management SaaS tool from a third-party provider, specifically related to data synchronization problems.","Regarding the issues with SaaS integration, we have received an email about the data synchronization problems. To better assist, could you please provide more specific details about the error and the affected third-party tool? We would like to schedule a phone call to discuss this further. Once the availability is confirmed, please let us know a suitable time, and I will call you at <tel_num> to resolve issue <acc_num>.",Problem,Product Support,high,de,400,Bug,Performance,Network,IT,Tech Support,Documentation,,
Issue Encountered with Investment Optimization Today,"There was an error during the investment optimization process, leading to incorrect analytics results.","Dear [name], we regret to hear that you encountered an error in the investment optimization process resulting in incorrect analytics output. Please provide us with the details of the error message you received and the steps you took before the issue occurred. We would like to investigate further and would it be convenient for you to call us at [tel_num] to discuss the issue in detail and find a solution for account number [acc_num].",Incident,Returns and Exchanges,high,en,400,Bug,Performance,Feedback,IT,Tech Support,,,
