subject,body,answer,type,queue,priority,language,version,tag_1,tag_2,tag_3,tag_4,tag_5,tag_6,tag_7,tag_8
Integrieren von Smartsheet-Daten in bestehende Analyse-Tools,"geehrte Kundenservice, benötige detaillierte Anleitungen zur Integration von Smartsheet in meine bestehenden Investitionsdatenanalyse-Tools. Bitte geben Sie optimierte Workflows für die Integration an, um meine Arbeit zu vereinfachen und die Nutzung der Tools zu erleichtern. Schritt-für-Schritt-Anweisungen und empfehlenswerte Ressourcen zur Integration sind willkommen. Ich danke Ihnen im Voraus für Ihre Hilfe.","geehrter <name>, vielen Dank für Ihr Kontaktanliegen an den Service-Desk. Um die Integration von Smartsheet in Ihre bestehenden Datenanalyse-Tools zu bewerkstelligen, empfehle ich Ihnen, die Website zu besuchen, wo Sie Schritt-für-Schritt-Anleitungen und Video-Tutorials finden können. Das umfassende Ressourcenzentrum bietet optimierte Workflows für die Integration. Falls Sie weitergehende Hilfe benötigen, teilen Sie bitte ein geeignetes Telefonatstermin an <tel_num> mit, um den Prozess fortzuführen. Berücksichtigen Sie bitte Ihre Konto-Nr. <acc_num>, um eine individuelle Lösung zu erhalten.",Request,Product Support,high,de,52,Feature,Integration,Documentation,Support,,,,
,"Drafting a report regarding problems with the marketing agency's digital tools. The tools are sporadically malfunctioning, which is obstructing efforts to grow the brand. I suspect the issue may be caused by software conflicts or outdated versions. I have attempted rebooting the systems and updating the applications, but unfortunately, the problem persists. I would greatly appreciate any assistance in resolving this matter. Could you please provide guidance on troubleshooting and updating the digital tools to ensure they operate smoothly? I am available to provide additional information if needed.","Glad to help with the digital tools issue. To assist you more effectively, please share details about the specific tools and any error messages you are encountering. I can then guide you through troubleshooting steps or arrange a call at your convenience to resolve the problem.",Incident,Technical Support,low,en,52,Bug,Software,Outdated Version,Troubleshooting,Assistance,System,Application,
Datenschutzverletzung im Sicherheitsbereich,"Sehr geehrter Kundensupport, es ist ein Vorfall aufgetreten, bei dem Patientendaten unerwartet kompromittiert wurden. Dies könnte auf veraltete Software und Sicherheitslücken zurückzuführen sein. Wir haben umgehend Maßnahmen ergriffen, um die Netzwerksicherheit zu verbessern, Systeme zu aktualisieren und die Protokolle sorgfältig zu prüfen, um die Ursache des Vorfalls zu ermitteln. Der Schutz der Patientendaten hat für uns höchste Priorität, und wir nehmen den Vorfall sehr ernst. Wir sind uns der potenziellen Risiken und der möglichen Konsequenzen einer solchen Verletzung bewusst und setzen alles daran, zukünftige Vorfälle zu verhindern. Unser Team arbeitet intensiv daran, die erforderlichen Maßnahmen umzusetzen.",Wir schätzen Ihre schnelle Reaktion und bitten um eine Überprüfung des Vorfalls. Bitte stellen Sie einen Vorfallbericht mit Details der bisher ergriffenen Maßnahmen sowie eine weitere Bewertung bereit.,Incident,Technical Support,high,de,52,Security,Outage,Disruption,Recovery,,,,
,I am seeking detailed API integration instructions for Avast Premium Security within Docker 20.10. I would like to understand the step-by-step process for connecting these two systems. Could you kindly supply the relevant documentation or direct me to resources that can assist with this integration? I appreciate your time and support regarding this matter. Thank you.,Please provide the API integration guidelines for Avast Premium Security in Docker. Kindly review and share the necessary information to facilitate the integration.,Request,Technical Support,high,en,52,Documentation,Support,API,Integration,Feature,,,
Optimierung des Markenwachstums,"Ich möchte mich erkundigen, welche potenziellen Strategien zur Steigerung des Markenwachstums mit Adobe Sign und ActiveCampaign existieren. Könnten Sie detaillierte Empfehlungen für digitale Strategien geben, um die Nutzung von Markenwachstums-Tools zu fördern? Hinweise auf Funktionen, die genutzt werden können, um die Markenbekanntheit und das Kundenengagement zu erhöhen, wären sehr willkommen.","<name>, wir schätzen Ihr Interesse an der Nutzung von Adobe Sign und ActiveCampaign zur Förderung des Markenwachstums. Um Ihnen maßgeschneiderte Empfehlungen geben zu können, bitten wir Sie, weitere Informationen zu Ihren Geschäftsziele, Zielgruppe und bestehenden digitalen Marketingmaßnahmen zu teilen. Das ermöglicht es uns, spezifischere Hinweise zu geben und die Tools effektiv einzusetzen.\n\nGrundsätzlich helfen Adobe Sign, Dokumentenunterschriftsprozesse zu vereinfachen und die Kundenerfahrung zu verbessern, während ActiveCampaign Automatisierung und Personalisierung von Marketingkampagnen ermöglicht, um Effizienz zu steigern.",Request,Product Support,medium,de,52,Marketing,Brand Growth,Digital Strategy,Customer Engagement,Tools,Recommendations,,
SaaS Performance Issue,Benutzer berichteten über Leistungseinbußen und sporadische Abstürze unserer SaaS-Projektmanagementsoftware. Die Ursache könnte in Speicherlecks und Redis-Instabilität liegen. Nach dem Neustart der Docker-Container und dem Leeren des Redis-Caches bestehen die Probleme weiterhin. Bitte unterstützen Sie bei der Problemlösung.,"Untersuchen Sie bitte das gemeldete Leistungsproblem unserer Projektmanagementplattform. Für eine genauere Analyse benötigen wir weitere Details zu den aufgetretenen Fehlern sowie die genauen Schritte, die unternommen wurden, einschließlich des Neustarts der Docker-Container und des Leeren des Redis-Caches. Ich möchte einen Anruf planen, um die Angelegenheit zu besprechen. Bitte teilen Sie uns mit, ob <tel_num> ein geeigneter Zeitpunkt ist, oder schlagen Sie eine passende Zeit vor.",Incident,Technical Support,medium,de,52,Performance,Crash,Software,Bug,Instability,Memory Leak,Container,Troubleshooting
Data analysis system encountered a complete failure,The system failed to optimize investments effectively.,We apologize for the issue with the data analysis system. Could you please provide details on the error you are experiencing so we can assist in optimizing your investments account <acc_num>?,Incident,Technical Support,medium,en,52,Crash,Performance,Outage,Disruption,Recovery,IT,Tech Support,
Request for Assistance Regarding Data Security Incident,"Customer Support, I am writing to inform you of a suspected breach involving our medical data systems. Preliminary scans suggest a potential malware intrusion, and we have attempted password resets as a precaution. Nonetheless, we need assistance to ensure our security measures adequately protect sensitive patient information. We would appreciate guidance on the next steps and any additional actions we should undertake to prevent future breaches. Please advise on the specific protocols and procedures we should follow.","<name> acknowledges receipt of your email concerning the suspected breach of medical data systems. We understand the urgency and importance of addressing this issue swiftly. To assist further, we would like to schedule a call to discuss the next steps and provide guidance on implementing additional security measures. Please let us know a convenient time for a call, so we can discuss the details of the breach and actions taken thus far. Kindly inform us of your available times.",Incident,Product Support,medium,en,52,Security,Virus,Incident,Malware,Data Breach,,,
Assistenz bei SaaS-Projektmanagement,"Sehr geehrter Kundendienst, ich möchte mich erkundigen, welche bewährten Verfahren es gibt, um ein SaaS-Projektmanagement-Tool in eine bestehende IT-Infrastruktur zu integrieren. Können Sie Hinweise geben, wie eine reibungslose Verbindung gewährleistet werden kann? Ziel ist es, den Workflow zu verbessern und die Produktivität zu erhöhen. Wir schätzen Ihre Ratschläge und Empfehlungen sehr. Vielen Dank für Ihre Zeit und Unterstützung.","Gerne unterstütze ich Sie bei der Integration von SaaS-Tools in Ihre IT-Infrastruktur. Bitte stellen Sie weitere Details zu Ihrer aktuellen Konfiguration bereit, damit ich Ihnen spezifische Anleitungen und Empfehlungen für eine nahtlose Integration geben kann.",Request,IT Support,medium,de,52,Product,Support,Workflow,Productivity,IT,,,
Support Request for Medical Data Security Protocols,"Hello Customer Support, I am inquiring about the security protocols that are in place to protect medical data in the hospital's systems. Could you please provide detailed information on the measures taken to ensure the confidentiality, integrity, and availability of sensitive medical information? I would appreciate it if the response could include information on compliance certifications, such as HIPAA, and procedures for handling security breaches. Additionally, I would like to know what training is provided to staff members regarding data security and how frequently this training is conducted.","We will provide detailed information regarding our medical data security protocols and compliance certifications, including HIPAA. Please contact <tel_num> to discuss and answer any questions you may have regarding the security measures.",Request,Customer Service,medium,en,52,Security,Compliance,Data Privacy,HIPAA,Medical Data,Confidentiality,Information Security,
Support Required for Digital Tools Malfunction,"The digital tools used by the marketing agency, including Laravel 8 and Zoho Books, experienced unforeseen failures which interrupted normal workflows. These issues may be due to software conflicts or recent updates that caused system instability. Attempts to restart services and update affected products were unsuccessful, necessitating immediate technical assistance. Assistance is urgently needed to resolve the problem as soon as possible to reduce operational disruptions.","<name>,\n\nWe have received your email regarding the malfunction of the marketing agency's digital tools, specifically Laravel 8 and Zoho Books. We regret to hear about the workflow disruptions caused by system instability, potentially due to software conflicts or recent updates. We recognize the urgency of the situation and aim to resolve the issue promptly to lessen operational impact.\n\nTo provide effective support, please share details of any error messages you have encountered and the steps you have taken so far.",Incident,Technical Support,high,en,52,Bug,Crash,Performance,Outage,Disruption,Software Conflict,,
Integration of SaaS with Project Management Tools,"Sehr geehrter Kundensupport, ich bitte um eine umfassende Dokumentation der bewährten Verfahren für die Integration von SaaS in bestehende Projektmanagement-Tools. Unser Team verwendet derzeit SaaS und möchte den Arbeitsablauf bei der Integration der Projektmanagement-Tools verbessern. Könnten Sie bitte eine Schritt-für-Schritt-Anleitung für die erfolgreiche Umsetzung der Integration bereitstellen? Wir schätzen jegliche Empfehlungen zu bewährten Verfahren, um eine reibungslose Integration zu gewährleisten. Falls es spezielle Anforderungen oder Einschränkungen gibt, die berücksichtigt werden müssen, lassen Sie es uns bitte wissen. Wir freuen uns auf Ihre Rückmeldung zur erfolgreichen Implementierung der SaaS-Integration.",Bitte stellen Sie detaillierte Anleitungen und bewährte Verfahren für die Integration von SaaS in Projektmanagement-Tools bereit. Kontaktieren Sie uns gerne unter <tel_num> für weitere Diskussionen.,Request,Billing and Payments,medium,de,52,Feature,Documentation,IT,Tech Support,,,,
System Performance Improvement,"Customer Support is requesting enhancements to optimize system performance by upgrading the backend infrastructure. This aims to significantly boost scalability and enhance the user experience. Currently, the existing infrastructure struggles to cope with rising traffic, leading to slow load times and errors. We believe that by refining the backend, we can improve the overall system performance and deliver a better experience for users. We would appreciate it if you could review this matter and provide a solution as soon as possible to help us improve.","<name>, thank you for reaching out regarding the system performance improvement request. We understand the importance of enhancing scalability and user experience. We will focus on optimizing the backend infrastructure to boost overall performance and provide a better user experience. Could you please share specific details about the current infrastructure, such as particular issues you're facing, error messages, or slow load times? This information will help us better understand the problem and develop an effective solution. We will review your request promptly.",Change,Technical Support,medium,en,52,Performance,IT,Tech Support,,,,,
,"Customer Support,\n\nWe are reporting a critical incident involving our project management SaaS platform, which has experienced extensive downtime. Initial assessments indicate a potential server overload or software malfunction.\n\nWe have received numerous error reports from users. Our team has attempted troubleshooting by restarting the system and clearing the cache. Regrettably, the issue persists, and users continue to face disruptions.\n\nWe kindly request urgent assistance to resolve this matter.","Dear Customer,\n\nThank you for reporting the issue with our project management SaaS platform. We apologize for the inconvenience caused by the downtime. We are escalating the issue to our technical team to investigate the root cause. Please provide your account details and the specific error messages received by users to assist us further. You can contact us at <tel_num> to discuss the next steps required.",Incident,Technical Support,high,en,52,Outage,Disruption,Recovery,Performance,Server,Software,Incident,SaaS
,"Customer Support, I am reaching out to inquire about integrating your analytics platform with existing investment portfolio management systems. Could you provide comprehensive documentation on how to achieve this integration? I am interested in leveraging the platform's features to enhance our portfolio management processes. Specifically, I would like to know about available APIs, software development kits (SDKs), and any requirements or restrictions involved. Additionally, sharing examples of companies that have successfully integrated the platform would be very helpful.","<name>, thank you for your interest in integrating our analytics platform with your portfolio management systems. We can provide detailed API documentation and relevant information. Please allow us to arrange a call at <tel_num> to discuss your questions and guide you through the integration process.",Request,Technical Support,high,en,52,Documentation,Feature,Software Development Kit,API,Feedback,,,
Incident of Data Security Compromise,A data security incident took place due to identified vulnerabilities. Attempts were made to scan and update the system.,We are investigating the reported data security breach. Kindly provide details about the vulnerabilities identified during scans and any updates attempted. A call may be necessary to discuss this further; please let us know a suitable time at <tel_num> to review the breach details and account <acc_num>.,Problem,Product Support,medium,en,52,Security,Incident,Data,Vulnerability,Compromise,,,
Urgent Security Breach Report,"Customer support has received a report regarding a severe security incident involving unauthorized access to confidential medical information from a healthcare provider. Despite initial measures such as updating firewalls and performing malware scans, the problem continues. The suspected cause of the breach seems to be outdated security protocols that have left the system exposed. The implications of this breach are concerning, potentially leading to identity theft, tampering with medical records, and other serious repercussions. We request immediate action to address this issue.",We have received your report of a security incident involving unauthorized access to sensitive medical data. We will investigate the matter and provide a detailed action plan. Please let us know a convenient time for a call to discuss further.,Incident,Billing and Payments,high,en,52,Security,Outage,Disruption,Recovery,,,,
Enhancement for System Scalability,"Requesting the implementation of scalability improvements to optimize integration across Mini-Beamer, JBL speakers, Bose headset, and other well-supported platforms. Aim is to ensure a smooth user experience and boost overall system performance. While the current configuration meets expectations, prompt improvements are necessary. Kindly provide a timeline for when these enhancements can be implemented. Please inform us if any additional information is required to proceed with the request. Looking forward to your response.","We have received your request for scalability enhancements to improve integration with Mini-Beamer, JBL speakers, Bose headset, and other supported platforms. To better understand your needs, we'd like to discuss the details with you. Please let us know a convenient time for a call. Additionally, please provide a timeline for the implementation of the requested improvements and inform us if further information is needed to move forward.",Change,Technical Support,high,en,52,Performance,System,Enhancement,Scalability,Integration,,,
"Datenanalyse-System zeigt fehlerhafte Verhalten, Optimierung der Investitionen behindert. Möglicherweise softwarebedingt oder durch Schäden der Datenintegration. Lösung durch Neustart des Servers, Überprüfung der Datenquellen und Aktualisierung der Software. System funktioniert nun korrekt, Optimierung der Investitionen kann fortgesetzt werden. Fortan wird das System überwacht, um zukünftige Fehler zu vermeiden.","Das Datenanalyse-System zeigte fehlerhafte Verhalten, was die Optimierung der Investitionen behinderte. Es könnte sich um einen möglichen softwarebedingten Fehler oder Schäden der Datenintegration handeln. Das Problem wurde durch den Neustart des Servers, die Überprüfung der Datenquellen und die Aktualisierung der Software gelöst. Das System funktioniert nun korrekt und die Optimierung der Investitionen kann fortgesetzt werden. Fortan wird das System überwacht, um zukünftige Fehler zu vermeiden.","Das Datenanalyse-System ist nun problemlos, die Optimierung der Investitionen kann fortgesetzt werden. Fortan wird das System überwacht, um zukünftige Fehler zu vermeiden.",Incident,Customer Service,high,de,52,Bug,Performance,Outage,Disruption,Recovery,Software,,
Verletzung der Datensicherheit,"Wir informieren Sie über eine potenzielle Datensicherheitsverletzung, die bei unserem Gesundheitsdienstleister aufgetreten ist. Die erste Untersuchung zeigt Anzeichen dafür, dass möglicherweise veraltete Verschlüsselungsmaßnahmen die Ursache sein könnten. Wir haben bereits gründliche Systemscans durchgeführt und die Firewalls geprüft, um die Situation zu beurteilen. Bislang ist das Produkt noch nicht betroffen. Allerdings verstehen wir die Bedeutung dieser Ereignisse und wollen sicherstellen, dass die Sicherheit unserer Systeme und Daten gewährleistet ist. Wir danken Ihnen für Ihr Verständnis und informieren Sie über weitere Entwicklungen.","Wir bedanken uns für Ihre schnelle Mitteilung bezüglich der potenziellen Datensicherheitsverletzung bei Gesundheitsdienstleister aufgrund veralteter Verschlüsselungsmaßnahmen. Wir sind froh zu hören, dass das Produkt bisher noch nicht betroffen ist. Wir sind bereit, ein genaues Gespräch darüber zu führen und planen einen Anruf unter dem angegebenen Telefonnummer <tel_num>.",Incident,Technical Support,medium,de,52,Security,Outage,Disruption,Investigation,,,,
Unauthorised Access to Records,"A healthcare provider experienced unauthorised access to patient data, potentially due to outdated security vulnerabilities in Windows 10. Attempts were made to apply system patches and reset access credentials, which were successful.","Investigate the unauthorized access to patient data by the healthcare provider. Clarify the matter by obtaining additional information about the system patches applied and the credential resets performed. Could you please provide details regarding the specific security vulnerabilities and the patches used? Additionally, schedule a call to discuss the issue. Would <tel_num> be available at the earliest convenience?",Incident,Product Support,high,de,52,Security,Vulnerability,Outage,System Patch,,,,
Anfrage zu Sicherheitsfunktionen einer skalierbaren SaaS-Projektmanagement-Plattform,"Sehr geehrter Kundendienst, ich bin daran interessiert, mehr über die verfügbaren Sicherheitsfunktionen einer skalierbaren SaaS-Projektmanagement-Plattform zu erfahren. Könnten Sie bitte Details zu den Maßnahmen bereitstellen, die den Schutz der Benutzerdaten gewährleisten? Ich wäre dankbar für Informationen zu Verschlüsselungsmethoden, Zugriffskontrollen sowie etwaigen Compliance-Zertifizierungen der Plattform. Zusätzlich möchte ich mehr über die Verfahren zur Daten-Backup und -Wiederherstellung erfahren. Vielen Dank im Voraus für Ihre Unterstützung bei dieser Angelegenheit. Ich freue mich auf eine zeitnahe Rückmeldung.","Sehr geehrter <name>, vielen Dank für Ihre E-Mail bezüglich der Sicherheitsfunktionen unserer SaaS-Projektmanagement-Plattform. Wir haben robuste Maßnahmen zum Schutz der Benutzerdaten implementiert, darunter Verschlüsselungsmethoden, Zugriffskontrollen sowie Compliance-Zertifizierungen wie SOC 2. Zudem verfügen wir über bewährte Verfahren für Daten-Backup und -Wiederherstellung. Gerne stelle ich Ihnen detailliertere Informationen zur Verfügung und beantworte etwaige spezifische Fragen. Bitte teilen Sie uns eine passende Zeit für einen Anruf mit, um weitere Details zu besprechen: <tel_num>.",Request,Returns and Exchanges,medium,de,52,Security,Product,Feature,Compliance,Data Protection,,,
Support Team for Brand Expansion,Could you please provide detailed digital strategy options for enhancing brand growth and the utilization of marketing agency services?,I am happy to discuss options for improving brand growth through digital strategies. Please call to discuss your requirements so we can offer tailored solutions to meet your marketing needs.,Request,Technical Support,medium,de,52,Marketing,Strategy,Brand Expansion,Digital Marketing,Agency,Growth,Promotion,
,"Customer Support team, I am reaching out to inquire about potential digital strategy options to enhance brand growth across the affected products. I am interested in revamping our online presence to increase engagement with our target audience. Could you please provide detailed options for us to consider? These might include social media campaigns, email marketing, and innovative approaches. I am eager to explore new ways to promote our brand and would appreciate your guidance and recommendations. Thank you.","<name>, thank you for contacting the customer support team. We would be happy to discuss digital strategy options with you. To provide tailored recommendations, please share information about the target audience for the affected products. We would like to schedule a call at your convenience to discuss your needs and offer guidance on social media campaigns, email marketing, and other strategies. Please let us know a suitable time for a call at <tel_num>.",Request,Returns and Exchanges,low,en,52,Feedback,Sales,Lead,Marketing,Digital Strategy,Social Media,Customer Engagement,
Problem bei Norton-Integration,"Sehr geehrter Kundenservice, ich bitte um Anweisungen zur Integration von Norton 360 Symantec Endpoint Protection 14.3 auf der SaaS-Plattform. Könnten Sie bitte detaillierte Schritt-für-Schritt-Anleitungen und Dokumentationen bereitstellen, die die erforderlichen Schritte für die Durchführung der Integration erklären? Zusätzlich wären weitere Ressourcen und Informationen sehr hilfreich, um eine erfolgreiche Implementierung zu gewährleisten. Vielen Dank im Voraus für Ihre Unterstützung bei diesem Anliegen.","<name>,\n\nVielen Dank, dass Sie sich wegen des Norton-Integrationsproblems an den Service-Desk gewandt haben. Wir schätzen Ihr Interesse an der Integration von Norton 360 Symantec Endpoint Protection 14.3 auf unserer SaaS-Plattform. Um Sie bei der Umsetzung zu unterstützen, stellen wir eine umfassende Anleitung bereit, die die notwendigen Schritte für den Abschluss des Prozesses beschreibt. Diese Schritt-für-Schritt-Dokumentation enthält alle erforderlichen Informationen, um eine erfolgreiche Integration sicherzustellen.\nSollten Sie zusätzliche Ressourcen oder weitere Informationen benötigen, lassen Sie es uns bitte wissen. Wir helfen Ihnen gern weiter und können den Integrationsprozess bei Bedarf auch persönlich besprechen. Wären Sie damit einverstanden?",Request,Customer Service,low,de,52,Security,Documentation,Support,Integration,,,,
