subject,body,answer,type,queue,priority,language,version,tag_1,tag_2,tag_3,tag_4,tag_5,tag_6,tag_7,tag_8
Problem with Decreased System Performance During Data Processing,"Dear Customer Support,<br>While preparing the report, we observed an unexpected slowdown in the system during data processing.<br>We suspect this issue might be due to insufficient resource allocation or software conflicts. We tried to resolve it by restarting the affected applications and checking for updates, but the problem still persists.<br>We would greatly appreciate your assistance in guiding us to identify the root cause of this issue.","In response to your email about the system slowdown during data processing, we would be pleased to assist you further. To better understand and address the issue, we need more detailed information about the slowdown, including any specific error messages you are encountering and your system configuration details.<br>Please provide us with this information so that we can offer an accurate solution. If needed, we can schedule a call to discuss this further. Kindly let us know a convenient time to reach you at <tel_num>.",Incident,Technical Support,medium,en,400,Performance,Bug,IT,Tech Support,,,,
Unterstützung für Rode NT-USB Mini,Können Sie Details zur Integration des Rode NT-USB Mini in Hospital-IT-Systeme zur Sicherung medizinischer Daten bereitstellen?,"Bitte kontaktieren Sie uns bald, um die Integration des Rode NT-USB Mini in Hospital-IT-Systeme zu besprechen.",Request,Sales and Pre-Sales,high,de,400,Product,Feature,Tech Support,,,,,
Urgent Support for Security Incident,"Dear Customer Support, <br>Our healthcare system has experienced unauthorized access attempts, which pose a risk to patient data security. The vulnerability could be due to outdated software configurations. We need your help to conduct updated security settings and vulnerability scans to ensure comprehensive protection. <br>We kindly request your expertise to review our system and provide recommendations for enhanced security measures. <br>Please let us know the next steps to resolve this issue. <br>Thank you.","We acknowledge your urgent request for assistance regarding the potential security breach in your healthcare system. We understand the gravity of the situation and the importance of protecting patient data. To better assist you, we would like to schedule a call to discuss the details of the incident and the steps taken so far. We are available for a call at your earliest convenience. Please let us know a suitable time. In the meantime, please ensure that affected systems are isolated to prevent any further potential breaches. We will work with you to address this issue promptly.",Problem,Product Support,low,en,400,Security,Performance,IT,Tech Support,,,,
Seeking Advice on Securing Medical Data in a PostgreSQL Environment for a Hospital,I need guidance on securing medical data in a PostgreSQL environment for a hospital. It's crucial to ensure that patient records are protected.,"To secure medical data in a PostgreSQL environment for a hospital, I recommend enabling encryption at rest and in transit using SSL/TLS certificates. Implement role-based access control to limit access to authorized personnel. Regularly update and patch PostgreSQL to prevent exploits. I suggest using a Web Application Firewall to protect against SQL injection attacks. If you need assistance, please provide details about your current setup, and I will be happy to guide you through the process and schedule a call.",Request,Technical Support,high,en,400,Security,IT,Tech Support,Documentation,,,,
Support for Product Returns and Exchanges,"Customers face difficulties with product returns and exchanges due to system malfunctions. Recent software updates might be the cause. Despite previous attempts to resolve the issues, the problems persist.",We are here to assist with issues related to product returns and exchanges due to system malfunctions. Please provide details about the problems you are experiencing and any attempts you have made to resolve them. We will investigate the matter and schedule a call to discuss further if needed. Please let us know a convenient time to call at <tel_num>.,Incident,Returns and Exchanges,medium,en,400,Return,Product,Bug,Performance,Disruption,Tech Support,,
Microsoft Dynamics 365 Data Analytics Integration Details,Can you provide details on how Microsoft Dynamics 365 integrates data analytics for investment optimization?,I can provide information on Microsoft Dynamics 365 data analytics integration for investment optimization. Microsoft Dynamics 365 includes built-in analytics integration with Power BI for data-driven insights. Please send a detailed guide or prefer a call to discuss this further at <tel_num>,Request,Billing and Payments,low,en,400,Feature,Documentation,IT,Tech Support,,,,
Probleme der Datensicherheit im medizinischen Bereich,"Ein Verstoß trat aufgrund des Veralteten der Software und schwacher Authentifizierungsmethoden in medizinischen Datensicherheitsystemen auf, obwohl ursprüngliche Bemühungen zur Aktualisierung der Systeme unternommen wurden.","Sofortige Maßnahmen werden getroffen, um die Datensicherheitsprobleme im medizinischen Bereich zu beheben. Eine Untersuchung wird durchgeführt, um die Ausmaße des Verstoßes festzustellen. Aktualisierte Software wird eingesetzt und die Authentifizierungsvorgänge verstärkt, um zukünftige Unfälle bei der Sicherung sensibler medizinischer Daten zu vermeiden. Weitere Updates werden angeboten, sobald weitere Informationen verfügbar sind.",Incident,Product Support,medium,de,400,Security,Bug,Performance,IT,,,,
Issue with Investment Data Analytics Tool,"Customer Support, I am reporting an issue with the investment data analytics tool used for creating reports. The tool is providing inconsistent returns on investment forecasts, which may be due to outdated algorithms or data integration issues. After checking for software updates and verifying the accuracy of the data input, the problem still persists. I would appreciate it if you could look into this matter and provide a solution as soon as possible. Please let me know if you need any additional information. Thank you for your assistance.","Thank you for bringing this issue to our attention regarding the investment data analytics tool. We will investigate the cause of the inconsistent returns on investment forecasts. To better assist you, please provide the version of the tool you are using and the last time the data was refreshed. If necessary, we can schedule a call at your convenience at <tel_num>. Please let me know a time that works for you. We are working to resolve the issue as soon as possible and will provide a solution accordingly for account <acc_num>.",Problem,Technical Support,low,en,400,Bug,Performance,Product,Feature,Tech Support,,,
Problem with Online Publication,"In need of customer support due to difficulties in publishing marketing documents online. Even after restarting the system and re-uploading the files, the issue continues. There might be a software bug causing this. Urgently require help to resolve this. Please inform if more details are needed to diagnose the problem.",We will look into this. Please provide your account number and a detailed description of the error message you are receiving. This will assist us in providing you with the necessary assistance.,Incident,Technical Support,low,en,400,Bug,Performance,Tech Support,Feedback,,,,
Smartsheet Technical Assistance,Users facing issues with syncing project data to Smartsheet through integrated devices following recent software updates and network connectivity problems.,"We are currently looking into the Smartsheet sync issue. To better assist you, could you please provide any error messages you are seeing and the specific integrated devices you are using? I am happy to discuss this further at your convenient time.",Incident,Technical Support,high,en,400,Bug,Network,Performance,IT,Tech Support,,,
Support Inquiry for Billing Issues,"Facing unanticipated billing discrepancies following recent software updates across multiple products. After reviewing invoices and resetting payment methods, the issue still persists. Assistance is required to resolve the matter and ensure accurate billing going forward.","I, [Name], am writing to acknowledge the billing discrepancy issue you are experiencing, which has arisen due to recent software updates across multiple products. I understand that you have reviewed your invoices and reset your payment methods, but the issue continues. To assist in resolving this matter and ensuring accurate billing moving forward, I would appreciate it if you could provide details on the specific discrepancies associated with your account number [acc_num] and the specific products affected. Additionally, knowing the date when these discrepancies first appeared would be helpful.",Incident,Billing and Payments,high,en,400,Billing,Payment,Bug,Refund,Tech Support,,,
,"Customer Support, we are writing to report performance issues with digital tools used in a marketing campaign. Despite the disruptions in campaign execution due to software conflicts and outdated drivers, we have made several attempts to update the relevant software and check for compatibility issues, but the problems persist. We would greatly appreciate your assistance in resolving this matter. These issues have caused significant disruptions to our work, and we are eager to find a solution. Please let us know the next steps to resolve the issue. We are available at your convenience.","<name>, thank you for reaching out to us regarding the performance issues with digital tools. We are sorry to hear that your marketing agency is experiencing disruptions in campaign execution. We would be happy to assist in resolving this matter. To better understand the issue, could you please provide more details on the software and drivers that have been updated and the compatibility checks that have been performed? Additionally, it would be helpful to know any specific error messages that you are seeing. We would like to schedule a call at your earliest convenience to discuss this further.",Incident,Technical Support,medium,en,400,Performance,Disruption,Software,Hardware,IT,Tech Support,,
Sicherheitsrisiken in der Klinik-IT,"Wir haben Datensicherheitslücken in den IT-Systemen der Klinik festgestellt, was sensiblen medizinischen Daten potenziell gefährden könnte. Dies scheint auf Schäden bei der Software-Integration und veralteten Sicherheitsprotokollen zurückzuführen sein. Bislang haben wir Feuerwände aktualisiert, Softwareaudits durchgeführt und Zugriffsprotokolle überprüft, um den Ursprung zu identifizieren. Wir bitten höflich um Unterstützung, um das Problem schnell zu lösen und die Integrität unserer medizinischen Daten zu gewährleisten.","Sehr geehrte [Name],\n\nich schreibe Ihnen in Bezug auf die festgestellten Datensicherheitslücken in den IT-Systemen der Klinik. Ich verstehe die Bedeutung einer schnellen Lösung dieser Angelegenheit, um sensible medizinische Daten zu schützen. Ich wäre Ihnen sehr dankbar, wenn Sie mehr Informationen zur vermuteten Software-Integrationsschäden und veralteten Sicherheitsprotokollen bereitstellen könnten, die möglicherweise den Ursprung bilden. Bitte geben Sie mir detaillierte Informationen über die betroffenen Systeme und die bisherigen Schritte, die untergenommen wurden.\n\nIch würde mich freuen, telefonisch mit Ihnen über diese Angelegenheit zu sprechen. Ein passender Termin wäre [Zeit].",Problem,Technical Support,medium,de,400,Security,IT,Tech Support,Performance,,,,
Issue with Product Return Procedures,"Dear Customer Service, we have encountered several return and exchange requests from customers that seem to be due to unclear application guidelines and unexpected functionality issues. We have provided feedback on the purchase process to various customer segments, but significant improvements in customer satisfaction have not been observed. The return and exchange processes pose challenges for customers, ultimately leading to a decline in overall purchase satisfaction. We believe it is important to review the product descriptions, application guidelines, and the overall purchase process to ensure they are clear and concise.","We have received your email regarding the issues with the product return process. To better understand the problem, could you please provide more specific details about the return and exchange requests your customers are facing? I look forward to working together to improve the customer experience and reduce returns.",Incident,Returns and Exchanges,low,de,400,Return,Product,Feedback,Bug,Performance,,,
Assistance with Campaign,Facing problems with missed deadlines due to inadequate collaboration tools with limited integration.,Examine the campaign and offer a suitable collaboration tool solution.,Problem,Product Support,medium,en,400,Feedback,IT,Tech Support,Performance,,,,
Request for Immediate Update on User Onboarding Process,"Customer support, we are writing to request an update on the user onboarding process for our project management platform. The current process is confusing and results in a high dropout rate, which is not ideal. We would like to suggest a streamlined approach, including interactive tutorials and clear instructions, as these would greatly enhance the user experience and encourage active participation. We believe that an update to this process is essential for the platform's success and look forward to hearing back soon.","Dear [Name], thank you for reaching out regarding the user onboarding process for our project management platform. We appreciate your suggestions for improvement and agree that a streamlined approach, including interactive tutorials and clear instructions, would be beneficial. We will review the current process and consider your recommendations for an update. We are available and would like to schedule a call at [Phone Number] to discuss and gather information and ideas for a revised onboarding process.",Change,General Inquiry,low,en,400,Feedback,Feature,Documentation,Performance,IT,Tech Support,,
Project Pricing Plans,"Inquiring about the pricing plans and billing options for the project management SaaS service. Could you provide details on the different tiers and their respective features? It would be helpful if you could clarify the available billing options, such as monthly and yearly subscriptions, and any discounts for long-term commitments. Additionally, are there any additional costs associated with support and implementation? I am looking to get a better understanding of the total cost of ownership for the platform.","'name', thank you for your interest in our project management SaaS pricing plans. We offer several tiers that vary in features, including both monthly and yearly subscriptions. Discounts are available for long-term commitments. Detailed information on the tier billing options is available on the pricing page. For any additional costs related to support and implementation, please contact us directly. We would be happy to discuss your specific needs and provide a quote for the total cost of ownership. If you would like, we can arrange a call.",Request,Billing and Payments,low,en,400,Billing,Payment,Subscription,Feature,Sales,Feedback,,
Request to Update Billing Information for Digital Products,"Dear Customer Support, I am writing to request an update on the billing information for our digital strategy products. The current system, while providing accurate tracking, is causing issues with financial management. I would like to optimize the billing process to ensure that charges are correct and payments are processed efficiently. Could you please assist in updating the billing information and provide a detailed explanation of the changes made? I would appreciate any recommendations that may improve financial management and tracking. Thank you for your time.","Hello [Name], thank you for reaching out to us regarding the update of billing information for your digital strategy products. We apologize for the inaccuracies you have experienced with the current system. We are ready to assist you in updating the billing information. Could you please provide us with additional details, including your account number and current billing address? Once we have reviewed your account, we will provide a detailed explanation of the changes made. If needed, we can schedule a call at your convenience using the number [tel_num]. Please let us know a suitable time.",Change,Billing and Payments,high,en,400,Billing,Payment,Financial,Performance,Tech Support,,,
Problem with Integration Failures,"Experienced issues with integrations across multiple products. Possible cause could be recent updates or changes in API connections. Attempted restarting services and re-authorizing integrations, but to no avail. The issue continues and assistance is needed to resolve it. Could you provide guidance on the next steps to take?","Thank you for reaching out regarding the integration issues. To assist further, could you please provide details of the error messages you are seeing and the specific products involved? I am happy to guide you through the next steps to resolve the issue.",Incident,Technical Support,medium,en,400,Bug,Performance,IT,Tech Support,Documentation,,,
Protecting Medical Data in Docker Environments,"Customer Support, please address the customer's inquiry regarding best practices for securing medical data in Docker systems as recommended by hospital IT departments. Medical data is highly sensitive and requires the utmost care in handling, storage, and protection. The customer would like to know the measures taken to ensure the security of data using Docker. Specifically, the customer is interested in learning about encryption methods, access controls, and network security. Could you please provide detailed information on these topics? The customer would appreciate any additional information.","Thank you for your inquiry regarding the security of medical data in Docker environments. To ensure the security of sensitive data, it is recommended that you implement encryption methods, access controls, and network security measures. For a comprehensive discussion on these topics, including best practices from hospital IT departments, we can provide detailed information. To schedule a call at a convenient time that suits you, please reach out at <tel_num>. Your account number is <acc_num>.",Request,IT Support,low,en,400,Security,Documentation,IT,Tech Support,,,,
digitale Marketingaktivitäten blieben starr,"digitale Marketingaktivitäten blieben starr. Werbeanzeigen optimiert, Inhalt angepasst, aber Ergebnisse immer unzufriedenstellend. Hilfe benötigt, um die Zielgruppe und Strategie zu verbessern.","hier, um Unterstützung bei den digitalen Marketingaktivitäten zu erhalten. Um Ihre aktuelle Strategie besser zu verstehen, könnten Sie bitte mehr Details zu Ihrer Kampagne geben, einschließlich der Zielgruppe und deren Zielen. Es wäre außerdem hilfreich, zu erfahren, welche spezifischen Metriken unzufriedenstellend sind. Damit können wir eine präzisere Richtung geben und die Ergebnisse verbessern. Falls Sie lieber telefonisch sprechen möchten, lassen Sie uns wissen, wann es Ihnen bequem ist, und rufen Sie uns unter der Nummer <tel_num> an, um zu reden.",Problem,Product Support,medium,de,400,Feedback,Sales,Feature,Documentation,,,,
Nötige Unterstützung bei Systemausfällen,Kritische Systemausfälle bei verschiedenen Integrationsen traten auf.,"Sehr geehrte/r <name>, bedauere, dass kritische Systemausfälle bei verschiedenen Integrationsen aufgetreten sind. Bitte bereitstellen Sie mehr Details zum Ausfall, z.B. Startzeit und alle Fehlermeldungen. Dies wird unserem technischen Team weitergeleitet, um eine schnelle Lösung zu finden. Falls erforderlich, können Sie sich unter <tel_num> für eine weitere Diskussion anrufen. Bitte geben Sie ein gutes Zeitfenster für den Anruf an.",Incident,Technical Support,high,de,400,Outage,Disruption,Recovery,IT,Tech Support,,,
Details on Securing Medical Data for Healthcare Providers with SAP ERP,Could you provide more details on securing medical data for healthcare providers using SAP ERP?,"<name> appreciates your interest in securing medical data for healthcare providers using SAP ERP. To ensure the integrity of medical data, we recommend implementing SAP's built-in security features, including role-based access control and data encryption. Additionally, regular audits and monitoring can help prevent unauthorized access. For detailed information, we would like to schedule a call at <tel_num> to discuss your specific requirements and provide tailored guidance. I am available.",Request,Customer Service,medium,en,400,Security,IT,Tech Support,Documentation,,,,
,Could you provide more details on the data analytics services that are available for optimizing investment strategies? I am very interested in learning about the services that can help me make better-informed decisions. Thank you for your time and assistance. I look forward to hearing back from you soon. Your guidance is greatly appreciated.,"<name>, I would be happy to clarify the data analytics services that are available for optimizing investment strategies. Our services include portfolio analysis and risk assessment to help make informed decisions. To better understand your specific needs, could you please provide information on your current investment goals and challenges? I will be glad to discuss these with you and be available for a call at your convenience to explore the services that can assist you.",Request,IT Support,high,en,400,Feedback,Sales,IT,Tech Support,,,,
,"Können Sie bitte mehr Details zu Datenanalysediensten, Optimierung und Anlageninvestitionen geben? Ich danke Ihnen für Ihre Zeit und Unterstützung bei dieser Angelegenheit.","Sehr geehrte [Name], vielen Dank für Ihr Interesse an unseren Datenanalysediensten und Optimierungsmethoden für Anlageninvestitionen. Unsere Team verwendet fortgeschrittene Werkzeuge und Techniken, um praxisrelevante Einsichten bereitzustellen und die Optimierung Ihrer Anlagenportfolios sowie die Verbesserung Ihrer Renditen zu unterstützen. Wir freuen uns darauf, die Dienstleistungen zu besprechen und wie sie Ihren spezifischen Anforderungen gerecht werden können. Wenn Sie verfügbar sind, freuen wir uns auf ein Telefonat, um dies ausführlicher zu besprechen. Bitte geben Sie uns ein geeignetes Zeitfenster bekannt. Sie können uns unter [Telefonnummer] kontaktieren, um ein Telefonat zu vereinbaren. Wir freuen uns auf Ihren Rückruf und freuen uns darauf, bald von Ihnen zu hören, [Kontonummer].",Request,Customer Service,medium,de,400,Performance,IT,Tech Support,Feedback,,,,
,"Customer Support, exploring digital strategies to boost brand growth. Could share some insights on the topics you cover? I'm particularly interested in learning about the digital marketing tactics your company finds effective. I would greatly appreciate any guidance or resources you could provide. Thank you for your time and assistance. I look forward to hearing back soon. Your help is greatly appreciated and I am excited to learn more about your expertise.","Thank you for reaching out to our customer support team to inquire about digital strategies that drive brand growth. We appreciate your interest in learning about our approach to digital marketing and the tactics we find effective. The strategies we utilize include a variety of methods such as search engine optimization, social media marketing, and targeted online advertising. We prioritize creating high-quality, engaging content to attract and retain customers effectively.",Request,Customer Service,low,en,400,Feedback,Sales,Marketing,Support,Resource,Guidance,Assistance,
Concern Regarding Financial Data Analytics Tool,"Dear Support Team, I am writing to report an issue with the Financial Advisory Data Analysis Tool. The tool is not providing accurate optimization results for investments as expected. I have tried updating the software and reviewing error logs, but the problem persists. Possible causes of the issue might include software integration problems or outdated input data. I would appreciate your support in resolving this problem. Please let me know if additional information is needed. Thank you for your understanding and assistance.",Please contact us at number <tel_num> to discuss potential solutions for the issues with the data analysis tool.,Incident,Customer Service,low,de,400,Bug,Performance,IT,Tech Support,Documentation,,,
Assistance with Digital Brand Growth Strategy,Can detailed information on digital strategies enhance a brand growth strategy? Could you help improve our online presence and expand our audience? Thank you for your time and support.,"We are pleased to assist with your digital brand growth strategy. To provide more specific information, could you please share more about your current online presence goals? We will contact you at the given time to discuss further strategies.",Request,Billing and Payments,high,de,400,Feedback,Sales,IT,Tech Support,,,,
Challenge in Digital Marketing Engagement,Brand engagement is currently low,Kindly review and discuss your account contacts shortly to explore possible solutions for enhancing brand engagement. We look forward to your earliest convenience in addressing this matter.,Incident,Sales and Pre-Sales,medium,en,400,Feedback,Performance,Documentation,,,,,
