subject,body,answer,type,queue,priority,language,version,tag_1,tag_2,tag_3,tag_4,tag_5,tag_6,tag_7,tag_8
Update der IT-Support-Workflows,"Sehr geehrtes Kundendienstteam,\n\nich möchte eine Überarbeitung unserer IT-Support-Verfahren beantragen, um die Einführung neuer Hardwareprodukte effizienter zu unterstützen. Es ist wichtig, integrationsübergreifende agile Teams mit den erforderlichen Schnittstellen auszustatten, um Plattformverfügbarkeit, Sicherheitsaspekte sowie Skalierbarkeit zu sichern. Ihr Beitrag ist entscheidend, um reibungslose Abläufe bei den genannten Geräten zu gewährleisten und die Gesamtleistung unseres Systems zu steigern. Für eine schnelle Bearbeitung dieses Anliegens danke ich Ihnen im Voraus.\n\nMit freundlichen Grüßen,","Vielen Dank für Ihre Anfrage bezüglich der Aktualisierung der IT-Support-Prozesse im Zusammenhang mit der Einführung neuer Hardware. Wir erkennen die Bedeutung einer nahtlosen Integration, Plattformverfügbarkeit sowie Sicherheits- und Skalierbarkeitsaspekte, um die Innovationskraft bereichsübergreifender, agiler Teams weiterhin zu fördern.\n\nZur effizienten Umsetzung empfehlen wir, die bestehenden IT-Support-Dokumentationen zu prüfen und bei Bedarf zu aktualisieren, um die Anforderungen der neuen Hardware zu berücksichtigen. Dabei sollten die Kompatibilität getestet, zentrale Schnittstellen definiert und die Überwachungsprotokolle sowie Sicherheitsanforderungen entsprechend angepasst werden.",Change,IT Support,medium,de,51,IT,Tech Support,Workflow,Security,Hardware,Platform,Integration,
Invoicing,"Dear Customer Support Team,\n\nI am reaching out to highlight an issue related to billing and payment processing on my account. Recently, I observed inconsistencies in the charges listed on my last invoice, which do not match the services I have utilized. Furthermore, I have been unable to complete payments as error messages keep appearing during the checkout process.\n\nThis matter is quite troubling as it affects my ability to access services without interruption. I kindly request a comprehensive review of my account's billing history and an immediate resolution.\n","Thank you for contacting us regarding billing discrepancies and payment problems, <name>. To assist you further, please provide your account number, the email address associated with your account, and, if possible, a copy of the latest invoice along with the error messages encountered during payment. We will promptly review your account and work towards a resolution.",Incident,Billing and Payments,high,en,51,Billing,Payment,Account,Refund,Error,Tech Support,,
Query About All-in-One Marketing Solutions,"Dear Support Team,\n\nI hope this message reaches you in good spirits. I am reaching out to request detailed information regarding your comprehensive marketing services. Specifically, I am keen to learn about your performance marketing tactics, analytics functionalities offered, and growth hacking strategies designed to help businesses expand efficiently.\n\nFurthermore, I would value insights into your client onboarding procedures. Understanding the steps involved in integrating new clients would assist us in evaluating the process effectively.","We appreciate your interest in our all-in-one marketing solutions. We provide extensive performance marketing techniques backed by sophisticated analytics tools for real-time optimization and reporting. Our growth hacking strategies emphasize rapid testing across various channels to generate scalable outcomes. The client onboarding process involves an initial discovery session, alignment of objectives, and a customized strategy proposal to ensure smooth integration. Our account management team maintains ongoing communication through scheduled updates.",Request,Product Support,high,en,51,Marketing,Feature,Feedback,Performance,,,,
Klärung,"Sehr geehrtes Kundendienstteam,\n\nich wende mich an Sie, um Unterstützung in Bezug auf eine kürzliche Interaktion zu erbitten. Mir wurde mitgeteilt, dass ein umsetzbares Problem gemeldet wurde und ein spezifischer Vorfall beschrieben wurde. Ich verstehe, dass es schwierig sein kann, alle Details klar zu erfassen, um bei der Lösung etwaiger Probleme zu helfen. Dennoch möchte ich die Schwierigkeiten, auf die ich gestoßen bin, klären, in der Hoffnung, dass eine Behebung diese beseitigen kann.\n\nKönnten Sie bitte Ratschläge geben, wie ich das Problem am besten schildern kann, um eine effektive Lösung zu ermöglichen? Falls es Vorlagen oder Beispiel-Formate gibt, die dabei helfen können.","Vielen Dank, dass Sie bereit sind, bei weiteren Details zu helfen, damit wir effizient Unterstützung leisten können. Um das Problem zügig zu beheben, bitten wir Sie um eine klare Beschreibung des Problems, einschließlich des Zeitpunkts des Auftretens, etwaiger Fehlermeldungen oder Codes, die Sie gesehen haben, sowie der Schritte, die Sie bereits unternommen haben, um das Problem zu beheben. Bitte verwenden Sie die folgende Vorlage als Leitfaden: eine kurze Zusammenfassung des Problems, wann es begann, sowie spezifische Details.",Problem,Customer Service,low,de,51,Customer Support,Issue Resolution,Technical Support,Feedback,,,,
Zugang zum Account-Management-Dashboard möglich?,"Sehr geehrtes Support-Team,\n\nich wende mich an Sie, um ein Problem zu melden. Beim Versuch, auf das Account-Management-Dashboard zuzugreifen, scheitere ich. Trotz mehrfacher Versuche, mich anzumelden, und verschiedener Geräte sowie Browser, bleibt der Zugriff verwehrt. Ich habe bereits den Cache meines Browsers gelöscht und das Passwort zurückgesetzt, jedoch besteht das Problem weiterhin.\n\nKönnten Sie bitte die Angelegenheit dringend prüfen und Anweisungen zur Behebung des Problems bereitstellen? Falls derzeit bekannte Störungen oder Wartungsarbeiten den Zugriff beeinträchtigen, bitte ich um eine entsprechende Mitteilung.\n\nVielen Dank im Voraus für Ihre schnelle Unterstützung.","Sehr geehrter <Name>,\n\nvielen Dank, dass Sie uns wegen des Zugriffsproblems auf das Account-Management-Dashboard kontaktiert haben. Wir schätzen Ihre Bemühungen, den Browser-Cache zu löschen, verschiedene Geräte zu verwenden und das Passwort zurückzusetzen. Momentan sind uns bekannte Störungen im Zuge von Wartungsarbeiten bekannt, die den Zugriff beeinträchtigen.\n\nUm Ihnen weiterhelfen zu können, bitten wir Sie, uns mitzuteilen, ob eine spezifische Fehlermeldung beim Anmeldevorgang erscheint, welche Browser und Version Sie verwenden. Falls möglich, senden Sie uns bitte einen Screenshot des Problems (ohne sensible Daten). Sobald wir diese Informationen haben, werden wir die Angelegenheit weiter prüfen.",Incident,Technical Support,high,de,51,Account,Login,Security,Tech Support,,,,
Billing Question,"Dear Customer Support Team,\n\nI hope this message reaches you well. I am reaching out to request clarification and assistance concerning a billing issue related to marketing services provided by the company. Recently, upon reviewing my latest invoice, I observed several unexpected charges that do not align with the initial agreement for the services I believed I subscribed to.\n\nFor context, the marketing services package was supposed to include certain features at a fixed monthly rate. However, the invoice shows additional fees that were not anticipated.","Thank you for reaching out to us with your billing concerns in a clear manner. We understand how important transparency is regarding billing statements and are committed to resolving this issue promptly. To assist you further, could you please provide your account number and the email address associated with your account? This information will help us locate your records and review the specific charges in question. Additionally, please send us a detailed breakdown of the latest invoice, including the justification for each charge, so we can double-check and address your concerns effectively.",Problem,Billing and Payments,low,en,51,Billing,Payment,Refund,Disruption,,,,
Systemausfall,"Sehr geehrtes Support-Team,\n\nWir erleben einen schwerwiegenden Zwischenfall, der essenzielle Systeme betrifft, darunter EMR/PACS-Integrationen, Telemedizin-Plattformen sowie IoT-Medizinprodukte. Der Zugriff der Nutzer ist eingeschränkt, was zu erheblichen Datenverzögerungen führt. Erste Analysen deuten auf mögliche Fehlfunktionen im Zusammenhang mit Intel Optane H10 Leistungsproblemen sowie RAID-Problemen bei Western Digital Book Duo hin. Die Tier-1-Teams haben die Geräte bereits neu gestartet und die Speichermedien geprüft, konnten die Ursache jedoch nicht beheben. Wir benötigen umgehend Unterstützung, um die Ursache zu identifizieren.","Vielen Dank, dass Sie dieses kritische Ereignis gemeldet haben. Bitte helfen Sie, indem Sie die aktuellen Protokolle der Vorfälle sowie etwaige Fehlermeldungen der betroffenen Systeme bereitstellen. Falls es dringend ist, teilen Sie bitte eine geeignete Zeit für ein telefonisches Gespräch mit dem technischen Team mit, um die Lösung zu beschleunigen.",Incident,Technical Support,high,de,51,Outage,Disruption,Recovery,System,Tech Support,,,
Request for ESG Analysis Tools,"Dear Customer Support Team,\n\nI hope this message finds you well. I am reaching out to request comprehensive details about your ESG analysis solutions. Specifically, I am interested in the functionalities offered, data sources utilized, reporting capabilities, and the overall service provided. Could you please provide information on how these tools can assist in making sustainable investment decisions?\n\nThank you very much for your support. I look forward to your prompt reply.\n\nBest regards,\n[Your Name]","Thank you for reaching out regarding our ESG analysis solutions. Our platform features a wide range of capabilities, including real-time ESG assessments, customizable dashboards, and detailed reporting functionalities. It aggregates data from reputable global sources such as financial disclosures, regulatory filings, and third-party ESG data providers to ensure accuracy and reliability. The analyses help support sustainable investment choices by identifying ESG risks and opportunities, tracking company performance on key sustainability metrics, and offering benchmarking tools for competitor comparisons. Detailed reports can be generated to facilitate informed decision-making.",Request,Customer Service,medium,de,51,Feature,Product,Documentation,Feedback,,,,
Security Recommendations,"Can you offer instructions on incorporating security measures for the integration of Smart-Thermometer data with EMR/PACS platforms to guarantee adherence to HIPAA, GDPR, and ISO 27001 standards?","To achieve compliance with HIPAA, GDPR, and ISO 27001 when integrating Smart-Thermometer data into EMR/PACS systems, utilize encryption, robust access management, audit trails, and data minimization techniques. Kindly provide details about the integration platform for customized suggestions.",Request,Technical Support,medium,en,51,Security,IT,Tech Support,Documentation,,,,
Network Connectivity Interruption Problem,"Dear Customer Support Team,\n\nI am submitting a report about a major network issue currently impacting several devices, including mesh Wi-Fi units, printers, and audio systems. I believe the cause may be linked to a failure in the network node or a security misconfiguration.\n\nOur Security Operations Center (SOC) team has already restarted the affected devices and performed initial diagnostics. However, these actions did not resolve the problem, and the disruptions continue. This ongoing issue is affecting our business operations.","Thank you for reaching out regarding the network connectivity problem. To assist you better, please share a diagram of your network topology, error logs from the affected devices, and any recent changes to your configurations. Since this is urgent, inform us of a suitable time for a call to speed up the troubleshooting process.",Incident,Technical Support,high,en,51,Network,Disruption,Outage,Hardware,Security,,,
Synchronization Difficulties,"Sehr geehrter Support-Team,\n\nich möchte auf ein ernsthaftes Problem aufmerksam machen, das die Integration von Airtable mit mehreren verbundenen Abteilungen und Tools betrifft. Kürzlich haben wir Änderungen an unseren Arbeitsabläufen vorgenommen und dabei festgestellt, dass die Daten zwischen den Abteilungen nicht korrekt synchronisiert werden. Dieses Synchronisationsproblem führt zu erheblichen Störungen im Betrieb, da die Datenaktualisierungen nicht einheitlich auf allen Plattformen angezeigt werden.\n\nWir haben bereits diverse Fehlerbehebungsmaßnahmen durchgeführt, darunter manuelle Aktualisierung der Datenverbindungen, das Löschen des Cache sowie die Neuinitialisierung der integrierten Anwendungen. Leider haben diese Maßnahmen das Problem nicht beheben können. Es besteht eine Desynchronisation.","Vielen Dank für Ihren Hinweis auf das Problem. Bitte spezifizieren Sie, welche integrierten Tools betroffen sind, und teilen Sie uns kürzliche Änderungen der Arbeitsabläufe sowie die Fehlerprotokolle mit, um die Untersuchung zu erleichtern.",Incident,Technical Support,high,de,51,Synchronization,Performance,Disruption,IT,Tech Support,,,
Subscription Billing Concern,"Dear Customer Support,\n\nI am reaching out to highlight an issue with billing across several product subscriptions. Recently, I observed that my account was incorrectly charged for multiple subscriptions. Specifically, there were instances of multiple billing charges for certain products, and in some cases, the amounts billed matched the prices listed on the website.\n\nI have examined my bank statements and subscription details, and these discrepancies have caused confusion and concern about the accuracy of the billing process. I kindly ask for your assistance in investigating and resolving this matter.","Thank you for reaching out to us regarding your subscription billing concerns, <name>. To assist in resolving this issue, could you please provide your account number and the email address associated with your subscriptions? Once we have this information, we will review the charges, clarify any discrepancies, correct any errors, and advise on how to prevent similar issues in the future. We appreciate your patience.",Incident,Billing and Payments,low,en,51,Billing,Account,Payment,Refund,,,,
Security Improvement Initiative,"Dear Customer Support Team,\n\nI am reaching out to address the urgent requirement to strengthen security protocols and compliance procedures related to EMR/PACS integrations, telehealth systems, and Internet of Medical Things (IoMT) devices. In the healthcare industry, ensuring strong security measures is crucial to safeguard confidential patient data and guarantee seamless, protected service provision.\n\nOur existing infrastructure demands ongoing attention through continuous DevSecOps practices to quickly identify and remedy vulnerabilities. Adopting a proactive strategy will help us maintain high security standards.","Thank you for your message concerning security upgrades for EMR/PACS systems, telemedicine services, and IoMT devices. We recognize the importance of robust security and compliance, particularly within healthcare environments. To assist you more effectively, could you specify which platforms you are currently utilizing? This will allow us to customize our guidance on implementing continuous DevSecOps, swift incident management, and HIPAA compliance. We would also be happy to arrange a call to discuss your requirements in greater detail.",Change,Product Support,high,en,51,Security,IT,Tech Support,Compliance,,,,
Assistance with Wi-Fi Connectivity Issues,"Dear Customer Support Team,\n\nI am reaching out to request help with ongoing Wi-Fi connectivity problems affecting multiple devices at home. Over the past few days, I have observed that devices, including smartphones, laptops, and smart home gadgets, frequently disconnect and experience slow internet speeds. This issue significantly disrupts my daily routines, including work and entertainment.\n\nI have already attempted basic troubleshooting steps such as restarting the router, checking for firmware updates, and ensuring that devices are within range. However, the problem persists. I would appreciate any further guidance or instructions you can provide.","Thank you for contacting us regarding your Wi-Fi connectivity difficulties. We appreciate the steps you've already taken, such as restarting your router, updating the firmware, and verifying device proximity. To assist you better, please confirm your internet service provider, as well as the brand and model of your router. Additionally, let us know if the issue occurs with both wired and wireless connections. Are there any specific error messages or indicator lights on your router? If your router is located near electronic devices or behind thick walls, try relocating it to a more central, open area to improve signal strength.",Incident,Product Support,medium,de,51,Network,Performance,Tech Support,,,,,
Rebalancing Concern,"Dear Customer Support Team,\n\nI am writing to report an issue with the automated rebalancing analytics function. It seems that the system is not accurately reflecting the anticipated adjustments to the portfolio, leading to inconsistencies in the analytics reports. This problem hampers our ability to make well-informed investment choices. I would be grateful if the team could look into this matter at their earliest convenience and offer guidance on how to resolve it. Please let me know if you need any additional details from my side.\n\nThank you for your assistance.\n\nBest regards,\n[Your Name]","Thank you for reporting the issue with the automated rebalancing analytics feature. To assist with our investigation, could you please provide specific examples of the discrepancies observed, including the relevant account numbers and recent report dates? This information will help us resolve the issue promptly. We appreciate your cooperation.",Incident,Customer Service,medium,en,51,Performance,Bug,Feature,Analytics,,,,
Immediate Attention Needed: Persistent Switch Connectivity Problems,"Dear Support Team,\n\nI am submitting a report regarding ongoing connectivity disruptions caused by a network switch, which are severely impacting our operations. These issues started recently and, despite rebooting the device and verifying all cable connections, they continue. I suspect the cause might be related to recent configuration modifications or potential hardware malfunctions.\n\nOur team has already initiated some troubleshooting steps, including restarting the device completely and inspecting all cables thoroughly.","Thank you for reaching out to us. Kindly provide the model and serial number of the switch, along with details of recent configuration changes and any error logs, so we can further investigate the connectivity problem.",Problem,Customer Service,low,en,51,Network,Disruption,Hardware,Tech Support,,,,
Summary,"Sehr geehrter Kundenservice,\n\nich hoffe, diese Nachricht erreicht Sie wohlbehalten. Ich möchte eine umfassende Übersicht über die Dienstleistungen im Bereich Marketing-Agenturen erhalten. Es wäre hilfreich, eine Partnerschaft mit einer Marketingagentur in Betracht zu ziehen, um die angebotenen Leistungen besser zu verstehen, einschließlich möglicher Spezialisierungen und einzigartiger Ansätze, die die Agentur in ihrer Branche unterscheidet.\n\nBesonders interessiert bin ich an erweiterten Fähigkeiten im digitalen Marketing, Social-Media-Management, Content-Produktion und SEO-Strategien. Zusätzlich wären Informationen zum Kundenbindungsprozess sowie Fallstudien mit Beispielen vergangener Projekte wünschenswert.","Vielen Dank für Ihr Interesse. Bitte teilen Sie uns die Branche mit, damit wir die relevanten Fallstudien entsprechend anpassen können.",Request,Sales and Pre-Sales,medium,de,51,Customer Service,Feedback,Marketing,Service Quality,,,,
Cloud Service Disruption,"Dear Customer Support Team,\n\nI wish to draw your attention to a major problem involving a disruption in the cloud infrastructure that is currently impacting a large segment of users, myself included. This interruption is obstructing access to vital services and leading to notable operational setbacks.\n\nThe problem appears to be extensive, with users facing issues such as login failures, inability to retrieve stored information, and problems with cloud-based applications. Considering the essential role of cloud services in daily activities,","We appreciate you notifying us about the ongoing cloud service disruption. We are aware of the issue affecting access, including login problems, service interruptions, and data or application availability concerns. Our technical team is actively investigating the root cause and working to resolve the outage as swiftly as possible. We will keep you updated on significant progress and provide an estimated timeline for full recovery. Meanwhile, we suggest periodically refreshing your sessions in case access is restored during our investigation. We sincerely apologize for the inconvenience caused.",Incident,Customer Service,medium,en,51,Disruption,Outage,Cloud,Infrastructure,Performance,Network,,
Python-Excel-Integration,"Sehr geehrtes Kundensupport-Team,\n\nich möchte umfassende Informationen zur Verbindung von Python-basierten Machine-Learning-Modellen mit Microsoft Excel anfragen, insbesondere im Hinblick auf die Durchführung von Echtzeit-Analysen zur automatisierten Neugewichtung von Portfolios. Das Hauptziel besteht darin, institutionelle Anlageansätze zu optimieren und vermögenden Kunden fortschrittliche Datenanalyse- und Entscheidungsfindungstools bereitzustellen.\n\nEs wäre äußerst hilfreich, die besten Vorgehensweisen, empfohlene Bibliotheken sowie verfügbare Schnittstellen oder APIs zu verstehen, um eine nahtlose Kommunikation zwischen Python-Modellen und Excel zu ermöglichen. Zusätzlich interessieren mich Hinweise zur Verwaltung von Datenaktualisierungsraten und zur Gewährleistung der Datenintegrität.","Vielen Dank für Ihre Anfrage zur Integration von Python-basierten Machine-Learning-Modellen mit Microsoft Excel für Echtzeit-Analysen und automatisiertes Portfoliorebalancing. Wir empfehlen die Nutzung von Bibliotheken wie openpyxl, xlwings, PyXLL oder DataNitro für eine direkte Verbindung und erweiterte Automatisierungsoptionen. Microsofts Office Scripts und Power Query können ebenfalls für die Datenverwaltung bei geplanten Aktualisierungen eingesetzt werden. Um eine Echtzeit-Performance sicherzustellen, sollten asynchrone Datenverbindungen eingerichtet und Cloud-Dienste wie Azure Functions genutzt werden, um Daten effizient zu verarbeiten und zu aktualisieren.",Request,Product Support,high,de,51,Feature,Performance,Automation,IT,,,,
Dringende Unterstützung für das Account Management Center erforderlich,"Sehr geehrtes Kundendienstteam,\n\nich wende mich an Sie, um auf ein Problem im Zusammenhang mit dem Account Management Center aufmerksam zu machen. Es scheint eine Ausrichtungsstörung vorzuliegen, die die Bedienbarkeit der Oberfläche beeinträchtigt. Die Elemente des Dashboards sind falsch positioniert, was die Navigation im Kontoverwaltungsbereich erschwert.\n\nDieses Problem besteht bereits seit einiger Zeit und hindert mich daran, die Plattform wie vorgesehen zu nutzen. Ich habe versucht, die Seite neu zu laden und den Browser-Cache zu löschen, doch das Problem besteht weiterhin. Könnten Sie bitte die Ausrichtungsstörung prüfen, wenn sich die Gelegenheit bietet?","Vielen Dank, dass Sie uns wegen des Ausrichtungsproblems im Account Management Center kontaktiert haben. Um Ihnen besser helfen zu können, teilen Sie uns bitte mit, welchen Browser und welches Gerät Sie verwenden. Ein Screenshot des Problems wäre ebenfalls sehr hilfreich. Sobald wir diese Informationen haben, werden wir das Problem umgehend untersuchen und an einer schnellen Lösung arbeiten.",Problem,Product Support,medium,de,51,Account,Tech Support,Bug,Performance,,,,
Display Connection Issue with Monitor,"Sehr geehrter Kundendienst,\n\nich möchte ein Problem mit meinem Monitor melden. Der Bildschirm verliert häufig die Verbindung, was zu Unterbrechungen bei der Anzeige führt. Manchmal flackert der Bildschirm oder wird komplett schwarz, was meine Arbeit erheblich beeinträchtigt. Ich habe die Kabel und Anschlüsse überprüft, doch das Problem besteht weiterhin. Könnten Sie bitte bei der Diagnose und Lösung des Problems helfen? Falls Firmware-Updates oder Fehlerbehebungsschritte erforderlich sind, bitte ich um detaillierte Anweisungen. Ich schätze eine schnelle Unterstützung, da das Problem sehr dringend ist.\n\nVielen Dank im Voraus.","Vielen Dank, dass Sie die Details zu Ihrem Monitorproblem mitgeteilt haben. Damit wir Ihnen besser helfen können, teilen Sie bitte die Marke und das Modell Ihres Monitors sowie das verwendete Betriebssystem und eventuelle Adapter mit. Versuchen Sie außerdem, den Monitor, falls möglich, direkt an den Computer anzuschließen, um zu prüfen, ob das Problem weiterhin besteht. Sobald wir die Geräteinformationen haben, senden wir Ihnen Anweisungen für Firmware-Updates. Bitte lassen Sie uns wissen, ob Sie einen Rückruf wünschen, um die Schritte gemeinsam durchzugehen.",Incident,Customer Service,low,de,51,Network,Hardware,Display,Troubleshooting,Firmware,Connection,,
