subject,body,answer,type,queue,priority,language,version,tag_1,tag_2,tag_3,tag_4,tag_5,tag_6,tag_7,tag_8
Anleitung zur Integration von Data-Analytics-Tools,"Sehr geehrter Kundenservice, ich möchte mich erkundigen, ob es Möglichkeiten gibt, Data-Analytics-Tools in Finanzunternehmen zu integrieren, um Investmentstrategien zu optimieren. Könnten Sie bitte detaillierte Dokumentationen und Tutorials bereitstellen, die demonstrieren, wie die Tools effektiv eingesetzt werden können? Ich wäre dankbar für Informationen zu bewährten Verfahren, potenziellen Fallstricken und Erfolgsgeschichten bestehender Kunden. Zudem möchte ich mich erkundigen, ob es Support- oder Schulungsressourcen gibt, die den Integrationsprozess vereinfachen. Vielen Dank für Ihre Zeit und Unterstützung. Ich freue mich auf eine baldige Rückmeldung.","Sehr geehrter <name>, wir schätzen Ihr Interesse an unseren Data-Analytics-Tools. Für die Integration empfehlen wir, unsere Webseite mit detaillierten Dokumentationen und Tutorials zu besuchen. Unser Support-Team steht Ihnen zur Verfügung, um Schulungen und Ressourcen bereitzustellen, die den Integrationsprozess erleichtern. Vereinbaren Sie gern einen Termin unter <tel_num>, um bewährte Verfahren, mögliche Fallstricke und Erfolgsgeschichten bestehender Kunden zu besprechen. Bitte teilen Sie uns einen passenden Zeitpunkt für den Anruf mit. Wir helfen Ihnen gern dabei, Ihre Investmentstrategien im Finanzunternehmen mit Data-Analytics-Tools auf Konto <acc_num> zu optimieren.",Request,Service Outages and Maintenance,medium,de,52,Documentation,Feature,Support,Feedback,,,,
Meldung eines Vorfalls im Zusammenhang mit einem möglichen Sicherheitsverstoß,"Der Vorfall wurde gemeldet und betrifft einen möglichen Sicherheitsverstoß im Zusammenhang mit den medizinischen Daten des Krankenhauses. Es besteht die Vermutung, dass unbefugte Zugriffsversuche die Ursache sind. Erste Maßnahmen zur Behebung umfassen das Zurücksetzen von Passwörtern sowie die Überwachung des Netzwerks. Weitere Untersuchungen sind notwendig, um die Ursache und das Ausmaß des Verstoßes zu ermitteln.","Ein Vorfallbericht bezüglich eines möglichen Sicherheitsverstoßes wurde erhalten. Das Sicherheitsteam wird die Angelegenheit weiter untersuchen. Bitte stellen Sie zusätzliche Informationen zu unbefugten Zugriffsversuchen bereit, um eine gründliche Analyse zu ermöglichen.",Incident,Human Resources,high,de,52,Security,Outage,Disruption,Recovery,,,,
Support Request for DataRobot Integration,Seeking assistance with the integration of the DataRobot SaaS platform. Could you please provide the details required for the integration process? Your guidance and any available documentation would greatly facilitate a successful integration.,"<name> thanks your interest in integrating the DataRobot SaaS platform. To better assist you, could you please provide information about your current setup to aim for a successful integration? Upon reviewing your request, we will provide necessary documentation and guidance to facilitate the process. If needed, we can schedule a call at <tel_num> to discuss further. Please let us know a convenient time for you. We are happy to provide any details required for the process.",Request,Customer Service,low,en,52,Support,Integration,Documentation,Assistance,,,,
Details zu Abrechnungsplan-Optionen,"Sehr geehrter Kundensupport, ich möchte Informationen zu den Zahlungsmöglichkeiten für Abrechnungspläne bei skalierbaren SaaS-Abonnements erhalten. Könnten Sie bitte ausführliche Details zu den verschiedenen Plänen bereitstellen, inklusive ihrer Funktionen und Preise? Ich bin auch an möglichen Rabatten und Aktionen interessiert, die derzeit verfügbar sind. Zudem möchte ich mehr über die akzeptierten Zahlungsmethoden erfahren, wie Kreditkarten, Online-Rechnungen und Zahlungsplattformen. Zusätzlich wäre ich dankbar für Informationen zum Ablauf des Abrechnungsprozesses, einschließlich der Verlängerung von Abonnements und Änderungen an den Plänen.",Bitte rufen Sie uns an,Request,Billing and Payments,low,de,52,Billing,Payment,Subscription,Plan,Discount,Pricing,Customer Support,
Scalability Challenges,"The SaaS platform is facing slow response times and occasional downtime during peak user activity. To address this, we need to reduce user load and optimize database queries.",Would like to investigate further. Please provide details on the platform configuration and any recent changes. Let's schedule a call at your earliest convenience to discuss possible solutions.,Problem,IT Support,medium,en,52,Performance,Outage,Disruption,Hardware,,,,
System Malfunctions Affecting Healthcare Accessibility,"The healthcare provider has identified several system access issues, likely caused by outdated software patches. Efforts to update patches and review access permissions have been made, but the problem continues. Immediate action is necessary to prevent data breaches and safeguard patient safety.","<name> is acknowledging receipt of your email regarding the system access issues at your facility. We recognize the urgency of the situation and the potential risks to patient safety and data security. Please provide details on the measures already taken to resolve the problem, including specific patch updates implemented and access reviews performed. This information will assist us in determining the next steps. We would also like to arrange a call to discuss further.",Incident,Technical Support,medium,en,52,Bug,Security,Outage,Disruption,Recovery,,,
Supportanfrage zu Drupal Commerce,"Sehr geehrter Kundenservice, ich möchte mich nach detaillierten Abrechnungs- und Zahlungsoptionen für die Integration der Drupal Commerce SaaS-Plattform erkundigen. Könnten Sie bitte weitere Informationen zu den verfügbaren Zahlungsmöglichkeiten, Abonnementplänen sowie eventuellen Zusatzkosten im Zusammenhang mit der Integration bereitstellen? Ich würde auch schätzen, wenn Sie Dokumentationen und Anleitungen zur Einrichtung der Integration zur Verfügung stellen könnten. Vielen Dank im Voraus für Ihre Unterstützung. Ich freue mich auf Ihre baldige Rückmeldung.","<name>, vielen Dank, dass Sie den Drupal Commerce Support kontaktiert haben. Wir stellen Ihnen gern detaillierte Informationen zu Abrechnungs- und Zahlungsoptionen für die Integration unserer SaaS-Plattform bereit. Wir bieten verschiedene Zahlungsmethoden und Abonnementpläne an und senden Ihnen auf Wunsch auch Dokumentationen sowie Hinweise zu möglichen zusätzlichen Gebühren. Um Ihnen besser helfen zu können, vereinbaren Sie doch bitte einen Termin unter <tel_num>, um Ihre spezifischen Anforderungen zu besprechen. Teilen Sie uns gern mit, wann ein passender Zeitpunkt für das Gespräch wäre.",Request,Billing and Payments,low,de,52,Support,Payment,Integration,Documentation,Setup,,,
Unreliable Billing Summaries Affecting Payment Accuracy,"Provides inaccurate billing summaries, which impact payment precision.","Dear <name>, Thank you for reaching out regarding the issue with billing summaries. We regret to hear that inaccuracies in the billing summaries are affecting payment accuracy. We aim to resolve this problem promptly. Could you please provide additional details about the discrepancies you've observed in the billing summaries, such as the specific time period, account number <acc_num>, or any affected transactions? This information will assist us in investigating the matter. If available, please feel free to include a contact number for a call.",Incident,Billing and Payments,high,de,52,Billing,Payment,Accuracy,Issue,,,,
Revise Digital Growth Strategy,Customer support has received a request to revise the digital strategy to enhance brand development and reduce service interruptions. The client is experiencing difficulties with the current approach and believes an update is essential to remain competitive. They would appreciate guidance on implementing the new strategy and the steps required to ensure a seamless transition. Kindly inform us how we can assist so we can proceed with the next actions.,"<name>, we are here to help update your digital growth strategy. To better understand your current challenges and offer appropriate guidance, we would like to schedule a call at your convenience. Please let us know a suitable time to discuss the necessary steps for a smooth transition, along with recommendations to improve your marketing agency's brand growth while minimizing service disruptions. We look forward to speaking with you soon to go over the details.",Change,Service Outages and Maintenance,high,en,52,Feedback,Service Disruption,Strategy,Customer Support,Brand Development,,,
Brand Growth Strategy,"Could you provide detailed digital strategy options available to enhance brand growth? We welcome an outline of various strategies and their potential impact on the brand, along with marketing agency services offered.","Dear <name>, thank you for your interest in marketing agency services aimed at increasing brand growth. We offer a range of digital strategies designed to boost visibility and brand influence. Our services include social media management, search engine optimization, content creation, and paid advertising. We will develop a tailored plan aligned with your specific needs and objectives. These strategies can significantly impact your brand, leading to increased brand awareness, website traffic, and lead generation. We would be happy to discuss this further; please feel free to schedule a call at your convenience to explore the various strategies in detail.",Request,Billing and Payments,high,de,52,Feedback,Sales,Lead,Marketing,Strategy,Digital,Brand Growth,
Zahlungsabwicklungsunterbrechungen,"Unser SaaS-System erfährt sporadische Abrechnungsfehler, die mehrere Produkte betreffen. Möglicherweise ist ein kürzlich durchgeführtes Update der Zahlungs-Gateways die Ursache. Es wurde versucht, Transaktionen erneut zu verarbeiten. Der Support hat die Gateways kontaktiert, konnte jedoch keine Lösung finden.","Wir untersuchen den sporadischen Abrechnungsfehler bei unserem SaaS. Um besser helfen zu können, bitten wir um weitere Details, insbesondere das Datum des letzten Updates der Zahlungs-Gateways und spezifische Fehlermeldungen bei der Transaktionsverarbeitung. Können wir einen Anruf unter <tel_num> vereinbaren, um die Angelegenheit weiter zu besprechen?",Incident,Billing and Payments,high,de,52,Payment,Outage,Disruption,Support,Update,,,
,"The data analytics platform for investment optimization has been crashing frequently. This may be due to software bugs or data overload. Efforts to resolve the issue have included rebooting the system and performing basic diagnostics, but the problems continue.","We are investigating the issues with the data analytics platform. To troubleshoot effectively, please provide details about the crashes, including any error messages and the times they occurred. Additionally, we require your account information, specifically the account number, to conduct an investigation and determine the appropriate course of action to resolve the problem.",Problem,Customer Service,high,en,52,Bug,Performance,System,Diagnostics,Software,,,
Concern,"The campaign has performed poorly, likely due to targeting mistakes or ineffective messaging. Efforts to enhance results included modifying ad copy and reallocating budgets. I would like to discuss this issue with you. It seems that targeting errors and ineffective messaging may have led to the underperformance. We have already taken initial steps such as adjusting the ad copy and reallocating budgets. I would appreciate scheduling a call at your convenience to review the campaign in detail and explore additional strategies to improve performance. Please let me know a suitable time for a call at <tel_num> to discuss this further.",I want to address the campaign's underperformance with you. It appears that targeting mistakes and ineffective messaging contributed to the issue. We've started by modifying the ad copy and reallocating budgets. Let's arrange a call at your convenience to review the campaign details and consider further improvements. Kindly inform me of a suitable time for a call at <tel_num> to continue the discussion.,Problem,Customer Service,medium,en,52,Performance,Campaign,Error,Disruption,Feedback,,,
Assistance Required for Application Crashes,"Users report recurrent crashes across several interconnected applications during high traffic periods, potentially due to memory leaks. Restarting services and clearing caches temporarily resolved the problem, but it continues to occur.","<name> apologizes for the inconvenience caused by frequent crashes in the integrated applications during peak usage times. We appreciate your efforts in attempting to resolve the issue by restarting services and clearing caches. To further investigate, could you please provide details of any error messages or logs encountered? Additionally, knowing the specific versions of the products in use would be helpful. If necessary, we can arrange a call at your convenience to discuss the matter in more detail; please let us know a suitable time.",Incident,Product Support,medium,en,52,Crash,Performance,Memory,Outage,Disruption,Recovery,,
Unresponsive Digital Tools - Updates Needed,"The marketing team's digital applications, such as Moodle, GitHub, and PowerPoint 2021, are not responding. The problem appears to be related to network software issues. After restarting devices and verifying internet connectivity, the problem remains unresolved. Despite troubleshooting efforts, the team has been unable to fix the issue. The unavailability of these tools is causing substantial delays in ongoing projects. We would appreciate your assistance in resolving this matter promptly. Please advise on any additional steps we should take.",Please investigate the issue with the digital tools by contacting <tel_num> to discuss troubleshooting procedures. Schedule a call if necessary to resolve the problem as soon as possible.,Incident,IT Support,high,en,52,Network,Performance,Disruption,IT,Tech Support,,,
Integration Difficulties with Marketing Agency Platform,"Dear Customer Support, I am composing a report regarding integration difficulties with the marketing agency platform. We are encountering data synchronization failures across several products, which we suspect may be due to API conflicts. Our team has attempted to reset connections and update the software, but the problem persists. These issues began several days ago. Despite troubleshooting efforts, we have yet to resolve the matter. We are concerned that this may impact data accuracy and would appreciate your assistance in resolving these issues.","<name>,\n\nI am writing to acknowledge receipt of your email regarding the integration difficulties with the marketing agency platform. I understand you are experiencing data synchronization failures across multiple products, which you believe may be caused by API conflicts. I apologize for the inconvenience caused and appreciate the troubleshooting steps your team has already undertaken.\n\nTo assist you further, could you please provide more details about the issue, including any specific error messages received and the steps you have taken to troubleshoot the problem?",Incident,Technical Support,medium,en,52,Bug,Performance,Outage,Disruption,Recovery,API,Software,
Fehlerbericht im System,"Das Data-Analytics-System ist abgestürzt, was die Investitionsoptimierung behindert hat. Wahrscheinliche Ursache: Softwareinkompatibilität oder Überlastung.","Untersuchen Sie den Systemfehler sowie die potenzielle Ursache der Softwareinkompatibilität und Überlastung. Kontaktieren Sie in Kürze die zuständigen Stellen, um die nächsten Schritte und eine Lösung zu besprechen.",Incident,Sales and Pre-Sales,low,de,52,Crash,Performance,Software,Hardware,,,,
Request for Support Regarding Data Security Incident,"A healthcare provider encountered a data security incident that temporarily exposed sensitive medical information. The breach was likely due to a misconfiguration of the firewall. Attempts to resolve the issue included resetting network settings, but the problem persists. We require assistance in securing the network to safeguard patient data. Kindly provide guidance on how to proceed with investigating and remediating the incident. Your prompt attention to this matter is appreciated, as protecting patient information is of the highest priority.","To assist with the data security incident, please provide detailed information about the breach, including the date and time it occurred, as well as any specific network settings that were reset. We would like to schedule a call to discuss the next steps in securing the network and protecting patient data. I am available at <tel_num> at the earliest convenience.",Problem,Product Support,low,en,52,Security,Network,Disruption,IT,Tech Support,,,
Störung,"Sehr geehrter Kundendienst,\n\nich möchte einen Serviceausfall melden, der momentan die Datenanalyse-Workflows unseres Finanzunternehmens beeinträchtigt. Das Problem wurde vermutlich durch kürzliche Systemaktualisierungen verursacht, die kürzlich implementiert wurden. Trotz Neustarts der betroffenen Software und Geräte besteht das Problem weiterhin.\n\nUnser Team hat Schwierigkeiten beim Zugriff auf wichtige Daten, was die Durchführung unserer Aufgaben erheblich erschwert. Wir benötigen dringend Unterstützung bei der Behebung des Problems, um die Störung unseres Geschäftsbetriebs zu minimieren.\n\nKönnten Sie bitte die Angelegenheit prüfen und eine schnelle Lösung anstreben?","Bitte untersuchen Sie das Ausfallproblem und kontaktieren Sie <tel_num>, um weitere Details zu besprechen und eine möglichst schnelle Lösung zu finden.",Problem,Service Outages and Maintenance,high,de,52,Disruption,Outage,Recovery,Software,Security,,,
,"Sehr geehrter Kundenservice, ich bitte um Ratschläge zur Integration digitaler Strategien zur Steigerung des Markenwachstums und zur Verbesserung unserer Marketingaktivitäten. Unser Team möchte unsere Online-Präsenz stärken und das Engagement unserer Zielgruppe erhöhen. Könnten Sie Empfehlungen geben, wie soziale Medien, E-Mail-Marketing und Content-Erstellung effektiv genutzt werden können, um unsere Ziele zu erreichen? Wir sind auch daran interessiert, mehr über die neuesten Trends und bewährten Praktiken im digitalen Marketing zu erfahren. Vielen Dank für Ihre Zeit und Unterstützung. Ich freue mich auf Ihre baldige Rückmeldung. Mit freundlichen Grüßen","Sehr geehrter <Name>, ich helfe Ihnen gerne bei der Integration digitaler Strategien und der Förderung des Markenwachstums. Um Ihre Bedürfnisse besser zu verstehen, schlage ich vor, einen Anruf zu vereinbaren, um Ihre aktuellen Marketingziele zu besprechen. Wann wäre ein passender Zeitpunkt für einen Anruf? Ich kann Empfehlungen für den Einsatz sozialer Medien, E-Mail-Marketing und Content-Erstellung geben, um Ihre Ziele zu erreichen.",Request,Technical Support,high,de,52,Feedback,Marketing,Social Media,Digital Strategy,Customer Service,Engagement,Brand Growth,Online Presence
Sichere medizinische Datenlösungen,"Sehr geehrter Kundenservice, ich möchte mich erkundigen, welche Sicherheitsmaßnahmen Ihr Unternehmen ergreift, um medizinische Daten in Krankenhaus-IT-Systemen und Mesh-Netzwerk-Lösungen zu schützen. Könnten Sie bitte detaillierte Informationen zu den verwendeten Protokollen und Technologien bereitstellen, die die Vertraulichkeit, Integrität und Verfügbarkeit sensibler medizinischer Daten gewährleisten? Ich würde auch gerne wissen, welche relevanten Zertifizierungen und Konformitätsstandards Ihr Unternehmen erfüllt. Vielen Dank im Voraus für Ihre Unterstützung in dieser Angelegenheit. Ich freue mich auf Ihre Rückmeldung.","Sehr geehrter <name>, vielen Dank für Ihre Anfrage bezüglich der Sicherheitsmaßnahmen zum Schutz medizinischer Daten in Krankenhaus-IT-Systemen. Unser Kundensupport-Team legt großen Wert auf die Sicherheit und Vertraulichkeit sensibler medizinischer Informationen. Wir setzen fortschrittliche Mesh-Netzwerk-Protokolle und Technologien wie Verschlüsselung sowie sichere Zugriffskontrollen ein, um die Vertraulichkeit, Integrität und Verfügbarkeit der Daten zu gewährleisten. Zudem verfügen wir über relevante Branchenzertifizierungen und Konformitätsstandards, darunter HIPAA und ISO 27001. Für detailliertere Informationen steht Ihnen gerne unser Sicherheitsexperte für ein Gespräch zur Verfügung.",Request,Customer Service,high,de,52,Security,Network,IT,Data Privacy,Medical Data,Confidentiality,System,Technology
Enhance product integration consistency across various devices,Drafting a request to improve the compatibility of product integration across numerous devices within our scalable SaaS project management platform to guarantee smooth operation.,"<name>, thank you for your request to enhance product integration across different devices in our SaaS project management solution. To assist you more effectively, please share the specific devices and software you are using. I am happy to discuss further at your convenience; you can also call <tel_num> to talk about the next steps.",Change,Sales and Pre-Sales,high,en,52,Product,Feature,Integration,Compatibility,Performance,Scalability,,
Festgestellte Diskrepanzen in Investment-Analytics-Berichten,"Analysen zur Investment-Optimierung des Unternehmens zeigen widersprüchliche Resultate, möglicherweise verursacht durch kürzliche Modifikationen in der Datenintegration.","Bitte untersuchen Sie das Problem in den Investment-Analytics-Berichten im Zusammenhang mit den jüngsten Änderungen bei der Datenintegration, um die Inkonsistenzen zu beheben. Erlauben Sie mir, die Angelegenheit zu prüfen, und ich werde Sie kurzfristig kontaktieren.",Incident,Product Support,medium,de,52,Performance,Data,Analytics,Discrepancy,,,,
Benachrichtigung über die Verzögerung der Website,"Sehr geehrter Kundenservice, die digitalen Strategien unserer Marketingagentur führen zu einer Verlangsamung der Website, was die Kampagnen unserer Kunden beeinträchtigt. Wahrscheinlich sind technische Probleme aufgrund kürzlicher Inhaltsaktualisierungen die Ursache. Trotz unserer Bemühungen, den Cache zu leeren und die Skripte zu optimieren, bestehen die Schwierigkeiten weiterhin. Wir befürchten, dass die Kampagnen unserer Kunden dadurch geschädigt werden könnten, und bitten um Unterstützung bei einer schnellen Lösung des Problems. Könnten Sie bitte eine Überprüfung vornehmen und Empfehlungen zur Vermeidung ähnlicher Probleme in der Zukunft geben? Wir schätzen Ihre Hilfe sehr.","Wir haben Ihre E-Mail bezüglich der Verzögerung der Website unserer Marketingagentur erhalten. Wir werden die Angelegenheit prüfen und Empfehlungen zur Behebung des Problems bereitstellen. Um Ihnen besser helfen zu können, könnten wir möglicherweise Kontakt aufnehmen, um weitere Informationen zu erhalten. Wäre es möglich, einen passenden Zeitpunkt für ein Gespräch zu vereinbaren? Bitte teilen Sie uns eine geeignete Zeit mit, damit wir Sie unter <tel_num> anrufen können.",Incident,Technical Support,high,de,52,Performance,Outage,Disruption,IT,Tech Support,,,
,"Sehr geehrter Kundenservice,\n\nich möchte ein Problem bezüglich Verzögerungen beim Datenzugriff melden, das derzeit bei unserem Finanzunternehmen auftritt. Diese Verzögerungen beeinträchtigen unsere Analysefähigkeiten, und wir vermuten, dass entweder ein RAID-Controller- oder NAS-Konfigurationsproblem vorliegen könnte.\n\nWir haben bereits erste Maßnahmen zur Fehlerbehebung ergriffen, darunter einen Neustart der Geräte und die Überprüfung der Integrität der RAID-Setups. Leider besteht das Problem trotz dieser Maßnahmen weiterhin.\n\nZu den Symptomen gehören langsame Datenzugriffszeiten, die unsere Fähigkeit beeinträchtigen, zeitnahe Berichte und Analysen zu erstellen. Das Team hat die Systemprotokolle auf Fehler überprüft.","<name>, wir haben Ihre E-Mail bezüglich der Verzögerungen beim Datenzugriff in der Finanzfirma erhalten. Gerne vereinbaren wir einen Anruf, um mögliche nächste Schritte zu besprechen, einschließlich einer möglichen Vor-Ort-Unterstützung. Wann würde Ihnen ein Gespräch passen? Bitte teilen Sie uns einen geeigneten Zeitpunkt mit.",Incident,Product Support,medium,de,52,Performance,Hardware,Network,Disruption,Troubleshooting,Maintenance,,
,A healthcare provider reported a possible unauthorized attempt to access sensitive medical information due to outdated firewall configurations. Resetting access credentials and updating firewall rules should resolve the problem.,We are currently investigating the issue. Please provide details about the healthcare provider's report and the current configuration of their firewall settings.,Incident,Customer Service,medium,en,52,Security,Network,Outage,Disruption,Recovery,,,
