subject,body,answer,type,queue,priority,language,version,tag_1,tag_2,tag_3,tag_4,tag_5,tag_6,tag_7,tag_8
Revise Analytics Investment Information,Enhance data quality by updating analytics algorithms.,"<name>, thank you for your email concerning the revision of analytics investment data. We appreciate your interest in improving the analytics algorithms. To better understand your request, could you please specify the particular updates you wish to see? We will review your feedback and consider implementing changes to improve the investment data analytics. If necessary, we can arrange a call at <tel_num> to discuss further. Please let us know a convenient time to contact you regarding <acc_num>.",Change,Product Support,medium,en,52,Performance,Data,Analytics,Algorithm,,,,
Problems with the Data Analytics System,The data analytics system has encountered performance issues that are impacting the investment processes. It seems that recent software updates might be the cause. Efforts to revert the updates have been unsuccessful.,We have received your email about the issues with the data analytics system. We need to investigate the cause of the slowdowns. Could you please provide more details about the recent software updates and any specific errors you are experiencing? We would like to schedule a call at your earliest convenience to discuss the issue and possible solutions.,Incident,Product Support,medium,en,52,Performance,Bug,Software Update,Data Analytics,System Issue,,,
Problems with Marketing Campaigns,"The digital campaigns managed by the marketing agency are not performing well due to targeting mistakes. Initial strategy adjustments led to some improvement, but issues persist.",Please review the campaign details and arrange a call to discuss further. Kindly inform us of a convenient time to contact you regarding the marketing campaign concerns for account <acc_num>.,Problem,Returns and Exchanges,medium,en,52,Marketing,Campaign,Strategy,Issue,,,,
Issue with Billing System,"Sehr geehrter Kundenservice, ich kontaktiere Sie, um auf Differenzen bei der Abrechnung hinzuweisen. Es wurden Erneuerungen bei mehreren Abonnements verschiedener Produkte festgestellt. Das Problem könnte durch ein kürzliches Systemupdate verursacht worden sein. Ich habe die Zahlungsprotokolle überprüft und die Transaktionen erneut versucht, aber das Problem besteht weiterhin. Ich würde eine schnelle Lösung des Problems sehr schätzen. Bitte informieren Sie mich, falls weitere Schritte erforderlich sind oder zusätzliche Informationen benötigt werden. Vielen Dank für Ihre Unterstützung.","<name>, vielen Dank, dass Sie sich wegen der Abrechnungsdifferenzen an uns gewandt haben. Wir bedauern die Unannehmlichkeiten, die dadurch entstanden sind. Unser Ziel ist es, das Problem so schnell wie möglich zu untersuchen und zu beheben. Könnten Sie bitte die Kontonummer <acc_num> sowie eine detaillierte Beschreibung der festgestellten Differenzen mitteilen? Falls nötig, können wir auch unter <tel_num> Kontakt aufnehmen, um die Angelegenheit zu besprechen und eine Lösung anzubieten. Wir schätzen Ihre Geduld und Kooperation und arbeiten daran, die Angelegenheit umgehend zu klären.",Problem,Billing and Payments,medium,de,52,Billing,Payment,Issue,System Update,,,,
Security Breach in Data Protection System,"The hospital's data security infrastructure was compromised, with suspected malware leading to unauthorized access. Firewall and antivirus scans were conducted, and although the issue has been resolved, the breach was initially identified during a routine system inspection. An investigation is ongoing to determine the cause and extent of the breach. The hospital team is actively working to address the problem swiftly to prevent further unauthorized access. Meanwhile, sensitive information has been secured, and additional security protocols have been implemented to avoid similar incidents in the future.",Received your report. The team will contact <tel_num> to discuss assistance and resolution regarding the data breach incident.,Problem,Technical Support,medium,en,52,Security,Malware,Unauthorized Access,Firewall,Antivirus,Breach,Investigation,
Financial company encounters integration challenges,"A financial organization working on investment data analysis is experiencing integration problems across various products, potentially due to incompatible software versions. Initial troubleshooting steps, including software updates, have not resolved the issue. Assistance is required to address the problem.",Kindly share details of the software versions and products involved to facilitate troubleshooting support.,Problem,Sales and Pre-Sales,low,en,52,Bug,Performance,Outage,Disruption,Recovery,IT,Tech Support,
,"Reporting issues with the data analytics tool crashing at the financial firm, which affects investment optimization. The crashes appear to be caused by software conflicts across various products. Despite efforts to fix the problem by reinstalling PyCharm and updating the affected applications, the issue remains unresolved. Your assistance in identifying the root cause of these crashes and finding a solution to prevent future occurrences would be highly valued. Please let us know if any additional information is needed to proceed.","We have received your report regarding the data analytics tool crashing at the financial firm. To assist with troubleshooting, please provide specific error messages and details about the software versions and applications in use. Could you kindly share this information? We are available for a call at your convenience to discuss further and determine the next steps toward resolving the issue.",Incident,Product Support,medium,en,52,Crash,Software,Performance,Bug,Issue,Root Cause,Assistance,
Request for Security Update,"Please draft a request for security enhancements to the hospital's IT systems, aimed at protecting medical data across various hardware and software platforms. An update is crucial to safeguard sensitive patient information and prevent potential cyber threats. We appreciate a detailed plan and timeline for implementing these updates. Kindly inform us of any additional steps we need to take.",Review the request and provide a detailed plan along with a timeline for implementing the security updates. Please allow me to get in touch for further discussions.,Change,Service Outages and Maintenance,medium,de,52,Security,IT,Hardware,Software,Vulnerability,Cyber Threat,,
,Could you share information on how digital strategies can effectively promote brand development within organizations? I am eager to understand the methodologies and the outcomes achieved. Please provide pertinent case studies or examples.,"Certainly, I can provide information on how digital strategies can enhance brand growth for companies. The typical approach involves integrating social media marketing, content development, and targeted advertising. These efforts have led to notable results, such as greater brand visibility and increased website traffic. For instance, a previous client experienced a 500% growth in social media followers and a 200% rise in website visits. I am happy to share detailed case studies and relevant examples with you.",Request,Customer Service,low,en,52,Feedback,Strategy,Branding,Organization,Methodology,,,
Incident Impacting Several Product Services,System crashes observed during peak usage periods.,Investigating an incident affecting multiple product services. Aiming to gain a clearer understanding of the problem and to gather detailed system information.,Incident,Technical Support,high,en,52,Crash,Performance,Outage,Disruption,,,,
Error Detected in Payment Processing System,"We are experiencing difficulties with the billing system, which is hindering our ability to process payments. This may be related to a recent software update. Despite restarting the systems and verifying account information, the problem persists. We would greatly appreciate your assistance in resolving this issue promptly to prevent service disruptions. Please help us address the billing system problem.","Thank you for bringing this issue to our attention. We apologize for any inconvenience caused by the billing system problem. To assist you further, could you please provide details about the recent software update and the exact error message encountered when attempting to process payments? This information will help us better understand the issue and offer an effective solution. If needed, we can schedule a call to discuss the details and work together to resolve the problem as soon as possible.",Problem,Billing and Payments,high,en,52,Bug,Crash,Payment,Disruption,Software,Account,Issue,
Digitale Werkzeuge der Marketingagentur funktionieren nicht mehr vollständig,"Sehr geehrter Kundensupport,\n\nich möchte berichten, dass die digitalen Werkzeuge unserer Marketingagentur ausgefallen sind, was die Bemühungen um Markenwachstum erheblich beeinträchtigt. Das Problem scheint nach einem kürzlichen Software-Update aufgetreten zu sein, möglicherweise durch Konflikte zwischen den Tools oder der Software. Unser Team hat versucht, das Problem durch Neustart der Systeme und Überprüfung der Updates sowie einfacher Fehlerbehebungsschritte zu lösen, leider ohne Erfolg.\n\nWir befürchten, dass diese Fehlfunktion die Marketingmaßnahmen weiterhin behindert und das Wachstum unserer Marke beeinträchtigt. Wir schätzen Ihre Unterstützung bei der Lösung der Angelegenheit.","Wir haben Ihre E-Mail bezüglich der nicht funktionierenden digitalen Werkzeuge der Marketingagentur erhalten. Wir werden das Problem untersuchen. Bitte stellen Sie Ihre Kontodaten sowie die genaue Fehlermeldung bereit, damit wir weitere Unterstützung leisten können.",Incident,Technical Support,high,de,52,Bug,Performance,Disruption,Maintenance,Software Update,System,Conflict,
Multiple Devices Encountering Data Access Delays,The healthcare provider faced delays in accessing data on several devices. Initial attempts with rebooting and software updates did not resolve the problem.,"We apologize for the data access delays experienced across various devices. Since rebooting and software updates did not fix the issue, we would like to conduct a further investigation. Could you please provide details of any error messages or symptoms observed? We may need to contact <tel_num> to discuss the issue in more detail. Please let us know a convenient time for a call.",Incident,Technical Support,medium,en,52,Performance,Hardware,Network,Disruption,Recovery,,,
Crash Issue,"Sehr geehrter Kundendienst, ich wende mich an Sie, um Ihre Aufmerksamkeit auf häufige Abstürze unserer Investitionsdatenanalyseplattform unseres Unternehmens zu lenken. Trotz unserer intensiven Bemühungen, das Problem zu beheben, besteht es weiterhin, was wahrscheinlich auf Softwarekonflikte zwischen mehreren Produkten zurückzuführen ist. Unser Team hat versucht, die Dienste neu zu starten und wichtige Anwendungen zu aktualisieren, doch leider haben diese Maßnahmen keine gewünschten Ergebnisse erzielt. Wir befürchten, dass dieses Problem unsere Produktivität und unsere Fähigkeit, fundierte Investitionsentscheidungen zu treffen, beeinträchtigt. Wir schätzen Ihre Unterstützung bei der Ursachenforschung des Problems.","Wir haben Ihre E-Mail bezüglich der Absturzprobleme der Investitionsdatenanalyseplattform erhalten. Um Ihnen besser helfen zu können, benötigen wir weitere Informationen, insbesondere die Fehlermeldungen und Details zu den beteiligten Softwareprodukten. Bitte stellen Sie diese Informationen bereit, damit wir die Ursachen identifizieren und eine Lösung umsetzen können.",Incident,Product Support,high,de,52,Crash,Software Conflict,Product,IT,Tech Support,,,
Digital Campaigns Did Not Achieve Growth Goals,"The marketing agency's online advertising efforts did not generate the anticipated brand expansion, potentially due to issues with platform integration. The initial troubleshooting involved analyzing campaign configurations and platform analytics, but the traffic decrease was not resolved. Further investigation is required to determine the underlying cause and to implement corrective measures to enhance campaign effectiveness.","Examine campaign configurations and platform analytics to pinpoint the underlying issue, then apply corrective measures to boost campaign performance.",Incident,Product Support,high,en,52,Performance,Outage,Disruption,Analytics,Platform Integration,,,
Dringender technischer Support erforderlich,"Ein Finanzinstitut hat Synchronisationsfehler bei Analysedaten in mehreren Tools festgestellt, vermutlich infolge von Kompatibilitätsproblemen nach den Updates auf MongoDB 4.4. Die Versuche umfassten Systemneustarts, Softwareversionen aktualisieren und Cache-Daten löschen, jedoch besteht das Problem weiterhin.","Eine E-Mail wurde bezüglich der Fehler beim Synchronisieren der Analysedaten aufgrund der MongoDB 4.4-Updates erhalten. Überprüfen Sie das Problem und kontaktieren Sie <tel_num>, um die nächsten Schritte und mögliche Lösungen zur Fehlerbehebung zu besprechen.",Problem,Technical Support,high,de,52,Bug,Crash,Compatibility,Technical Support,,,,
Inquiry About Digital Strategies,Customer support is seeking information on integrating tools such as Bitbucket and QuickBooks into digital strategies. Could you please provide details about this? I would appreciate any information on the implementation process and its advantages. Looking forward to your response as I explore the strategies being used. Thank you for your time and assistance. Eager to learn how these can help our business grow.,Please reach out to discuss the specifics of implementing digital strategies.,Request,Sales and Pre-Sales,medium,en,52,Customer Support,Digital Strategy,Implementation,Assistance,Business,,,
Issue with Product Integration Updates,"Multiple product integrations are failing. Devices have been restarted and connections verified, but the issue persists. Suspect it may be related to recent platform updates. Please assist in resolving this problem promptly.","Please review the recent updates and their potential impact on product integrations. Could you provide additional details about the specific integrations that are failing, including any error messages? Contact <tel_num> to discuss the requirements.",Incident,Customer Service,medium,de,52,Product,Integration,Issue,Platform Update,Connection,Bug,,
