subject,body,answer,type,queue,priority,language,version,tag_1,tag_2,tag_3,tag_4,tag_5,tag_6,tag_7,tag_8
Payment Difficulties on SaaS Platform,"The customer is experiencing difficulties processing payments through the SaaS platform's billing portal. The issue may have been triggered by a recent update to the payment gateway. The customer has tried clearing the cache, switching browsers, and retrying payments, all to no avail. The problem persists despite multiple attempts. They are requesting assistance to resolve the issue and enable successful transactions.","<name>, we acknowledge the payment difficulties on the SaaS platform's billing portal and appreciate the troubleshooting steps you have already undertaken. To assist you further, could you please share the specific error messages or error codes you encounter when attempting to process payments? If needed, we can arrange a call at a convenient time to discuss the issue in detail and work towards a resolution. Please let us know a suitable time for you.",Incident,Billing and Payments,medium,en,52,Payment,Billing,Payment,Issue,Outage,Disruption,Support,
Strategic Improvement of Brand Expansion,"We are seeking to understand the digital strategies utilized by your organization to boost brand development. Could you please share comprehensive details about the digital approaches your company employs to promote brand growth? Any relevant data, case studies, or examples would be highly valuable. This information will help us better grasp the strategies' advantages and enable us to make informed decisions regarding potential collaborations.",Please contact our representative at <tel_num> to discuss the details further.,Request,Human Resources,low,en,52,Strategy,Brand Development,Growth,Digital Transformation,Case Study,Business Improvement,Organizational Development,
Technisches Anliegen,Fehler beim Absturz beheben,"Hierbei handelt es sich um ein technisches Problem. Um Ihnen besser helfen zu können, bitten wir Sie, weitere Details zum Absturz bereitzustellen, einschließlich der Fehlermeldung, der durchgeführten Schritte und der Umstände, unter denen das Problem auftrat. Dies ermöglicht uns, eine genauere Lösung anzubieten.",Incident,IT Support,high,de,52,Bug,Crash,Technical Support,,,,,
Problems with Software in Campaigns,"The digital campaigns managed by the marketing agency have been disrupted due to unexpected software incompatibilities across key tools. The problem probably originated from recent system updates. Despite restarting devices and reinstalling the impacted applications, the issue remains unresolved. Immediate assistance is required to fix the problem and ensure campaigns resume normal operation.",Assess the software problem and contact <tel_num> to discuss troubleshooting strategies and resolution procedures for the campaigns.,Problem,Technical Support,high,en,52,Bug,Software,Performance,Disruption,Outage,,,
,"Customer Support, I am reaching out to inquire about best practices for securing medical data in healthcare environments using Cassandra 4.0. Could you please provide guidance on this topic? I would appreciate any information you can share. Thank you for your time and assistance. I look forward to hearing from you soon.","<name>, thank you for your inquiry regarding securing medical data with Cassandra 4.0 in healthcare settings. Recommended practices include implementing encryption, access controls, and conducting regular security audits. Additionally, ensuring compliance with regulatory standards such as HIPAA is essential. We can provide detailed guidance and support as needed. Would you like to schedule a call to discuss this at <tel_num>, or would you prefer to receive information via email regarding <acc_num> specific setup?",Request,Technical Support,high,en,52,Customer Support,Healthcare,Guidance,Information,Assistance,,,
,Can you offer guidance on expanding a project management SaaS? Please share details about your current configuration and any particular challenges you're experiencing. I'd be happy to help and provide customized recommendations.,"To assist with scaling your project management SaaS, please provide information about your existing setup and specific obstacles you're encountering. I am glad to offer tailored advice.",Request,IT Support,high,en,52,Feature,Feedback,Documentation,,,,,
Anfrage zum Data Analytics Support,"Ich möchte mich erkundigen, ob Data Analytics Tools zur Optimierung von Anlagestrategien angeboten werden. Könnten Sie bitte detaillierte Informationen zu den verfügbaren Tools bereitstellen, beispielsweise prädiktive Modellierung und Portfolio-Optimierungssoftware? Ich würde auch gerne Fallstudien und Beispiele sehen, um zu verstehen, wie diese Tools Kunden bei der Erreichung ihrer Anlageziele unterstützen. Zudem bin ich an Schulungen interessiert, die Nutzern helfen, die besten Tools effektiv zu nutzen.","<name> bietet eine Reihe von Data Analytics Tools zur Optimierung von Anlagestrategien an, inklusive prädiktiver Modellierung und Portfolio-Optimierungssoftware. Gerne stellen wir Fallstudien und Beispiele bereit, die zeigen, wie unsere Tools Kunden bei der Zielerreichung unterstützt haben. Unser Support umfasst Schulungen und engagierten Kundenservice. Für weitere Details und um die passenden Tools für Ihre Bedürfnisse zu ermitteln, vereinbaren wir gerne ein Gespräch. Bitte teilen Sie uns eine passende Zeit mit. Sie erreichen uns unter <tel_num>.",Request,Product Support,medium,de,52,Feature,Support,Training,Documentation,Feedback,,,
,"A financial organization has encountered delays in data processing, which is impacting their investment optimization efforts. The delays may be due to compatibility issues between software and hardware. After restarting the systems and updating the drivers, the problem still remains. Assistance is required to resolve this issue promptly to reduce potential losses.","<name>, thank you for contacting us regarding the data processing delays impacting your investment optimization at your financial firm. We understand the urgency of this situation and are here to assist. To better support you, please provide details about your software and hardware systems, including any specific error messages encountered. We would also like to schedule a call at your earliest convenience to discuss the matter further. Is <tel_num> a suitable contact number, or would you prefer an alternative time?",Incident,Technical Support,low,en,52,Performance,Hardware,Software,Disruption,Recovery,,,
Verstoß gegen Datenschutzbestimmungen,"Der Gesundheitsdienstleister könnte eine Datenschutzverletzung erlitten haben, die die medizinischen Aufzeichnungen im IT-System des Krankenhauses betrifft. Mögliche Ursache ist eine Phishing- oder Malware-Infektion. Es wurden Versuche unternommen, Sicherheitsüberprüfungen erneut durchzuführen und die Antivirensoftware zu aktualisieren, jedoch besteht das Problem weiterhin. Ich benötige Unterstützung bei der Lösung dieses Problems.","Bitte verfassen Sie eine E-Mail, um den möglichen Datenverstoß beim Gesundheitsdienstleister zu bestätigen. Ich verstehe die Dringlichkeit der Angelegenheit und möchte das Thema genauer besprechen. Können Sie bitte weitere Informationen zu den durchgeführten Sicherheitsüberprüfungen, den Aktualisierungen der Antivirensoftware und den bisherigen Maßnahmen bereitstellen? Außerdem wäre es hilfreich, einen Anruf zu vereinbaren, um das Problem zu untersuchen. Wäre ein Termin für einen Anruf zu einer passenden Zeit möglich? Bitte teilen Sie mir eine geeignete Uhrzeit mit.",Incident,Sales and Pre-Sales,low,de,52,Security,Malware,Data Privacy,IT,Safety,,,
Recurring Timeouts During Project Synchronization,"Users have reported frequent timeouts while synchronizing project data, likely due to server overload. Restarting the servers and clearing the cache resolved the problem. The servers are now operational, and data synchronization is functioning normally. If you encounter further issues, please do not hesitate to contact our support team. We apologize for any inconvenience caused and appreciate your patience and understanding. Our team is working diligently to prevent such issues in the future.","<name>, thank you for your email regarding the recurring timeouts during project synchronization. We appreciate the steps you took, such as restarting servers and clearing the cache, to resolve the issue. If the problem persists, please let us know the current status of data synchronization. If necessary, we can schedule a call at <tel_num> to discuss further; kindly inform us of a convenient time for you. Alternatively, you can reach us at <tel_num> to report any issues.",Incident,Customer Service,high,en,52,Performance,Outage,Disruption,Recovery,Server,,,
Data Access Issue,The healthcare provider encountered data access problems impacting medical records within the Dokumentenscanner hospital systems. The issue may be related to a recent Kubernetes update. Attempts to resolve the problem by rebooting the system and rolling back recent patches have been unsuccessful. Immediate support is required to resolve this issue and prevent service interruptions.,"Currently investigating the data access problem affecting the Dokumentenscanner hospital systems, which may have been caused by the recent Kubernetes update. The matter has been escalated to the technical team for urgent assistance. Please provide specific error messages observed during the investigation to facilitate troubleshooting.",Incident,Technical Support,medium,en,52,Security,IT,Disruption,Outage,Recovery,,,
Urgent System Malfunction Noted,"Several essential products experienced failures, affecting data analysis processes. A reboot of the firewall reset was attempted, but problems continue. A possible outage across the entire network system is suspected.","We are currently investigating the reported critical system malfunction. To assist you more effectively, please specify which products failed and include the exact error messages encountered. Could you provide this information at your convenience? You can also call us at <tel_num> to arrange a suitable time for further discussion.",Incident,Service Outages and Maintenance,high,en,52,Bug,Outage,Network,Security,Performance,,,
Technisches Problem melden,"Sehr geehrter Kundenservice, ich möchte ein Problem mit unserer Projektmanagement-SaaS-Plattform melden. Nutzer berichten zeitweise über langsame Reaktionszeiten, die möglicherweise durch kürzliche Spitzen in der Serverauslastung verursacht werden. Wir haben bereits versucht, das Problem zu beheben, indem wir die Server neu gestartet und den Cache geleert haben, jedoch sind die Verbesserungen nur begrenzt. Die verzögerten Reaktionszeiten beeinträchtigen die Produktivität unserer Teams und verschlechtern die allgemeine Benutzererfahrung. Wir würden eine dringende Überprüfung der Angelegenheit schätzen und bitten um eine Lösung zur Behebung des Problems. Bitte lassen Sie uns wissen, falls Sie weitere Informationen benötigen.","Sehr geehrter <Name>, vielen Dank für Ihre E-Mail bezüglich der technischen Schwierigkeiten mit unserer Projektmanagement-SaaS-Plattform. Es tut uns leid zu hören, dass Ihr Team zeitweise langsame Reaktionszeiten erfährt. Wir schätzen die bisher durchgeführten Maßnahmen zur Fehlerbehebung, einschließlich der Serverneustarts und Cache-Leerungen. Um Ihnen weiterhelfen zu können, bitten wir Sie um zusätzliche Details zu den kürzlichen Spitzen in der Serverbelastung, beispielsweise die Häufigkeit und Dauer der Spitzen. Außerdem wäre es hilfreich, die genauen Fehlermeldungen oder Symptome zu kennen, die die Nutzer aktuell erleben. Falls erforderlich, können wir auch einen Telefontermin vereinbaren.",Problem,IT Support,low,de,52,Performance,Outage,Disruption,Recovery,IT,Tech Support,,
Problems with Data Processing Delays,"Customer Support,<br><br>The company faced delays in processing data that impacted investment analysis. The potential cause appears to be software compatibility problems among the listed products. Attempts to resolve the issue included updates and system restarts, but these efforts were unsuccessful.<br><br>We are requesting assistance to determine the underlying cause of the problem and to develop a solution to prevent recurrence. Our team reviewed system logs and identified errors possibly linked to compatibility issues. We would appreciate your help in investigating this further.",Please review the issue; additional information may be required. Kindly let us know a suitable time to schedule a call at <tel_num> to discuss and identify the root cause of the data processing delays.,Incident,Customer Service,medium,en,52,Performance,Disruption,Software,System,Support,,,
Decreased Speed on SaaS Platform,"Customer Support,<br>We are encountering sporadic slowdowns in our scalable SaaS project management system. The problem might be linked to delays in Elasticsearch indexing.<br>Our team has attempted troubleshooting by restarting Elasticsearch nodes and clearing caches, but unfortunately, the issue remains unresolved.<br>We would be grateful for your assistance in resolving this matter.<br>Please inform us if any additional information is required for your investigation.<br>Thank you.","<name>, thank you for reporting the sluggish performance of the SaaS platform. Kindly provide details on the steps taken regarding Elasticsearch indexing delays so far. We are happy to assist in resolving this issue.",Problem,Customer Service,low,en,52,Performance,Outage,Disruption,Troubleshooting,Scalability,,,
Assistance Required for Enhancing HubSpot CRM and WordPress Brand Development,Seeking guidance on how to optimize the integration of HubSpot CRM with WordPress to boost brand growth. Can you suggest strategies to improve our digital footprint?,"Glad to assist in enhancing your HubSpot CRM and WordPress brand expansion. To improve your digital presence, I recommend reviewing your current website and CRM configurations to pinpoint areas for improvement. Consider streamlining your sales and marketing workflows and maintaining consistent data across all platforms. We can also explore strategies such as search engine optimization, content development, and social media integration. To get started, please share details about your existing setup and your specific objectives.",Request,Product Support,medium,en,52,Feature,Documentation,Feedback,Sales,Lead,,,
Security Breach in Hospital System,"The hospital's IT system has experienced a security breach, impacting medical data and device security. It is likely caused by outdated security protocols. Passwords have been reset, and an initial virus scan has been performed to address the issue.","Please confirm receipt of the email regarding the security breach in the hospital system. I understand that outdated security protocols may have contributed to the problem. The measures taken so far, such as resetting passwords and conducting the first virus scan, are a good start. I would like to discuss to ensure that all necessary steps have been taken to prevent future incidents. Would a call be convenient to review the situation in detail and determine the next steps?",Incident,Customer Service,low,de,52,Security,Virus,Outage,Disruption,IT,Tech Support,,
Enhancement of Oracle Database Performance,Upgrade Oracle Database 19c with Git version 2.32,"We have received your request to improve the performance of Oracle Database 19c with Git 2.32. The updates have been carried out and notifications sent upon completion. If you have any specific questions or concerns, please inform us so we can assist you further.",Change,Sales and Pre-Sales,low,en,52,Performance,Database,Enhancement,Oracle,,,,
Breach of Data in Hospital Systems,"A potential data breach has been identified, affecting sensitive medical information stored within the hospital's IT infrastructure. The breach is likely due to inadequate cybersecurity measures and outdated software. Initial steps have been taken, but the breach persists.",Report the incident to the cybersecurity team for immediate investigation and resolution.,Problem,Product Support,high,de,52,Security,Data Breach,Hospital,Infrastructure,Cybersecurity,Software,Outdated Software,
Multiple Tools Experiencing Malfunctions,"Customer Support, reporting issues with several SaaS project management applications malfunctioning. Affected platforms include Smart-Türklingel, DocuSign, VLC, Hadoop, PDFfiller, Laravel, and Cisco IOS. The problems began following recent software updates. Attempts to resolve the issues by restarting devices, checking network connectivity, and rolling back recent changes have been unsuccessful. We suspect that the root cause is related to the recent updates. Your assistance would be highly valued.","<name>, thank you for contacting us regarding the issues with multiple SaaS project management tools. We regret to hear that the problems started after recent software updates. Despite efforts such as restarting systems, verifying network connections, and reverting recent changes, the issues persist. We are eager to investigate this matter further and provide a solution promptly. Could you please share specific details about the errors or symptoms you're experiencing, including error messages or screenshots? Additionally,",Incident,Product Support,high,en,52,Bug,Performance,Network,Disruption,Recovery,,,
Enhancement of Product Integration,"We are reaching out to request an update on the integration compatibility across multiple products within our scalable SaaS project management platform. Currently, we are facing performance challenges due to the lack of seamless integration between various tools. We would appreciate it if the team could examine this issue and propose solutions to improve the platform's performance. This would likely involve updating APIs to ensure compatibility among the products. We believe that such an update would significantly benefit our business by enabling better functionality.",I have received your request to enhance product integration within the SaaS project management platform. Please contact <tel_num> to discuss and provide a timeline for the update.,Change,Product Support,high,en,52,Product,Integration,Performance,API,Scalability,Enhancement,,
Brand Support,Can you share information about the digital strategies employed by the agency to boost brand development?,Will call soon,Request,Product Support,low,en,52,Feedback,Brand,Support,Development,,,,
Anfrage bezüglich intermittierender Synchronisationsprobleme in unserem Projektmanagement-Tool,"Sehr geehrter Kundenservice, ich möchte ein Problem mit unserer Projektmanagement-Software melden. Wir erleben sporadische Synchronisationsfehler, die vermutlich auf Serverüberlastungen während der Stoßzeiten zurückzuführen sind. Trotz Neustarts und Cache-Lösungen besteht das Problem weiterhin. Es wurde beobachtet, dass die Fehler häufiger während der Spitzenzeiten auftreten, was auf eine mögliche Verbindung zur Serverauslastung hindeutet. Wir bitten um Unterstützung bei der Lösung dieses Problems, da unsere Teamproduktivität dadurch beeinträchtigt wird. Bitte informieren Sie uns über die nächsten Schritte zur Fehlerbehebung und ob es sich um ein bekanntes Problem handelt, das bereits in Bearbeitung ist.","Wir haben die Meldung der intermittierenden Synchronisationsfehler in unserem Projektmanagement-Tool erhalten. Das Problem wird untersucht. Bitte kontaktieren Sie <tel_num> für weitere Details. Wir werden die nächsten Schritte zur Fehlerbehebung besprechen und mögliche Lösungen prüfen, um das Problem so schnell wie möglich zu beheben.",Problem,Product Support,low,de,52,Bug,Performance,Outage,Disruption,Recovery,Network,,
Medizinische Daten-Sicherheit,"Sind detaillierte Sicherheitsrichtlinien zur Verfügung gestellt, um den Schutz medizinischer Daten, IT-Lösungen und -dienstleistungen eines Krankenhauses sicherzustellen? Wie werden Patientenvertraulichkeit und Einhaltung der Vorschriften gewährleistet? Bitte geben Sie Informationen zu Datenverschlüsselung, Zugriffskontrollen und Vorschriften zur Mitteilung von Verletzungen an.","Wir nehmen Medizinische Daten-Sicherheit sehr ernst. Unsere Krankenhausauftrags-IT-Lösungen umfassen Datenverschlüsselung, Zugriffskontrolle, Vorschriften zur Mitteilung von Verletzungen sowie die Gewährleistung von Patientenvertraulichkeit und Einhaltung der Vorschriften. Sie können detaillierte Sicherheitsrichtlinien erhalten. Falls Sie spezielle Fragen zur Sicherheit haben, freue ich mich, diese besprechen zu können.",Request,Product Support,high,de,52,Security,Data Protection,Privacy,IT,Compliance,Encryption,Access Control,
Access to Medical Records,"Customer support reports an issue with accessing medical data from a healthcare provider. The hospital's system is malfunctioning due to incorrect permission settings. Attempts to reset user roles and verify access logs have been unsuccessful. The problem continues, and immediate assistance is needed to resolve it. The team has tried multiple troubleshooting methods and seeks expert advice to determine the underlying cause and apply an effective solution. Kindly assist us in resolving this matter.","We have received an email regarding the hospital's medical data access problem. We are investigating the issue as a priority. Please anticipate a call at <tel_num> to discuss and identify the root cause, as well as to implement an appropriate resolution.",Problem,Product Support,low,en,52,Security,Access,IT,Tech Support,,,,
Digital Campaigns Achieving Anticipated Engagement Outcomes,"Customer Support, composing a report on the marketing agency's digital campaigns aimed at brand development, which are producing the expected engagement. Despite previous basic troubleshooting efforts, the issue remains unresolved. Potential reasons may include technical problems or misalignment of strategies. We would appreciate it if you could examine the matter and offer a detailed analysis of the problem. Kindly suggest possible solutions to enhance the campaign's effectiveness. We look forward to your prompt response. Thank you for your time.","We received your email regarding digital campaigns achieving the expected engagement results. We will review the matter and provide a comprehensive analysis. To assist you more effectively, a phone call may be necessary at <tel_num> to discuss further. Please let us know a convenient time for a call, so we can identify the root cause and recommend potential solutions.",Incident,Service Outages and Maintenance,high,en,52,Feedback,Marketing,Digital Campaigns,Engagement,Technical Problem,,,
App Crashes and Performance Issues,"Wir erleben häufige Abstürze und eine langsame Reaktionszeit unserer SaaS-Projektmanagement-Anwendung. Das Problem trat kürzlich nach einem Multi-Produkt-Update auf, das möglicherweise Konflikte verursacht hat. Wir haben versucht, das Problem durch das Löschen des Caches, einen Neustart des Servers und das Zurücksetzen partieller Updates zu beheben, was teilweise erfolgreich war. Die Leistung der Anwendung ist jedoch erheblich beeinträchtigt, was den Arbeitsablauf stört. Wir schätzen, dass dieses Problem dringend untersucht werden muss, um eine Lösung und Behebung zu ermöglichen. Bitte informieren Sie uns, falls weitere Systeminformationen benötigt werden.","Sie haben eine E-Mail bezüglich Abstürzen und langsamer Leistung unserer SaaS-Projektmanagement-App erhalten. Wir werden das Anliegen umgehend prüfen. Um Ihnen weiterhelfen zu können, bitten wir Sie, die genauen Fehlermeldungen bereitzustellen, Ihre Kontonummer zu bestätigen sowie Kontaktinformationen anzugeben. Wir werden diese Daten prüfen und ggf. einen Anruf vereinbaren, um eine Lösung zu besprechen.",Incident,Technical Support,high,de,52,Crash,Performance,IT,Tech Support,,,,
Enhancement of Investment Strategies Using Data Analytics Tools,Could you provide comprehensive documentation and best practices for Data Analytics Tools? We aim to improve our investment strategy tools.,"<name>, we appreciate your interest in optimizing investment strategies with Data Analytics Tools. Providing detailed documentation and best practices will help support your objectives. Please allow us to arrange a consultation tailored to your needs and offer personalized guidance. Is a call at <tel_num> at your preferred time convenient? Kindly let us know; we are happy to assist at <acc_num>.",Request,Technical Support,high,de,52,Feature,Documentation,Feedback,,,,,
Absicherung der Abrechnungsmöglichkeiten für medizinische Daten,Bitte stellen Sie eine Anleitung für die Abrechnungsoptionen bereit.,"Sehr geehrter Kunde, vielen Dank, dass Sie uns bezüglich der Absicherung der Abrechnungsoptionen für medizinische Daten kontaktiert haben. Wir bieten verschiedene Abrechnungsmodelle an, um die Sicherheit Ihrer medizinischen Daten zu gewährleisten. Gerne erläutern wir die Details der Optionen in einem persönlichen Gespräch; vereinbaren Sie dazu einen Termin. Teilen Sie uns bitte eine passende Zeit mit, damit wir Sie unter <tel_num> anrufen können. Alternativ können wir Ihnen einen sicheren Link zusenden, um die Optionen zu überprüfen. Für die Prüfung Ihres Kontos benötigen wir die <acc_num>, um die besten verfügbaren Optionen für Sie zu ermitteln.",Request,Billing and Payments,high,de,52,Security,Documentation,,,,,,
Healthcare Data Access Problem,Encountered data access problems in several systems.,We are pleased to assist with your healthcare data access issue. Please provide details on the specific issues and the systems affected.,Incident,Product Support,low,en,52,Security,IT,Tech Support,,,,,
