subject,body,answer,type,queue,priority,language,version,tag_1,tag_2,tag_3,tag_4,tag_5,tag_6,tag_7,tag_8
Issue with Marketing-Campaign-Database,Deployment of Marketing-Campaign-Database is failing.,"Investigate the issue with Marketing-Campaign-Database. The deployment is failing. Could you please provide more details such as the error message, steps taken, and the context of the failure? This will help me understand the problem better and offer a solution. Please call if further information is needed. Kindly specify an appropriate time for the call.",Incident,Technical Support,high,de,400,Feature,IT,Tech Support,,,,,
,"Customer Support team, facing recurring downtime issues with the project management software, which is disrupting workflow deadlines. It might be due to server load configuration problems. Steps already taken include optimizing current server settings and monitoring usage patterns, but without success. Would greatly appreciate a thorough investigation and a proposed solution to reduce downtime and ensure a smooth workflow.","<name>, we are looking into the recurring downtime issues with the project management software. We would like to discuss and determine the root cause to provide a solution that minimizes downtime. Please let us know if you are available to call at <tel_num> to discuss this matter with our team.",Problem,Customer Service,high,en,400,Outage,Performance,IT,Tech Support,,,,
Query on Integrating TensorFlow Project Management Software,"Dear Customer Support, I am interested in integrating TensorFlow into our project management software. Could you provide detailed information, including any available guides or tutorials? I would greatly appreciate any information to help me get started, as well as an understanding of the potential benefits and limitations of using TensorFlow software. Thank you for your assistance. I look forward to hearing from you soon.","We appreciate your interest in integrating TensorFlow into your project management software. Integrating TensorFlow allows users to leverage machine learning capabilities to enhance their project management experience. To get started, we recommend checking our online guides and tutorials, which provide step-by-step instructions for setting up and utilizing the integration. Relevant resources can be found in the support section of our website. The benefits of using TensorFlow software include enhanced predictive analytics and automated task management.",Request,Returns and Exchanges,medium,en,400,Feature,Documentation,Feedback,IT,Tech Support,,,
,Enhance project tracking with a more user-friendly dashboard for our SaaS platform.,"'<name>' values the suggestion to improve the project tracking user-friendly dashboard for our SaaS platform. We recognize the importance of a dashboard that offers a clear and concise overview of project progress and key metrics. Our development team is currently working on enhancing the platform's features, and your input is highly valuable to us. We would like to discuss your ideas and explore how they can benefit our users. Could you please provide more details on the specific features and functionalities you envision for the dashboard?",Change,Customer Service,low,en,400,Feature,Feedback,Documentation,IT,,,,
Issue with Service Interruption in SaaS Platform Today,"Encountered a service interruption. Services were restarted, and logs were reviewed.","Dear [name], thank you for reporting the service interruption in the SaaS platform today. Initial steps have been taken to restart the services and review the logs. If the issue continues, please provide any logs, error messages, and analysis to assist in resolving the problem.",Incident,Service Outages and Maintenance,high,en,400,Outage,Disruption,Recovery,IT,Tech Support,,,
Unterstützung bei der Optimierung von Investitionen,"Die Finanzfirma muss Datenanalysewerkzeuge nutzen, um data-getriebene Entscheidungen zu treffen. Wie kann ich helfen, Optimierung von Investitionen zu erreichen?","Ich freue mich, Ihnen bei der Optimierung von Investitionen mit Datenanalysewerkzeugen zu helfen und dabei data-getriebenen Entscheidungsfindung unterstützen. Könnten Sie bitte mehr Informationen über die aktuellen Werkzeuge und Herausforderungen liefern? Wir können einen Termin für eine Besprechung vereinbaren, um mögliche Lösungen für Ihre Finanzfirma zu erarbeiten.",Request,Billing and Payments,low,de,400,Feedback,Product,Feature,IT,,,,
Problem mit dem Systemausfall,"Liebe Kundenservice, unerwarteter Systemausfall ist während der Datenanalyse aufgetreten. Wir haben versucht, das System neu zu starten und nach Softwareupdates zu suchen, jedoch bestehen die Probleme leider weiterhin. Der Ausfall führte zu einem beträchtlichen Datenverlust und unangemessenen Anhaltzeiten. Wir bitten um Unterstützung bei der Lösung des Problems, um zukünftige Vorkommen zu vermeiden und Unterbrechungen unserer Betriebsaktivitäten zu minimieren. Bitte geben Sie die nächsten Schritte zur Problembehebung und -lösung an.","Liebe [Name], wir entschuldigen uns für den Systemausfall, den Sie während der Nutzung unserer Dienste erlebt haben. Wir danken Ihnen für Ihre Aufmerksamkeit. Um das Problem zu lösen, möchten wir eine Konferenz einrichten, um den besten Lösungsansatz zu ermitteln. Bitte geben Sie ein geeignetes Zeitfenster für die Konferenz an, und rufen Sie uns unter [Telefonnummer] an, um die Probleme schnell zu beheben und zu lösen.",Incident,Technical Support,medium,de,400,Outage,Disruption,Recovery,Performance,Bug,Tech Support,,
Secure Access to Medical Data,Is it possible to supply details on securing access to medical data for a Joomla-based hospital setup? It's important to ensure compliance with regulations to protect patient information. Kindly offer advice on securing medical data.,"Offer general guidance on securing access to medical data for a Joomla setup, please contact us at <tel_num> for a consultation to discuss specific compliance requirements for your hospital setup and patient information protection.",Request,Customer Service,medium,en,400,Security,Compliance,IT,Tech Support,,,,
Data Security Measures for Healthcare Providers,"I am reaching out to inquire about the data security solutions offered to healthcare providers and hospital systems. Could you please provide information on the measures in place to protect sensitive patient data? I would appreciate it if you could share relevant case studies or testimonials from previous clients in the healthcare industry. Additionally, could you let me know about the compliance with industry standards and regulations, such as HIPAA? I look forward to hearing back from you soon.","We appreciate your inquiry regarding data security solutions for healthcare providers. We offer robust measures to protect sensitive patient data that are compliant with industry standards and regulations, including HIPAA. We would be happy to provide you with more information and can arrange a call at your convenience to discuss the details and how our services can benefit your organization.",Request,General Inquiry,low,en,400,Security,Documentation,Feedback,IT,Tech Support,,,
Service Disruptions,"Encountered service interruptions across various products, specifically the Smart-Thermostat Polk Audio Signa S2, following the latest software update.","Dear [name], we are sorry to hear that you are experiencing service disruptions due to the recent software update. Could you please provide more details about the issues you are facing with the Smart-Thermostat Polk Audio Signa S2? We would be happy to troubleshoot or escalate the issue to our technical team for further assistance. We are available to discuss this further at your convenience over a call.",Incident,Technical Support,medium,en,400,Disruption,Outage,Performance,Maintenance,Product,Feature,,
Solutions for Data Analytics and Investment Optimization,"Dear Customer Service Department,<br>I am writing to inquire about data analysis solutions for investment optimization. Could you please provide more information on the analytical tools offered and how they can assist in making sound investment decisions? I am particularly interested in learning about the predictive modeling capabilities that can be utilized to identify market trends and patterns. Additionally, I would like to know more about data visualization tools that can help in presenting complex data in a concise and clear manner. I am also interested in customer service training options to ensure that I have the necessary skills.",We will provide information on data analysis solutions and discuss predictive modeling and data visualization tools. Please call us at <tel_num> to arrange a meeting to address your questions regarding customer service training options.,Request,Product Support,high,de,400,Feedback,Product,Feature,IT,Tech Support,,,
Unvereinbare Kosten für Datenanalyse identifiziert,Die Kosten für Datenanalyse sind unvereinbar,Sie haben eine E-Mail über unvereinbare Datenanalyse-Kosten erhalten. Bitte geben Sie weitere Details für eine umfassendere Unterstützung an.,Problem,Product Support,high,de,400,Bug,Performance,Documentation,Feedback,,,,
Inquiry About Customization Options for SaaS Project Management Features,"Could you provide details on the customization options available for the SaaS project management features? I am interested in learning how the platform can be tailored to meet our specific needs. Please provide information on the available features, limitations, and any constraints.","Dear [Name], thank you for your interest in our SaaS project management platform. We offer a range of features including task management, reporting, and collaboration tools, which are highly customizable to meet specific business needs. I would be happy to discuss the available features, limitations, and any constraints in more detail. Please provide information on your specific requirements so we can schedule a call at [Tel Number] to discuss and provide a personalized demo using [Account Number] for more details.",Request,Human Resources,low,en,400,Feature,Documentation,Feedback,Sales,Tech Support,,,
Integration Guide for Steinberg Cubase 11 SaaS,"Customer Support, seeking detailed guidance on integrating Steinberg Cubase 11 SaaS into our project management solution. Could you provide a comprehensive documentation resource that outlines the necessary steps for integration? Also, it would be helpful if you could detail the supported features, potential limitations, and specific system requirements that must be met. Additionally, any information that could assist in troubleshooting common issues that may arise during the integration process would be greatly appreciated. Looking forward to your response as we explore this solution.","Providing detailed documentation for integrating Steinberg Cubase 11 SaaS, including a list of supported features, limitations, system requirements, and guidance to ensure a smooth integration process.",Request,Technical Support,high,en,400,Documentation,Feature,Feedback,Tech Support,,,,
,"Dear Customer Support, I am inquiring about optimizing investment strategies using data analytics products and services. Could you provide insights and leverage the tools to make informed decisions? I would greatly appreciate your guidance on best practices for implementing data analytics in investment strategies. Additionally, could you inform me about the available products and services that can assist in this process? Thank you for your time and assistance. I look forward to hearing from you soon.","<name>, thank you for your inquiry regarding the optimization of investment strategies using data analytics products and services. Our team is prepared to provide guidance and best practices, utilizing the available tools to help you make informed decisions. Please contact <tel_num> to discuss and explore suitable options that meet your needs.",Request,Billing and Payments,high,en,400,Feedback,Product,Feature,Documentation,,,,
Issues with Marketing-Dashboards,"The Marketing-Dashboard is displaying real-time analyses due to a system update, which has caused a problem.","Dear <name>, thank you for reporting the issue with the Marketing-Dashboards. We will investigate the problem caused by the system update and request additional information. I will get in touch as soon as a solution is found.",Incident,Technical Support,medium,de,400,Bug,Performance,Outage,IT,Tech Support,,,
Issue with Unauthorized Access to Medical Data in Hospital IT Systems,"We have detected an unauthorized access incident involving medical data within our hospital's IT systems. Outdated security protocols and software vulnerabilities might be the cause. Although we have strengthened firewall settings and updated antivirus software, the issue persists. We need your assistance to resolve the incident and prevent future occurrences.","Email subject: Unauthorized Access to Medical Data in Hospital IT Systems. I understand that you have already taken steps to strengthen firewall settings and update antivirus software, but the issue persists. To better assist you, I would like to request more information about the incident, such as the date, time it occurred, and any error messages you received. Let's schedule a call to discuss the best approach to resolve this issue and prevent future occurrences.",Incident,Customer Service,medium,de,400,Security,Bug,Network,Virus,IT,Tech Support,,
Enquiry on SaaS Project Management Tool,Inquiring about the pricing tiers and billing options for the SaaS project management tool. Could you provide information on the different plans and the features they include? I would greatly appreciate a detailed explanation of the billing process and any discounts that may be available with long-term commitments. This information would help in making an informed decision about whether to use the tool for project management needs.,"Dear customer, thank you for your inquiry regarding the SaaS project management tool. We offer several pricing tiers that vary in features to suit different needs. The plans include basic, premium, and enterprise options, which include features like task management, team collaboration, and reporting. We offer both monthly and annual billing options, and discounts are available for long-term commitments. I would be happy to provide detailed information and answer any questions you may have. I would also be available for a call at your convenience.",Request,Billing and Payments,medium,en,400,Billing,Payment,Feature,Feedback,Sales,,,
Support Needed for Google Translate Integration Issues,Users are facing difficulties with the Google Translate integration following recent API modifications. Reverting the updates resolves the problem.,"Understood that users are encountering issues with the Google Translate integration due to recent API changes, and reverting the updates resolves the issue. We would like to investigate further. Please provide details of the error messages and the steps you have taken so far. Knowing your account number, <acc_num>, is crucial for addressing the issue. If you need to discuss this further, please call us at <tel_num>.",Incident,Technical Support,high,en,400,Bug,Performance,Feature,Tech Support,,,,
Request for Updating the Marketing Agency's Digital Strategy,"Customer Support, requesting an update on the digital strategy of the marketing agency. The current strategy is yielding the desired results, but service outages are impacting brand growth. I believe a revised strategy would help us better reach our target audience and improve our overall brand presence. I would appreciate it if you could review the matter and provide a plan for updating the digital strategy. This should include an analysis of the current strategy, identification of areas for improvement, and an assessment of the current challenges and objectives.","Dear [Name], thank you for your email regarding the update to the marketing agency's digital strategy. We understand the importance of an effective digital strategy in achieving your brand growth goals. We would be happy to assist in reviewing the current strategy and providing recommendations for improvement. To better understand the current challenges and objectives, could you please provide more information on the service outages and the desired results you are aiming to achieve? This will enable us to provide a tailored plan for updating the digital strategy.",Change,Service Outages and Maintenance,high,en,400,Feedback,Marketing,Outage,Performance,Documentation,,,
Probleme mit Software-Fehlern,"Es werden Software-Fehler in mehreren Anwendungen beobachtet. Neueste Aktualisierungen könnten möglicherweise Kompatibilitätsprobleme verursachen. Es wurde versucht, die Software neu zu installieren, was jedoch keinen Erfolg gebracht hat. Weitere Unterstützung ist erforderlich, um das Problem zu lösen.","Um Ihnen besser zu helfen, möchte ich die Software-Fehler untersuchen. Bitte geben Sie mir mehr Informationen über die betroffenen Anwendungen und Aktualisierungen. Könnten Sie mir Details zu den recenten Aktualisierungen des betroffenen Geräts bereitstellen? Wir können ein Gespräch planen, um das Problem zu diagnostizieren und eine Lösung zu finden.",Incident,Technical Support,high,de,400,Bug,Performance,Feature,IT,Tech Support,,,
Query Regarding Billing Inconsistency Support,Encountered a billing inconsistency affecting the subscription for multiple software tools. This might have resulted from processing errors at the end. Efforts to contact support through email have not yielded a response yet. I would greatly appreciate any investigation into this matter and a prompt resolution if possible.,We will review the billing inconsistency and work towards resolving it. Please contact <tel_num> for assistance and verification of <acc_num>.,Incident,Billing and Payments,low,en,400,Billing,Payment,Support,Feedback,Investigation,Performance,,
Request for Billing Adjustment for Marketing Services,"I am writing to request a billing adjustment for marketing services related to digital strategies and brand growth initiatives. The services provided did not meet our expectations, and we believe an adjustment is necessary. We would greatly appreciate it if you could review our account and make the necessary adjustments as soon as possible. Please let us know if you need any additional information to facilitate this request.",We will review account <acc_num> to assess the marketing services provided and determine if a billing adjustment is warranted. Please allow us to investigate and we will get back to you soon with an update.,Change,Billing and Payments,medium,en,400,Billing,Account,Feedback,Sales,,,,
Unerwarteter Dienstausfall hat Datenerstenzeitsysteme beeinträchtigt,aufgrund Netzwerkschäden werden Sie Zugriffsprobleme erleben.,"Sehr geehrte [name], es tut uns leid, dass der unerwartete Dienstausfall die Betriebsysteme für Datenerstellung beeinträchtigt hat und Sie Zugriffsprobleme erlebt haben. Das Team ist sich bewusst, dass diese Situation unangenehm sein kann, und arbeitet dringend daran, die Netzwerkschäden so schnell wie möglich zu beheben. In der Zwischenzeit empfehlen wir Ihnen, die Dienststatusseite zu überprüfen, um den Fortschritt der Reparatur zu überwachen. Sollten kritische Aufgaben vorliegen, die sofortige Aufmerksamkeit erfordern, melden Sie dies bitte. Wir tun unser Bestes, um eine alternative Lösung zu bieten und die Fehler zu untersuchen, um zukünftig den Datenerstenzeitsystemen Sicherheit zu gewährleisten.",Incident,Service Outages and Maintenance,high,de,400,Outage,Network,Disruption,Recovery,IT,Tech Support,,
Steigerung der digitalen Markenwahrnehmung,"Sehr geehrte Kundensupport, ich würde gerne nachfragen, welche digitalen Strategien zur Steigerung der Markenwahrnehmung für Produkte angeboten werden. Könnten Sie bitte mehr Informationen über die angebotenen Dienstleistungen und deren Vorteile für Unternehmen bereitstellen? Es würde mich freuen, zu erfahren, wie Ihr Ansatz von anderen unterscheidet. Ich freue mich darauf, die Möglichkeit zu diskutieren, wie wir Online-Sichtbarkeit verbessern können.","Sehr geehrte [Name], vielen Dank für Ihre Anfrage zu unseren digitalen Strategien zur Steigerung der Markenwahrnehmung. Wir bieten individuelle Dienstleistungen zur Förderung der Online-Präsenz an. Es freut uns, darüber zu sprechen, wie unsere Herangehensweise Vorteile für Ihr Unternehmen haben kann. Bitte teilen Sie uns ein geeignetes Termindatum mit, unter [Tel-Nummer] per E-Mail.",Request,Product Support,medium,de,400,Feedback,Sales,Product,Feature,,,,
,"Dear Customer Support, please address the issue with the marketing agency's digital strategy, which is causing inconsistencies in brand messaging. Despite our efforts to resolve it by reviewing campaigns, realigning team resources, and optimizing content, the problem continues. These inconsistencies might be due to misalignment in the tools used across different digital platforms. I would greatly appreciate if you could look into this matter and provide a solution to ensure consistent brand messaging across all platforms.",We will investigate the digital strategy inconsistencies affecting brand messaging and review potential misalignments in the tools used across platforms. Please allow us to contact you at a convenient time to discuss this further.,Incident,Product Support,medium,en,400,Feedback,Performance,Documentation,IT,Tech Support,,,
Problems with Network Devices,A financial company is facing connectivity issues with several of its products. Efforts to resolve the issue have included restarting the switch and checking network configurations.,Please investigate the connectivity issues with the network devices. Provide details on the affected products and configurations to assist us.,Incident,Technical Support,high,en,400,Network,Performance,IT,Tech Support,,,,
,Seeking information on methods to secure medical data in hospital systems. Interested in learning about the strategies your company employs to protect sensitive information.,"We can provide robust solutions for securing medical data in hospital systems, including encryption, firewalls, and access controls. Our company places a high priority on protecting sensitive information. We would be happy to discuss these measures with you; please let us know a convenient time for a call to provide further details and answer any questions you may have regarding security measures.",Request,Technical Support,medium,en,400,Feedback,IT,Tech Support,Security,,,,
Exploring Digital Strategies for Brand Growth and Online Development,"Customer Support, seeking clarification on digital strategies to boost brand growth. Could you offer details on methods and techniques to enhance brand awareness and engagement? I am particularly interested in learning about the approach to social media marketing, content creation, and influencer partnerships. Additionally, I would like to know about analytics and measurement tools to track the success of digital campaigns. Thank you for your time and assistance. Looking forward to your response. Best regards.",We will review your inquiry and provide information on digital strategies and methods for brand growth development online soon.,Request,Returns and Exchanges,medium,en,400,Feedback,Sales,IT,Tech Support,,,,
,"Wenden Sie sich an uns, um Informationen zu Personalisierungsoptionen für unsere Projektmanagement-Software-as-a-Service-Plattform zu erhalten. Es wäre sehr hilfreich, wenn Sie mehr über die verfügbaren Personalisierungsmöglichkeiten erläutern könnten. Detaillierte Beschreibung der Prozesse und Verfahren, die Anfragen für Personalisierungen sowie die eventuellen Kosten zu präsentieren, würde mir helfen, ein besseres Verständnis davon zu entwickeln, wie die Plattform auf spezifische Anforderungen angepasst werden kann. Ich bedanke mich für Ihre Unterstützung und freue mich auf Ihre baldige Rückmeldung.","Unsere Projektmanagement-Software-as-a-Service-Plattform bietet verschiedene Personalisierungsoptionen an, um spezifische Anforderungen zu erfüllen. Personalisierungen umfassen anpassbare Arbeitsabläufe, benutzerdefinierte Felder und die Integration mit Drittanbietern. Wenn Sie eine Anfrage für Personalisierungen stellen möchten, kontaktieren Sie bitte unser Unterstützungsteam, um Ihre Anforderungen zu besprechen. Nach Prüfung der Anfrage wird eine Kalkulation der erforderlichen Arbeit erstellt und Ihnen vorgelegt. Die Kosten variieren je nach der Komplexität der Personalisierung. Wir setzen uns mit Ihnen auseinander, um Ihre Anforderungen zu verstehen und eine Lösung anzubieten, die Ihr Budget einhält. Das Team wird Ihnen gerne detaillierte Informationen zu Ihren Anforderungen zukommen lassen.",Request,Product Support,high,de,400,Feature,Documentation,Feedback,IT,Tech Support,,,
Concerning Service Interruption,"Experiencing a Service Failure, multiple software integrations are affected, disrupting project management processes. Following the recent software update, server issues have arisen. Tried restarting the applications and clearing the cache, but the problem persists. Would greatly appreciate a prompt investigation and estimated time for a solution. Please notify if further information is needed to facilitate the investigation.","Received your email regarding the service interruption, noting that several software integrations are impacted. We will urgently investigate this. To assist with our examination, could you please provide more details and precise error messages from the recent software update? We will contact you shortly to discuss further.",Problem,Service Outages and Maintenance,low,de,400,Outage,Disruption,Performance,IT,Tech Support,,,
