subject,body,answer,type,queue,priority,language,version,tag_1,tag_2,tag_3,tag_4,tag_5,tag_6,tag_7,tag_8
QuickBooks Assistance,"Customer Support team, I am reaching out to inquire about integrating QuickBooks data analytics tools to enhance investment tracking. Could you provide guidance on the tools to use and the steps to achieve seamless integration? I would also appreciate any recommendations or resources to help me get started. My goal is to streamline financial monitoring and make well-informed investment decisions. Thank you for your time and assistance. I look forward to your response.","<name>, thank you for contacting the Service Desk. To integrate QuickBooks data analytics tools, we suggest exploring our approved list of third-party applications. To begin, please visit our website to see the compatible tools. If you need further assistance, kindly provide <acc_num> and a convenient time to call <tel_num> so we can discuss your specific requirements and guide you through the integration process. We are happy to assist you in optimizing your investment tracking.",Request,Technical Support,high,en,52,Account,Support,Feature,Feedback,IT,,,
Request for Assistance with Data Latency Issues,The organization has encountered delays in data processing affecting investment evaluations. The delays may be due to problems with system integration. Efforts to reset data pipelines have been made. Urgent support is required to address the problem promptly to avoid interference with investment analysis.,Seeking support for data latency challenges within the organization. Review system integration and data pipelines to identify the root cause. Contact <tel_num> to discuss scheduling a resolution and please be available to determine subsequent actions to prevent disruptions in investment evaluations.,Problem,Technical Support,high,en,52,Performance,Disruption,IT,Tech Support,,,,
Support Request for SaaS Platform,"Customer Support: Reporting an issue with report generation on our scalable SaaS project management platform. Users have encountered sporadic outages, which we suspect are due to server overload during peak times. Our team has attempted to troubleshoot by restarting servers and modifying load balancing settings, but the problem persists. Despite our efforts, the outages continue, affecting user productivity. We would be grateful if you could help us resolve this issue promptly. Thank you.","<name>, thank you for reporting the issue with our SaaS project management platform. We apologize for the inconvenience caused by the intermittent outages. To assist you better, could you please provide details about your server configuration and load balancing settings? Additionally, please share the troubleshooting steps you have already taken. If necessary, we can arrange a call at <tel_num> to discuss and explore potential solutions to resolve the issue as quickly as possible.",Incident,Customer Service,medium,en,52,Outage,Disruption,Performance,Server,Support,SaaS,Scalability,
Client Assistance,Revise branding and digital marketing plan to strengthen online visibility,examine contact details and talk about needs promptly,Change,IT Support,high,en,52,Feedback,Marketing,Digital Marketing,Online Visibility,Client Support,,,
Inquiry About Digital Marketing Strategies for Electronics Products,Could you provide marketing strategies for DSLR cameras and smart thermostats?,"Dear Customer, thank you for your email regarding digital marketing strategies for electronics products. We would be happy to assist with strategies for DSLR cameras and smart thermostats. For DSLR cameras, consider implementing social media campaigns targeting photography enthusiasts and influencers. For smart thermostats, focus on promoting energy efficiency and smart home automation. Additionally, we offer search engine optimization and pay-per-click advertising services to enhance online visibility and boost sales. Please let us know if you'd like to discuss these strategies in more detail.",Request,Customer Service,low,en,52,Marketing,Electronics,Strategy,Product,,,,
Assistenz bei Integrationen,Könnten Sie bitte die Richtlinien für die Integration bereitstellen?,"Sehr geehrter <name>, vielen Dank für Ihre Kontaktaufnahme mit dem Service-Desk. Wir stellen Ihnen die Integrationsrichtlinien gerne zur Verfügung. Bitte teilen Sie uns mit, welche Art der Integration Sie suchen, damit wir die entsprechenden Dokumentationen zusenden können. Zusätzlich können Sie die allgemeine Integrationsinformationen auf unserer Webseite einsehen. Falls Sie weitere Unterstützung benötigen, rufen Sie uns gern unter <tel_num> an, um die Angelegenheit zu besprechen.",Request,Customer Service,medium,de,52,Feature,Documentation,IT,Tech Support,,,,
Security Breach in Medical Data,"A security breach involving medical data has affected hospital systems, probably due to vulnerabilities in outdated software. Although initial scans and patches have been implemented, the problem remains unresolved. Further investigation is required to identify and fix the issue.","We are reviewing the reported security breach concerning medical data at the hospital. An investigation will be conducted to resolve the problem, and a call will be scheduled with the team to discuss the applied patches and the current system status. Please inform us of a suitable time for the call. Additionally, kindly confirm the current versions of the software patches that have been installed for review.",Incident,Returns and Exchanges,low,en,52,Security,IT,Vulnerability,Outage,Investigation,,,
Digital Marketing Techniques,"Customer support team, aiming to connect about digital marketing methods to boost brand development and technology product markets. Could you share detailed strategies to increase brand awareness and engagement within the sector? We would appreciate insights into approaches such as social media campaigns, content development, and advertising. This will help us better understand how to effectively promote technology products and reach our target audience. Thank you for your time and assistance. We look forward to your response.","<name>, thank you for your email regarding digital marketing techniques for technology product markets. Our team employs a mix of social media marketing, content creation, and targeted advertising to support brand growth. We can provide detailed information and guidance on these approaches to help promote technology products effectively. To better understand your specific requirements, please let us know a convenient time for a call at <tel_num>. Alternatively, suggest a suitable time for a discussion, and we will be happy to assist.",Request,Sales and Pre-Sales,low,en,52,Feedback,Marketing,Strategy,Social Media,Customer Support,Brand Development,,
System Timeout Problems,"Dear Customer Support, I am reporting an issue with the system during peak times. Users are frequently experiencing timeouts, which we suspect are caused by inadequate server capacity. Restarting the servers offers only a temporary fix; we need a permanent solution. We have attempted to optimize resource allocation, but the problem remains. We would appreciate it if you could investigate this matter and help us find a lasting fix as soon as possible. The issue is causing disruptions.",We have received your email regarding the system timeout problem. Please provide a contact number so we can call and discuss the issue further to find a prompt resolution.,Problem,Technical Support,high,en,52,Performance,Outage,Disruption,Recovery,IT,Tech Support,,
Request for Assistance with Microsoft SQL Server 2019 SaaS Project Management Integration,Seeking guidance on how to integrate the Microsoft SQL Server 2019 SaaS project management platform. Can you supply comprehensive documentation outlining the setup procedures? I would appreciate any best practices or helpful tips you can share.,Please provide the documentation for integrating the Microsoft SQL Server 2019 platform. Kindly send a detailed guide; I would prefer a call to walk through the setup process at your convenience.,Request,Technical Support,high,en,52,Documentation,IT,Tech Support,,,,,
,"Reporting problems with data analytics software crashing at a financial organization, affecting investment optimization. The crashes appear to result from software conflicts across various products. Despite efforts to fix the issue by reinstalling PyCharm and updating the affected applications, the problem continues. Your help in identifying the underlying cause of the crashes and finding a solution to prevent future occurrences would be highly valued. Please inform us if additional details are required to proceed.","Acknowledged receipt of the report regarding data analytics tool crashes at the financial firm. To assist with troubleshooting, we need to know the specific error messages and the versions of the software applications in use. Could you please provide this information? Additionally, we are available for a call at your convenience to discuss the matter further and move forward with resolving the issue.",Incident,Product Support,medium,en,52,Bug,Crash,Performance,Software,Issue,Support,,
Network Connectivity Problem Report,"Users have reported sporadic connectivity disruptions affecting multiple services, likely due to network instability. After restarting routers and confirming firewall configurations, the issue remains unresolved. The team is actively working to resolve the problem as quickly as possible. In the meantime, please try restarting your devices and verifying your internet connection. If the issue persists, do not hesitate to contact us for further assistance. We apologize for any inconvenience caused and appreciate your patience and understanding.","We acknowledge the report of intermittent connectivity issues and appreciate your efforts to resolve them. Please try restarting your devices and checking your internet connection. If problems continue, contact us for further assistance.",Problem,IT Support,medium,en,52,Network,Disruption,Maintenance,Hardware,,,,
Medical Data Security Weaknesses,"Customer Support team is highlighting concerns regarding vulnerabilities in the security of medical data within hospital systems. A healthcare provider encountered problems potentially due to insufficient encryption and outdated software. Initial efforts to fix the issue involved changing passwords and applying basic software updates, but these measures did not fully resolve the problem. We are worried about the possible risks associated with these vulnerabilities, including data breaches and unauthorized access to sensitive medical information. Your assistance would be appreciated.",Please investigate the security vulnerabilities related to medical data and provide a comprehensive solution to ensure the integrity and safety of the systems. Kindly share your contact details for further discussion.,Problem,Returns and Exchanges,low,en,52,Security,IT,Vulnerability,Data Protection,Healthcare,,,
Epson Scanner Problem,Requesting assistance with integration procedures,Please specify the Epson scanner model to receive detailed integration guidance,Request,IT Support,high,en,52,Bug,Hardware,Support,Scanner,,,,
Performance Issues of Digital Campaigns Due to Integration Challenges Across Multiple Platforms,"Dear Customer Service, I am writing to report that our marketing agency's digital campaigns are performing poorly, possibly because of integration issues across various platforms. We have tested platform synchronization and updated the software, but the problems persist. Our team is diligently working to resolve the issue and would appreciate additional support. Could you please provide guidance on how to fix the integration problems to ensure seamless synchronization across platforms? Despite trying various troubleshooting methods, the issues remain unresolved.",Please review the concern and contact <tel_num> to discuss the next steps. Provide instructions for resolving the integration issues across platforms.,Problem,Customer Service,low,de,52,Performance,Disruption,Support,Integration,Campaign,Software,,
Technical Difficulty,"The marketing agency's website has been crashing frequently during traffic spikes, probably due to inadequate server capacity. Attempts to restart the server and clear the cache have not resolved the problem. Assistance is required to fix this issue and ensure the website remains stable and accessible to users.","<name> is composing an acknowledgment email regarding the technical difficulties faced by the marketing agency's website, which is experiencing frequent crashes during traffic surges. They understand that initial efforts to restart the server and clear the cache have not remedied the situation. They seek help in resolving the issue to keep the website stable and accessible. To better understand the problem, they would like to request additional details about the server type, capacity, and the frequency and timing of the crashes.",Problem,IT Support,high,en,52,Performance,Outage,Disruption,Recovery,IT,Tech Support,,
Unterstützung benötigt,"Könnten Sie eine Anleitung zu bewährten Praktiken für die Sicherung medizinischer Daten auf Cisco IOS 15.4 in einer Krankenhaus-IT-Umgebung bereitstellen? Ich schätze die Ressourcen, die die Sicherheit und Integrität sensibler medizinischer Informationen gewährleisten können.","Sehr geehrter <name>, vielen Dank, dass Sie wegen der Sicherung medizinischer Daten auf Cisco IOS 15.4 in der Krankenhaus-IT-Infrastruktur Kontakt aufgenommen haben. Um die Sicherheit und Integrität sensibler medizinischer Daten zu gewährleisten, empfehlen wir die Implementierung robuster Zugriffskontrollen, Verschlüsselung der Daten während der Übertragung und im Ruhezustand sowie regelmäßige Updates auf die neueste IOS-Version. Für detailliertere Informationen zu bewährten Praktiken konsultieren Sie bitte die offizielle Dokumentation und Sicherheitshinweise von Cisco. Sollten Sie spezifische Fragen haben, zögern Sie nicht, uns zu kontaktieren.",Request,Customer Service,low,de,52,Security,IT,Support,Data Integrity,,,,
Assistance Needed for Delayed System Responses,"Users have reported occasional delays when accessing project dashboards, potentially due to recent modifications in database indexing. After restarting the impacted services and clearing caches, the problem remains unresolved. Kindly investigate the issue promptly to find a solution and reduce workflow interruptions.","We have received a report concerning sluggish response times when accessing project dashboards. Please prioritize investigating this matter by examining recent database indexing changes. If necessary, arrange a call to discuss the situation further; inform us of a suitable time at <tel_num>. Aim to resolve the issue swiftly to minimize workflow disruptions.",Incident,Product Support,medium,en,52,Performance,Outage,Disruption,Recovery,IT,Tech Support,,
Website Accessibility Problem,The marketing agency encountered difficulties accessing the website following recent software updates.,"We are investigating the website access problem reported after the latest software updates. Please provide detailed information about the issue, including any error messages and screenshots, to help us better understand the problem and find a solution. For further assistance, contact <tel_num>.",Incident,Technical Support,low,en,52,Accessibility,Website,Software Update,Disruption,,,,
Billing Discrepancies Across Multiple Products,"A financial firm utilizing data analysis experienced billing errors across several of its products. These issues may have resulted from system integration problems. Attempts were made to reset accounts, verify payment methods, and contact support; however, no solution was found. The errors caused revenue losses and impacted customer satisfaction. Urgent assistance is needed to resolve the issue and prevent further losses. Please investigate the incident and provide a prompt resolution.","We have received an email regarding billing discrepancies across multiple products and understand the urgency of the situation. To better diagnose the problem, we kindly request additional information about the specific products affected and any error messages encountered. Could you please provide more details about potential system integration issues that might be the cause? We also need account details to verify the information. Please confirm the account number so we can assist further and avoid additional losses. Let us know a suitable time to call and discuss the issue in detail.",Problem,Billing and Payments,high,de,52,Billing,Payment,Revenue,System Integration,Error,,,
Anfrage zu Digitalen Marketingservices für Markenentwicklung,Können Sie detaillierte Preisangaben und Abrechnungsmodelle für Ihre digitalen Marketingdienstleistungen bereitstellen?,"Wir bieten individuell angepasste digitale Marketinglösungen, die auf die jeweiligen Anforderungen abgestimmt sind. Die Abrechnungsmodelle variieren je nach gewähltem Paket. Gerne erläutern wir die Details im Gespräch. Bitte stellen Sie uns weitere Informationen zu Ihren Marketingzielen zur Verfügung, damit wir Ihnen ein passendes Angebot unterbreiten und die besten Strategien für das Markenwachstum empfehlen können.",Request,Billing and Payments,low,de,52,Feature,Sales,Lead,Feedback,,,,
Concerns with Marketing Agency,The marketing agency has encountered delays in campaign analytics reporting due to errors in data integration.,"<name> sorry to hear that the marketing agency is facing delays in campaign analytics reporting caused by data integration issues. Kindly provide details of the errors and the expected timeline for the reports. We will escalate this issue to the technical team for investigation and prompt resolution. For further discussion, please contact <tel_num>.",Incident,Product Support,medium,en,52,Performance,Disruption,Outage,Recovery,IT,Tech Support,,
Festgestellte Diskrepanzen bei der Integration verschiedener Plattformen,Korrektur erforderlich,"Ich benötige zusätzliche Informationen, um bei der Lösung des Problems mit inkonsistenter Integration zu unterstützen. Könnten Sie bitte die Plattformen sowie beobachtete Symptome detailliert beschreiben? Gerne helfe ich bei der Problemlösung und kann einen Termin für ein Gespräch vereinbaren.",Problem,Customer Service,low,de,52,Bug,Integration,Discrepancy,Platform,Correction,,,
Avast Security Support,"Dear Customer Support Team, I am reaching out to seek guidance on integrating digital marketing strategies with Avast Premium Security to boost brand growth. As a business owner, I recognize the importance of online security and its impact on brand reputation. I am currently using Avast Premium Security and am impressed with its features and capabilities. However, I believe that leveraging digital marketing strategies could elevate my brand to the next level. Could you please provide guidance on how to integrate digital marketing strategies effectively?","<name>, thank you for contacting the support team regarding the integration of digital marketing strategies with Avast Premium Security to enhance your brand growth. We appreciate your trust in our product's capabilities. To provide effective guidance, could you please share details about your current digital marketing efforts and specific areas of online security you wish to focus on? This will help us offer tailored advice to leverage Avast Premium Security in protecting and growing your business.",Request,Technical Support,medium,en,52,Security,Feedback,Online Security,Reputation,Business Growth,,,
Unterstützung erbeten,Könnten Sie bitte zusätzliche Details zu den eingesetzten Datenanalyse-Tools für die Investitionsoptimierung bereitstellen?,"Wir verwenden eine Reihe von Datenanalyse-Tools zur Investitionsoptimierung, darunter maschinelle Lernalgorithmen und statistische Modelle. Gerne erläutern wir weitere Details in einem Gespräch. Bitte teilen Sie uns eine passende Zeit für einen Anruf unter <tel_num> mit oder antworten Sie per E-Mail.",Request,IT Support,high,de,52,Feature,Data Analysis,Investment Optimization,Support,,,,
Integration of Scalability Capabilities,Could you supply details regarding the scalability capabilities?,<name> values your interest in scalability feature integrations. Our solution provides adaptable pricing options to meet expanding requirements. We would be pleased to offer more detailed information or arrange a call at your convenience. Kindly inform us of a suitable time for a discussion or let us know if you prefer to receive a comprehensive brochure highlighting the scalability benefits for your business. Feel free to contact <tel_num> or reply via email.,Request,Customer Service,low,en,52,Performance,Feature,Scalability,,,,,
Poor Performance of Digital Campaigns on Platforms,"Our marketing agency's digital campaigns are underperforming. We have attempted to resolve the issue by seeking assistance, but the problem persists.","Review the digital campaigns, contact <tel_num>, and discuss potential solutions and next steps with <acc_num>.",Problem,Product Support,high,de,52,Performance,Digital Campaigns,Marketing,Issue,Assistance,,,
Security Enhancement,"Enhance the security of hospital medical data systems by adopting advanced protocols. This should encompass encryption, robust authentication methods, and routine software updates. Furthermore, staff should be trained in proper data management techniques to reduce potential risks. The implementation of these measures will help ensure adherence to compliance standards and safeguard confidential information from unauthorized access.",Assess and deploy strengthened security measures to shield sensitive medical information and ensure regulatory compliance.,Change,Technical Support,high,en,52,Security,IT,Tech Support,Risk Management,,,,
Assistance Required for Crash Problem,"Users are encountering repeated crashes across several interconnected products during peak usage times, potentially due to memory leaks. Restarting services and clearing caches temporarily resolved the problem, but it continues to occur.","<name> sincerely apologizes for the inconvenience caused by the frequent crashes during high traffic periods across the integrated products. We appreciate your efforts in restarting services and clearing caches to mitigate the issue. To further investigate, could you please share any error messages or logs encountered? Additionally, knowing the specific versions of the products in use would be helpful. If necessary, we can arrange a call at your convenience to discuss the issue in more detail; please let us know a suitable time.",Incident,Product Support,medium,en,52,Crash,Performance,Bug,Hardware,,,,
Data Analytics,"Customer Support is reaching out to inquire about data analytics solutions that can assist in optimizing investment strategies. Could you please provide detailed information about the tools and services available? I am particularly interested in understanding how these solutions can facilitate data-driven decision-making to enhance investment portfolios. Specifically, I would like to know the types of data analyzed, the methods employed for analysis, and the insights generated. Additionally, I would appreciate information regarding the implementation process and pricing details.",We can provide comprehensive information about our data analytics solutions. Please contact <tel_num> to discuss your specific requirements and address any questions you may have about our services.,Request,Customer Service,medium,en,52,Product,Feedback,Support,Data Analytics,,,,
Support Inquiry from Customer,"Dear Customer Support Team, I am reaching out to request detailed information regarding billing and payment options for integrating Redis 6.2 with a PHP 8.0 SaaS platform. We are interested in exploring ways to leverage these technologies to enhance our platform's performance and scalability. Could you please share details about the available pricing plans and payment methods? We would also appreciate guidance on how to initiate the integration process. Additionally, please inform us of any special considerations or offers.",<name> has received the inquiry about detailed billing and payment options for integrating Redis 6.2 with PHP 8.0 SaaS platform. They will provide the information via email and schedule a call at <tel_num> to discuss options and requirements.,Request,Billing and Payments,high,en,52,Billing,Payment,Support,Performance,Technology,Scalability,Pricing,
Digitale Strategie zur Förderung des Markenwachstums durch die Markenmarketingagentur,"Durch die digitale Strategie wurde das Markenwachstum gefördert. Mögliche Ursachen für den Mangel an Effektivität könnten eine missausgerichtete Kampagne sein. Eine Analyse wurde durchgeführt, und der Inhaltsfokus konnte angepasst werden. Die Werbenaufwendungen wurden erhöht, und eine Verbesserung konnte erreicht werden.",Ich möchte gerne mehr Details zu den aktuellen Kampagnenanalysen besprechen und die Ursache des Problems identifizieren. Könnten Sie bitte zusätzliche Informationen bereitstellen?,Problem,Product Support,medium,de,52,Marketing,Strategy,Brand Growth,Campaign Analysis,Effectiveness,Digital Marketing,Improvement,
