subject,body,answer,type,queue,priority,language,version,tag_1,tag_2,tag_3,tag_4,tag_5,tag_6,tag_7,tag_8
USB Storage Devices Detected,"Dear Customer Support,\n\nI am seeking help concerning an issue with my USB storage devices. Recently, my computer has stopped recognizing USB drives when connected. This problem occurs regardless of which USB port or drive I use. I have tested multiple drives and tried different ports, but none are detected by the system.\n\nI have already performed basic troubleshooting steps such as restarting the computer, updating drivers, and inspecting the device manager, but the issue remains. This situation is causing considerable inconvenience.","Thank you for reaching out regarding your USB drive problem. Since you've already tested various drives and ports, as well as restarting your PC and updating drivers, kindly provide details about your operating system version so we can suggest tailored troubleshooting steps. In the meantime, ensure your system is fully updated, and test the USB drives in Safe Mode or on another computer to rule out hardware failure. If the issue continues, please inform us so we can investigate further and check for any error messages.",Problem,IT Support,medium,en,51,Hardware,Support,Driver,Troubleshooting,,,,
Alert,"Support Team, we are facing a major infrastructure disruption impacting essential device platforms. This problem is disrupting operations and needs urgent intervention. Kindly look into this matter and keep us informed with updates at your earliest convenience to help us resolve the issue swiftly. Thank you for your support.","We appreciate your report of the issue. To assist us promptly, please share details about the affected devices, platforms involved, and the specific problems encountered. This information will help us prioritize the investigation and provide timely updates on the progress.",Incident,Customer Service,medium,en,51,Disruption,Outage,Infrastructure,Tech Support,,,,
Outlook Email Delivery Issue,"Sehr geehrtes Kundendienstteam,\n\nich kontaktiere Sie, um Unterstützung bei einem anhaltenden Problem mit Zustellungsfehlern bei E-Mails in Outlook 2021 zu bitten. Es wird vermutet, dass die Fehler durch Konflikte bei der Integration unserer EMR (Elektronische Patientenakten) und PACS (Bildarchivierungs- und Kommunikationssysteme) verursacht werden, die besonders sicher sind. Erste Untersuchungen deuten darauf hin, dass bestehende Sicherheitsrichtlinien für SMTP-Verbindungen die erfolgreiche Übertragung von E-Mails beeinträchtigen könnten.\n\nUm das Problem zu beheben, wurden mehrere Maßnahmen ergriffen, einschließlich der Neukonfiguration des Servers, Anpassungen der Sicherheitsrichtlinien und Wiederherstellung eines normalen E-Mail-Flusses. Trotz dieser Maßnahmen bestehen weiterhin Schwierigkeiten.","Vielen Dank, <name>. Damit wir Ihnen besser helfen können, könnten Sie bitte spezifische Fehlermeldungen oder Bounce-Back-Codes der fehlgeschlagenen E-Mails bereitstellen? Verwendest du außerdem spezielle Sicherheitssoftware oder Firewalls in den EMR/PACS-Systemen? Outlook 2021 ist bekannt für Konflikte aufgrund strenger SMTP-Beschränkungen; das Whitelisting der Mail-Server sowie die Überprüfung der Port- und Verschlüsselungseinstellungen wird empfohlen. Bitte teilen Sie uns Ihre SMTP-Konfiguration mit, um eine gezielte Lösung zu finden.",Incident,Technical Support,medium,de,51,Outlook,Email,Delivery,Issue,Email,Error,Integration,EMR
Immediate Attention Needed: Malfunction in Crucial SSD Encryption,"Dear Support Team,\n\nI am facing a problem with the data encryption feature on my Crucial MX500 1TB SSD. Despite updating to the latest firmware, the issue remains unresolved. It appears there might be a firmware corruption or misconfiguration causing the malfunction. Could you please help me troubleshoot and resolve the encryption problem? I rely on this SSD for secure data storage and need it to operate properly.\n\nAppreciate your quick response to this matter.\n\nSincerely,\n[Your Name]","Thank you for reaching out to us. Kindly specify the exact error messages related to the encryption issue. Additionally, inform us about the operating system and encryption software being used so we can assist you more effectively.",Incident,Product Support,low,en,51,Bug,Security,Hardware,Performance,,,,
Assistance with Securely Connecting to QuickBooks Online,"Dear Customer Support,\n\nI am seeking assistance with integrating the QuickBooks Online cloud-based SaaS platform. Using a microservices architecture, I want to guarantee that API interactions are both secure and dependable. Furthermore, my goal is to achieve smooth data synchronization across systems while preserving data accuracy and providing real-time updates. Could you please share best practices documentation for securely establishing API connections within this context, along with recommendations for optimizing data flow? Additionally, what tools or frameworks would you suggest for microservices integration with QuickBooks Online?","Thank you for reaching out about securely integrating QuickBooks Online, a cloud-native SaaS solution. To establish a secure connection to the QuickBooks Online API within a microservices setup, it is advisable to utilize OAuth 2.0 authentication, ensuring all API exchanges are transmitted over HTTPS. Managing access tokens with refresh logic within your services can help sustain secure and consistent connections. For data synchronization, you might consider employing event-driven architectures using message queue systems like Apache Kafka or cloud services such as AWS SNS/SQS.",Request,IT Support,high,en,51,Security,IT,Tech Support,Product,Performance,,,
Connectivity Problems and Data Synchronization Failures Among Devices,"The team is experiencing connectivity disruptions and data sync failures across several devices and software. We suspect that a recent firmware update and network modifications may be the cause. Devices have been restarted and cables verified, but the issues continue. Immediate support is needed to resolve these interruptions.","Thank you for reporting the connectivity and data synchronization problems impacting your team. To assist with our investigation, please specify which device types and software are affected, and provide details about the recent firmware and network changes implemented. If possible, include error messages or screenshots. This information will help us diagnose the issue swiftly. Since the matter is urgent, kindly inform us of a suitable time for a call so we can provide direct assistance.",Incident,Technical Support,medium,en,51,Network,Disruption,Connectivity,Firmware,,,,
Guidelines for Securing Telemedicine Platforms,"Dear Support Team,\n\nI hope this message finds you well. I am reaching out to request a comprehensive manual for securing telemedicine platforms. As telemedicine becomes an increasingly vital aspect of healthcare delivery, ensuring the protection of patient information is of utmost importance.\n\nCould you please provide detailed recommendations on best practices to enhance the security of telemedicine solutions? I am particularly interested in identifying vulnerabilities within platforms and implementing the most effective measures to reduce potential risks. This includes encryption standards, user authentication protocols, data storage security, and compliance with relevant regulations.","Thank you for contacting us regarding the security of telemedicine platforms. To safeguard patient data and ensure compliance with HIPAA and GDPR, it is essential to guarantee end-to-end encrypted communications (TLS 1.2 or higher), implement robust user authentication methods (preferably multi-factor authentication), and store health information in encrypted databases. Regularly update software and promptly apply security patches. Limit access through role-based permissions, monitor system activities for unauthorized attempts, and utilize secure communication tools certified for the healthcare sector.",Request,Technical Support,medium,de,51,Security,IT,Tech Support,Documentation,,,,
Druckerproblem beim Drucken von Dokumenten,"Sehr geehrtes Kundendienstteam,\n\nich wende mich an Sie, um Unterstützung bei einem Druckerproblem zu bitten. Trotz mehrmaliger Versuche druckt mein Drucker keine Dokumente. Ich habe die Verbindung überprüft, sichergestellt, dass ausreichend Papier und Tinte vorhanden sind, und sowohl den Drucker als auch den Computer neu gestartet. Das Problem besteht weiterhin. Dies beeinträchtigt meine Fähigkeit, wichtige Aufgaben zu erledigen. Ich würde eine schnelle Lösung sehr schätzen.\n\nVielen Dank für Ihre Unterstützung und eine zügige Bearbeitung meines Anliegens.\n\nMit freundlichen Grüßen,\n[Ihr Name]","Vielen Dank, <name>. Damit wir Ihnen weiterhelfen können, teilen Sie uns bitte das Modell Ihres Druckers sowie etwaige Fehlermeldungen mit, die auf dem Druckerbildschirm oder dem Computer angezeigt werden. Ist der Drucker außerdem per USB oder im Netzwerk verbunden? Sobald wir diese Informationen haben, stellen wir konkrete Schritte zur Fehlerbehebung bereit, um das Problem möglichst rasch zu lösen.",Problem,Customer Service,low,de,51,Product,Hardware,Printer,Tech Support,,,,
Alignment Issue with Account Management,"Dear Customer Support Team,\n\nI hope this message finds you well. I am reaching out to report an issue I have encountered with the Account Management Center. Specifically, I have noticed alignment problems that negatively affect the overall usability and visual appearance of the hubs. Although the interface elements seem correctly positioned, navigation and access to certain features are significantly hindered. \n\nThis misalignment disrupts my workflow and diminishes the user experience, with buttons and text fields overlapping or being misplaced. I have attempted to open the hub on various devices and browsers, but the issue persists.","Thank you for bringing the alignment issue in the Account Management Center to our attention. To assist with further investigation, could you please send us screenshots of the misaligned elements? Additionally, have you tried using different operating systems or browsers? We appreciate your patience as we work to resolve the problem as quickly as possible.",Problem,Product Support,high,de,51,Account,UI/UX,Feedback,Technical Support,,,,
Integrationsfehler bei Geräten beeinträchtigen den Marketing-Prozess,"Mehrere Geräte melden Verbindungsprobleme mit den Marketing-Systemen, was den Workflow stört. Das Problem trat nach einem kürzlichen Betriebssystem-Update auf. Trotz Neustarts und Neuinstallationen der Treiber besteht das Problem weiterhin. Wir bitten um Unterstützung bei der Diagnose und Behebung der Integrationsprobleme umgehend.","Vielen Dank für Ihre Kontaktaufnahme. Um Ihnen besser helfen zu können, teilen Sie uns bitte die Modellarten und -nummern der Geräte mit, die Verbindungsprobleme zeigen, sowie die Version des Betriebssystems nach dem Update und etwaige spezifische Fehlermeldungen. Diese Informationen erleichtern die effektive Diagnose. Falls es dringend ist, geben Sie bitte eine passende Zeit für ein Gespräch an, damit wir das Problem schnell lösen können.",Problem,Customer Service,high,de,51,Bug,Hardware,Network,Disruption,Support,Tech Support,,
Immediate Help Needed for Video Conferencing System Connectivity Issues,"Dear Customer Support,\n\nI am reaching out to request immediate assistance regarding ongoing connectivity problems with our video conferencing system. Despite our attempts to resolve the matter, the system continues to experience interruptions that hinder communication.\n\nWe have already rebooted the relevant hardware, installed the latest updates for device drivers, and confirmed that network connectivity is stable. Nevertheless, the issue persists, leading us to believe that the root cause may be a software or network configuration error.\n\nCould you please","Thank you for contacting us. To assist you more effectively, could you specify which version of the video conferencing software you are using, any error messages you have encountered, and provide details about your operating system and network setup? This information will help us offer precise troubleshooting guidance. If you prefer a phone call, please let us know a convenient time and your contact number.",Incident,Customer Service,medium,en,51,Network,Disruption,Outage,Hardware,Tech Support,,,
Information on Agile Team Structure,"Dear Customer Support,\n\nI trust this message reaches you well. I am reaching out to request comprehensive details about the configuration of agile teams within the organization. Gaining insight into specific roles, duties, and workflows of these teams is essential for enhancing collaboration and streamlining project management. Could you kindly supply documentation that provides an overview of how teams are organized, including the methodologies and tools they utilize? Additionally, I would appreciate any guidelines and best practices that the teams adhere to.\n\nThank you for your assistance regarding the agile team organization.","Thank you for your inquiry about the agile team setup. To provide an accurate overview, could you please specify which department or particular teams you are interested in? Once clarified, we can share relevant organizational charts, workflows, methodologies, and practice guidelines employed by those teams. Please let us know if you require details about specific tools as well.",Request,Customer Service,high,en,51,Documentation,Feedback,IT,Tech Support,,,,
Problem bei Rückgabe des Produkts,"Sehr geehrtes Kundendienstteam,\n\nich kontaktiere Sie, um Unterstützung bei einem Problem zu erhalten, das kürzlich bei bestimmten elektronischen Geräten aufgetreten ist, die ich erworben habe. Die Produkte zeigen Fehlfunktionen, die auf Nutzerfehler zurückzuführen sind, was die Funktionalität erheblich beeinträchtigt. Ich vermute, dass die Probleme auf Inkompatibilitäten mit meinen Systemen zurückzuführen sind, die möglicherweise auf defekte Einheiten hinweisen.\n\nZur weiteren Erklärung: Ich habe bereits mehrere erste Schritte zur Fehlerbehebung unternommen, darunter Software-Resets gemäß den Anweisungen in den Benutzerhandbüchern. Trotz dieser Bemühungen bestehen die Probleme weiterhin.","Vielen Dank, dass Sie sich wegen der Rückgabe an uns gewandt haben. Damit wir Ihnen weiterhelfen können, bitten wir Sie, die Bestellnummer, die Seriennummern der Produkte sowie eine kurze Beschreibung der spezifischen Probleme, die bei den Artikeln auftreten, bereitzustellen. Diese Informationen helfen uns, die Berechtigung für die Rückgabe gemäß unserer Rückgaberichtlinie zu bestätigen und die nächsten Schritte zu empfehlen. Bitte fügen Sie auch die Kaufbelege bei. Sobald wir die Details erhalten haben, werden wir den Rückgabe- oder Umtauschprozess einleiten.",Incident,Returns and Exchanges,high,de,51,Return,Product,Hardware,Disruption,Tech Support,,,
Request for Support with Laptop Connectivity and Performance Issues,"Dear Customer Support Team,\n\nI am experiencing persistent problems with my laptop's connectivity. The device frequently disconnects from Wi-Fi, disrupting my work. Additionally, my laptop has become noticeably slower than usual, with applications taking longer to open and frequent system delays. I have attempted restarting the device and checking the network settings, but the issues continue. Could you please advise on how to resolve these problems? Could it be a hardware issue requiring inspection? I rely on my laptop daily.","Thank you for reaching out, <name>. To assist you with the connectivity and performance concerns, please provide the device's make and model, the operating system version, and whether other devices on the same Wi-Fi network are experiencing similar issues. Have there been recent software updates installed? Also, please share any specific error messages you see. Meanwhile, try disconnecting and reconnecting to Wi-Fi and ensure a full antivirus scan is completed.",Incident,Technical Support,high,en,51,Performance,Network,Hardware,Tech Support,,,,
Immediate Attention Needed: Security Breach Concerning EMR/PACS Platforms,"Dear Customer Support Team,\n\nI am submitting a report regarding a security breach involving EMR/PACS systems. An unauthorized access attempt was detected, seemingly originating from a phishing email aimed at the EMR/PACS integrations. Fortunately, the Security Operations Center (SOC) responded promptly to isolate the compromised systems and prevent further damage.\n\nAt present, the SOC has initiated round-the-clock monitoring and is actively working to mitigate the threat and address any remaining risks. I am worried about the possibility of data leakage.","Thank you for informing us about the security breach involving EMR/PACS systems. We take such incidents very seriously. To assist with the review of your current security measures and provide customized recommendations, could you please share more details regarding the scope of the attempted intrusion, any vulnerabilities identified, and the version details of your EMR/PACS platforms? This information will enable us to perform a comprehensive analysis and offer precise guidance for remediation. In the meantime, we advise resetting affected credentials to secure your systems.",Incident,Product Support,high,en,51,Security,Virus,Network,IT,Tech Support,,,
Extensive Service Disruption Affecting Multiple Platforms,"Dear Customer Support Team,\n\nI am submitting a report concerning a major outage impacting several SaaS platform services, including the Smart-Gartenbewässerung system and various Microsoft Office applications. The disruption has led to extensive service downtime, significantly hindering operational activities.\n\nInitial assessments suggest that the core issue may be linked to a failure in Kubernetes orchestration. The coordination and management of containerized services appear to be compromised, resulting in a chain reaction of failures across various service components.","We appreciate your detailed report on the outage. To assist you further, kindly provide recent Kubernetes logs, error notifications, and deployment statuses of the affected services. Our team will prioritize this issue and update you with findings and recovery procedures as soon as possible.",Incident,Service Outages and Maintenance,high,en,51,Outage,Disruption,Performance,IT,Tech Support,,,
Report of an Issue,"Dear Customer Support Team,\n\nI hope this message reaches you well. I am writing to report a significant problem observed across multiple cross-functional Agile teams using the SaaS platform. Over the past few days, I have noticed sporadic outages that disrupt the platform, greatly affecting our ability to deliver continuous service to users.\n\nThe underlying cause seems linked to the Kubernetes orchestration within our infrastructure. Specifically, the platform's microservices, which are managed through Kubernetes, are experiencing unexpected downtimes.","Thank you for reaching out and providing a detailed overview of the ongoing platform disruptions experienced by your teams. We understand how crucial uninterrupted access to the SaaS platform is and take this matter very seriously. To assist our Kubernetes specialists with their investigation, could you kindly share the following details: the specific timeframes when outages occurred, any error messages or patterns observed in the logs during downtime, and information about recent deployment changes or updates made to the Kubernetes clusters? This information will be very helpful.",Incident,Technical Support,medium,en,51,Outage,Disruption,Performance,Tech Support,,,,
Updating the Client Reporting Interface,"Dear Customer Support Team,\n\nI trust this message reaches you well. I am reaching out to highlight a problem with the client reporting interface. Over the past few days, I have observed that the dashboard is not updating as expected. The data seems static and does not reflect recent activity metrics that are vital for ongoing projects.\n\nSince we depend heavily on the dashboard for precise and prompt reporting, this interruption is affecting our decision-making capabilities. I have tried basic troubleshooting steps such as refreshing the page and clearing the cache, but the issue persists.","Thank you for informing us about the problem with the client reporting dashboard. We understand how essential accurate and timely data is for your projects. To assist us in further investigating, could you please confirm whether the dashboard module shows the last update time or date you noticed? In the meantime, you may be able to access the latest raw data reports through the export feature in your account. We are prioritizing this case and will keep you updated until the issue is resolved. Please let us know if you need any additional assistance.",Problem,Technical Support,high,en,51,Product,Feature,Bug,Performance,,,,
Request for Updated Summary of Security Compliance Operations,"Dear Customer Support Team,\n\nI hope this message reaches you well. I am writing to request an updated overview of the security compliance operations related to account services. Given the importance of maintaining strict security protocols in accordance with compliance standards, having the latest information on this topic is essential for continued trust and service alignment.\n\nCould you kindly provide comprehensive documentation detailing the current status, recent modifications, and upcoming enhancements of the security compliance operations?","Thank you for your inquiry regarding the security compliance operations. We are in the process of compiling the latest overview, including recent updates and future plans for improvements. Could you please confirm the specific account number or service in question so we can provide the most relevant detailed information? Once received, we will promptly send the requested documentation highlighting new procedures and guidelines.",Change,Product Support,low,en,51,Security,Compliance,IT,Tech Support,,,,
Dringende Mitteilung: Verbindungsprobleme nach jüngstem Microservices-Update,"Sehr geehrtes Support-Team,\n\nich möchte ein kritisches Anliegen an Sie herantragen, das mehrere Geräte betrifft, die mit unserer SaaS-Plattform verbunden sind. Nach einem kürzlichen Software-Update haben wir erhebliche Verbindungs- und Leistungsstörungen festgestellt, die offenbar weitreichend sind. Erste Analysen deuten darauf hin, dass das Update auf der Kubernetes-Orchestrierungsebene der Microservices möglicherweise die Ursache ist und die Stabilität unserer Plattform beeinträchtigt.\n\nZur Behebung des Problems haben wir die betroffenen Dienste neu gestartet und sogar auf eine vorherige stabile Version zurückgesetzt.","Vielen Dank für Ihre Meldung. Bitte stellen Sie die aktuellen Fehlerprotokolle sowie Informationen zu den betroffenen Diensten und den ungefähren Ausfallzeiten bereit, um eine schnelle Analyse und Behebung des Problems zu ermöglichen.",Incident,Technical Support,high,de,51,Performance,Outage,Disruption,Microservices,Network,,,
Corporate Restructuring Notification,"Dear Customer Support Team,\n\nI am reaching out to request an update on the current organizational structure as reflected in our records for the Marketing agency. The agency has recently experienced several significant changes, and it is important to ensure that our documentation accurately represents these new operational configurations. I would be grateful for your assistance in updating this information.\n\nTo begin with, I would like to clarify the updated roles and responsibilities within various departments of the agency. For instance, the Creative Department now concentrates exclusively on content creation, with clearly defined functions aimed at enhancing efficiency and accountability.","Thank you for informing us about the recent structural changes within the Marketing agency. We appreciate the comprehensive overview of the revised departmental functions, technological integrations, enhanced client management procedures, and data-driven marketing strategies. To guarantee our records are fully current, could you please provide official organizational charts outlining the new structure? Additionally, if there have been changes to key contacts or departmental points of contact, kindly share the updated details with us.",Change,General Inquiry,medium,en,51,Notification,IT,Documentation,Feedback,,,,
