subject,body,answer,type,queue,priority,language,version,tag_1,tag_2,tag_3,tag_4,tag_5,tag_6,tag_7,tag_8
Concerns About Software and Hardware Compatibility,"The marketing agency's digital strategies are being impeded by software and hardware compatibility issues. However, high-priority tools are now functioning smoothly due to recent updates.","We understand that the marketing agency is facing software and hardware compatibility issues that are hindering their digital strategies. We would like to help resolve this matter as soon as possible. To better assist you, could you please provide details on the high-priority tools that are now functioning seamlessly due to recent updates? This will enable us to investigate and provide a suitable solution. If needed, we can schedule a call at a convenient time to discuss further. Please let us know a suitable time.",Incident,Technical Support,high,en,400,Bug,Performance,Hardware,Software,Feature,IT,Tech Support,
Untersuchung unkonstanter Investment-Prognosen durch Datenanalyse-Nutzungstool,"Das Datenanalyse-Nutzungstool produziert unkonstante Investment-Prognosen. Es könnte sein, dass Probleme mit der Software-Aktualisierung und Datenaustausch die Ursache sind. Datenquellen wurden überprüft, aber die Probleme sind weiterhin bestehen. Wir benötigen Unterstützung, um das Problem zu lösen.","Um das Problem mit den unkonstanten Investment-Prognosen durch das Datenanalyse-Nutzungstool zu untersuchen, laden wir Sie ein, sich mit uns über <tel_num> zu kontaktieren, um mögliche Lösungen zu besprechen. Falls erforderlich, können wir eine Debugging-Sitzung vereinbaren, um das Konto <acc_num> zu beheben.",Problem,Technical Support,high,de,400,Bug,Performance,IT,Tech Support,Documentation,,,
Enquiry About Cubase Software,"Hello Customer Support, we are interested in Cubase software for potential investment in analytics. We would appreciate detailed specifications and integration options for the software. Specifically, we are interested in understanding how it can be used for data analysis and visualization, as well as any potential customization options. Additionally, could you provide information on the software's compatibility with different systems and available tutorials and support resources? Your prompt assistance is greatly appreciated. We look forward to your response. Thank you.",We will review your inquiry about Cubase software for investment in analytics and provide detailed information and examples of successful implementations. Please allow us to call at your convenience to discuss further.,Request,Technical Support,medium,en,400,Sales,Product,Feature,Feedback,IT,Tech Support,,
Investment Optimization Tools Unavailable Following Maintenance,"The investment optimization tools are currently inaccessible due to a service outage. This unexpected downtime might be a result of recent server maintenance. We have restarted the affected applications and are monitoring server performance, but access continues to be disrupted. Assistance is needed to resolve this issue promptly to minimize any impact on operations.",We will investigate the service outage and can be contacted at <tel_num> to discuss troubleshooting steps and resolution options.,Incident,Service Outages and Maintenance,high,en,400,Outage,Maintenance,Performance,Tech Support,,,,
Issue with Latest Invoice Billing Procedure,"Encountered an unforeseen billing error on the latest invoice, which might be related to a synchronization problem. After reviewing and reconciling the transactions, we have addressed the discrepancy. Urgent assistance is needed to resolve the issue to prevent any further complications.",Please review the recent invoice <acc_num> and contact us to discuss the discrepancy. We need to resolve this issue soon to avoid any additional complications.,Problem,Billing and Payments,medium,en,400,Billing,Refund,Payment,Disruption,Feedback,,,
