subject,body,answer,type,queue,priority,language,version,tag_1,tag_2,tag_3,tag_4,tag_5,tag_6,tag_7,tag_8
,"Dear Customer Support, I am writing to report a critical issue concerning the security of our medical data. Recently, I have experienced unauthorized access attempts, which I believe may be due to outdated security protocols. Despite reviewing and updating the current firewall settings and ensuring the software is up to date, the issues persist. I am concerned about the potential breach of sensitive information and would like immediate assistance in resolving this matter. Could you please provide guidance on how to enhance our security measures?",We acknowledge receipt of your security issue regarding medical data and would like to schedule a call at <tel_num> to discuss the matter and provide guidance on enhancing security measures. Please let us know a time that is convenient for you to address this issue and prevent future unauthorized access attempts.,Incident,Customer Service,medium,en,400,Security,IT,Tech Support,Performance,,,,
Revise Digital Marketing Techniques to Boost Brand Growth and Customer Engagement,"Update digital marketing tool strategies to enhance brand growth and customer engagement. Implement new SEO methods, social media initiatives, and content marketing. Improve brand visibility and customer interaction to drive business growth.","Would be pleased to discuss the implementation of new digital marketing strategies for your business. To better understand your goals, could you please provide information on your current marketing efforts and what you hope to achieve? We can then review and discuss further at a convenient time.",Change,IT Support,low,en,400,Feedback,Sales,Feature,Documentation,,,,
Instabilitätsprobleme des Investment-Optimierungstools,"Das Investment-Optimierungstool destabilisiert unsere Datenanalyse. Sie haben bereits versucht, das Tool neu zu starten und Ressourcen neu zuzuordnen, aber die Probleme sind bestehen geblieben.","Sehr geehrte/r [Name], leider hören wir, dass Ihr Investment-Optimierungstool wiederholt Probleme bei der Datenanalyse verursacht. Es tut uns leid, dass Sie bereits versucht haben, das Problem zu beheben, indem Sie das Tool neu gestartet und Ressourcen neu zugewiesen haben. Um das Problem besser zu verstehen, könnten Sie uns bitte mehr Details über die Fehlermeldungen und die Häufigkeit der Instabilität liefern? Wir möchten gerne telefonisch mit Ihnen sprechen ([Telefonnummer]), um mögliche Lösungen zu besprechen. Wir stehen Ihnen gerne zur Verfügung, um den Anruf zu vereinbaren und auf Ihre Wohlwollen zu achten.",Incident,Technical Support,high,de,400,Bug,Performance,IT,Tech Support,,,,
Request for Enhanced Data Integration,"Seeking to enhance our data integration capabilities across various platforms, which would significantly improve the efficiency of investment analytics reporting. Your assistance in providing a solution would be greatly appreciated. Improved data integration would facilitate better decision-making and reduce manual data transfer errors. I look forward to your attention to this matter and hearing back soon.",Review the data integration request and contact us at <tel_num> to discuss possible solutions and next steps.,Change,Product Support,low,en,400,Feature,Performance,Feedback,IT,Tech Support,,,
Alert on Security Incident,Noted unauthorized access attempts occurred,"<name>, please address this security incident with prompt attention. Kindly furnish details about the unauthorized access attempts, including the date and time, and the affected systems. This will assist us in investigating the matter and taking the necessary actions. If available, I would like to discuss this further by calling at <tel_num>. Could you please inform me of a convenient time to call regarding <acc_num>?",Incident,Human Resources,low,en,400,Security,Alert,IT,Tech Support,,,,
,"experienced difficulties accessing data within the hospital system. the issue might be due to the recent software update. efforts to troubleshoot by restarting the server and checking permissions were made, but the problem still exists. urgent assistance is required to resolve this matter.","acknowledging the data access issue within the hospital system. understanding that troubleshooting steps such as restarting the server and checking permissions have been attempted. to assist you better, could you please provide details on the recent software update and the exact error message received? would like to schedule a call to discuss the issue further. available at the earliest convenience, please let me know a suitable time for the call: <tel_num>.",Problem,Technical Support,medium,en,400,Bug,Performance,IT,Tech Support,,,,
Unterstützung bei beständigen Ausfällen von digitalen Werkzeugen,"Sehr geehrte Kundenservice, wir begegnen beständigen Problemen mit unseren digitalen Werkzeugen, was unsere Markenwachstumsstrategie beeinträchtigt. Wir gehen davon aus, dass die Softwareinkompatibilität auf die neuesten Updates zurückzuführen ist. Bislang haben wir die Geräte mehrmals neu gestartet, die Netzwerkverbindungen überprüft und die Software aktualisiert, aber das Problem behält sich beständig bestehen. Das Team hat verschiedene Schritte zur Lösung des Problems unternommen, aber das Problem bleibt ungelöst. Wir schätzen Ihre schnelle Unterstützung und hoffen, dass wir eine schnelle Lösung bieten können. Bitte geben Sie uns alle notwendigen zusätzlichen Informationen, die wir zur Lösung des Problems benötigen. Wir freuen uns auf Ihre Rückmeldung.","Sehr geehrte [name], wir kümmern uns um die Probleme mit Ihren digitalen Werkzeugen. Vielen Dank für die bereitgestellten Schritte zur Fehlerbehebung. Um Ihnen besser behilflich zu sein, könnten Sie bitte spezifische Fehlermeldungen und Symptome beschreiben, sowie eine gute Zeit, um bei uns anzurufen, mitteilen. Wir können gerne die Lösung des Problems im Konto [acc_num] besprechen. <tel_num>",Problem,Technical Support,high,de,400,Outage,Disruption,Network,Performance,Tech Support,,,
Unbefugtes Zugriffsanliegen identifiziert,Unbefugtes Zugriffsanliegen auf das Krankenhaus-IT-System identifiziert.,"Sehr geehrte/r [Name], wir nehmen das festgestellte unbefugte Zugriffsanliegen auf das Krankenhaus-IT-System sehr ernst. Bereits dringende Maßnahmen wurden ergriffen, um das Konto-Nr. [acc_num] zu schützen. Das Team überprüft den Vorfall und wird notwendige Maßnahmen ergreifen, um zukünftige Versuche zu verhindern. Sollten Sie Fragen oder Bedenken haben, können Sie bitte an [tel_num] anrufen, um Informationen über die nächsten Schritte zu erhalten. Wir schätzen Ihre Zusammenarbeit bei der Bearbeitung dieser Angelegenheit und halten Sie über den Fortschritt informiert. Vielen Dank.",Incident,IT Support,high,de,400,Security,Alert,IT,,,,,
Help with Integration Challenges,"Customers are facing troubles integrating Zoom, Slack, and Zapier project management tools due to API compatibility and network connectivity issues. They have already restarted the integration process and verified their API keys, but the problem still exists.","We received your email about integration difficulties with Zoom, Slack, and Zapier project management software. To assist you better, could you please provide any error messages you are seeing? It would be helpful to schedule a call at your convenience to discuss the issue and find possible solutions. Please let us know a suitable time for the call at <tel_num> to resolve the issue with account number <acc_num>.",Problem,Product Support,medium,en,400,Integration,Network,Performance,IT,Tech Support,,,
Urgent Issue: Key Feature Crash in Project Management Tool,"Reporting critical issue with project management tool. During load testing, a key feature crashed unexpectedly. Even after increasing server capacity, the problem still exists. Suggesting the issue might be due to insufficient server resources. Requesting urgent assistance to address this matter and prevent future crashes. Kindly provide any necessary information. Thank you for prompt attention.","Received your email about the critical feature crash in the project management tool. Will investigate this matter urgently. To assist with the investigation, please provide details such as the error message and the steps taken during the user load testing. Feel free to contact me at <tel_num> for further discussion.",Incident,Technical Support,high,en,400,Bug,Crash,Performance,IT,Tech Support,,,
Verbesserung der Investitionsanalyse mit Mathematica,"Lieber Kundensupport, ich hoffe, es geht Ihnen gut. Ich schreibe an, um Rat bei der Optimierung der Investitionsanalyse mit Wolfram Mathematica Redis 6.2 zu erhalten. Könnten Sie mir Ressourcen oder Tutorials zur Verfügung stellen, die mir helfen, das Werkzeug effektiver zu nutzen und die Investitionsanalyse zu verbessern? Ich würde mich freuen, wenn Sie mir Unterstützung leisten könnten. Vielen Dank für Ihre Zeit und Unterstützung. Ich freue mich darauf, von Ihnen zu hören.","Sehr geehrte [Name], wir danken Ihnen für Ihr Interesse an der Optimierung der Investitionsanalyse mit Wolfram Mathematica Redis 6.2. Wir können Ihnen allgemeine Anleitungen und Ressourcen zur Verfügung stellen, um das Werkzeug effektiver zu nutzen. Auf unserer Website finden Sie eine Reihe von Tutorials und Dokumentationen, die den Grundlagen der Anwendung von Mathematica sowie der Datenanalyse und -visualisierung abdecken. Darüber hinaus bieten wir spezifische Beispiele an, die zeigt, wie Mathematica mit Redis 6.2 integriert werden kann, um die Investitionsanalyse zu verbessern. Allerdings möchten wir eine detailliertere Diskussion Ihres spezifischen Bedarfs und Ziels einleiten, um Ihnen individuelle Unterstützung zu geben.",Request,Product Support,medium,de,400,Feature,Feedback,Documentation,IT,Tech Support,,,
Unapproved Entry in Medical Records,"An unauthorized access attempt to medical data has been detected in the hospital system. This may have occurred due to insufficient security measures or a phishing attack. Immediate system review has been conducted and temporary access restrictions have been applied. Should concerns persist, there is a potential for ongoing vulnerabilities and data breaches.",We take this matter seriously and will conduct a thorough investigation to address the security concerns and prevent future unauthorized access attempts immediately.,Incident,Product Support,medium,en,400,Security,Virus,IT,Tech Support,Alert,,,
Performance Challenge with Financial Data Analytics Tool,"Our data analytics tool for financial firms is encountering slow performance during investment optimizations. This could be due to high data volumes or software conflicts. So far, we have restarted the devices and checked for relevant software updates. We would greatly appreciate your assistance in resolving this issue to ensure optimal performance.","We are investigating the performance challenge with the financial firm's data analytics tool. To better understand the issue, please provide information on the data volume and the software conflicts you suspect. We would like to schedule a call at your convenience to discuss and explore possible solutions. Please let us know a suitable time to contact you at <tel_num> regarding account <acc_num>.",Problem,Technical Support,low,en,400,Performance,IT,Tech Support,,,,,
Guidance on Securing Medical Data in WordPress for Healthcare,"We are reaching out for assistance in securing medical data on a WordPress site for a healthcare provider. It is essential for our healthcare organization to handle sensitive patient information and ensure that our website is compliant with relevant regulations. Could you provide us with recommendations for plugins, themes, and secure practices for a WordPress site? We would greatly appreciate guidance on data encryption, access controls, and backup procedures. Additionally, we would like to know about specific WordPress features that can help maintain the confidentiality of patient data.","Thank you for your concern regarding the security of medical data on a WordPress site. To ensure compliance with regulations, we recommend using reputable plugins for data encryption and access controls, as well as implementing two-factor authentication. Regular backups are also crucial. We can discuss specific WordPress features and best practices to maintain the confidentiality, integrity, and availability of patient data in more detail. For a comprehensive discussion, we would be available to call at <tel_num> at your convenience. Please let us know a time that suits you, and we will suggest a suitable time for the call.",Request,Customer Service,low,en,400,Security,Documentation,IT,Tech Support,,,,
Autorisierte Zugriffsbemühungen auf medizinische Systeme,"Autorisierte Zugriffsbemühungen auf medizinische Datenysteme wurden festgestellt. Veraltete Sicherheitsprotokolle treiben Probleme an. Ein Softwareupdate wurde durchgeführt, das Problem behält sich jedoch bestanden. Bitte benötigen wir Ihre Hilfe.","Wir müssen die Angelegenheit ermitteln. Bitte geben Sie mehr Details über Ihre Bemühungen bei dem Softwareupdate an, damit wir Ihnen besser helfen können.",Problem,General Inquiry,low,de,400,Security,Bug,Product,IT,Tech Support,,,
Verbesserung der Online-Sicherheit mit Bitdefender,Könnten Sie Einblicke in die Auswirkungen von Bitdefender Antivirus auf die Sicherheit und Online-Marketing-Strategie geben?,"Ich kann Informationen zur Verwendung von Bitdefender Antivirus und dessen Auswirkungen auf die Online-Marketing-Strategie bereitstellen. Bitdefender bietet fortschrittliche Täuschungsgefahr- und Anti-Phishing-Funktionen. Es wäre mir eine Freude, spezifische Details zur Implementierung zu besprechen. Sie können mich anrufen, um gemeinsam die Möglichkeiten zur Verbesserung der Online-Sicherheit zu ergründen.",Request,IT Support,medium,de,400,Security,Feedback,IT,Tech Support,,,,
Problems with Financial Reports,"After the latest software updates, the financial firm's integrated financial analysis reports are encountering issues. These problems seem to be due to incompatibility with existing data sources. Despite rolling back the updates and reconfiguring the analysis, the issues persist. Please assist in resolving the problem as soon as possible.","I am working on resolving the issues with the financial reports. To better assist, I would appreciate more details on the executed software updates. I would prefer to discuss this further over a call. Please share a suitable time slot for a call at <tel_num>. Alternatively, I can respond to your query via email and help resolve the issue <acc_num> as soon as possible.",Incident,Returns and Exchanges,medium,de,400,Bug,Performance,Documentation,Feedback,IT,Tech Support,,
Hilfe bei Störungen während digitaler Kampagne erforderlich,"Die Marketing-Agentur hat kritische Störungen während der digitalen Kampagne erfahren. Wichtige Werkzeuge und Geräte sind mehrfach gestört, was wahrscheinlich aufgrund von Softwarekonflikten liegen könnte. Nach dem Neustart der Geräte, Überprüfung der Verbindungen und erneuten Installieren der Anwendungen ist der Problem nicht mehr zu überwinden. Es gibt sichtbare Verzögerungen, die möglicherweise zu Verlusten führen. Einen unverzüglichen Einsatz benötigen wir, um die Kampagne korrekt weiterzuführen. Könnten Sie uns bitte raten, welche nächsten Schritte wir unternehmen sollen, um eine Lösung zu bieten und die Situation zu beheben?","Um die Störungen während der digitalen Kampagne zu überprüfen und rechtzeitig eine Lösung zur Verfügung zu stellen, benötigen wir Ihre Unterstützung. Um besser helfen zu können, möchte ich telefonisch mit Ihnen sprechen. Sie können sich an der Nummer <tel_num> wenden. Falls ein anderes Treffen besser geeignet ist, vorschlagen wir gerne einen anderen Zeitpunkt.",Incident,Technical Support,high,de,400,Bug,Performance,Disruption,IT,Tech Support,,,
Beratung für die Integration von Wolfram Mathematica erforderlich,"Geachte Kundenservice-Abteilung, ich schreibe an Sie, um zu fragen, ob es möglich ist, die Wolfram Mathematica Projektmanagement-Software-as-a-Service-Plattform in unser Projekt zu integrieren. Da ich eine erhöhte Rechenleistung benötige, denke ich, dass Mathematica ein großartiges Tool wäre, um zu nutzen. Allerdings bin ich unsicher, ob die Integration möglich ist. Könnten Sie mir Rat geben, anstelle dessen? Ich schätze es, wenn Sie mir Dokumentationen, Tutorials und andere Unterstützungsmaterialien zur Verfügung stellen. Besonders interessiert würde ich Informationen zu APIs und Plugins, die die Integration erleichtern könnten. Ich freue mich darauf, von Ihrer Hilfe zu hören und zu erkunden.","Geachte <name>, vielen Dank für Ihre Nachricht. Wir freuen uns, die Integration von Wolfram Mathematica in Ihr Projekt zu besprechen. Wir sind froh, dass Sie Interesse an der Nutzung von Mathematica zeigen. Um Ihnen besser zu helfen, könnten wir mehr Informationen über Ihre spezifischen Anforderungen zur Integration benötigen. Wir bieten APIs und Plugins an, die die Integration erleichtern können, aber dies muss auf den Details beruhen, um den besten Ansatz zu ermitteln. Wenn möglich, wäre ein Telefonat für eine detailliertere Diskussion von Interesse.",Request,Technical Support,high,de,400,Feature,Documentation,Feedback,Tech Support,,,,
Concern About Monthly Subscription Charges,"Dear Support, I hope this message finds you well. I am writing to bring to your attention an issue with my subscription charges. I was charged twice for the same month, and I believe this might be due to a system glitch. I have already contacted support, and a resolution has been provided. However, I would greatly appreciate it if you could look into this matter and possibly process a refund for the excess charge soon, if possible. Please let me know if you need any additional information to resolve the issue. My email address for further contact is necessary. Thank you for your prompt attention.","Hello, we are looking into the issue with your monthly subscription charges. To assist further, we would like to verify some information, including your account details, specifically your account number <acc_num>. Could you please confirm this information with me? We will also review any previous support interactions related to this matter. If necessary, we may need to contact you directly, and we are available for a call at <tel_num> if it is more convenient. We appreciate your patience while we work to resolve this issue and process the refund for any excess charge.",Problem,Billing and Payments,medium,en,400,Billing,Refund,Payment,Account,Tech Support,,,
Hospital-Data Breach,"An unauthorized access trigger occurred within the Hospital's IT systems, indicating a possible data breach due to outdated software and inadequate security settings.","Dear <name>, we take the possible data breach in the Hospital's IT system seriously and request immediate investigation of the matter. To assist with the investigation, please provide more details about the unauthorized access trigger, such as the date and time it occurred, and any additional relevant information. You can call <tel_num> to discuss further questions. Would you prefer to schedule a specific time for this? Please inform us of any concerns or questions regarding your <acc_num> Hospital-IT system.",Incident,Technical Support,high,de,400,Security,Bug,Performance,Virus,IT,,,
,"Hello Customer Support, we are encountering data integration problems between our analytics tools, which is impacting our investment optimization. The issue might be due to compatibility problems with outdated software. Despite updating Node.js and checking API connections between Evernote and Salesforce CRM, the issue remains unresolved. Our team is working on resolving it, but we could use some guidance to troubleshoot and resolve the issue. Could you please provide us with additional steps to take?",Please contact us at <tel_num> to discuss the steps needed to resolve the data integration issue.,Problem,Technical Support,high,en,400,Bug,Performance,IT,Tech Support,,,,
Fehlermeldung: Investment-Datenanalyse-Tool,"Das Investment-Datenanalyse-Tool wurde unerwartet aufgrund von mangelnden Serverressourcen am höchsten Benutzungstag abgeschaltet. Versuche, das Programm neu zu starten und die Protokolle zu löschen, waren erfolglos. Ich schätze, Sie könnten sich bald um diese Angelegenheit kümmern und eine Lösung bieten, da eine schnelle Aufklärung der Situation erforderlich ist.","Wir haben erfahren, dass das Investment-Datenanalyse-Tool kurzzeitig ausgefallen ist. Wir werden die Serverressourcen prüfen. Bitte melden Sie sich bald bei uns, wenn Sie die Angelegenheit bearbeiten möchten und eine Lösung bieten können.",Incident,Customer Service,medium,de,400,Bug,Performance,Outage,IT,Tech Support,,,
Problems with Multiple Products,"Dear Customer Service, I am writing to urgently draw your attention to a service outage affecting several of our products, including Python 3.9 and QuickBooks. This outage is causing significant disruptions to our work. I look forward to your prompt attention to this matter. Please let me know if you require any further information.","Dear [Name], In response to your email regarding the service outage affecting multiple products, including Python 3.9 and QuickBooks, I understand the urgency of the situation and the inconvenience it has caused. To assist you better, please provide more details about the error messages and any relevant information regarding the outage. We will need to arrange a meeting at a convenient time for both parties; please provide a suitable time for a follow-up call at [Phone Number].",Change,Service Outages and Maintenance,high,de,400,Outage,Disruption,Recovery,Product,,,,
Marketing-Campaigns Show Good Performance,Campaigns generate good results but may cause stagnation.,"Review marketing campaigns, contact relevant parties to discuss potential improvements and solutions to address stagnation, and thoroughly examine campaign performance.",Problem,Product Support,medium,de,400,Feedback,Performance,,,,,,
Significance of Implementing Advanced Security Protocols for Medical Data Management,"Dear Customer Service Department, I would like to draw your attention to the importance of implementing first-class security protocols for medical data management. It is crucial to protect patient data from unauthorized access, theft, and manipulation, especially considering the increasing number of cyberattacks and data leaks in the healthcare sector. Proactive measures are necessary to ensure the confidentiality, integrity, and availability of sensitive medical data. I urge you to take immediate action to implement robust security measures such as encryption, firewalls, and access controls to safeguard patient data. Additionally, regular security audits should be conducted.","Dear [Name],\n\nI appreciate your email highlighting the significance of enhanced security protocols for medical data management. It is important to take security seriously, especially regarding the confidentiality of patient data against unauthorized access, theft, and manipulation, in light of the increasing number of cyberattacks and data leaks in the healthcare sector.\n\nWe have already implemented robust security measures, including encryption, firewalls, and access controls, to ensure the confidentiality, integrity, and availability of patient data. We regularly conduct security audits to identify potential security risks.",Change,Technical Support,medium,de,400,Security,IT,Tech Support,Documentation,,,,
Hospital Security Breach,"Recently, sensitive patient information was exposed due to a potential security breach in the hospital's systems. The incident might have been caused by outdated software and insufficient firewall protections. We have updated the antivirus software and conducted a preliminary security audit to identify vulnerabilities.",We will investigate and provide immediate assistance to prevent future security breaches.,Problem,Customer Service,medium,en,400,Security,Virus,IT,Tech Support,,,,
Untersuchung von Rechnungsungleichheiten - Support-Anfrage,"Ich erhalte unerwartete Rechnungsungleichheiten für verschiedene Dienstleistungen, die unsere digitale Strategieinitiativen beeinträchtigen. Es scheint, dass Synchronisationsfehler, Duplikationen, Gebühren und Abonnementprobleme dahinterstehen. Die Rechnungsstellung wurde bei jedem Anbieter überprüft, aber die Probleme blieben bestehen. Ich bitte höflich um Hilfe, um das Problem zu lösen.","Sehr geehrte [Name], ich erhalte Ihre Anfrage zur Rechnungsungleichheit für mehrere Dienstleistungen und verstehe, wie stark die digitale Strategieinitiativen beeinträchtigt werden. Ich freue mich, Ihnen bei der Lösung des Problems behilflich zu sein. Um den Sachverhalt besser zu verstehen und eine schnelle Lösung zu finden, benötige ich bitte zusätzliche Details, einschließlich des spezifischen Dienstleistungs-Nr. [acc_num], die betroffen sind. Wenn Sie möchten, können wir gerne telefonisch besprechen. Bitte teilen Sie mir mit, wann ein passender Zeitpunkt für den Anruf für Sie wäre, [tel_num].",Problem,Billing and Payments,high,de,400,Billing,Refund,Payment,Account,Support,,,
