subject,body,answer,type,queue,priority,language,version,tag_1,tag_2,tag_3,tag_4,tag_5,tag_6,tag_7,tag_8
Problem with Financial Data Inconsistencies,"A financial company is encountering data inconsistencies that are affecting investment analysis, possibly due to software integration problems. It's believed that conflicting data sources are leading to inaccuracies. So far, the data connections have been checked and the analytics configurations reviewed for any errors. I would greatly appreciate it if you could look into this matter and provide a solution as soon as possible.","Received your email about the financial data inconsistency issue and am looking into it. To better understand the problem, could you please inform me about the specific discrepancies you are experiencing and the steps you have taken so far? Additionally, could you provide details on any errors found in the analytics configurations? We can schedule a call at the earliest convenience to resolve this issue as soon as possible. Please let me know a suitable time for the call at <tel_num>.",Problem,Technical Support,medium,en,400,Bug,Performance,IT,Tech Support,Documentation,,,
Problem mit dem System,"Liebe Kundenservice, unerwarteter Systemausfall hat die Datenanalyse verhindert und liegt an mangelnden Serverressourcen. Bereits versucht wurden, den Server neu zu starten und Softwareupdates zu suchen, jedoch blieben die Probleme bestehen. Der Ausfall führte zu einem Verlust ungespeicherter Daten und zu einer wesentlichen Unterbrechung. Bitte helfen Sie bei der Behebung des Problems, um zukünftige Vorkommen zu vermeiden und Unterbrechungen für den Betriebsablauf zu minimieren. Geben Sie bitte die nächsten Schritte für die Fehlerbehebung und die Lösung des Problems an. Vielen Dank für die schnelle Beachtung des Problems.","Liebe [Name], entschuldigen wir uns für den Systemausfall, den wir ausgenutzt haben. Wir danken Ihnen für Ihre Aufmerksamkeit. Um das Problem zu lösen, möchten wir einen Anruf vereinbaren, um die beste Lösung zu bestimmen. Es wäre gut, wenn Sie ein geeignetes Zeitfenster für den Anruf nennen könnten, damit wir schnell eine Verbindung herstellen und beginnen können, die Fehlerbehebung. Bitte geben Sie uns Ihre Telefonnummer [Tel-Nummer], damit wir die Verbindung herstellen können.",Incident,Technical Support,medium,de,400,Outage,Disruption,Performance,Maintenance,IT,Tech Support,,
Optimizing Investments,Utilize TensorFlow for data analytics in investments,"Dear [Name], thank you for the email concerning investment optimization. Using TensorFlow for data analytics sounds like an interesting approach. To better assist you, could you please provide details about your current investment portfolio and specific goals for achieving optimization? This will enable us to provide a tailored solution. If available, we would like to schedule a call at <tel_num> to discuss further. Please let us know a convenient time.",Request,Customer Service,high,en,400,Feedback,Performance,Feature,Documentation,,,,
,"Hello Customer Support, I am experiencing issues with generating my critical data analytics report due to software compatibility problems arising from recent software updates. I have already tried reinstalling the affected software and restarting my systems, but the issue still persists. Could you please assist me in resolving this matter as soon as possible to avoid any delays?",We will assist with the software compatibility issue. Please provide details about the updates to the affected software so we can investigate further.,Incident,Technical Support,high,en,400,Bug,Performance,IT,Tech Support,,,,
Update pricing for bundled products,Asking for an update on the pricing structure for our bundled product offerings in the project management SaaS. Kindly review and implement the necessary changes.,"Hello [name], we have received your request to update the pricing structure for bundled product offerings in our project management SaaS. We will review and implement the changes as needed. Please provide more details on the updates you would like to make. You can contact us at [tel_num] to discuss further.",Change,Sales and Pre-Sales,low,en,400,Feature,Product,Feedback,,,,,
Issue with Data Analytics Tool Producing Inconsistent Investment Forecasts,"Our data analytics tool is generating inconsistent investment forecasts. Recent software updates may be causing data integration issues. We have restarted the application and checked the data sources, but the errors and issues still persist. Assistance is needed to resolve this issue.",Please review the issue with your data analytics tool and contact us at <tel_num> to discuss scheduling a troubleshooting session to resolve the inconsistent investment forecasts issue. Your account number is <acc_num>.,Problem,Technical Support,high,en,400,Bug,Performance,Feature,IT,Tech Support,,,
Enhancing ClickUp for Project Management,"I am in need of customer support to seek guidance on optimizing ClickUp for better project management and collaboration. Could you provide tips and best practices for using the platform more efficiently? I would really appreciate advice on customizing workflows, managing tasks, and facilitating team communication. Thank you for your assistance, and I look forward to hearing from you soon.","Hello, thank you for reaching out to the customer support team regarding optimizing ClickUp for better project management. I would be happy to provide tips and best practices for using the platform more efficiently. To customize workflows and manage tasks effectively, I recommend utilizing ClickUp's automated workflow features and prioritizing tasks based on urgency and importance. For facilitating team communication, make use of the platform's built-in chat and notification features. Let's discuss your specific needs further.",Request,Technical Support,high,en,400,Feedback,IT,Tech Support,Feature,,,,
Problem with Bose QuietComfort 35 II Headset,"Facing disconnections post software update, have already restarted and reinstalled drivers.","<name>, we apologize for the issue with your Bose QuietComfort 35 II Headset. The disconnections after the software update are frustrating. Given that you have already tried restarting and reinstalling the drivers, we would like to investigate further. Please provide a detailed description of the disconnections so we can assist you with the next steps to resolve the issue.",Problem,Technical Support,high,en,400,Bug,Hardware,Performance,IT,Tech Support,,,
Integration of Avid Pro Tools SaaS Project Management Solution,"Exploring the process of integrating Avid Pro Tools SaaS into our project management solution. Could you provide more information on this? I would like to know the steps involved, specific requirements, and be aware of any potential compatibility issues. Additionally, are there any tutorials or guides available to help me walk through the process? I am very interested in learning more about the solution to help streamline our workflow and improve collaboration within the team. Please let me know what resources and support are available to assist with the integration.","<name> appreciates your interest in integrating Avid Pro Tools SaaS into your project management solution. To initiate the integration process, please ensure that the latest version of the Pro Tools solution is installed. A step-by-step guide is available on our website, which outlines the requirements and considerations for compatibility. We also offer tutorials and support resources to assist with the integration. If you have any specific questions or need assistance, please let us know; we are happy to help. Alternatively, you can schedule a call at <tel_num>.",Request,Technical Support,high,en,400,Feature,Documentation,IT,Tech Support,,,,
Technische Herausforderung bei Optimierungsinstrument,"Das Investitionsoptimierungs-Tool brach die Datenverarbeitung, was wahrscheinlich auf eine Serverüberlast zurückzuführen ist. Ich habe versucht, den TP-Link-Switch neu zu starten und Apache Hadoop neu zu starten, aber das Problem besteht weiterhin. Das Tool verarbeitete einen großen Datensatz. Ich habe die Dienstleistungen neu gestartet, aber das Problem behält sich bestehen. Könnten Sie bitte helfen, das Problem schnell zu lösen?","Ich arbeite an der technischen Problematik des Optimierungsinstruments. Ich möchte das Problem analysieren und einen Anruf vereinbaren. Es wäre hilfreich, wenn wir über die aktuelle Serverlast sprechen könnten, die mit dem verarbeiteten großen Datensatz verbunden ist. Wenn eine Konferenzzeit für Sie geeignet ist, teilen Sie bitte Ihre passende Zeit mit. Sie können mich anrufen unter <tel_num>.",Incident,Technical Support,high,de,400,Bug,Performance,Network,IT,Tech Support,,,
Request for Support on Zoom Connection Issues,"Customer support, I am writing to report the problem with my recent Zoom call. This was a data analysis meeting where the call was frequently dropped, which disrupted our investment discussions. The issue might be due to poor internet connectivity or insufficient bandwidth. I have already tried troubleshooting by resetting the router and adjusting the Zoom settings, but the problem still persists. I would greatly appreciate your assistance in resolving this issue to ensure uninterrupted communication. Please let me know the additional steps I should take to resolve the problem.","<name>, we acknowledge your support request regarding the Zoom connection issues experienced in your recent data analysis meeting. We are sorry to hear that the call was disrupted due to frequent drops. We understand that you have already tried troubleshooting by resetting the router and adjusting the Zoom settings. We would be happy to assist you further. Could you please provide us with details about your internet connection, including your internet service provider and speed? Additionally, it would be helpful if you could let us know the number of participants in the meeting. This information will help us in resolving the issue more effectively.",Incident,Technical Support,medium,en,400,Network,Performance,IT,Tech Support,,,,
Support for Enhancing Investments with Alteryx,"Seeking assistance in optimizing investments through better data analytics with Alteryx. Would appreciate detailed insights and guidance on leveraging Alteryx's capabilities to make informed investment decisions. Kindly share practices, tools, and techniques to enhance my investment strategy and provide relevant resources for getting started.","Dear [Name], I would be delighted to help you optimize your investments using better data analytics with Alteryx. I will provide relevant practices and resources to enhance your investment strategy. Please let me know a suitable time to call and discuss further at [Tel Num].",Request,Billing and Payments,medium,en,400,Feedback,IT,Tech Support,Documentation,,,,
Support Concern Regarding Data Analysis,"Data analysis processes have come to a halt, which is affecting our investment optimization efforts. Could we please restart the check on Mailchimp to address this issue?","We are looking into the data analysis problem. Could you please provide the exact error message you are receiving? It would be helpful if we could schedule a call at your convenience to discuss and resolve the issue impacting investment optimization. Please reply with a suitable time for the call, and I can provide my contact number for you to reach out. <tel_num>",Incident,IT Support,high,en,400,Bug,Performance,IT,Tech Support,,,,
Support Case for Incident Report,There was an incident that might have endangered patient data because of obsolete security measures.,Please take this matter seriously and investigate immediately. Kindly provide details to assist in the resolution.,Incident,Technical Support,high,en,400,Security,IT,Tech Support,Bug,,,,
Boosting Brand Growth Online,Inquiring about customer support to update digital marketing tools and strategies with the goal of enhancing brand growth and online presence. Interested in exploring new ways to reach the target audience and increase engagement. Could please provide recommendations on how to implement these changes? Appreciate your help and look forward to hearing back soon. Thank you for your assistance.,"Thank you for reaching out to our customer support team, <name>. We are happy to assist with updating your digital marketing tools and strategies to enhance your brand's growth and online presence. To provide more tailored recommendations and a plan for implementation, could you please share more information about your current situation and goals? We are available to schedule a call at <tel_num> to discuss further.",Change,IT Support,medium,en,400,Feedback,Sales,IT,Tech Support,,,,
Problem with Digital Strategy Execution,"Our marketing firm is facing difficulties in executing the digital strategy, which is impacting brand expansion. This might be due to the inadequate use of integration tools such as HubSpot and Kubernetes. Despite efforts to diagnose and update HubSpot CRM, the problem remains unresolved. We would greatly appreciate your advice on how to correctly integrate these tools to resolve the issue.",We will review the digital strategy execution issue and provide guidance on integrating HubSpot and Kubernetes. Please schedule a call at <tel_num> to discuss and determine the appropriate course of action. Your account number is <acc_num>.,Incident,Customer Service,medium,en,400,Feedback,Bug,Feature,IT,Tech Support,,,
Issue with Laravel Application,We are experiencing connection issues with our Laravel application.,"Dear customer, we are aware of the problem with the Laravel application. Could you please provide more details about the connection issues, such as error messages and symptoms? We would be glad to assist in identifying the problem. If necessary, we can arrange a call to discuss any further questions at a suitable time.",Incident,Technical Support,high,de,400,Bug,Network,Performance,IT,Tech Support,,,
Assistance with Django 3.2 SaaS Integration,"Dear Customer Support Team, I am inquiring about the connection to the integration of Django 3.2 into a SaaS solution. Could you provide detailed documentation and resources to guide the process? I would appreciate it if you could offer tutorials and guidance. I am looking to utilize the Django SaaS solution to develop a robust and efficient application. Please share any specific requirements or considerations you have in mind. I would also like to be informed about potential limitations or known issues. Thank you for your time.","Dear [Name], we appreciate your interest in integrating Django 3.2 into your SaaS solution. We will provide detailed documentation and resources to assist with the process. Our integration knowledge base includes specific integration guides and step-by-step tutorials for integrating Django. To obtain this information, please visit our support section on the website. Should you have any further questions or specific needs, we would be pleased to offer telephone consultations at your convenience. You can reach us at [Phone Number] or respond via email. Thank you for your availability.",Request,Technical Support,medium,de,400,Feature,Documentation,IT,Tech Support,,,,
Enhanced Security Features for Software Users Across Products,"Dear Customer Support, I am writing to inquire about the integration of enhanced security features for software users across affected products. I believe these features should include multi-factor authentication, encryption, and regular security updates to help improve data security and prevent potential security vulnerabilities. Ensuring data availability and user security is crucial. I would appreciate it if you could consider implementing these necessary changes as soon as possible. Thank you for your time and support.","Dear [Name], thank you for your inquiry regarding enhanced security features for software users across products. We understand the importance of data and security. Our team is reviewing the request for multi-factor authentication, encryption, and regular security updates. We will consider the possibility of implementing these features within the given timeframe and create a rollback plan if necessary. If you need further information, please contact us. Alternatively, it would be possible to arrange a call to discuss. Please provide a suitable time for the call at [Phone Number].",Change,Customer Service,medium,de,400,Security,Product,Feature,IT,Tech Support,,,
Boost Investment in Data Analytics,Improve investment tools for optimization,Review and enhance data analytics tools to optimize investment decisions promptly,Change,IT Support,medium,en,400,Feature,Feedback,IT,Tech Support,,,,
Inquiry Regarding Digital Brand Founding,"I am interested in learning more about digital strategies for brand founding. Could you provide more detailed information about the services offered? I would greatly appreciate any insights you can share. Thank you for your engagement, and I look forward to your response.","Dear <name>, thank you for your inquiry about our digital brand founding services. We offer a range of services, including social media management, content production, search engine optimization, and support for reaching your business goals online. Our approaches are tailored to meet the specific needs and objectives of our clients. If you would like to discuss how our services can support your business, we would be happy to schedule a call. Please let us know a convenient time to reach you at <tel_num> to discuss any further questions you may have.",Request,IT Support,medium,de,400,Feedback,Sales,Lead,Documentation,,,,
Concern Regarding the Efficiency of the Data Analytics Tool,"The data analytics tool is facing sporadic performance issues. Recent software updates might be leading to server overload. Steps like restarting and clearing cache have been taken, but the problem continues.","To resolve this, we recommend investigating the issue with the data analytics tool. You can contact us at <tel_num> for troubleshooting. We can arrange a callback at a time that is convenient for you.",Incident,Technical Support,high,en,400,Performance,Bug,IT,Tech Support,,,,
Details on Project Management SaaS Pricing,Is it possible to get details on the pricing tiers for your project management SaaS service? Thank you!,"Hello, regarding your inquiry about the pricing tiers for our project management SaaS service. We offer three main tiers, each with varying levels of features and support, and pricing is based on the number of users and the level of service required. For detailed information, I would be happy to discuss this with you. We are also available for a brief call to go over the pricing options and answer any questions you may have. Please let us know a convenient time for the call. Contact number: <tel_num>.",Request,Billing and Payments,medium,en,400,Sales,Feedback,Product,,,,,
Probleme bei Marketing-Agenturen zur Erhöhung von Leads,Beobachtet werden einen Anstieg der Leads im Marketingbereich.,"Derzeit sind Probleme bei der Erhöhung von Leads bei Marketing-Agenturen bestehend. Bitte geben Sie mehr Details zum Anstieg der Leads an, die Sie erlebt haben. Wir können einen Konferenztermin planen, um dies zu besprechen.",Incident,Sales and Pre-Sales,medium,de,400,Feedback,Sales,Lead,,,,,
Request for Guidance on Securing Medical Data in a PostgreSQL Environment for a Hospital,I need advice on securing medical data in a PostgreSQL environment for a hospital setting. It's crucial to ensure that patient records are protected.,"To secure medical data in a PostgreSQL environment for a hospital, I recommend enabling encryption at rest and in transit, using SSL/TLS certificates. Implement role-based access control to limit access to authorized personnel. Regularly update and patch PostgreSQL to prevent exploits. I suggest using a Web Application Firewall to protect against SQL injection attacks. If you need assistance, please provide details about your current setup, and I'll be happy to guide you through the process and schedule a call.",Request,Technical Support,high,en,400,Security,IT,Tech Support,Documentation,,,,
Improve Data Analytics for Financial Strategies,"customer support, expressing desire for enhancements to data analytics capabilities to improve investment optimization and performance tracking of financial strategies. current system offers basic insights, but advanced analytics would significantly aid the decision-making process. interested in seeing features such as predictive modeling, risk assessment, and portfolio optimization. these enhancements would allow for making informed investment decisions and tracking performance of financial strategies","Dear [Name], thank you for your email regarding enhancements to data analytics capabilities for financial strategies. We have noted your request for features including predictive modeling, risk assessment, and portfolio optimization. Could you please provide more details about your current system and the expected outcomes? We will schedule a call at [tel_num] to discuss your needs further.",Change,Service Outages and Maintenance,medium,en,400,Feature,Feedback,Performance,Documentation,,,,
Investment Portfolio Analysis,"The investment portfolio analysis tool encountered issues during the routine update, likely because of incompatible data formats.","We apologize for the issue. Please try clearing the cache and restarting the tool. For further assistance, contact us at <tel_num>.",Incident,Customer Service,low,en,400,Bug,Performance,IT,Tech Support,,,,
Details on Project Management Features Customization,Seeking comprehensive information on project management features and customization options available in the SaaS platform. Particularly interested in how the platform can be tailored to meet the specific needs of our organization. Could you provide details on the kinds of customization options available and how they are implemented? Looking forward to a detailed discussion on how these features can be customized to support our team's workflow.,"Would be happy to discuss project management features and customization options with you, <name>. Our platform offers a variety of tools and functionalities tailored to meet the specific needs of organizations. Please contact <tel_num> to discuss and obtain detailed information on customization options and how they can support your team's workflow.",Request,Customer Service,low,en,400,Feature,Documentation,Feedback,,,,,
Guidelines for Securing Medical Data in BenQ TK850 Hospital Settings,Seeking advice on securing medical data within a BenQ TK850 hospital environment. Could you offer recommendations and best practices to ensure the security and integrity of sensitive medical information?,Offering general security guidelines and best practices for securing medical data in a BenQ TK850 hospital environment.,Request,Product Support,high,en,400,Security,Documentation,Feedback,,,,,
Seeking Insights on Role of Data Analytics in Enhancing Investment Strategies,"I am interested in learning about how data analytics can be utilized to inform investment decisions and drive business growth. Could you provide information on this topic, including examples and case studies that demonstrate the effectiveness of data analytics in investment strategies?","I am happy to provide information on the role of data analytics in enhancing investment strategies. Data analytics plays a crucial role in informing investment decisions and driving business growth by providing insights into market trends and customer behavior. We can utilize data analytics to analyze market data and identify growth opportunities. I would be happy to provide more information on this topic, including examples and case studies. Let's discuss further, and I would be available for a call.",Request,Product Support,medium,en,400,Feedback,Sales,Lead,Documentation,,,,
Frequent Disconnections in Software During Peak Hours,"Users encounter disconnections during peak traffic times. Despite optimizing database queries and increasing server capacity, the issues remain. A follow-up request for more information on disconnection error messages and their frequency is needed. Also, a call at a convenient time to discuss and resolve the issue is requested. Please provide a suitable time as <tel_num>.","Writing an acknowledge email regarding frequent disconnections in software during peak hours. Steps taken include optimizing database queries and increasing server capacity, but issues persist. To better understand the issue, requesting information on disconnection error messages and their frequency. Additionally, scheduling a call at a convenient time to discuss and resolve the issue is requested. Please let us know a suitable time, <tel_num>, for the call.",Problem,Technical Support,high,en,400,Network,Performance,Disruption,IT,Tech Support,,,
Information über Datenanalyse-Dienstleistungen zur Optimierung von Investitionsentscheidungen,Können Sie Details zu den Datenanalyse-Dienstleistungen für die Optimierung von Investitionsentscheidungen geben? Vielen Dank!,Wir bieten individuelle Datenanalyse-Dienstleistungen sowie Optimierungslösungen für Investitionen.,Request,Technical Support,high,de,400,Feedback,Feature,Documentation,,,,,
