subject,body,answer,type,queue,priority,language,version,tag_1,tag_2,tag_3,tag_4,tag_5,tag_6,tag_7,tag_8
Netzwerkstörungen beeinträchtigen medizinische Informationen,"Sehr geehrter Kundenservice, ich möchte ein Problem mit dem Netzwerk unseres Gesundheitsdienstleisters melden. Es treten wiederholte Netzwerkausfälle auf, die den Zugriff auf medizinische Daten behindern. Wir vermuten, dass das Problem möglicherweise durch einen Fehler in der Firmware der TP-Link-Switches verursacht wird. Wir haben versucht, die Switches neu zu starten und die Firmware zu aktualisieren, doch das Problem besteht weiterhin. Wir würden es sehr schätzen, wenn Sie die Angelegenheit so schnell wie möglich prüfen und eine Lösung anbieten könnten. Die Ausfälle verursachen erhebliche Störungen im Betrieb und beeinträchtigen die Fähigkeit, qualitativ hochwertige Versorgung zu leisten.","Sehr geehrter <Name>, vielen Dank, dass Sie uns bezüglich der Netzwerkausfälle kontaktiert haben, die den Zugriff auf medizinische Daten beeinträchtigen. Wir entschuldigen uns für die Störungen, die den Betrieb und die Patientenversorgung beeinträchtigen. Bitte teilen Sie uns die genaue Modellbezeichnung der TP-Link-Switches sowie die aktuell installierte Firmware-Version mit. Gerne vereinbaren wir auch ein Gespräch, um das Problem im Detail zu besprechen und die beste Vorgehensweise zu bestimmen. Bitte nennen Sie uns einen passenden Zeitpunkt.",Problem,Product Support,medium,de,52,Network,Outage,Disruption,Recovery,,,,
Sicherung der Abrechnungsoptionen für medizinische Daten,Könnten Sie bitte eine Anleitung zu den verfügbaren Abrechnungsoptionen bereitstellen?,"Sehr geehrter Kunde, vielen Dank, dass Sie uns bezüglich der Sicherung der Abrechnungsoptionen für medizinische Daten kontaktiert haben. Wir bieten verschiedene Abrechnungsmodelle an, um die Sicherheit Ihrer medizinischen Daten zu gewährleisten. Gerne möchte ich die Details der Optionen mit Ihnen besprechen und einen Telefontermin vereinbaren. Bitte teilen Sie mir eine passende Zeit mit, damit ich Sie unter <tel_num> anrufen kann. Alternativ sende ich Ihnen einen sicheren Link, um die Optionen zu prüfen. Für die bestmögliche Beratung benötige ich Ihre <acc_num>, um Ihr Konto zu überprüfen und die besten verfügbaren Optionen anzubieten.",Request,Billing and Payments,high,de,52,Security,Backup,Documentation,,,,,
Support Request Regarding Billing Discrepancies,"A marketing agency has identified inconsistencies in billing across multiple platforms. The potential cause might be system synchronization errors that occurred during recent updates. Attempts were made to contact support and verify account settings, but the issue remains unresolved. We would appreciate it if you could investigate the matter and provide a solution at your earliest convenience. Please let us know if additional information is needed to facilitate the investigation. We look forward to your response and a resolution to the problem.","We are investigating the billing discrepancies and would like to request additional information to aid our investigation. Could you please provide the account number and a detailed list of the discrepancies observed across the various platforms? This will help us better understand the issue and work towards a solution. If necessary, we can contact you at a later time to discuss further details. Kindly share a suitable time for a call at <tel_num> to clarify the issue in more detail.",Incident,Billing and Payments,low,de,52,Billing,Account,Support,Disruption,Maintenance,,,
Reported Problems After Financial Firm System Upgrade,"The financial institution experienced multiple outages across various products, which disrupted their investment analytics. The suspected cause is conflicts arising from recent system updates. Reboot diagnostics have been conducted. The technical team is actively working to resolve the problem; however, the issue remains unresolved. These outages have led to substantial losses for the firm's clients, making a prompt resolution critical to prevent further financial impact. The technical staff is attempting to identify the root cause, but the complexity of the system makes this challenging. The firm is also considering seeking additional assistance.",We received your email regarding the system update problems and would like to discuss this with you. Please let us know a convenient time for a call at <tel_num> so we can assist with the next steps to resolve the issue as soon as possible. The account number is <acc_num>.,Incident,Service Outages and Maintenance,high,en,52,Outage,Disruption,Recovery,Maintenance,IT,Tech Support,,
Verbesserung der Sicherheitsvorkehrungen zum Schutz medizinischer Daten,"Maßnahmen zur Erhöhung der Sicherheit implementieren, um den Schutz sensibler medizinischer Informationen zu gewährleisten. Sicherheitsprotokolle regelmäßig überprüfen und verbessern. Zusätzliche Schutzmaßnahmen und Protokolle einführen, um unbefugten Zugriff zu verhindern. Kontaktieren Sie Vertreter <tel_num>, um die Details der Umsetzung zu besprechen, und berichten Sie regelmäßig über den Fortschritt.","Sicherheitsvorkehrungen kontrollieren und optimieren, um den Schutz medizinischer Daten zu gewährleisten. Weitere Schutzmaßnahmen und Protokolle einführen, um unbefugten Zugriff zu verhindern. Wenden Sie sich an den Vertreter <tel_num>, um die Implementierungsdetails zu klären, und geben Sie Updates zum Fortschritt.",Change,Product Support,low,de,52,Security,Data Protection,Medical Data,Protocols,Compliance,Privacy,Risk Management,
Guidelines for Subscription Management,"Customer support team reaching out to an analytics optimization company. We are currently overseeing subscriptions for various products and need detailed billing and payment instructions to maintain smooth operations. Could you kindly supply a complete guide on how to navigate the subscription process, including payment conditions, billing periods, and any extra charges related to accounts? We would also appreciate information about the subscription management tools and resources available from your company to assist us.","Provide a detailed guide on managing subscriptions, covering payment terms, billing cycles, and supporting optimization initiatives. We look forward to discussing the details soon.",Request,Billing and Payments,high,en,52,Account,Billing,Payment,Documentation,Feedback,,,
Support for Medical Data Security,"Customer Support, I am seeking assistance in drafting a request for implementing advanced security measures to better safeguard medical data within hospital infrastructure. Due to the rising threat of cyberattacks, it is crucial to take proactive measures to protect sensitive patient information and prevent potential data breaches. I would appreciate guidance on best practices for securing medical data, along with recommendations for robust security solutions that can be integrated with our existing systems. Furthermore, I am interested in learning about the latest security advancements.","<name>, thank you for contacting the Service Desk regarding support for medical data security. We take the protection of sensitive patient information seriously and would be happy to guide you through recommended practices and robust security solutions. To discuss your specific needs and explore available options, we can schedule a consultation with one of our security experts. Please let us know a convenient time for a call at <tel_num> to arrange the meeting. Additionally, kindly have <acc_num> ready.",Change,Billing and Payments,medium,en,52,Security,IT,Cyberattack,Data Protection,Hospital Infrastructure,,,
Marketing Initiatives Not Meeting Expectations,"The digital marketing efforts managed by the agency have not achieved the anticipated results. Initial diagnostics involved verifying software compatibility and resetting campaign settings; however, the problems continue. ",We received an email concerning the underwhelming performance of the digital campaigns. Please provide detailed information on the expected versus actual performance metrics. I would like to arrange a call at a convenient time to discuss the issue in detail and explore potential solutions. Kindly inform me of a suitable time for the call.,Incident,Customer Service,low,en,52,Feedback,Campaign,Software Compatibility,Issue,Marketing,Diagnostics,,
Verbesserung der Investitionsdatenanalyse,"Sehr geehrter Kundendienst, ich möchte mich erkundigen, welche Datenanalyse-Tools zur Optimierung von Anlagestrategien in Finanzunternehmen eingesetzt werden können. Könnten Sie mir dazu detaillierte Hinweise geben? Besonders interessiert mich, welche spezifischen Werkzeuge und Techniken in der Branche verwendet werden. Außerdem freue ich mich über Informationen zu bewährten Praktiken bei der Implementierung von Datenanalysen zur Unterstützung von Anlageentscheidungen. Ich bin überzeugt, dass datenbasierte Erkenntnisse die Anlageergebnisse deutlich verbessern können, und bin gespannt darauf, mehr darüber zu erfahren, wie diese Tools effektiv genutzt werden können. Bitte teilen Sie mir Ihre Hinweise mit.","Sehr geehrter <name>, vielen Dank, dass Sie den Kundendienst kontaktiert haben. Wir schätzen Ihr Interesse an der Optimierung Ihrer Investitionen mithilfe von Datenanalyse-Tools. Gerne geben wir Ihnen allgemeine Hinweise zu diesem Thema, einschließlich bewährter Branchenpraktiken und gängiger Werkzeuge. Für spezifischere Informationen bitten wir Sie, uns mehr Details zu Ihren aktuellen Anlagestrategien und Zielen mitzuteilen. Unser Team steht bereit, dieses Thema zu einem passenden Zeitpunkt mit Ihnen zu besprechen. Möchten Sie, dass wir Sie unter <tel_num> anrufen, um die Details zu klären?",Request,Returns and Exchanges,low,de,52,Performance,Security,Product,Feedback,IT,,,
Inquiry About Billing Options,"I am interested in exploring the billing plans available for your scalable SaaS project management software. Could you please provide comprehensive details about the different plans, including pricing, features, and any discounts that might be available? I would also appreciate information on free trials and demos to help determine if the software aligns with my needs.","<name>, thank you for your interest in our scalable SaaS project management solution. We offer a variety of billing options and payment plans designed to meet different needs. Our plans include features such as task management, team collaboration, and reporting tools. We also provide discounts for annual commitments and offer free trials to test the software. I would be happy to discuss the details and answer any questions you may have. Please let me know if you'd like to schedule a call at <tel_num> or if you'd prefer to receive a detailed overview via email.",Request,Billing and Payments,low,en,52,Billing,Payment,Subscription,SaaS,Pricing,Discount,Free Trial,Feature
Data Processing Troubleshooting,"Customer Support, the company has encountered delays in data processing that impact investment analytics, possibly due to incompatible USB stick drivers or Node.js version mismatches. Initial steps included updating Node.js and restarting devices, but the problems continue. Despite these efforts, the issue persists, and we are seeking assistance. We would appreciate any guidance on resolving this problem, including recommendations for software updates or configuration adjustments that might be required. Please inform us of any additional information needed.","<name>, thank you for reaching out regarding the data processing issue. We are eager to assist in resolving this problem. To better understand the situation, could you please specify the incompatible USB stick drivers or Node.js versions involved? Additionally, kindly confirm the exact Node.js version you have installed and provide any specific error messages encountered. This information will help us offer targeted advice on potential software updates or configuration changes necessary to resolve the issue. You can contact us at <tel_num>.",Incident,Technical Support,high,en,52,Performance,Bug,Hardware,Software,Tech Support,,,
Benötigte Hilfe bei Redis-Integration,Könnten Sie bitte eine ausführliche Dokumentation zur Verfügung stellen?,"Bitte stellen Sie die umfassende Redis-Integrationsdokumentation bereit. Ich würde gerne die aktuelle Version einsehen. Bevorzugen Sie eine E-Mail, oder möchten Sie unter <tel_num> anrufen, um weitere Details zu klären?",Request,Technical Support,medium,de,52,Documentation,IT,Tech Support,,,,,
Medical Data Security Breach,"Incident: The medical records system of the healthcare facility has been breached. Potential cause: unauthorized access due to a system vulnerability. Actions taken: password resets, firewall inspections, preliminary malware scans. Requesting support to investigate and resolve the issue.",Please look into the healthcare security breach by contacting <tel_num> to discuss the investigation and potential resolution steps. Refer to account <acc_num> for further details.,Incident,Technical Support,medium,en,52,Security,Breach,Malware,Network,IT,Tech Support,,
Financial Discrepancy,"The financial institution encountered erroneous investment data analysis outcomes, potentially due to faulty data integration. The first steps in troubleshooting included checking data sources and adjusting analytical models to fix the problem.","<name>, thank you for reporting the financial discrepancy. We are sorry to hear that the financial institution faced inaccurate investment data analysis results. It's good to know that initial troubleshooting measures, such as verifying data sources and recalibrating analytical models, have been undertaken. To assist you further, could you please share more details about the issue, including any specific data errors or messages received? This will help us understand the problem better and provide a more effective solution.",Incident,Returns and Exchanges,low,en,52,Bug,Security,IT,Tech Support,,,,
SendGrid Integrationsrichtlinien,"Sehr geehrter Kundendienst, ich bitte um detaillierte Integrationsrichtlinien für SendGrid in Verbindung mit Bitbucket innerhalb einer skalierbaren SaaS-Plattform. Unser Entwicklerteam ist daran interessiert, die Funktionen beider Dienste zu nutzen, um die Funktionalität unserer Anwendung zu verbessern. Wir würden es sehr schätzen, wenn Sie Schritt-für-Schritt-Anleitungen für die Integration der Dienste bereitstellen könnten, einschließlich der erforderlichen API-Schlüssel, Authentifizierungsprotokolle und Konfigurationseinstellungen. Zusätzlich wären Beispiele sehr hilfreich, um zu sehen, wie Kunden erfolgreich SendGrid in Bitbucket integriert haben. Ich freue mich auf Ihre Rückmeldung bezüglich der Möglichkeiten zur Integration.","Bitte stellen Sie die detaillierten Integrationsrichtlinien für SendGrid und Bitbucket bereit, inklusive Schritt-für-Schritt-Anleitungen für die erforderlichen API-Schlüssel sowie Beispiele erfolgreicher Integrationen. Ich würde mich freuen, wenn Sie die Dokumentation per E-Mail zusenden könnten.",Request,Customer Service,medium,de,52,Security,IT,Tech Support,Documentation,,,,
,"Customer Support reports a critical issue impacting hospital systems. The team has encountered multiple data breaches, likely due to outdated security patches on several products. Efforts to resolve the problem included applying patch updates, running malware scans, and conducting access audits. Despite these measures, the breaches remain unresolved, resulting in the compromise of sensitive patient information and raising concerns about potential repercussions. Immediate assistance is required to identify the root cause.","<name>, we acknowledge the urgent nature of the critical issue affecting the hospital's systems and the need to resolve the data breaches promptly. To assist you effectively, please provide details about the specific products and systems impacted, including information on applied patch updates, the results of malware scans, and access audits performed. We will guide you on the next steps and recommend additional security measures to prevent future breaches. If needed, we can schedule a call at <tel_num> to discuss further.",Incident,Product Support,high,en,52,Security,Outage,Disruption,Recovery,IT,Tech Support,,
System Outage Encountered Today,"Dear Customer Support,<br>We wish to notify that a healthcare provider experienced an unforeseen system outage, which may be linked to a security incident. Preliminary diagnostics revealed abnormal network behavior.<br>Our team promptly attempted to update firewall settings and reboot the system, but these actions did not fully restore normal operation.<br>We are concerned about the potential impact on patient care and data security.<br>Please advise on the appropriate next steps.<br>Best regards, [Your Name]",We apologize for the inconvenience. Kindly provide details of the unusual network activity so we can assist with the investigation.,Incident,Service Outages and Maintenance,high,en,52,Outage,Network,Security,Disruption,Recovery,,,
Unbefugter Zugriff auf medizinische Daten festgestellt,"Sehr geehrter Kundenservice, ich möchte einen schwerwiegenden Vorfall melden, bei dem unbefugter Zugriff auf die medizinischen Daten unserer Gesundheitseinrichtung stattgefunden hat. Die Untersuchungen deuten darauf hin, dass dies wahrscheinlich durch eine Fehlkonfiguration der IT-Systeme unseres Krankenhauses verursacht wurde. Sofort wurden Maßnahmen ergriffen, einschließlich der Durchführung von Firewall-Updates und der Einleitung von Zugriffsaudits. Leider wurde bei diesen Maßnahmen das Problem nicht vollständig gelöst. Der unbefugte Zugriff hat dazu geführt, dass sensible Patientendaten kompromittiert wurden, was unsere Besorgnis hinsichtlich der möglichen Folgen für die Privatsphäre unserer Patienten und das Vertrauen in unsere Einrichtung erhöht.","Sehr geehrter <Name>, wir nehmen die Meldung des unbefugten Zugriffs auf die medizinischen Daten Ihrer Gesundheitseinrichtung sehr ernst und schätzen Ihre schnelle Mitteilung. Wir werden umgehend eine Untersuchung des Vorfalls einleiten und Ihnen Ratschläge für die nächsten Schritte geben, um zukünftige Vorfälle zu verhindern. Zur Unterstützung der Untersuchung benötigen wir möglicherweise zusätzliche Informationen, insbesondere zu den bisher durchgeführten Zugriffsaudits und den durchgeführten Firewall-Updates im Zusammenhang mit den falsch konfigurierten IT-Systemen Ihres Krankenhauses. Könnten Sie uns bitte nähere Details zu diesen Maßnahmen sowie weitere relevante Informationen zukommen lassen? Außerdem würden wir gerne telefonisch Kontakt aufnehmen, um die Angelegenheit weiter zu besprechen.",Problem,Technical Support,high,de,52,Security,Outage,Disruption,Audit,Firewall,Data Privacy,,
Problem with Data Processing Delays,"Customer Support,<br><br>The company faced delays in data processing that impacted investment analytics. The potential cause appears to be software compatibility problems across various products. Attempts to resolve the issue included updating and restarting systems, but these efforts did not succeed.<br><br>We are seeking assistance to pinpoint the root cause of the problem and to develop a solution to prevent recurrence. Our team reviewed system logs and identified errors that may be related to compatibility issues. We would appreciate your support in investigating this matter further.",Please review the issue; additional information may be required. Kindly let us know a suitable time for a call at <tel_num> to discuss and identify the root cause of the data processing delays.,Incident,Customer Service,medium,en,52,Performance,Disruption,Software,Tech Support,,,,
,"Sehr geehrter Kundenservice, ich möchte mich nach Abrechnungsdetails, Zahlungsmöglichkeiten, Dienstleistungen der Marketingagentur und deren Beitrag zum Marktwachstum erkundigen. Könnten Sie bitte eine detaillierte Aufstellung der anfallenden Kosten sowie der akzeptierten Zahlungsmethoden zusenden? Ich würde auch gerne wissen, ob es Rabatte oder Aktionen gibt, über die Sie informieren können. Zusätzlich interessiere ich mich für etwaige zusätzliche Gebühren, die zu beachten sind. Ich bin daran interessiert, mehr über die angebotenen Dienstleistungen der Marketingagentur zu erfahren, um das Marktwachstum zu fördern. Ich freue mich auf Ihre Rückmeldung mit den angeforderten Informationen.","Sehr geehrter <Name>, vielen Dank, dass Sie sich an unser Kundensupport-Team gewandt haben. Wir freuen uns, Ihnen eine detaillierte Übersicht der Kosten und Zahlungsmöglichkeiten unserer Marketingagentur zu übermitteln. Zu den gängigen Zahlungsmethoden zählen Kreditkarte, Scheck und Banküberweisung. Wir bieten Rabatte bei langfristigen Verpflichtungen sowie spezielle Aktionen für Neukunden an. Für bestimmte Dienstleistungen, wie Premium-Support oder individuelle Lösungen, können zusätzliche Gebühren anfallen. Wenn Sie spezifischere Informationen benötigen, teilen Sie uns bitte mit, welche Dienstleistungen Sie interessieren und welches Budget Sie eingeplant haben.",Request,Billing and Payments,low,de,52,Billing,Payment,Refund,Discount,Marketing,Customer Service,Cost,Payment Methods
,Der Gesundheitsdienstleister hat Verzögerungen beim Zugriff auf Daten in mehreren Systemen erfahren.,"Untersuchung der Datenzugriffsverzögerungen beim Gesundheitsdienstleister, die in mehreren Systemen aufgetreten sind, umgehend eingeleitet.",Incident,Product Support,low,de,52,Outage,Disruption,Recovery,IT,Tech Support,,,
Inquiry Regarding Marketing Services Billing,"Customer Support, I am reaching out to inquire about billing options and payment plans available for the marketing services listed. Could you please provide a detailed cost breakdown for these services, including any discounts or promotions that might be available? I am interested in exploring various marketing channels offered by your company, such as social media advertising, email marketing, and search engine optimization. I would like to understand the pricing structure for these services.","<name>, thank you for your email. I would be happy to provide a detailed breakdown of the pricing for our marketing services. To discuss further, please let me know a convenient time for a call by contacting <tel_num>. I look forward to speaking with you soon. Best regards, <name>",Request,Billing and Payments,low,en,52,Billing,Payment,Discount,Promotion,Customer Support,Marketing,Cost Breakdown,
Probleme beim Laden der Projekt-Dashboards,"Der Nutzer berichtet wiederholt über langsame Ladezeiten beim Zugriff auf das Projekt-Dashboard. Die erste Fehlerbehebung umfasste das Leeren des Caches und den Neustart der Server, doch das Problem besteht weiterhin. Wir werden die Ursache bald untersuchen und eine Aktualisierung bereitstellen.","Sehr geehrter <name>, wir entschuldigen die Unannehmlichkeiten, die durch die Ladeprobleme bei den Projekt-Dashboards entstanden sind. Wir schätzen die ersten durchgeführten Maßnahmen zur Fehlerbehebung, darunter das Leeren des Caches und den Neustart der Server. Da das Problem weiterhin besteht, möchten wir die Ursache genauer untersuchen. Bitte teilen Sie uns weitere Details mit, wie häufig die langsamen Ladezeiten auftreten und ob Fehlermeldungen angezeigt werden. Es wäre auch hilfreich zu wissen, welchen Browser und welches Betriebssystem Sie verwenden. Falls nötig, können wir einen Anruf unter <tel_num> vereinbaren, um das Problem zeitnah zu besprechen.",Incident,Customer Service,medium,de,52,Performance,Bug,Server,Issue,Troubleshooting,,,
Request for Avast Antivirus Integration Instructions,"Customer Support, I am reaching out to request comprehensive integration instructions for using Avast Free Antivirus 2021 within our scalable SaaS project management platform. We are planning to implement this antivirus solution to strengthen our security measures. Could you kindly provide us with detailed, step-by-step guidance on how to integrate Avast into our system? Additional resources or documentation to facilitate a smooth and secure user experience would also be highly appreciated. Thank you for your assistance.","<name>, thank you for your interest in integrating Avast Antivirus with our SaaS project management platform. To provide you with detailed integration instructions, please share the specific requirements of your platform. We are happy to assist you with a step-by-step guide and any additional resources needed for a seamless integration process.",Request,IT Support,high,en,52,Security,Documentation,IT,Tech Support,,,,
Support Request for IBM SPSS,"I am reaching out to inquire about the comprehensive product features and integration options available for IBM SPSS Statistics 28, specifically in the context of investment analytics. Could you supply details on the software tools used for analyzing and forecasting investment trends? I would appreciate guidance on how to implement these features for potential applications within the investment analytics domain.","To obtain detailed information about the features of IBM SPSS Statistics 28 related to investment analytics applications, please let us know a suitable time for a call.",Request,Sales and Pre-Sales,medium,en,52,Product,Feature,IT,Tech Support,,,,
