subject,body,answer,type,queue,priority,language,version,tag_1,tag_2,tag_3,tag_4,tag_5,tag_6,tag_7,tag_8
Support Request for Documentation,"Is it possible to supply comprehensive documentation for integrating the DataRobot Oracle Database 19c project management system? I would greatly appreciate detailed, step-by-step instructions along with any relevant resources to help with the successful implementation and effective management of projects.","We can provide documentation for integrating the DataRobot Oracle Database 19c. Please feel free to send us a detailed guide with step-by-step instructions and relevant resources. If you have any specific questions or need further assistance, we are happy to help and would like to discuss at your convenient time.",Request,Technical Support,high,en,400,Documentation,Feedback,IT,Tech Support,,,,
Error Report,Project management software crashes during peak load times. Increased server capacity and optimized settings did not resolve the issue. Urgently need the problem to be fixed and further assistance.,Thank you for the error report. I am here to assist. Please provide more details including error messages so I can help solve the issue with the project management software.,Incident,Technical Support,high,de,400,Bug,Performance,Network,IT,Tech Support,,,
Expansion through Digital Brand Strategies,Would like to get detailed information on digital strategy services for brand growth. I am keen on understanding the methods that can assist businesses in expanding their online presence and enhancing engagement. Thank you for your time and assistance. I look forward to hearing back soon.,Contact us at <tel_num> to discuss digital strategy services for brand growth.,Request,Human Resources,low,en,400,Feedback,Sales,Feature,Documentation,,,,
,"Looking for customer support to inquire about how data analytics can enhance investment optimization strategies, particularly in portfolio management and risk assessment. I would greatly appreciate any information or guidance you can provide, along with any resources available. Thank you for your time and I look forward to hearing from you soon.","We can provide information on how data analytics enhances investment optimization strategies, specifically in portfolio management and risk assessment. Let's discuss this further soon.",Request,Customer Service,medium,en,400,Feedback,IT,Tech Support,,,,,
Bericht Über Eintragung Des Vorfalls Abgegeben,"Es gab einen möglichen unerlaubten Zugriff auf medizinische Daten. USB-Sticks und PostgreSQL-Datenbanken, die diese Daten speichern, wurden betroffen. Um das Netzwerkzugangssicherheitsrisiko zu reduzieren, werden stärkere Zugangssteuerungen eingeführt. Wir benötigen weiteres technisches Hilfeschreiben, um sicherzustellen, dass die Daten geschützt sind.",Die Eintragung des Vorfalls überprüfen. Für weitere Hilfen rufen Sie <tel_num> an. Kontaktieren Sie uns unter <acc_num> für die Sicherstellung des Datenschutzes.,Incident,Technical Support,medium,de,400,Security,Network,Bug,Performance,IT,Tech Support,,
Verschlüsselung medizinischer Daten in AWS für Krankenhaus-IT-Systeme - Sicherstellung der HIPAA-Konformität und Schutz sensibler Patientendaten,"Wir müssen sicherstellen, dass die medizinischen Daten in den AWS Krankenhaus-IT-Systemen verschlüsselt sind und dass wir HIPAA-Konformität erfüllen, um die sensiblen Patientendaten zu schützen.","Die Verschlüsselung medizinischer Daten in AWS und die Bereitstellung der HIPAA-Konformität, einschließlich der Verschlüsselung und Zugriffskontrollen, werden unterstützt. Bitte geben Sie an, wann wir die Details zu den Krankenhaus-IT-Systemen besprechen können.",Request,Human Resources,medium,de,400,Security,Compliance,IT,Tech Support,,,,
Verbesserung der Investitionen in IBM-Software (SPSS Statistics 28),"Könnten Sie zusätzliche Details zur Optimierung der Investitionen in IBM SPSS Statistics 28 bereitstellen? Ich möchte mehr über die verfügbaren Funktionen und Werkzeuge erfahren, um fundierte Investitionsentscheidungen treffen zu können. Ich freue mich auf Ihre Unterstützung und würde mich freuen, bald von Ihnen zu hören.","Ich werde gerne mehr Informationen zur Optimierung der Investitionen in IBM SPSS Statistics 28 bereitstellen. Das Software-Produkt bietet verschiedene Werkzeuge und Funktionen für Datenanalyse, die fundierte Entscheidungsfindungen ermöglichen. Ich bin gerne bereit, Sie am geeigneten Zeitpunkt anzurufen, um dies zu besprechen. Bitte geben Sie mir den passenden Zeitpunkt an, an dem Sie angerufen werden möchten, und ich rufe Sie dann an. <tel_num>",Request,Product Support,medium,de,400,Feature,Feedback,Product,,,,,
Verbesserung der Optimierung von Integrierungstools für Bildschirmaufnahmen,"Hätten Sie Vorschläge zur Optimierung der Bildschirmaufnahmen und der Integrationstools? Es wäre hilfreich zu wissen, welche besten Praktiken zur flüssigen Kompatibilität gelten.",Bald werden Vorschläge zur Optimierung der Bildschirmaufnahmen und der Integrationstools gegeben.,Request,Product Support,medium,de,400,Feature,Feedback,Documentation,,,,,
Performance Concern with SaaS Application Currently,"Our project management SaaS application is experiencing an unanticipated performance decline during peak usage times. This might be due to insufficient resource allocation amidst increased traffic. We have attempted to scale server resources and optimize database queries, but the issue still persists. We require your assistance to resolve this problem.","We are reviewing the performance issue with the SaaS application. Could you please provide more details, such as any error messages or relevant server logs? Additionally, we can schedule a call at <tel_num> to discuss the next steps for resolving this issue.",Incident,IT Support,medium,en,400,Performance,Network,IT,Tech Support,,,,
,"Dear Customer Support, we are urgently seeking your intervention as a critical issue necessitates immediate attention. Recently, our organization faced a data breach impacting sensitive patient records' security. Despite promptly applying security updates and enhancing antivirus definitions, the issue remains unresolved. It seems that vulnerabilities in our software systems might be the cause. We are deeply concerned about the potential consequences and require your assistance in resolving this matter. Could you please provide guidance on the next steps we should take and recommend any necessary measures to prevent future breaches?","Hello, we are sorry to hear about the data breach affecting your organization. To assist you effectively, we need details about your current security setup. Please call us at <tel_num> to discuss the next steps and recommend preventive measures. We are available to discuss this at your earliest convenience to proceed with the investigation and resolution.",Incident,Technical Support,high,en,400,Security,Virus,Recovery,Alert,,,,
