subject,body,answer,type,queue,priority,language,version,tag_1,tag_2,tag_3,tag_4,tag_5,tag_6,tag_7,tag_8
Geplante Wartungsarbeiten zur Sicherstellung der Systemverfügbarkeit,"Sehr geehrter Kundenservice, ich bitte um Ratschläge und bewährte Praktiken zur Aufrechterhaltung der Verfügbarkeit während geplanter Wartungsarbeiten an unserer SaaS-Plattform. Könnten Sie allgemeine Tipps und Empfehlungen geben, um Ausfallzeiten zu minimieren und ein nahtloses Nutzererlebnis zu gewährleisten? Ich freue mich über jegliche Hinweise und Strategien, die Sie teilen können. Vielen Dank für Ihre Unterstützung. Ich freue mich auf Ihre baldige Rückmeldung.","Sehr geehrter <name>, vielen Dank für Ihre Anfrage bezüglich der Sicherstellung der Verfügbarkeit während geplanter Wartungsarbeiten an unserer SaaS-Plattform. Um Ausfallzeiten zu minimieren und ein reibungsloses Nutzererlebnis zu gewährleisten, empfehlen wir, Wartungsarbeiten außerhalb der Stoßzeiten durchzuführen, die Nutzer frühzeitig zu informieren und schrittweise Updates mittels Rollouts vorzunehmen. Die Implementierung automatisierter Tests und Überwachungsmaßnahmen hilft ebenfalls, potenzielle Probleme frühzeitig zu erkennen. Zusätzlich sollten Lastenausgleich und Redundanz genutzt werden, um den Datenverkehr zu verteilen und die Systemstabilität zu erhöhen.",Request,Service Outages and Maintenance,medium,de,52,Maintenance,Outage,Disruption,Recovery,Performance,,,
Problem mit der Datenanalyse-Plattform,"Die Kunden Datenanalyse-Plattform meldet fortlaufend Fehler, was wahrscheinlich auf unkompatibele Software-Updates zurückzuführen ist. Die betroffenen Systeme wurden neu gestartet, die Konfigurationen wurden zurückgesetzt und die betroffenen Produkte wurden neu installiert.","Sehr geehrte/r [Name],\n\nleider höre ich, dass die Datenanalyse-Plattform des Kunden fortlaufende Fehler meldet. Die von Ihnen bisher unternommenen Schritte, wie Neustart der Systeme, Zurücksetzen der Konfigurationen und Neuinstallation der betroffenen Produkte, sind ein guter Anfang. Allerdings wäre es hilfreich, genauere Details zu den Software-Updates und den Fehlernachrichten zu erhalten, um das Problem besser zu verstehen und eine effektivere Lösung zu finden. Falls nötig, können wir telefonisch weitere Dinge besprechen. Bitte rufen Sie an, falls Sie Fragen haben.",Problem,Customer Service,high,de,52,Bug,Performance,Software Update,Compatibility,System Configuration,,,
Concern with Marketing Agency,The analytics dashboard is no longer refreshing after the software update.,We are investigating the issue with the analytics dashboard not updating following the software update. Please provide additional details to assist with the investigation.,Incident,Technical Support,medium,en,52,Feature,Software Update,Analytics,Dashboard,Marketing,,,
Issue with Multi-Product Solution Integration,"Experiencing integration errors and data synchronization issues within the Project Management SaaS. The problem originated shortly after recent API updates. Attempts to resolve included clearing caches, resetting connections, and updating login credentials, which led to a resolution. We welcome your support to resolve this issue promptly. Please inform us if additional troubleshooting steps are necessary or if the known problem has been fully addressed.",Verify the multi-product integration issue by contacting <tel_num>. Discuss further troubleshooting steps and known issues to find a swift solution.,Incident,Product Support,medium,de,52,Bug,Performance,Network,Security,IT,Tech Support,,
Support Problem with SaaS Platform,"Users are facing repeated disconnections and sluggish responses when accessing the SaaS platform from various devices. There may be conflicts with network adapters. Attempts to resolve included restarting devices, updating drivers, and clearing caches, but the problem continues across different devices and networks. Assistance in resolving this issue would be appreciated.","We are investigating a support issue with the SaaS platform involving frequent disconnections and slow responses. To troubleshoot further, please provide details about your network configuration and the devices in use. Contact <tel_num> to discuss potential solutions and the next steps to resolve the issue <acc_num>.",Problem,Technical Support,high,en,52,Performance,Network,Disruption,IT,Tech Support,,,
Pricing Details for Microsoft Office 365,"Customer Support, I am reaching out to request detailed information on the pricing and integration capabilities of Microsoft Office 365 with Mailchimp analytics. Our company aims to utilize these tools to streamline workflows and gain valuable insights for marketing initiatives. Could you please provide a comprehensive cost breakdown for the platform, including any available discounts or promotions? Additionally, I would appreciate details on the various integration options, such as APIs and third-party connectors.","<name>, kindly provide a detailed overview of Microsoft Office 365 and Mailchimp pricing, along with available integration options. Please allow us to call <tel_num> to discuss and address any specific questions related to analytics optimization and discounts.",Request,Sales and Pre-Sales,high,en,52,Billing,Product,Feature,Documentation,Support,,,
Optimierung der Workflows im digitalen Marketing,"Sehr geehrter Kundenservice,\n\nich möchte mich erkundigen, ob es möglich ist, Adobe Sign in die ClickUp-Workflows für das digitale Marketing zu integrieren. Unser Team verwendet ClickUp für die Aufgabenverwaltung, möchte jedoch die Abläufe durch die Einbindung von e-Signaturen verbessern. Ich halte Adobe Sign für ein hervorragendes Tool, um unser Set an Funktionen zu erweitern, bin mir jedoch unsicher, wie wir mit der Integration beginnen sollen.\n\nKönnten Sie bitte detaillierte Anleitungen zur Einrichtung der Adobe Sign-Integration in ClickUp bereitstellen? Insbesondere interessiert mich, welche Funktionen verfügbar sind, wie die Integration konfiguriert wird und welche bewährten Methoden für die Nutzung bestehen.","Sehr geehrter <Name>,\n\nvielen Dank, dass Sie den Kundenservice bezüglich der Integration von Adobe Sign in ClickUp für das digitale Marketing kontaktiert haben. Gerne stellen wir Ihnen eine Anleitung zur Einrichtung der Integration bereit.\n\nBitte besuchen Sie unsere Webseite, um ausführliche Dokumentationen und Tutorials zur Konfiguration von Adobe Sign in ClickUp zu finden. Unsere Support-Ressourcen umfassen Schritt-für-Schritt-Anleitungen, Videos sowie Informationen zu den verfügbaren Funktionen, bewährten Methoden und der gemeinsamen Nutzung beider Tools.\n\nFalls Sie weitere Fragen haben oder zusätzliche Unterstützung benötigen, lassen Sie es uns bitte wissen.",Request,Technical Support,medium,de,52,Feature,Workflow,Digital Marketing,Integration,E-signature,Toolset,,
Unapproved Access to Patient Information,Patient records were accessed without proper authorization.,We apologize for this incident and are treating it with utmost seriousness. Kindly provide details regarding the unauthorized access to patient records so we can investigate promptly and take the necessary measures to ensure the security and confidentiality of patient data.,Problem,Technical Support,high,en,52,Security,Privacy,Access Control,Data Protection,,,,
Problems with Accessing Medical Data,"Customer Support reports intermittent delays in accessing medical data systems. The healthcare provider observed that recent security patches might be conflicting with the system. Initial troubleshooting was attempted, including rebooting the system and rolling back patches, but the issue remains unresolved. We would be grateful for prompt assistance to resolve this matter and ensure continuous access to vital medical information. Please advise on the next steps.",We acknowledge the issue regarding delays in accessing medical data and appreciate the troubleshooting efforts undertaken. We will escalate this matter to our technical team for further assistance. Please contact <tel_num> to discuss the next steps and schedule a resolution plan.,Incident,Product Support,low,en,52,Security,IT,Tech Support,Disruption,,,,
Enhancing Investment Data Utilization,"Customer Support is contacted to inquire about leveraging data analytics tools to improve investment strategies for financial firms. They are seeking detailed guidance on this topic, with a particular interest in learning about specific tools and techniques employed within the industry. Additionally, they would like information on best practices for implementing data analytics in investment decision-making. They believe that data-driven insights can significantly improve investment results and are eager to learn how to effectively utilize these tools. Kindly assist.","<name>, thank you for reaching out to the customer support team. We appreciate your interest in optimizing investment data through analytics tools. We can provide a general overview of the topic, including common industry practices and frequently used tools. To offer more tailored guidance, please share details about your current investment strategies and objectives. Our representative would be happy to discuss at a convenient time; please let us know a suitable time, and we can arrange a call at <tel_num> to explore this further.",Request,Returns and Exchanges,low,en,52,Feature,Feedback,IT,Tech Support,,,,
Datensicherheit,Einführung fortschrittlicher Sicherheitsmaßnahmen für die medizinischen Daten des Krankenhauses.,"Ihre Anfrage zur Implementierung erweiteter Sicherheitsprotokolle für die medizinischen Daten des Krankenhauses wurde erhalten. Die Anfrage wurde an das Sicherheitsteam zur Überprüfung weitergeleitet. Bitte kontaktieren Sie <tel_num>, um die nächsten Schritte zu besprechen und einen Zeitplan für die Umsetzung zu vereinbaren.",Change,Product Support,low,de,52,Security,Data Protection,Healthcare,Safety,IT,,,
