subject,body,answer,type,queue,priority,language,version,tag_1,tag_2,tag_3,tag_4,tag_5,tag_6,tag_7,tag_8
Concern about Marketing Campaign,"The marketing campaign is not performing well due to integration issues with digital tools. Despite attempts to troubleshoot by updating plugins, the problem continues.","To address the issue with the marketing campaign, we would like to discuss how to resolve the integration problems with digital tools. Could you please provide more details at a suitable time for a call to assist with this matter?",Incident,Customer Service,high,en,400,Feedback,Feature,IT,Tech Support,,,,
Probleme mit dem Software,"Die Marketingoperatoren leiden unter Softwarekonflikten und Verbindungsproblemen, die möglicherweise durch neuere Updates und unkompatibles Hardware verursacht werden.","Um die Softwarekonflikte und Verbindungsprobleme zu lösen, sollten weitere Details ermittelt werden und ein Beratungsansatz angewendet werden.",Incident,IT Support,high,de,400,Bug,Network,Hardware,Performance,IT,Tech Support,,
,"Dear Customer Support, I am inquiring about digital strategies that drive brand growth. Could you provide some information on the topics your company focuses on in digital marketing and any methods that have been particularly effective? Your insights and guidance would be greatly appreciated. Thank you in advance for your assistance, and I look forward to hearing from you soon.",We will provide information on digital strategies and methods driving brand growth via a scheduled email or call for your convenience.,Request,Product Support,medium,en,400,Feedback,Sales,IT,Tech Support,,,,
Support Incident Regarding Data Breach,"A data breach has happened, revealing sensitive medical information because of outdated security updates.",We sincerely apologize for the data breach. Please contact us at <tel_num> for immediate assistance to discuss the necessary steps to protect your sensitive medical data.,Incident,Technical Support,high,en,400,Security,IT,Tech Support,Virus,,,,
Problems with Recent Software Updates,We have encountered malfunctions across devices related to recent campaigns. These issues might have arisen due to the recent updates.,"We apologize for the technical issues experienced with recent software updates. To better assist you, could you please provide details about the malfunctions in the campaign? We will investigate the matter and can be contacted at <tel_num> for further discussion and assistance.",Problem,IT Support,high,en,400,Bug,Performance,IT,Tech Support,,,,
System Downtime Impacting Project Services,"Faced a system outage, restarted the Aruba switch, reinitialized devices, but access is still restricted.","Please investigate the system downtime and, if possible, share the exact location of the error message on the Aruba switch for further assistance.",Incident,IT Support,medium,en,400,Outage,Disruption,Recovery,IT,Tech Support,,,
Support for Client,"Our marketing agency is facing low engagement in recent digital campaigns, possibly due to changes in platform algorithms. We have analyzed campaign data, adjusted ad limitations, and tested various ad materials, but engagement remains stagnant. We need your assistance to improve engagement.","I am pleased to assist in enhancing engagement for your digital campaigns. To better understand the specific issue, I would appreciate more details about your current campaign strategy and the specific metrics showing no improvement. Let's schedule a meeting at a convenient time to discuss further ways to increase engagement. Please provide a suitable time for the meeting at <tel_num>.",Problem,Customer Service,low,de,400,Feedback,Performance,IT,Tech Support,,,,
Query for Insights on Digital Strategies,Seeking details on how digital strategies can boost brand growth; would greatly benefit from understanding the approach. Interested in learning about the latest trends in business application. Appreciate your assistance and look forward to your response soon.,"Dear customer, thank you for your inquiry. I would be happy to provide you with information on digital strategies. I will send you a detailed email with the latest trends in business application. We would like to schedule a call at your convenience to discuss further.",Request,Customer Service,medium,en,400,Feedback,Sales,Query,Documentation,,,,
Requirements for Securing Medical Data in MongoDB 4.4 for a Hospital,"Dear Customer Support, we require detailed information on securing medical data using MongoDB 4.4 in a hospital setting. This includes ensuring the confidentiality and integrity of patient data. Please provide specifics on data encryption, access control, and auditing measures. Additionally, we need details on how these measures comply with regulatory requirements such as HIPAA.","Hello, we can provide you with detailed information on securing medical data using MongoDB 4.4 for a hospital. MongoDB includes various security features such as data encryption, access control, and auditing to ensure the confidentiality and integrity of patient data. These measures also comply with regulatory requirements like HIPAA. We will send you a comprehensive guide on our security features and compliance details. For further discussion, please call at <tel_num> or email us for more specific information regarding <acc_num>. Thank you.",Request,Sales and Pre-Sales,low,en,400,Security,Documentation,IT,Tech Support,,,,
Integrieren von QuickBooks Online SaaS-Projektmanagement,"Lieber Kundensupport, ich möchte gerne nachfragen, ob es möglich ist, die QuickBooks Online SaaS-Projektmanagement-Plattform in mein bestehendes System zu integrieren. Könnten Sie mir zusätzliche Informationen zur Integration geben, beispielsweise die Vorteile, den Set-up-Prozess sowie eventuelle Einschränkungen? Es wäre ebenfalls sehr hilfreich, wenn Sie mir Details zur Datensynchronisierung zwischen den beiden Systemen und eventuellen zusätzlichen Gebühren für die Integration bereitstellen könnten. Gibt es spezielle Anforderungen oder Voraussetzungen, die beachtet werden müssen, bevor ich die QuickBooks Online Plattform integriere? Ich freue mich auf Ihre Rückmeldung und mögliche zusätzliche Informationen.","Lieber <name>, die Integration der QuickBooks Online SaaS-Projektmanagement-Plattform in Ihr bestehendes System kann zu Vorteilen wie vereinfachtem Rechnungsstellungsprozess und effizienterer Ausgabenüberwachung führen. Für weitere Details zum Set-up-Prozess und eventuelle Einschränkungen, bitte rufen Sie uns unter <tel_num> an, um diese Themen zu besprechen.",Request,Technical Support,medium,de,400,Feature,Documentation,Tech Support,,,,,
kritische Leistungsschwierigkeiten bei der SaaS-Plattform,"Sehr geehrte Kundensupport, unsere projektmanagement SaaS-Plattform leidet unter kritischen Leistungsschwierigkeiten, die auf unoptimierte Ressourcenallokation und Kompatibilitätsprobleme mit Azure sowie macOS Monterey zurückzuführen sein. Bislang konnten wir den Anwendungsbetrieb durch Neustart der Anwendung und Leeren der Caches wiederherstellen, das Problem behält jedoch anhaltend. Das Team arbeitet aktiv daran, das Problem zu lösen und benötigt dringend Ihre Unterstützung, um weitere Störungen zu vermeiden. Bitte geben Sie uns Anleitungen, wie wir die Ressourcenallokation optimieren und die Kompatibilität verbessern können, oder schließen Sie uns bei der Suche nach einer Lösung ein. Danke für Ihr Verständnis und die schnelle Unterstützung.","Wir werden die Leistungsschwierigkeiten der SaaS-Plattform sofort untersuchen und falls erforderlich, zusätzliche Informationen einholen.",Incident,Product Support,high,de,400,Performance,Outage,IT,Tech Support,,,,
Support Inquiry for Connectivity Issues with Apache Hadoop,"Recently, the team has encountered connectivity problems with Apache Hadoop, which is impacting the optimization of investments and data analytics. Steps taken so far include restarting devices, reconnecting peripherals, and verifying software installations, but the issue still persists. Assistance is needed to resolve the conflicts in hardware and software configurations.","We acknowledge your support request regarding connectivity issues with Apache Hadoop. We understand that you have already tried restarting devices and verifying software installations, but the issue remains unresolved. To assist further, could you please provide more details about your hardware and software configurations? We would like to schedule a call to discuss the issue in more depth and determine the best course of action to resolve the conflicts. Please let us know if this time works for you, and we will arrange a suitable call.",Incident,Technical Support,medium,en,400,Network,Performance,Hardware,IT,Tech Support,,,
Sicherheitsanomalie melden,"Sehr geehrte Kundenservice, ich melde ein dringendes Sicherheitsproblem mit unserem medizinischen Datensystem. Unerwartete Sicherheitslücken wurden entdeckt, die möglicherweise auf veraltete Software-Vulnerabilitäten von Adobe und Cisco zurückzuführen sind. Trotz durchgeführter Antiviren-Scans und Anwendung von Software-Updates besteht das Problem weiterhin. Bitte geben Sie mir freundlichst Anweisungen, um das Problem zu lösen, und wie ich zukünftig Sicherheitslücken vermeiden kann. Ich freue mich darauf, die nächsten Schritte zu besprechen. Vielen Dank für Ihre Aufmerksamkeit. Mit freundlichen Grüßen.","Um Ihnen bei dem Sicherheitsproblem behilflich zu sein, bitten wir Sie, uns mehr Details zu den Lücken und der aktuellen Systemeinstellung zu geben. Bitte rufen Sie uns unter <tel_num> an, um die nächsten Schritte zu besprechen und wie Sie zukünftig Sicherheitslücken vermeiden können. Vielen Dank.",Problem,Technical Support,medium,de,400,Security,Bug,Performance,Virus,IT,Tech Support,,
Combine Monday.com with Jenkins,Seeking assistance to integrate Monday.com with Jenkins to boost project tracking and management efficiency. Integration will help us optimize workflows and enhance productivity. Would greatly appreciate guidance on how to proceed with the integration.,"To integrate Monday.com with Jenkins, utilize Zapier to connect the two platforms via Monday.com's API. This will enable automated workflows that enhance project tracking. Begin by exploring Monday.com's integration options and Jenkins plugins to find a solution that meets your needs. Follow the setup instructions to complete the integration.",Change,IT Support,high,en,400,Feature,IT,Tech Support,Feedback,,,,
Probleme mit Marketing-Kampagnen,"Obwohl digitale Strategien implementiert wurden, leisten Marketing-Kampagnen schlechte Leistungen. Möglicherweise liegt der Grund in einer Mangel an Ausrichtung oder ungenauen Produkt- und Zielgruppenbotschaften. Durch Analyse der Daten, Anpassung der Werbung und Durchführung von A/B-Tests wurde bereits Verbesserung erzielt.","Sehr geehrte/r [Name],\n\nich verstehe Ihre Besorgnis hinsichtlich unterperformierender Marketing-Kampagnen, obwohl digitale Strategien implementiert wurden. Ein Mangel an Ausrichtung oder ungenauen Produkt- und Zielgruppenbotschaften könnte plausibler sein. Wir haben bereits die Daten analysiert, die Werbung angepasst und A/B-Tests durchgeführt, was zu Verbesserungen geführt hat.\n\nUm das Problem besser zu verstehen, könnten Sie bitte mehr Informationen über die Zielgruppe und die Produktbotschaft geben? Es wäre praktisch, wenn Sie [telefonnummer] anrufen und das Thema im Weiten besprechen könnten.\n\nMit freundlichen Grüßen",Problem,Customer Service,high,de,400,Feedback,Performance,Product,Feature,,,,
,"customer support, data breach detected in the healthcare system due to outdated security protocols. reviewed secure access logs and updated the software, but the issue still persists. Immediate assistance is required to resolve the matter and prevent further breaches.","<name> acknowledges the email regarding the data breach detected in the healthcare system due to outdated security protocols. understands the urgency of the matter and requires immediate assistance to prevent further breaches. would like to gather more information to better assist you. Could you please provide us with the details of the breach, including the date and time it was detected and the specific outdated security protocols involved? Your assistance in sharing the results of the review of secure access would be greatly appreciated.",Problem,Human Resources,medium,en,400,Security,IT,Tech Support,Outage,,,,
System Performance Challenges with Data Analytics Tools,"Currently facing system performance challenges while using data analytics tools for investment optimization. The issue might be due to high CPU usage caused by multiple applications running simultaneously. So far, closing non-essential applications and restarting the system helped to some extent, but the problem still persists. Assistance is needed to resolve this.",Please review the issue and contact <tel_num> to discuss potential troubleshooting steps for resolving system performance challenges with data analytics tools.,Problem,Technical Support,high,en,400,Performance,IT,Tech Support,,,,,
,"Customer Support, inquiring about data analytics services, particularly for optimizing investment strategies. Could you provide details on the types of services that would assist in making informed decisions? I would greatly appreciate any information provided, including case studies or examples of successful implementations. Thank you for your assistance. I look forward to hearing back soon. Regards, [Your Name]","Dear [Your Name], thank you for reaching out to our customer support team. We offer various data analytics services to optimize investment strategies, including portfolio analysis and risk assessment. Our services help in making informed decisions by providing valuable insights and trends. We have successfully implemented these services for several clients and would be happy to provide case studies and examples. Let's discuss further; please let us know a convenient time to contact you.",Request,Billing and Payments,medium,en,400,Feedback,Documentation,Tech Support,,,,,
Issues with Server Response Time,"A sudden increase in server response time was observed during peak usage periods, attributed to the latest code loading. Attempts to optimize server settings and roll back the loading process have been unsuccessful in resolving the issue. The team is currently investigating the root cause to ensure a better user experience.","Working on resolving the issue, aiming to reduce server response time and improve the user experience for account <acc_num>.",Incident,IT Support,medium,de,400,Performance,Outage,IT,Tech Support,,,,
Concerns Over Hospital System Security Breach,"An unauthorized access attempt was detected on the hospital systems. This may have occurred due to outdated software or phishing. The issue is being addressed by applying security patches to the affected software and conducting user training sessions to prevent similar incidents in the future. Access logs are being reviewed, and additional measures are being taken to enhance system security. The hospital's team is working diligently to ensure the integrity of patient data and prevent potential breaches. If you have any questions, please let us know.","Dear [Name], thank you for your email regarding the hospital system security issue. We are pleased to inform you that security patches have been applied and user training sessions conducted to prevent similar incidents. Could you please provide more information on the access logs review and the additional measures taken to enhance system security? If available, it would be convenient to schedule a call at [Tel_num] to discuss the matter and address any questions or concerns you may have regarding the hospital's system security. Best regards.",Incident,Technical Support,high,en,400,Security,Bug,IT,Tech Support,Performance,Feedback,Training,Alert
Enhancing Investment Analytics Tools for Financial Firms,Would greatly appreciate detailed information on optimizing investment analytics tools for financial firms. This will help us improve our services and make better-informed decisions. Looking forward to your timely assistance. I am eager to hear from you soon.,"Thank you for your interest in optimizing investment analytics tools for financial firms to improve your services and make better-informed decisions. To provide effective solutions, could you please provide details on your current investment analytics tools and specific areas you would like to optimize? This information will enable us to offer tailored guidance and recommendations. I prefer discussing this over a phone call, and I am available to schedule a call at your convenience. Please call me at <tel_num>.",Request,Billing and Payments,medium,en,400,Feature,Feedback,Sales,,,,,
Issue with Software Integration Across Multiple Platforms,Observing errors during software integration across various platforms. These issues seem to be due to updates and compatibility problems.,"Dear [Name],\n\nWe apologize for the software integration issues. Could you please provide more details on the installed updates and the specific affected platforms? This information will help us investigate and offer a solution to the compatibility issues.\n\nIf necessary, we can arrange a phone call (Call: [Phone Number]). Please specify an appropriate time. \n\nKind regards, [Name]",Incident,Technical Support,high,de,400,Bug,Performance,IT,Tech Support,,,,
Medizinische Unterstützung anfragen,Hilfe bei der Sicherstellung von medizinischen Daten benötigt,"Sehr geehrte/r [Name],\n\nwir haben Ihren Antrag zur Unterstützung bei der Sicherstellung von medizinischen Daten erhalten. Um Ihnen besser behilflich zu sein, bitten wir Sie, uns spezifischere Informationen zur Sicherstellung medizinischer Daten zu geben.\n\nUm Ihren Antrag zu prüfen und eine geeignete Anleitung zur Verfügung zu stellen, damit die Sicherheit der medizinischen Informationen gewährleistet wird, benötigen wir zusätzliche Informationen.\n\nFalls erforderlich, vereinbaren wir einen angemessenen Zeitpunkt für eine Besprechung. Bitte geben Sie uns geeignete Zeiten an, um Sie anzurufen: [Telefonnummer].",Request,Customer Service,high,de,400,HR,Employee,Notification,Alert,,,,
Hilfe bei Datenanalyse benötigt,"Möchten Sie mehr Details über unsere Datenanalysedienstleistungen, Optimierung und Investitionsstrategien erhalten? Vielen Dank.","Bitte kontaktieren Sie uns, um unsere Datenanalysedienstleistungen, Optimierung und Investitionsstrategien zu besprechen.",Request,Customer Service,medium,de,400,Feedback,Performance,Feature,,,,,
Probleme bei der Synchronisation von Projektdateien auf verschiedenen Geräten,"Netzwerkunstabilität und Softwarefehler könnten die Synchronisationsprobleme verursacht haben. Versucht, Geräte neu anzumelden und den Cache zu leeren, aber das Problem behält sich bestehen. Wir freuen uns, wenn wir Ihnen helfen können, um einen ungestörten Datenzugriff zu gewährleisten.","Um die Synchronisationsprobleme zu untersuchen, kontaktieren Sie uns bitte unter <tel_num> für weitere Hilfe und Lösungen.",Problem,Technical Support,medium,de,400,Network,Bug,Performance,IT,Tech Support,,,
Support Required for Potential Data Breach,"A potential data breach has been identified in the hospital's system, possibly due to outdated security protocols. Initial investigations have shown insufficient encryption and a lack of regular security updates.","<name> acknowledges your concern about the potential data breach in the hospital's system and is committed to assisting in resolving the issue. To better understand the situation and provide effective support, could you please provide details on the initial investigations and the current security measures in place? If necessary, we can schedule a call at <tel_num> to discuss further. Please let us know a suitable time for you.",Incident,Human Resources,medium,en,400,Security,IT,Tech Support,,,,,
Security Integration Inquiry,"I am keen on integrating Sophos Home project management SaaS to boost security. Could you provide details on the integration process, its benefits, and any potential challenges? I would greatly appreciate information to get started and any support resources available.","We appreciate your interest in integrating Sophos Home project management SaaS to enhance security. The integration offers benefits such as enhanced threat detection and improved incident response. To get started, please visit our website for detailed documentation on the integration process. For assistance, contact us at <tel_num>. Our support team is available to help you address any challenges you may encounter during the integration process and can provide online resources and community forums where you can find helpful information and guidance.",Request,Customer Service,medium,en,400,Security,Feedback,IT,Tech Support,,,,
Acknowledgment of Security Incident Report - Compromised Access to Medical Data in Hospital Systems,The report on the security incident involving compromised access to medical data in hospital systems has been noted. We will assist in investigating the incident and take steps to prevent similar incidents in the future. It is recommended that we schedule a call to discuss the details of the incident and the preliminary security audits that have been initiated. Please let us know a convenient time to call at <tel_num> to discuss the next steps and guidance for implementing additional security measures to protect the systems.,Acknowledged the report on the security incident that compromised access to medical data in hospital systems. We will assist in investigating the incident and take measures to prevent future incidents. A call is recommended to discuss the incident details and the preliminary security audits that have been initiated. Please provide a convenient time to call at <tel_num> to discuss the next steps and guidance for implementing additional security measures to protect the systems.,Incident,Technical Support,high,en,400,Security,Account,IT,Tech Support,,,,
Secure Medical Data with MATLAB and AWS,"Customer Support, we are seeking information on securing medical data using MATLAB R2021a in AWS healthcare applications. Could you provide details on the practices and protocols that ensure the confidentiality, integrity, and availability of sensitive medical information? We would greatly appreciate guidance on implementing robust security measures to protect patient data. Specifically, we are interested in learning about encryption methods, access controls, and data backup procedures. Please let us know of any available resources or documentation.","Reviewing your inquiry, we will provide guidance on securing medical data using MATLAB and AWS. Please allow us to contact you for a detailed discussion.",Request,Technical Support,low,en,400,Security,IT,Tech Support,Performance,Documentation,,,
Issue with Invoicing Discrepancies in Product Integration,We have noticed invoicing discrepancies for several products following the recent system update during their integration. We are trying to resolve the issue and ensure successful transactions.,"We are addressing invoicing discrepancies related to product integration for account number <acc_num>. To better understand the issue, could you please provide more details about the discrepancies after the recent system update and during the integration process? I would like to schedule a telephone conference with you. My contact number is <tel_num>. Please let me know a convenient time to discuss the issue.",Incident,Billing and Payments,high,de,400,Billing,Product,Feature,Tech Support,,,,
Problems with Data Processing Tools,"The data processing tool suddenly crashed, disrupting optimization investments. Restarting the program, checking for updates, and clearing the cache did not resolve the issue.","Apologies for the issues with the data processing tool. We will continue to analyze the problem. Could you please share any error messages you see? Additionally, we can arrange a call at <tel_num> to address the problem and minimize disruption to your investment optimization process and account <acc_num>.",Incident,Product Support,medium,de,400,Bug,Performance,IT,Tech Support,,,,
Upgraded Security Measures for Medical Data Systems,"It is essential to implement strong security measures to protect medical data, which optimizes the efficiency of hospital infrastructure. We must ensure the confidentiality, integrity, and availability of sensitive patient information to enhance the overall quality of healthcare services.","<name>, thank you for your email regarding the enhanced security of medical data systems. We appreciate your concern for protecting sensitive patient information. Our team is always working to implement robust security protocols to ensure the confidentiality and integrity of medical data. Please let us know a convenient time to discuss further by calling <tel_num>.",Change,Technical Support,medium,en,400,Security,Performance,IT,Tech Support,Feedback,,,
