subject,body,answer,type,queue,priority,language,version,tag_1,tag_2,tag_3,tag_4,tag_5,tag_6,tag_7,tag_8
Possible Security Incident in Medical Systems,Noted the potential security breach in the medical data of the hospital's systems. Possible causes may include a vulnerability from a recent software update or an external attack. Systems have been restarted and preliminary security patches applied to prevent further damage. Our team is currently investigating to determine the root cause and implement a permanent solution. We will keep you updated on the situation and advise on necessary protective measures.,"We appreciate you bringing this matter to our attention regarding the potential security breach in the medical data of the hospital's systems. We understand the severity and the importance of protecting sensitive information. We would like to offer our assistance in investigating the issue and implementing a permanent solution. Please provide us with details on the recent software update, any error messages, and logs, as they may be relevant to the investigation. We will schedule a call at <tel_num> to discuss the issue and determine the best course of action.",Incident,Technical Support,medium,en,52,Security,Outage,Disruption,Recovery,Vulnerability,Software Update,External Attack,
Assistance Needed for Application Performance Problems,"Users have reported occasional delays in response times within the project management application, potentially linked to recent changes in infrastructure. Despite restarting the impacted servers and clearing caches, the problem continues. Kindly investigate and resolve this issue promptly.","We have received reports of sporadic slow response times in the project management application. Please examine the issue and review recent infrastructure modifications. Kindly provide details of any error messages, symptoms, or issues users are experiencing. We would also like to arrange a call to discuss this further; please inform us of your earliest availability and a suitable time at <tel_num>.",Incident,Technical Support,medium,en,52,Performance,IT,Tech Support,,,,,
Issue with Epson Scanner,Provide instructions for integration.,Please provide the model of the Epson scanners for integration instructions. Additional support can be offered upon request.,Request,IT Support,high,de,52,Hardware,Product,Support,,,,,
,"Customer Support,\n\nWe are reporting a critical incident involving the project management SaaS platform, which experienced extensive downtime. An initial assessment indicates a potential server overload or software malfunction.\n\nWe have received multiple error reports from users, and our team has attempted to troubleshoot the issue by restarting the system and clearing the cache. Unfortunately, the problem persists, and users are still facing disruptions.\n\nWe kindly request urgent assistance to resolve this matter.","Dear Customer,\n\nThank you for reporting the issue with the project management SaaS platform. We apologize for the inconvenience caused by the downtime. We are escalating this issue to our technical team to investigate the root cause. Please provide your account details and the specific error messages received by users to assist us further. You can contact us at <tel_num> to discuss the next steps needed.",Incident,Technical Support,high,en,52,Outage,Disruption,Recovery,Performance,Server,Software,Incident,SaaS
Lösungen zur medizinischen Datensicherheit,"Ich nehme Kontakt auf, um mich nach Lösungen für die sichere Verwaltung medizinischer Daten in der IT-Infrastruktur von Krankenhäusern zu erkundigen. Können Sie detaillierte Informationen zu den ergriffenen Maßnahmen bereitstellen, die den Schutz sensibler Patientendaten sowie die Gewährleistung der Integrität medizinischer Aufzeichnungen sicherstellen?","Sehr geehrte/r <name>, vielen Dank für Ihre Anfrage bezüglich Lösungen zur medizinischen Datensicherung. Wir haben robuste Maßnahmen implementiert, um sensible Patientendaten zu schützen, darunter Verschlüsselung, Zugriffskontrollen und regelmäßige Sicherheitsüberprüfungen. Gerne gebe ich Ihnen einen detaillierten Überblick über unsere Lösungen. Wäre ein Gesprächstermin zu einem passenden Zeitpunkt möglich, um weitere Details zu besprechen? Bitte teilen Sie mir eine geeignete Zeit mit, oder kontaktieren Sie mich unter <tel_num>.",Request,Product Support,medium,de,52,Security,Data Protection,Healthcare,Privacy,Infrastructure,Patient Data,Compliance,
Multiple Critical Tools Outage,"A significant outage has affected several vital tools, likely due to network instability. Initial troubleshooting steps involved rebooting systems and clearing caches. Diagnostics are ongoing to identify the underlying cause. The team is working hard to resolve the issue as quickly as possible. We apologize for the inconvenience and thank you for your patience. If you have any questions or concerns, please let us know.","<name>, thank you for contacting us regarding the outage of multiple critical tools. We appreciate the troubleshooting efforts undertaken so far. If you require further assistance or have any questions, please do not hesitate to reach out to us at <tel_num> or reply via email. We are happy to provide updates on the situation.",Incident,IT Support,high,en,52,Outage,Network,Disruption,Recovery,IT,Tech Support,,
Issue with SaaS Application Project Management,"Our SaaS application for project management is experiencing frequent downtime, which may be due to server overload following the recent code deployment. Initial troubleshooting efforts, such as server restarts and code rollback, have not resolved the issue, and it continues to affect multiple key functionalities across different platforms. Despite our efforts to identify the root cause, we have not been successful so far. This downtime is impacting our business operations, and we urgently need assistance to get the application running smoothly. We would greatly appreciate your help.","Acknowledging receipt of the email regarding the issues with the SaaS application project management. Understanding the urgency of the situation and its impact on business operations, we are here to assist in resolving the issue. Could you please provide us with additional information, including any specific error messages received and the functionalities that are affected? It would also be helpful if you could provide details on the recent code deployment changes made to the system. We will schedule a call at the earliest convenience to discuss and determine the best course of action.",Problem,IT Support,medium,en,52,Performance,Outage,Disruption,Recovery,Bug,,,
Report on IT Security Issue at Hospital,"The healthcare provider experienced multiple connectivity issues with devices, which compromised the hospital's IT security. Potential misconfigurations in the network may have caused these disruptions. Affected devices have been restarted, and firewall settings have been checked, but the problem persists.",Please investigate the issue. Provide additional details about the affected devices and their network configurations so we can offer further assistance.,Incident,IT Support,medium,de,52,Security,Network,Disruption,Hardware,,,,
Anfrage zum digitalen Marketingservice für Markenentwicklung,Können Sie detaillierte Preis- und Abrechnungsmodelle für Ihre digitalen Marketingdienstleistungen bereitstellen?,"Wir bieten individuell zugeschnittene digitale Marketinglösungen an, die auf die jeweiligen Bedürfnisse abgestimmt sind. Die Abrechnungsstrukturen unterscheiden sich je nach gewähltem Paket. Gerne erläutern wir die Details in einem Gespräch. Bitte stellen Sie weitere Informationen zu Ihren Marketingzielen bereit, damit wir Ihnen ein präziseres Angebot unterbreiten und die besten Wachstumsoptionen für Ihre Marke empfehlen können.",Request,Billing and Payments,low,de,52,Sales,Lead,Marketing,Digital Marketing,Pricing,Billing,,
"Digital Marketing Tools: Firmen Antwortfähigkeit Steigt, Allgemeine Probleme","Die digitalen Marketingwerkzeuge der Firma zeigten plötzlich eine erhöhte Antwortfähigkeit. Mehrere Neustart- und Verbindungsprüfungen wurden durchgeführt, jedoch behält sich das Problem bestehen. Es wird vermutet, dass das Problem durch Serverbelastung oder Netzwerkprobleme verursacht wird. Bitte beachten Sie, dass wir dringend Maßnahmen ergreifen müssen, um eine schnelle Lösung anzubieten. Falls zusätzliche Informationen benötigt werden, um das Problem zu beheben, informieren Sie uns bitte, und wir werden uns darum kümmern.","Derzeit untersuche ich das Problem mit den digitalen Marketingwerkzeugen. Bitte geben Sie mir die genaue Fehlermeldung und den Zeitpunkt an, ab wann das Problem begonnen hat, damit ich mich schnellstmöglich um eine Lösung kümmern kann.",Incident,Service Outages and Maintenance,high,de,52,Performance,Network,Outage,Disruption,Recovery,IT,Tech Support,
Datenschutzverletzung Sicherheitsproblem,Das IT-System des Krankenhauses wurde durch veraltete Protokolle kompromittiert.,Sie haben eine E-Mail bezüglich eines möglichen Datenschutzverstoßes im Krankenhaus aufgrund veralteter Protokolle erhalten. Ich benötige zusätzliche Informationen zum Problem. Könnten Sie bitte Details zu den fraglichen Protokollen und etwaigen Fehlermeldungen bereitstellen? Dies wird bei den nächsten Schritten zur Lösung des Problems helfen.,Incident,IT Support,high,de,52,Security,IT,Tech Support,,,,,
Request for Assistance with Digital Brand Expansion Strategies,"Customer Support, I am seeking information on strategies for growing a digital brand through your services. Could you please share detailed case studies showcasing successful campaigns that utilized specific tools to boost brand visibility and engagement? I am particularly interested in learning about the methods and techniques employed to achieve substantial growth in the digital space. Additionally, I would appreciate any information on the metrics used to evaluate the success of these campaigns. I look forward to your response.","<name>, thank you for your email. Please provide case studies of successful digital brand growth campaigns, including the metrics used to measure their success. We can also discuss how our services can support your brand's online expansion. If convenient, I am available for a call at <tel_num> to go over your requirements in detail.",Request,Billing and Payments,high,en,52,Feedback,Strategy,Marketing,Digital Marketing,Campaign,Engagement,Visibility,
Probleme mit digitalen Tools,"Bei den digitalen Werkzeugen der Marketingagentur (Antenne, Cisco Webex, Docker, Maple, Mailchimp, Smartsheet, Chef, SD-Karte, QuickBooks) treten Verbindungsprobleme auf, vermutlich aufgrund von Netzwerkausfällen. Das Team hat versucht, die Geräte neu zu starten und die Netzwerkeinstellungen zu prüfen, doch die Probleme bestehen weiterhin. Es wurden Software-Updates gesucht und sichergestellt, dass die Geräte korrekt konfiguriert sind. Trotz dieser Maßnahmen bestehen die Schwierigkeiten weiterhin. Wir schätzen eine schnelle Unterstützung bei der Problemlösung sehr. Bitte informieren Sie uns über weitere erforderliche Schritte.","Bitte untersuchen Sie das Problem. Teilen Sie uns Fehlermeldungen und Netzwerkinformationen mit, um zusätzliche Unterstützung zu ermöglichen. Kontaktieren Sie <tel_num>, um weitere Maßnahmen zur Fehlerbehebung zu besprechen.",Incident,Technical Support,low,de,52,Network,Outage,Disruption,Support,,,,
SaaS Performance Concern,"Customer Support has reported an issue with the SaaS platform's performance, which has unexpectedly slowed down. The problem might be linked to a recent update that was deployed. Attempts such as clearing the cache and restarting the server have not resulted in any improvement. The sluggish performance is impacting the team's overall productivity and workflow. Could you please investigate this matter urgently and suggest a solution or workaround to resolve the issue? Your assistance in restoring the platform's optimal operation would be greatly appreciated.","<name>, we received your email regarding the performance slowdown of the SaaS platform. Sorry to hear that the recent update may have caused this issue. We would like to investigate further and find a solution. Kindly provide the <acc_num> along with the exact error message you are encountering. Additionally, please let us know when the last update was applied and when the issue first began. If possible, we can arrange a call at <tel_num> to discuss potential workarounds to get the platform back to normal functioning.",Problem,Customer Service,low,en,52,Performance,Outage,Disruption,Recovery,Maintenance,,,
,"Sehr geehrter Kundendienst, könnten Sie bewährte Methoden für eine sichere Integration von AWS Elasticsearch 7.13 in Gesundheits-IT-Umgebungen bereitstellen? Wir benötigen Anleitungen zum sicheren Speichern und Abrufen von Daten. Bitte teilen Sie Ihr Fachwissen zu diesem Thema mit uns. Wir schätzen Ihre Unterstützung in dieser Angelegenheit.","Sehr geehrter Kunde,\n\nwir danken für Ihre Anfrage bezüglich einer sicheren Integration von AWS Elasticsearch 7.13 in Gesundheits-IT-Umgebungen. Für eine sichere Datenaufbewahrung und -abfrage empfehlen wir, die Daten im Ruhezustand sowie bei der Übertragung zu verschlüsseln, AWS IAM-Rollen zu nutzen und die integrierten Sicherheitsfunktionen von Elasticsearch zu verwenden. Die Implementierung von Zugriffskontrollen, rollenbasierter Zugriffskontrolle und Zwei-Faktor-Authentifizierung ist ebenfalls essenziell. Vergewissern Sie sich außerdem, dass Ihr Elasticsearch-Cluster ordnungsgemäß konfiguriert ist, HTTPS verwendet wird und regelmäßige Backups durchgeführt werden. Gerne stellen wir Ihnen detaillierte Informationen bereit.",Request,Technical Support,high,de,52,Customer Service,Support,Integration,Documentation,Knowledge Base,,,
Inquiry about Billing Details and Payment Methods for Pro Tools and Microsoft SQL Server 2019 Licenses,"Dear Customer Support, I am reaching out to inquire about the billing breakdown and payment options for Pro Tools and Microsoft SQL Server 2019 licenses. Could you kindly provide a detailed overview of the costs involved, including subscription charges, licensing fees, and any available discounts? I would also appreciate information on the payment methods offered, such as monthly or annual payments, as well as any penalties for late payments. Additionally, please let me know if there are any bundle deals or promotional offers available.","Dear Customer, thank you for contacting us regarding the billing breakdown and payment options for Pro Tools and Microsoft SQL Server 2019 licenses. We are happy to provide a detailed overview of the costs involved and the available payment methods. To assist you better, please provide your account number and current setup details so we can offer a personalized response.",Request,Billing and Payments,medium,en,52,Billing,Payment,Subscription,License,Cost,Discount,Account,
,"The data analytics platform has encountered sporadic failures disrupting investment optimization activities. Potential reasons involve recent software modifications or data corruption issues. Servers have been rebooted and updates reverted, yet the problem continues. Kindly assist in diagnosing and resolving this matter to avoid recurrence. The system's downtime is affecting operations, and an urgent return to normal functionality is required. Your prompt attention to this issue is appreciated.",Please examine the data analytics system issue and contact <tel_num> to discuss and deliver a solution.,Incident,Product Support,medium,en,52,Bug,Performance,Outage,Recovery,Software Update,,,
Issue Detected: Underperformance of Digital Campaigns,"The digital campaigns did not meet expectations, potentially due to targeting inaccuracies or platform-related problems. Despite optimizing ads and modifying audience segments, there was no improvement. An analysis is necessary to determine the underlying cause and to develop effective strategies to boost campaign results.",Examine the issue and contact <tel_num> to discuss the analysis and potential solutions.,Problem,Returns and Exchanges,medium,en,52,Performance,Outage,Disruption,Recovery,Analytics,,,
Strategies for Enhancing Digital Brand Development,"Customer Support: I am reaching out to inquire about the services provided by your marketing agency, specifically focusing on leveraging digital strategies to foster brand growth. Could you offer detailed guidance on how your agency's services can assist businesses in expanding their online presence and boosting brand visibility? I would appreciate information on the types of digital strategies you recommend, such as social media marketing, search engine optimization, and content creation. Additionally, I am interested in understanding the process involved in working with your agency.",Please contact us soon to discuss strategies for digital brand growth.,Request,Product Support,medium,en,52,Marketing,Digital Strategy,Brand Development,Social Media,Visibility,Online Presence,,
Problem with Smart Robotic Mop Device,The Smart Robotic Mop was unable to complete data cleaning. It appears that a software glitch or sensor malfunction may have caused this problem.,"<name>, we apologize for the inconvenience caused by the Smart Robotic Mop device. We understand that the failed data cleaning might be due to a potential software bug or sensor error. We would like to assist you in resolving this issue promptly. To better diagnose the problem, please provide us with the error messages you received or any unusual behaviors observed. Additionally, you have already tried restarting the device and checking for software updates. If the issue continues, please let us know.",Incident,Customer Service,low,en,52,Bug,Hardware,Performance,Disruption,Recovery,,,
Problems with Marketing Agency's Products,"Customer Support, I am contacting you concerning several product problems that our marketing agency is experiencing. These issues are severely affecting our campaign execution and overall effectiveness. We believe that recent software updates might be causing conflicts resulting in these problems. Our team has tried troubleshooting by rebooting and reinstalling the software, but unfortunately, these efforts did not resolve the issues. We would greatly appreciate your assistance in identifying the underlying cause and providing a solution.","To help resolve the product issues, please provide specific error messages and details about the software version you are currently using. This information will assist us in pinpointing the root cause and offering an appropriate solution.",Incident,Technical Support,high,en,52,Product,Issue,Feedback,Support,Software,Troubleshooting,,
Severe Issue with Data Analytics Platform,"Customer Support reports that a critical failure in the data analytics platform has compromised investment optimization workflows. Despite multiple attempts to restart the system and recalibrate data inputs, the problem remains unresolved. The suspected cause might be a software bug or data corruption. This failure has caused major operational disruptions, and urgent assistance is required to resolve the issue. Could you please investigate the matter and provide a prompt solution? Your prompt support would be highly appreciated.","<name>, this is to confirm receipt of your email regarding the critical failure of the data analytics platform. We recognize the urgency and impact on operations. We are currently investigating the issue. Kindly provide details of any error messages received and the steps already taken to troubleshoot. Additionally, information about the last system update or modifications would be helpful. With this information, we can better identify potential fixes and troubleshooting procedures. If necessary, further actions may be required.",Incident,Technical Support,high,en,52,Bug,Crash,Performance,Disruption,Recovery,Software Bug,,
Anleitung zur Integration von Data Analytics erforderlich,"Bitte wenden Sie sich an den Rat zur Integration von Data Analytics-Tools auf dem Touchscreen-Monitor, um die Investitionsoptimierung zu verbessern. Könnten Sie bewährte Verfahren für die Integration bereitstellen? Diese Ressource schätzt die Informationen, die beim Einstieg in das Projekt hilfreich sein könnten.",Gerne unterstütze ich bei der Integration von Data Analytics. Könnten Sie bitte weitere Details zu Ihrer aktuellen Konfiguration und spezifischen Anforderungen mitteilen? Ich kann dann bewährte Verfahren für die Integration des Touchscreen-Monitors mit Ansible empfehlen.,Request,Product Support,high,de,52,Product,Feature,Documentation,Feedback,,,,
Anfrage zur Integration von Datenanalysen,"Sehr geehrter Kundenservice, ich bitte um detaillierte Anleitungen zur Integration von Datenanalyse-Lösungen, um Investitionsstrategien und verwandte Produkte zu optimieren. Ich möchte Datenanalysen nutzen, um Investitionsentscheidungen zu verbessern und Produktangebote anzupassen. Können Sie bewährte Praktiken für die Integration von Datenanalysen in bestehende Infrastrukturen bereitstellen? Außerdem bin ich an Empfehlungen für geeignete Datenanalyse-Tools und Plattformen interessiert, die für meine Branche passend sind. Zudem möchte ich erfahren, ob Schulungen und Support-Services angeboten werden, um die Einführung der Datenanalyse-Integration zu erleichtern. Vielen Dank für Ihre Zeit und Unterstützung.","<name>, vielen Dank, dass Sie den Kundenservice kontaktiert haben. Wir schätzen Ihr Interesse an der Integration von Datenanalyse-Lösungen für Investitionsstrategien. Um Ihnen bestmöglich zu helfen, würden wir gerne Ihre spezifischen Bedürfnisse und Anforderungen genauer besprechen. Wäre ein passender Zeitpunkt für einen Anruf verfügbar, um dies zu erörtern? Bitte teilen Sie uns eine geeignete Zeit mit. Wir bieten Schulungen und Support-Services an, um die Datenanalyse-Integration zu unterstützen, und empfehlen passende Tools und Plattformen, die auf Ihre Branche zugeschnitten sind.",Request,Customer Service,high,de,52,Feature,Documentation,Feedback,IT,Tech Support,,,
,Docker version 20.10 is compatible with data analytics in financial investments.,"Dear Customer, thank you for your email. We appreciate the information regarding Docker 20.10's support for data analytics in financial investments. Could you please provide more details? We would like to explore the feature further and have specific questions about its implementation. We are happy to assist you further.",Request,Sales and Pre-Sales,medium,en,52,Product,Feature,Compatibility,Data Analysis,,,,
Investment Guidance,"Customer Support is seeking advice on how to optimize investment strategies through data analytics tools. They are exploring various features and functionalities of the platform and would appreciate expert insights to maximize its potential. Specifically, they want to learn about different metrics and indicators provided by the tools to make well-informed investment choices. Could you please offer guidance on how to begin using these data analytics tools for investment optimization?","<name>, thank you for reaching out to the customer support team regarding investment guidance with data analytics tools. To start optimizing your investment strategies, we recommend reviewing the platform's user guide, which offers an overview of the various metrics and indicators available. Additionally, our website features a series of tutorials and webinars that can help you better understand how to interpret data for informed decision-making. If you would like personalized assistance, please schedule a call with one of our experts.",Request,Billing and Payments,medium,en,52,Feedback,Account,Security,Product,Feature,Documentation,,
Sudden Outage on SaaS Platform Impacting Multiple Integrated Products,Server Overload Reported,Investigating Server Overload Issue Affecting SaaS Platform; Will Provide an Update Soon.,Incident,Product Support,medium,en,52,Outage,Disruption,Recovery,Performance,,,,
Inquiry Regarding Security Capabilities of Healthcare Solutions,"Customer Support is reaching out to inquire about the security features of healthcare solutions compatible with Windows 10 Pro and Microsoft Teams. As a healthcare professional, I am interested in understanding the measures implemented to safeguard sensitive patient information and ensure regulatory compliance. Could you provide comprehensive details about the security features, such as encryption techniques, access management, and data backup processes? Additionally, I would appreciate information on how these solutions integrate with Microsoft Teams.","Please review the inquiry and provide detailed information about security features and compliance certifications, including HIPAA. Contact <tel_num> to discuss further.",Request,Billing and Payments,high,en,52,Security,Compliance,Encryption,Healthcare,Data Protection,,,
Recent Update Causes Failure in Multiple Product Integrations,"Reporting an issue where several product integrations, such as iOS and Linux, have unexpectedly failed after the recent platform update. The probable cause appears to be conflicts introduced by the latest update. Troubleshooting efforts, including system restarts and patch verifications, have not resolved the problem. We would appreciate prompt assistance in resolving this matter. Please advise on the necessary steps to address the issue.",Please investigate the problem and contact <tel_num> to discuss potential solutions for the failed product integrations.,Incident,Human Resources,low,en,52,Bug,Performance,Disruption,Recovery,Maintenance,,,
