subject,body,answer,type,queue,priority,language,version,tag_1,tag_2,tag_3,tag_4,tag_5,tag_6,tag_7,tag_8
Update der Digitalen Strategie für Wachstum,"Lieber Kundenservice, ich möchte die Aktualisierung unserer digitalen Strategie um Wachstum und Beteiligung unserer Kunden bitten. Die aktuelle Strategie ist seit einiger Zeit wirksam, aber eine Neuüberprüfung und -bearbeitung ist notwendig, um im Marktwettbewerb den Vorteil zu behalten. Wir möchten neue innovative Ansätze erkunden, um unsere Gesamtpresenz im Markt zu verbessern, einschließlich Aktualisierungen der Website, Sozialmedien und Content-Marketing-Anstrengungen. Wir glauben, dass diese Maßnahmen die Kundenbeteiligungsmetriken erhöhen und das Geschäfts-Wachstum fördern werden.","Lieber [Name], vielen Dank, dass Sie sich an uns gewandt haben. Wir haben Ihre Anfrage zur Aktualisierung der digitalen Strategie für Wachstum zur Kenntnis genommen. Es freut uns, dass Sie Wachstum Ihrer Marke und die Verbesserung der Kundenbeteiligungsmetriken anstreben. Um Ihre Anforderungen besser zu verstehen, könnten wir mehr Informationen über Ihre aktuelle digitale Strategie in den spezifischen Bereichen zu erhalten wünschen. Es wäre schön, einen Anruf zu vereinbaren, um Ihre Bedürfnisse zu besprechen und neue innovative Wege zu finden, um mit den Kunden zu interagieren. Bitte teilen Sie uns alle Details mit.",Change,Product Support,medium,de,400,Feedback,IT,Tech Support,Product,Feature,,,
Misleading Charges in Account,"Lately, there have been several incorrect charges on my account for various products. This might be due to an error in the billing system or automated miscalculations. I have already contacted support and reviewed my account statements, finding some discrepancies. I would appreciate prompt assistance in resolving this issue.","We are currently reviewing account <acc_num> for the inaccuracies you mentioned. To better assist you, could you please provide details on the specific charges or any questions you have? Once we have this information, we will contact you at <tel_num> to discuss the next steps and ensure that the issue is resolved and your billing is accurate moving forward.",Incident,Billing and Payments,medium,en,400,Billing,Account,Refund,Payment,Bug,,,
Probleme mit der Integration,"Probleme bei der Integration mehrerer Plattformen, darunter Microsoft Teams und GitHub, wurden festgestellt. Neueste API-Änderungen könnten die Ursache sein. Verbindungsaufbau und API-Schlüssel wurden überprüft, ohne Erfolg. Wir schätzen Ihre Unterstützung beim Lösen dieses Problems. Bitte geben Sie die Schritte an, die Sie bisher unternommen haben, und lassen Sie uns wissen, welche API-Änderungen in der Nähe vorgenommen wurden.","Ich helfe gerne bei den Problemen mit der Integration mehrerer Plattformen. Um das Problem besser zu verstehen, könnten Sie bitte mehr Details zu den Fehlermeldungen und den Schritten geben, die Sie bisher unternommen haben. Es wäre hilfreich zu wissen, welche spezifischen API-Änderungen in der Nähe vorgenommen wurden. Wir können einen Anruf vereinbaren, um den Fall zu besprechen und eine zugeschnittene Lösung bereitzustellen. Bitte geben Sie ein geeignetes Zeitfenster an. Anruf: <tel_num>, Konto: <acc_num>, um das Troubleshooting zu besprechen.",Incident,Customer Service,medium,de,400,Integration,Network,Tech Support,Performance,,,,
Anfrage Zusammenarbeit: Skalierbarkeitsfunktionen,"Gestresst um den Kundensupport, ich möchte mich über die Anforderung der SaaS-Funktionen und die Verbesserung der Plattform für Projektzusammenarbeit und Skalierbarkeit informieren. Könnten Sie mehr Informationen über die Funktionalitäten und Hilfsmittel zur Unterstützung der Teamzusammenarbeit bei Projektwachstum bereitstellen? Ich freue mich auf Details zu den Funktionen, dem Preis und dem Implementierungsprozess. Bitte helfen Sie mir, die Plattform zu verstehen und meine Bedürfnisse zu erfüllen, um die Projektresultate zu verbessern. Vielen Dank für Ihre Zeit und Unterstützung. Ich freue mich darauf, bald eine Rückmeldung zu erhalten.",Die Anfrage wird bearbeitet. Bitte kontaktieren Sie uns unter <tel_num> für eine Diskussion über die Skalierbarkeitsfunktionen.,Request,Sales and Pre-Sales,low,de,400,Feature,Feedback,IT,Tech Support,,,,
Secure Management of Medical Data with OBS Studio,"In need of customer support to guide securely managing medical data using OBS Studio for video editing and streaming, particularly with Sony Vegas Pro 18. It's crucial to ensure that sensitive patient information is protected and compliant with relevant regulations. Could you provide recommendations or best practices for securing medical data within these software tools? Appreciate your assistance on this matter and look forward to hearing from you soon.",Please contact <tel_num> to discuss securing medical data using OBS Studio and Sony Vegas Pro 18.,Request,IT Support,medium,en,400,Security,IT,Tech Support,Feedback,Performance,,,
Issue with Data Integration System,"Facing issues with the data integration system, which has affected the performance of investment analysis. The problem seems to have arisen from the latest software updates or configuration changes. I have tried restarting the affected devices and reinstalling important software components, but without success. We believe that further assistance in resolving this issue would be helpful once we can. Please provide detailed information about the latest software updates and configuration changes to aid in solving the problem.","To resolve the data integration issue, please provide more details about the latest software updates and configuration changes. This will be helpful in addressing the problem.",Problem,Product Support,medium,de,400,Performance,IT,Tech Support,,,,,
Support for Adobe Audition,reach out to find out how Adobe Audition Project Management Software-as-a-Service solution can be integrated. Could you provide more information on the topic? I would be glad to offer advice and resources to begin the integration. Please let me know if there are specific requirements or considerations to keep in mind. I look forward to discussing how Adobe Audition can be utilized.,"Dear [name],\n\nI appreciate your interest in integrating Adobe Audition Project Management Software-as-a-Service solution. To proceed, I need more precise information regarding the current requirements. Could you please provide more details about your intentions for using Adobe Audition with our solution? You can visit our website for general information on integrations and system requirements. Alternatively, if you prefer to schedule a conference call, I am available to assist in exploring the integration together. Please let me know.",Request,Technical Support,medium,de,400,Feedback,IT,Tech Support,Product,,,,
Performance Challenges,"Faced unanticipated performance problems with multiple products during peak usage periods. This might be related to resource constraints and inefficient code management. Despite recent code optimizations and capacity enhancements, the issues continue. I would appreciate your help in pinpointing the root cause and implementing a solution to ensure a seamless user experience.","Received your email concerning the performance issues with the products. To assist you better, could you please provide more details on the errors you are experiencing and the optimizations that have already been made? Once I have this information, we can discuss possible solutions at your convenience.",Incident,Product Support,medium,en,400,Performance,Bug,Feature,IT,Tech Support,,,
,"geehrte Kundenservice-Team, ich schreibe, um dringend über die sozialen-Media-Beteiligungsmesswerte zu berichten. In den vergangenen Wochen wurde eine signifikante Abnahme der Beteiligung festgestellt, die möglicherweise auf kürzlich eingeführte Algorithmen zurückzuführen ist. Um das Problem zu reduzieren, haben wir den Veröffentlichungsplan und die Inhaltsstrategien angepasst, aber leider blieben die Bemühungen erfolglos. Ich hoffe, Ihr Verständnis und Unterstützung bei der Problembehandlung. Könnten Sie bitte mehr Informationen über den aktuellen Veröffentlichungsplan und die Inhaltsstrategie bereitstellen? Konkrete Ratschläge und Empfehlungen zur Verbesserung der sozialen-Media-Beteiligung wären sehr willkommen.","Ich freue mich, Ihnen bei der Verbesserung der sozialen-Media-Beteiligungsmesswerte zu helfen. Könnten Sie bitte mehr Details zum aktuellen Veröffentlichungsplan und der Inhaltsstrategie bereitstellen? Sobald ich diese Informationen habe, kann ich konkrete Ratschläge und Empfehlungen geben, um die Beteiligung zu verbessern. Es könnte erforderlich sein, dass wir telefonisch darüber sprechen, um alle Aspekte zu besprechen.",Incident,Technical Support,low,de,400,Feedback,Performance,Feature,,,,,
Request for Information on Data Security Measures,"Hello Customer Support, I am inquiring about the data security measures that are in place for healthcare-related products. Could you provide a detailed explanation of the protocols and technologies used to protect sensitive patient data? It would be greatly appreciated if the information includes relevant certifications and compliance standards that the company adheres to. This information will help me better understand how your approach to data security aligns with industry practices. Thank you in advance for your assistance, and I look forward to hearing from you.",Thank you for your inquiry regarding data security measures. We adhere to industry standards and protocols to protect sensitive patient data. We can provide detailed information on the protocols and certifications we use. Please allow us to call you for a more convenient time to discuss this further.,Request,Customer Service,medium,en,400,Security,Compliance,Documentation,Feedback,Tech Support,,,
Significant Disruption in Data Analytics Software Reported,"A significant disruption has been reported affecting the data analytics software, which is crucial for investment optimization. The issue might be due to server overload or software malfunction. Attempts to reboot the affected systems and check network connections were unsuccessful. We kindly request your assistance in resolving this issue as soon as possible.","Acknowledging the major outage impacting the data analytics software, which is hindering investment optimization. We regret to inform you that our attempts to reboot the systems and check network connections were unsuccessful. To investigate further, we need details on any error messages and the exact steps taken so far. Could you also provide the time the outage started and any recent changes made to the system or software? We would like to schedule a call at your earliest convenience to discuss this matter.",Incident,Service Outages and Maintenance,high,en,400,Disruption,Network,Performance,IT,Tech Support,,,
,"Das Softwareprogramm scheitert bei der Darstellung von Datenvisualisierungen, was auf mögliche hohe Speichereinstellungen oder Kompatibilitätsprobleme mit dem NAS-System zurückzuführen sein könnte, obwohl das System neu gestartet und aktualisiert wurde.","Um das Problem zu diagonalisieren, bitten wir um weitere Details und mögliche Lösungen.",Problem,Technical Support,high,de,400,Bug,Performance,Feature,Documentation,IT,Tech Support,,
Severe Performance Challenges with SaaS Application,"The SaaS application is currently facing severe performance challenges, leading to slow response times. This might have resulted from an increase in user load and the connected devices via the NAS system. Steps were taken to optimize server settings and enhance bandwidth, but the performance issues continue to persist. Despite these efforts, the platform's performance remains unsatisfactory, causing concern about its impact on users. I would greatly appreciate it if you could look into this matter urgently and provide a solution to resolve the performance issues.","Received your email about the critical performance issues with the SaaS application. I understand the urgency of the matter and its impact on users. To assist further, could you please provide details on the increased user load and the optimizations that have been attempted so far? Additionally, I need your account number and contact information to proceed with the investigation and provide a suitable solution.",Problem,Technical Support,high,en,400,Performance,Network,IT,Tech Support,,,,
,"Dear Customer Support, I'm encountering an issue with securing medical data during routine operations. There might be integration conflicts among multiple software applications. I've already updated Norton 360, restarted my Mac Mini, and adjusted the barcode scanner settings, but the problem still persists. I would greatly appreciate your help in resolving this matter. Please let me know if you need any additional information from me. Thank you for your support and assistance.",We will investigate the integration conflicts that might be causing the medical data security issue. Could you please provide us with the versions of the software applications involved and any relevant analysis? We will contact you at <tel_num> to discuss the next steps. Thank you.,Problem,IT Support,low,en,400,Bug,Performance,IT,Tech Support,,,,
Problem mit dem System-Aufstopp bei Microsoft Teams,Es gab einen System-Aufstopp und Datenanalyse-Berichte wurden gestartet.,"Untersuchen Sie das Microsoft Teams System-Aufstopp-Problem. Sie haben Datenanalyse-Berichte ausgeführt. Bitte starten Sie die Anwendung neu und melden Sie sich bei uns an, wenn das Problem weiterhin besteht. Wir werden Ihnen zusätzliche Hilfe anbieten.",Incident,Technical Support,high,de,400,Bug,Performance,IT,Tech Support,,,,
"Interesse an der Sicherung medizinischer Daten, Alteryx-Integration und HubSpot CRM","Ich würde mich freuen, mehr Details zum Thema zu erhalten. Könnten Sie bitte mehr Informationen zu Ihrem aktuellen Setup und den spezifischen Anforderungen bereitstellen, damit ich Ihnen besser helfen kann? Detaillierte Informationen über mögliche Integrationsoptionen würden sehr hilfreich sein.","Ich freue mich, Ihnen bei der Sicherung medizinischer Daten und der Alteryx-Integration mit HubSpot CRM behilflich zu sein. Um Ihnen optimal zu helfen, könnten Sie bitte mehr Informationen zu Ihrem aktuellen Setup und den spezifischen Anforderungen bereitstellen. Detaillierte Informationen über die möglichen Integrationsoptionen würden sehr hilfreich sein.",Request,Billing and Payments,medium,de,400,Documentation,Feature,IT,Tech Support,,,,
,"Zugänglichkeit von digitalen Marketingwerkzeugen, Umsetzung von Kampagnen und Förderung des Wachstums beeinträchtigt.","Entschuldigung für die Probleme mit den digitalen Marketingwerkzeugen. Könnten Sie bitte mehr Details zum spezifischen Fehler oder dem Problem geben, das Sie konfrontiert haben, damit wir die Situation besser verstehen und eine genaue Lösung anbieten können? Falls erforderlich, können wir telefonisch oder per E-Mail eine Besprechung vereinbaren. Geben Sie bitte eine geeignete Zeit an, um zu telefonieren, oder kontaktieren Sie uns per E-Mail unter <tel_num>. Wir werden unser Bestes tun, um das Problem so schnell wie möglich zu lösen.",Incident,Product Support,high,de,400,Feedback,Feature,Documentation,Sales,,,,
Investment Strategies Through Data Analytics Services,"Customer Support, seeking information on data analytics services to optimize investment strategies. Would appreciate details on the tools and techniques used for analyzing market trends to make data-driven investment decisions. Kindly provide information and case studies. Appreciate your assistance. Looking forward to your response.","Dear [Name], thank you for your inquiry regarding our data analytics services. We utilize advanced tools and techniques to analyze market trends. We would be happy to provide you with more information and discuss case studies. We would like to call you at your convenience to discuss further.",Request,Customer Service,medium,en,400,Feature,Documentation,Feedback,Sales,Tech Support,,,
Support Needed for Login Problems,"A user is encountering intermittent login difficulties with the SaaS platform. This might be related to recent server updates. The user has already attempted clearing the cache and logging in from multiple browsers, but these steps have not resolved the issue. Additionally, the user has tried different login credentials, and the problem still persists. The user is experiencing frustration and is requesting assistance to resolve the issue as soon as possible. Could you please look into this matter and provide a solution or workaround?",Please investigate the login issue and contact the user soon to resolve it and provide a workaround.,Incident,IT Support,medium,en,400,Login,Performance,IT,Tech Support,,,,
Anfrage zur Integration von SendGrid,"Kontaktieren Sie mich, um mehr Informationen zur Integration von SendGrid bei unserem Projektmanagement-Clouddienst zu erhalten. Wir könnten einen Schritt-für-Schritt-Leitfaden und relevante Ressourcen bereitstellen, um die E-Mail-Übertragung zu verbessern und mehr Vorteile der Verwendung von SendGrid zu erfahren. Insbesondere möchten wir wissen, wie man Webhooks einrichtet, um die Öffnungsrate von E-Mails zu verfolgen. Ihre Hilfe wird schätzen.","Ich freue mich, Ihnen bei der Integration von SendGrid und Ihrem Projektmanagement-Clouddienst helfen zu können. Bitte besuchen Sie die Website und gehen Sie in den Ressourcenbereich, um detaillierte Anleitungen für die Einstellung von Webhooks und die Verfolgung von E-Mail-Auföffnungen zu finden. Wenn Sie weitere Hilfe benötigen, lassen Sie uns einen Anruf vereinbaren. Bitte geben Sie mir einen günstigen Zeitpunkt, um anzurufen. <tel_num> Wenn Sie den Leitfaden per E-Mail erhalten möchten, lassen Sie es mich wissen, und ich werde ihn Ihnen zusenden. Falls Sie weitere Fragen haben, kontaktieren Sie mich bitte unter <acc_num>.",Request,Product Support,medium,de,400,Integration,Documentation,Tech Support,,,,,
Issues with Slack Integration,"A problem has been identified where users are experiencing connection issues with Slack on our SaaS platform. The issue seems to be related to the latest updates on iOS 15 and Express.js 4.17. Efforts to resolve the problem have included checking API integrations, restarting devices, and verifying network connections, but the issues persist.","Dear [name],\n\nI would like to reassure you that we have documented the issue with the Slack connection to our SaaS platform. Thank you for the detailed information and the efforts you have made to resolve the problem, which included checking API integrations, restarting devices, and verifying network connections. It is likely that the issues stem from the latest updates on iOS 15 and Express.js 4.17.\n\nTo investigate the issue further, please provide more details about any error messages you encounter, as this will assist us in finding a solution.",Incident,Technical Support,high,de,400,Bug,Network,Performance,IT,Tech Support,,,
Improve Investment Optimization Through Advanced Data Analytics Tools,"Seeking assistance in optimizing the use of investment tools for better performance tracking across our product line. The current tools are lacking in the level of detail necessary to make informed investment decisions. I would greatly appreciate advanced features such as real-time data tracking, predictive analytics, and customizable dashboards. These enhancements would significantly improve the investment experience and lead to better returns.","\""Name\"", thank you for reaching out to our customer support team regarding the request to enhance data analytics tools for investment optimization. We appreciate your feedback and understand the importance of advanced features in making informed investment decisions. Currently, we are reviewing the available tools and exploring ways to implement real-time data tracking, predictive analytics, and customizable dashboards. To better understand your specific needs and priorities, could you please provide more information on the features you would like to see?",Change,Returns and Exchanges,medium,en,400,Feature,Performance,Product,Feedback,IT,,,
Details on Integrating OBS Studio,"I am reaching out to the customer support team regarding the integration capabilities of OBS Studio with a project management SaaS solution. Could you provide detailed information on how these two platforms work together? Specifically, I am interested in learning about the types of data that are shared, the benefits of the integration, and any specific setup or configuration requirements. Additionally, I would appreciate any documentation or resources that can help me get started with the integration process. I look forward to hearing back from you as we explore this solution.","Thank you for reaching out to our customer support team regarding the integration of OBS Studio with your project management SaaS solution. We will provide you with detailed information on how to integrate these two platforms, including the types of data that are shared and the benefits of the integration. For specific setup and configuration requirements, we recommend reviewing the documentation resources available on our website. If you need further assistance, please let us know and we will be happy to schedule a call at <tel_num> to discuss your integration needs.",Request,Customer Service,medium,en,400,Feature,Documentation,Feedback,IT,Tech Support,,,
Support Required for ClickUp Integration,"Dear Customer Support, I am requesting detailed instructions on how to integrate ClickUp with QuickBooks Online for project management. I need a step-by-step process to ensure a smooth connection between the two platforms and seamless data transfer. Could you please provide a comprehensive guide and any additional resources that could assist in this integration? I would greatly appreciate any tips or recommendations you have. Thank you for your assistance, and I look forward to your prompt response.","Dear [Name], we will provide a step-by-step guide for integrating ClickUp with QuickBooks Online. Please allow us to contact you at [Tel Num] to schedule a convenient call to walk you through the process. Thank you.",Request,Customer Service,high,en,400,Feature,Documentation,IT,Tech Support,,,,
Severe Performance Challenges in SaaS Project Management Tool,"Customer Support, we are currently facing severe performance challenges with our project management SaaS platform. It may be due to unoptimized resource allocation or Azure compatibility issues, possibly related to macOS Monterey. Despite restarting the application and clearing caches, the issue still persists. Our team is working hard to resolve the issue and urgently requires assistance to prevent further disruptions. Could you please look into this matter and provide guidance on how to optimize resource allocation and ensure smooth performance?",We will investigate the performance issues with the SaaS platform immediately. Please provide any additional information that may be needed.,Incident,Product Support,high,en,400,Performance,IT,Tech Support,Maintenance,,,,
Concern About Website Speed,"Users face delays during peak times, even after coding optimization and server scaling. Assistance is needed to pinpoint and resolve the issue for a smooth user experience.",Please review the issue and contact us at <tel_num> to discuss a suitable time for investigating the root cause of the website performance issue.,Incident,IT Support,high,en,400,Performance,IT,Tech Support,,,,,
IT-System-Sicherheit,"geehrte Kundenservice,\n\nich melde Ihnen einen neuesten Sicherheitsfall im Krankenhaus-IT-System an. Es wurde ein autorisierter Zugriff festgestellt, was möglicherweise auf schwache Passwortsicherheitsprotokolle zurückzuführen ist. Um das Problem zu beheben, werden wir stärkere Passwortsicherheitsmaßnahmen einführen und eine umfassende Systemkontrolle durchführen, um potenzielle Vernetzungsfehler zu identifizieren.\n\nDer Vorfall ereignete sich am [Datum], als die Sicherheitsüberwachung feststellte, dass der autorisierte Zugriff wahrscheinlich das Ergebnis eines schwachen Passworts war. Unser Team hat Maßnahmen getroffen, um dies zu beheben. Seitdem haben wir verstärktes Passwortmanagement und kontinuierliche Systemüberwachung implementiert.\n\nViele Grüße","geehrte <name>,\n\nvielen Dank für Ihre Meldung zum Sicherheitsfall im Krankenhaus-IT-System. Wir schätzen Ihre umfassenden Maßnahmen, einschließlich der Stärkung der Passwortsicherheitsrichtlinien und der durchgeführten Systemkontrolle. Um den Vorfall weiter zu prüfen und detaillierte Kontrollergebnisse zu besprechen, wäre es hilfreich, wenn wir telefonisch zusammenarbeiten könnten. Bitte teilen Sie mir Ihr freies Zeitfenster mit, damit wir ein passendes Gespräch vereinbaren können. Wir werden unser Team darauf hinweisen, um sicherzustellen, dass alle erforderlichen Anleitungen zur Verhinderung zukünftiger Vorfälle bereitstehen.\n\nViele Grüße,\n[Dein Name]",Incident,Technical Support,high,de,400,Security,IT,Network,Bug,Performance,,,
