subject,body,answer,type,queue,priority,language,version,tag_1,tag_2,tag_3,tag_4,tag_5,tag_6,tag_7,tag_8
Bestätigung des Laufzeitproblems bei SaaS-System,"Unerwartete Warteschlangen wurden beim Projektmanagement-SaaS-System beobachtet, was den Benutzerzugriff beeinträchtigt hat. Es scheint, dass Server-Konfigurationsfehler durch die neuesten Updates verursacht wurden. Ich habe versucht, die betroffenen Dienste neu zu starten und die neuesten Konfigurationsänderungen rückgängig zu machen, aber das Problem behält sich bestehen. Bitte helfen Sie uns, das Problem schnell zu lösen.","Ich bestätige das Problem der Laufzeit bei Ihrem SaaS-System und entschuldige die damit verursachten Unannehmlichkeiten. Ich verstehe, dass Sie versucht haben, die betroffenen Dienste neu zu starten und die neuesten Konfigurationsänderungen rückgängig zu machen, aber das Problem behält sich bestehen. Ich bin bereit, Informationen zu Fehlermeldungen zu sammeln und die genauen Schritte der neueren Updates zu prüfen. Es ist korrekt, dass wir uns am geplanten Zeitpunkt treffen und das Thema im Detail besprechen, um eine Lösung zu finden. Bitte teilen Sie mir ein geeignetes Zeitfenster für den Anruf mit.",Incident,IT Support,high,de,400,Bug,Performance,Network,IT,Tech Support,,,
,"The user is unable to access the project settings, and recent updates. Steps taken include clearing the browser cache and resetting user permissions, but access is still blocked. The issue might be due to recent code changes or permission misconfigurations. Please assist in resolving this issue at your earliest convenience.","We are looking into the issue regarding access to the project settings. To troubleshoot, could you provide details on the recent updates and code changes? If needed, we may need to contact you directly for a call at your convenience to discuss and find a resolution.",Incident,Technical Support,medium,en,400,Bug,Performance,IT,Tech Support,,,,
Probleme bei plötzlichem Fallen der Website-Besucherzahl,"Beobachtet wurde ein plötzlicher Anstieg der Website-Besucherzahl, begleitet von einer Steigerung der Engagierungsindikatoren. Mögliche Ursache: neueste Änderungen in der Suchmaschinen-Optimierung (SEO).",Für das Problem wird die Ursache ermittelt und mögliche Lösungen für den plötzlichen Fall der Website-Besucherzahl besprochen. Eine Kontaktaufnahme ist erforderlich.,Incident,Technical Support,high,de,400,Performance,Disruption,Feedback,IT,,,,
,"Dear Customer Support, I recently observed inconsistencies in patient billing records and suspect they may be due to system glitches or incorrect data entry. I have already reviewed the billing system logs and verified patient information, but the issue still persists. I need your assistance to resolve this as soon as possible. Could you please provide examples of the discrepancies and the steps you have taken so far? We would appreciate a prompt response and guidance on the next steps we should take to resolve this matter. Thank you for your attention to this issue.","Dear [Name], we are investigating the discrepancies in the patient billing records you have reported. To better understand the specifics of the issues you are experiencing, could you please provide examples of the discrepancies and the steps you have already taken? We will contact you at [Tel Num] to discuss the next steps and resolve the issue as soon as possible. Thank you.",Problem,Billing and Payments,low,en,400,Billing,Payment,Bug,Performance,IT,Tech Support,,
,"Dear customer support, a critical failure in our project management SaaS application has led to service disruptions for multiple clients. The issue seems to stem from recent MySQL updates that may be incompatible with our Shopware integration. Despite our attempts to rollback the MySQL updates and reconfigure the Shopware settings, the issue persists. We require your assistance to resolve this matter promptly to prevent further service disruptions.",Please review the issue and contact us at <tel_num> to discuss possible assistance and resolution for the project management SaaS application failure.,Problem,Product Support,high,en,400,Disruption,Outage,Performance,Feature,Tech Support,,,
,"Sehr geehrte Kundensupport, ich schreibe an Sie, da die Nothwendigkeit einer verstärkten Sicherheitspolitik in Bezug auf die Bewahrung medizinischer Daten in IT-Systemen im Gesundheitssektor sehr bedeutend ist. Es ist von großer Bedeutung, um vertrauliche Patientendaten abzusichern und cyberbasierte Bedrohungen zu vermeiden. Bitte überlegen Sie, robuste Sicherheitsmaßnahmen wie Verschlüsselung, Firewalls und Zugangssteuerungen einzuführen, um die Vertraulichkeit, Integrität und Verfügbarkeit medizinischer Daten zu gewährleisten. Darüber hinaus sollten regelmäßige Sicherheitsaudits und Trainings für Mitarbeiter durchgeführt werden, um Schwachstellen zu identifizieren und Datenverletzungen zu verhindern. Ich glaube, dass dies den Schwerpunkt der Maßnahmen setzen sollte.","Sehr geehrter <name>, vielen Dank für Ihre E-Mail und die Bedeutung der Verbesserung der Sicherheitsprotokolle für medizinische Daten in IT-Systemen. Wir nehmen die Sicherheit der Patientendaten sehr ernst und engagieren uns, um diese zu schützen. Wir werden unsere aktuellen Sicherheitsmaßnahmen überprüfen und zusätzliche Protokolle zur Verschlüsselung und Zugangssteuerung in Betracht ziehen. Wir betrachten auch die Durchführung regelmäßiger Sicherheitsaudits und Trainings für Mitarbeiter, um die Vertraulichkeit, Integrität und Verfügbarkeit medizinischer Daten zu gewährleisten. Wir bedanken uns für Ihre Einsicht und werden Ihnen über die Laufenden Maßnahmen informieren.",Change,IT Support,high,de,400,Security,IT,Tech Support,Feedback,,,,
,"Dear Customer Support, I am submitting a report regarding an issue with the investment optimization tool. The tool is experiencing delays in data processing, which might be due to insufficient memory allocation or software configuration errors. Despite restarting the RAID-Controller and checking the Asana integration, the issues still persist. I have attempted troubleshooting, but the delays continue to occur. I would greatly appreciate it if you could look into this matter and provide a solution as soon as possible. Please let me know if any additional information is required.","<name>, thank you for reporting the issue with the investment optimization tool. We would like to assist in resolving the delay in data processing. Could you please provide details of any error messages and the exact steps you have taken so far? Please provide <acc_num> so we can look into this matter and provide a solution as soon as possible.",Incident,Technical Support,low,en,400,Bug,Performance,IT,Tech Support,,,,
Problems with Project Management Platform Interruptions,"We have noticed unexpected interruptions with the project management platform. These interruptions are likely due to server overloads from recent code updates. Despite reverting to the previous version and attempting to increase server capacity, the issue persists. This is causing significant delays in accessing critical project information. We value your prompt attention to this urgent matter and would appreciate a quick resolution. Please inform us if you need additional details to resolve the issue.","Dear <name>,\n\nYour email regarding interruptions with the project management platform has been received. We understand the critical nature of this issue and its impact on teams' ability to access vital project information. We assure you that we take this matter seriously and will work to resolve it as quickly as possible.\n\nTo better understand and address the issue, could you provide additional details such as the exact error messages, when these occurred, and any relevant log files or screenshots?\n\nThank you for your cooperation.",Problem,Technical Support,high,de,400,Outage,Disruption,Performance,IT,Tech Support,,,
Optimierung von Investment-Analysen-Tools,"Sehr geehrte Kundenservice, bitte überprüfen Sie die Nutzung der Tools Smartsheet und Adobe Effects zur Verbesserung der Investmentanalyse. Könnten Sie uns Details zur effektiven Nutzung dieser Tools liefern? Ich schätze eine Anleitung oder Ressourcen sehr. Vielen Dank für Ihre Unterstützung. Ich freue mich darauf, bald von Ihnen zu hören.","Sehr geehrte <name>, wir werden Ihnen Anleitungen zur Optimierung der Investment-Analysen-Tools Smartsheet und Adobe Effects zur Verfügung stellen. Bitte lassen Sie uns telefonisch über <tel_num> erreichen, um weitere Details zu besprechen und den besten Ansatz für Ihre spezifischen Anforderungen zu bestimmen.",Request,Billing and Payments,high,de,400,Feature,Feedback,Documentation,IT,,,,
Hilfe für neuerlichen Sicherheitsunfall-Bericht,"Lieber Kundenservice, ich schreibe Ihnen, um einen neuerlichen Sicherheitsunfall zu melden, bei dem es im Krankenhaus zu einem Krankenhaus aufgetreten ist. Unautorisiertes Zugriffsvorfall hat die medizinischen Daten in den IT-Systemen des Krankenhauses gefährdet. Der Vorfall wurde auf Benutzerfehler zurückgeführt. Wir haben versucht, die Sicherheitssoftware zu aktualisieren und eine Überprüfung des Zugriffslogs durchzuführen, aber die Probleme blieben bestehen. Wir schätzen Ihre Anleitung zur Lösung des Problems und zur Verhinderung zukünftiger Vorfall. Bitte geben Sie die nächsten Schritte an. Vielen Dank für Ihre Unterstützung.","Lieber [Name], wir bestätigen den gemeldeten Sicherheitsunfall im Krankenhaus. Um Ihnen behilflich zu sein, benötigen wir weitere Informationen zum Vorfall und den Schritten, die bisher unternommen wurden. Bitte geben Sie Details zu den compromittierten Daten und den Sicherheitssoftware-Aktualisierungen, die durchgeführt wurden. Wir vereinbaren einen Anruf am [Tel Nummer], um die nächsten Schritte zu besprechen und Ihnen Rat zur Lösung des Problems zu geben.",Incident,Returns and Exchanges,high,de,400,Security,IT,Tech Support,Documentation,,,,
Irregular Investment Forecast Outputs,"Hello Customer Support, we are encountering problems with our investment forecasts. The latest analytics run has produced inconsistent results, which may be due to a recent data integration error. We have already taken initial steps to address the issue by restarting the analytics system and checking for discrepancies in the data sources. However, the problem persists, and we require your assistance to identify and rectify the root cause. We would appreciate your urgent attention to this matter and guidance on how to proceed. Please schedule a call at <tel_num> as soon as possible, and we will provide you with the necessary details, including the account number <acc_num>, to expedite the resolution.","Hello, we are currently experiencing issues with irregular investment forecast outputs. Could you please provide us with details regarding the recent data integration error and the initial steps you have taken to resolve the issue? We are able to provide solution guidance and may schedule a call at <tel_num> to expedite the resolution for account <acc_num>.",Incident,Technical Support,high,en,400,Bug,Performance,Documentation,IT,Tech Support,,,
Problematik bei episodischem Datenverlust in DataRobot Analyse Investorenleistungsmaßen,"Habe episodischen Datenverlust in DataRobot Analyse Investorenleistungsmaßen erlebt. Daten verloren werden und wiederhergestellt werden müssen. Versucht, DataRobot neu zu installieren und Kompatibilität mit macOS und Bitdefender zu überprüfen, aber das Problem behält sich beständig. Beschreibung des Problems: Datenverlust tritt episodisch auf. Fehlerbehebungsmaßnahmen wurden unternommen, aber das Problem bleibt ungelöst. Wäre dankbar, wenn die Angelegenheit schnellstmöglich angenommen und eine Lösung angeboten werden könnte. Bitte teilen Sie weitere Informationen mit.","Sehr geehrte(r) <name>,\n\nich bestätige die Erhaltung eines E-Mail-Berichts über episodischen Datenverlust in DataRobot Analyse Investorenleistungsmaßen. Ich möchte die Problemumstellung untersuchen und eine Lösung finden. Bitte bestätigen Sie die Version von DataRobot sowie die Software-Updates, die in vergangenen Zeiträumen auf den Plattformen installiert wurden. Darüber hinaus wäre es hilfreich, wenn Sie die genauen Fehlermeldungen bei den Datenverlustsymptomen mitteilen könnten. Falls nötig, können wir telefonisch Kontakt aufnehmen (Tel.: <tel_num>), um weitere Details zu besprechen. Bitte geben Sie bekannt, wenn weitere Informationen zur Verfügung stehen.\n\nMit freundlichen Grüßen,\n[Your Name]",Problem,Technical Support,high,de,400,Bug,Performance,Security,IT,Tech Support,,,
Problems with Financial Reporting Access,"User unable to access recent financial reports after recent update. Already restarted system and cleared cache, but issue persists.","Dear [name],\n\nI am reporting an issue where access to financial reports is still problematic after the latest update. I understand that restarting the system and clearing the cache did not resolve the problem. Please investigate further and share any additional details from the error message for reference. If necessary, we can schedule a call to discuss the solution. Please provide a suitable time for the call or prefer to communicate via email. I look forward to your response.\n\nBest regards,",Incident,Billing and Payments,medium,de,400,Bug,Performance,IT,Tech Support,,,,
Assistance with Azure Ruby on Rails Integration,Seeking guidance on integrating the Azure Ruby on Rails SaaS project,"'Name', we appreciate your contact with the service desk concerning the integration of the Azure Ruby on Rails SaaS project. We would be delighted to assist with the integration process. To better understand your requirements, could you please provide us with more details about the project and the specific Azure services you are interested in using? This information will help us provide you with the most accurate and helpful solution. If you need, we can schedule a call at your convenience to discuss further. Please let us know a time that works for you.",Request,IT Support,low,en,400,Feature,IT,Tech Support,,,,,
,"Ein Integrationsfehler trat bei SaaS-drittanbieterbasierten Produkten auf. Ungereimte API-Änderungen könnten der Ursache sein. Versucht, das Problem durch Neustart der Dienste und Wiederherstellung der Verbindungen zu beheben, ohne dass dies erfolgreich war. Hilfe ist erforderlich, um die Ursache des Integrationsfehlers zu identifizieren und zu beheben.","Derzeit überprüfe den Fall auf den Integrationsfehler bei den SaaS-drittanbieterbasierten Produkten. Um Ihnen besser zu assistieren, benötige ich zusätzliche Informationen, insbesondere die Fehlermeldungen und die Schritte, die Sie bisher unternehmen konnten. Könnten Sie bitte mehr Details zum Problem geben? Ein Telefonat muss geplant werden, um weitere Details zu besprechen. Könnten Sie ein passendes Zeitfenster nennen, um das Gespräch zu vereinbaren? Bitte geben Sie <tel_num> an.",Incident,Product Support,high,de,400,Bug,Network,Performance,Recovery,Tech Support,,,
Besorgnis über Abnahme der Kundenbeteiligung bei digitalen Strategien,Beobachten wir eine Abnahme der Kundenbeteiligung aufgrund von Algorithmusänderungen. Trotz der Anpassungen haben wir die Ergebnisse verbessert.,"Ich möchte mich hiermit auf die Besorgnis über die Abnahme der Kundenbeteiligung bei digitalen Strategien aufgrund von Algorithmusänderungen konzentrieren. Verstehe, dass die Ergebnisse trotz der Anpassungen verbessert wurden. Um das Problem besser zu verstehen, könnten Sie bitte mehr Details über den betroffenen digitalen Strategie und bereits vorgenommenen Anpassungen geben. Es wäre hilfreich, zu wissen, welche Messkriterien verwendet werden, um die Kundenbeteiligung zu messen. Ich wäre gern bereit, eine Telefonkonferenz zu vereinbaren, um mögliche Lösungen zu erörtern. Bitte lassen Sie mich wissen, wann wir telefonisch zusammenarbeiten können.",Problem,Sales and Pre-Sales,high,de,400,Feedback,Product,Feature,,,,,
Verbesserung der Strategien für Markengröße,"Sind Sie an einer umfassenderen digitalen Strategie interessiert, die die Markengröße fördern kann? Wir möchten mehr über Ihre Dienstleistungsanforderungen erfahren.","Sehr geehrte/r [Name],\n\nvielen Dank für Ihr Interesse an digitalen Strategien zur Markengröße. Unser Angebot umfasst Social-Media-Management, Content-Creation, Zielgruppenwerbung und Markenkenntnis, um die Markengröße zu verbessern. Wir freuen uns, weitere Informationen mit Ihnen zu besprechen und die Dienstleistungen auf Ihre spezifischen Anforderungen anzupassen.\n\nUm Ihre Ziele und Absichten besser zu verstehen, würden wir Sie bitten, uns mehr Details zu Ihrem aktuellen Markengröße-Projekt und den Herausforderungen zu teilen. Es wäre uns eine Freude, telefonisch mit Ihnen zu sprechen und weiterzudiskutieren. Gibt es für Sie ein gutes Zeitfenster, um am [time] anzurufen? [tel_num]\n\nVielen Dank und freundliche Grüße,\n[Your Company Name]",Request,Technical Support,high,de,400,Feedback,Product,Feature,Sales,,,,
Investment Optimization Analytics Anomalies Detected,We have identified some anomalies in the investment optimization analytics. Potential reasons could be data inconsistencies or algorithmic errors. Our attempts to recalibrate the algorithms and validate the data sources have been unsuccessful. We require assistance to resolve this issue and ensure the accuracy of the analytics.,Reviewing the investment optimization analytics anomalies. Please provide details of the errors encountered. You can contact us at <tel_num> to discuss and receive assistance in resolving the issue.,Incident,Returns and Exchanges,high,en,400,Bug,Performance,IT,Tech Support,,,,
Verbesserung digitaler Marketingstrategien für ein erhöhtes Markenwachstum,"Ich benötige Unterstützung bei der Analyse meiner digitalen Marketingstrategien, um ein besseres Markenwachstum zu erzielen.","Guten Tag <name>, ich bemerke die Anfrage nach Unterstützung bei der Analyse Ihrer digitalen Marketingstrategien, um das Markenwachstum zu erhöhen. Um Ihre Bedürfnisse besser zu verstehen, würde ich gerne mehr Informationen über Ihre aktuellen Marketingbemühungen und spezifische Ziele erhalten. Dies ermöglicht es mir, personalisierte Empfehlungen und Ratgeber zu geben. Falls Sie es vorziehen, können wir auch telefonisch darüber sprechen. Bitte rufen Sie mich unter <tel_num> an, sobald es Ihnen passt. Lassen Sie mich wissen, wann Sie telefonieren möchten.",Change,Technical Support,high,de,400,Feedback,Sales,Feature,,,,,
Concern about Unauthorized Access to Patient Invoices,There was an attempt to access patient invoice data without authorization due to a phishing attack. We have intensified our employee training and updated our firewall settings. Further support is required to ensure the security of our patient data.,"Dear [Name],\n\nI am writing to provide an update on the issue regarding unauthorized access to patient invoices. We take the protection of patient data seriously and are committed to providing the necessary support.\n\nTo investigate the problem and improve our security measures, please provide more details about the incident, including the date and time it occurred. We would also be happy to arrange a call to discuss the necessary steps to ensure the security of your patient data. Please specify a convenient time for the call by contacting us at the phone number [Phone Number].\n\nBest regards,",Incident,Billing and Payments,high,de,400,Security,Account,IT,Tech Support,Training,Virus,,
,inquiring about methods to ensure the security of medical data in hospital systems. could you share specifics on the steps taken to safeguard sensitive information and guard against cyber threats? would be grateful for any information provided on this topic.,"will offer general information on security measures to protect medical data in hospital systems, such as encryption, firewalls, and access controls. would like to schedule a call at a convenient time to discuss these details further.",Request,Customer Service,medium,en,400,Security,IT,Tech Support,Feedback,,,,
Identification of Unavailable Medical Information Through Various Systems,"During standard procedures, it has been noted that medical information is not accessible. This could be due to recent software updates or changes in server configurations. After restarting the affected services and verifying user permissions, the access issues still remain. Please assist us in resolving this matter.","Dear [name], we acknowledge the receipt of your email regarding the issue of unavailable medical information across multiple systems. We are sorry to hear that the problem persists even after restarting the affected services and checking user permissions. We will investigate this matter further. Could you please provide us with the details of the recent software updates and server configuration changes made? Additionally, it would be helpful to know any specific error messages or symptoms that users are experiencing when trying to access the medical data.",Incident,Technical Support,low,en,400,Bug,Performance,Network,IT,Tech Support,,,
Concern About Hospital System Security Incident,"There was an unauthorized access incident that led to the compromise of sensitive medical data within the hospital system. This may have originated from a phishing attack targeting the staff. We have reset user passwords and updated malware protection, but access issues still persist.","Acknowledging the issue with the hospital system regarding the unauthorized access and data compromise. We will investigate and resolve the access issues. Please, let us know a convenient time to discuss this matter. We will gather necessary information and provide the necessary assistance to ensure the security of the system and data. Please, inform us of a suitable time to call at <tel_num>.",Incident,Customer Service,high,en,400,Security,Virus,IT,Tech Support,,,,
Problem with Financial Firm's Data Analytics Platform,The financial firm's data analytics platform is experiencing issues in analyzing investment data correctly. This problem might be due to incompatibility with a recent software update or new hardware. Steps taken such as restarting the system and reinstalling affected applications have not resolved the issue. We kindly request your assistance in resolving this issue as soon as possible.,"Acknowledging the issue with the data analytics platform and appreciating the troubleshooting steps already taken. We will investigate the matter further. Could you please provide details on the recent software update and any new hardware installed? Additionally, knowing the exact error messages and symptoms would be helpful. We would like to schedule a call to discuss the issue and determine the best course of action for resolution. Please let us know your availability for a call.",Incident,Technical Support,medium,en,400,Bug,Performance,Hardware,IT,Tech Support,,,
Anforderung für fortgeschrittene Berichtsfunktionen,"Ich möchte um eine Anfrage stellen, um fortgeschrittene Berichtsfunktionen für die Projektmanagement-Plattform zu integrieren. Diese verbesserten Analysefunktionen sollen die betroffenen Produkte ermöglichen, um informiertere Entscheidungen zu treffen und die Operationen zu optimieren. Derzeit sind die Berichtsfunktionen begrenzt und machen es schwierig, wichtige Leistungsindikatoren zu verfolgen und Bereiche zu identifizieren, die Verbesserungen benötigen. Die Einbindung von fortgeschrittener Berichtsfunktionen würde uns helfen, ein tieferes Verständnis unserer Produkte zu gewinnen und datenbasierte Entscheidungen zu treffen, die das Geschäfts- und Betriebswachstum fördern. Ich schätze, wenn Sie einen Zeitplan für die Implementierung dieser Funktionen bereitstellen könnten, wäre das sehr hilfreich.","Ich werde Ihre Anfrage zur Einbindung fortgeschrittener Berichtsfunktionen für die Projektmanagement-Plattform bearbeiten. Es ist wichtig, die Bedeutung fortschrittlicher Analysefunktionen für informierte Entscheidungsfindung und die Optimierung der Operationen zu verstehen. Die Entwicklungsteams werden die Vielseitigkeit der fortgeschrittener Berichtsfunktionen überprüfen und einen Zeitplan für die Implementierung bereitstellen. Um unsere Anforderungen noch besser zu verstehen, würden wir es schätzen, wenn Sie spezifische Informationen zu den gewünschten Berichtsfunktionen geben könnten, z.B. die Art der Analysefunktionen, die Sie benötigen, um wichtige Leistungsindikatoren zu verfolgen. Diese Informationen helfen uns, die Implementierung so anzupassen, dass sie Ihren Bedürfnissen gerecht wird. Wir werden Sie bald kontaktieren, um den Zeitplan für die Implementierung zu besprechen.",Change,Technical Support,low,de,400,Feature,Feedback,Performance,Documentation,,,,
