subject,body,answer,type,queue,priority,language,version,tag_1,tag_2,tag_3,tag_4,tag_5,tag_6,tag_7,tag_8
Benötigte Sicherheitsmaßnahmen und Unterstützung,"Sehr geehrter Kundenservice, ich möchte mich erkundigen, welche Schritte erforderlich sind, um die Einhaltung der Vorschriften zum Datenschutz bei der Nutzung von Avast Premium Security sicherzustellen. Könnten Sie bitte detaillierte Richtlinien bereitstellen, um persönliche Daten zu schützen und die aktuellen Sicherheitsstandards aufrechtzuerhalten? Ich freue mich auf bewährte Verfahren, die dabei helfen, Avast Premium Security optimal zu nutzen und Informationen sicher zu bewahren. Vielen Dank für Ihre Zeit und Unterstützung. Ich freue mich auf Ihre baldige Rückmeldung.","Sehr geehrter <name>, vielen Dank, dass Sie den Service-Desk kontaktiert haben. Um die Einhaltung der Datenschutzvorschriften bei Avast Premium Security zu gewährleisten, empfehlen wir, die Firewall- und Antivirenfunktionen zu aktivieren und die Software regelmäßig zu aktualisieren. Zudem sollten Sie starke Passwörter verwenden, vorsichtig mit E-Mail-Anhängen und Links sein, um persönliche Daten zu schützen. Für detailliertere Richtlinien und bewährte Verfahren können wir gerne einen Termin vereinbaren. Bitte teilen Sie uns eine passende Zeit mit, oder kontaktieren Sie uns unter <tel_num>. Wir helfen Ihnen gerne weiter.",Request,Billing and Payments,high,de,52,Security,Compliance,Data Privacy,Standard,Support,Guidance,,
Online Brand Development,Can you offer insights on how incorporating digital strategies through OBS Studio access tools can boost brand expansion?,"To assist you in leveraging digital strategies with OBS Studio access tools for brand growth, please share your current setup details.",Request,Customer Service,medium,en,52,Feature,Feedback,Brand,Strategy,Digital,,,
Guidance Required for Aruba Switch Integration,"I am attempting to integrate TensorFlow and Scikit-learn with an Aruba 2530 Switch for analytics purposes. Could you provide guidance on how to set up this integration? I would appreciate any documentation or tutorials that can assist me in getting started. Since this is a new type of integration for me, I want to ensure it is done correctly. Thank you for your support.","Hello, thank you for contacting us regarding the integration of TensorFlow and Scikit-learn with the Aruba 2530 Switch. We are happy to assist you through the process. To get started, I recommend reviewing the official Aruba documentation on switch integration available on our website. Additionally, I can outline some general steps and best practices for setting up the integration. If you'd like, we can also schedule a call at your convenience to discuss your specific requirements and address any questions you may have. Please let us know a suitable time for a call.",Request,Product Support,high,en,52,Product,Documentation,Feature,IT,Tech Support,,,
,"Sehr geehrter Kundendienst,<br><br>ich wende mich an Sie, um ein kritisches Problem zu melden, das die Abläufe unserer Organisation erheblich beeinträchtigt. Mehrere Produkte, darunter Figma, Moodle und das Smart-CPAP-Gerät, sind servicebedingt ausgefallen. Diese intermittierenden Ausfälle haben zu erheblichen Störungen in unserer Arbeit geführt.<br><br>Unsere erste Untersuchung deutet darauf hin, dass das Problem möglicherweise mit Fehlern in der IT-Infrastruktur oder einer potenziellen Sicherheitsverletzung zusammenhängt. Wir haben versucht, das Problem durch Systemneustarts und Netzwerkdiagnosen zu beheben, bisher haben diese Maßnahmen jedoch keine Lösung gebracht.<br><br>Wir befürchten, dass das Problem komplexer ist und detailliertere technische Informationen erfordert.","Sehr geehrter <name>,<br><br>ich antworte auf Ihre E-Mail bezüglich der Serviceausfälle, die die Abläufe unserer Organisation beeinträchtigen. Ich entschuldige mich für die verursachten Störungen und danke Ihnen für die bereitgestellten Details. Könnten Sie bitte genauere Informationen zu den Fehlermeldungen sowie den genauen Zeitpunkt der Ausfälle bereitstellen? Außerdem wäre es hilfreich, wenn Sie <tel_num> anrufen könnten, um das Problem im Detail zu besprechen und Anweisungen für die nächsten Schritte zur schnellen Behebung des Problems zu erhalten.",Incident,Service Outages and Maintenance,high,de,52,Outage,Disruption,Hardware,Service,Infrastructure,Investigation,,
Request for Assistance with Digital Marketing Service Inquiries,"Customer Support is reaching out to inquire about digital marketing services aimed at enhancing brand growth strategies. Could you provide detailed information on pricing and payment options for your services? We are interested in understanding how your company can assist us in reaching our marketing objectives. Specifically, we would like to know about the different packages available and what each includes. Additionally, we would appreciate details on any discounts or promotions you may be offering. Thank you, and we look forward to your response.",We offer a variety of digital marketing packages tailored to your needs. We will send a detailed brochure with pricing options. Please let us know a convenient time for a call to discuss further.,Request,Billing and Payments,high,en,52,Feedback,Sales,Lead,Customer Support,Marketing,,,
,"Sehr geehrter Kundendienst, ich bitte um ausführliche Integrationsrichtlinien für Oracle Database 19c mit Ruby on Rails 6.1, insbesondere im Hinblick auf Investment-Analysen. Könnten Sie bitte eine Schritt-für-Schritt-Anleitung für die Einrichtung der Integration bereitstellen, inklusive notwendiger Konfigurationsdateien, Tipps zur Fehlerbehebung bei Datenbankverbindungen und bewährte Praktiken? Über Empfehlungen zu geeigneten Gems oder Bibliotheken für die Integration sowie Hinweise auf potenzielle Fallstricke würde ich mich ebenfalls freuen. Ich würde eine Rückmeldung bezüglich einer erfolgreichen Integration der Investment-Analytics-Anwendung mit Oracle Database 19c und Ruby on Rails 6.1 sehr begrüßen.",Bitte senden Sie die detaillierten Integrationsrichtlinien und Empfehlungen per E-Mail oder Telefon zu.,Request,Technical Support,high,de,52,Product,Documentation,Support,Integration,Configuration,Troubleshooting,,
Concerns About Performance of Analytics Platform,"The analytics platform encountered unforeseen data delays, which might be related to server overload or errors in the data pipeline. Retry procedures and system checks were conducted but did not resolve the issue. The problem continues and assistance is required to address it. Could you please examine the matter and provide a solution, along with an estimated time for resolution? Your help in getting the analytics platform back to normal operation is greatly appreciated.",Received your email concerning the performance issue with the analytics platform. We will investigate the matter and contact you with a solution and an estimated time for resolution.,Incident,Technical Support,medium,en,52,Performance,Outage,Disruption,Recovery,System Check,,,
Untersuchung eines Datenlecks,"Sehr geehrter Kundenservice, ich möchte Sie darüber informieren, dass ein Gesundheitsdienstleister möglicherweise gegen datenschutzrechtliche Vorschriften verstoßen hat, was Patientendaten betrifft. Erste Ermittlungen deuten darauf hin, dass ein Phishing-Angriff auf eine Systemlücke die Ursache sein könnte. Sofort wurden Maßnahmen eingeleitet, erste Scans durchgeführt und Passwörter zurückgesetzt, um den möglichen Schaden zu begrenzen. Wir benötigen jedoch Ihre Unterstützung, um die Angelegenheit gründlich zu untersuchen, sicherzustellen, dass alle erforderlichen Maßnahmen getroffen werden, und um zukünftige Vorfälle zu verhindern. Bitte stellen Sie eine Anleitung oder Unterstützung bereit.","Vielen Dank für die schnelle Benachrichtigung über das potenzielle Datenleck. Das Sicherheitsteam wird die Angelegenheit weiter untersuchen und Sie bezüglich der nächsten Schritte beraten. Bitte senden Sie uns den Vorfallbericht sowie Details zu den bisher ergriffenen Maßnahmen. Kontaktieren Sie uns unter <tel_num>, um die nächsten Schritte zu besprechen und den besten Kurs zu bestimmen, um die Sicherheit der Patientendaten zu gewährleisten.",Incident,Technical Support,medium,de,52,Security,DataLeak,Investigation,SystemVulnerability,Privacy,PatientData,SecurityAudit,
Probleme beim Datenabruf mit Fehler,"Das Finanzunternehmen hat wiederkehrende Probleme beim Datenabruf in Cassandra 4.0 und SQL Server festgestellt, die die Analyse-Workflows beeinträchtigen. Mögliche Ursachen könnten Datenbeschädigungen oder Verbindungsprobleme sein. Erste Maßnahmen zur Fehlerbehebung umfassten das Neustarten der Datenbankdienste sowie die Überprüfung der Netzwerkstabilität, wodurch eine Lösung erreicht wurde. Das Team untersucht derzeit alternative Ansätze, beispielsweise die Überprüfung von Software-Updates und die Durchsicht der Systemprotokolle auf Fehlermeldungen. Sollte das Problem weiterhin bestehen, könnten weitere Schritte erforderlich sein, darunter Datenvalidierung und Netzwerkpaketanalyse. Wir halten Sie über die Fortschritte auf dem Laufenden.","Wir haben eine E-Mail bezüglich des Datenabruffehlers in Cassandra 4.0 und SQL Server erhalten, der die Analyse-Workflows des Finanzunternehmens beeinträchtigt. Ich verstehe, dass bereits erste Fehlerbehebungsmaßnahmen durchgeführt wurden und eine Lösung erzielt wurde. Um weiterzuhelfen, benötigen wir bitte zusätzliche Informationen, z.B. genaue Fehlermeldungen und relevante Details aus den Systemprotokollen, die auf mögliche Datenbeschädigungen oder Verbindungsprobleme hinweisen. Falls notwendig, können wir einen Anruf vereinbaren, um das Problem direkt zu besprechen und mögliche Lösungen zu erkunden. Bitte teilen Sie uns diese Informationen mit.",Incident,IT Support,medium,de,52,Bug,Network,Performance,Disruption,Recovery,Maintenance,,
gesundheitswissenschaftliche Dienstleister kürzlich möglichen Datensicherheitsverstoß online erfahren,gesundheitswissenschaftliche Dienstleister erlebt einen möglichen Datensicherheitsverstoß. Erste Schritte umfassten Systemprüfungen.,"nehmen Datensicherheitsverstöße ernst, untersuchen den Fall. Weitere Maßnahmen unternommen, um Systeme sicherer zu gestalten und Kunden zu schützen. Fortschritte werden informierend übermittelt.",Problem,Customer Service,high,de,52,Security,Outage,Disruption,Recovery,,,,
Unterstützung bei Skalierbarkeitsoptionen,"Sehr geehrter Kundenservice, ich möchte mich nach den Skalierbarkeitsmöglichkeiten und bewährten Bereitstellungspraktiken für eine SaaS-Lösung erkundigen. Könnten Sie bitte detaillierte Informationen bereitstellen, wie die Plattform bei erhöhtem Traffic und groß angelegten Deployments vorgeht? Welche bewährten Methoden empfehlen Sie, um eine nahtlose Integration und optimale Leistung zu gewährleisten? Ich würde eine Anleitung oder Empfehlungen schätzen, um eine effektive Bereitstellung und Verwaltung der SaaS-Lösung sicherzustellen. Zusätzlich interessiere ich mich für die Support-Services, die Sie im Falle von Problemen oder Anliegen anbieten. Ich freue mich auf Ihre Unterstützung.","Sehr geehrter <Name>, ich möchte Ihnen bezüglich der Skalierbarkeitsoptionen und Unterstützung für Ihre SaaS-Lösung antworten. Unsere Plattform ist so konzipiert, dass sie bei erhöhtem Traffic und groß angelegten Deployments automatische Skalierung und Lastverteilung ermöglicht. Für eine nahtlose Integration und optimale Leistung empfehlen wir, den Leitfaden mit bewährten Bereitstellungspraktiken auf unserer Website zu prüfen. Wir bieten eine Vielzahl von Support-Services an, darunter E-Mail-, Telefon- und Online-Chat-Support. Bei Problemen oder Anliegen steht Ihnen unser engagiertes Support-Team für schnelle Unterstützung zur Verfügung.",Request,Product Support,low,de,52,Performance,Scalability,Deployment,Integration,Platform,,,
,"The agency's online advertising efforts are not meeting expectations, potentially due to outdated audience targeting. Updating the content and increasing the advertising budget has produced the desired outcomes. I would appreciate guidance on how to refine targeting methods to boost campaign effectiveness.",Please review the digital campaigns and offer advice on optimizing targeting techniques to improve overall performance. Kindly specify a suitable time for us to discuss the details further.,Problem,Product Support,high,en,52,Performance,Outage,Disruption,Feedback,Campaign,Effectiveness,,
Problem mit Marketingkampagne,"Die digitale Marketingkampagne der Agentur zeigte eine niedrige Beteiligung, was eventuell auf eine falsche Zielgruppenansprache zurückzuführen ist. Es wurden mehrere Anzeigen getestet, doch nur geringe Verbesserungen wurden erzielt.","Sehr geehrte/r <name>, vielen Dank, dass Sie uns darauf aufmerksam gemacht haben. Die geringe Beteiligung an den digitalen Kampagnen ist bedenklich, und wir möchten eine Lösung für dieses Problem finden. Es ist möglich, dass die Zielgruppe nicht optimal auf die Marke abgestimmt ist. Gerne würden wir die Verbesserungsmöglichkeiten für die Kampagnenleistung gemeinsam mit Ihnen besprechen. Könnten Sie bitte weitere Informationen zu den getesteten Zielgruppen und Anzeigen bereitstellen? Wir würden auch einen Anruf zu einem passenden Zeitpunkt vereinbaren, um mögliche Lösungen zu erörtern. Bitte teilen Sie uns eine geeignete Zeit mit, <tel_num>.",Problem,Sales and Pre-Sales,low,de,52,Marketing,Campaign,Digital Marketing,Target Audience,Performance,Improvement,,
Issue Detected in Data Analytics Platform,"The company's data analytics platform experiences sporadic delays in processing investment optimization computations, potentially due to recent software updates. Restarting the system and clearing caches temporarily resolved the problem. Assistance is needed to permanently resolve this issue promptly.","We are investigating the intermittent delays in processing investment optimization calculations on the data analytics platform. To troubleshoot effectively, please provide details of recent software updates and any specific error messages encountered. If necessary, we can arrange a call at a convenient time to discuss the problem and work toward a solution. Kindly inform us of a suitable time to contact <tel_num> regarding account <acc_num>.",Problem,Technical Support,medium,en,52,Performance,Outage,Disruption,Software Update,Cache,Data Analytics,System Issue,
Mehrere Schwierigkeiten bei der Produktintegration,"Die Marketingagentur hat mehrere Fehler bei der Produktintegration festgestellt, möglicherweise verursacht durch Softwarekonflikte. Es wurde versucht, die Systeme neu zu starten und die Treiber zu aktualisieren, jedoch blieb das Problem bestehen. Wir schätzen eine Anleitung zur Unterstützung, um das Problem zu beheben. Bitte informieren Sie uns, falls weitere Informationen benötigt werden, damit wir die Angelegenheit weiter untersuchen können.","Untersuchung der Produktintegrationsprobleme. Bitte stellen Sie eine Liste der verwendeten Softwaresysteme bereit. Wir werden uns so bald wie möglich melden, um weitere Details zu besprechen.",Incident,Technical Support,high,de,52,Bug,Performance,Disruption,Support,Software,System,,
Cybersecurity Breach in Hospital System,"Customer Support,<br><br>I am writing to notify you that the hospital's cybersecurity system has been compromised, which has potentially exposed patient data. Preliminary investigations indicate that the breach was probably due to outdated security patches that were not updated promptly.<br><br>Our team has taken immediate measures to contain the situation, including reconnecting affected devices and resetting passwords. Nevertheless, we are concerned about the possible repercussions of this breach and are seeking assistance to conduct a comprehensive investigation and provide guidance.","We take cybersecurity breaches at hospitals very seriously and are prepared to assist. To investigate further, please send us the incident report along with details of the affected systems. We can then schedule a call with our security team to discuss the next steps and offer guidance on how to prevent similar incidents in the future at your earliest convenience.",Incident,Technical Support,high,en,52,Security,Outage,Disruption,Recovery,IT,Tech Support,,
Detected Issues with Data Analytics Platform,Experiencing intermittent connectivity problems with the platform.,We apologize for the inconvenience and our team will investigate the intermittent connectivity issues immediately.,Incident,Billing and Payments,medium,en,52,Network,Disruption,Outage,,,,,
Assistance Needed for Data Integration Issue Impacting Investment Analytics,"A financial company's customer support team is facing data integration errors that are disrupting investment analytics. The problem may have been caused by incompatible software updates. Despite rebooting the systems and applying patches, the issue remains unresolved. The firm urgently requires support to fix the problem and avoid further disruptions to their investment analysis processes. Please investigate the matter and suggest a solution as soon as possible.","We are currently examining the data integration errors that are affecting investment analytics. To resolve the issue, we need details about the software updates and patches that have been applied. Could you please provide information regarding the recent updates and patches installed? We would also like to schedule a call at your convenience to discuss the solution and prevent future disruptions. Kindly let us know a suitable time to call at <tel_num> regarding account <acc_num>.",Incident,Product Support,low,en,52,Bug,Disruption,Maintenance,Data Integration,Analytics,Software Update,,
Network Connection Problem,"The organization is facing connectivity disruptions with Cisco Webex Meetings due to WLAN router issues, potentially caused by network congestion. Actions taken include restarting the router, verifying connections, and updating the software. Despite these efforts, problems persist. We seek guidance on the next steps to resolve this matter and restore proper network function. Kindly inform us if further information is required.","Please review the issue and provide your account number. When convenient, call <tel_num> to discuss and assist in resolving the network connectivity problem.",Problem,IT Support,medium,en,52,Network,Disruption,Hardware,Performance,IT,,,
Investigation into Data Security Breach,"Customer Support, reporting to healthcare provider that there may have been a data security incident affecting patient information. Preliminary checks indicate a possible phishing attack exploiting system vulnerabilities. Immediate steps have been taken, including running initial scans and resetting passwords, to reduce potential harm. Nevertheless, we need assistance to thoroughly investigate the issue and ensure that appropriate measures are implemented to prevent future occurrences. Your guidance and support in this matter would be highly valued.",We would appreciate being promptly informed of any suspected data security breaches. Please escalate this issue to the security team for further investigation and guidance. Kindly share the incident report details and the measures already implemented. Contact <tel_num> to discuss subsequent steps and determine the best course of action to safeguard patient records.,Incident,Technical Support,medium,en,52,Security,Data Breach,Phishing,Vulnerability,Investigation,,,
Concern About Marketing Campaign,"The digital marketing campaign resulted in inconsistent brand messaging across various platforms. There might be potential issues with team coordination. Several internal strategy adjustments and reviews have been attempted to resolve the problem, but it continues. Assistance is needed to identify the root cause and implement a solution to ensure consistent brand messaging.",Review the digital marketing campaign and contact us to discuss steps to resolve the issue.,Problem,Technical Support,low,en,52,Marketing,Campaign,Brand,Coordination,Strategy,Review,Issue,
