subject,body,answer,type,queue,priority,language,version,tag_1,tag_2,tag_3,tag_4,tag_5,tag_6,tag_7,tag_8
Request for Assistance with Marketing Agency's Digital Campaign Analytics Dashboard,"Hello Customer Support, I am encountering an issue with the marketing agency's digital campaign analytics dashboard. The dashboard is currently inaccessible, and I suspect it might be related to recent server maintenance. I have already tried clearing my cache and using different browsers, but unfortunately, my efforts have been unsuccessful. Could you please assist me in resolving this matter as soon as possible? I appreciate your prompt attention to this issue and look forward to hearing from you soon. Thank you for your support.","Dear [name], thank you for reaching out to us regarding the issue with the digital campaign analytics dashboard. We apologize for any inconvenience this may have caused. We would like to investigate further, and could you please provide us with the exact error message you are seeing? We will contact you soon to resolve the issue. Thank you.",Incident,Technical Support,high,en,400,Bug,Performance,Maintenance,IT,Tech Support,,,
,A data security breach has been identified impacting the healthcare provider's systems. Potential reasons for this could be the use of outdated software and the absence of adequate security protocols.,"Acknowledging the detection of a data security breach affecting the healthcare provider's systems. Please escalate this issue to the incident response team for further investigation and support. Additional information about the system configuration and security measures may be necessary. If convenient, a call can be arranged to discuss and determine the next steps to address the issue and prevent future breaches.",Incident,Returns and Exchanges,low,en,400,Security,Bug,IT,Tech Support,,,,
Incident of Data Leakage in Hospital IT Networks,An unforeseen data leak has resulted in the exposure of medical records.,We are promptly addressing the situation by containing the breach and safeguarding the medical data. An investigation has been initiated.,Incident,Technical Support,medium,en,400,Security,Incident,Network,Performance,Recovery,,,
,"Customer Support, compiling a report on a potential security breach in the hospital's systems. An unauthorized access attempt has been detected, which may have compromised medical data security. This could be due to inadequate access controls and outdated software vulnerabilities. Initial steps have been taken to update firewalls and conduct security scans. However, we require further investigation and remediation to ensure the security systems are secure. We would appreciate prompt assistance to prevent potential breaches and protect the data.",Please investigate the security breach and contact us at <tel_num> to discuss the next steps. We can schedule a call to resolve the issue promptly.,Incident,Product Support,high,en,400,Security,IT,Tech Support,Bug,,,,
Issues Encountered Following KNIME Update,"A recent update to KNIME has resulted in errors during data analytics and investment optimization tasks. These errors might be due to compatibility issues. Despite reverting to the previous version and clearing caches, the errors still persist. Assistance in resolving this issue would be greatly appreciated.",We will assist in addressing the KNIME update errors and investigate potential compatibility issues. Please provide detailed information about the errors you are experiencing. We can schedule a call to troubleshoot the issue at your convenience and discuss further.,Incident,Technical Support,high,en,400,Bug,Performance,IT,Tech Support,,,,
Assistance with Campaign Interruption,"Our digital marketing campaign unexpectedly ceased, affecting our brand growth plans. Despite restarting the affected applications and confirming internet connectivity, the issue still persists. Could you please investigate and provide a solution as soon as possible?",We will investigate the campaign interruption and determine the cause of the server outage to provide a solution as soon as possible. Please allow us to contact <tel_num> for a discussion to resolve the issue promptly.,Incident,Technical Support,high,en,400,Network,Performance,Disruption,IT,Tech Support,,,
Detection of Unauthorized Access Attempts,"Customer Support is preparing a report on a security incident involving unauthorized access attempts to hospital systems. The attempted breach may have been facilitated by phishing emails targeting staff, which could potentially compromise the security of medical data. A thorough security review has been initiated, and firewall settings have been updated to prevent further intrusions. However, the threat still persists, and immediate assistance is required to resolve the issue. I would appreciate guidance on how to enhance security measures to prevent similar incidents in the future.",We will promptly review the case and provide guidance on enhancing security measures. Please allow us to schedule a call at <tel_num> to discuss and determine the next steps to resolve the issue and prevent future incidents.,Incident,Technical Support,medium,en,400,Security,Network,IT,Tech Support,Alert,,,
Autorisierter Zugriff Versuch auf KI-Systeme des Krankenhauses wurde detektiert,"Es wurde ein autorisierter Zugriffsbereich auf die KI-Systeme des Krankenhauses detektiert. Das IT-Team hat die Firewall-Einstellungen aktualisiert und eine System-Sicherheitsprüfung durchgeführt. Das Ereignis scheint auf veraltete Sicherheitsprotokolle und verlorene Benutzerkredenziale zurückzuführen sein. Das Team arbeitet daran, das Problem zu lösen und zukünftige Ereignisse zu verhindern.","Wir bedanken uns für die prompte Maßnahme, die vom IT-Team eingeleitet wurde, um den autorisierten Zugriffsbereich auf die KI-Systeme des Krankenhauses zu behandeln. Bitte teilen Sie uns mehr Informationen zu den veralteten Sicherheitsprotokollen und den verlorenen Benutzerkredenzialen mit, da sie möglicherweise zum Problem beigetragen haben. Wir möchten einen weiteren Gesprächstermin vereinbaren, um das Thema zu besprechen. Können wir kurz in Kontakt treten, um einen Termin zu vereinbaren, der Ihnen am besten passt?",Incident,Product Support,low,de,400,Security,IT,Tech Support,Notification,,,,
Enhancing Investment Techniques Through Data Analysis,Could you offer insights on optimizing investment strategies using data analytics within QuickBooks Online? Your prompt assistance is greatly appreciated.,"Hello [name], thank you for reaching out to us about optimizing investment strategies using data analytics within QuickBooks Online. We can certainly provide guidance on this topic. QuickBooks Online offers various tools and features that can help you make data-driven decisions to optimize your investment strategies. Utilize the reporting features to analyze financial data, track expenses and income, and identify trends and patterns. Additionally, the budgeting and forecasting tools can help you create predictive models for better financial planning.",Request,Technical Support,medium,en,400,Feature,Feedback,Documentation,Tech Support,,,,
Customer Support Request for Security Audit,"A healthcare provider has reported unauthorized access to medical data within their system. This may have occurred due to inadequate security measures. Despite implementing patches and updating passwords, vulnerabilities still exist. We are requesting assistance in conducting a thorough security audit to provide recommendations for strengthening the system's security. Please let us know the necessary steps and any additional information we need. We appreciate prompt attention to this matter and look forward to your response.",Acknowledging your request for a security audit related to the unauthorized access of medical data within the system. We will proceed with this request and need information on the vulnerabilities you are experiencing and the patches that have been implemented. Could you please provide a detailed description of the issue and the security measures that have already been taken? We would like to schedule a call at a convenient time to discuss and determine the course of action to strengthen the system's security.,Problem,Product Support,medium,en,400,Security,IT,Tech Support,Performance,Feedback,,,
Seeking Marketing Assistance,"Our marketing firm is observing a notable decrease in brand engagement metrics. This decline might be attributed to recent algorithm modifications on social media platforms. Efforts to enhance engagement, such as increasing ad expenditure and optimizing content, have not yielded satisfactory results. We are reaching out for guidance to improve our online presence and boost engagement. Could you provide us with recommendations and strategies to help us overcome this challenge?","I would be glad to assist. Please provide details on your current marketing strategies and engagement metrics. Upon review, I can provide recommendations to improve your online presence and increase engagement.",Incident,Customer Service,medium,en,400,Feedback,Sales,Marketing,,,,,
,"Es gibt derzeit eine Rechnungsstellungsproblematik mit Smart-Tracker und Memrise, die auf unrichtige Änderungen der Rechnungszeiträume zurückgeführt werden könnte. Die Zahlungsgeschichte wurde bereits durchgesehen und die Abonnement-Einstellungen überprüft. Wir benötigen jedoch zusätzliche Unterstützung, um das Problem zu lösen.","Ich würde mich gerne um Ihre Rechnungsstellungsprobleme mit Smart-Tracker und Memrise kümmern. Um die Situation besser zu verstehen, bitte mehr Details zum festgestellten Unrecht und Änderungen der Rechnungszeiträume geben. Zudem können wir die Konto-Einstellungen überprüfen. Könnten Sie bitte bestätigen, dass Ihre Konto-Nummer <acc_num> ist? Falls nötig, können wir telefonisch in Verbindung treten. Wir setzen uns bald mit Ihnen in Verbindung, um das Problem zu lösen.",Problem,Billing and Payments,medium,de,400,Billing,Payment,Refund,Account,Tech Support,,,
Inquiry for Codecademy SaaS Integration Documentation,"Hello Customer Support, I am writing to request detailed documentation for integrating Codecademy SaaS into our project management system. Could you provide step-by-step instructions for the integration process? Additionally, I would greatly appreciate any extra resources or troubleshooting tips you could offer. I am looking forward to your response and hope to successfully integrate Codecademy SaaS into our workflow. Thank you for your time and assistance. I am excited to explore the benefits this integration could bring to our project management.","We appreciate your interest in integrating Codecademy SaaS into your project management system and are happy to assist you with your request. To provide accurate and helpful information, could you please share your current setup and what you are trying to achieve with the integration? The integration with Codecademy allows for a seamless connection between two platforms, enabling you to track progress and manage projects more efficiently. We will provide you with a step-by-step guide for the integration process, along with additional resources and troubleshooting tips to ensure a smooth experience.",Request,Technical Support,high,en,400,Documentation,Feedback,IT,Tech Support,,,,
Reported Problem with Website Crash,The website crash has severely impacted the campaign launch.,We are addressing the issue of the website crash affecting the major campaign launch. Please share the error message you received and call <tel_num> for further discussion.,Problem,IT Support,high,en,400,Crash,Outage,Performance,IT,Tech Support,,,
Query on Healthcare Data Security Solutions and Hospital IT Services,Interested in detailed information about healthcare data security solutions and hospital IT services. Could we provide more extensive details and offerings?,"Dear <name>, thank you for your interest in healthcare data security solutions and hospital IT services. We offer a wide range of solutions designed to protect confidential health information. We would be delighted to share more about our services. Please let us know if you would like to learn more about specific aspects of our solutions. We can call at your chosen time to further discuss. Please provide a suitable time for a call at <tel_num>.",Request,Product Support,high,de,400,Security,Documentation,IT,Tech Support,,,,
Issue with Account Access,"You reported problems accessing your account, including viewing invoices and making payments. Despite clearing the browser cache and attempting to retrieve your password, the issue persists. We look forward to assisting you in resolving this problem. Please provide a detailed description of the error message you receive, as this will help us open your account. Your cooperation in providing this information will greatly assist in analyzing the issue and finding a solution. If needed, please contact us directly for a detailed examination of your account to resolve the problem. Should you be available for a call, please provide your account number <acc_num>.","Dear <name>, thank you for bringing the issue of accessing your account, including invoices and payments, to our attention. We regret to inform you that we are still encountering difficulties despite your efforts to retrieve your password and clear your browser cache. Please assist us by providing a detailed description of the error message you receive, as this will help us open your account. Your cooperation in providing this information will greatly assist in analyzing the issue and finding a solution. If further assistance is needed, please contact us directly to examine your account and resolve the problem. Should you be available for a call, please provide your account number <acc_num>.",Problem,Billing and Payments,medium,de,400,Account,Login,Payment,IT,Tech Support,,,
Antrag auf hohe Priorität für Umstellung,Bitte Kompatibilität und Integrationsfunktionen betreffender Software- und Hardwareprodukte zu verbessern und das Gesamtleistungsniveau für das Benutzererlebnis zu optimieren.,"Antrag auf Umstellung mit hoher Priorität angenommen, Kompatibilität und Integrationsfunktionen betreffender Produkte werden verbessert.",Change,Returns and Exchanges,high,de,400,Bug,Performance,Product,Feature,IT,Tech Support,,
Support for Data Analysis Tool,The data analysis tool is performing below average. We suspect software errors and data discrepancies.,"Dear [Name],\n\nI am writing in response to your email regarding the performance issues with the data analysis tool. I would like to offer support to address these issues and resolve any potential software errors or data discrepancies. We take your concerns seriously and would like to investigate the matter further.\n\nTo better understand the issues, could you please provide more details on the symptoms you have observed, any error messages you have received, and the specific version of the software you are using? Additionally, it would be helpful if you could share when the errors first occurred. If convenient, we suggest scheduling a telephone meeting at [phone number] to discuss this further.\n\nBest regards,\n[Your Name]",Problem,Customer Service,medium,de,400,Bug,Performance,IT,Tech Support,,,,
Secure Medical Data in Salesforce,"Inquiring about securing medical data in Salesforce CRM, specifically its integration with Norton 360. Looking for guidance on best practices for implementing this integration to ensure the confidentiality and integrity of sensitive medical information. Would appreciate any recommendations or resources that could help get started.","Hello, thank you for reaching out to us regarding the integration of securing medical data in Salesforce CRM with Norton 360. To ensure the confidentiality and integrity of sensitive medical information, we recommend implementing encryption and access controls. Our team can provide guidance on best practices for this integration. For your convenience, let's schedule a call to discuss further. Please let us know a suitable time for the discussion. The resources available on our website outline security measures for protecting medical information.",Request,IT Support,high,en,400,Security,Documentation,Feedback,IT,,,,
Verstoß gegen Datensicherheitsrichtlinien,"Es wurde ein Verstoß gegen Datensicherheitsrichtlinien festgestellt, der medizinische Akten beeinträchtigt hat.","Sehr geehrte/r [Name],\nwir nehmen den gemeldeten Verstoß gegen Datensicherheitsrichtlinien sehr ernst und werden sofortige Maßnahmen unternehmen, um betroffenen medizinischen Akten eine zusätzliche Schutzschicht zukommen zu lassen. Für eine detaillierte Untersuchung und die notwendigen Maßnahmen, um zukünftige Verstöße zu verhindern, benötigen wir zusätzliche Informationen zum Vorfall. Wenn zur Verfügung stehende Informationen vorliegen, wäre es hilfreich, einen Telefontermin zu vereinbaren, um die Angelegenheit genauer zu besprechen. Ich freue mich, sinnvolle Zeitfenster für den Anruf anzubieten.",Incident,Technical Support,high,de,400,Security,Compliance,Feedback,,,,,
Inquiry About Digital Strategies and Services,"Could you provide more details on the digital strategies, services available, and how they can aid in brand growth? I am particularly interested in learning more about the services you offer to help businesses grow.","Thank you for your interest in our digital strategies and services that can aid in brand growth. Our company offers a range of services, including social media management, content creation, and search engine optimization, all designed to help businesses expand their online presence and reach their target audience. We provide customized digital marketing plans tailored to meet the specific needs of each client. If you would like to learn more about our services and how they can help your business grow, we would be happy to assist you.",Request,Returns and Exchanges,medium,en,400,Feedback,Sales,Lead,Product,Feature,,,
Project Management Application Issue,"The project management application is encountering sporadic downtime as a result of increased user load. Efforts to scale server resources and optimize the database have been made, but the issues continue.",Please review the issue and contact assistance for possible solutions.,Problem,Technical Support,high,en,400,Bug,Performance,Outage,Network,IT,Tech Support,,
Bericht über den Absturz,"Das finanzielle Analyse-Dashboard wurde unerwartet mit einer Gipfelerhöhung gestoppt. Versucht habe, den Server neu zu starten und die Abfragen zu optimieren, was erfolgreich war. Bitte helfen Sie uns, das Problem zu beheben, um zukünftige Stürze zu vermeiden und Unterbrechungen zu minimieren.","Ich werde den Crashbericht für das finanzielle Analyse-Dashboard untersuchen. Um Ihnen besser zu helfen, bitte geben Sie mehr Details zu den Fehlermeldungen und den genauen Schritten, die Sie bereits unternommen haben. Es ist notwendig, dass wir telefonisch Kontakt aufnehmen, um mögliche Lösungen zu besprechen. Teilen Sie bitte geeignetes Zeitfenster für den Anruf mit, sobald Sie verfügbar sind.",Incident,Product Support,medium,de,400,Crash,Performance,Outage,Recovery,IT,Tech Support,,
Betreff: Markenentwicklung stellt aktuell Herausforderungen dar,"Sehr geehrte Kundenservice,\n\naktuell stellen Markenentwicklungsprozesse einige Schwierigkeiten dar. Trotz der Umsetzung digitaler Strategien sind die Ergebnisse unzufriedenstellend. E-Mail-Kampagnen wurden optimiert, Social-Media-Strategien überarbeitet, jedoch stagniert das Wachstum. Ungeeignete Werkzeuge und unzureichende Ziele könnten mögliche Ursachen sein. Nach der Analyse von Leistungsdaten bleibt jedoch keine Lösung in Sicht. Unterstützung wird benötigt, um die Grundursache zu identifizieren und effektive Strategien für das Wachstum umzusetzen.","Wir werden uns die Marketingstrategien genauer ansehen und Ihnen dabei helfen, eine effektive Lösung zu finden.",Incident,Sales and Pre-Sales,low,de,400,Feedback,Performance,Product,Feature,,,,
Enhancing Security Protocols for Medical Data in Hospital Settings,Is it possible to offer guidance on practices for securing medical data?,"I can provide general information on securing medical data, including encryption and access controls. For more specific guidance, please provide details on the hospital's current security measures and the type of data that needs to be secured.",Request,Product Support,medium,en,400,Security,Medical,Documentation,Feedback,IT,,,
Hospital Infrastructure Security Breach,"A security breach has been detected in the hospital's infrastructure, which is compromising the integrity of medical data. Despite updates to the software and enhancements to the firewall protections, the issues continue.","Name acknowledges the security breach in the hospital's infrastructure and expresses concern over the compromised medical data integrity. To better assist you, could you provide details about the breach and the steps that have been taken so far? We would like to schedule a call at your convenience to discuss this further. Please let us know a suitable time for the call at the provided telephone number: <tel_num>. Alternatively, you can contact us directly at <acc_num> to expedite the resolution process.",Incident,Product Support,medium,en,400,Security,IT,Tech Support,Maintenance,,,,
Problem with MongoDB Synchronization,"The investment optimization process has been disrupted due to synchronization issues with MongoDB 4.4, specifically with recent updates in Zoho CRM, which may be due to compatibility conflicts or data conversion errors. Steps taken include resetting connections and verifying configurations, but these efforts have been unsuccessful. Assistance is needed to resolve this issue.","I am looking into the MongoDB synchronization issue affecting Zoho CRM. To better assist you, could you please provide details on the recent updates and any error messages encountered? A call at your earliest convenience would be helpful for us to work together towards a resolution.",Incident,Customer Service,medium,en,400,Bug,Performance,Network,IT,Tech Support,,,
Problem mit dem Geräte-Synchronisierungsprozess,"Sehr geehrte Kundenservice, ich melden Fehler in der Projektmanagement-Software-as-a-Service. Die Anwendung synchronisiert mehrere Geräte, einschließlich iOS und PC. Trotz der neuen Software-Updates besteht der Fehler weiterhin. Ich habe versucht, den Cache zu löschen und die App neu zu installieren, aber das Problem ist nicht behoben. Ich glaube, dass Serverbelastung und Kompatibilitätsprobleme nach den neuesten Software-Updates die Ursache sein könnten. Ich schätze, Sie könnten schnell eine Lösung bereithalten. Vielen Dank für Ihre Unterstützung.","Sehr geehrte [name], entschuldigen Sie bitte die Fehler. Die Geräte-Synchronisierung im Projektmanagementsystem Software-as-a-Service haben Probleme. Um den Ursprung des Problems zu ermitteln, könnten Sie bitte eine detaillierte Beschreibung der Fehlermeldungen mit der Nummer <acc_num> bereitstellen. Sie können auch den Nummer <tel_num> anrufen, um die Lösung des Problems schnell zu besprechen. ",Problem,IT Support,high,de,400,Bug,Performance,Network,IT,Tech Support,,,
Avid Pro Tools SaaS Integration Inquiry,"Seeking guidance on integrating Avid Pro Tools SaaS with our project management solution. Could you provide details on the process, specific requirements, and any compatibility issues we should be aware of? Additionally, are there any tutorials or guides available to help walk us through the integration process? I am keen to learn more about the solution to help streamline our workflow and improve team collaboration. Please let me know about any resources or support available to assist with the integration.","We appreciate your interest in integrating Avid Pro Tools SaaS into your project management solution. To start the integration process, please ensure that you have the latest version of the Pro Tools solution installed. A step-by-step guide is available on our website, which outlines the requirements and considerations for compatibility. We also offer tutorials and support resources to assist with the integration. If you have specific questions or need additional assistance, please let us know and we will be happy to help. Alternatively, we can schedule a call at your convenience. Contact number: <tel_num>",Request,Technical Support,high,en,400,Feature,Documentation,IT,Tech Support,,,,
Please update billing details,"I am writing to request an update to my billing details, as allowing more flexible payment plan options would greatly benefit our customers and enhance their overall experience. At present, the payment plan options are limited and inflexible, which can be a hindrance to users. I would greatly appreciate it if these updates could be made as soon as possible. Thank you for your time and consideration.","We appreciate your email regarding the request to update your billing details and the desire to allow more flexible payment plan options for users. We understand that the current payment plan options may be limited and inflexible, which can be a hindrance to users. We will forward your request to the billing team for review and consider implementing more flexible payment plan options. To better understand your specific requirements, we would like to request additional information regarding the type of payment plan options you are seeking.",Change,Billing and Payments,medium,en,400,Billing,Payment,Feedback,Account,,,,
