subject,body,answer,type,queue,priority,language,version,tag_1,tag_2,tag_3,tag_4,tag_5,tag_6,tag_7,tag_8
Secure Medical Data Procedures,Is it possible to supply guidelines for securing medical data with Oracle Database 19c in a hospital IT environment? Thank you.,"Please provide guidelines for securing medical data using Oracle Database 19c. For your convenience, we can discuss this further.",Request,Customer Service,medium,en,400,Security,Documentation,IT,,,,,
Enhancing Security for Medical Data Solutions,Seeking advice on securing medical data for hospital solutions. Could you provide information on security measures that can be implemented to protect sensitive patient information? I would greatly appreciate any guidance or resources you can provide to ensure the confidentiality and integrity of medical data. Thank you for your assistance.,"Dear [Name],\n\nWe appreciate your concern regarding the security of medical data in hospital solutions. Ensuring the protection of sensitive patient information is our top priority. We have implemented robust security measures such as encryption, firewalls, and access controls to ensure confidentiality and integrity of the medical data. We also comply with relevant regulations such as HIPAA. For detailed information, please review our security whitepaper. We can schedule a call to discuss this further at your convenience and address any specific needs you may have. We are available to discuss at a time that is convenient for you.",Request,Billing and Payments,medium,en,400,Security,Documentation,Feedback,,,,,
Support for Integrating Project Management Tools,"Request to integrate project management tools with our current products to significantly boost functionality and user experience. The aim is to streamline workflows, enhance collaboration, and boost productivity. I believe this integration would be highly beneficial for our customers and would like to discuss it further. Please let me know if we can explore this opportunity. I look forward to hearing from you.",I would be happy to discuss the integration of project management tools with our existing products. Please provide more details on the specific tools you are interested in. Let's schedule a call at your earliest convenience to explore this further.,Change,Customer Service,low,en,400,Feedback,Feature,Documentation,IT,Tech Support,,,
Inquiry on Digital Strategies for Dell UltraSharp U2720Q,"Seeking detailed information on digital strategies products, specifically Dell UltraSharp U2720Q. Looking to learn about a marketing plan to promote the product. Would greatly appreciate the provided information on this topic.",Will provide information on digital strategies for Dell UltraSharp U2720Q. Please allow for a convenient call to discuss.,Request,Returns and Exchanges,high,en,400,Product,Feature,Feedback,Sales,,,,
Advice on Securing Medical Data with Drupal Commerce and Salesforce CRM,"Hello Customer Support, I am seeking guidance on securing medical data when integrating Drupal Commerce with Salesforce CRM. Medical data is highly sensitive and requires careful handling and storage. Could you provide some best practices for integrating these systems to ensure the security and integrity of the medical data? Additionally, any recommendations or resources that could assist in achieving this would be greatly appreciated. Thank you for your help.",Thank you for your request. We will be happy to provide guidance on securing medical data with Drupal Commerce and Salesforce CRM. Please allow us to call at a convenient time to discuss best practices and recommendations for integrating these systems securely.,Request,Service Outages and Maintenance,high,en,400,Security,IT,Tech Support,Documentation,,,,
Performance Fluctuations in SaaS Platform,"While using the project management unit, performance issues are encountered.","Dear Support, thank you for bringing this to our attention. We regret any inconvenience caused by the performance problems on the SaaS platform, particularly in the project management unit. To better assist you, could you please provide more details about the performance fluctuations, such as when the issues started and any error messages received? This will help us in examining the problem more closely. If needed, we can arrange a telephone conference to discuss the issue in more detail. Please provide a convenient time to call at <tel_num> for a follow-up discussion via email.",Problem,IT Support,high,de,400,Performance,IT,Tech Support,,,,,
Assistance with Engagement Issues,"Noticed a decline in brand engagement across digital platforms recently. This might be due to shifts in market trends. Although efforts have been made to adjust the content strategy and increase social media advertising, there hasn't been a significant improvement. The team is seeking guidance to effectively adjust the strategy to better align with current market trends and improve the brand's online presence. We believe that with the right support, we can develop a plan to increase engagement and drive business growth.","Acknowledging the drop in brand engagement across digital channels. Understanding that attempts to adjust the content strategy and boost social media ads have not yielded significant improvement. To better assist you, I would like to schedule a call to discuss your current strategy and goals in detail. I am available to discuss potential solutions and develop a plan to increase engagement and drive business growth for your brand at your convenience.",Incident,Product Support,medium,en,400,Feedback,Performance,Documentation,IT,Tech Support,,,
Preisstrukturen und Zahlungsmöglichkeiten für das SaaS-Produkt,"Sehr geehrte Kundenservice-Team, ich wende mich an Sie, um mehr Informationen über die Preisstrukturen und Zahlungsmöglichkeiten für unser SaaS-Produkt zu erhalten. Könnten Sie mir bitte detaillierte Informationen zu verschiedenen Plänen geben, einschließlich eventuell vorhandener Rabatte für langfristige Bindungen und besonderer Promotionsangebote? Darüber hinaus wäre ich sehr interessiert, wenn Sie den Zahlungsprozess sowie mögliche zusätzliche Gebühren erläutern könnten. Zudem wäre ich daran interessiert, eine kostenlose Probestunde zu erhalten, um das Produkt auszuprobieren, bevor ich mich für einen bezahlten Plan entscheide. Ich freue mich, wenn Sie diese Fragen beantworten können und bin Ihnen für eine umfassende Rückmeldung dankbar. Sollten Sie weitere Fragen haben, können Sie mich gerne unter dem angegebenen Telefonnummer <tel_num> erreichen.","Sehr geehrte <name>, vielen Dank, dass Sie sich an unser Kundenservice-Team wenden. Das SaaS-Produkt bietet mehrere Preisstufen an, bei denen Rabatte für langfristige Bindungen sowie besondere Promotionsangebote verfügbar sind. Der Zahlungsprozess ist einfach und enthält keine versteckten Gebühren. Wir bieten auch eine kostenlose Probestunde an, die Ihnen das Produkt ermöglicht, auszuprobieren, bevor Sie sich für einen bezahlten Plan entscheiden. Sollten Sie weitere Fragen haben, freuen wir uns auf Ihre Rückmeldung und können gerne umfassende Informationen zu den Preisen und Plänen anbieten. Sie können uns gerne unter <tel_num> anrufen, um Ihre Fragen einzugehen.",Request,Billing and Payments,low,de,400,Billing,Payment,Product,Feature,Feedback,,,
Request for Insights on Leveraging Digital Strategies with H2O.ai and Zoho Books,Could you provide insights on how to utilize digital strategies with H2O.ai and Zoho Books to enhance workflow and increase productivity? We are looking for ways to automate tasks and make data-driven decisions. Thank you for your time and support. I look forward to your feedback soon.,I am pleased to assist. Could you please provide more information on your current workflows and the specific tasks you wish to automate? This will help me to better provide guidance on how to leverage H2O.ai and Zoho Books with digital strategies.,Request,Product Support,low,de,400,Feedback,Documentation,IT,Tech Support,,,,
Fälligkeit des Rechnungsstempels - Unvorhergesehene Probleme bei der Abrechnung von Zahlungen,"Sehr geehrte Kundenservice, wir begegnen unerwarteten Fehlern bei der Abrechnung von Zahlungen. Das Problem scheint auf Datenintegritätsprobleme in unserem Softwareprodukt zurückzuführen sein. Wir haben die neuesten Software-Updates durchgesehen und die Transaktionsprotokolle verglichen, aber das Problem behält sich bestehen. Wir benötigen Ihr Engagement, um das Problem so schnell wie möglich zu lösen und weitere Fehler zu vermeiden. Bitte helfen Sie uns, den Ursprung des Problems zu identifizieren und eine Lösung zu finden.",Das Problem wird umgehend untersucht.,Incident,Billing and Payments,medium,de,400,Billing,Payment,Bug,Performance,Documentation,,,
Investment Analysis Platform Data Output Issues,"The investment analysis platform is producing inconsistent data outputs, which may be due to potential software integration issues. Steps taken to resolve the issue, such as rebooting the system and updating applications, have not resolved the problem. Assistance is required.","Dear customer, \n\nI have received your email regarding the inconsistent data outputs from the investment analysis platform. It is noted that you have already attempted to resolve the issue by rebooting the system and updating applications, but the problem still persists. I would like to assist in resolving this issue. To better understand the problem, could you please provide details on the inconsistent data outputs you are experiencing, including any specific errors or discrepancies you are seeing? Additionally, I would like to schedule a call to further discuss this matter.",Problem,Technical Support,medium,en,400,Bug,Performance,IT,Tech Support,Documentation,,,
Enhancing Security for Medical Data with Symantec Endpoint Protection,"Customer Support, seeking guidance on securing medical data within a hospital setting using Symantec Endpoint Protection 14.3. Would appreciate recommendations and resources to configure and manage the software to ensure the confidentiality, integrity, and availability of sensitive medical information. Specifically, interested in learning about the software's capabilities to detect threats.","Thank you for your inquiry regarding securing medical data with Symantec Endpoint Protection 14.3 in a hospital setting. We recommend configuring the software to enable advanced threat protection and to implement strict security policies. Please refer to the online resources and practice guides for configuration. If you need further assistance, please schedule a call at <tel_num> to discuss your specific requirements and receive tailored guidance. Your account number is <acc_num>.",Request,Billing and Payments,medium,en,400,Security,IT,Tech Support,Documentation,,,,
,"Customer Support,<br>I am writing to bring to your attention an issue reported by one of our customers. The customer is experiencing difficulties with returns and exchanges for several products related to investment optimization.<br>The problem seems to have arisen due to outdated software and discrepancies in the inventory. The team has already taken initial steps to resolve the issue by checking product codes and attempting system reboots, but unfortunately, these efforts have not yielded a resolution.<br>I would greatly",investigate the issue and provide a detailed explanation and course of action to resolve it.,Incident,Returns and Exchanges,low,en,400,Return,Replacement,Product,Bug,Documentation,Tech Support,,
Request for Integration of Project Management Features,Could you please integrate project management features into the affected products to enhance collaboration? We believe this would greatly benefit our team. We would like to discuss this further and would appreciate your feedback on the matter. Could you let us know if this has been considered?,"<name>, thank you for your email regarding the project management feature request. We appreciate your feedback and would be happy to discuss this further. Could you please provide more details on the specific features you are looking for to improve our team's collaboration? We will review your request and contact you at <tel_num> to discuss the next steps needed.",Change,IT Support,medium,en,400,Feature,Feedback,Product,,,,,
Reduced Brand Presence Noted on Online Platforms Lately,"Our marketing firm is facing reduced brand visibility and engagement online. Possible reasons include recent algorithm updates. Despite efforts in targeted advertising and content refinement, the outcomes have been modest.",Suggest scheduling a call to explore possible solutions,Problem,Sales and Pre-Sales,medium,en,400,Feedback,Performance,Marketing,Product,,,,
Support Request: Security Breach Identified in IT Systems,"Dear Customer Support Team, a security breach has been identified in our IT systems, compromising the integrity of medical data. The unauthorized access appears to be responsible for this vulnerability. Immediate security patches have been installed, and the first system audit has been conducted. We require further assistance with guidance. The breach has endangered sensitive patient data, causing significant concerns. We appreciate any additional support and recommendations to ensure system integrity in the future. Please inform us of the next steps and any further measures to be taken.","We confirm receipt of your email regarding the security breach in the IT systems, which may have led to the potential masking of sensitive patient information. We understand the critical situation and are prepared to offer the necessary support and guidance. Our team will review the incident and provide recommendations for further actions. We will offer additional measures to enhance the security and integrity of the systems. We look forward to receiving your detailed instructions for the next steps via email. Please continue to monitor the systems for any suspicious activity.",Incident,Technical Support,low,de,400,Security,Alert,IT,Tech Support,,,,
Issues with Data Processing Speed Using Keras in MATLAB,"We are facing slowdowns in data processing using Keras in MATLAB. We have updated the drivers, restarted the system, and checked for application conflicts, but the issue persists.",I would be happy to assist with the slowdowns in data processing using Keras in MATLAB. Please provide details on your system configuration and any exact errors you are encountering. I will follow up soon to discuss this further.,Problem,IT Support,high,en,400,Performance,Bug,IT,Tech Support,,,,
System Crash Incident,"A marketing agency experienced an unexpected system crash, which might be related to a recent Ubuntu update. Attempts to restart and reinstall the system have been unsuccessful.","We apologize for the inconvenience caused by the system crash at your marketing agency. We understand that you have already tried restarting and reinstalling the system without success. To better assist you, could you please provide more details about the error messages and the exact steps you took during the Ubuntu update? This information will help us troubleshoot the issue more efficiently. If needed, we can schedule a call at a convenient time for you to discuss this further. Please let us know a suitable time to reach you at <tel_num>.",Incident,Technical Support,high,en,400,Crash,Performance,IT,Tech Support,,,,
Bitten um technische Unterstützung für Markenentwicklung Marketing-AG,"Wir bei Markenentwicklung Marketing-AG haben aktuell technische Probleme mit mehreren Werkzeugen. Die neuesten Systemupdates und Integrationen scheinen die Ursache zu sein. Wir haben versucht, die betroffenen Anwendungen neu zu starten, die Caches zu leeren und Backups wiederherzustellen, aber ohne Erfolg. Das Team hat verschiedene Schritte zur Lösung des Problems unternommen, aber das Problem behält sich bestehen. Wir benötigen dringend Hilfe, um das Problem zu lösen, um weitere Beeinträchtigungen bei Markenentwicklung zu vermeiden.","Ich möchte um technische Unterstützung für Markenentwicklung Marketing-AG bitten, die technischen Probleme mit den Werkzeugen zu lösen, die bisherige Schritte zur Lösung des Problems unternommen wurden, aber ohne Erfolg. Um das Problem schnell zu lösen, könnten Sie mir bitte mehr Details zu den neuesten Systemupdates und Integrationen geben, um die spezifischen Fehler besser verstehen zu können. Dies würde uns helfen, das erste Anliegen zu lösen.",Incident,Technical Support,high,de,400,IT,Tech Support,Performance,Maintenance,Recovery,,,
Verbessern Sie unsere Markenwachstumsstrategien,"Wir suchen nach weiteren Details zu unseren digitalen Strategien zur Verbesserung des Markenwachstums. Wir sind interessiert, um mehr über Ihre Dienstleistungen zu erfahren.","Sehr geehrte [name], wir bedanken uns für Ihr Interesse an unseren Strategien zur Verbesserung des Markenwachstums im digitalen Bereich. Unsere Angebote umfassen soziale-Medien-Management, Inhaltscreativität, zielführende Werbung und die Erhöhung der Markenwahrnehmung. Wir freuen uns darauf, Ihnen Informationen zu liefern und unsere Dienstleistungen auf Ihre spezifischen Bedürfnisse anzupassen. Um Ihre Ziele besser zu verstehen und um effektiver Wachstumsherausforderungen Ihrer Marke zu bewältigen, könnten Sie uns bitte mehr über Ihre aktuelle Situation mitteilen. Es freut uns, einen geeigneten Zeitpunkt für ein Telefonat mit Ihnen zu vereinbaren, um weitere Details zu besprechen. [Zeit] wäre beispielsweise eine gute Wahl.",Request,Technical Support,high,de,400,Sales,Feedback,Product,Feature,,,,
,"Hello Customer Support, I am inquiring about the integration capabilities of our SaaS platform with third-party tools. Could you provide detailed information on the available integrations, API documentation, webhooks, and pre-built connectors? I would greatly appreciate some guidance on setting up and configuring these integrations. Additionally, could you inform me about any limitations or restrictions related to the types of integrations we can make? I look forward to hearing back from you with this information. Thank you for your assistance.","Dear [Name], thank you for reaching out. We offer various integration options, including detailed API documentation and pre-built connectors. We can send you detailed information on our integration capabilities. Let's discuss scheduling a call at your convenience at [tel_num] to guide you through the setup and configuration process.",Request,Product Support,medium,en,400,Feature,Documentation,Feedback,Tech Support,,,,
Problem with Software Access Today,Team members are facing disruptions with the essential software tools.,We are investigating the issues with the core software tools to determine the cause and find a resolution as soon as possible.,Incident,Human Resources,medium,en,400,Bug,Disruption,Performance,IT,Tech Support,,,
Probleme bei der Integration der Projektor-App,"Es treten zufällige Ausfälle der Projektor-App auf, die möglicherweise auf Kompatibilitätsprobleme zurückzuführen sind. Das Problem wurde durch eine Aktualisierung der App gelöst.","Sehr geehrte(n) [Name],\n\nich möchte die Probleme bei der Integration der Projektor-App und der WhatsApp Desktop-Integration melden, die möglicherweise auf Kompatibilitätsprobleme zurückzuführen sind. Ich entschuldige mich für die Unannehmlichkeiten, die durch die Aktualisierung der App behoben wurden. Ich freue mich darauf, Ihnen bei der Behebung des Problems zu helfen. Bitte geben Sie mir mehr Informationen, wie z.B. die Version der Projektor-App und der WhatsApp Desktop, die genaue Fehlermeldung sowie den Betriebssystem, auf dem das Problem auftritt. Das wäre sehr hilfreich für mich.",Incident,Technical Support,medium,de,400,Bug,Performance,Disruption,IT,Tech Support,,,
Request to Update ClickUp Integration Settings,"Dear Customer Support, I am writing to request an update to the integration settings to improve compatibility with ClickUp, Zapier, and Smart-Küchengeräte. This update is necessary to enhance project management and ensure seamless communication between our tools. Currently, we are experiencing compatibility issues that are hindering our workflow. I would greatly appreciate your assistance in updating these settings as soon as possible. Please let me know if you need any additional information to facilitate this update. Thank you for your time and assistance. I look forward to hearing from you.","Hello [Name], thank you for reaching out to update the integration settings for improved compatibility with ClickUp, Zapier, and Smart-Küchengeräte. We understand the importance of seamless communication for effective project management. To better assist you, could you please provide details on the compatibility issues you are currently experiencing, including any error messages you have encountered? Additionally, it would be helpful to know the current integration settings so we can make the necessary changes. It would be convenient to schedule a call at [tel_num] to discuss and ensure everything is set up correctly. Thank you.",Change,IT Support,medium,en,400,Feature,IT,Tech Support,Performance,,,,
Sicherheitsanomalie im Datensystem,"Unerlaubter Zugriff auf medizinische Datensysteme wurde jüngst bemerkt, was zu einer Anspannung der Datensicherheitslage geführt hat. Momentane Zugriffsbeschränkungen wurden angewendet und ein vorläufiger Systemüberwachungsprozess durchgeführt.","Für nähere Informationen zum Datenschutzproblem rufen Sie bitte <tel_num> an, um eine Diskussion über die notwendigen nächsten Schritte zu starten, die für die Steigerung der Datensicherheit hilfreich sein könnten.",Incident,Customer Service,low,de,400,Security,IT,Tech Support,Maintenance,,,,
,"Bitte kontaktieren Sie uns, um Informationen zu verschiedenen Produkten und Dienstleistungen bezüglich der Sicherung medizinischer Daten einzuholen. Könnten Sie Details über die besten Praktiken, Protokolle und Maßnahmen zur Gewährleistung der Konfidentialität, Integrität und Verfügbarkeit sensibler medizinischer Informationen liefern? Bitte schätzen Sie, welche Ressourcen und Empfehlungen zur Erweiterung der Kenntnisse über Schutzmaßnahmen für kritische Daten verfügbar sind. Wir können auf Anfrage telefongespräche anbieten, um spezifische Ressourcen und Relevanz zu besprechen.","Wir bieten allgemeine Ratschläge zur Sicherung medizinischer Daten. Um Konfidentialität, Integrität und Verfügbarkeit zu gewährleisten, empfehlen wir Verschlüsselung, Zugriffssteuerungen und Sicherungen. Bitte beachten Sie, dass es sich um allgemeine Empfehlungen handelt. Für spezifische Empfehlungen und Details zu Produkten und Dienstleistungen benötigen wir zusätzliche Informationen. Wenn Sie möchten, können wir telefonisch darüber diskutieren, um die Verfügbarkeit der Ressourcen und die Relevanz zu besprechen und präzisere Ratschläge erteilen.",Request,Service Outages and Maintenance,high,de,400,Security,Product,Feature,Documentation,Maintenance,,,
Support Required for Mathematica Integration,"Looking for assistance with integrating Wolfram Mathematica into our current data analytics framework. Could you provide the details of the integration process, including the necessary software and hardware requirements? We are interested in leveraging Mathematica's computational capabilities to enhance our data analysis. Specifically, we would like to know which APIs and libraries can facilitate this integration. Additionally, are there any tutorials or documentation available to guide us through the process? We appreciate your assistance, and we look forward to hearing from you soon.","Will assist with integrating Wolfram Mathematica into your data analytics framework. Please provide details about your current setup and requirements. Send us the necessary information on the software and APIs that can facilitate the integration, and provide any relevant tutorials or documentation.",Request,Human Resources,medium,en,400,IT,Tech Support,Documentation,Hardware,Feature,,,
Campaign Assistance,Facing problems with missed deadlines due to inadequate collaboration tools with limited integration capabilities.,Evaluate the campaign and provide a suitable solution for the collaboration tools.,Problem,Product Support,medium,en,400,Feedback,IT,Tech Support,,,,,
Support für Zoho CRM Integration,"Ich benötige detaillierte Anweisungen zur Integration von Zoho CRM in den Projektmanagement-Webdienst, um Arbeitsabläufe zu vereinfachen und Effizienz zu verbessern. Vielen Dank für Ihre Unterstützung!","Sehr geehrte [Name], vielen Dank für Ihre Nachricht. Das Support-Team hat Ihre Anfrage entgegengenommen. Wir bedanken uns für Ihr Interesse an der Integration von Zoho CRM in den Projektmanagement-Webdienst. Wir werden Ihnen eine detaillierte Schritt-für-Schritt-Anleitung zur Verfügung stellen, die die erforderlichen Schritte zur Verbindung beider Systeme umfasst, einschließlich Authentifizierung, Datenaustausch und Workflows. Wenn Sie möchten, können wir auch telefonisch eine detailliertere Diskussion über die Integration planen. Bitte lassen Sie uns wissen, wann es Ihnen bequem ist, oder rufen Sie uns unter [Tel-Nummer] an. Alternativ finden Sie weitere Informationen und Tutorials in unserer Wissensdatenbank unter den FAQs zur Integration von Zoho CRM.",Request,Product Support,medium,de,400,Feature,Documentation,IT,Tech Support,,,,
