subject,body,answer,type,queue,priority,language,version,tag_1,tag_2,tag_3,tag_4,tag_5,tag_6,tag_7,tag_8
Reported Data Integration Failures,"Dear Customer Support, I am documenting issues related to data integration failures across various analytics platforms, which have considerably hindered our investment optimization processes. It appears that these problems started following recent updates to our products, indicating a possible incompatibility issue. Despite attempts such as system reboots and applying software patches, the issue remains unresolved. These failures have caused operational inefficiencies and could potentially lead to financial setbacks. Your prompt attention to this matter would be highly appreciated, and I kindly request your urgent assistance in resolving this issue.","<name> confirms receipt of your email regarding data integration failures across analytics tools. We apologize for the disruption to your investment optimization efforts. Please provide details of the recent product updates and any software patches that were applied. Additionally, share relevant logs and error messages encountered during the failures. We will investigate this matter promptly and advise on possible solutions to resolve the issue as soon as possible.",Incident,Customer Service,high,en,52,Bug,Performance,Disruption,Recovery,Maintenance,Security,,
Technisches Problem,"Unsere Marketingagentur hat mehrere Ausfälle bei digitalen Tools erlebt, was die Kampagnenbereitstellung beeinträchtigt hat. Die wahrscheinlichste Ursache sind gleichzeitige API- und Datenbankausfälle. Trotz Service-Neustarts und Cache-Löschungen sowie plattformübergreifender Diagnosen konnten wir keine Lösung finden. Unser Team arbeitet engagiert daran, das Problem zu beheben und zukünftige Vorfälle zu verhindern. Wir schätzen Ihre schnelle Aufmerksamkeit für dieses Anliegen und freuen uns über Ihre Unterstützung bei der Behebung der Ausfälle. Bitte lassen Sie uns wissen, wenn Sie weitere Informationen benötigen, um den Problemlösungsprozess zu erleichtern.","Wir entschuldigen uns für die technischen Probleme, die unsere digitalen Tools betreffen, und schätzen die Bemühungen unseres Teams, diese bisher zu beheben. Wir möchten die Ausfälle so schnell wie möglich beheben und unterstützen Sie gerne dabei. Um den Lösungsprozess zu erleichtern, bitten wir Sie, uns weitere Details zu den Fehlernachrichten mitzuteilen, insbesondere den genauen Zeitpunkt, wann die Ausfälle begonnen haben. Diese Informationen helfen bei der weiteren Untersuchung des Problems. Falls erforderlich, vereinbaren wir gerne einen Anruf, um das Problem detaillierter zu besprechen. Bitte teilen Sie uns mit, wann es Ihnen passt.",Incident,Technical Support,high,de,52,Bug,Outage,Disruption,Recovery,Performance,IT,Tech Support,
Data Breach Incident,"Customer support reported informing the healthcare provider about a suspected data breach that may have impacted hospital systems. The cause of the breach is believed to be due to misconfigured network equipment with outdated firmware. Attempts to resolve the issue included applying security patches, resetting device configurations, and conducting security scans, but these efforts were unsuccessful. The breach has put patient information at risk, raising concerns about possible repercussions. We request assistance to address and resolve this issue.","We received an email regarding a potential data breach at the hospital. The matter has been escalated to our security team. To assist you more effectively, we would like to schedule a call to discuss the details and provide guidance on network device configuration and software updates. Please let us know a convenient time for a call at <tel_num>.",Incident,Product Support,low,en,52,Security,Outage,Disruption,Recovery,,,,
Growth Insights,Could detailed insights into digital strategies for market growth be provided using IBM Cloud services? Would like to learn more about the available tools.,Contact for further information,Request,Product Support,low,de,52,Feedback,Sales,Lead,Product,,,,
,I am reaching out to inquire about digital strategies to implement and enhance brand growth across various product lines. Could you provide detailed information on this topic? I am especially interested in learning about approaches to customize strategies for different products and target audiences. Any guidance or resources you can share would be greatly appreciated. I look forward to hearing from you and exploring strategies to inform our efforts.,"I would be happy to discuss digital strategies with you. To better understand your specific needs, could you please share information about your products and target audiences? I can then offer tailored guidance and resources as needed. Please schedule a call at <tel_num> to discuss your questions.",Request,Technical Support,low,en,52,Strategy,Branding,Growth,Product,Audience,Guidance,Resources,Marketing
SaaS Platform Crashing During Peak Hours,"Please document the issue with our SaaS platform, which intermittently crashes during peak periods. Despite attempts at load balancing and server scaling, the problem persists. It is likely caused by server overload. We would appreciate an estimated timeline for resolving this issue and suggestions for improvements. Kindly review and provide recommended solutions to prevent future outages.","<name>, please confirm via email regarding the intermittent crashes of the SaaS platform during peak times. I understand that despite efforts to implement load balancing and server scaling, the issue still occurs. To assist you more effectively, could you please provide additional details about the current infrastructure setup, including server specifications and the load balancing methods in use? Also, if possible, share the exact error messages encountered during the crashes. This information will help us to identify the root cause and suggest appropriate solutions.",Problem,Returns and Exchanges,medium,de,52,Crash,Performance,Outage,Disruption,Recovery,Load Balancing,Scalability,
Anfrage zu Preisstrukturen für Datenanalyse-Dienstleistungen,"Sehr geehrter Kundenservice, ich möchte mich nach den Preis- und Abrechnungsoptionen für Datenanalyse-Lösungen erkundigen, die speziell auf Finanzinvestmentfirmen zugeschnitten sind. Könnten Sie bitte eine detaillierte Aufstellung der anfallenden Kosten sowie mögliche individuelle Tarifpläne bereitstellen? Zudem würde ich gerne Informationen zu eventuellen Rabatten oder Aktionen erhalten, die derzeit verfügbar sind. Bitte informieren Sie mich außerdem über etwaige Einrichtungsgebühren sowie laufende Wartungs- und Unterhaltskosten. Ich freue mich auf Ihre Rückmeldung, um die Lösungen auf unsere Bedürfnisse abzustimmen. Vielen Dank für Ihre Zeit und Unterstützung.","Sehr geehrter <name>, danke für Ihre E-Mail bezüglich unserer Datenanalyse-Lösungen für Finanzinvestmentfirmen. Wir bieten individuell angepasste Preismodelle an, die auf die spezifischen Anforderungen unserer Kunden zugeschnitten sind. Die Kosten variieren je nach Projektumfang, Datenvolumen und benötigten Funktionen. Wir gewähren Rabatte bei langfristigen Verträgen sowie spezielle Aktionen für Neukunden. Einrichtungsgebühren sowie laufende Wartungs- und Supportkosten hängen von der implementierten Lösung ab. Gerne können wir die Details in einem Gespräch besprechen; eine detaillierte Kostenübersicht stelle ich Ihnen gerne zur Verfügung. Bitte teilen Sie mir einen passenden Zeitpunkt für eine Beratung mit, damit wir Ihre Anforderungen gemeinsam besprechen können.",Request,Billing and Payments,low,de,52,Billing,Pricing,Data Analysis,Finance,Customer Service,Discount,Tariff Plan,
Request for Software Licensing Support,Could you provide detailed billing information and available payment options for Python 3.9 and Microsoft Office 365 licenses? I need these details to proceed with the purchase. Please include any current discounts or promotions. I appreciate your assistance and look forward to hearing from you soon.,"We are happy to assist with your software license inquiry. Please provide detailed billing information and available payment options so we can contact you at the appropriate time. Also, include any applicable discounts or promotions for Python 3.9 and Microsoft Office 365 licenses.",Request,Billing and Payments,high,de,52,Billing,Payment,License,Support,Discount,Purchase,,
Online Marketing,I am keen on understanding strategies in online marketing that can propel brand development. Could you provide comprehensive details on the techniques employed to enhance brand visibility and reach a broader audience? I would value any insights on how to effectively utilize digital marketing platforms to meet business objectives.,"<name>, thank you for your interest in online marketing strategies. We offer a variety of services to promote brand growth, including social media management and targeted advertising. To discuss how we can help you achieve your business objectives, I would like to arrange a call at your convenience. Please let me know a suitable time to contact you at <tel_num> to explore these solutions in detail.",Request,Product Support,low,en,52,Marketing,Strategy,Digital Platform,Brand Development,Audience Insights,Visibility,Business Objectives,
Notification of Medical Data Security Incident,"A healthcare organization has identified a possible breach of medical records due to vulnerabilities in outdated software. Promptly, the systems were patched, and firewall defenses were strengthened.","We have promptly responded by updating systems and improving firewall security to mitigate the potential medical data breach. Thank you for bringing this to our attention. If you have any further concerns, please contact us at <tel_num>.",Problem,Product Support,high,en,52,Security,IT,Disruption,,,,,
Multiple Digital Platforms Campaign Not Meeting Expectations,"Customer Support, I am reaching out to highlight a critical issue with our marketing agency's multi-product digital campaign. Despite our initial projections, the campaign is performing unexpectedly poorly. We have tried rebooting the system and conducting preliminary diagnostics; however, the problem remains unresolved. The underperformance may be linked to integration challenges across various platforms. We would greatly appreciate your assistance in identifying the underlying cause and providing an appropriate solution.",Please review the campaign issues by contacting <tel_num> to discuss and schedule a convenient time to investigate and resolve the integration problems across the digital platforms.,Incident,Product Support,high,en,52,Performance,Outage,Disruption,IT,Tech Support,,,
Assistance with Digital Marketing Strategies,"Customer Support is seeking assistance with integrating digital marketing techniques for the Western Digital Book Duo on Shopify. Could you offer detailed instructions on how to effectively combine these tools to boost the online store's performance? I would also appreciate guidance on configuring and optimizing digital marketing campaigns. Specifically, I am interested in understanding how to utilize the storage features of the Western Digital Book Duo to streamline data management on Shopify and enhance customer experience.",I would be happy to assist with integrating digital marketing strategies for the Western Digital Book Duo on Shopify. Please allow a call at your convenience so we can discuss and I can provide guidance on setting up and optimizing your digital marketing campaigns.,Request,Customer Service,high,en,52,Feedback,Sales,Lead,IT,Tech Support,,,
Fehler bei der Daten-Synchronisation in Finanzinstitut,"Das Finanzunternehmen hat einen Daten-Synchronisationsfehler erlebt, der mehrere Produkte im Bereich Investmentanalyse betrifft. Die Ursache liegt wahrscheinlich in einer fehlerhaften Netzwerkkonfiguration. Die Fehlerbehebung umfasste Systemneustarts, Software-Updates und Überprüfungen der Konnektivität, jedoch ist das Problem weiterhin vorhanden.","Sehr geehrter <name>, ich schreibe Ihnen bezüglich des Daten-Synchronisationsfehlers im Finanzunternehmen zur Bestätigung. Ich verstehe, dass trotz der durchgeführten Maßnahmen wie Systemneustarts, Software-Updates und Überprüfungen der Konnektivität das Problem weiterhin besteht. Um eine Lösung zu finden, möchten wir das Problem besser verstehen. Könnten Sie bitte weitere Details zu den vermuteten Ursachen in der Netzwerkkonfiguration bereitstellen? Außerdem wäre es hilfreich zu wissen, welche spezifischen Produkte von den Daten-Synchronisationsfehlern betroffen sind. Wenn es Ihnen passt, können wir auch gerne einen Anruf vereinbaren, um mögliche Lösungen zu besprechen.",Incident,Product Support,medium,de,52,Network,Performance,Outage,Disruption,Recovery,,,
Support Request for Data Analytics Integration,"We are seeking to improve our data analytics integration across various product platforms and devices. This enhancement would allow us to optimize our investment strategies and make better-informed decisions. Currently, our analytics capabilities are limited and do not provide the detailed insights required. We would appreciate it if this could be prioritized for implementation at the earliest convenience. Please let us know if any additional information is needed to proceed with this request. We look forward to your prompt response.",Review the request and contact us if further details are required to advance the enhancement.,Change,Product Support,medium,en,52,Product,Feature,Documentation,Feedback,IT,,,
Mehrere Schwierigkeiten bei Produktintegrationen aufgetreten,"Sehr geehrter Kundenservice, ich möchte mitteilen, dass unsere Marketingagentur mehrere Probleme bei der Produktintegration erlebt hat, die zu erheblichen Verzögerungen bei den Kampagnen geführt haben. Trotz wiederholter Systemneustarts und grundlegender Fehlerbehebung konnten die Probleme bisher nicht behoben werden. Es wird vermutet, dass inkompatible Updates verschiedener Plattformen die Ursache sind. Wir haben versucht, die genaue Ursache zu ermitteln, waren dabei jedoch bisher erfolglos. Wir würden eine schnelle Lösung des Problems sehr schätzen. Bitte lassen Sie uns wissen, falls Sie zusätzliche Informationen benötigen.","Sehr geehrter <name>, um bei den Produktintegrationsproblemen zu helfen, bitten wir Sie, Details zu den verwendeten Plattform-Updates anzugeben. Sie können uns unter <tel_num> kontaktieren, um weitere Details zu besprechen.",Problem,Technical Support,high,de,52,Bug,Performance,Disruption,Recovery,Product,Feature,,
,"geehrte Kundensupport, ich wende mich an Sie, um Informationen zu skalierbaren SaaS-Lösungen für das Projektmanagement zu erhalten. Könnten Sie mir mehr über die wesentlichen Funktionalitäten und Vorteile der Plattform erzählen? Ich bin besonders an Anpassungsoptionen, Integrationsmöglichkeiten sowie Sicherheitsmaßnahmen interessiert. Ich freue mich auf eine Rückmeldung und einen Austausch darüber, wie die Lösung unsere Projektworkflow-Optimierung und Teamzusammenarbeit verbessern kann.","geehrte <name>, wir bedanken uns für Ihr Interesse an unseren SaaS-Lösungen für das Projektmanagement. Wir können Ihnen gerne Details zu den wesentlichen Funktionalitäten und Vorteilen, einschließlich Anpassungsoptionen, Integrationsmöglichkeiten und Sicherheitsmaßnahmen, bereitstellen. Bitte erlauben Sie uns, Sie telefonisch unter der Nummer <tel_num> anzurufen, um diese Diskussion fortzusetzen.",Request,Customer Service,medium,de,52,Product,Feature,Security,Feedback,IT,,,
Mehrere Produkte sind von gemeldetem Vorfall betroffen,"Bitte melden Sie, dass ein Vorfall aufgetreten ist, welcher mehrere Produkte betrifft. Zu den betroffenen Geräten zählen der SQL Server und Laptop-Peripheriegeräte. Das System ist unerwartet abgestürzt, möglicherweise infolge kürzlicher Updates. Nach einem Neustart der Geräte und Überprüfung der Verbindungen besteht das Problem weiterhin. Ich vermute einen möglichen Konflikt im System. Ich bitte um Unterstützung, um das Problem so schnell wie möglich zu beheben. Eine Anleitung zur Fehlerbehebung und Konfliktlösung wäre sehr hilfreich. Vielen Dank für Ihre Unterstützung.","Kontaktieren Sie <tel_num>, um den Vorfall zu überprüfen, und besprechen Sie die nächsten Schritte zur Fehlerbehebung. Ziel ist es, den Systemkonflikt zu lösen, der die betroffenen Produkte betrifft.",Incident,IT Support,low,de,52,Bug,Crash,Performance,Hardware,Outage,Disruption,Recovery,Support
,"Das Unternehmen erlebte Verzögerungen im System, wobei mehrere Produkte aufgrund von Netzwerküberlastungen bei intensiven Datenanalyseprozessen beeinträchtigt wurden. Vorläufige Maßnahmen zur Fehlerbehebung umfassten Neustarts des Systems sowie Software-Updates an betroffenen Geräten. Trotz dieser Versuche bestehen die Leistungsprobleme weiterhin, was die Effizienz bei der Verarbeitung von Investitionsdaten beeinträchtigt. Wir benötigen Unterstützung bei der Behebung des Problems, um eine rechtzeitige und präzise Datenverarbeitung sicherzustellen.","Hier, die Systemverlangsamungen betreffen Produkte aufgrund von Netzwerküberlastung. Um das Problem besser zu verstehen und eine effektivere Lösung anzubieten, könnten Sie bitte weitere Details zur Netzwerk-Infrastruktur und den spezifischen Datenanalyseaufgaben bereitstellen, die die Überlastung verursachen? Zusätzlich wäre es hilfreich, die genauen Symptome der Fehler zu kennen, die Sie erleben. Wir können einen Anruf planen, um die Lösung zu besprechen und sicherzustellen, dass die rechtzeitige und genaue Verarbeitung der Investitionsdaten gewährleistet ist. Bitte teilen Sie uns einen passenden Zeitpunkt für den Anruf mit.",Incident,Technical Support,high,de,52,Performance,Network,Hardware,Bug,Recovery,,,
Online Advertising Initiative,The platform remains non-operational.,Express apologies,Incident,Technical Support,high,en,52,Outage,Disruption,Recovery,IT,Tech Support,,,
Request for Assistance with Digital Campaign Integration Issues,"Our marketing agency's digital campaign platforms have encountered integration failures, potentially due to recent software updates. The team has tried restarting and reconfiguring the systems without success. We are concerned that this issue might affect our ongoing campaigns and would appreciate prompt help in resolving it. Could you please guide us on additional troubleshooting steps or solutions? Thank you for your quick attention to this matter. We look forward to your response.","<name>, I am writing to acknowledge the email regarding the integration failures on your digital campaign platforms. I understand the urgency due to the potential impact on your ongoing campaigns. To assist you more effectively, could you please provide details about the recent software updates, specific error messages encountered, and the troubleshooting steps already attempted? Additionally, I would like to schedule a call to discuss the issue further.",Incident,Product Support,medium,en,52,Bug,Software Update,Integration,Digital Campaign,Tech Support,,,
Enhancing Brand Expansion with Adobe Creative,"Customer Support,\n\nI am reaching out to inquire about integrating Adobe Creative Cloud's digital marketing solutions to bolster brand development strategies. As a marketer, I am eager to utilize these tools to amplify the brand's online visibility and extend its reach to a broader audience.\n\nI would appreciate it if you could offer detailed information on how to seamlessly incorporate Adobe Creative Cloud's digital marketing functionalities. Specifically, I am interested in learning about the available plugins, extensions, and APIs that facilitate this integration.","Provide information on integrating Adobe Creative Cloud's digital marketing tools, including available plugins and APIs.",Request,IT Support,medium,en,52,Feature,Marketing,Digital Marketing,Brand Development,Visibility,,,
Ensuring Proper Security for MacBook Air Devices Today,I am seeking information on securing MacBook Air systems used within hospital environments to safeguard healthcare data. Could you offer guidance on best practices and measures to maintain the security and integrity of sensitive healthcare information? I would appreciate any recommendations or resources that could assist in defending against potential threats and vulnerabilities.,"To ensure the security of MacBook Air systems in hospitals and protect sensitive healthcare data, please let us know a convenient time for a call.",Request,IT Support,high,en,52,Security,IT,Hardware,Vulnerability,,,,
Security Support Inquiry,"Drafting a request to enhance security protocols that safeguard medical information within the hospital's infrastructure and healthcare setting. Present security measures are adequate to defend against cyber threats and data breaches. I would like to request the deployment of stronger security measures, including encryption, firewalls, and routine security updates. This will help maintain the confidentiality, integrity, and availability of medical data, thereby preventing potential harm to patients. I believe this is a crucial step in protecting the healthcare environment.","<name> We appreciate your concern regarding the security of medical data and hospital infrastructure. We are pleased to assist with your request. Ensuring the security of patient information is our top priority, and we are committed to implementing necessary measures to prevent cyber threats and data breaches. Your request has been forwarded to the security team for review of current protocols, and they will evaluate the need for additional safeguards such as encryption, firewalls, and regular updates. A comprehensive risk assessment will be conducted to identify any potential vulnerabilities within the system.",Change,Product Support,medium,en,52,Security,IT,Cyber Threat,Data Breach,Encryption,Firewall,,
Integration of Ableton Live with GitLab,"Dear Customer Service,\n\nI am interested in integrating Ableton Live with the scalable SaaS platform provided by GitLab. I would like to learn more about the step-by-step process involved and the necessary tools required for a successful integration.\n\nCould you please provide comprehensive documentation on setting up the integration, including details on required API keys, authentication methods, and configuration settings? Additionally, I would appreciate information on common issues encountered during the integration process and how to resolve them.\n\nFurthermore, I am keen to understand if there are any specific requirements or limitations associated with integrating Ableton Live.\n\nThank you in advance for your assistance.","We can provide detailed documentation on integrating Ableton Live with GitLab, including API keys and configuration details. Please allow us to send you troubleshooting guides and schedule a call to walk through the process.",Request,Product Support,high,de,52,Feature,Documentation,API,Integration,Support,,,
Data Integration Problem,"Dear Customer Support, a financial organization faced failures in data integration, which affected their investment analysis processes. The potential cause appears to be software compatibility problems among various products. Attempts to resolve included rebooting systems, updating software, and verifying network connections, which led to some resolution; however, the issue continues to disrupt daily activities. We would appreciate it if you could examine this matter and provide a solution promptly. Please inform us if you require any additional information.",We received your email regarding the data integration problem. Our team is investigating possible software compatibility issues. Kindly provide the account number and a convenient time for a call to discuss the matter further.,Incident,Technical Support,medium,en,52,Bug,Performance,Software Compatibility,IT,Tech Support,,,
Hilfe beim digitalen Markenentwicklung,"Ich möchte mich erkundigen, wie digitale Strategien das Markenwachstum in Unternehmen fördern können, insbesondere bei der Nutzung verschiedener Technologieprodukte. Könnten Sie Details zu Ansätzen bereitstellen, die in der Vergangenheit Unternehmen unterstützt haben? Ich freue mich auf weitere Informationen zu diesem Thema.","Gerne stehe ich Ihnen für eine Diskussion über digitale Strategien zur Verfügung. Bitte erlauben Sie mir, einen geeigneten Zeitpunkt für einen Anruf zu vereinbaren, um weitere Details zu besprechen.",Request,Sales and Pre-Sales,low,de,52,Marketing,Digital Strategy,Brand Development,Technology,Growth,Business,Innovation,
Data Analytics Challenge,"A problem with data analytics has impacted the investment optimization process at the financial firm. The potential cause might be system overload or misconfiguration. After restarting the analytics servers and verifying data feeds, the issue remains unresolved. We require assistance to resolve this matter.","This is to acknowledge receipt of your report regarding the data analytics challenge at the financial firm. We recognize that initial troubleshooting steps, including restarting the analytics servers and inspecting data feeds, have already been undertaken. To assist you effectively, we propose scheduling a call to discuss the issue in detail. Please inform us of a convenient time for the call. Additionally, providing further information would be beneficial.",Incident,Product Support,high,en,52,Performance,Outage,Disruption,Recovery,IT,Tech Support,,
