subject,body,answer,type,queue,priority,language,version,tag_1,tag_2,tag_3,tag_4,tag_5,tag_6,tag_7,tag_8
Problem mit Smart Steckdose,"Es gab einen Fehler bei der Smart-Steckdose, was die Marketingkampagnen beeinträchtigt hat. Das Gerät wurde neu gestartet und die Einstellungen wurden überprüft, jedoch behält das Problem trotzdem bestand.","Um das Problem mit der Smart Steckdose zu untersuchen, bitte geben Sie weitere Details zur Fehlermeldung an, um Unterstützung zu erhalten.",Incident,Technical Support,medium,de,400,Bug,Product,Feature,Tech Support,,,,
,"Wir bedanken uns bei den Benutzern, die sich mit Verbindungsproblemen auf Monday.com auseinander gesetzt haben. Es ist verständlich, dass Neustarts und das Löschen des Caches nicht immer den Fehler beheben. Es wird in Erwägung gezogen, dass das Überlasten der Server möglicherweise die Ursache sein könnte. Bitte helfen Sie uns, das Problem zu lösen, indem Sie uns mehr Details über den genauen Fehlerfall und die Zeit, zu der das Problem aufgetreten ist, teilen. Falls dies notwendig ist, können wir einen Anruf vereinbaren.","Sehr geehrte/r [Name],\n\nich möchte mich bei Ihnen für die Aufmerksamkeit zu den Verbindungsproblemen auf Monday.com bedanken. Es ist verständlich, dass Neustarts und das Löschen des Caches nicht immer den Fehler beheben. Es wird in Erwägung gezogen, dass das Überlasten der Server möglicherweise die Ursache sein könnte.\n\nUm besser helfen zu können, möchten wir mehr Informationen zum Problem sammeln. Könnten Sie uns bitte den genauen Fehlerfall, einschließlich der genauen Zeit, zu der das Problem aufgetreten ist, mitteilen? Falls dies notwendig ist, können wir auch einen Anruf vereinbaren.",Problem,IT Support,medium,de,400,Network,Performance,Disruption,IT,Tech Support,,,
Error discovered in Patient Billing System,"Several account statements are found to have incomplete entries, which might be due to recent database migrations. We will review the booking protocols and re-examine the invoices to identify any issues for resolution.",Thank you for bringing this to our attention. We are currently investigating the error in the Patient Billing System and will strive to offer a solution as soon as possible.,Problem,Billing and Payments,low,de,400,Bug,Billing,Account,IT,Tech Support,,,
Concern About Investment Analytics Software,"The investment analytics tools at the financial firm are encountering problems, leading to delays.","Dear [Name], we acknowledge the issue with the investment analytics tools. We are sorry to hear that the malfunction is causing delays. We would like to resolve this issue as soon as possible. Could you please provide more details about the error message you are receiving and the specific functionality that is not working as expected? This will help us better understand the issue and provide an accurate solution. We need to schedule a call at a convenient time for you, so please let us know when you are available to discuss further and arrange the call.",Incident,Technical Support,high,en,400,Bug,Performance,IT,Tech Support,,,,
Issues with Software Access Disrupted,"A marketing agency encountered disruptions in software access following a recent system update. Despite restarting the affected software and resetting network connections, the issues continue to persist.",Investigate the disruptions in software access for the marketing agency that occurred after the recent system update. Please provide details on any error messages received and specify which software is affected. We can schedule a call at your convenience to discuss the resolution needed; contact me at <tel_num> to discuss further.,Incident,IT Support,medium,en,400,Bug,Network,Disruption,Performance,IT,Tech Support,,
Request for Integration Update,"I am writing to request an update to the product's integration features. The current integration process, when applied to our existing products, has caused issues with user experience. I would like to request an update to the integration to enhance compatibility and broaden the overall user experience. The integration requires API support for additional functionalities and data formats. I believe this update would be of great benefit to the users and increase their satisfaction with the product. I appreciate it if you could inform me about the scope of the request and the progress made. If you agree to proceed, please let me know a good time window for a telephone conference at <tel_num>.","Your request for an update to the integration features of the product has been noted to improve compatibility and enhance the overall user experience for existing products. I understand that the current integration process has caused some issues and I appreciate your feedback. The request will be forwarded to the development team to evaluate the possibility of updating the API and supporting additional functionalities and data formats. I will inform you shortly about the extent of the request and the progress made. If you agree to proceed, please provide a suitable time window for a telephone conference at <tel_num>.",Change,IT Support,medium,de,400,Feature,Feedback,IT,Tech Support,,,,
Exploring SaaS Features for Project Management and Scalability,"I am interested in learning about the SaaS features that support project management and scalability. Could you provide information on whether the platform is suitable for large projects and teams? I would greatly appreciate details on the tools and features that enable efficient collaboration and task management. Thank you for your assistance, and I look forward to hearing back soon.",I would be happy to provide information on the SaaS features related to project management and scalability. Please allow me to call at your convenience to discuss the details of the tools and features in more depth.,Request,Returns and Exchanges,medium,en,400,Feature,Product,Feedback,,,,,
Issue with Online Engagement,"experiencing a notable decline in online engagement for the brand. The recent modifications in the digital strategy are suspected to be due to incorrect configurations of the tools. Despite reviewing digital campaigns and adjusting target parameters, no visible improvement has been observed. The team has been searching for technical issues on the website and social media platforms, but it seems the situation is under control. Appreciate your support in identifying the cause of the issue and providing suggestions for improvements.","Please refer to the email regarding the issue with online engagement. I understand that the team has already reviewed digital campaigns for technical issues on the website and social media platforms. To investigate the problem further, I would appreciate more specific details on the recent changes in the digital strategy and the decline in online engagement metrics. Could you provide more details about the timeline of the changes and the current engagement metrics? If necessary, we can arrange a call to discuss the issue and provide suggestions for improvements.",Incident,Product Support,high,de,400,Bug,Performance,IT,Tech Support,Feedback,,,
Anfragen zur Einholung von Kundendienst-Anleitungen für die Sicherung medizinischer Daten sowie Rücksichtnehmende Empfehlungen für Figma und Apple Xcode 12.5,"Ich würde gerne Informationen zu besten Praktiken und Sicherheitsmaßnahmen für die Verwaltung vertraulicher medizinischer Daten erhalten. Könnten Sie mir Rücksichtnehmende Empfehlungen für die Nutzung von Figma und Apple Xcode 12.5 zur Verfügung stellen? Ich freue mich auf Ihre Rückmeldung und freue mich darauf, Sie zu einem geeigneten Zeitpunkt kontaktieren zu können, um diese Themen zu besprechen.","Wir können Ihnen Anleitungen zur Sicherung medizinischer Daten und Rücksichtnehmende Empfehlungen für Figma und Apple Xcode 12.5 bereitstellen. Bitte lassen Sie uns zu einem geeigneten Zeitpunkt kontaktieren, um diese Themen zu besprechen.",Request,Returns and Exchanges,medium,de,400,Backup,Security,IT,Tech Support,Documentation,Feedback,,
Probleme mit der Verbindung zu Projektmanagement-SaaS,"Der Benutzer begegnet Verbindungsproblemen beim Projektmanagement-SaaS, was die Produktivität beeinträchtigt und Unkompatibilitätsprobleme verursacht.","Bitte überprüfen Sie die Verbindungsprobleme mit Projektmanagement-SaaS und die Unkompatibilitätsprobleme. Bereitstellen Sie mehr Details wie Umgebung und Fehlernachrichten, damit wir das Problem besser diagnosieren können. Wenn erforderlich, können Sie uns anrufen (+49123456789) und uns das Problem diskutieren. Wir werden Ihnen bald eine Aktualisierung zu den nächsten Schritten senden, um das Problem im Konto <acc_num> zu lösen.",Problem,IT Support,medium,de,400,Network,Performance,Bug,IT,Tech Support,,,
Optimieren des Benutzererlebnisses,"Sehr geehrte Kundensupport, ich möchte um die Verbesserung der Kompatibilität meines Produkts mit verschiedenen Peripheriegeräten und Softwarewerkzeugen unter Ubuntu 22.04 LTS bitten. Die verbesserte Integration und eine effiziente Arbeitsablaufgestaltung könnten die Benutzererfahrung erheblich verbessern und das volle Potenzial des Produkts entfalten. Ich glaube, dass Anpassungen in der Kompatibilität die Kundenzufriedenheit und Loyalität erhöhen können. Ich schätze, wenn Sie meine Anfrage in die zukünftige Produktentwicklung einbeziehen. Bitte geben Sie mir Rückmeldung über die Möglichkeit der Umsetzung der Verbesserungen. Vielen Dank.","Sehr geehrte [Name], vielen Dank für Ihre E-Mail zur Verbesserung des Benutzererlebnisses und der Kompatibilität unter Ubuntu 22.04 LTS. Wir bedanken uns bei Ihnen für Ihre Rückmeldung und werden Ihre Anfrage in die zukünftige Produktentwicklung einbeziehen. Wir werden die Umsetzbarkeit der Verbesserungen prüfen und Ihnen rechtzeitig Rückmeldung geben. Falls Sie weitere Fragen haben, melden Sie sich bitte unter [Telefonnummer]. Vielen Dank für Ihr Verständnis und Ihre Geduld.",Change,Product Support,low,de,400,Feature,Feedback,Product,Performance,Tech Support,,,
Issue mit digitale Plattformen,"bestätige, dass Ausfälle der Schlüsseldigitalplattformen festgestellt wurden. Neue Updates oder Konfigurationsänderungen könnten die Ursache sein. versucht haben, Dienste neu zu starten und Netzwerkverbindungen zu überprüfen, jedoch blieben die Probleme bestehen. Bitte helfen Sie uns, die Angelegenheit so schnell wie möglich zu lösen.","schreibe Ihnen bestätigen, dass das Problem mit den digitalen Plattformen bekannt ist. es tut mir leid, dass Sie Serviceausfälle erleben. verstehe, dass Sie bereits versucht haben, die Dienste neu zu starten und die Netzwerkverbindungen zu überprüfen. weiterhin helfen, wäre es nützlich, wenn Sie weitere Details zu den jüngsten Updates und Konfigurationsänderungen geben könnten, die durchgeführt wurden. Zusätzlich wäre es hilfreich, wenn Sie genaue Fehlermeldungen und Symptome mitteilen könnten, die Sie beobachten. Falls nötig, können wir telefonisch besprechen, wie wir die Angelegenheit lösen können.",Problem,Service Outages and Maintenance,high,de,400,Outage,Network,Performance,IT,Tech Support,,,
Urgent Assistance Required for Data Breach,"A data breach has been identified in the hospital systems, which may have exposed patient medical records. This issue might have arisen from vulnerabilities in the integration of the Oracle Database and Elasticsearch. Despite our efforts to patch the existing software and enhance security protocols, these measures have not been successful. Therefore, it is essential to conduct additional security audits and investigations to ensure the safety of patient data.","Immediate action is required for the urgent data breach concern, especially considering the potential vulnerabilities in the integration of Oracle Database and Elasticsearch. We need more details on the patching and security protocols that have been attempted so far. It would be helpful to discuss this further over the phone at your earliest convenience to determine the next steps and ensure the safety of patient data.",Problem,Product Support,high,en,400,Security,Bug,Performance,IT,Tech Support,,,
