subject,body,answer,type,queue,priority,language,version,tag_1,tag_2,tag_3,tag_4,tag_5,tag_6,tag_7,tag_8
Details for Integrating Smartsheet with Discord for Project Management,"Dear Customer Support, I apologize for the inconvenience. I would like to inquire about integrating Smartsheet with Discord for project management purposes. Could you provide more information on this topic? Specifically, I am interested in the steps required to set up the integration, potential advantages and disadvantages, and any specific requirements or limitations. Additionally, I would appreciate guidance on how to address common issues that may arise during the integration process. Thank you for your time and assistance. I look forward to hearing back soon.","We can provide detailed information on integrating Smartsheet with Discord for project management, including setup instructions, potential benefits, and guidance on resolving common issues. If you're interested, please call us at <tel_num> to discuss further.",Request,Customer Service,low,de,400,Feedback,Feature,Documentation,IT,Tech Support,,,
Scalability Features in Project Management,I am interested in learning about the scalability features available in project management tools. Could you provide information on how the tool manages large projects and teams? I would appreciate detailed insights into features that can be customized to meet specific needs. Thank you for your assistance.,I would be happy to discuss the project management features and scalability options with you. Please provide details on your current project's needs so we can discuss further at a convenient time.,Request,Customer Service,medium,en,400,Feature,Documentation,Feedback,IT,Tech Support,,,
Handling Slow Excel Data Processing,"Customer Support, <br>Our financial institution encounters slow data processing when analyzing investments with Excel, especially with large datasets often surpassing 100,000 rows. This delay might be due to insufficient storage or processor limitations, similar to those found in a Gaming PC. Despite attempts to optimize Excel settings and close unnecessary applications, performance issues persist. <br>Large datasets significantly delay calculations and data visualization. Have already explored initial troubleshooting steps.","{name}, writing to address the concerns regarding slow Excel data processing. To better understand the issue, could you please provide details on your current Gaming PC's specifications, including the processor speed and type of storage? This information will help determine if a hardware upgrade is necessary. In the meantime, I recommend trying to split the large datasets into smaller spreadsheets using Excel's data compression features to improve performance. Looking forward to discussing further.",Problem,Product Support,high,en,400,Performance,Hardware,IT,Tech Support,,,,
Strategies for Expanding Gaming Brands Digitally,Request for insights on effective strategies,"Examine effective digital strategies for growing gaming brands, including social media influencer marketing. Would prefer a convenient call to further explore.",Request,Customer Service,low,en,400,Feedback,Sales,Feature,,,,,
,"geehrte Kundenservice, ich möchte um die Implementierung erweiterten Datenanalysefunktionen bitten, um die Optimierung von Investitionen, die Effizienz und die Qualität der Entscheidungsfindung zu verbessern. Die Entwicklung fortschrittlicher Algorithmen und Modelle zur Analyse von Marktentwicklungen und zur Bereitstellung handlungsorientierter Einsichten ist mein Ziel. Dies soll zur Förderung informierter Entscheidungen und zur Unterstützung des Wachstums und der Geschäftsaktivitäten beitragen. Ich glaube, dass diese Funktion ein wertvoller Beitrag zum Plattformangebot ist. Ich freue mich darauf, bald eine Rückmeldung zu erhalten. Vielen Dank für Ihre Zeit und Ihr Verständnis.","geehrte <name>, vielen Dank, dass Sie sich bei der Anfrage der erweiterten Datenanalysefunktionen gemeldet haben. Wir schätzen Ihre Rückmeldung und suchen stets nach Möglichkeiten, unser Plattformangebot zu verbessern. Die Entwicklung fortschrittlicher Algorithmen und Modelle zur Analyse von Marktentwicklungen und zur Bereitstellung handlungsorientierter Einsichten ist ein interessanter Vorschlag, den wir gerne in Betracht ziehen. Wir möchten gerne eine Vorlage zur Diskussion der spezifischen Anforderungen haben, um Ihre spezifischen Funktionen besser zu verstehen. Könnten Sie bitte mehr Informationen zu den spezifischen Funktionen geben?",Change,Product Support,high,de,400,Feature,Performance,Documentation,,,,,
Optimierung Ihrer Digitalen Marketingstrategien,"Wir möchten unsere digitalen Marketingwerkzeuge und Strategien zur Markenwachstum und Leistungsdatenauswertung aktualisieren, um die Markenpräsenz zu steigern und ein breiteres Publikum zu erreichen. Dies führt zu besseren Leistungen und Wachstum. Bitte teilen Sie uns Ihre spezifischen Bedürfnisse und Ziele mit, damit wir eine individuelle Lösung entwickeln können, die Ihren Geschäftsbedürfnissen entspricht. Wir können Ihnen dabei helfen, aktuelle Systeme zu überprüfen, Verbesserungsbereiche zu identifizieren und neue Werkzeuge und Strategien für die Markenpräsenz zu empfehlen, um ein breiteres Publikum zu erreichen.","Sehr geehrter Kundendeinigen Sie für Ihr Interesse an der Erhöhung Ihrer Markenstrategien und der Leistungsanalyse. Wir empfehlen Ihnen, unsere Beratung zu vereinbaren, um Ihre spezifischen Bedürfnisse und Ziele zu besprechen. Dies ermöglicht es uns, eine individuelle Lösung zu entwickeln, die Ihren Geschäftsbedürfnissen entspricht. Wir können Ihnen helfen, die aktuellen Systeme zu überprüfen, Verbesserungsbereiche zu identifizieren, sowie neue Werkzeuge und Strategien für die Markenpräsenz zu empfehlen, um ein breiteres Publikum zu erreichen. Geben Sie bitte angemessene Zeiten an, um einen Anruf zu vereinbaren und weitere Informationen zu besprechen.",Change,IT Support,medium,de,400,Feedback,Performance,Feature,Documentation,Sales,,,
Handbuch für die Integration von HelloSign,"Betreff: Handbuch für die Integration von HelloSign\n\nSehr geehrte Kundensupport,\n\nich möchte mich mit Ihnen in Bezug auf detaillierte Anwendungshinweise für die Integration von HelloSign in unsere Projektmanagement-Software in Kontakt setzen. Es wäre sehr hilfreich, wenn Sie mir Schritt-für-Schritt-Anweisungen zur Einrichtung der Integration zur Verfügung stellen könnten, einschließlich notwendigen API-Schlüsseln und Authentifizierungsmethoden.\n\nDarüber hinaus wäre es mir sehr wichtig, zu erfahren, ob es spezielle Anforderungen oder Limitationen gibt, die bei der Nutzung von HelloSign Software zu beachten sind.\n\nIch freue mich auf Ihre Unterstützung bei der Durchführung dieser Integration.\n\nBitte informieren Sie mich, falls weitere Informationen erforderlich sind.\n\nVielen Dank für Ihre Zeit.",Der Leitfaden wurde per Rückgabeart E-Mail gesendet.,Request,Customer Service,high,de,400,Documentation,Feature,IT,Tech Support,,,,
,An error has happened during the integration of the Mailchimp project management tool.,We apologize for the issue with integrating the Mailchimp project management tool. Could you please provide more details about the error so we can assist you better?,Incident,Returns and Exchanges,medium,en,400,Bug,Performance,IT,Tech Support,,,,
Message Regarding Service Disruptions,Experiencing service disruptions that are affecting the gaming mouse and Pinnacle Studio 24. Please address the issues and enhance performance.,"Dear [name], thank you for your message. We apologize for any inconvenience caused by the service disruptions affecting the gaming mouse and Pinnacle Studio 24. Our team is working to quickly resolve the issues and improve performance. We will conduct a thorough investigation to identify the cause of the disruptions and implement necessary repairs and updates. In the meantime, we recommend checking our website for the latest service status updates. If you encounter specific error messages, please share them with us.",Change,Service Outages and Maintenance,medium,de,400,Disruption,Performance,Hardware,Tech Support,,,,
Issue with Network Switch,"Facing connectivity stability issues with the TP-Link 16-Port Switch. Recent network load and configuration changes seem to be the cause. The switch has already been reset and cable connections checked, but the problem persists.",Please call <tel_num> to discuss the issue with the TP-Link 16-Port Switch. The next steps will involve identifying the root cause of the connection problems and analyzing the data exchange issues.,Incident,Customer Service,low,de,400,Network,Performance,Disruption,IT,Tech Support,,,
Verbesserung von Investitionsanalyse-Tools für Ubuntu 20.04 LTS,"Ich benötige Unterstützung bei der Optimierung von Investitionsanalyse-Tools für Ubuntu 20.04 LTS. Könnten Sie Anleitungen oder Ressourcen empfehlen, mit denen ich beginnen kann?","Um Investitionsanalyse-Tools für Ubuntu 20.04 LTS zu optimieren, empfehle ich, zunächst Ressourcen und Tutorials auf der offiziellen Ubuntu-Website sowie im Online-Forum zur Investmentanalyse zu erkunden. Für personalisierte Hilfe kann sich die technische Support-Team wenden. Bitte geben Sie mehr Details zu Ihren spezifischen Bedürfnissen und Anforderungen, um präzisere Ratschläge zu erhalten. Wir können einen geeigneten Termin für eine Diskussion vereinbaren.",Request,Technical Support,high,de,400,Feature,Documentation,Feedback,IT,,,,
,"A financial firm is encountering software incompatibility problems following a recent system update. Reinstalling and updating the software may resolve the issue. To help troubleshoot the problem, could you please provide any error messages and specify which software is experiencing compatibility issues? Additionally, knowing your software and operating system versions would be helpful. If needed, we can schedule a call at your convenience to discuss the issue and explore possible solutions. Please let us know.","We apologize for the inconvenience caused by the software incompatibility issues following the recent system update. We understand that reinstalling and updating the software may resolve the issue. To assist in troubleshooting, could you please provide any error messages and specify which software is experiencing compatibility issues? Additionally, knowing your software and operating system versions would be helpful. If needed, we can schedule a call at your convenience to discuss the issue and explore possible solutions. Please let us know.",Incident,Technical Support,medium,en,400,Bug,Performance,IT,Tech Support,Documentation,,,
,"Customer Support, Recently identified inconsistencies in patient billing records. These discrepancies might have occurred due to system glitches or incorrect data entry. After reviewing the billing system logs and verifying patient information, no resolution was found. The issue still persists and requires your assistance to be resolved promptly. Could you please look into this matter and provide a solution to guide us on our next steps? We appreciate your prompt attention to this issue and look forward to your response.","<name>, we are investigating the discrepancies in the patient billing records as reported. To proceed, we need specific details about the issues you are experiencing. Could you please provide examples of the discrepancies and any steps you have taken so far? We can discuss the next steps over the phone at <tel_num> to resolve this issue as soon as possible.",Problem,Billing and Payments,low,en,400,Billing,Bug,Performance,IT,Tech Support,,,
Assistance with Security Breaches,unauthorized access attempts to access medical data have been carried out.,Received an email regarding unauthorized access attempts to access medical data. I will prioritize your request and set it up. Please provide more details about the issue. You can contact us at <tel_num> for further counseling and discussion about the solution.,Problem,Customer Service,medium,de,400,Security,Account,IT,Tech Support,,,,
,"Dear Customer Support, I am inquiring about the API integration capabilities for our project management SaaS. Could you please provide details on the available APIs, their functionality, and any documentation or support resources you offer? It would be greatly appreciated if you could share examples of successful integrations that other customers have implemented. This information will help me better understand the platform and meet our project management needs. Thank you for your assistance. I look forward to hearing from you soon. Regards, [Your Name]",We offer various APIs for integration. Please visit our website for documentation and support resources. We can also send examples of successful integrations and discuss further by calling <tel_num>. ,Request,Technical Support,high,en,400,Documentation,Feature,Feedback,IT,Tech Support,,,
Probleme bei Anwendungsabstürzen,"Es werden gelegentliche Abstürze von Sage Accounting, Duolingo und Datenberichterstellung beobachtet.","Sehr geehrte/r [Name], es tut uns leid, dass Sie gelegentliche Abstürze bei Sage Accounting, Duolingo und Datenberichterstellung erleben. Bitte geben Sie uns mehr Informationen zu den Abstürzen, wie etwa eventuell received Fehlermeldungen oder die Häufigkeit der Abstürze. Dies wird uns helfen, das Problem besser zu verstehen und eine Lösung anzubieten. Wir möchten gerne darüber sprechen und haben gerne einen geeigneten Zeitpunkt für einen Anruf. Bitte lassen Sie uns wissen, wann Ihnen ein Anruf gut passt.",Incident,IT Support,medium,de,400,Bug,Crash,Performance,IT,Tech Support,,,
Data-Issues,"Unjustified variances have been identified in the latest data analysis reports. Although the reports have been recalculated and the data entries re-examined, the issues persist. The recent software updates might be the cause.","We will take steps to investigate the reported data issues. For a thorough investigation, please provide more details on the variances in the analysis reports. Additionally, we will check the recent software updates to determine if they are the cause of the problem and discuss potential solutions with you.",Problem,Product Support,high,de,400,Bug,Performance,IT,Tech Support,,,,
,Facing occasional outages in the project management tool linked to higher server load following a recent update. We are rebooting the servers and checking the database connections to address this problem.,"We are examining the issues with the project management application. Please provide specifics on the intermittent downtime and the recent update that may have caused the increased server load. Additionally, it would be helpful to know any error messages you are seeing in the application. If necessary, we can schedule a call to discuss further. Please let us know a convenient time to reach you at <tel_num> regarding account <acc_num>.",Problem,Technical Support,high,en,400,Outage,Performance,Network,Maintenance,IT,,,
Bekanntmachung Technischer Support,"Sehr geehrte Kundenservice-Abteilung, wir begegnen momentan Störungen in Verbindung mit unserem digitalen Strategie. Diese scheinen auf Probleme bei der Software-Integration hindeuten zu können und könnten durch die neuesten Systemupdates verursacht worden sein. Wir haben versucht, das Problem durch Neustarts der betroffenen Anwendungen und Überprüfung der Kompatibilitätseinstellungen zu lösen, leider ohne Erfolg. Wir wären dankbar für Ihre Ratschläge und Unterstützung bei der Lösung dieses technischen Problems. Bitte teilen Sie uns mit, falls weitere Informationen benötigt werden, um die Lösung des technischen Problems bezüglich der Konto-Nummer <acc_num> voranzubringen.","Für die Prüfung der Software-Integration-Probleme rufen Sie die Nummer <tel_num> an, um die nächsten Schritte zu besprechen. Bitte geben Sie Ihren Verfügbarkeitszeitraum für den Anruf bekannt, um die technische Unterstützung-Anfrage bezüglich der Konto-Nummer <acc_num> so schnell wie möglich zu lösen.",Incident,IT Support,low,de,400,Network,Disruption,Tech Support,Performance,,,,
,"Dear Customer Support, I am writing to report a critical issue with the hospital's systems. There was an unauthorized access attempt that poses a risk to secured medical data. Despite updating the software and conducting security scans, the issue still persists. The potential causes may include outdated security protocols and software vulnerabilities. We kindly request your assistance in resolving this matter as soon as possible to ensure the confidentiality and integrity of the medical data. Please let us know how we can proceed.","We appreciate you bringing this critical issue regarding the unauthorized access attempt on the hospital's systems to our attention. To better assist you, could you please provide us with more details about the security measures that have been taken so far and the specific security protocols currently in use? We would like to schedule a call at the earliest convenience to discuss this further. Please let us know a suitable contact number and preferred time for us to call, as we work together to resolve this matter.",Incident,IT Support,medium,en,400,Security,Bug,Virus,Performance,,,,
Upgrade Software Integrations,Upgrade for a better experience,"Dear <name>, upgrading software integrations will enhance your experience. Please provide us with any assistance information you need regarding this update. We are here to help!",Change,Customer Service,low,en,400,Feature,Feedback,IT,Tech Support,,,,
,"geehrte Kundenservice, es wurde eine mögliche Datensicherheitslücke gemeldet, die Patientendaten im IT-System des Krankenhauses gefährdet haben. Es scheint, dass veraltete Sicherheitsprotokolle und unpatchte Softwarevulnerabilites die Ursache sind. Eine vorläufige Sicherheitsanalyse wurde durchgeführt, und Serverprotokolle wurden geprüft. Allerdings bestehen weiterhin Probleme. Die Lücke wurde durch Routineüberwachungssysteme erkannt, und ungewöhnliche Aktivitäten im Netzwerk wurden festgestellt. Wir sind besorgt über das mögliche Ausmaß der Versorgung der Patienten und setzen uns darum, das Problem zu beheben. Wir schätzen Ihre Hilfe bei der Untersuchung und dem Vorschlag von Maßnahmen zur Vorbeugung ähnlicher Ereignisse.","geehrter [name], wir danken Ihnen für Ihre Anfrage bezüglich der möglichen Datensicherheitslücke im Krankenhaus. Wir nehmen die Bedrohung der Patientendaten im IT-System ernst und möchten Ihnen helfen, ähnliche Ereignisse zukünftig zu erkennen und zu verhindern. Um die Situation besser zu verstehen, könnten Sie uns bitte mehr Informationen zur ungewöhnlichen Netzweraktivität und den relevanten Serverprotokollen und den bisher durchgeführten Sicherheitsanalysen bereitstellen. Wir möchten auch wissen, wann die Sicherheitsprotokolle und die Software zuletzt aktualisiert wurden. Das Expertenteam wird sich um die Untersuchung und die Empfehlungen kümmern.",Problem,Technical Support,high,de,400,Security,Bug,IT,Tech Support,,,,
Sicherung der Klinikdatenbankinfrastruktur,"Sehr geehrte Kundensupport, wir möchten Sie um Ihre Unterstützung bitten, um die Sicherung unserer Klinik-IT-Infrastruktur zu gewährleisten, insbesondere bei der Konfiguration von Oracle Database 19c und MongoDB. Da wir vertrauliche Patientendaten speichern, ist die Sicherheit und Integrität der Informationen von entscheidender Bedeutung. Könnten Sie uns Empfehlungen zur Umsetzung robuster Sicherheitsmaßnahmen für unsere Datenbanken geben? Wir freuen uns auf Rat zur Authentifizierung, Authorisierung und Verschlüsselung sowie auf Vorschläge für spezielle Sicherheitsfunktionen und Tools, die für unsere IT-Infrastruktur geeignet wären? Wir freuen uns darauf, zusammenzuarbeiten.","Sehr geehrter <name>, wir bedanken uns bei Ihnen für Ihre Sorge bezüglich der Sicherung der Klinikdatenbankinfrastruktur. Für Oracle Database 19c und MongoDB empfehlen wir die Umsetzung von robusten Authentifizierungs- und Authorisierungsprotokollen sowie der Verschlüsselung vertraulicher Daten. Es wäre von Vorteil, spezielle Sicherheitsfunktionen und Tools, wie Zugriffskontrolle und Auditing, genauer zu besprechen. Wenn das Telefon <tel_num> für Sie verfügbar ist, könnten wir gerne <acc_num> für die Konfiguration der Sicherheitsmaßnahmen auseinandersetzen und weiterarbeiten.",Request,Technical Support,medium,de,400,Backup,Security,IT,Tech Support,,,,
Concerns about Software Compatibility Issues,"Dear Support Team, a marketing agency is facing delays in campaign execution due to software compatibility problems with their devices. These issues might be caused by outdated software versions or insufficient integration. Despite updating devices and restarting applications, the problems continue to persist. We urgently need your assistance to resolve this matter as soon as possible to avoid further delays. Please provide us with the software versions used on the devices so we can better assist you. Additionally, we would like to schedule a call to discuss the next steps to resolve the issue. I am available to discuss at your convenience. Please let us know a suitable time so we can proceed with troubleshooting and resolving the compatibility problems experienced. Thank you for your prompt attention to this matter.","Dear [Name], we acknowledge your email regarding the software compatibility issues faced by the marketing agency. To better assist you, could you please provide us with the software versions currently in use on the devices? It would also be helpful if we could schedule a call to discuss the next steps to resolve the issue. I am available at your convenience. Please let us know a suitable time so we can proceed with troubleshooting and resolving the compatibility problems being experienced. Thank you for your prompt attention to this matter.",Problem,Customer Service,low,en,400,Bug,Performance,IT,Tech Support,Feedback,,,
Investment Optimization Issue Encountered Today,"There was an error in investment optimization, leading to incorrect analytics results.","Dear <name>, I apologize to hear that you encountered an error in investment optimization with incorrect analytics results. Please provide the details of the error message you received and the steps you took before the issue occurred. I would like to investigate further and it would be convenient to call you at <tel_num> to discuss the issue in detail and find a solution for your account number <acc_num>.",Incident,Returns and Exchanges,high,en,400,Bug,Performance,Feedback,Documentation,,,,
Betreff: Sicherung medizinischer Daten in Microsoft Dynamics 365-Umfeld,"Lieber Kundenservice, bitte informieren Sie mich über Empfehlungen zur Sicherung medizinischer Daten in Microsoft Dynamics 365-Umfeld. Es ist wichtig, dass wir sicher und bewusst sind, wie wir vertrauliche medizinische Informationen schützen. Könnten Sie uns Ressourcen und Protokolle zur Sicherstellung der Vertraulichkeit, Integrität und Verfügbarkeit der medizinischen Daten im System bereitstellen? Wir freuen uns, besser in der Verantwortung für den Schutz kritischer Informationen unterweisen zu können. Vielen Dank für Ihre Unterstützung bei diesem Thema. Ich freue mich darauf, von Ihnen zu hören.","Lieber <name>, danke für Ihre Nachricht. Das Kundenservice-Team wird Ihnen gerne bei der Sicherung medizinischer Daten in Microsoft Dynamics 365-Umfeld helfen. Wir verstehen die Bedeutung des Schutzes vertraulicher medizinischer Informationen und freuen uns, Ihnen bei der Erreichung Ihrer Sicherheitsziele zu unterstützen. Um die Vertraulichkeit, Integrität und Verfügbarkeit der medizinischen Daten sicherzustellen, empfehlen wir die Implementierung von Zugriffssteuerungen, Datenverschlüsselungen und regelmäßigen Backups. Die Nutzung der Microsoft-beförderbaren Sicherheitsfunktionen, einschließlich rollbasiertes Sicherheits- und Datenverlustpräventionspolitiken, wird empfohlen. Für detaillierte Informationen laden wir Sie ein, an einem geplanten Gespräch teilzunehmen. Bitte antworten Sie, wenn Sie bereit sind.",Request,Product Support,high,de,400,Backup,Security,IT,Tech Support,,,,
Query Regarding Campaign Performance Metrics Today,"Our marketing agency has encountered unexpected delays in obtaining campaign performance metrics, which might be due to recent software updates or configuration errors. We have already attempted to update the settings and reanalyze the data and reports.","We are addressing the issue with the campaign performance metrics. To better understand the problem, could you please provide more details on the specific errors and delays you are experiencing? It would be convenient for us to discuss this further via a call. Please let us know a suitable time to reach you at <tel_num> regarding <acc_num>.",Incident,Customer Service,low,en,400,Performance,Bug,Disruption,IT,Tech Support,,,
Unpräzise Berichte zur Verarbeitung von Investment-Daten,Es gibt Unpräzisionen in den Berichten zur Verarbeitung von Investment-Daten. Mögliche Ursachen könnten veraltete Algorithmen sein.,"Wir untersuchen derzeit das Problem mit den Berichten zur Verarbeitung von Investment-Daten. Um die Fehler besser zu verstehen, könnten Sie bitte mehr Details zu den Unpräzisionen geben, die Sie festgestellt haben. Nach der Überprüfung der Algorithmen, um festzustellen, ob sie veraltet sind, vereinbaren wir einen Anruf, falls weitere Diskussionen erforderlich sind.",Problem,Customer Service,low,de,400,Bug,Performance,Feature,Documentation,,,,
