subject,body,answer,type,queue,priority,language,version,tag_1,tag_2,tag_3,tag_4,tag_5,tag_6,tag_7,tag_8
Support for Enhanced Security Protocol Implementation,"Write about the significance of implementing an enhanced security protocol for medical data in hospital IT systems. It is crucial to ensure compliance with regulations to protect patient data from unauthorized access. The security protocols should include measures such as encryption, firewalls, and secure authentication mechanisms. Additionally, regular security audits and staff training should be conducted to prevent data breaches. It is important to prioritize the security of medical data to maintain patient trust and avoid potential legal and financial repercussions.","Dear <name>, thank you for your inquiry regarding the implementation of an enhanced security protocol for medical data in hospital IT systems. We appreciate your comments on this matter. Our team takes the security of patient data very seriously and is constantly working to ensure compliance with regulations to protect patient data from unauthorized access. We have already implemented measures such as encryption and firewalls for the systems. However, we recognize the need for continuous improvement and welcome suggestions for further security measures, including regular security audits and staff training to prevent data breaches.",Change,IT Support,high,de,400,Security,Compliance,IT,Tech Support,,,,
Können weitere Details zu digitalen Marketingstrategien bereitstellen?,Bitte mehr Informationen zu den Dienstleistungen geben.,"Bereit, über digitalen Marketingstrategien zu sprechen. Könnten Sie mehr Details zu den spezifischen Dienstleistungen geben? Freuen uns, einen Anruf zu vereinbaren, der es bequem macht, die Informationen durchzugehen.",Request,Customer Service,low,de,400,Feedback,Documentation,IT,Tech Support,,,,
Assistance Required for GIMP,Is there guidance available on optimizing GIMP for data analytics contexts? Thanks!,I would be glad to assist in optimizing GIMP for data analytics. Please provide more details about your specific needs to better assist in the investment context.,Request,Technical Support,low,en,400,Feedback,IT,Tech Support,Documentation,,,,
Issue with JIRA Project Management System,"Experienced a JIRA System crash while using the project management system. The issue seems to have arisen due to high server load. Restarted the desktop computer and cleared the cache, but the problem persists.","Dear <name>, we are sorry to hear about the JIRA System issues. Thank you for trying to resolve the problem by restarting the computer and clearing the cache. To better assist you, we would appreciate more details, such as the error message, and the exact steps you took before the crash occurred. Additionally, it would be helpful to know the server specifications and the number of active JIRA System users. This information will help us diagnose the problem more effectively.",Incident,IT Support,low,de,400,Crash,Performance,Hardware,IT,Tech Support,,,
Data Retrieval Problems with Elasticsearch 7.13 on Debian 10 Buster,Facing challenges in retrieving data using Elasticsearch 7.13 after upgrading from Debian 10 Buster.,Examine the data retrieval difficulties with Elasticsearch 7.13 on Debian 10 Buster. Contact support for assistance in resolving the issue.,Incident,IT Support,high,en,400,Bug,Performance,IT,Tech Support,,,,
Problems with Loading Project Control Dashboards,"Dear Customer Support, I have encountered issues with loading the Project Control Dashboards. Possible causes include server overload and network delays. I have attempted to clear the server cache and optimize database queries, but the problem persists. Users frequently report delays when viewing the dashboards. I would greatly appreciate your assistance in resolving this issue. Please let me know if you need additional information. I look forward to your prompt response.","Dear [Name], thank you for reporting the issue with loading the Project Control Dashboards. We apologize for the inconvenience and appreciate the troubleshooting steps you have already taken. We would be happy to assist in resolving this problem. To better understand the issue, please provide more details about the error messages and symptoms. Additionally, it would be helpful if you could specify the approximate time when the problem occurs and whether there have been any recent changes to the server or network configuration. We look forward to your prompt response.",Incident,Technical Support,medium,de,400,Performance,Network,Disruption,IT,Tech Support,,,
Financial Guidance,"Dear Customer Service, could you provide comprehensive guidance on optimizing investments, utilizing data analysis for financial insights, and improving overall financial performance for financial institutions? We are interested in using data-based insights to inform investment decisions and enhance our financial performance. Could you share the best practices and tools available in the data analysis sector? We would greatly appreciate it if you could share recommendations and resources. Thank you for your time and support. Kind regards, [Your Name]","Dear [Your Name], thank you for your inquiry regarding optimizing investments and utilizing data analysis for financial insights. We can provide detailed guidance on best practices and tools available in the data analysis sector. For a more detailed discussion, we would like to hear about your specific goals and current data analysis setup. Please let us know if you would like to schedule a meeting to discuss your needs and receive personalized recommendations and resources to support your investment decisions. We look forward to hearing from you. Kind regards, [Customer Service Team]",Request,Billing and Payments,low,de,400,Feedback,Sales,Documentation,IT,,,,
Support Required for Hadoop Integration Problem,"An error has occurred during the integration, leading to data discrepancies.",We are reviewing the Hadoop integration issue. Please provide details of the error message for assistance in resolving the data discrepancies.,Incident,Returns and Exchanges,low,en,400,Bug,Performance,IT,Tech Support,,,,
Problem Bericht: Gipfel Nutzungstage,"Während des Gipfel Nutzungstage wurde eine steigende Systemlatenz beobachtet. Es wurden unoptimierte Datenbankabfragen identifiziert, die die Problematik beeinträchtigen. Durch die Skalierung der Ressourcen und das Leeren der Caches wurde eine Verbesserung erreicht. Wir bedanken uns für Ihre Hilfe bei der Lösung des Problems.","Wir möchten Ihnen für das gemeldete Problem, der Systemlatenz während der Gipfel Nutzungstage, danken. Um den Ursprung des Problems besser zu verstehen, bitten wir Sie, uns zusätzliche Informationen zur Datenbankabfrage zu geben, einschließlich der spezifischen Schritte, die bereits unternommen wurden, wie z.B. die Skalierung der Ressourcen und das Leeren der Caches. Darüber hinaus wäre es schön, wenn wir uns telefonisch verbinden könnten, um die Lösung des Problems zu besprechen. Bitte geben Sie an, wann Sie verfügbar sind, damit wir den richtigen Zeitpunkt für das Gespräch bestimmen können. Sie können uns anrufen unter <tel_num>. Dies wird uns helfen, einen geeigneten Lösungsansatz zu finden.",Incident,IT Support,high,de,400,Performance,Bug,IT,Tech Support,,,,
Verbesserung der Sicherheit in Medikamentendaten-Systemen,"Ich schreibe, um die Verbesserung der Sicherheitsprotokolle für die zugehörige IT-Infrastruktur von Medizindaten in der Gesundheitsbranche anzufordern. Es ist entscheidend, dass vertrauliche Patientendaten geschützt und potentielle Datensperrungen verhindert werden. Ich schätze, dass die Angelegenheit dringend behandelt und die notwendigen Maßnahmen ergreift, um die Sicherheit medizinischer Daten zu gewährleisten.","Die Anfrage zur Verbesserung der Sicherheitsprotokolle für medizinische Daten-Systeme wird entgegengenommen. Die erforderlichen Maßnahmen werden unterprüft und ergriffen, um vertrauliche Patientendaten zu schützen und Datensperrungen zu verhindern.",Change,Customer Service,high,de,400,Security,Performance,IT,Tech Support,,,,
Feedback on Delayed Load Speeds Noted,"Customers reporting sluggish load times while using the project dashboard. This might be related to heightened server traffic. Steps like clearing the cache and optimizing database queries have been taken, but the problem remains unresolved. We request a prompt investigation to address this and enhance user satisfaction.","Acknowledged the email about the delayed load speeds on the project dashboard. Recognize that cache has been cleared and database queries optimized. Need to investigate further. Specifically, would appreciate details on the average server traffic and the exact load times experienced by users. Kindly furnish this information or we can discuss further by calling <tel_num> to assist in resolving the issue quickly.",Problem,Product Support,low,en,400,Performance,Feedback,Bug,IT,Tech Support,,,
Integration with Discord,Inquiring about integrating Discord for project management SaaS to improve team collaboration. Could you provide guidance on the features available and the benefits of using Discord for team collaboration in project management? I would like to know the specific requirements and steps needed to integrate Discord SaaS. Please let me know.,"Thank you for your interest in integrating Discord for enhanced team collaboration in project management SaaS. To set up the integration, navigate to the integrations section within the SaaS and select Discord from the available integrations list. You will be prompted to authorize the connection and configure settings to suit your needs. The Discord integration offers several features, including real-time chat notifications and automated updates, which keep the team informed. Using Discord for team collaboration can enhance the project management experience.",Request,Customer Service,high,en,400,Feature,Documentation,Feedback,IT,,,,
Request for Guidance on Optimizing Digital Strategies and Evernote ClickUp Integration,"I am looking for assistance in optimizing my digital strategies and integrating Evernote with ClickUp. I need help in streamlining my workflow to increase productivity. Could you provide guidance on this? To better assist you, could you please share the current tools you are using and any specific challenges you are facing? This will enable me to offer tailored advice on how to streamline your workflow. Additionally, I would like to offer some general tips on how to integrate these tools effectively, including setting up automated workflows using templates. I prefer to discuss this over the phone, so please let me know a convenient time.","I would be happy to help optimize your digital strategies and Evernote ClickUp integration to increase productivity. To better understand your current workflow, could you please provide information on the tools you are currently using and any specific challenges you are facing? This will enable me to provide tailored guidance on streamlining your workflow. Additionally, I would like to offer some general tips on how to integrate these tools effectively, including setting up automated workflows using templates. I prefer to discuss this over the phone, so please let me know a convenient time.",Request,Technical Support,high,en,400,Feedback,IT,Tech Support,Performance,Feature,,,
Assistance with Sluggish Operation,"The investment optimization tool is experiencing slow data analytics performance. After updating Ruby on Rails and reviewing Kubernetes resource allocation, the issue remains unresolved.","We are looking into the issue with the investment optimization tool. To better understand the problem, could you please provide details on the specific instances of slowness, any error messages encountered, and the exact actions that led to these issues? Additionally, it would be helpful to know the current versions of Ruby on Rails and Kubernetes you are using. We would like to schedule a call to discuss this further; please let us know your availability for a call at <tel_num> to investigate the issue.",Incident,IT Support,medium,en,400,Performance,IT,Tech Support,,,,,
Enhancements for Data Analytics Tools,"I reached out to customer support to request improvements in data analytics tools for better investment optimization strategies and performance tracking. The current tools lack the level of detail needed to make informed decisions. I am particularly interested in advanced features such as predictive analytics and machine learning capabilities, which would allow us to better track performance and make data-driven decisions. I believe these enhancements would greatly benefit our business.",Thank you for reaching out to our support team regarding enhancements to the data analytics tools. We appreciate your feedback and are interested in learning more about the specific features you would like to see. Please provide details on the predictive analytics and machine learning capabilities you are looking for. We will review your request and discuss possible solutions with our development team. Please contact <tel_num> to discuss this matter further.,Change,Technical Support,low,en,400,Feature,Performance,Feedback,Documentation,,,,
Refresh Digital Growth Strategy,"Dear Customer Support, I am writing to request the creation and updating of our digital strategy offerings. We wish to take an offensive approach to market growth and improve customer satisfaction metrics. Our current strategy has been in place for some time, and we believe it is important to reassess and revamp our approaches to remain competitive in the market. We are eager to explore new innovative paths and enhance customer interaction. The update should include the optimization of our website, social media presence, and content marketing efforts. We are grateful for your support and look forward to discussing the implementation of these measures to boost customer satisfaction metrics.","Dear [Name], Thank you for reaching out to our Customer Service Team regarding the update of your digital growth strategy. We appreciate your engagement in improving market growth and customer satisfaction metrics. To better understand your requirements, could you please provide more detailed information about your current digital strategy in specific areas? We are looking forward to discussing the appropriate time for our follow-up call to discuss how we can address your needs and find new innovative ways to engage with your customers. Please provide a suitable time.",Change,Product Support,medium,de,400,Feedback,Sales,IT,Tech Support,,,,
Message Generated,Software Update for Data Analysis Tool. Reporting Process Suspended.,Error with Data Analysis Tool. Please call <tel_num> to investigate and proceed to resolve the reporting issue.,Incident,Technical Support,medium,de,400,Feature,Documentation,IT,,,,,
Report on Unforeseen Software Halts,"I am encountering unanticipated halts in Adobe Audition and Skype following the latest software updates. Even after reinstallation and ensuring all system updates are current, the issue continues to recur. I have attempted various troubleshooting steps, but the problem still persists. I would greatly appreciate assistance to resolve this issue and avoid further disruptions.","I would be pleased to help with the software crash issue. Please provide details of any system error messages you are receiving, as this will assist in providing better support.",Incident,IT Support,high,en,400,Bug,Performance,Disruption,IT,Tech Support,,,
Optimieren Benutzerrechte-Einstellungen,"bitte, Verbesserung Benutzerrechte-Einstellungen für den Projektmanagement-Cloud-Dienst einleiten. Ziel ist, Projektkollaboration und Sicherheit erheblich zu verbessern, indem spezifische Rollen zugewiesen und Risiko autorisierten Zugriffe reduziert werden. Einfache Überwachungsprozesse und Updates erleichtern die Projektverwaltung. Ich glaube, diese Verbesserungen könnten die Produktivität des Teams enorm fördern.","gehrte <name>, danke für Ihre E-Mail im Zusammenhang mit der Verbesserung der Benutzerrechte-Einstellungen für den Projektmanagement-Cloud-Dienst. Ihr Feedback verstehen und die Vorteile für die Projektkollaboration und die Sicherheit zu schätzen. Die Anfrage wird in die zukünftige Entwicklung einbeziehen. Lassen Sie uns besprechen, wann es Ihnen gelegen kommt, um ein Telefonat zu vereinbaren. Bald werden wir Sie über den Stand Ihrer Anfrage informieren.",Change,Customer Service,medium,de,400,Feature,Security,IT,Tech Support,,,,
,"Customer Support, we are writing to request an enhancement in the integration features for our project management SaaS platform. Currently, the integration capabilities are limited, leading to a lack of seamless compatibility with our existing products, which has resulted in inefficiencies and additional workload for our team. We would like to request that you consider expanding the integration features to include better compatibility with our existing products. This would greatly improve our workflow and overall user experience. We would appreciate it if you could look into this matter and provide a suitable solution.","<name>, thank you for reaching out to us regarding the request to enhance the integration features for our project management SaaS platform. We apologize for the inefficiencies and additional workload caused by the limited compatibility with your existing products. Could you please provide us with more specific information about the integration features you are looking for and the products you are currently using? This will help us better understand your needs and provide a suitable solution. We will review your request and get back to you shortly.",Change,Product Support,high,en,400,Feature,Product,Feedback,Performance,IT,,,
Improve Digital Marketing Tools,We are requesting to integrate improved marketing tools to enhance the effectiveness of our digital strategy across various platforms. We aim to better manage our online presence and improve our overall marketing performance.,"Dear [Name], thank you for reaching out to us regarding the integration of marketing tools to enhance the effectiveness of your digital strategy. We appreciate your interest in improving your online presence and overall marketing performance. To better understand your specific requirements, could you please provide information on the marketing tools and platforms you are currently using? This will enable us to assess and recommend appropriate integration options for your business. If this is convenient for you, we can schedule a call at [Phone Number] to discuss further. Please let us know a time that works for you.",Change,Technical Support,high,en,400,Feedback,Product,Feature,Performance,Sales,,,
Occasional Login Issues in Project Management System Noted,"Customers are facing occasional login difficulties. The problem could be related to higher server activity during peak times. Resetting users' passwords and clearing their browser cache might help. If the issue continues, a deeper investigation is needed to find the cause.",Acknowledged the email about occasional login issues with the project management system. Suggest scheduling a call at your convenience to discuss the issue in detail. Please inform me of a suitable time for the call at <tel_num> to move forward with resolving the problem.,Problem,Customer Service,medium,en,400,Login,Performance,Network,IT,Tech Support,,,
Support for Critical Issue,We encountered a critical disruption affecting multiple data analysis services. The latest Elasticsearch updates might be the cause. We have attempted to resolve the issue by restarting affected applications and checking server configurations. Please assist us in resolving the problem quickly to minimize disruption to investment optimization efforts.,Please investigate the effects of the Elasticsearch updates on the data analysis services and provide any detailed error messages to assist further.,Incident,Technical Support,high,de,400,Disruption,Performance,IT,Tech Support,,,,
Unaddressed Unauthorized Access Alerts in Medical Data Systems,"Experienced unauthorized access alerts in medical data systems due to outdated software and weak passwords. Software has been updated and password policies reinforced, but the issue still persists.","Given the ongoing unauthorized access alerts, please schedule a call at <tel_num> at your earliest convenience to discuss and determine the next steps to resolve the issue. This concern pertains to account <acc_num>.",Problem,Technical Support,medium,en,400,Security,Alert,Bug,Performance,IT,,,
,"Lieber Kundensupport, ich schreibe, um nachzufragen, ob Sie Details zur Integration von TensorFlow in unsere Projektmanagement-Software bereitstellen können. Ich wäre sehr dankbar, wenn Sie mir Informationen zur Einrichtung und dem Start der Integration sowie den Vorteilen und Einschränkungen bei der Nutzung der TensorFlow-Software geben könnten. Vielen Dank für Ihre Unterstützung und ich freue mich darauf, bald von Ihnen zu hören.","Lieber [Name], vielen Dank für Ihr Interesse an der Integration von TensorFlow in unsere Projektmanagement-Software. Wir bieten eine Integration von TensorFlow an, die Benutzern ermöglicht, maschinelles Lernvermögen in ihr Projektmanagement-Erlebnis einzubinden. Um den Start zu beginnen, empfehlen wir Ihnen, unsere Online-Leitfäden und Tutorials zu prüfen, die Schritt-für-Schritt-Anleitungen zur Einrichtung und Nutzung der Integration enthalten. Die Ressourcen können auf unserer Website im Bereich Support gefunden werden. Die Vorteile der Nutzung der TensorFlow-Software umfassen erweiterte Prognoseanalyse und automatisierte Aufgabenmanagement. Beachten Sie jedoch, dass die spezifischen Einschränkungen je nach Anwendung variieren können.",Request,Returns and Exchanges,medium,de,400,Feature,Documentation,Feedback,Tech Support,,,,
Wachstum der Digitalen Marke,Könnten weitere Details liefern?,"Rufen Sie <tel_num> an, um die Details zum Thema Digitaler Marke zu besprechen.",Request,Sales and Pre-Sales,low,de,400,Feedback,Product,Feature,,,,,
Issues with Data Analysis,"Unforeseen data system events have been identified during the analysis of investment forecasts in Excel. These issues are believed to be due to erroneous data inputs. After comparing the data sources using Google Translate and DeepL, the problems persist. I would appreciate your assistance in finding a solution to these issues.",I am pleased to assist with your data analysis. Please provide more details on the discrepancies observed and the steps you have taken so far. You can contact me at <tel_num> to discuss further.,Problem,Product Support,high,de,400,Bug,Performance,IT,Tech Support,,,,
Initiate return of multiple products due to compatibility issues,I am requesting to initiate the return of multiple software and hardware products due to compatibility issues.,"We can assist with the return of your software and hardware products. Please provide a list of your order details and the products you wish to return, along with any instructions needed to complete the return process.",Change,Returns and Exchanges,medium,en,400,Return,Replacement,Product,Hardware,Software,,,
Bestätigung Supportanfrage autorisierten Zugriff Krankenhaus-IT-Systeme,"Wir bestätigen die Supportanfrage zur Erkennung eines autorisierten Zugriffs auf die IT-Systeme des Krankenhauses. Wir nehmen diese Angelegenheit ernst und möchten Ihnen helfen, das Problem zu untersuchen und zu lösen. Um die Situation besser zu verstehen, bitten wir Sie, uns über die potenziellen Schwachstellen von Notion und Squarespace zu informieren, die möglicherweise identifiziert wurden. Wir sind auch bereit, die durchgeführten Zugriffsschichten zu überprüfen. Spezialisten werden eingesetzt, um zusammenzuarbeiten und Sicherheitsrisiken anzugehen und Vorschläge zu machen, um zukünftige Vorfälle zu verhindern. Möglicherweise könnten wir telefonisch treffen, um diese Punkte zu besprechen.","Wir schreiben Ihnen, um Ihnen zu bestätigen, dass wir Ihre Anfrage zur Unterstützung des Krankenhausauftritts und des autorisierten Zugriffs auf die IT-Systeme erhalten haben. Wir nehmen diese Angelegenheit sehr ernst und möchten Ihnen helfen, das Problem zu untersuchen und zu lösen. Um die Situation besser zu verstehen, bitten wir Sie, uns über die potenziellen Schwachstellen von Notion und Squarespace zu informieren, die möglicherweise identifiziert wurden. Wir sind auch bereit, die durchgeführten Zugriffsschichten zu überprüfen. Spezialisten werden eingesetzt, um zusammenzuarbeiten und Sicherheitsrisiken anzugehen und Vorschläge zu machen, um zukünftige Vorfälle zu verhindern. Möglicherweise könnten wir telefonisch treffen, um diese Punkte zu besprechen.",Incident,Technical Support,medium,de,400,Security,IT,Tech Support,Performance,,,,
Secure Medical Data in PostgreSQL 13,Is it possible to get details on securing medical data using PostgreSQL 13 in hospital settings? I am keen to learn about the best practices for protecting sensitive patient information and ensuring compliance with regulations. Could you share the key considerations for securing medical data in a hospital environment?,"I can provide general information on securing medical data with PostgreSQL 13. Key considerations include data encryption, access controls, and regular audits. For specific guidance tailored to a hospital environment, we could schedule a call at your convenience. Please let me know a suitable time.",Request,Customer Service,medium,en,400,Security,Compliance,Documentation,IT,Tech Support,,,
