subject,body,answer,type,queue,priority,language,version,tag_1,tag_2,tag_3,tag_4,tag_5,tag_6,tag_7,tag_8
Besorgnis um die Digitalen Wachstumsstrategien,"Die Agentur hat digitale Strategien entwickelt, um das Markenwachstum zu fördern; jedoch scheint dies aufgrund uneffizienter Zielgruppensegmentierung und überholter Taktiken nicht optimal zu funktionieren. Mehrere Kampagnen wurden gestartet, jedoch blieb das Engagement niedrig; durch Anpassungen der Herangehensweise konnte das Engagement jedoch verbessert werden. Da die Fortschrittsmäßigkeit fehlt, möchte die Agentur die aktuelle Strategie überprüfen, um Bereiche zur Verbesserung zu identifizieren. Es wird empfohlen, die Zielgruppensegmentierung und Taktiken zu überprüfen, um den Bedürfnissen und dem Markenimage besser zuzuordnen. Ich freue mich darauf, den Lösungsansatz zusammenzuarbeiten.","Sehr geehrte [Name],\n\nich teile Ihre Bedenken bezüglich der mangelnden Fortschrittsmäßigkeit der digitalen Strategien, die zur Markenentwicklung beitragen sollen. Ich schätze Ihre aktive Anfrage, um unsere aktuelle Strategie zu überprüfen und Bereiche zur Verbesserung zu identifizieren. Um die Situation besser zu verstehen und effektive Lösungen anzubieten, benötigen wir zusätzliche Informationen. Könnten Sie bitte mehr Details zu den durchgeführten Kampagnen geben, einschließlich der Segmentierung und Taktiken, die verwendet wurden, sowie den Metriken, die das Engagement gemessen haben? Das hilft uns, eine präzisere Einschätzung zu gewinnen.\n\nMit freundlichen Grüßen,\n[Ihr Name]",Problem,Customer Service,low,de,52,Marketing,Strategy,Digital Marketing,Brand Growth,Campaign Performance,Customer Engagement,,
Bericht über Systemaktualisierungsprobleme im Finanzunternehmen,"Das Finanzunternehmen hat mehrere Produktausfälle erlebt, wodurch die Investmentanalyse beeinträchtigt wurde. Mögliche Ursache sind Konflikte durch Systemupdates. Es wurden Neustarts und Diagnosen versucht. Das technische Team des Unternehmens arbeitet an der Behebung des Problems, jedoch besteht das Problem weiterhin. Die Ausfälle haben zu erheblichen Verlusten bei Kunden und im Unternehmen geführt, weshalb eine schnelle Lösung erforderlich ist, um weitere Verluste zu vermeiden. Das technische Team bemüht sich, die Ursache zu identifizieren, was aufgrund der Systemkomplexität schwierig ist. Das Unternehmen erwägt die Hinzuziehung externer Experten.","Wir haben eine E-Mail bezüglich der Probleme mit der Systemaktualisierung erhalten und möchten diese gerne besprechen. Bitte teilen Sie uns eine passende Zeit mit, wann <tel_num> anrufen kann, um die nächsten Schritte zur schnellen Lösung des Problems <acc_num> zu besprechen.",Incident,Service Outages and Maintenance,high,de,52,Performance,Outage,Disruption,Recovery,IT,Tech Support,,
Investment Report Submission Postponed as of Today,"The client is facing a delay in receiving investment analytics reports, potentially due to data processing overload. This issue affects the functionality of the product. Attempts to restart the analytics servers have been unsuccessful. Assistance is required to resolve this problem.","Please investigate the matter by contacting <tel_num>, discuss possible resolution strategies, and provide an appropriate solution to the delayed investment reports.",Incident,Technical Support,low,en,52,Performance,Outage,Disruption,Recovery,IT,Tech Support,,
Unauthorized Access to Healthcare Systems,A security breach has jeopardized patient information. Problems continue to occur.,Currently examining the situation without delay.,Incident,Technical Support,high,en,52,Security,Outage,Disruption,,,,,
Report on SaaS Platform Outage,"The SaaS platform encountered an unexpected outage that impacted user access. The issue is suspected to be due to server overload or a software bug. Restarting the servers cleared the cache, but the problem continues to persist. Further investigation is necessary to resolve the issue. Assistance in resolving this issue as soon as possible is requested.",Thank you for your report and for bearing with the inconvenience. Our team will investigate the issue to determine the root cause and implement a solution. We will notify you of the update and resolution as soon as possible to restore access to the SaaS platform.,Problem,Customer Service,medium,en,52,Outage,Disruption,Performance,Bug,Security,,,
Guidelines for Protecting Patient Information,"Drafting a request for best practices to safeguard patient data utilizing Firebase and Kaspersky Internet Security. Could you offer details on how to establish strong security protocols to shield sensitive patient information? I would be grateful for suggestions and resources that can help ensure the confidentiality, integrity, and availability of patient data.","<name> appreciates your concern regarding the protection of patient information and is glad to provide guidance on safeguarding sensitive data with Firebase and Kaspersky Internet Security. Implementing comprehensive security measures is crucial and should involve a layered strategy, including data encryption, authentication, and access controls. It is recommended to leverage Firebase's built-in security features, such as Firebase Authentication and Firebase Security Rules, to regulate access to patient data. Furthermore, enabling additional security measures...",Request,IT Support,high,en,52,Security,Confidentiality,Data Privacy,IT,Policy,,,
Benötigte Anleitung zur Shopware-Spotify-Integration,"Sehr geehrter Kundenservice, ich möchte mich erkundigen, ob die Integration von Shopware mit Spotify für die Umsetzung digitaler Marketingkampagnen möglich ist. Unser Unternehmen möchte die Vorteile beider Plattformen nutzen, um nahtlose und ansprechende Kundenerlebnisse zu schaffen. Ich bin der Überzeugung, dass die Integration unsere Marketingbemühungen verbessern und es uns ermöglichen könnte, eine größere Zielgruppe zu erreichen. Allerdings bin ich unsicher, welcher Ansatz am besten geeignet ist und würde eine Anleitung sehr schätzen. Können Sie bitte Informationen zu den verfügbaren Integrationsmöglichkeiten, APIs, Plugins sowie die notwendigen Schritte für den Einstieg bereitstellen?","Sehr geehrter <Name>, vielen Dank, dass Sie sich bezüglich der Integration von Shopware mit Spotify für Ihre digitalen Marketingkampagnen an unseren Kundenservice gewandt haben. Um Ihnen bestmöglich zu helfen, erläutern wir die verfügbaren Integrationsmöglichkeiten, APIs, Plugins und die erforderlichen Schritte für den Einstieg. Wir können auch Informationen zur Synchronisierung des Produktkatalogs mit Spotifys Werbeplattform sowie zur Verfolgung der Kampagnenleistung bereitstellen. Falls gewünscht, vereinbaren wir gern einen Telefontermin unter <tel_num>, um weitere Details zu besprechen und Ihre Fragen zu beantworten. Alternativ können Sie uns auch einen passenden Zeitpunkt nennen.",Request,Product Support,low,de,52,Documentation,Feature,IT,Tech Support,,,,
Brand Expansion Challenge,The report indicates inconsistent growth of the brand despite implementing digital strategies. Attempts to modify advertising channels and messaging have not yielded significant improvements. Potential reasons for this issue may include misaligned targeting or improper utilization of platforms. We would greatly appreciate your assistance in identifying the underlying cause and providing guidance to better align our targeting and platform usage to achieve our brand growth objectives. Please let us know if you need any additional information.,"We are happy to assist with the brand expansion challenge. To better support you, please share details about your current digital strategies and targeting approaches. We will review this information and schedule a call at <tel_num> to discuss potential solutions and next steps for improvement.",Problem,Customer Service,medium,en,52,Marketing,Strategy,Brand Expansion,Digital,Advertising,Performance,Optimization,
Software Conflicts in Marketing Agency,"Sehr geehrter Kundenservice, ich möchte mehrere Produktprobleme melden, die den Arbeitsprozess unserer Marketingagentur beeinträchtigen. Es scheint, dass Softwareinkompatibilitäten oder mögliche Malware-Infektionen die Ursachen sind. Unser Team hat versucht, die betroffene Software neu zu installieren und vollständige Systemscans durchzuführen, jedoch waren diese Maßnahmen erfolglos. Die Konflikte verursachen erhebliche Störungen im Betrieb, und wir benötigen dringend Unterstützung, um das Problem zu beheben. Wir würden eine Anleitung zur Unterstützung schätzen, um die Ursachen zu identifizieren und eine Lösung umzusetzen. Bitte informieren Sie uns darüber.","Sehr geehrter <name>, es tut uns leid zu hören, dass bei Ihrer Marketingagentur Softwarekonflikte auftreten. Wir möchten Ihnen bei der Lösung des Problems helfen. Um das Problem besser zu verstehen, könnten Sie bitte weitere Details zu den beteiligten Programmen und den genauen Fehlern, die Sie erleben, bereitstellen? Es wäre auch hilfreich, die relevanten technischen Spezifikationen Ihres Betriebssystems zu kennen. Sie können uns die Informationen unter <tel_num> zukommen lassen, damit wir die nächsten Schritte besprechen und eine Lösung finden können, damit Ihr Arbeitsablauf schnellstmöglich wieder reibungslos läuft.",Problem,Product Support,high,de,52,Bug,Security,Malware,Software,Performance,,,
Unterstützung bei fehlerhaften Integrationen,"Mehrere Integrationen scheitern sporadisch, möglicherweise infolge jüngster API-Änderungen. Ich habe versucht, Dienste neu zu starten und die Protokolle zu prüfen, konnte jedoch keine Lösung finden.","<name>, hier, um bei den Problemen mit fehlerhaften Integrationen zu helfen. Um das Problem besser zu verstehen, könnten Sie bitte weitere Details zu den kürzlichen API-Änderungen sowie Fehlermeldungen und Protokolle bereitstellen? Es wäre auch hilfreich, die spezifischen Integrationen zu kennen, die fehlschlagen. Sie können einen Termin unter <tel_num> vereinbaren, um die Angelegenheit zu besprechen und eine Lösung bei <acc_num> zu erarbeiten. Bitte teilen Sie uns eine passende Zeit mit.",Incident,Technical Support,medium,de,52,Bug,Integration,Performance,Outage,,,,
Problem with Data Access,"A healthcare provider encountered data access problems that affected medical data security. This issue is suspected to be due to recent system updates. After restarting the affected servers and reviewing firewall settings, the problem still exists.","We are investigating the data access issue you reported. To proceed, we need details on any error messages you are receiving since the recent system updates. Please provide more information about the issue. We will schedule a call to discuss the resolution. Please let us know a convenient time to call at <tel_num> regarding account <acc_num>.",Problem,Product Support,low,en,52,Security,IT,Tech Support,Outage,,,,
Issue with Digital Marketing Agency Report,"Drafting a report on the digital strategies of the marketing agency, currently facing service disruptions across several products. These outages are probably caused by errors in platform integration. Initial troubleshooting steps such as rebooting systems and clearing caches have been attempted, but the problems continue. Efforts to identify the root cause have so far been unsuccessful. We would greatly appreciate your assistance in resolving this issue as soon as possible. Please keep us informed.","We have received your email regarding service disruptions across multiple products caused by platform integration errors. We would like to help resolve this issue. Could you please provide the specific error messages and details about the affected products? If necessary, we may need to arrange a call to discuss the matter further. Kindly let us know a convenient time for the call.",Incident,Service Outages and Maintenance,medium,en,52,Disruption,Outage,Performance,IT,Tech Support,,,
Digital strategies implemented by the marketing agency are leading to technical problems across various products,Integration errors have resulted in technical difficulties. Troubleshooting steps included partial resets and diagnostic procedures.,"We received an email concerning technical problems caused by the marketing agency's digital strategies. Kindly provide detailed information about the issues so we can assist further. For additional support, please call <tel_num> to discuss the matter.",Problem,Technical Support,high,en,52,Bug,Technical Support,Disruption,Troubleshooting,,,,
Support Request for Docker,Can you supply the technical specifications and integration options for Docker 20.10 with PostgreSQL 13 in a SaaS environment?,Please provide the technical specifications and integration options for Docker 20.10 with PostgreSQL 13 in SaaS. We will send a follow-up email with the details.,Request,IT Support,high,en,52,IT,Tech Support,Docker,Integration,Environment,,,
