subject,body,answer,type,queue,priority,language,version,tag_1,tag_2,tag_3,tag_4,tag_5,tag_6,tag_7,tag_8
Finanzunterstützungsteam,"Kontaktieren Sie uns, um Ratschläge und Ressourcen für die Optimierung Ihrer Investitionen mit dem Einsatz von Datenanalysewerkzeugen zu erhalten. Wären Sie bereit, um den Bereich zu beginnen? Ich freue mich darauf, Ihnen Informationen zu Datenanalysewerkzeugen und deren Nutzung in Investitionsentscheidungen zu liefern.","Wir bieten allgemeine Informationen zur Nutzung von Datenanalysewerkzeugen für die Optimierung von Investitionen. Wir können Ihnen Ressourcen zur Verfügung stellen, um den Bereich zu beginnen. Ich wäre gerne bereit, das Thema zu besprechen. Eine Telefonkonferenz könnte für eine vertiefte Diskussion des Themas verfügbar sein?",Request,Technical Support,medium,de,400,Feedback,Performance,Feature,Documentation,,,,
Problem mit ständigem Software-Crash bei Smartsheet unter hoher Projektlast,"Beim Einsatz von Smartsheet unter hoher Projektlast tritt ein konstanter Software-Crash auf. Dies deutet auf ein mangelndes GPU-Berechnungsleistungsvermögen des AMD Radeon RX 6800 XT hin. Es wurde bereits versucht, die Software-Treiber zu aktualisieren und die Systemressourcen zu überprüfen, und es wurde versucht, die Speicherallokation mit Kubernetes zu optimieren.","Sehr geehrte(r) <name>, Sie erleben einen Software-Crash unter hoher Projektlast bei Smartsheet und möchten dies beheben. Sie haben bereits verschiedene Schritte unternommen, um das Problem zu beheben, darunter die Aktualisierung der Software-Treiber und die Überprüfung der Systemressourcen. Um das Problem weiter zu untersuchen, benötigen wir spezifische Informationen zur Systemkonfiguration und spezifische Fehlermeldungen. Könnten Sie bitte genaue Details des Crashes, etwa Fehlermeldungen oder Protokolle, mitteilen, die generiert wurden? Darüber hinaus möchten wir das Problem telefonisch besprechen. Sollten Sie damit einverstanden sein.",Problem,Technical Support,high,de,400,Bug,Crash,Performance,Hardware,IT,Tech Support,,
Problem with Campaign Tools,"Despite recent software updates, the digital marketing campaign tools are not updating performance metrics correctly. We have already cleared caches and restarted systems, but the issue still persists.",We are investigating the problem with the digital marketing campaign tools not updating performance metrics correctly. Could you please provide more details on the recent software upgrades and the exact metrics that are not updating? We would like to schedule a call at your convenience to discuss the work and find a resolution. Please let us know a suitable time to call at <tel_num> for further troubleshooting and to find a solution for the campaign issue.,Problem,IT Support,high,en,400,Bug,Performance,IT,Tech Support,,,,
,"Dear Customer Support, our agency is facing connectivity issues with digital tools, which might be due to recent software updates conflicting with hardware settings. Despite rebooting the router and devices, the issue still persists. We urgently need your assistance to resolve this issue as soon as possible to minimize disruptions to our operations. Please provide guidance on the next steps we should take. We appreciate your prompt attention to this matter and look forward to hearing from you soon.","<name>, we are here to assist with the connectivity issues affecting your digital tools. To better troubleshoot the problem, could you please provide details on the recent software updates and hardware settings? We will call <tel_num> to discuss and guide you on the next steps to resolve the issue as soon as possible.",Incident,Technical Support,medium,en,400,Network,Performance,Disruption,IT,Tech Support,,,
Langsame Leistung bei mehreren Softwareanwendungen gemeldet,"Heute meldeten sich viele Softwareanwendungen auf langsame Leistung. Es könnte konfliktierende Updates und mangelnde Systemressourcen dahinterstecken. Bitte versuchen, die Anwendungen neu zu starten, um die Ressourcen zu optimieren. Allerdings behält das Problem nach wie vor bestand.","Wir werden das langsame Leistungsmanko untersuchen, das bei mehreren Softwareanwendungen gemeldet wurde. Um Ihnen besser zu helfen, bitten wir Sie, mehr Informationen über die installierten Updates und die verfügbaren Systemressourcen bereitzustellen. Falls weitere Informationen erforderlich sind, wäre ich Ihnen dankbar, wenn Sie telefonisch eine weitere Beratung vereinbaren könnten.",Incident,Customer Service,low,de,400,Performance,IT,Tech Support,,,,,
Customer Support: Issue with Project Management Software,"Users are facing intermittent connectivity issues with the project management software, making dashboards inaccessible. This may be due to recent software updates or network configuration changes. Despite attempts to clear the browser cache, switching browsers, and resetting network configurations, the issues persist. The problem description is still unclear, and urgent assistance is needed to resolve the issue soon. We would appreciate any guidance on troubleshooting steps and would like to provide help.","I understand that users are experiencing intermittent connectivity issues with the project management software. To better assist, I would like to gather more information about the issue. Could you please provide the exact error message, a screenshot, and the current software version you are using? Additionally, it would be helpful to know if any recent network configuration changes have been made. We can schedule a call at your convenience at <tel_num> to discuss the issue and provide guided troubleshooting steps to resolve it.",Incident,Technical Support,low,en,400,Network,Performance,Disruption,IT,Tech Support,,,
Struggling with Brand Growth Due to Digital Strategy Challenges Post-Algorithm Changes,"Our marketing agency is facing difficulties in driving brand growth through digital strategies. Recent algorithm changes might have impacted our visibility. We have tried to optimize our campaigns and improve targeting, but haven't seen significant improvements. We need assistance in improving our online presence and effectively reaching our target audience.","We understand your concerns regarding driving brand growth through digital strategies and the potential impact of recent algorithm changes on visibility. To better assist you, could you please provide information on your current digital strategies and the specific challenges you are facing? This will help us provide a tailored solution to enhance your online presence and effectively reach your target audience. If available, we would like to schedule a call at <tel_num> to discuss and explore possible solutions to help your marketing agency.",Problem,Sales and Pre-Sales,medium,en,400,Feedback,Marketing,Digital Strategy,Performance,Sales,,,
Digital Strategies for Brand Growth Development,Please contact us to learn more about digital strategies for enhancing brand growth. Kindly provide details on the methods that can increase brand awareness and engagement. We appreciate your time and support. Looking forward to your response.,"Dear <name>, thank you for your inquiry regarding digital brand growth strategies. We utilize a combination of social media management, content creation, and targeted advertising activities to enhance brand awareness and engagement. We would be pleased to discuss more details and tailor the strategy to meet your specific needs. If a phone call is convenient, we can further discuss the details.",Request,Service Outages and Maintenance,high,de,400,Feedback,Sales,Feature,Documentation,,,,
Problem with Digital Service Interruption,Facing service disruptions across various platforms because of a failed deployment.,We apologize for the inconvenience caused by the digital service interruption due to a failed deployment. Our technical team is working to resolve the issue as soon as possible. Please confirm if the issue persists and provide your account information <acc_num> for further assistance. Contact us at <tel_num> if needed.,Incident,Service Outages and Maintenance,medium,en,400,Outage,Disruption,Recovery,Maintenance,IT,Tech Support,,
,"Dear Customer Support, we are exploring digital strategies to enhance our brand growth and are interested in gaining information on methods and techniques that can be used to increase brand awareness and customer engagement. We would greatly appreciate a detailed explanation of your approach to social media marketing, content creation, and customer interaction. Additionally, could you provide us with information on the analytics and measurement tools you use to track the success of your strategies? We look forward to your prompt assistance and are eagerly awaiting your response.","We appreciate your interest in digital strategies for brand growth. Our approach involves a combination of social media marketing, content creation, and customer interaction. We utilize various analytics and measurement tools to track the success of our strategies. Our team creates engaging content and leverages social media platforms to increase brand awareness and drive customer engagement. We use data analytics to monitor performance and make data-driven decisions. We would be happy to discuss our strategies in more detail.",Request,Customer Service,high,en,400,Feedback,Sales,IT,Tech Support,,,,
Request for Information on Medical Data Security Services,"Hello, we appreciate your interest in our services for securing medical data in a hospital's IT environment. Our team offers a range of solutions to ensure the confidentiality and integrity of sensitive medical information. We provide security assessments, data encryption, and compliance consulting to meet regulatory requirements. Please let us know your specific needs and the type of current infrastructure you have in place for handling medical data. We would be happy to schedule a call at your convenience to discuss further.","Thank you for your inquiry regarding our services for securing medical data in a hospital's IT environment. We appreciate your interest. Our team provides a variety of solutions to ensure the confidentiality and integrity of sensitive medical information. We offer security assessments, data encryption, and compliance consulting to meet regulatory requirements. Please provide us with more details about your current infrastructure and the type of medical data you are working with. We would like to schedule a call at your convenience to discuss your specific needs in more detail.",Request,Sales and Pre-Sales,low,en,400,Security,Compliance,Consulting,IT,Tech Support,,,
,Könnten Sie mehr Details zu Lösungen für die Sicherung medizinischer Daten liefern?,"Sehr geehrte/r [Name], wir bedanken uns für Ihr Interesse an Lösungen zur Sicherung medizinischer Daten. Unsere Firma bietet eine Vielzahl von Dienstleistungen an, einschließlich Verschlüsselung, Datensicherung, Zugriffskontrolle, sowie Maßnahmen zur Gewährleistung der Vertraulichkeit und Integrität medizinischer Akten. Wir bieten auch Trainings und Unterstützung an, um Organisationen bei der Einhaltung der relevanten Vorschriften zu helfen. Um Ihnen genauere Informationen zu geben, würde ich gerne einen Anruf vereinbaren. Falls Sie telefonisch erreichbar sind, können wir gerne einen Termin vereinbaren. Bitte lassen Sie uns wissen, falls Telefonnummer <tel_num> verfügbar ist.",Request,Sales and Pre-Sales,low,de,400,Backup,Medical,IT,,,,,
Alert for Unauthorized Access Triggered Today,An unauthorized access alert was triggered on the hospital's system. This may have occurred due to a potential phishing attempt involving employee credentials. Passwords have been changed and user activity is being monitored for any unusual behavior.,Received the alert regarding unauthorized access to the hospital's system. Please investigate and provide details on the affected employee's credentials. We will schedule a call to discuss the necessary next steps to ensure system security. I am available for a call at your earliest convenience.,Incident,Human Resources,low,en,400,Security,Alert,IT,Tech Support,,,,
Bessere Sicherheitsmaßnahmen anstreben,Bitte Verbesserung der Sicherheitsmaßnahmen für medizinische Daten in den IT-Systemen des Krankenhauses,"Sehr geehrte [name], vielen Dank für Ihren Brief zur Verbesserung der Sicherheitsmaßnahmen für medizinische Daten in den IT-Systemen des Krankenhauses. Wir nehmen die Datensicherheit sehr ernst und bemühen uns, sensible Informationen zu schützen. Um eine angemessene Lösung zu finden, könnten Sie bitte mehr Details zu den spezifischen Sicherheitsbesorgnissen bereitstellen. Ich würde es gerne mit Ihnen telefonisch erörtern. Bitte teilen Sie mir ein geeignetes Zeitfenster für das Telefonat mit der Nummer [tel_num].",Change,Product Support,high,de,400,Security,IT,Feedback,,,,,
Improvement in Investment Data Analytics Tools,We would like to request enhancements to the data analytics tools to optimize our investment strategies and improve our decision-making processes by providing detailed insights and trends.,"We appreciate your email regarding the enhancements to the data analytics tools for investment optimization. We understand the importance of detailed insights and trends for decision-making processes. Our team is currently reviewing the tools to identify areas for improvement. To better understand your specific needs, could you please request information on the features you would like to see enhanced? Additionally, could you provide us with details on your current challenges and expected outcomes? We would be happy to schedule a call at your convenience.",Change,IT Support,medium,en,400,Feature,Feedback,IT,,,,,
,Reported a possible data breach that may have impacted patient records.,We are taking immediate action regarding the potential data breach affecting patient records. Please provide details of the incident and call at your earliest convenience to discuss further. I would be available to discuss this today if convenient.,Incident,Product Support,medium,en,400,Security,Notification,Alert,,,,,
Hilfe beim Markenwachstum durch digitale Strategien,"Können wir Ihnen zusätzliche Informationen über digitale Strategien zur Verfügung stellen? Wir bieten Dienstleistungen wie Sozialmedien-Verwaltung und Inhaltserschaffung an. Lassen Sie uns gerne personalisierte Informationen zu Ihren spezifischen Bedürfnissen besprechen. Für weitere Informationen rufen Sie uns gerne unter [tel_num] an, um die Details zu besprechen.","Gehoben, [name]. Wir können eine Übersicht über unsere digitalen Strategien zur Unterstützung des Markenwachstums bereitstellen. Unsere Dienstleistungen umfassen Sozialmedien-Verwaltung und Inhaltserschaffung. Bitte teilen Sie uns Ihre spezifischen Anliegen mit, damit wir eine personalisierte Information für Sie bereitstellen können. Sie können uns jederzeit unter [tel_num] anrufen, um weitere Details zu besprechen.",Request,Technical Support,high,de,400,Feedback,Sales,Feature,Documentation,Training,,,
Secure Medical Data in Hospital Settings,"Customer Support, we are inquiring about the practices used to secure medical data in a hospital environment. Given the highly sensitive nature of medical data, it is crucial to take every precaution to prevent unauthorized access. Could you provide detailed information on the measures taken to ensure the security of medical data? This should include information on data encryption, access controls, and backup procedures. We would also appreciate information on compliance with regulations such as HIPAA. Additionally, could you recommend specific technologies or tools for securing medical data?","We will provide detailed information on securing medical data, including encryption and compliance with HIPAA regulations. We will follow up with this information via email.",Request,Customer Service,medium,en,400,Security,Backup,Documentation,IT,Tech Support,,,
Unterstützung für SaaS-Projekte,Ich interessiere mich für mehr Informationen über Skalierbarkeitsfunktionen in Projektmanagement-SaaS-Lösungen. Könnten Sie mir mehr Details über die Plattform zur Verwaltung großer Projekte und Teams geben? Welche Werkzeuge und Funktionen unterstützen die Skalierbarkeit und die Zusammenarbeit? Ich freue mich auf die bereitgestellten Informationen. Vielen Dank für Ihre Unterstützung.,"Ich wäre gerne bereit, mehr Informationen zu Skalierbarkeitsfunktionen in Projektmanagement-SaaS-Lösungen bereitzustellen. Die Plattform ist konzipiert, um die Verwaltung großer Projekte und Teams einfach umzusetzen. Sie bietet anpassbare Workflows, realzeitbasierte Berichte und verbindliche Zusammenarbeitsfunktionen. Diese Werkzeuge helfen, die Skalierbarkeit zu verbessern. Ich wäre gerne bereit, eine Besprechung einzuleiten. Könnten Sie bitte mitteilen, wann es Ihnen bequem wäre, anzurufen, um Ihre Projektmanagementbedürfnisse zu besprechen? <tel_num>",Request,Technical Support,high,de,400,Feature,Documentation,IT,Tech Support,,,,
Issues with Software Upgrades,"Problems with software updates causing connectivity issues in Project Tools. Restarting routers resolved the issue, but bandwidth limitations and compatibility may be contributing factors.","Dear <name>, you have confirmed the software update issues, which have caused problems with the Project Tools connectivity. I understand that restarting the routers resolved the issue, but bandwidth limitations and compatibility could be potential causes. Please provide details on the current software version of the affected Project Tools. If necessary, we can schedule a meeting to discuss the problem at a convenient time. Please share your preferred time slot via phone at <acc_num> <tel_num>",Problem,Product Support,high,de,400,Bug,Performance,Network,IT,Tech Support,,,
Request for Elaboration on Digital Strategies,"Customer support, seeking clarification on digital strategies to implement for driving brand growth. Could you provide details on the methods and techniques that can be used? I am very interested in learning the approach to digital marketing tools and how to utilize them to measure success. Your information would be greatly appreciated. Thank you for your time and assistance. I look forward to hearing back soon.","<name> would be happy to provide details on digital strategies. They will utilize various methods and tools to drive brand growth. A detailed email with the approach to digital marketing and measuring success will be sent soon for your convenience, or you can call to discuss further.",Request,IT Support,high,en,400,Feedback,Sales,IT,Tech Support,,,,
Guidance on Securing Medical Data with Action-Kamera on macOS Monterey,"Customer Support, seeking instructions to secure medical data using the Action-Kamera on Apple macOS Monterey. As a healthcare professional, it is crucial to ensure that patient information is protected and compliant with relevant regulations. The Action-Kamera is used for capturing medical images and videos, and it is currently running on Apple macOS Monterey. Could you provide step-by-step guidance on how to configure the device and the operating system to ensure the security and confidentiality of medical data?","We will provide detailed guidance on securing medical data with the Action-Kamera on macOS Monterey, including encryption and access controls. Please allow us to call at <tel_num> for further discussion.",Request,Technical Support,medium,en,400,Security,Documentation,IT,Tech Support,,,,
Erhöhung der Digitalen Marke,"Betreff: Mehr über digitale Strategien für die Wachstum von technologie-fokussierten Firmen\nHallo Kundenservice, ich würde gerne mehr über erfolgreiche Kampagnen von Marengrowth erfahren, die die Effektivität messen und nutzen können. Könnten Sie mir bitte die Metriken nennen, die für die Bewertung der Effektivität verwendet werden?","Für eine Diskussion über digitale Strategien und erfolgreiche Kampagnen von Marengrowth, Sie können uns unter <tel_num> erreichen.",Request,Customer Service,medium,de,400,Feedback,Product,Feature,IT,Tech Support,,,
,"Gehörte Kundensupport,\n\nEin Mitarbeiter hat Probleme beim Zugriff auf die Datenanalyse-Plattform für Investmentoptimierung gemeldet. Es könnte durch die neuesten Systemaktualisierungen entstanden sein. Wenn bereits versucht wurde, das Passwort zurückzusetzen und die Zugriffsberechtigungen zu überprüfen, hat die Lösung das Problem nicht gelöst. Das IT-Team konnte Probleme mit den Anmeldeinformationen und den Zugriffsberechtigungen feststellen. Der Mitarbeiter hat derzeit immer Zugriff auf die Plattform. Könnten Sie bitte helfen, das Problem zu lösen? Es wäre schön, wenn Sie zusätzliche Anleitungen geben könnten.\n\nVielen Dank.","Das Problem zur Datenanalyse-Plattform unterstützen. Bitte geben Sie den Mitarbeiterdaten an und vereinbaren Sie einen geeigneten Zeitpunkt, um die Schritt-für-Schritt-Anleitungen zu besprechen.",Incident,Human Resources,low,de,400,Account,Login,IT,Tech Support,Feedback,,,
Issue with Response Time for Project Boards,"Dear Customer Service, we have observed a significant slowdown in response time when accessing Project Boards. This problem seems to correlate with recent programming changes and the server load. Despite implementing cache monitoring and observing server performance, no improvements have been noted. The increased response time is affecting productivity, and we would appreciate if you could address this issue. Please let us know if you need any additional information to resolve the problem. We look forward to your prompt response.","Dear [Name], we will investigate the issue with the response time for Project Boards. Thank you for the information. Could you please provide more details about the recent programming changes and the current server load? It would be helpful to know when the problem started and at what specific time it became noticeable. Please let us know a convenient time to contact you at [Phone Number].",Incident,Product Support,high,de,400,Performance,Disruption,IT,Tech Support,,,,
Request for Integration of SendGrid SaaS,"Dear Support, we are seeking assistance with integrating SendGrid into our existing project management SaaS platform to enhance our communication capabilities. Could you provide detailed information on the integration process, including the necessary APIs, documentation, and support resources? Your guidance on how to seamlessly integrate SendGrid would be greatly appreciated. Additionally, are there any specific requirements we should consider during the integration process? We look forward to your timely assistance. Thank you.","For information on integrating SendGrid, please contact us at <tel_num> to discuss the details and requirements for integrating into your SaaS platform.",Request,IT Support,medium,en,400,Feature,Documentation,IT,Tech Support,,,,
,"Customer Support, please share your insights on enhancing the digital marketing tools and strategies utilized for brand growth and customer engagement across our products. Currently, we are evaluating the effectiveness of our tools and strategies and believe there is room for improvement to increase brand visibility and customer interaction. We would like to see the implementation of personalized marketing campaigns, enhanced social media management, and improved data analytics to track customer behavior and preferences. Additionally, we think it would be beneficial to explore new strategies.","Thank you, {name}, for reaching out with your valuable suggestions to enhance our digital marketing tools and strategies. We appreciate your input and are always looking for ways to improve brand growth and customer engagement. We would be happy to discuss your ideas further, particularly personalized marketing campaigns, social media management, and data analytics. Could you please provide us with a convenient time to call and explore these ideas in more detail? We are looking forward to speaking with you soon to explore ways to implement these improvements.",Change,Technical Support,high,en,400,Feedback,Product,Feature,Documentation,Sales,Marketing,,
Security Concern Regarding Data Access,"Noted unauthorized access attempts to medical data systems, possibly due to outdated firewall settings and increased phishing attacks. Steps taken include updating security protocols and conducting employee training on recognizing phishing scams to prevent future incidents.","Thank you for bringing the data security issue to our attention. Updating security protocols and conducting employee training are indeed positive steps towards preventing future incidents. Could you please provide details on the unauthorized access attempts, including the date and time they occurred, so we can investigate and provide the necessary support? Should you need to discuss this further, feel free to call at <tel_num>.",Problem,IT Support,high,en,400,Security,IT,Tech Support,Training,Alert,,,
Inquiry About Data Analytics Services Details,Is it possible to provide information on data analytics services that could optimize our investments? This would be incredibly helpful for making informed decisions. Thank you for your assistance.,"Hello [Name], we appreciate your interest in our data analytics services. Our team offers comprehensive solutions designed to optimize investments through detailed analysis and reporting. We would be happy to discuss these services in support of your decision-making process. To better understand your needs, could you please provide information on your current investment goals and challenges? We can schedule a call at your convenience to discuss further; you can reach us at [Tel Num] to arrange a call at your earliest convenience.",Request,Billing and Payments,low,en,400,Feedback,Sales,Lead,IT,Tech Support,,,
