subject,body,answer,type,queue,priority,language,version,tag_1,tag_2,tag_3,tag_4,tag_5,tag_6,tag_7,tag_8
Connection Problem with QuickBooks Online,"We are facing connection issues with QuickBooks Online. After restarting the router and verifying the network settings, the problem still exists. We have gone through the API documentation.","I would be glad to assist with the QuickBooks Online connection problem. Please provide details of the error message you are receiving. I will investigate and get back to you with a solution. Alternatively, we can schedule a call at your convenience to further troubleshoot the issue.",Problem,IT Support,high,en,400,Network,Performance,IT,Tech Support,Documentation,,,
Support for Data Analysis Tools,"Dear Customer Support, I am writing to inquire about optimizing our data analysis tools for investment strategies. Currently, the performance of our software is limited by the hardware capabilities of our key products, hindering our ability to make informed decisions. I would like to know if an upgrade to the system could enhance efficiency and accuracy. Could you please provide advice and suggest the best software and hardware updates? I look forward to your response and appreciate your assistance with this matter.","We are happy to assist with optimizing your data analysis tools. To provide the best advice, I need more information about your current system and specific performance issues. Could you please provide additional details? I am available to discuss this further via a call. My contact number is <tel_num>.",Change,IT Support,medium,de,400,Product,Feature,Performance,IT,Tech Support,,,
Issues with Investment Optimization Software,"The investment optimization software used by the financial firm is not producing the expected analysis results. The issues with data integration are believed to be due to erroneous input parameters. After reviewing the data sources and conducting diagnostic tests, the problem persists. Assistance is required to resolve the issue and obtain the expected analysis results.","Let's address the issues with the investment optimization software. I would be better able to assist if we could discuss additional details. We can schedule a call to discuss possible causes such as data integration problems or erroneous input parameters, determine the next steps to solve the problem, and ensure we achieve the expected analysis results.",Problem,Product Support,low,de,400,Bug,Performance,IT,Tech Support,,,,
Assistance with Security Issues,"Healthcare providers have experienced unauthorized access to medical data, which may be due to weak security protocols. Fire alarm installations have undergone enhanced antivirus scans, but the issue persists. Assistance is needed to identify the cause, implement a solution, and prevent future incidents.","To investigate security issues, please contact <tel_num> for further steps in resolving the problem.",Problem,Technical Support,low,de,400,Security,Virus,IT,Tech Support,Performance,,,
Problems with Digital Marketing Analytics Tools,"Facing issues with digital marketing analytics tools that hinder the ability to measure campaign effectiveness. These problems seem to be caused by the latest software updates. Despite restarting the tools and clearing the cache, the issue persists stubbornly. I am looking forward to your support in resolving this problem as soon as possible.","Dear [name],\n\nI am writing to confirm the issues encountered with your digital marketing analytics tools. I regret to inform you that the problem persists even after restarting the tools and clearing the cache. We are eager to assist in resolving this issue.\n\nTo better understand the problem, could you please provide more details on the error messages and specify which functionalities are expected to work? Additionally, we would be happy to arrange a call to discuss further steps. Please contact us at [tel_num] if available.",Incident,Technical Support,high,de,400,Bug,Performance,Feedback,IT,Tech Support,,,
Issue with Support System,A system crash happened during data analysis because of excessive resource usage and concurrent queries. Efforts to optimize MySQL queries and increase server resources were not successful.,Please review the system crash issue and contact us at <tel_num> to discuss further optimization options for MySQL queries and server resources to prevent future crashes.,Problem,Technical Support,high,en,400,Crash,Performance,IT,Tech Support,,,,
Report on Unauthorised Access Event,"We are currently dealing with an unauthorised access event within our hospital systems, which has the potential to compromise patient data. This issue might be due to outdated security protocols or user negligence. We have attempted to reset passwords and strengthen access controls, but the problem persists. We urgently require your assistance to resolve this matter and prevent further breaches.","Dear [Name],\n\nThank you for your email regarding the unauthorised access event within our hospital systems. We understand the severity of the situation and the potential compromise of patient data. To better assist you, could you please provide us with more information about the incident, including the date and time it occurred and any error messages received? Additionally, we would like to schedule a call to discuss the issue in detail and determine the appropriate course of action.\n\nI am available to discuss at your convenience. Please let us know a time that works for you.\n\nBest regards,\n[Your Name]",Incident,Customer Service,high,en,400,Security,IT,Tech Support,,,,,
Support for Adobe Illustrator CC 2021 in Digital Marketing,"Seeking assistance in integrating Adobe Illustrator CC 2021 into digital marketing strategies. Could you provide details on the software's features that could help enhance our marketing efforts? I would greatly appreciate any guidance on the tools and functionalities available to support our marketing objectives. Specifically, I'm interested in learning about the software's capabilities for creating engaging visual content and its compatibility with Adobe Creative Cloud applications. Thank you for your time and assistance. I look forward to hearing from you soon.","Would be happy to assist in integrating Adobe Illustrator CC 2021 into your digital marketing strategies. The software offers a range of tools and features to create engaging visual content and is compatible with Adobe Creative Cloud applications. To discuss further, I would like to schedule a call at a convenient time for you. Please let me know a suitable time to call at <tel_num> to explore Adobe Illustrator's support for your marketing goals.",Request,Billing and Payments,high,en,400,Feature,Feedback,Product,Documentation,Tech Support,,,
System Downtime Impacting Data Analysis Software,"A system outage has impacted several analytical tools. Attempts to restart the devices have not resolved the issue. The cause is uncertain, possibly due to network failure or hardware malfunction. Assistance is required to resolve this issue.",Received an email about the system outage and have assigned a technician to investigate the issue. Please contact +1-800-123-4567 to discuss the steps needed to resolve the problem.,Incident,IT Support,medium,en,400,Outage,Disruption,Network,Hardware,IT,Tech Support,,
Guidance on Securing Medical Data with AutoCAD 2022 and QuickBooks Online,"Could you provide guidance on securing medical data using AutoCAD 2022 and QuickBooks Online? It's crucial to ensure the confidentiality of patient information. Your assistance is greatly appreciated, and I look forward to hearing back from you soon.","Customer, I appreciate your concern about securing medical data and am happy to assist you. To ensure the confidentiality of patient information using AutoCAD 2022 and QuickBooks Online, I recommend implementing robust access controls, using strong passwords, and enabling multi-factor authentication. Additionally, consider encrypting sensitive data both in transit and at rest. It is essential to regularly update and patch your software to prevent exploitation of known vulnerabilities. However, I would like to clarify that AutoCAD",Request,Human Resources,medium,en,400,Security,IT,Tech Support,Documentation,,,,
Support for Security Gaps,"There was an unauthorized access incident involving security measures for medical data. The outdated security protocols seem to be the result of user errors. Efforts have been made to protect the data, including improved password policies and system updates, but more needs to be done. Urgent assistance is required to correct the situation and ensure the security of our medical data.","Dear <name>,\n\nI am responding to your email regarding the security incident that affected the security measures for medical data. I understand the urgency of the situation and the need to address it immediately. To better assist you, I would like to gather more information about the incident, such as the exact date and time of the incident, and any error messages you may have received. I would also appreciate detailed information on the password policies and system updates that have been implemented so far.\n\nPlease provide a convenient time when I can call to discuss this further. You can reach me at <tel_num> in the meantime.",Incident,Product Support,medium,de,400,Security,Bug,Performance,IT,Tech Support,,,
Support Required for System Downtime,The agency faced a system outage that impacted several applications and hardware possibly due to software conflicts or failed network connections.,We have received your email about the system outage at the agency. Please provide details on the affected applications and hardware. We are ready to assist with troubleshooting and can schedule a call for your convenience to discuss further.,Incident,Technical Support,high,en,400,Outage,Disruption,Hardware,Network,IT,Tech Support,,
,"Customer Support, seeking information on API integration options for our project management SaaS platform. Could you please provide details on the various APIs available, such as REST and GraphQL, and the endpoints that are accessible for integration? Additionally, we would appreciate information on the SDKs and libraries that are provided to simplify the integration process. We are particularly interested in learning about the authentication mechanisms, such as OAuth and API keys, and would like to receive associated documentation. Furthermore, we would like to know about any existing integrations with popular services.","We offer REST and GraphQL APIs with various endpoints, along with SDKs to simplify the integration process. Authentication is handled through OAuth and API keys. Please allow us to send you detailed documentation and integration guides for review.",Request,Customer Service,medium,en,400,Feature,Documentation,Tech Support,,,,,
,"Customer Support, exploring digital strategies to boost brand growth. Could offer some insights on the topic? keen to learn about the company's digital marketing tactics that have proven effective. would be grateful for any guidance or resources you can provide. Thank you for your assistance. looking forward to your response. help is greatly appreciated and I am excited to learn from your expertise.","Thank you for reaching out to our customer support team to inquire about digital strategies that drive brand growth. We appreciate your interest in learning about the approaches our company uses to effectively engage in digital marketing. The tactics that have proven successful for us include search engine optimization, social media marketing, targeted online advertising, and prioritizing the creation of high-quality, engaging content to attract and retain customers.",Request,Customer Service,low,en,400,Feedback,Sales,Marketing,Documentation,Customer Support,,,
,Would you be able to offer comprehensive details on securing medical data with healthcare solutions? Thank you.,"I can provide comprehensive details on securing medical data using healthcare solutions. These solutions employ encryption and secure servers to protect sensitive information. For a detailed discussion, I would be happy to schedule a call at your convenience. Please let me know a suitable time to reach you.",Request,Technical Support,high,en,400,Feature,Documentation,Feedback,,,,,
