subject,body,answer,type,queue,priority,language,version,tag_1,tag_2,tag_3,tag_4,tag_5,tag_6,tag_7,tag_8
Performance Issue with Dashboard,"Dear Customer Support, Recently, users have encountered substantial lag when accessing the project management dashboard. This issue might be due to increased user load impacting server performance. Despite attempts to optimize server resources and clear cache, the problem persists. The lag is causing delays in workflow, which is significantly affecting overall productivity. We would greatly appreciate it if you could look into this matter urgently and provide a solution to resolve the issue. Please let us know if there is any additional information needed. Thank you.","Hello, <name> has acknowledged the receipt of your email regarding the dashboard performance issue and assures that immediate action will be taken to address the problem. We understand the impact this issue has on your workflow and productivity and appreciate the efforts made so far to optimize server resources and clear the cache. We will troubleshoot the issue and would be helpful if you could provide us with information regarding your server configuration, current user load, and any recent changes made to the system. Additionally, it would be beneficial for us to know",Problem,Technical Support,high,en,400,Performance,Disruption,IT,Tech Support,,,,
Problem with Reduction in Website Traffic,Our marketing agency has noticed a sudden decrease in website traffic. Efforts to address this issue have included analyzing Google Analytics data and refining SEO strategies.,Please review the situation and contact us at <tel_num> to discuss potential causes and next steps for addressing the decline in website traffic. Your account number is <acc_num>.,Incident,Technical Support,medium,en,400,Bug,Performance,Feedback,Documentation,,,,
Problems with Data Processing,"Investment Analysis Platform is experiencing delays in data processing, which seems to be due to recent server updates. Restarting the server and clearing the cache did not resolve the issue. Please assist us in resolving this problem quickly.","Dear [Name],\n\nI confirm the issue of delayed data processing on the Investment Analysis Platform. Despite restarting the server and clearing the cache, the problems persist. I would like to investigate this further.\n\nCould you please provide detailed error messages and specifics about the nature and timing of the delays? If needed, [account_number] will contact you to discuss and resolve the issue.\n\nKind regards,\n",Incident,Technical Support,low,de,400,Bug,Performance,Network,IT,Tech Support,,,
Support for Delayed Campaign Performance,"Our agency is encountering delays in the performance analytics of our campaign due to system slowdowns. It seems that the issue might be caused by high server load during peak usage. We have already cleared the cache and restarted the system, but the problem persists. This concern could affect our ability to deliver timely insights to our clients. We would greatly appreciate your assistance in resolving this matter as soon as possible. Please provide any additional troubleshooting steps and let us know if a permanent solution is required.","We will assist with the system slowdowns that are impacting the campaign performance analytics. We understand that you have already cleared the cache and restarted the system. Please provide us with current server load information and usage patterns to help us troubleshoot further. Additionally, we would like to schedule a call at a convenient time to discuss potential solutions. Please let us know a suitable time to reach you at <tel_num>. Our goal is to determine the appropriate course of action to resolve the issue and prevent future delays.",Incident,Technical Support,low,en,400,Performance,Network,Disruption,IT,Tech Support,,,
,"customer support, a breach in medical data security has been identified within the hospital's systems. This may have occurred due to outdated software vulnerabilities. Efforts to address the issue include updating security software and reinforcing network protocols. The hospital is taking immediate action to rectify the situation and prevent future breaches.",thank you for bringing this to our attention. We are pleased to hear that immediate action has been taken to address the situation. We would like to discuss how to ensure that the necessary steps are in place to prevent future breaches. It would be convenient for us to schedule a call at your earliest convenience.,Incident,Technical Support,high,en,400,Security,Network,Bug,Performance,Outage,,,
Request for Adjustment of Billing for Marketing Services,"I am writing to request a billing adjustment for marketing services related to digital strategies and brand growth initiatives. The services provided did not meet our expectations, and we believe an adjustment is necessary. We would greatly appreciate it if you could review our account and make the necessary adjustments as soon as possible. Please let us know if there is any additional information you need to facilitate this request.","We will review account number <acc_num>, assess the marketing services provided, and determine if a billing adjustment is warranted. Please allow us to investigate and we will get back to you soon with an update.",Change,Billing and Payments,medium,en,400,Billing,Account,Feedback,Sales,IT,Tech Support,,
Frage zur digitalen Strategie-Dienstleistung für Markenwachstum online,"Sehr geehrte Kundenservice, ich bin an zusätzlichen Informationen zu digitalen Strategie-Dienstleistungen für Markenwachstum online interessiert. Bitte geben Sie mir mehr Details zu den angebotenen Dienstleistungen und ihren möglichen Vorteilen für Unternehmen im Online-Bereich. Ich freue mich auf Ihre Ansätze und die Möglichkeit, meine Erwartungen zu erfüllen. Vielen Dank für Ihre Unterstützung. Ich freue mich darauf, bald von Ihnen zu hören.","Sehr geehrte [Name], vielen Dank für Ihre Abfrage zu digitalen Strategie-Dienstleistungen für Markenwachstum online. Wir freuen uns über Ihr Interesse an unseren Dienstleistungen und sind bereit, Ihnen mehr Informationen zu geben. Unsere digitalen Strategie-Dienstleistungen sind darauf ausgerichtet, Unternehmen bei dem Wachstum im Online-Bereich und bei der Erreichung Ihrer Zielgruppe effektiver zu helfen. Unser Ansatz umfasst eine gründliche Analyse der aktuellen Onlinepräsenz, die Identifizierung von Bereichen, in denen Verbesserungen möglich sind, sowie die Entwicklung einer individuellen Strategie, um Ihre Geschäftsziele zu erreichen. Wir bieten eine Reihe von Dienstleistungen an, darunter soziale Medien-Management und Suchmaschinenoptimierung.",Request,Product Support,low,de,400,Feedback,Sales,IT,Tech Support,,,,
Support Request Submited,"Critical outage of project management tools identified. After the recent system update, unexpected compatibility issues arose. Possible causes could be software conflicts or recently applied security patches. Already tried rolling back updates and clearing caches, but the issues persist. The team is currently working to make important project data accessible, which significantly hampers productivity. Urgent support is requested to resolve the issue. Could please provide a quick solution approach to guide the error resolution process?",Investigate compatibility issues with project management tools and provide a solution approach to guide the error resolution process. Please call at a convenient time to discuss further details.,Incident,IT Support,high,de,400,Outage,Disruption,Recovery,Software,Security,Performance,IT,Tech Support
,"Hello Customer Support, I hope this message finds you well. I am writing to seek assistance with the inconsistent results we are encountering in our digital strategy. It seems there might be some issues related to software integration and data discrepancies. Despite our efforts to troubleshoot by updating the software and cross-referencing the analytics, we have not yet seen any improvements. We would be very grateful for your support in resolving this issue. Could you please help us identify the root cause and suggest potential solutions? We are eager to get this sorted and are open to scheduling a call at your convenience. Please let us know a time that works for you.","Hello, thank you for reaching out to us regarding the issue with your digital strategy results. We apologize for the inconvenience you are experiencing and are happy to assist you in resolving it. To better understand the problem, could you please provide us with more details about the software integration and the data discrepancies you are facing? Any specific error messages from the analytics or related data would be very helpful. Once we have this information, we can schedule a call at a convenient time for you to discuss the issue further. Please let us know a time that works for you.",Problem,Product Support,medium,en,400,Bug,Performance,Feature,Documentation,Feedback,IT,Tech Support,
Konkretisierung der IFTTT-Datenanalyse-Optimierung,"Bitte kontaktieren Sie, um die Integration IFTTT für Datenanalyse-Optimierung und Investitionen zu erläutern. Ich würde gerne mehr Details über die Vorteile der Integration und die spezifischen Prozesse erfahren, die mit den Investitionen verbunden sind. Bitte teilen Sie relevanten Informationen und Ressourcen, um meine Verständnis der Funktionsweise zu verbessern. Ich freue mich auf Ihre Rückmeldung und auf weitere Diskussionen zu diesem Thema.","Ich freue mich darauf, die Integration von IFTTT für Datenanalyse-Optimierung und Investitionen zu diskutieren. Bitte geben Sie einen geeigneten Zeitpunkt an, um detaillierte Informationen und Fragen zur Funktionsweise der Integration zu klären.",Request,Sales and Pre-Sales,low,de,400,Feature,Feedback,Documentation,IT,,,,
,"Auffälligkeiten wurden in den Analysedaten für die Anlagenoptimierung identifiziert. Mögliche Ursachen sind Dateninconsistenzen oder Algorithmierfehler. Versuche zur Kalibrierung der Algorithmen und Überprüfung der Datensource waren erfolglos. Weitere Unterstützung ist erforderlich, um sicherzustellen, dass die Analysen korrekt sind.","Derzeit wird der Eintrag über Auffälligkeiten in den Analysedaten für Anlagenoptimierung ignoriert. Bitte geben Sie weitere Details zu den beobachteten Fehlern an. Sie können sich an Nummer <tel_num> wenden, um weitere Unterstützung besprechen und das Problem lösen zu können.",Incident,Returns and Exchanges,high,de,400,Bug,Performance,IT,Tech Support,Documentation,,,
Double Charge Issue,"The customer was billed twice for the monthly subscription fee, possibly due to an issue with the billing system. The customer has attempted to resolve the issue by reviewing their bank statement and contacting the support department, but the double charge is consistently present. The customer requests assistance in resolving this matter quickly.","The double charge on the account is intentional. To resolve the issue, the customer needs to verify their account number and the dates on the receipts. Please confirm the account number and the dates of the transactions. Following that, we can quickly perform a payment reconciliation to eliminate the double charge. If necessary, we can arrange a call to discuss any further questions at a convenient time.",Incident,Billing and Payments,low,de,400,Billing,Payment,Refund,Account,,,,
Unterstützung für Investitionen,"Wir haben unerwartete Schwankungen in den Investitionsleistungen festgestellt, obwohl wir Datenanalysebemühungen unternommen haben. Die Probleme könnten auf ungenaue Datenintegration und Softwarekompabilitätsprobleme zurückzuführen sein. Wir haben verschiedene Dateneingaben überarbeitet und verschiedene Analysewerkzeuge getestet.","Wir haben Ihre Investitionsleistungsfluktuationen erhalten und möchten darüber sprechen. Könnten Sie bitte mehr Details zu Ihren Datenanalysebemühungen und den Analysewerkzeugen geben, die Sie bisher getestet haben?",Problem,Returns and Exchanges,medium,de,400,Bug,Performance,Documentation,IT,Tech Support,,,
Ausführen der Aktualisierung der Marketingstrategien,"Lieber Kundenservice, ich möchte die Aktualisierung unserer digitalen Marketingstrategien beantragen, um die Markenpräsenz und die Engagementschaffung auf verschiedenen Plattformen sowie die Verbesserung der Produktpresenz zu verbessern. Da die aktuellen Strategien leider nicht den gewünschten Erfolg bringen, müssen wir unsere Ansätze überdenken, um im Wettbewerb erfolgreich zu bleiben. Ich schätze es, dass Sie Ratschläge zur Verbesserung unserer Marketingbemühungen geben könnten. Insbesondere interessiere ich mich für mehr Sozialmedienmarketing, Inhaltsmarketing und Suchmaschinenoptimierung. Ich glaube, dass eine Aktualisierung unserer Marketingstrategien dazu beitragen kann, unser Markenwissen zu erweitern und den Verkehr auf unserer Website zu erhöhen.","Lieber [Name], Ihre Anfrage zur Aktualisierung der digitalen Marketingstrategien, insbesondere zur Markenpräsenz und Engagementschaffung, erhalten wir. Um die aktuellen Herausforderungen besser zu verstehen und individuelle Ratschläge zu geben, wäre es schön, über spezifische Bedürfnisse und Ziele zu sprechen. Bitte teilen Sie uns mit, wann es für Sie am besten geeignet ist, um telefonisch Kontakt aufzunehmen ([Telefonnummer]). Wir können Ihnen mehr Informationen zu Sozialmedienmarketing, Inhaltsmarketing und Suchmaschinenoptimierung geben, um Vorschläge zur Verbesserung Ihrer Marketingbemühungen zu machen. Diese Aktualisierung könnte dazu beitragen, unser Markenwissen zu erweitern und den Verkehr auf Ihrer Website sowie den Umsatz zu steigern. Wir freuen uns auf Ihre Rückmeldung ([Kontonummer]).",Change,Customer Service,low,de,400,Feedback,Sales,Product,Feature,Documentation,,,
Verbessern der Datenanalyse und Investitionsoptimierung,"Gehrte Kundensupport, ich möchte darauf hinweisen, dass die Verbesserung unserer Datenanalysetools notwendig ist. Dies würde erheblich zu besseren Berichtsfähigkeiten und Investitionsoptimierungsstrategien führen, was zu besserer finanzieller Entscheidungsfindung beitragen würde. Ich glaube, dass die Verbesserung unserer Tools die Effizienz und die Kostenreduktion steigern kann. Zudem würde die verbesserte Berichtsfähigkeit es uns ermöglichen, unseren Fortschritt besser zu verfolgen. Ich schätze es, wenn Sie dieses Thema schnell in eine Lösung umsetzen könnten. Vielen Dank für Ihre Unterstützung. Ich freue mich darauf, bald von Ihnen zu hören.","Gehrte <name>, vielen Dank, dass Sie gemeldet haben, dass die Datenanalysetools und Investitionsoptimierung verbessert werden sollten. Wir werden das Problem annehmen und mögliche Lösungen prüfen, um die Berichtsfähigkeiten und die Effizienz zu verbessern. Bitte teilen Sie uns mit, welche Tools Sie derzeit verwenden und welche spezifischen Anforderungen Sie haben. Falls Sie weitere Informationen benötigen, können Sie uns unter <tel_num> kontaktieren, um diese besprechen zu können. Wir freuen uns auf Ihre Rückmeldung und freuen uns darauf, Ihnen behilflich zu sein.",Change,Product Support,medium,de,400,Feedback,Feature,Performance,Documentation,,,,
Problems with Hadoop Integration Process,The application integration with Hadoop has crashed due to incompatible data configurations.,I am currently working on the Hadoop integration issue. Please provide the latest error log and current data configurations to help resolve the problem. Let's arrange a call to discuss further. <tel_num>,Problem,Product Support,medium,de,400,Bug,Performance,IT,Tech Support,,,,
Query for ClickUp Integration Information,Is it possible to get detailed information on integrating ClickUp into our scalable SaaS project management system? This would significantly aid in streamlining our workflow and enhancing productivity. Thank you for your prompt assistance. We look forward to your response soon.,Thank you for your interest in integrating ClickUp into our SaaS project management system. Could you please share your current workflow and productivity goals so we can tailor the integration to meet your specific needs? We are happy to discuss at a convenient time.,Request,Customer Service,medium,en,400,Feature,Documentation,Feedback,IT,Tech Support,,,
Airtable User Inquiry,Could Advisors Offer Guidance on Optimizing Investments Using Airtable's Data Analysis Tools? Thank you.,"Dear <name>, thank you for reaching out to the Service Desk with your inquiry about clarifying optimization methods for investments using Airtable's data analysis tools. We are pleased to assist you with this topic. To better support you, we need more information about your current investment tracking process and the data analysis tools you are currently using. Could you please provide more details on these aspects? Should this be convenient, we would be happy to arrange a discussion to develop an individually tailored solution.",Request,Product Support,medium,de,400,Feature,Feedback,IT,Tech Support,,,,
Probleme bei der Rechnungsstellung,"Betreff: Fakturierungsprobleme\n\nSehr geehrte Kundenservice, ich habe Unstimmigkeiten in den Rechnungen für die Analysedienstleistungen bemerkt, die ich derzeit mit dem Systemfehler und Missverständnissen zurückzuführen glaube. Trotz der manuellen Reconciliation und des Rechenschaftsgebers bleiben die Unstimmigkeiten ungelöst. Ich freue mich, wenn Sie sich bald um diese Angelegenheit kümmern und eine mögliche Lösung anbieten können.","Betreff: Rechnungsstellung - Unstimmigkeiten\n\nSehr geehrte [Name], ich bestätige, dass Ihre E-Mail bezüglich der Rechnungsstellung und der damit verbundenen Unstimmigkeiten für die Analyseleistungsaccounts [Acc_num] entgegengenommen wurde. Ich entschuldige mich für die Unstimmigkeiten und vermute, dass sie auf Systemfehler und Missverständnisse zurückzuführen sind. Ich schätze Ihre Bemühungen, die Rechnungen manuell zu Recht stellen. Um die Angelegenheit zu klären, bitten wir Sie, eine detaillierte Aufstellung der Unstimmigkeiten zu liefern, einschließlich der betroffenen Datumsangaben und Beträge. Falls notwendig, können wir telefonisch besprechen, wann es uns am besten passt. Ich werde mich bemühen, die Angelegenheit an das Fakturierungsabteilung weiterzuleiten, um eine schnelle Lösung zu finden.",Problem,Billing and Payments,medium,de,400,Billing,Refund,Account,Performance,Feedback,,,
Urgent Support Inquiry Required,"Greetings from Customer Support, we are addressing your urgent request for support in optimizing digital strategy tools to enhance brand growth initiatives. It has come to our attention that your current systems are outdated, which is hindering progress. We would greatly appreciate your assistance in providing us with timely help to get back on track. Please let us know the specific steps needed to resolve the issue. Your prompt attention to this matter is highly valued, and we look forward to hearing from you soon.","Hello [Name], we are writing to acknowledge your urgent support request regarding the optimization of digital strategy tools and enhancing brand growth initiatives. We understand that your current systems are outdated, which is hindering progress. To better assist you, we would like to schedule a call to discuss the specific issues you are experiencing with your current setup. This will enable us to provide an accurate assessment and recommend the necessary steps to resolve the issue. We are available to arrange a call at your earliest convenience and can be reached at [tel_num].",Change,IT Support,high,en,400,IT,Tech Support,Feedback,Performance,Maintenance,,,
Customer Inquiry Regarding Return Issues,"Facing difficulties with the return of several digital products. The customer states that the installation issues are due to compatibility problems or user error. We have supplied them with troubleshooting guides, but the issues still exist.",Please provide details of the issues and your contact information for further assistance. This may include potential escalation if necessary.,Incident,Returns and Exchanges,medium,en,400,Return,Product,Feature,Tech Support,,,,
Data Analytics Tools,Can you supply information on data analytics tools?,We can provide a range of data analytics tools. Please specify the features or solutions you are interested in so we can offer detailed recommendations.,Request,Technical Support,medium,en,400,Product,Feature,Documentation,,,,,
Beklagung technischer Unterstützung,"Sehr geehrte Kundensupport, ich schreibe Ihnen, da ich technische Probleme mit der Teamkollaboration mehrerer SaaS-Anwendungen meldete. Es gibt Hinweise auf Netzwerkunstabilität und hohe Ressourcenlast. Als Anfangsmaßnahmen Neustart des Routers und Löschen der Browser-Caches durchgeführt, aber das Problem behält sich bestehen. Betroffene Anwendungen sind Projektleitungstools, Kommunikationsträger und Dateiteilungsdiälekt. Die Benutzer haben störende Abtrennungen, langsame Lastzeiten und Fehlermeldungen erlebt. Ich schätze eine baldige Lösung des Problems. Bitte teilen Sie mir mit, was für zusätzliche Fehlerbehebungsmaßnahmen unternehmen können, und wann wir uns telefonisch verabreden können, um das Problem zu besprechen. Telefonnummer: <tel_num>","Sehr geehrte [Name], vielen Dank, dass Sie uns über Ihre technischen Probleme mit den SaaS-Anwendungen informieren. Um Ihnen besser helfen zu können, um das Problem zu lösen, könnten Sie uns bitte mehr Informationen zu Ihrem Netzwerkbetrieb und den Fehlermeldungen geben? Es wäre auch vorteilhaft, wenn wir telefonisch zusammenarbeiten könnten, um die Details zu besprechen. Telefonnummer: <tel_num>. Wenn Sie verfügbar sind, können wir uns am geeigneten Zeitpunkt verabreden.",Incident,IT Support,low,de,400,Tech Support,Network,Performance,Bug,Outage,Disruption,,
Request for Updating Data Analytics Tools Integration in Airtable,We need to update the integration of data analytics tools across Airtable to enhance investment optimization.,"Thank you for your request to update the integration of data analytics tools in Airtable, which will help enhance investment optimization. Please provide detailed information about the specific analytics tools you are currently using so we can review your request and provide a solution. For further discussion, please contact us at <tel_num>. We appreciate your choice of service and look forward to reaching out soon.",Change,Technical Support,low,en,400,Feature,IT,Tech Support,,,,,
Securing Medical Data in Hospitals,Please provide details on medical data security solutions.,We offer encryption and access control solutions to secure medical data for hospitals. Please contact us for more information.,Request,Customer Service,high,en,400,Security,IT,Tech Support,Feedback,,,,
Capabilities for API Integration in Project Management,"Customer Support, seeking to understand the API integration capabilities for project management within our SaaS platform. Could you provide details on the available APIs, their functionality, and documentation resources to assist us in getting started? We are particularly interested in integrating with our existing tools and workflows. Specifically, we would like to know what types of data can be accessed and manipulated via the API, as well as any limitations or restrictions. Additionally, it would be helpful to know what support resources are available to developers and integrators.","<name>, thank you for your inquiry regarding API integration capabilities. We offer a range of APIs for project management; please visit our developer portal for detailed documentation. You can call <tel_num> to discuss your specific requirements and address any questions you may have.",Request,Product Support,medium,en,400,Feature,Documentation,IT,Tech Support,,,,
Verbesserung digitaler Marketingkonzepte,Bitte optimieren Sie digitalen Marketingplan mit Smartsheet und Google Meet zur Förderung des Markenwachstums.,"Wir werden Ihre Anfrage zur Verbesserung des digitalen Marketingplans, einschließlich der Nutzung von Smartsheet und Google Meet, prüfen. Baldigen Sie mit Kontakt.",Change,Product Support,high,de,400,Feedback,Sales,Feature,,,,,
Anfrage Aktualisierung Integrationsparameter,"Die Aktualisierung der Integrationsparameter wird benötigt, um die Kompatibilität mit Node.js-Projektmanagementwerkzeugen zu verbessern und bessere Leistung zu erzielen.","Wir erhalten Ihre Anfrage zur Aktualisierung der Integrationsparameter und zur Verbesserung der Kompatibilität mit Node.js-Projektmanagementwerkzeugen. Um die Aktualisierung fortzusetzen, benötigen wir weitere Informationen über die aktuell genutzten Integrationsparameter und Projektmanagementwerkzeuge. Bitte geben Sie die aktuellen Einstellungen an, damit wir eine genauere Lösung anbieten können. Die Integrationsparameter werden entsprechend aktualisiert, um bessere Leistung zu gewährleisten. Falls erforderlich, können Sie uns unter <tel_num> kontaktieren, um eine weitere Diskussion zu führen. Bitte geben Sie eine passende Zeit für den Anruf an.",Change,Human Resources,medium,de,400,Feature,Performance,Documentation,IT,,,,
