subject,body,answer,type,queue,priority,language,version,tag_1,tag_2,tag_3,tag_4,tag_5,tag_6,tag_7,tag_8
Hardware Malfunction Reports,"Dear Customer Support Team,\n\nI hope this message reaches you well. I am writing to report a series of technical issues impacting several hardware devices, which I believe may be connected to network configuration problems. The affected equipment includes Keyboard 4, a 4K Monitor, the UniFi Dream Machine, among others.\n\nIn recent days, these devices have begun to malfunction in various ways. For example, Keyboard 4 intermittently fails to register keystrokes, and the 4K Monitor has exhibited similar issues.","Thank you for providing detailed information regarding the problems with Keyboard 4, the 4K Monitor, and the UniFi Dream Machine. To assist us further, could you clarify whether these devices are plugged into a surge protector? Additionally, are there any error messages or indicator lights on the UniFi Dream Machine indicating network disconnections? Please share these details so we can better diagnose the problem.",Incident,Technical Support,medium,en,51,Hardware,Network,Disruption,Tech Support,,,,
Dringende Verbindungsstörungen bei Geräten beeinträchtigen den Arbeitsfluss im gesamten Büro,"Sehr geehrtes Support-Team,\n\nich möchte auf anhaltende Netzwerkprobleme bei unseren Geräten hinweisen, die den Ablauf in unserem Büro erheblich stören. In den letzten Tagen wurden plötzliche, häufige Störungen an mehreren Geräten festgestellt, was zu Produktivitätsverlusten und betrieblichen Verzögerungen führt.\n\nWir haben festgestellt, dass die Verbindungsprobleme möglicherweise mit unserer Netzwerkinfrastruktur zusammenhängen, insbesondere mit Konflikten im Mesh-WLAN-System sowie den VPN-Router-Konfigurationen. Trotz unserer internen Fehlerbehebung bestehen die Probleme weiterhin.\n\nUm die Ursache zu beheben, haben wir folgende Maßnahmen ergriffen:\n1. Geräte mit Verbindungsproblemen neu gestartet.\n2.","Vielen Dank für die ausführliche Meldung. Damit wir Ihnen bestmöglich weiterhelfen können, bitten wir Sie, Details zum Mesh-WLAN-Modell, Marke und Modell der VPN-Router sowie die Anzahl der betroffenen Geräte anzugeben. Teilen Sie uns außerdem mit, ob spezifische Fehlermeldungen während der Störungen angezeigt werden. Falls Sie eine Fernwartung wünschen, schlagen Sie bitte einen passenden Termin vor. Wir setzen alles daran, das Problem so schnell wie möglich zu lösen.",Incident,Technical Support,low,de,51,Network,Disruption,Performance,IT,Tech Support,,,
Connectivity Problem with Microsoft Surface Pro 8,"Dear Customer Support Team,\n\nI am reaching out to request help with an ongoing connectivity problem with my Microsoft Surface Pro 8. The device frequently disconnects from Wi-Fi, which greatly hampers my productivity as I depend on a reliable internet connection for work and personal activities. Despite trying basic solutions such as restarting the device, switching airplane mode on and off, and resetting network settings, the issue still occurs sporadically throughout the day.\n\nFurthermore, I have made sure that...","Thank you for contacting us regarding the connectivity problem with your Microsoft Surface Pro 8. Since you have already attempted common troubleshooting methods and confirmed that the issue is specific to your device, we suggest reinstalling the Wi-Fi adapter driver through Device Manager and testing the connection in Safe Mode with Networking to rule out software conflicts. If the problem continues, please inform us if you notice any unusual noises or physical damage to the device. A hardware assessment may be necessary.",Incident,Technical Support,medium,en,51,Network,Connectivity,Hardware,Tech Support,,,,
Mehrere Systemstörungen gemeldet,"Sehr geehrter Kundenservice, es wurden unerwartete Ausfälle bei mehreren Systemen festgestellt, sowohl Hardware als auch Software sind betroffen. Vermutlich ist ein zentraler Netzwerkfehler die Ursache. Nach einem Neustart der Geräte und Durchführung von Netzwerktests bestehen die Probleme bei den betroffenen Produkten weiterhin. Wir benötigen umgehend Unterstützung, um die Schwierigkeiten schnellstmöglich zu beheben. Bitte beraten Sie uns über die nächsten Schritte und Fernwartungsoptionen. Vielen Dank für Ihre schnelle Aufmerksamkeit in dieser Angelegenheit.","Vielen Dank, dass Sie die Meldung mehrerer Systemstörungen gemacht haben. Um rasch helfen zu können, könnten Sie bitte angeben, welche Systeme oder Produkte betroffen sind, sowie etwaige Fehlermeldungen, die Sie erhalten haben? Bitte bestätigen Sie auch, ob die Probleme bestimmte Abteilungen betreffen. Teilen Sie uns gegebenenfalls kürzliche Änderungen oder Updates im Netzwerk mit. Wir sind bereit, eine Fernwartung durchzuführen, sobald wir die Details kennen. Falls ein dringender Anruf gewünscht ist, nennen Sie bitte eine passende Zeit und Ihre Kontaktnummer. Wir schätzen Ihre Kooperation.",Incident,Service Outages and Maintenance,high,de,51,Outage,Disruption,Network,Hardware,Software,IT,Tech Support,
Problem with SaaS Platform Features,"Dear Customer Support Team,\n\nI am reaching out to report a malfunction currently affecting the SaaS platform. Over the past few hours, several essential features of the platform have become unresponsive or sluggish, greatly hindering workflow efficiency.\n\nSpecifically, I have observed slow dashboard load times, data synchronization discrepancies, and occasional failures during user login attempts. These issues have persisted despite efforts to refresh the application and clear browser caches.\n\nSince the platform is vital for daily operations, your prompt attention is appreciated.","Thank you for reaching out regarding the difficulties faced with the SaaS platform. We recognize the importance of the dashboard's performance, data consistency, and user login processes, and sincerely apologize for any inconvenience caused. Our technical team is actively investigating the situation to identify the underlying cause and aims to restore normal service as swiftly as possible. We will provide updates with an estimated resolution time shortly. Meanwhile, as a temporary solution, please ensure you are accessing the platform through a supported browser.",Incident,Product Support,medium,en,51,Feature,Performance,Bug,Dashboard,,,,
Billing Issue,"Problem mit der Zahlungsabwicklung bei der Abrechnung. Bitte unterstützen Sie mich dabei, das Problem so zügig wie möglich zu lösen.","Vielen Dank, dass Sie uns bezüglich Ihres Abrechnungs- und Zahlungsproblems kontaktiert haben. Um Ihnen besser helfen zu können, bitten wir Sie, Ihre Kontonummer sowie die Nummer der letzten Rechnung anzugeben und die genaue Fehlermeldung zu schildern. Sobald wir diese Informationen erhalten haben, werden wir den Vorfall prüfen und das Problem so schnell wie möglich beheben. Wir danken Ihnen für Ihre Geduld.",Incident,Billing and Payments,medium,de,51,Billing,Payment,Refund,Issue,,,,
Dringende Unterstützung bei Problemen mit der Cloud-Plattform des Agile Teams benötigt,"Sehr geehrtes Support-Team,\n\nich hoffe, diese Nachricht erreicht Sie wohlbehalten. Ich möchte ein Problem melden, das wir mit der Agile Squad Cloud Platform festgestellt haben. Unser Team ist stark auf die Plattform für unsere täglichen Arbeitsabläufe angewiesen, doch kürzlich haben wir erhebliche Störungen erlebt, die den Arbeitsfluss erheblich beeinträchtigen.\n\nGenauer gesagt, treten sporadische Verbindungsprobleme auf, und es kommt gelegentlich zu Fehlschlägen beim Datenabgleich zwischen verschiedenen Modulen. Diese Schwierigkeiten verursachen Verzögerungen bei Projektupdates und behindern die Zusammenarbeit innerhalb unserer agilen Teams. Wir bitten um grundlegende Troubleshooting-Schritte.",Vielen Dank für die Meldung der Probleme mit der Agile Squad Cloud Platform. Könnten Sie bitte die Namen der betroffenen Module sowie die entsprechenden Fehlermeldungen mitteilen? Wir prüfen die Angelegenheit derzeit und werden Sie so schnell wie möglich auf dem Laufenden halten.,Problem,Customer Service,high,de,51,Network,Disruption,Performance,Tech Support,,,,
Improvement Request,"Dear Customer Support Team,\n\nI hope this message reaches you in good health. I am writing to request modifications to encryption, compliance, monitoring, and support procedures across several key products and services. In particular, I am focusing on encrypted USB devices, Microsoft Outlook, mesh Wi-Fi networks, Internet of Things (IoT) gadgets, and healthcare data integrations.\n\nConsidering the critical importance of these products and the sensitive information they manage, it is vital to implement strong encryption methods to safeguard against unauthorized access.","Thank you for the detailed inquiry concerning enhancements in encryption, compliance, monitoring, and support procedures. To develop a customized plan, could you please specify the product versions, current challenges, and priorities? Additionally, please provide details on the proposed approach, including software and hardware updates, estimated timelines, and necessary resources.",Change,Product Support,low,en,51,Feature,Security,Maintenance,Product,Feedback,,,
Login Problems with Windows 10,"Dear Customer Support,\n\nI am facing difficulties when trying to access my Windows 10 Pro device. Each login attempt results in the system either becoming unresponsive or showing an error message that blocks access. I have rebooted several times and verified that my keyboard functions correctly, but the issue remains. This problem is significantly affecting my productivity as I cannot reach my files or applications. Could you please help me resolve this login issue as soon as possible? Here are the troubleshooting steps I have tried.","Thank you for reaching out regarding your login difficulties with your Windows 10 Pro device. To assist you better, could you specify the exact error message you encounter during login? Additionally, are you attempting to log in with a local account or a Microsoft account? If possible, try booting your computer into Safe Mode by repeatedly pressing F8 during startup. Please let us know if this resolves the issue. If not, kindly provide recent details or error messages to help us diagnose further.",Incident,IT Support,medium,en,51,Login,Tech Support,Windows,Performance,,,,
Inquiry for In-Depth Platform Architecture Details,"Dear Customer Support Team,\n\nI hope this message reaches you in good health. I am writing to request comprehensive information about the system architecture. Gaining an understanding of the foundational structural elements is essential for us to facilitate smooth integration and optimize service utilization.\n\nSpecifically, we are interested in details about the platform's main modules, data transmission processes, security measures, scalability capabilities, available API interfaces, and customization options. Additionally, insights into the technology stack and deployment environment would be greatly appreciated.\n\nThank you for your assistance. Please provide any relevant technical documentation. If necessary, kindly inform us of a suitable time to meet with a specialist.","Thank you for your inquiry. We will share the relevant technical documentation. If needed, please let us know a convenient time for a consultation with our expert.",Request,Technical Support,low,en,51,Product,Documentation,Feedback,IT,,,,
Immediate Attention Needed: Multiple Device Failures Disrupting Functionality,"Dear Support Team,\n\nI am submitting a report regarding several faults observed across various hardware and software components of the products. These issues have considerably disrupted the user experience and impaired the effective operation of the devices. Hardware concerns include unexpected shutdowns and connectivity disruptions, while software problems involve frequent crashes and unresponsive features. I would be grateful for swift assistance in diagnosing and fixing these malfunctions. Kindly advise on the necessary procedures to resolve these issues and facilitate repairs.","Thank you for reaching out to us, <name>. To assist you efficiently, could you please specify the affected product models and versions, as well as provide details about when the issues began and any error messages encountered? If possible, also share your preferred contact number and a suitable time for us to call and support you.",Incident,Product Support,high,en,51,Hardware,Software,Disruption,Outage,Tech Support,,,
Difficulties in Coordinating Agile Teams,"Dear Customer Support Team,\n\nI hope this message finds you well. I am writing to highlight ongoing difficulties encountered in synchronizing our agile teams within the organization. Despite our efforts, we continue to face frequent miscommunications, delays in task handovers, and inconsistent sprint results. These issues are negatively affecting overall productivity and team morale.\n\nWe have tried various approaches to enhance coordination, such as regular stand-up meetings, improved documentation, shared communication platforms, but the problems persist. We would appreciate your guidance on resolving these challenges.","Thank you for bringing up the coordination issues within your agile teams. To better assist you, could you specify which project management and collaboration tools your squads are currently utilizing, whether they are remote, on-site, or hybrid? Meanwhile, we recommend clearly defining user stories, roles, and responsibilities within the teams, and establishing a single source of truth for task tracking. Tools like Jira, Trello, and Microsoft Teams can help centralize communication and task management. Additionally, we can share agile practice guides to support your efforts.",Problem,Customer Service,medium,en,51,Agile,Coordination,Communication,Project Management,Team,Performance,Disruption,
Billing Concerns for Multiple Subscriptions,"Dear Customer Support,\n\nI am reaching out to highlight an issue with billing related to several of my product subscriptions. Recently, I observed that my account was incorrectly charged for multiple subscriptions. Specifically, there were multiple billing entries for certain products, and in some cases, the billed amounts corresponded to the prices listed on the website.\n\nAfter reviewing my bank statements and subscription details, I noticed discrepancies that caused confusion and raised concerns about the accuracy of the billing process. I kindly ask for your assistance in investigating and resolving this matter.","Thank you for contacting us regarding your billing concerns, <name>. To assist with resolving this issue, please provide your account number and the email address associated with your subscriptions. Once we have this information, we can review the charges, clarify any discrepancies, correct errors, and advise on how to prevent similar issues in the future. We appreciate your patience.",Incident,Billing and Payments,low,en,51,Billing,Refund,Payment,Account,,,,
Microservices Deployment Issue,"Dear Customer Support Team,\n\nI am writing to report an incident involving delays in deploying microservices within our cloud-native SaaS platform. Since the issue started, I have observed unpredictable lag times that significantly hinder the deployment process of microservices, adversely affecting operational efficiency and user experience.\n\nThe problem seems to be connected to the Kubernetes orchestration and CI/CD pipeline workflows. Despite attempts to resolve the issue, such as restarting failed pods, the delays continue to occur.","Thank you for reporting the microservices deployment delays. To assist you promptly, could you please share recent deployment logs, details about the Kubernetes cluster (such as version and node status), and your CI/CD pipeline configurations? This information will help us investigate potential issues within the orchestration process. Please also specify your preferred method for secure access. In the meantime, verify that the cluster resources and pipeline dependencies are up to date. We look forward to working together to resolve this swiftly.",Incident,Technical Support,medium,en,51,Bug,Performance,Outage,Disruption,Deployment,Cloud,Microservices,SaaS
Hinweise zu Rückgaben und Umtausch,"Sehr geehrtes Kundenservice-Team,\n\nich hoffe, diese Nachricht erreicht Sie wohl. Ich wende mich an Sie, um detaillierte Informationen zum Ablauf von Rückgaben und Umtausch bei Bestellungen zu erhalten, die auf Ihrer Plattform getätigt wurden. Kürzlich habe ich ein Produkt erworben, das leider nicht meinen Erwartungen entspricht, und möchte die Schritte für eine Rückgabe oder einen Umtausch verstehen.\n\nKönnten Sie bitte umfassende Hinweise auf Ihre Rückgaberichtlinien bereitstellen? Besonders interessiert mich, innerhalb welchen Zeitraums Rückgaben und Umtausch beantragt werden müssen, welche Bedingungen und Einschränkungen gelten und ob Kaufbelege erforderlich sind.","Vielen Dank, dass Sie sich bezüglich des Rückgabe- und Umtauschprozesses an uns gewandt haben. Rückgaben und Umtausch sind innerhalb von 30 Tagen nach Erhalt der Bestellung möglich, sofern der Artikel unbenutzt ist und sich in der Originalverpackung befindet. Ein Kaufbeleg ist erforderlich. Bitte beachten Sie, dass bei bestimmten Sonderangeboten möglicherweise andere Regelungen gelten. Die Versandkosten für die Rücksendung trägt der Kunde, außer bei defekten oder falsch gelieferten Artikeln, in diesem Fall werden die Rücknahmegebühren übernommen. Nach Erhalt des zurückgesandten Artikels erfolgt die Bearbeitung in der Regel innerhalb von...",Request,Returns and Exchanges,medium,de,51,Return,Refund,Product,Customer Service,,,,
Microsoft Surface Pro 8 Connectivity Issue,"Sehr geehrtes Support-Team,\n\nich wende mich an Sie, um Unterstützung bei einem anhaltenden Verbindungsproblem mit meinem Microsoft Surface Pro 8 zu erhalten. Das Gerät verliert regelmäßig die WLAN-Verbindung, was meine Produktivität erheblich beeinträchtigt. Für private Nutzung ist eine stabile Internetverbindung unabdingbar. Trotz Durchführung grundlegender Fehlerbehebungen wie Neustart des Geräts, Aktivierung des Flugmodus und Zurücksetzen der Netzwerkeinstellungen tritt das Problem sporadisch im Tagesverlauf auf.\n\nAußerdem wurde bestätigt, dass mein Surface Pro 8 mit der neuesten Windows-Version läuft und alle verfügbaren Updates installiert sind.","Vielen Dank, dass Sie uns bezüglich des Verbindungsproblems mit Ihrem Microsoft Surface Pro 8 kontaktiert haben. Sie haben bereits die üblichen Fehlerbehebungen durchgeführt und bestätigt, dass das Problem spezifisch an Ihrem Gerät besteht. Ich empfehle, die Treiber des WLAN-Adapters im Geräte-Manager neu zu installieren, die Verbindung im abgesicherten Modus zu testen und mögliche Softwarekonflikte auszuschließen. Falls das Problem weiterhin besteht, lassen Sie uns bitte wissen, ob ungewöhnliche Geräusche hörbar sind oder sichtbare Schäden am Gerät vorliegen. In diesem Fall würde eine Hardwareüberprüfung und die Einleitung eines Reparaturauftrags erforderlich sein.",Incident,Technical Support,medium,de,51,Network,Connectivity,Hardware,Tech Support,,,,
Problem bei Produktretoure,"Sehr geehrtes Kundendienstteam,\n\nich wende mich an Sie, um Unterstützung bei einem Problem mit der Software eines kürzlich erworbenen elektronischen Geräts zu bitten. Das Gerät weist Fehlfunktionen auf, die die Nutzung erheblich einschränken, was vermutlich auf Inkompatibilitäten mit meinem System oder möglicherweise auf Defekte zurückzuführen ist.\n\nZur Klärung habe ich bereits mehrere erste Lösungsschritte unternommen, darunter das Zurücksetzen der Software gemäß den Anleitungen in den Handbüchern. Trotz meiner Bemühungen bestehen weiterhin Probleme.","Vielen Dank, dass Sie uns bezüglich Ihres Rückgabeanliegens kontaktiert haben. Damit wir Ihnen weiterhelfen können, bitten wir Sie, Ihre Bestellnummer, die Seriennummern der Produkte sowie eine kurze Beschreibung des spezifischen Problems bereitzustellen. Diese Informationen ermöglichen es uns, die Berechtigung im Rahmen unserer Rückgaberichtlinien zu prüfen und die nächsten Schritte zu empfehlen. Falls Sie Kaufbelege besitzen, fügen Sie diese bitte ebenfalls bei. Nach Erhalt der Details werden wir den Rückgabe- oder Umtauschprozess einleiten.",Incident,Returns and Exchanges,high,de,51,Product,Return,Software,Hardware,Disruption,Assistance,,
Details zu Integrations- und Supportprozessen,"Sehr geehrtes Kundendienstteam,\n\nich hoffe, diese Nachricht erreicht Sie wohlbehalten. Ich möchte Sie um ausführliche Informationen bezüglich der Integration und der Supportprozesse im Zusammenhang mit der Verwaltung von Python-basierten Machine-Learning-(ML)-Modellen für Echtzeit-Analysen innerhalb einer Big-Data-Lake-Architektur bitten. Die Organisation plant, fortschrittliche ML-Fähigkeiten für die Echtzeit-Datenanalyse zu nutzen, weshalb das Verständnis der Plattformunterstützung und der Technologieoptionen für die strategische Planung von großer Bedeutung ist.\n\nKönnten Sie bitte umfassende Details zu diesem Thema bereitstellen, insbesondere hinsichtlich der Systembereitstellung, Überwachung und Wartung von Python-basierten ML-Modellen? Zudem wären Einblicke in die verfügbaren Support-Mechanismen sehr hilfreich.","Vielen Dank für Ihre Anfrage bezüglich der Integration und Unterstützung von Python-basierten ML-Modellen für Echtzeit-Analysen. Unsere Plattform bietet native Unterstützung für Python, inklusive vorgefertigter Konnektoren, REST-APIs und Tools zur einfachen Bereitstellung und Analyse der Modelle. Wir stellen rund um die Uhr Support bereit, führen regelmäßige Updates durch und bieten detaillierte Überwachungstools zur Leistungsüberprüfung sowie Fehlerbehebung. Bitte teilen Sie uns die spezifischen ML-Frameworks und Datenvolumen mit, damit wir maßgeschneiderte Empfehlungen hinsichtlich Skalierbarkeit und Latenz entwickeln können.",Request,IT Support,high,de,51,Feature,IT,Tech Support,Performance,,,,
Security Protocols for Product Compatibility,"Dear Customer Support Team,\n\nI am seeking detailed guidance on security integration procedures for ensuring compatibility when deploying the listed devices and applications within a healthcare setting. It is critical to achieve smooth integration while adhering strictly to industry standards such as HIPAA, GDPR, and ISO 27001.\n\nCould you kindly supply comprehensive documentation that details best practices and outlines how the products comply with these standards? Furthermore, I would appreciate information on specific configuration parameters and security measures.","Thank you for your inquiry. Please specify which devices and applications you are interested in, so we can provide detailed compatibility, security, and compliance documentation tailored to a healthcare environment.",Request,Sales and Pre-Sales,medium,en,51,Security,Product,Documentation,Tech Support,,,,
Multiple Equipment Malfunctions Reported,"Dear Customer Support Team,\n\nI am submitting a report regarding a severe problem impacting several vital devices used in clinical procedures. Over the past few hours, numerous essential devices, such as tablets, encrypted USB sticks, and monitors, have all unexpectedly ceased functioning at the same time. This unforeseen malfunction has significantly interrupted our routine clinical activities, thereby jeopardizing patient care and operational productivity.\n\nOur team suspects that the cause of these failures might be connected to recent changes or updates.","Thank you for bringing this urgent matter to our attention. We recognize the critical nature of device failures affecting clinical operations and will prioritize your request accordingly. To assist you efficiently, could you please provide detailed information about the affected devices, including specific models, serial numbers, and accompanying screenshots of error messages or symptoms observed? Additionally, if there have been any recent infrastructure updates or modifications that might coincide with the onset of these failures, kindly share those records with us.",Incident,Technical Support,high,en,51,Hardware,Disruption,Equipment,Tech Support,,,,
Intermittent Network Connection Problems Continue,"Dear Customer Support Team,\n\nWe are facing sporadic network disconnections that impact several devices connected across different departments within the office. These disruptions persist despite our troubleshooting efforts. We suspect that the router may be overloaded or there could be performance issues with the NAS, which might be causing the problem. We have already tried restarting the router and modem; however, the connectivity issues remain throughout the office network.\n\nThese interruptions are greatly affecting our daily tasks, and we would be grateful for your assistance.","Thank you for contacting us regarding the ongoing intermittent network issues affecting multiple devices within your office. We understand how disruptive this can be and appreciate the troubleshooting steps you have already undertaken, including rebooting the router and modem.\n\nTo help us diagnose the problem more effectively, could you provide additional details? Specifically, please let us know whether the affected devices are connected via wired Ethernet, Wi-Fi, or both. This information will help us identify the root cause of the connectivity drops.",Problem,Technical Support,high,en,51,Network,Disruption,Performance,Troubleshooting,,,,
