subject,body,answer,type,queue,priority,language,version,tag_1,tag_2,tag_3,tag_4,tag_5,tag_6,tag_7,tag_8
Starke Abnahme der Beteiligungsraten bei digitalen Marketingleistungen,"Wir erleben eine starke Abnahme der Beteiligung bei digitalen Marketingleistungen, was auf die neuesten Änderungen der Algorithmen sozialer Plattformen zurückzuführen ist. Wir haben versucht, unsere Inhaltsstrategie anzupassen und Anzeigen zu optimieren, aber das Problem behält sich trotzdem bestehen. Die Beteiligungsmetriken sind deutlich gestiegen, wir kämpfen jedoch darum, unser Zielpublikum zu erreichen. Wir freuen uns auf Ihre Unterstützung und Anleitung, um das Problem zu lösen.","Sehr geehrte [name],\n\nich schreibe an Sie, um das Thema der starken Abnahme der Beteiligungsraten bei digitalen Marketingleistungen für Konto [acc_num] zu bestätigen. Ich verstehe, dass trotz der Anpassung der Inhaltsstrategie und der Optimierung der Anzeigen das Problem weiterhin besteht. Um Ihnen besser zu helfen, würde ich Sie bitten, uns mehr spezifische Informationen über die sozialen Plattformen und die Arten der Anzeigen zu berichten, auf denen das Problem auftritt. Zudem wäre es sehr hilfreich, wenn wir den genauen Zeitraum zu kennen bekämen, in dem die Beteiligungsmetriken abgenommen haben. Ich freue mich, Sie telefonisch zu sprechen, um diese Angelegenheit zu besprechen, falls dies für Sie in Ordnung ist.",Problem,Technical Support,high,de,400,Feedback,Performance,Feature,Documentation,,,,
,"Customer support, we have encountered a sudden drop in brand engagement metrics. It is possible that a recent update to our marketing automation software has disrupted campaign delivery. Despite attempting to revert previous configurations and reinitiating campaigns, we have not been successful. We request your assistance in resolving this issue.","Regarding the sudden drop in brand engagement metrics, we are sorry to hear about the issues you are experiencing with the marketing automation software. We understand that you have already tried reverting previous configurations and reinitiating campaigns without success. To better assist you, could you please provide any specific error messages you are seeing and the exact steps you took to revert previous configurations? If needed, we can schedule a call.",Incident,Product Support,high,en,400,Bug,Performance,Feature,Feedback,IT,Tech Support,,
Details on SaaS Billing Process,"I am inquiring about the billing process for the SaaS project management services. Could you provide information on how the billing cycle works, the payment methods that are accepted, any discounts available for long-term commitments or bulk subscriptions? Your additional details would greatly help me understand the billing process and make an informed decision about using the services.","Dear [Name], we are happy to provide detailed information regarding the SaaS billing process, accepted payment methods, available discounts for long-term commitments and bulk subscriptions. Please allow us to contact you at [Tel Num] to discuss these further.",Request,Billing and Payments,medium,en,400,Billing,Payment,Subscription,Feedback,Sales,Documentation,,
Problem with Marketing Analytics Data,"Facing issues with the accurate updating of digital marketing campaign analytics. The problem might have arisen due to recent platform changes or server downtime. I have already tried restarting the analytics tool and clearing the cache, but the issue still persists. Please assist us in resolving this matter as soon as possible.","We will investigate the issue with marketing analytics data. Please provide your account number and the specific campaign affected, so we can resolve the matter at your convenience and as soon as possible.",Incident,Technical Support,medium,en,400,Bug,Performance,Outage,IT,Tech Support,,,
Please Improve Integration Features,"Customer support, kindly consider enhancing the integration capabilities for our listed products, which would significantly boost project management efficiency and user experience. We believe this improvement would be beneficial, and users would greatly appreciate it. We hope you will consider our request at your earliest convenience. Thank you for your assistance.",We will review your request to enhance integration capabilities and will contact you soon to discuss further.,Change,Product Support,medium,en,400,Feature,Feedback,Product,,,,,
Verbesserung der digitalen Werkzeuge,Bitte kontaktieren Sie uns. Die Optimierung der digitalen Werkzeuge könnte die Markensichtbarkeit verbessern und das Wachstum fördern. Eine vereinfachte Integration könnte das allgemeine Leistungsprofil verbessern und einen breiteren Publikumsmarkt erreichen lassen.,"Vielen Dank für Ihr Interesse an der Optimierung der digitalen Werkzeuge und der verbesserten Markensichtbarkeit. Wir werden Ihren Antrag prüfen und können Sie gerne auf <tel_num> anrufen, um weitere Details und mögliche Lösungen zu besprechen. <acc_num>",Change,IT Support,medium,de,400,Feedback,Product,Feature,Performance,,,,
Enhance Digital Strategies with Microsoft Azure Zapier,I am seeking assistance in optimizing our digital strategies using Microsoft Azure and Zapier. Our goal is to enhance brand growth and market reach. We need help integrating various tools to streamline operations and improve efficiency. Could you please provide guidance on how to get started and recommend best practices for implementation? I look forward to hearing from you soon.,I will provide guidance on integrating Microsoft Azure and Zapier to optimize your digital strategies. Please allow me to schedule a call to discuss and recommend best practices for implementation at a time that suits you.,Change,Technical Support,medium,en,400,Feature,Feedback,IT,Tech Support,,,,
Medizinische Datensicherheitsprobleme,"Es trat ein Vorfall auf, der potenzielle Schwachstellen in der Datensicherung medizinischer Informationen verursachte, die aufgrund von Software-Configurationsfehlern entstanden sind. Um das Problem zu beheben, wurden Systemprüfungen und Sicherheitsaktualisierungen durchgeführt.","Wir haben sofortige Maßnahmen ergriffen, um die potenziellen Schwachstellen in der Datensicherung medizinischer Informationen zu beheben. Dazu gehörten Systemprüfungen und die Durchführung von Sicherheitsaktualisierungen. Unsere Ziele sind es, weitere Vorfälle zu vermeiden und den Schutz sensibler Informationen, einschließlich Kundenkonto-Nummern wie <acc_num>, zu gewährleisten.",Incident,Technical Support,medium,de,400,Security,Bug,Performance,IT,Tech Support,,,
Kundenservice digitale Wachstumsstrategien,"Informationen über digitales Marketing, Markenwachstum und die Anwendung von Magento benötigt?","Bitte kontaktieren Sie uns, um digitale Strategien und Wachstum mit Magento zu besprechen.",Request,Technical Support,medium,de,400,Feedback,Sales,IT,Tech Support,,,,
Hospital System Security Issue,"An unauthorized access attempt has been detected on our hospital systems, which may have occurred due to outdated software or phishing. We are addressing this issue by applying security patches to the affected software and conducting user training sessions to prevent similar incidents in the future. We have reviewed access logs for any suspicious activity and have implemented additional measures to enhance system security. Our team is working diligently to ensure the integrity of patient data and to prevent potential breaches. If you have any questions, please let us know.","Dear [Name], thank you for your email regarding the hospital system security issue. We are pleased to inform you that security patches have been applied and user training sessions have been conducted to prevent similar incidents. Could you please provide more information on the review of access logs and the additional measures taken to enhance system security? If available, I would like to schedule a call at [Phone Number] to discuss the matter and address any questions or concerns you may have regarding the hospital's system security. Best regards.",Incident,Technical Support,high,en,400,Security,IT,Tech Support,Training,Alert,,,
Problem with Data Analytics Tool,"Customer Support, encountering issues with the financial firm's data analytics tool while preparing a report. The tool is malfunctioning, leading to inaccurate investment optimization results. Steps taken include updating the relevant software and checking error logs for insights, but the issue still persists. Possible causes might be software integration problems or outdated data inputs. We would greatly appreciate your assistance in resolving this matter as soon as possible. Please let us know.",Please review the issue and contact us at <tel_num> to discuss and determine the next steps to resolve the data analytics tool malfunction.,Incident,Customer Service,low,en,400,Bug,Performance,IT,Tech Support,Feedback,,,
Verbessern Digitalmarketing-Werkzeuge,"bitte schreiben, um Marketing-Werkzeuge zu integrieren, um die Effektivität unserer digitalen Strategie auf mehreren Plattformen zu verbessern. Wir helfen dabei, die Online-Präsenz besser zu verwalten und die Gesamtleistung des Marketing zu steigern.","geehrte <name>, vielen Dank für Ihre Anfrage. Wir werden uns um die Integration von Marketing-Werkzeugen bemühen, um die Effektivität Ihrer digitalen Strategie zu verbessern. Wir schätzen Ihre Bereitschaft, die Online-Präsenz und die Leistung des Marketing zu verbessern. Um Ihre Anforderungen besser zu verstehen, könnten Sie uns bitte mehr Informationen zu dem spezifischen Marketing-Werkzeug und den Plattformen geben, mit denen Sie zurzeit arbeiten. Dies ermöglicht es uns, die besten Integrationsmöglichkeiten für Ihr Unternehmen zu bewerten und Ihnen einen Vorschlag zu geben. Falls weitere Diskussionen erforderlich sind, können Sie telefonisch <tel_num> mit uns in Kontakt treten. Geben Sie bitte ein geeignetes Zeitfenster an, wir freuen uns darauf, Ihnen zu helfen.",Change,Technical Support,high,de,400,Feedback,Product,Feature,Sales,,,,
Hilfe bei Datenproblemen,"In der letzten Datenupload-Operation entstand ein Fehlers, der falsche Investitionsleistungsmaße verursachte. Ich habe versucht, die Daten erneut hochzuladen, aber das Problem behält sich beständig. Deshalb benötige ich Unterstützung, um das Problem zu lösen.","Sehr geehrter Kunde, ich stehe Ihnen zur Verfügung, um das Datenproblem zu beheben. Tut mir leid, dass die kürzliche Datenupload-Operation falsche Investitionsleistungsmaße hervorrief. Um eine bessere Lösung anzubieten, bitte ich Sie, mehr Details über den Datenmapping-Fehler und die Schritte, die Sie bisher unternommen haben, zu teilen. Wir könnten gerne telefonisch darüber sprechen. Wäre es für Sie eine passende Zeit, um jetzt anzurufen? Ansonsten teilen Sie mir bitte den passenden Zeitpunkt mit. Sie können mich unter dem angegebenen Telefonnummer erreichen, um das Problem zu besprechen.",Incident,Product Support,high,de,400,Bug,Performance,IT,Tech Support,,,,
Support for SaaS Project Using MySQL 8.0,"Inquiring about support for integrating MySQL 8.0 into a scalable SaaS project management solution. Would appreciate insights and best practices for the integration, as well as information on compatibility and potential challenges that might arise during the process. Additionally, looking for guidance on how to optimize the performance of the database solution. Please provide specific requirements and recommendations for the integration process. Looking forward to hearing back to explore the solution and support our project management needs.","Thank you for reaching out to our support team regarding the integration of MySQL 8.0 into your SaaS project management solution. We will provide you with practices and guidance on compatibility and potential challenges. The solution is compatible with MySQL 8.0, and we recommend checking specific requirements for optimal performance. We would be happy to discuss and explore the solution to support your project management needs. We are available for a call at your convenience to discuss the details of the integration and answer any questions you may have regarding the solution.",Request,Technical Support,medium,en,400,Feature,Performance,Documentation,Tech Support,,,,
Enhancement of Investment Optimization Procedures,Facing disruptions in investment optimization processes owing to Elasticsearch problems.,We apologize for the disruptions in your investment optimization procedures due to Elasticsearch issues. Could you please provide the error message you are encountering? We are happy to assist in resolving the issue as soon as possible.,Incident,Technical Support,high,en,400,Feature,Disruption,Feedback,,,,,
Unterstützung bei Dienstausfall,"Es trat ein unerwarteter Dienstausfall auf, der die Projektverwaltungsschaltflächen beeinträchtigt. Es könnte möglicherweise auf die neueste Softwareaktualisierung und API-Änderungen zurückgehen. Ich habe versucht, die Dienste neu zu starten und die Logs nach Fehlern zu überprüfen.","Sehr geehrte [name], vielen Dank für Ihre Nachricht. Wir bedauern den Dienstausfall und die Beeinträchtigung der Projektverwaltungsschaltflächen. Es ist bedauerlich, dass der Betriebsprozess gestört wurde. Wir verstehen, dass die neueste Softwareaktualisierung und API-Änderungen möglicherweise das Problem verursachen könnten. Um die Quelle des Problems zu identifizieren und eine Lösung anzubieten, benötigen wir mehr Details. Bitte geben Sie uns die Fehlermeldungen und die Logs, die Sie gefunden haben, sowie die Schritte, die Sie unternommen haben, um die Dienste neu zu starten. Es ist korrekt, dass Sie uns kontaktieren sollen [tel_num], um die Angelegenheit genauer zu besprechen.",Incident,Product Support,high,de,400,Outage,Disruption,Performance,Bug,IT,Tech Support,,
Detected Problem with System Performance,"The system performance is slowing down, which is affecting the data analytics. It might be due to server overload during peak usage. After restarting the servers and clearing the cache, the issues still persist. We need your assistance to resolve this.","We have received your email regarding the system performance issue that is impacting data analytics. We have taken initial steps by restarting the servers and clearing the cache. To assist you better, could you please provide details on the current symptoms or any error messages you are experiencing? This will help us understand the issue more clearly. We are flexible and can schedule a call at a time that is convenient for you. I would suggest some times for your convenience.",Incident,Service Outages and Maintenance,high,en,400,Performance,Outage,Tech Support,,,,,
Medical Data Protection,"We need to implement robust security measures to safeguard medical data and ensure compliance with healthcare regulations in our hospital systems. This should include encrypting sensitive information, implementing strict access controls, and conducting regular audits.","Thank you for bringing the protection of medical data in our hospital systems to our attention. We take security and compliance with healthcare regulations very seriously. To address your concerns, we will implement enhanced security measures such as encrypting sensitive information, enforcing strict access controls, and conducting regular audits to ensure the integrity of the medical data. Our team will review and update our current security protocols to meet the latest healthcare regulations. We would like to discuss this further and would appreciate your input.",Change,IT Support,high,en,400,Security,Compliance,IT,Tech Support,,,,
API Support,"Ich habe eine Anfrage bezüglich der API-Dokumentation und benötige detaillierte Informationen für die Integration in unser Projektmanagement-Software-as-a-Service (SaaS)-System. Könnten Sie mir Schritt-für-Schritt-Anweisungen zur Integration der API bereitstellen, die mein Verständnis des Implementierungsprozesses erheblich unterstützen? Ich freue mich auf Ihre Rückmeldung und danke Ihnen im Voraus für Ihre Unterstützung.","Wir werden Ihnen per E-Mail detaillierte API-Dokumentation und Schritt-für-Schritt-Integration-Anweisungen zukommen lassen. Bitte geben Sie uns 24 Stunden, um die notwendigen Informationen vorzubereiten.",Request,Technical Support,high,de,400,Documentation,Feature,Feedback,IT,Tech Support,,,
Sichere medizinische Daten,"Können detaillierte Informationen zur Verschlüsselung medizinischer Daten für Norton Antivirus, SAP ERP und Hospital-IT-Umgebungen bereitgestellt werden?","Informationen zur Verschlüsselung medizinischer Daten für Norton Antivirus, SAP ERP und Hospital-IT-Umgebungen werden per Telefonanruf oder E-Mail bald bereitgestellt.",Request,Product Support,high,de,400,Security,Documentation,IT,,,,,
Medical Data Security Guidance,Is there a way to offer advice on securing medical data at the hospital using Outlook and OneNote? It's essential to ensure that patient information is protected and compliant with regulations. Could you please provide steps and resources to achieve this? I would greatly appreciate any advice on data security in this context.,"For guidance on securing medical data at the hospital using Outlook and OneNote, please contact <tel_num> to discuss compliance practices and receive relevant resources and steps to ensure patient information is protected.",Request,IT Support,high,en,400,Security,Compliance,Documentation,,,,,
Security Concerns Regarding Unauthorized Access,Encountered unauthorized access attempts on systems.,Seeking details on the unauthorized access attempts on systems. Please provide information on the date and time of the attempts for us to discuss and proceed with the appropriate security protocols.,Incident,Product Support,medium,en,400,Security,Account,IT,Tech Support,,,,
Anfrage zur Unterstützung bei möglichen Datenverlusteinträgen im Gesundheitsversorger-System,"Wir haben möglicherweise eine Datenverlustsituation im Gesundheitsversorger-System festgestellt, was auf unerlaubten Zugriff durch eine Schwachstelle zurückzuführen sein könnte. Bitte teilen Sie uns weitere Details zur Verlustsituation mit, einschließlich des genauen Datums und jeglicher Maßnahmen, die bereits ergriffen wurden. Zudem wäre es hilfreich, zu erfahren, welche Art von Daten möglicherweise betroffen sind. Wir nehmen den Sachverhalt ernst und sind bereit, alles notwendige zu tun, um die Schäden zu minimieren und effektive Unterstützung zu gewährleisten.","Sehr geehrte/r [Name],\n\nunser Team hat eine mögliche Datenverlustsituation im Gesundheitsversorger-System festgestellt, die auf unerlaubten Zugriff durch eine Schwachstelle zurückzuführen sein könnte. Wir nehmen diesen Sachverhalt sehr ernst und sind bereit, Ihnen Unterstützung zu gewähren, um die möglichen Schäden zu minimieren.\n\nUm effektive Unterstützung zu gewährleisten, bitten wir Sie, uns weitere Details zur Verlustsituation zu liefern, einschließlich des genauen Datums und jeglicher Maßnahmen, die bereits ergriffen wurden. Darüber hinaus wäre es hilfreich, wenn Sie uns mitteilen könnten, welche Art von Daten möglicherweise betroffen sind.\n\nWir werden uns mit Ihnen in Kürze in Verbindung setzen, sobald wir weitere Informationen haben.\n\nMit freundlichen Grüßen,\n[Ihr Name]",Incident,Human Resources,low,de,400,Bug,Security,IT,Tech Support,,,,
Unterstützung bei Problemen mit der Datenerfassung in RapidMiner,"Eine finanzielle Firma hat Schwierigkeiten bei der Datenerfassung in RapidMiner, was die Investmentanalyse beeinträchtigt. Kürzliche Software-Updates könnten Kompatibilitätsprobleme verursacht haben. Versucht, das Programm neu zu starten und die Daten erneut hochzuladen, das Problem behält jedoch bestanden. Unterstützung benötigt, um das Problem zu beheben und die Analyse wiederherzustellen. Bitte geben Sie Rat, wie Kompatibilitätsprobleme debuggen können?","Ich helfe gerne bei den Datenerfassungsproblemen in RapidMiner. Ich möchte mehr über die genauen Fehlernachrichten erfahren, die Sie erhalten haben, nach den kürzlich installierten Software-Updates. Bitte geben Sie mir weitere Informationen, damit ich Ihnen besser helfen kann. Wenn Sie möchten, können wir auch gerne an einer späteren Zeit telefonisch näher über das Thema sprechen.",Incident,Customer Service,medium,de,400,Bug,Performance,IT,Tech Support,,,,
Concern Regarding SaaS Project Management Tool,"Facing integration problems with the SaaS project management tool. After trying to revert to previous versions and clearing cache data, the issue still persists. It seems that recent updates might have caused compatibility issues. I would really appreciate your help in resolving this to avoid any disruptions to our workflow. Please let us know what the next steps are. I look forward to hearing from you soon.",Please review the issue and contact us at <tel_num> to discuss the next steps for resolving the SaaS project management tool integration failures.,Incident,Returns and Exchanges,low,en,400,Bug,Performance,Disruption,IT,Tech Support,,,
Notification on Detected Breach,"Recently, a breach was identified in the hospital's systems, resulting in the compromise of sensitive medical data. Immediate security updates have been deployed and network activity is being closely monitored for any irregularities.","Dear [Name], we acknowledge your email regarding the issue at the hospital. We appreciate the immediate security updates that have been implemented and the monitoring of network activity. To assist further, could you please provide information on the nature of the breach and the systems affected? This will help us better understand the situation and provide the necessary support. We would appreciate a call at a convenient time, [Tel Number], to discuss this further. Please let us know a suitable time that works for you. Thank you for your cooperation in resolving this issue.",Incident,Technical Support,high,en,400,Security,Network,Alert,IT,,,,
Problem with Task Synchronization,"Hello Customer Support, we are experiencing delays in task synchronization across different devices. The issue might be due to increased server load during peak hours. Our team has been monitoring performance metrics and restarted the affected services, but the problem still persists. This is concerning as it may impact the user experience. We are requesting your assistance in resolving this matter. Could you please provide a solution or workaround to minimize these delays? We appreciate your prompt attention to this matter.","Hello, we are investigating the issue with task synchronization delays across devices. To better understand the problem, could you please provide information on any errors or symptoms you are experiencing, as well as the time frames during which delays are most frequent? If needed, we can schedule a call at <tel_num> to discuss this further. We will investigate possible solutions and workarounds to minimize delays and improve the user experience. We appreciate your patience and cooperation while resolving this matter and will keep you updated on our progress.",Incident,Product Support,medium,en,400,Bug,Performance,Outage,Disruption,IT,Tech Support,,
Critical Error,"A critical error has occurred during software integration with Avast, Adobe, and Magento, likely due to compatibility conflicts. Despite updating the software and verifying connection settings, the issue still persists.","Could you please provide more details about the error to assist in resolving the compatibility conflicts with Avast, Adobe, and Magento?",Incident,Customer Service,low,en,400,Bug,Performance,Network,IT,Tech Support,,,
Problem with Data Synchronization Software,"Facing challenges with data synchronization between analytics tools, which is leading to project delays. The issue might be related to compatibility problems between Notion and Outlook. We have already tried restarting the applications and clearing caches, but the problem still persists. This is causing delays in our project timeline, and we urgently need assistance in resolving this issue. Could you please provide guidance on how to troubleshoot and resolve these compatibility issues?","To assist with your data synchronization issue, could you please provide more details such as the error messages you are encountering and the versions of Notion and Outlook you are using? This will help guide our troubleshooting process. We can also schedule a call at a convenient time for you to resolve the issue. Your account number is <acc_num>.",Incident,Technical Support,high,en,400,Bug,Performance,Documentation,IT,Tech Support,,,
Sicherheitshilfe,"Anfrage zur Verbesserung der Sicherheitsprotokolle, insbesondere in Bezug auf die medizinische Datenerfassung und die Krankenhaus-IT-Systeme.","Sehr geehrte [name], wir bedanken uns für Ihre Anfrage zur Verbesserung der Sicherheitsprotokolle, insbesondere in Bezug auf die medizinische Datenerfassung und die Krankenhaus-IT-Systeme. Um Ihnen besser zu helfen, könnten Sie uns bitte mehr Informationen über Ihren aktuellen Sicherheitsaufbau sowie Ihre spezifischen Bedenken geben? Ich freue mich darauf, diese Punkte genauer zu besprechen. Falls ein Telefonat möglich wäre, könnten wir die nächsten Schritte erörtern.",Change,Technical Support,high,de,400,Security,Feedback,IT,Tech Support,,,,
