subject,body,answer,type,queue,priority,language,version,tag_1,tag_2,tag_3,tag_4,tag_5,tag_6,tag_7,tag_8
Integrating SendGrid SaaS,"Dear Customer Support, please initiate a contact to obtain more detailed information on integrating SendGrid with our existing project management SaaS platform. We are keen to leverage SendGrid's email services to enhance our communication capabilities. Could you provide more specifics about the integration process, including the necessary APIs, documentation, and support resources? We would be grateful to receive any guidance to integrate SendGrid seamlessly into our platform. Additionally, are there any specific requirements or considerations for the integration process that we should be aware of? Thank you for your time.","To provide SendGrid integration details, please call <tel_num> to discuss further integration requirements for the SaaS platform.",Request,IT Support,medium,de,400,Feature,IT,Tech Support,,,,,
Support Unauthorized Access Attempt,"An unauthorized access attempt on medical data has been detected, which may be due to misconfigured firewall settings. Initial troubleshooting included reviewing system logs and firewall configurations, but the issue still persists and requires assistance. Please provide guidance on how to proceed with the investigation and resolution.","Regarding the case of the unauthorized access attempt on medical data, assistance is needed. Please provide details on the system logs and current firewall settings. Logs from the past 24 hours and a thorough review of the current firewall settings are required for a comprehensive investigation and resolution.",Incident,Customer Service,medium,en,400,Security,IT,Tech Support,,,,,
Support Required for Login Problems,"Facing occasional login difficulties, which might be related to recent system updates. Browser caches have been cleared and passwords have been reset, but the issue continues and requires your help to resolve. Please provide a solution or an alternative workaround.","<name> will assist with the login issue you're experiencing. It's clear you've already tried clearing your browser caches and resetting your passwords. To better assist you, could you provide a detailed description of the issue, including any error messages you receive when attempting to log in? We will schedule a call at <tel_num> to discuss the issue and find a solution or an alternative workaround for account number <acc_num>.",Incident,Customer Service,medium,en,400,Login,Performance,IT,Tech Support,,,,
Support needed for underperforming Marketing Campaigns,"Marketing campaigns are underperforming, raising concerns about brand growth visibility. Inappropriate target audience segmentation and outdated strategies might be the reasons. So far, data from previous campaigns has been analyzed, and target audience segmentation has been adjusted, with improved results.","Please review the concerns regarding underperforming marketing campaigns. We can discuss potential solutions, suggest options, and arrange a call at your convenience. Please let us know when would be a suitable time so we can better understand the situation and be more effective in assisting you.",Incident,Product Support,medium,de,400,Feedback,Performance,Product,Feature,,,,
Inquiry About Investment Analytics Services,"Hello Customer Support, I am inquiring about the investment analytics services your company offers, particularly regarding billing and payment options. Could you provide details on the types of services available and how they can benefit my business? I would greatly appreciate any information you can provide, including pricing and implementation timelines. Thank you for your assistance, and I look forward to hearing back from you soon.","Dear [Name], thank you for your email. We would be happy to provide you with information about our investment analytics services, including billing and payment options, and offer customized solutions that fit your business needs. We can discuss pricing and implementation timelines at your convenience. Please let us know a suitable time for a call at [Tel Number].",Request,Billing and Payments,low,en,400,Billing,Payment,Inquiry,Feedback,Sales,Tech Support,,
Asking for Updates on Digital Strategy Tools,"I am writing to request updates on our digital strategy tools. The current tools provide the necessary insights for tracking brand growth and analytics integration. However, I would like to see improvements in data visualization and reporting features. Additionally, having customizable dashboards for real-time analytics would be beneficial. This would enable us to make more informed decisions and drive business growth. I look forward to hearing about potential updates and enhancements to the tools.","Thank you for your request to update our digital strategy tools to enhance brand growth tracking and analytics integration. We understand the importance of data visualization and customizable dashboards for making informed decisions. We would like to schedule a call to discuss potential updates and enhancements to the tools. I am available at your convenience. Please let us know a suitable time to ensure the call at <tel_num>. In the meantime, we are looking for your specific requirements and examples of insights.",Change,Technical Support,medium,en,400,Feature,Documentation,Feedback,Tech Support,,,,
Unauthorized Access Attempts on Medical Data,"The incident involves unauthorized access attempts to medical data, which may be due to a weak firewall configuration. Measures have been taken to tighten access controls and update security protocols, but ongoing vulnerabilities are still a concern.","Acknowledging the concerns regarding the unauthorized access attempts on medical data. Thanks for taking immediate action to tighten access controls and update security protocols. Please investigate and address any potential ongoing vulnerabilities. Could you provide information on the current security measures in place? I would like to schedule a call to discuss this matter further. I am available to discuss at your convenience, please let me know a suitable time.",Incident,Returns and Exchanges,high,en,400,Security,Network,Bug,Recovery,,,,
Issues with Database Query Speed,Concern about the speed of query execution during data analytics tasks on MySQL.,"Dear [name], we have received your email regarding slow query performance in the MySQL database used for data analytics. To better assist you, could you please provide details on the queries executed and the current database configuration? This information will help us identify the root cause and provide a suitable solution. If needed, we can schedule a call at [tel_num] to discuss further. Please let us know a convenient time.",Incident,Product Support,low,en,400,Performance,IT,Tech Support,,,,,
Enhancing Security Protocols for Medical Data in Smartsheet,"Hello Customer Support, I am writing to inquire about the security measures in place for medical data within Smartsheet, particularly concerning healthcare compliance. As a user in the healthcare industry, it is crucial that our organization adheres to strict data protection regulations. Could you provide detailed information on the encryption methods used, access controls, and security features to ensure the confidentiality, integrity, and availability of sensitive medical information? I would greatly appreciate your guidance on how to configure Smartsheet to meet these requirements. Thank you for your assistance.","Hello [name], thank you for reaching out to our support team regarding security measures for medical data in Smartsheet. We take data protection very seriously and have measures in place to ensure compliance with healthcare regulations. Smartsheet utilizes various encryption methods and access controls to secure data. For detailed information on our security features and guidance on configuration, we would be happy to discuss this with you further. We are available for a call at your convenience to address any specific requirements and provide tailored assistance regarding the securing of medical data. Thank you.",Request,Customer Service,medium,en,400,Security,Compliance,IT,Tech Support,Documentation,,,
Hilfe bei unerlaubtem Zugriff auf das Krankenhausauftrittssystem,Der unerlaubte Zugriff auf das Krankenhausauftrittssystem wurde durch einen Phishing-Angriff ausgelöst. Als erste Schritte wurden die Passwörter geändert und ein Malware-Scan durchgeführt.,"Um das Problem weiter zu untersuchen, kontaktieren Sie uns unter <tel_num>. Mögliche weitere Maßnahmen und Lösungen werden besprochen.",Incident,IT Support,high,de,400,Security,Virus,IT,Tech Support,,,,
Probleme mit Dienststörungen,"Erleben Sie erhebliche Störungen bei Investitionsdatenanalyse-Tools und Zusammenarbetsanwendungen. Obwohl Systemneustarts und die Überprüfung der Benutzerrechte erfolgt sind, bestehen die Probleme weiterhin bei mehreren Produkten.","Entschuldigung für die Dienststörungen bei Investitionsdatenanalyse-Tools und Zusammenarbetsanwendungen. Könnten Sie bitte mehr Details über den Fehler und die betroffenen Produkte liefern? Wir könnten diese am besten am nächsten geeigneten Zeitpunkt besprechen, um mögliche Lösungen zu erörtern.",Incident,Service Outages and Maintenance,high,de,400,Disruption,Performance,IT,Tech Support,Product,,,
Verbesserung des Markenaufbaus durch Optimierung des Digitalen Marketing,Ich benötige Hilfe bei den Strategien und Analysemethoden für ein besseres Markenaufbau im digitalen Marketing.,"Sehr geehrte [name], ich habe Ihre Anfrage zur Unterstützung bei den digitalen Marketingstrategien und Analysen zur Verbesserung des Markenaufbaus verstanden. Um Ihre Bedürfnisse besser zu verstehen, bitten wir Sie, uns mehr Informationen zu Ihren aktuellen Marketinganstrengungen und spezifischen Zielen zu geben. Dies ermöglicht es uns, gezielte Ratschläge und Vorschläge für Verbesserungen zu liefern. Falls gewünscht, können wir telefonisch an einem bestimmten Datum und Zeitpunkt weitere Details besprechen. Bitte lassen Sie uns wissen, wann es am besten für Sie ist, uns zu erreichen.",Change,Technical Support,high,de,400,Feedback,Product,Feature,Sales,Marketing,,,
Probleme bei langsamer Ladegeschwindigkeit von Dashboards,Benutzer begegnen langsamem Laden von Dashboards,"Für das Problem mit dem langsam ladenden Dashboard kontaktieren Sie uns. Falls weitere Informationen benötigt werden, kümmern wir uns schnellstmöglich um die Lösung des Problems.",Problem,Customer Service,low,de,400,Performance,IT,Tech Support,,,,,
Verbessern von Investitionsstrategien durch Datenanalysewerkzeuge,"Sehr geehrte Kundenservice, ich möchte Datenanalysewerkzeuge einrichten, um die Investitionsstrategien zu verbessern. Das Ziel ist es, die Portfolio-Performance der betroffenen Produkte zu optimieren und data-driven Einsichten zu gewinnen, um investitionsmässige Entscheidungen zu treffen. Wir möchten dieparallelen Verbesserungen in der Performance verbessern. Bitte geben Sie Anleitung und die besten Werkzeuge und Methoden an, um das Ziel zu erreichen. Wir sind für eine Beratung offen und freuen uns auf Ihre Rückmeldung. Danke für Ihre Unterstützung.","Sehr geehrte [Name], wir haben Ihre Anfrage bereits bearbeitet und schätzen Ihr Interesse, Datenanalysewerkzeuge zu nutzen, um Ihre Investitionsstrategien zu verbessern. Wir werden uns bemühen, die besten Werkzeuge und Methoden zur Verfügung zu stellen, um Ihren Anforderungen gerecht zu werden. Eine Beratung ist für uns ein großer Vorteil, um Ihnen bei der Optimierung der Portfolio-Performance mit data-driven Einsichten zu helfen. Bitte teilen Sie uns mit, wann ein Anruf am besten für Sie zustande. Wir freuen uns darauf, Ihnen zu helfen. [Telefonnummer]",Change,IT Support,medium,de,400,Feedback,Product,Feature,Performance,Documentation,,,
Alert on Data Loss,"Dear Customer Support,<br><br>We are writing to inform you that our system has encountered a serious issue. An unexpected data breach has occurred, which could potentially expose sensitive medical data. This breach might have arisen due to a vulnerability in third-party software integrations.<br><br>We have attempted to secure the system, updated the software, and implemented additional security protocols, but the breach still persists. We take this matter seriously and are working diligently to resolve it promptly.","Dear [Name], we take the alert regarding the data breach seriously and thank you for your swift communication. To assist in resolving the issue, could you please provide additional details on the vulnerability within the third-party software integrations and the additional security protocols that have been implemented? Additionally, we would like to arrange a call at your convenience to discuss potential solutions and options.",Incident,Customer Service,high,de,400,Security,Alert,Bug,Performance,,,,
Medizinische Datensicherheitsproblematik gemeldet,"Unautorisierten Zugriff auf medizinische Daten festgestellt, möglicherweise aufgrund veralteter Sicherheitsprotokolle. Neueste Softwareupdates könnten die Ursache sein. Firewall-Einstellungen und Passwörter wurden aktualisiert, aber mögliche Schwachstellen wurden immer noch identifiziert. Hilfe benötigt, um das Problem zu beheben und die Sicherheit unserer Daten zu gewährleisten.","Sehr geehrte/r [Name], wir haben Ihre gemeldete Medizinische Datensicherheitsproblematik zur Kontonummer [acc_num] erhalten. Verstehen die Schwere der Situation und bereit, uns zur Lösung des Problems zu helfen. Eine erste Prüfung unserer Sicherheitseinrichtungen deutet darauf hin, dass eine gründlichere Untersuchung erforderlich ist, um den Ursprung des Problems zu identifizieren. Bitte geben Sie uns mehr Informationen zu spezifischen Schwachstellen und eventuellen Fehlermeldungen, die Sie erhalten haben. Wir freuen uns auf einen Telefonanruf, um das Problem genauer zu besprechen.",Problem,Billing and Payments,high,de,400,Security,Virus,IT,Tech Support,,,,
Technical Support Inquiry About Slow Loading Times on Project Management Dashboard During Peak Hours,"The project management dashboard is experiencing slow load times during peak hours, despite attempts to optimize queries and scale server capacity. This has affected users, and assistance is needed to resolve the issue.","<name> has written an acknowledgment of the technical support request related to the slow loading times on the project management dashboard during peak hours. It is understood that despite efforts to optimize and scale server capacity, issues persist and affect users. Assistance is required to gather more information about the environment and the steps taken so far. Please provide details on the server configuration and the optimization efforts made. <name> would be happy to schedule a call at your convenience to discuss the matter further.",Problem,Technical Support,medium,en,400,Performance,IT,Tech Support,,,,,
Concerning Protection of Health Information,"There have been incidents of unauthorized attempts to access health information. Suspicious IP addresses have been blocked, and firewall configurations have been updated.",Please review the incident and contact the analysis team for assistance immediately.,Incident,Technical Support,high,en,400,Security,Virus,Network,IT,Tech Support,,,
Concerns with Data Analytics Tool Processing,"Hello Customer Support, we have encountered issues with the data analytics tool processing investment data efficiently, which might have been caused by a recent software update. Despite attempting to resolve the issue by restarting the system and reprocessing the data, the problems still persist. This inefficiency is causing our team to struggle in meeting their deadlines. We would greatly appreciate if you could look into this matter urgently and provide a solution as soon as possible. Your prompt assistance would be much appreciated, and we look forward to hearing from you soon.","Dear [name], we apologize for the issues you are experiencing with the data analytics tool. We will investigate this matter urgently and request that you contact us at [tel_num] to discuss a possible solution that will help your team meet their deadlines. Thank you for your patience and assistance.",Problem,Technical Support,high,en,400,Bug,Performance,IT,Tech Support,Feedback,,,
Customer Support Inquiry for Digital Strategies,"Hello Customer Support, I am looking to understand better the digital strategies that could help increase our brand's visibility and engagement. Could you provide more information on the methods used to boost our online presence and interact with customers? I am particularly interested in learning about social media campaigns, email marketing techniques, and content creation strategies. Additionally, I would like to know how you approach measuring the success of digital initiatives and how data is used to inform the decision-making process. I believe a better understanding of these strategies would be very beneficial.","<name>, thank you for your email and interest in digital strategies. I would be happy to provide you with the information you need regarding methods used to boost your online presence and interact with customers. Our digital team utilizes a combination of social media campaigns, email marketing techniques, and content creation strategies to increase brand visibility and engagement. To measure the success of our digital initiatives, we rely on key performance indicators such as engagement rates, click-through rates, and conversion rates, which help us inform our decision-making process.",Request,Sales and Pre-Sales,medium,en,400,Feedback,Sales,IT,Tech Support,,,,
Investment Details Inquiry,"Customer Support, I am inquiring about the investment optimization services that utilize data analytics. Could you provide more information on how your team uses data to optimize investment portfolios? Specifically, what data points do you analyze to inform investment decisions? I would greatly appreciate any additional details you can provide about the services. Thank you for your time and assistance. I look forward to hearing back soon.","Dear [Name], thank you for your email regarding our investment optimization services. Our team uses data analytics to analyze market trends and portfolio performance. We would be happy to discuss the services in more detail with you. Could you please let us know a convenient time for us to call you at [Tel_num] to provide more information and answer any questions you may have regarding our investment services and account [Acc_num].",Request,Billing and Payments,low,en,400,Feedback,Sales,Tech Support,,,,,
,"Customer support, assistance with a problem regarding the analytics dashboard in the report issue. The investment performance metrics are displayed incorrectly, which is hindering the decision-making process. This issue might have been caused by the recent software update. I have already attempted to restart the application and clear the cache, but the problem still persists. I would greatly appreciate it if you could look into this matter and provide a solution as soon as possible. Please let me know if you need any additional information to resolve the issue. Thank you for your time and assistance.",We will investigate the issue with the analytics dashboard. Please contact us at <tel_num> if you need to provide any additional information. Thank you.,Problem,Technical Support,high,en,400,Bug,Performance,IT,Tech Support,Feedback,,,
Verschlüsselungssicherheit medizinischer Daten-Dienste,"Geliebte Kundensupport, ich schreibe an Sie, um nach Informationen zu den Sicherheitsmaßnahmen für medizinische Daten in unserem Krankenhaus-IT-Dienst und verwandten Produkten zu suchen. Könnten Sie mir Informationen über das verwendete Verschlüsselungsverfahren, Zugriffssteuerungen und Datenspeicherprotokolle geben? Zudem wäre ich dankbar für Informationen zu Compliance-Zertifizierungen, wie z.B. HIPAA, die die Einhaltung unserer Dienste sicherstellen. Darüber hinaus wäre ich interessiert, zu erfahren, ob Sicherheitsaudits und Penetrationstests durchgeführt wurden, um die Integrität unserer Systeme zu gewährleisten. Bitte geben Sie diese Informationen, damit ich besser verstehen kann, wie wir medizinische Daten schützen.","Geliebte <name>, vielen Dank für Ihre Anfrage bezüglich der Sicherheitsmaßnahmen für medizinische Daten in unseren Krankenhaus-IT-Diensten. Wir nehmen den Datenschutz sehr ernst und haben robuste Sicherheitsmaßnahmen eingerichtet, einschließlich Verschlüsselungsverfahren, Zugriffssteuerungen und sicherer Datenspeicherprotokolle. Unsere Dienste sind in Übereinstimmung mit relevanten Vorschriften, einschließlich HIPAA, gestaltet. Sicherheitsaudits und Penetrationstests wurden durchgeführt, um die Integrität unserer Systeme zu gewährleisten. Sie freuen sich, wenn wir einen Anruf vereinbaren, um die Sicherheitsprotokolle im Detail zu besprechen. Bitte geben Sie mir geeignete Zeit für den Anruf, die Nummer lautet:",Request,Billing and Payments,medium,de,400,Security,Product,Documentation,Feedback,,,,
Recent Feedback on Delayed Responses,"Recently, users have been reporting sluggish response times when accessing project dashboard features during peak hours of high user traffic. Efforts have been made to pinpoint performance bottlenecks and optimize database queries, but the issues remain unresolved. The problem is still under active investigation for resolution.",Received an email concerning the delayed responses on the project dashboard. Offered to provide assistance in gathering details on server performance during peak hours and support in resolving the issue.,Incident,Customer Service,low,en,400,Feedback,Performance,Bug,IT,Tech Support,,,
Report on Significant Service Disruptions,Noted significant service disruptions impacting various tools.,"<name> sincerely apologizes for the service disruptions experienced, which affected multiple tools. Could you please provide details on the times the outages occurred and any error messages received? This information will assist us in investigating and resolving the issue promptly. Should you need to discuss further, please contact us at <tel_num>.",Incident,Service Outages and Maintenance,high,en,400,Disruption,Outage,Performance,IT,Tech Support,,,
Setting Up AutoCAD 2022 SaaS,"Please provide more details on integrating AutoCAD 2022 SaaS with project management tools. Could you share more specifics about the setup and the advantages it brings to the team? We currently use AutoCAD SaaS for design and project management, and we are looking to simplify the workflow integration between both systems. Please let us know the steps we need to take to achieve this and be available for a call to discuss further details.",Looking forward to discussing the integration of AutoCAD 2022 SaaS. Please provide your account number so we can arrange a call to present the setup details and advantages of the integration. We can discuss further details during the call.,Request,General Inquiry,low,de,400,Feature,IT,Tech Support,,,,,
Concerning Incident of Medical Data Security,"There was a security breach in the medical data systems because of the use of outdated software and weak authentication methods. Despite the initial efforts to update the systems, the issues still persist.",We are taking immediate action to address the medical data security issue. An investigation is underway to determine the extent of the breach. We will implement updated software and strengthen authentication protocols to prevent future incidents and ensure the security of sensitive medical data. Updates will be provided as more information becomes available.,Incident,Product Support,medium,en,400,Security,Bug,Performance,IT,Tech Support,,,
Problem with Recent Subscriptions Showing Double Charges,"I am facing billing problems with double charges on recent subscriptions. After reviewing my account settings and reaching out to support, the issue still persists. It might be due to a system misconfiguration or an integration error. I need assistance to resolve this matter.","Dear [Name], we apologize for the billing issues you are experiencing with double charges on recent subscriptions. We would like to assist in resolving this matter. To better understand the issue, could you please provide details on your account settings and any interactions with support? We prefer to schedule a call at [Tel Number]. Please let us know a convenient time for discussing your account [Acc Num].",Problem,Billing and Payments,medium,en,400,Billing,Refund,Account,Performance,Tech Support,,,
Unstimmigkeiten in Modellausgaben bemerkt,"Aktuell sind Unstimmigkeiten in den Ausgaben unserer Investitionsprognosemodelle zu beobachten, möglicherweise auf Probleme zurückzuführen, die durch die Integration neuer Datensätze entstanden sind. Obwohl die Quellen der Daten auf der Analytics-Plattform überprüft und eine Neustart durchgeführt wurde, behält die Problematik ihren Bestand. Unterstützung wird benötigt, um den Fall zu beheben.","Die E-Mail mit dem Thema 'Unstimmigkeiten in Modellausgaben' wurde erhalten. Der Fall wird geprüft. Falls eine Anruf erforderlich ist, kontaktieren Sie uns unter <tel_num>. Weitere Details können besprochen werden, sobald eine geeignete Zeit für die Untersuchung durch das technische Team festgelegt wurde.",Problem,Product Support,medium,de,400,Bug,Performance,IT,Tech Support,,,,
