subject,body,answer,type,queue,priority,language,version,tag_1,tag_2,tag_3,tag_4,tag_5,tag_6,tag_7,tag_8
Support for Data Mismatch Issues,Facing data mismatches across different platforms,"<name>, we hope you reached out to us regarding the data mismatches you are experiencing across various platforms. We apologize for the inconvenience caused and are here to assist in resolving the issue. To better understand the problem, could you please provide details on the discrepancies you have encountered, including specifics on the incorrect data and the platforms where you noticed the issue? This information will help us investigate and troubleshoot the problem more efficiently. If needed, we can schedule a call at your convenience to discuss the matter further. Please let us know a suitable time.",Incident,Product Support,medium,en,400,Bug,Performance,IT,Tech Support,,,,
Network Support Inquiry,"A financial firm encountered connectivity problems with their Netgear CM1000, which disrupted investment analytics due to network overload. The issue was resolved by restarting the router and checking cable connections. ","<name> is writing to acknowledge your network support request regarding the connectivity issues with the Netgear CM1000 at your financial firm. We understand that restarting the router and checking the cable connections resolved the issue. To assist you further, could you please provide the details of the network overload error message? If needed, <acc_num> will look into the matter and schedule a call at <tel_num> to discuss possible solutions.",Incident,IT Support,high,en,400,Network,Performance,IT,Tech Support,,,,
Concern Regarding Data Analytics Tool Efficiency,"The data analytics tool is encountering sporadic performance issues. Recent software updates might be causing server overload. Despite restarting the tool and clearing the cache, the problems continue.","To address this, please investigate the data analytics tool. You can contact us at <tel_num> for troubleshooting. We can arrange a callback at your convenience.",Incident,Technical Support,high,en,400,Performance,IT,Tech Support,Maintenance,,,,
Support for Equipment,"For more information on optimizing investment strategies and utilizing data analysis services, could you please provide additional details? Your assistance is greatly appreciated.","I am pleased to assist with optimizing your investment strategies and utilizing our data analysis services. To better support you, could you please provide more details about your current investment portfolio and your goals? We can then present a personalized solution and arrange a call at a convenient time for further discussion.",Request,Billing and Payments,low,de,400,IT,Tech Support,Feedback,Documentation,,,,
,"Kontaktiere Verbindung herstellen, um medizinische Daten für Produkte sicherzustellen. Könnten IT-Integrationen für Krankenhäuser empfehlen, um die Vertraulichkeit und Integrität sensibler Patientendaten gewährleisten?","Empfehlen sichere Integrationssolutionen für Krankenhäuser, um die Vertraulichkeit und Integrität von Patientendaten zu gewährleisten.",Request,Product Support,medium,de,400,Security,Product,Feature,IT,,,,
weitere Informationen zu digitalen Strategien bereitstellen,"bin sehr interessiert, mehr über die Förderung von digitalen Strategien und deren Beiträge zum Markenwachstum zu lernen. Könnten Sie mir bitte mehr Details und Ressourcen zu diesem Thema liefern? Ich schätze die geteilten Informationen sehr. Vielen Dank für Ihre Unterstützung und Ihre Zeit.","Wir freuen uns, Ihnen Informationen zu digitalen Strategien bereitzustellen. Bitte kontaktieren Sie uns zu einem geeigneten Zeitpunkt, um dieses Thema näher zu besprechen.",Request,Customer Service,medium,de,400,Feedback,Sales,IT,Tech Support,,,,
Concern Over Marketing Campaign,"Customer Support, kindly address the urgent issue related to the ongoing marketing campaign. Despite our efforts to enhance brand engagement through targeted adjustments, the results have not met expectations. We suspect the problem may stem from ineffective targeting and outdated content. We would be immensely grateful if you could review the situation and offer guidance to improve the campaign's effectiveness.","Dear [Name], thank you for reaching out regarding the marketing campaign issue. We would be happy to assist in troubleshooting this problem. Could you please provide us with details on the campaign adjustments made so far? A review of this information will help us provide you with the guidance needed to improve the campaign's performance.",Incident,Returns and Exchanges,low,en,400,Feedback,Sales,Marketing,Performance,,,,
,"Recently, customers have reported sluggish performance, which may be due to increased server load following recent updates. We have cleared the caches and optimized the database queries, but the issue still persists.",Received an email regarding the slow performance issues. Please provide details on the current server load and the investigation into recent updates. We need to know the current server utilization to proceed with troubleshooting.,Problem,Customer Service,medium,en,400,Performance,Outage,Bug,IT,Tech Support,,,
Notwendigkeit eines digitalen Kampagnen Supports,"Die digitale Marketingkampagne des letzten Monats unterachteilt sich. Änderungen an den Algorithmen könnten die Sichtbarkeit beeinträchtigt haben. Ad-Spenden und Werbe-Kreativen wurden angepasst und brachten Verbesserungen. Bitte helfen Sie uns, den Umfang des Problems festzustellen und Vorschläge für Lösungen zu erstellen, um die Kampagne auf den richtigen Weg zu bringen.","Die Kampagne durchzusehen, kontaktieren Sie bitte <tel_num>, um mögliche Lösungen für die nächsten Schritte zu besprechen.",Incident,Product Support,medium,de,400,Feedback,Feature,IT,Tech Support,,,,
Application facing occasional performance lags,Solution needed,"Examining the intermittent performance lags in the application. To better assist you, could you please provide details about the issue, its frequency, and any error messages received? You can contact <tel_num> to discuss this further.",Problem,Customer Service,medium,en,400,Performance,Bug,IT,Tech Support,,,,
,"Customer Support, exploring digital strategies for brand growth. Could you provide information on the techniques and tools used to increase brand awareness and engagement? I would greatly appreciate any insights or guidance you can offer. Thank you for your assistance. I look forward to hearing from you soon. Your help is greatly appreciated in this matter.","Dear [Name], thank you for reaching out to our customer support team. We appreciate your interest in digital strategies for brand growth. Our team employs a combination of social media marketing, content creation, and email campaigns to increase brand awareness and engagement. We leverage analytics tools to track performance and make data-driven decisions. For specific information, we would be happy to discuss further with you. I would be available for a call at your convenience to explore strategies that can help with brand growth. Please",Request,IT Support,high,en,400,Feedback,Sales,IT,Tech Support,,,,
,"customer support, concerned about the security of medical data within hospital systems. Implementing enhanced security measures is crucial to prevent potential breaches. Include encryption, secure authentication, and regular software updates. Additionally, training hospital staff on data security practices is essential. I would appreciate guidance on how to implement these measures effectively.","<name>, we take data security seriously and recommend implementing encryption, secure authentication, and regular software updates to protect medical data. We can provide guidance and training practices for hospital staff. Please contact us at <tel_num> for assistance in scheduling a consultation.",Change,Service Outages and Maintenance,high,en,400,Security,IT,Employee,Training,Performance,,,
Unterstützung für Zoho CRM,"Wir möchten Ihnen bei der Einrichtung detaillierter Dokumentation für die Integration des Zoho CRM SaaS-Projektmanagement-Tools helfen. Bitte verstehen Sie, dass wir Ihnen dabei unterstützen, die Prozessanforderungen für eine erfolgreiche Integration zu verstehen. Wir freuen uns darauf, Ihnen die Möglichkeiten der Nutzung unserer Tools zu zeigen. Vielen Dank für Ihre Zeit und Unterstützung. Wir schätzen Ihre Unterstützung sehr.","Sehr geehrte [Name], wir danken Ihnen für Ihr Interesse an der Integration unseres SaaS-Projektmanagement-Tools in Zoho CRM. Wir werden Ihnen eine umfassende Anleitung und die Schritte zur erfolgreichen Integration zur Verfügung stellen. Diese Dokumentation umfasst Informationen zu API-Endpunkten, Authentifizierungsverfahren und Datenaufmatchung. Wenn Sie spezifische Aspekte der Integration interessieren, z.B. Daten-synchronisation oder Workflow-Automation, lassen Sie uns bitte wissen, damit wir Ihnen detailliertere Informationen zur Verfügung stellen können. Falls Sie eine detaillierte Anleitung für den Integrationsprozess benötigen, bieten wir Ihnen gerne einen Telefonanruf an. Bitte kontaktieren Sie uns unter [Telefonnummer].",Request,Technical Support,high,de,400,Documentation,Feature,IT,Tech Support,,,,
Information on Integration with Zapier for Project Management,"I am inquiring about the integration options for our project management SaaS through Zapier. Could you please provide detailed information and a set of step-by-step instructions for the integration process? Additionally, it would be very helpful if you could send relevant documentation to assist me in better understanding the capabilities and limitations of the integration. I greatly appreciate your assistance and look forward to hearing back soon.","<name>, we have reached out to the customer support team regarding the integration options for Zapier with our project management SaaS. We are able to offer you step-by-step instructions for setting up the integration. If you prefer, please let us know and we can send you the documentation or walk you through the process over a call. To schedule a time to discuss further, please call <tel_num>. I look forward to hearing back from you soon.",Request,Technical Support,medium,en,400,Documentation,Feedback,IT,Tech Support,,,,
,"Während der Überprüfung von Berichten über langsame Leistung und erhöhte Serverbelastung, scheint dies auf kürzlich durchgeführte Updates zurückzuführen sein. Caches wurden geleert und Datenbankabfragen optimiert, trotzdem besteht das Problem weiterhin.","Die Einwilligung zur Bearbeitung E-Mail-Beschwerden wegen langsame Leistungsprobleme ist gegeben. Um weitere Untersuchungen durchzuführen, könnten detaillierte Informationen zur Serverbelastung und den kürzlich durchgeführten Updates hilfreich sein. Bitte geben Sie auch die aktuelle Servernutzungsrate an, um die Ursachen besser ermitteln zu können.",Problem,Customer Service,medium,de,400,Performance,Maintenance,IT,Tech Support,,,,
Digital Marketing Inquiry,Could you provide details on leveraging Scikit-learn for digital marketing strategies? This would greatly assist us in understanding how to implement machine learning algorithms to enhance our marketing efforts and make data-driven decisions. We are particularly interested in learning about the various tools and techniques available for applying Scikit-learn in digital marketing. Thank you for your assistance.,"I would be happy to help with using Scikit-learn for digital marketing. I can provide information on relevant tools and techniques, data analysis, and machine learning algorithms to improve your marketing efforts. Please let me know a convenient time to discuss this further.",Request,IT Support,high,en,400,Feedback,Sales,Tech Support,,,,,
Problem with Delay in Adobe Creative Cloud Services,"Noted a delay in accessing Adobe Creative Cloud services, which has affected project timelines. This delay may have been caused by recent maintenance updates.",Will look into the cause of the delay in Adobe Creative Cloud services and will contact you soon to discuss potential solutions.,Incident,Customer Service,low,en,400,Performance,Maintenance,Disruption,IT,,,,
,"Dear Customer Support, I am seeking detailed insights and optimization strategies for my investments by utilizing data analytics on the mentioned products. Could you kindly provide me with information on how data analytics can aid in making informed investment decisions? It would be greatly appreciated if you could also include examples of successful investment optimization strategies that have been achieved through data analytics. Furthermore, please inform me about the tools and software available to support this process. I look forward to hearing back from you and learning more.","We will provide you with information on investment optimization using data analytics, including examples of successful strategies and the tools available. Please contact us at <tel_num> to discuss your specific needs further.",Request,Billing and Payments,high,en,400,Feature,Documentation,Feedback,Sales,IT,Tech Support,,
Details on Billing Cycles and Payment Options for Smart-Wassermelder Service,Could you provide more details on the billing cycles and payment options for the Smart-Wassermelder service? I would like to know about the available plans and payment methods.,"Dear [Name],\n\nI am pleased to provide you with information on the billing cycles and payment options for the Smart-Wassermelder service. The billing cycles can be either monthly or annual, depending on the selected tariff. We offer three different tariffs, each with its own set of features and prices. In terms of payment methods, we accept credit cards, direct debit, and bank transfers. For more detailed information on tariffs and prices, please visit our website. If you have any specific questions or need guidance on which tariff best suits your needs, feel free to reach out.",Request,Billing and Payments,high,de,400,Billing,Payment,Service,Feature,,,,
Überwachung medizinischer Daten in Krankenhaus-Systemen,"Sehr geehrte Kundensupport, könnten Sie mir detaillierte Informationen über Lösungen zur Überwachung medizinischer Daten in Krankenhaus-IT-Systemen geben? Ich möchte gerne mehr über Maßnahmen erfahren, um vertrauliche Patientendaten zu schützen. Insbesondere interessieren mich die Verwendung von Verschlüsselungsverfahren, Zugangskontrollen und Datensicherungsprozeduren. Vielen Dank für Ihre Unterstützung.","Sehr geehrte <name>, vielen Dank für Ihre Anfrage zur Überwachung medizinischer Daten in Krankenhaus-Systemen. Die Lösungen umfassen Verschlüsselungsverfahren, Zugangskontrollen und Datensicherungsprozeduren, um vertrauliche Patientendaten zu schützen. Freuen Sie sich auf eine detaillierte Beratung. Könnten Sie bitte die Gelegenheit geben, mich unter <tel_num> anzurufen, um detaillierte Informationen zu erhalten und Fragen zu Sicherheitsmaßnahmen zu beantworten?",Request,Customer Service,medium,de,400,Security,Data,IT,Tech Support,Maintenance,Backup,,
Concern about Performance Issues in SaaS Platform,"Encountering difficulties with the report writing performance of the SaaS platform, which is crucial for project management. The issues seem to have started after recent software updates, possibly due to compatibility conflicts. The team has already attempted to troubleshoot by rebooting servers and optimizing database queries, but the problems persist. This is of great concern as it's impacting our ability to meet project deadlines. We are seeking assistance to resolve this matter as soon as possible. Could you please look into this?","Thank you for your email regarding the performance issues with the SaaS platform, particularly affecting project management functionalities. It appears that the problems began after recent software updates, and your team has already tried troubleshooting by rebooting servers and optimizing database queries, but the issues remain unresolved. We would like to investigate further and request additional information from you, such as specific error messages and the steps taken during the troubleshooting process. This will help us better understand and resolve the issue.",Incident,Returns and Exchanges,low,en,400,Performance,Bug,IT,Tech Support,,,,
,"Customer Support, <br>The financial firm's investment optimization system is encountering data discrepancies which may be due to integration issues across different software platforms. So far, we have restarted servers, checked configuration settings, and updated affected products. We would appreciate prompt assistance to resolve the matter and ensure the accuracy and reliability of the investment data. Please let us know the next steps to address the issue.","We acknowledge the issue with the data discrepancies in the investment optimization system. To better assist you, we would like to discuss the issue further. Please provide details on the discrepancies and any error messages encountered. You can contact us at <tel_num> to discuss the next steps to resolve the issue.",Incident,Technical Support,high,en,400,Bug,Performance,Network,IT,Tech Support,Product,Feature,Documentation
Support for Issues with Data Discrepancies,"During the analysis of investments, data discrepancies are occurring, which are attributed to outdated software integrations.","investigate the issue of data discrepancies, which are due to outdated software integrations. To better assist, please provide more details on the specific discrepancies in the used software integrations. Suggest reviewing these details and plan a conference call for further discussion on updating the integrations to resolve the problem.",Problem,Technical Support,high,de,400,Bug,Performance,IT,Tech Support,Documentation,,,
Betreff: Meldung über unerwartete Datenverletzungen im medizinischen Datensicherheitssystem,"Sehr geehrte Kundenservice, ich melde an, dass es zu unerwarteten Datenverletzungen im Datensicherheitssystem für medizinische Daten gekommen ist. Mögliche Ursachen könnten veraltete Software oder Konfigurationsfehler sein. Sicherheitsaudits und Software-Updates wurden bereits durchgeführt, aber die Probleme blieben bestehen. Ich freue mich auf schnelle und umfassende Unterstützung bei der Lösung dieser dringenden Angelegenheit. Vielen Dank für Ihr Engagement.","Wir werden spezielle Experten einsetzen, um die Datenverletzungen zu untersuchen. Bitte geben Sie weitere Details zu den durchgeführten Sicherheitsaudits und Software-Updates an, um eine umfassendere Unterstützung und Lösung bereitzustellen.",Problem,Customer Service,medium,de,400,Security,Bug,Performance,IT,Tech Support,,,
Support for Optimizing Data Analytics Tools,"I am writing to seek support in optimizing and integrating our data analytics tools to enhance our investment strategies. The goal is to improve the performance of the affected software and hardware, leading to more efficient data processing and analysis. This will enable our team to make better decisions and boost business growth. I would appreciate advice on the best approaches to achieve optimization and the recommended tools and resources to support our efforts. If you need additional information to facilitate this process, please let me know.","I am pleased to assist in optimizing and integrating your data analytics tools. To understand the current status, could you please provide more details about your existing software and hardware infrastructure? Additionally, it would be helpful to know the specific investment strategies you wish to optimize. I can recommend the best approaches and resources to support your optimization efforts. To discuss this further, please contact me at the following time slot: <tel_num>.",Change,IT Support,high,de,400,Performance,Product,Feature,Feedback,IT,Tech Support,,
Significant Decline in Digital Engagement Metrics Noted Recently,"Customer Support, we have noticed a significant decline in digital engagement metrics across various platforms. This decrease might be due to recent modifications in our advertising strategy and algorithm updates. After reviewing our campaign performance and making adjustments to target demographics and content optimization, the metrics continue to lag. We would greatly appreciate your guidance on how to improve our digital engagement. Please let us know if you need any additional information from us.","Assist with the significant decline in digital engagement metrics we are currently experiencing. To better understand the situation, could you please provide specific details on the metrics that have declined and any recent changes made to our advertising strategy? Relevant data and screenshots of our campaign performance would be greatly appreciated. This information will help us provide tailored guidance to improve our digital engagement.",Incident,Product Support,medium,en,400,Performance,Feedback,IT,Tech Support,,,,
,"Customer Support, I am encountering difficulties with the effectiveness of our digital growth strategy. The marketing agency has reviewed performance metrics, adjusted content strategies, and evaluated tool functionality, yet progress remains minimal. We are facing issues due to inefficient tool usage and inadequate integration, which are impacting our product offerings. I would appreciate your guidance to improve our digital strategy and overcome these challenges.","Thank you for reaching out to our customer support team regarding the challenges you are facing with your brand's growth and digital strategy effectiveness. We understand that although performance metrics have been analyzed, content strategies revised, and tool functionality assessed, progress remains limited. To better understand the situation and provide tailored guidance, could you please provide more details on the specific tools you are using and how you are trying to integrate them with your product offerings? This will enable us to offer better advice to help you overcome these challenges.",Incident,Customer Service,medium,en,400,Feedback,Performance,Feature,Tech Support,,,,
,"Kundenservice, ist es möglich, dass Ratgeber zur Schutz von medizinischen Daten für Bitdefender Antivirus Plus bei IT-Systemen von Krankenhäusern bereitgestellt werden? Wie kann die Vertraulichkeit und Integrität der Patientendaten gewährleistet werden?",Kontaktieren Sie bitte das Team von Bitdefender Antivirus Plus unter <tel_num> für Ratgeber zur Schutz von medizinischen Daten und IT-Systemen von Krankenhäusern.,Request,IT Support,medium,de,400,Security,Bug,IT,Tech Support,,,,
Trouble with Software Update,"Facing connectivity problems with the SaaS project management tool, affecting the integrated devices. The issue started after the latest software update, possibly due to compatibility issues. I've restarted my devices, checked my network settings, and cleared the cache but to no avail. Could you please help resolve this issue at your earliest convenience?","Received your email about the connectivity issues with the SaaS project management tool following the recent software update. To assist you better, I would like to schedule a call to discuss the issue in detail. Please let me know a convenient time to contact you at <tel_num> so we can resolve this issue as soon as possible. Your account number is <acc_num>.",Problem,Technical Support,medium,en,400,Bug,Network,Performance,IT,Tech Support,,,
Support for Medical Data Security with ActiveCampaign and Firebase Integrations,"Hello, I am reaching out to seek guidance on securing medical data for ActiveCampaign and Firebase integrations within a hospital IT environment. I would greatly appreciate any information or resources that could help ensure the security and compliance of medical data. Specifically, I am looking for advice on how to properly integrate these systems while maintaining the confidentiality and integrity of sensitive patient information. Thank you in advance for your assistance.",We can provide guidance on securing medical data with ActiveCampaign and Firebase integrations. Please allow us to call you at your convenience.,Request,Billing and Payments,high,en,400,Security,IT,Tech Support,Performance,Documentation,,,
Bitten um Unterstützung bei Systemausfall,"Sehr geehrte Kundenservice-Abteilung, ich melde einen Systemausfall, der den Zugang zu den Projektmanagementwerkzeugen beeinträchtigt hat. Es könnte durch die neueste Softwareaktualisierung entstanden sein. Trotz mehrerer Neustarts der betroffenen Anwendungen und Geräte besteht das Problem weiterhin. Ich schätze Ihre Unterstützung und hoffe, dass Sie die Angelegenheit bald bearbeiten und eine mögliche Lösung anbieten können. Bitte geben Sie mir weitere Informationen, falls Sie sie benötigen, um die Lösung des Problems voranzutreiben. Vielen Dank für Ihre Hilfe bei der Bearbeitung dieser Angelegenheit. Ich freue mich darauf, bald von Ihnen zu hören.","Wir werden den gemeldeten Systemausfall sofort untersuchen und nach einer Lösung suchen. Bitte geben Sie uns Details zur Softwareaktualisierung und den genauen Fehlerbenachrichtigungen, damit wir Ihnen besser helfen können.",Incident,Human Resources,low,de,400,Outage,Disruption,IT,Tech Support,,,,
