subject,body,answer,type,queue,priority,language,version,tag_1,tag_2,tag_3,tag_4,tag_5,tag_6,tag_7,tag_8
,Können Datenanalysewerkzeuge mehr Details zu Investitionsstrategien liefern und die Optimierung von Investitionsstrategien verbessern? Vielen Dank.,Datenanalysewerkzeuge bieten Funktionen zur Investitionsüberwachung und Portfolioanalyse und können Investitionsstrategien optimieren. Ich werde Ihnen ein detailliertes Broschüre über weitere Informationen zukommen lassen.,Request,Technical Support,medium,de,400,Feedback,Product,Feature,Documentation,,,,
Technical Support Inquiry for System Outages,"A marketing agency has encountered system outages impacting vital digital strategies owing to server overload from increased traffic. After restarting servers and clearing caches, the issues continue. Urgent assistance is required to resolve this matter.","Dear [Name], we acknowledge your technical support request regarding system outages at your marketing agency. To better assist you, we need to know if you are experiencing server overload and increased traffic. Please provide any error messages or symptoms you are seeing. We would be happy to schedule a call at your convenience to discuss a workable resolution; please let us know a suitable time for the call at [Tel Num].",Incident,Technical Support,high,en,400,Outage,Network,Performance,IT,Tech Support,,,
Reported Problem with Engagement in Digital Marketing Campaign,"The digital marketing campaign has shown low engagement. We have modified the ad spend, updated the messaging, and segmented the audience, but the results are still not satisfactory. Assistance is needed to enhance the campaign's performance.","Examining the issue with the engagement of the digital marketing campaign. For better assistance, we would like to discuss further. Please call at <tel_num> at your convenience to gather more information and provide a tailored solution for the campaign.",Incident,Product Support,low,en,400,Performance,Feedback,Sales,,,,,
Concerns About Enhancing Data Analysis Efficiency,"A financial company is facing disruptions in data analysis, which they are trying to optimize for investment decisions. These interruptions might be due to software incompatibility or hardware failures. Restarting the affected systems and clearing the system caches did not resolve the issue. Urgent assistance is required to address the problem and potentially reduce financial losses.","Hello [Name], we have received your email regarding the issue with data analysis optimization at your financial firm. We understand that you are experiencing interruptions, even after restarting devices and clearing system caches. To better assist you, could you please provide details on the software and hardware you are using for data analysis? Additionally, it would be helpful to know any specific error messages or symptoms you are encountering. We would like to schedule a call to discuss the issue further and are available at [Tel Num].",Incident,Technical Support,medium,en,400,Performance,Disruption,Hardware,IT,Tech Support,,,
Concern About Data Breach,A data breach has impacted medical records. Efforts to address vulnerabilities and boost encryption have not been successful. Urgent help is needed to resolve this matter.,Acknowledging the data breach affecting medical records. Understanding that attempts to patch vulnerabilities and improve encryption have been unsuccessful. Would like to schedule a call to discuss this issue and provide immediate assistance. Please let me know a convenient time to call at <tel_num> to discuss next steps for resolving the issue related to <acc_num>.,Incident,Customer Service,medium,en,400,Security,Virus,IT,Tech Support,,,,
IBM SPSS Support Assistance Required,"Hello, I am in need of guidance on using IBM SPSS Statistics 28 for analyzing investment data. Could you provide any resources, tutorials, or user guides to get me started? I would greatly appreciate any help you can offer. I look forward to hearing from you soon.","Hello [Name], we are happy to assist you through our Service Desk with IBM SPSS Statistics 28 for your investment data analysis. We can provide you with some resources, tutorials, and user guides to help you get started. For personalized guidance, we can schedule a call at a convenient time for you. Please let us know what would be helpful. Alternatively, you can visit our website for additional support materials and documentation for IBM SPSS Statistics 28.",Request,Customer Service,medium,en,400,Documentation,Tech Support,Feedback,,,,,
Einbinden von Joomla SaaS-Projektmanagement-Lösung,"Ich versuche, die Joomla SaaS-Projektmanagement-Lösung einzubinden. Könnten Sie detaillierte Dokumentation und Anleitungen zur Integration bereitstellen? Ich danke für die zur Verfügung gestellten Ressourcen und Unterstützung, um diesen Prozess erfolgreich abzuschließen.","Sehr geehrte [name], wir danken Ihrem Interesse an die Integration der Joomla SaaS-Projektmanagement-Lösung. Eine ausführliche Anleitung finden Sie auf unserer Website, die den Integrationsprozess beschreibt. Für personalisierte Unterstützung geben Sie bitte Ihre Kontonummer an: [acc_num], damit wir spezifische Einrichtungsfragen überprüfen können. Falls nötig, können wir eine Telefonverabredung mit Ihrem Telefonnummer [tel_num] vereinbaren, um den Prozess durchzuführen. Wäre eine bestimmte Anrufzeit für Sie in Ordnung?",Request,Returns and Exchanges,high,de,400,Documentation,Feature,IT,Tech Support,,,,
Reported Issue with Tracker-Gem,"Experienced sudden malfunction with the Smart-Tracker feature, impacting multiple products. The cause of the problem is unclear, but it seems recent software updates and database inaccuracies might be related. The team is working on resolving it; they have restarted services and rolled back recent changes, but the issue persists. Your assistance is appreciated to quickly address the error. Please inform us if we need additional information to find a rapid solution.","Investigating the reported Tracker issue. To better assist, I would like to discuss more details about the problem. When can we discuss this further? Please provide an appropriate time window. Additionally, please have your account details ready, such as your account number.",Incident,Product Support,high,de,400,Bug,Performance,Maintenance,IT,Tech Support,,,
Unterstützung im Bereich Markenwachstum,"Hallo, ich schreibe, um mehr über digitale Strategien zum Markenwachstum zu erfahren. Könnten Sie mir spezifischere Methoden und Techniken erläutern, die zur Förderung des Wachstums eingesetzt werden können? Ich freue mich, wenn Sie Details zum Thema mitteilen können, inklusive Fallstudien und Empfehlungen von früheren Kunden. Das wird mir helfen, ein besseres Verständnis für die Art und Weise zu entwickeln, wie Ihre Dienstleistungen Geschäftsziele unterstützen können.","Sehr geehrte [Name], wir bedanken uns für Ihr Interesse an digitalen Strategien für das Markenwachstum. Wir verwenden verschiedene Methoden, darunter die Verwaltung von Sozialmedien und gerichtete Werbung, um das Wachstum zu fördern. Wir freuen uns, die Fallstudien und Empfehlungen von früheren Kunden besprechen zu können. Ein Telefonkonferenz könnte für diese Besprechung verfügbar sein?",Request,Product Support,high,de,400,Feedback,Sales,IT,Tech Support,,,,
Slow Query Performance in Database,"During data analytics processing, slow query performance was observed in the MySQL database.","Hello [name], we have received your email concerning slow query performance in the MySQL database during data analytics processing. To better assist you, could you please provide details of the queries executed and the current database configuration? This information will help us identify the root cause of the issue and provide a suitable solution. If needed, we can schedule a call at [tel_num] to discuss further. Please let us know a convenient time.",Incident,Product Support,low,en,400,Performance,IT,Tech Support,,,,,
Issue with Inconsistent Investment Data Reporting on Analytics Dashboard,"Hello Customer Support, we are encountering inconsistent investment data reporting on the analytics dashboard. The problem appears to be related to the integration between Node.js and Django. We have already tried reconfiguring the data sources and restarting the services, but the issue still persists. We would greatly appreciate it if you could look into the matter and provide a solution. The inconsistent data is impacting our ability to make informed decisions. Please let us know if you need any additional information to resolve the issue. Thank you for your time and assistance. We look forward to your earliest convenience.","Writing an email acknowledging the issue of inconsistent investment data reporting on the analytics dashboard. Understanding that despite reconfiguring the data sources and restarting the services, the problem persists. To better assist, would like to know more about the integration misalignment between Node.js and Django as mentioned. Could you please provide more details on the issue and the steps taken so far? Will schedule a call at your earliest convenience to discuss the matter and work on a solution.",Incident,Product Support,low,en,400,Bug,Performance,Disruption,IT,Tech Support,,,
Upgraded Security Measures in Hospitals,"Customer Support, please elaborate on the current implementation of enhanced security protocols for data encryption of medical data within hospital systems. This is a critical area for hospitals as they handle sensitive patient information. Robust security measures are essential to prevent data breaches and protect patient confidentiality. We would like to request information on the current security protocols and any plans for upgrading them. Additionally, we would appreciate","<name>, we appreciate your concern regarding enhanced security protocols in hospitals. We will provide you with information on the current security measures and our plans for upgrades. We also offer resources to ensure compliance with relevant regulations and standards. Please contact <tel_num> for further discussion.",Change,Product Support,high,en,400,Security,Documentation,IT,Tech Support,,,,
Investment Reporting Problem Detected,"Facing delays in investment reporting due to data aggregation issues, which might be related to recent software updates. After attempts to resync data sources and restart systems, the issue still exists.","Investigate the investment reporting problem which is experiencing due to data aggregation issues, possibly caused by recent software updates. Please help by providing details of any error messages and the specific steps you have taken so far. Additionally, to look into this matter further, please provide your account number and any relevant reference.",Problem,Customer Service,low,en,400,Bug,Performance,IT,Tech Support,,,,
Problems with FL Studio Integration API Compatibility,"Dear customer service, I am writing to report an issue with the integration of FL Studio into our SaaS project management tool. The problem appears to be related to API compatibility issues. Despite reinstalling FL Studio, updating, and adjusting the integration settings, the issue persists. I have already taken several troubleshooting steps, but none have been successful. Could you please help resolve this problem? I am looking forward to your guidance on how to fix the API compatibility issues or alternative solutions for integrating FL Studio with our project management tool. Thank you.","Dear [name], I am writing to confirm receipt of your email regarding the issue with the integration of FL Studio into our SaaS project management tool, which seems to be due to API compatibility problems. I would be happy to assist in resolving this issue. Could you please provide more details about the error messages you are receiving, including the version of FL Studio you are using? These details will help me better understand the problem and offer a precise solution. If necessary, I can arrange a call at [tel_num] to continue the troubleshooting process and explore alternative solutions. Thank you.",Incident,Customer Service,low,de,400,Bug,Performance,Feature,IT,Tech Support,,,
,"Hello Customer Support, I have been encountering integration problems with my analytics tools, which are leading to inaccurate investment insights. These issues might be due to recent updates to Shopware and Airtable. Despite my efforts to troubleshoot by resetting API connections and verifying data accuracy, the problems continue. I have tried several solutions, but the issue is still unresolved. Could you please assist me in resolving this? I would greatly appreciate any guidance or support you can provide to help us get our analytics tools working properly.",We will investigate the issue.,Incident,Sales and Pre-Sales,medium,en,400,Bug,Performance,IT,Tech Support,,,,
Trouble with Data Analytics Tool Integration Impacting Financial Database Connection for Investment Optimization,"Our data analytics tool is having difficulties integrating with financial databases, leading to delays in investment optimization. We have tried rolling back the software and performing network diagnostics, but the problem continues. The issue might be due to incompatible software updates or network problems. We require assistance in resolving this critical issue as soon as possible.",I can assist with your data analytics tool integration issue. Please provide details on the software updates and network diagnostics that have been performed. Knowing the versions and results will help me better assist you. I am available to discuss the issue further via a call if that is more convenient.,Incident,Technical Support,high,en,400,Bug,Network,Performance,IT,Tech Support,,,
,"Die Teambesprechung über Google Meet wurde durch Verbindungsprobleme unterbrochen, insbesondere während der Diskussionen zur Datenanalyse. Der Laptop wurde neugestartet, die Netzwerkverbindung überprüft und die Softwarekonfiguration geprüft, jedoch blieb das Problem bestehen. Es scheint sich möglicherweise auf einen Netzwerkkonfigurationsfehler oder Ressourcenüberlastung bei dem Lenovo ThinkPad zu beziehen. Wir benötigen Unterstützung, um das Problem bald zu beheben und zukünftige Störungen zu vermeiden.","Ich helfe gerne bei den Verbindungsproblemen mit dem Lenovo ThinkPad. Bitte geben Sie mehr Details zur Netzwerkkonfiguration, um mir zu helfen, das Problem zu beheben. Ich rufe Sie zum geeigneten Zeitpunkt an, um das Problem gemeinsam zu lösen.",Problem,IT Support,medium,de,400,Network,Performance,IT,Tech Support,Disruption,,,
,"Dear Customer Support, I am writing to address recent service disruptions with our digital tools hardware. These outages have had a significant impact on our marketing operations, causing delays and lost opportunities. We kindly request that you take immediate action to restore our services, as this would greatly assist us in getting back on track to meet our targets. We appreciate your prompt attention to this matter and look forward to hearing from you soon. Please let us know if there is any additional information needed.",We apologize for the disruptions and will investigate them immediately. Please provide your account number and specific details about the outages so we can assist you better.,Change,Service Outages and Maintenance,high,en,400,Disruption,Outage,Hardware,Performance,Recovery,IT,,
Langsame Leistung bei Projektmanagement-Cloud-Anwendung,Die Projektmanagement-Cloud-Anwendung zeigt Spitzen Nutzung und erzeugt langsame Leistungen aufgrund mangelnder Serverressourcen.,"Eine E-Mail wurde über die langsame Leistung bei der Projektmanagement-Cloud-Anwendung aufgrund mangelnder Serverressourcen gesendet. Der Fehler wird der technischen Abteilung übermittelt, und die Serverressourcen werden erhöht. Bitte lassen Sie uns untersuchen und kontaktieren Sie uns bald, falls zusätzliche Informationen erforderlich sind.",Problem,Technical Support,high,de,400,Performance,IT,Tech Support,,,,,
Problem with Security Breach,"Recently, a security breach was detected in the medical data systems of the hospital's IT. It is suspected that outdated software and misconfigured user access caused the vulnerability. So far, we have run malware scans and restricted user access. We need your assistance to ensure the security systems are secure.","To assist with the security breach issue, please provide details on the current state of the systems and any measures that have already been taken. Once you do, we will schedule a call to discuss further assistance.",Incident,Technical Support,high,en,400,Security,Virus,IT,Tech Support,,,,
Request for Investment Analytics Support,"Hello Customer Support, I am reaching out to inquire about the investment analytics tools and the billing process. Could you provide information on the types of analytics tools that are available and how they can benefit my business? I would greatly appreciate it if you could explain the billing process, including any subscription fees or one-time payments. Additionally, are there any discounts available for long-term commitments or bulk purchases? I am very interested in learning how these tools can help me make data-driven decisions. Please let me know if there are any resources or documentation that I can review. Thank you.",I would be happy to provide information on the investment analytics tools and the billing process. Please allow me to call you at your convenience so we can discuss any questions you may have regarding our services and available discounts.,Request,Billing and Payments,low,en,400,Billing,Payment,Refund,Account,Product,Feature,Sales,Tech Support
Issues with Digital Engagement,"experiencing unexpected drops in digital engagement metrics, which may impact brand growth strategies. Possible causes include recent changes to digital ad algorithms. Have attempted to adjust the ad list and refine the content approach, with some improvement observed. Need assistance to resolve the issue.","To address the issues with digital engagement, please call <tel_num> to discuss potential causes and solutions, including recent algorithm changes. We will determine the next steps and work to enhance your <acc_num>-level accounts.",Incident,General Inquiry,high,de,400,Bug,Performance,Feedback,Feature,Documentation,Tech Support,,
,I need assistance with integrating Asana and Cisco Webex Meetings for project collaboration. Could you provide a detailed process? I want to know the steps and requirements to help our team collaborate more efficiently.,Please provide the integration steps and requirements for Asana and Cisco Webex Meetings so we can discuss further and ensure it's convenient for everyone.,Request,Product Support,medium,en,400,Feedback,HR,Employee,Training,IT,Tech Support,,
Concerning Incident Involving Potential Unauthorized Access to Medical Data Systems,"There was an incident involving the potential unauthorized access to medical data systems, which is likely due to inadequate security protocols and software vulnerabilities. We have updated the software and reviewed access logs, finding some anomalies. We need your assistance to fully investigate and enhance security measures.","Dear [Name], we acknowledge the potential unauthorized access to medical data systems and understand the gravity of the situation. To better assist you, could you please provide details about the incident, including the date and time it occurred and any specific error messages you may have encountered. Additionally, it would be helpful to know the current security software and protocols in place. We would like to schedule a call to discuss further. Best regards,",Incident,Human Resources,low,en,400,Security,Virus,IT,Tech Support,,,,
Einbindung von Schoology in die Projektleitung,Könnten Sie mehr Details zur Integration von Schoology in ein Projektmanagement-aaS liefern? Vielen Dank für Ihre Unterstützung!,"Sehr geehrte/n [Name],\n\nwir bedanken uns für Ihr Interesse an der Integration von Schoology in ein Projektmanagement-aaS. Um Ihnen mehr Informationen zu liefern, könnten wir bitte mehr über Ihre spezifischen Anforderungen zur Integration erfahren. Das hilft uns, eine passende Lösung anzubieten, die Ihren Bedürfnissen entspricht. Falls Sie eine Telefonkonferenz vorziehen, sind wir bereit, einen passenden Termin zu vereinbaren. Bitte wählen Sie einen Zeitpunkt, zu dem Sie sich am Telefon mit uns treffen können, und lassen Sie uns wissen, wann wir Sie am besten erreichen können. Vielen Dank und beste Grüße.",Request,Product Support,medium,de,400,Feedback,IT,Tech Support,Documentation,,,,
Probleme mit Software-Abstürzen,Es treten Abstürze bei Avast und SQL Server auf.,"Sehr geehrte(r) <name>, wir entschuldigen uns für die Unannehmungen, die von Software-Abstürzen bei Avast und SQL Server verursacht wurden. Um Ihnen optimale Unterstützung zu bieten, benötigen wir mehr Details zu den Fehlern sowie die Schritte, die Sie bisher unternommen haben. Wir möchten ein Telefonat vereinbaren, um das Problem genauer zu untersuchen. Bitte geben Sie ein geeignetes Zeitfenster und den Telefonnummer <tel_num> an.",Problem,Customer Service,high,de,400,Bug,Crash,Performance,IT,Tech Support,,,
Request for Integration of Norton Antivirus,"I am reaching out to obtain information on integrating Norton Antivirus with SaaS project management tools. Could you provide more details on this topic? I would be grateful if you could offer guidance or documentation to help us start the integration process. Specifically, I am looking for information on the configuration of the integration, potential compatibility issues, and solutions for common problems. Thank you for your time and assistance. I look forward to hearing back soon.",The Norton Integration documentation will be sent via email shortly.,Request,IT Support,low,de,400,Feature,Documentation,IT,Tech Support,Security,,,
Potential Data Lock Issue,Healthcare provider encounters potential data lock issue securing medical data. believed to be due to outdated security protocols. preliminary scans for vulnerabilities have been conducted. request further investigation and resolution of the problem.,"Dear <name>, thank you for reporting the potential data lock issue to the healthcare provider. we understand the significance of this matter and are ready to assist in investigating and resolving the situation. to better understand the case, please provide additional information, such as the date when the issue was discovered and specific vulnerabilities identified by the preliminary scans. we would be happy to arrange a call to discuss the next steps and possible solutions. your cooperation is appreciated.",Incident,Product Support,high,de,400,Bug,Security,Performance,IT,Tech Support,,,
Sicherheitsbedenken an Medikamentensystem-Daten,"Es besteht die Möglichkeit, dass Datensperrungen bei medizinischen Aufzeichnungen des IT-Systems des Krankenhauses gefährdet sind. Möglicherweise liegt dies an veralteter Software, die Schwachstellen enthält. Systemaktualisierungen wurden durchgeführt, Zugangspunkte sind sichergestellt und Sicherheitsprüfungen durchgeführt, jedoch behält das Problem bestanden. Ein dringender Support ist erforderlich, um das Problem zu lösen und weitere Schäden zu verhindern. Bitte geben Sie Anweisungen für die nächsten Schritte an. Vielen Dank für Ihre dringende Unterstützung in dieser Angelegenheit.","Rufen Sie die Nummer <tel_num>, um die Datensperrung zu besprechen. Führen Sie die angegebenen Schritte aus, um das Problem zu lösen und weitere Schäden zu verhindern.",Problem,Customer Service,low,de,400,Security,IT,Tech Support,Bug,,,,
Support for Unexpected Billing,"Received an unexpected invoice for additional charges. This error in the bill seems to be due to a misunderstanding. Up to now, the contract has requested clarification from the billing department. I value a thorough examination and would appreciate an explanation of the additional costs or a new invoice.","Dear [Name], we have received an unexpected invoice for additional charges. I understand your concerns and would be happy to assist in resolving the issue. To better understand the situation, please provide your account number [acc_num] and invoice number, and any other questions you may have. We will check the account for discrepancies and may need to contact you to discuss further questions. If you are available by phone, would you prefer to call at [tel_num]? We aim to provide a clear explanation of the additional charges or a new invoice as soon as possible.",Problem,Billing and Payments,low,de,400,Billing,Refund,Payment,Account,Feedback,,,
Problem with HR System Access to Payroll Information,"Customer Support, <br>The HR system has been encountering intermittent outages, which have disrupted employee access to payroll information. Possible causes may include server overload or recent software updates. Efforts to resolve the issue, such as rebooting the server and checking connectivity, have been unsuccessful. We need your assistance to resolve this issue.","Received your email regarding the issue with HR system access to payroll information availability. To assist further, could you please provide details on the server and software updates? We can schedule a call to discuss potential solutions; I am available at your convenience and suggest a time that would work best for you.",Incident,Human Resources,medium,en,400,HR,Employee,Outage,IT,Tech Support,,,
