subject,body,answer,type,queue,priority,language,version,tag_1,tag_2,tag_3,tag_4,tag_5,tag_6,tag_7,tag_8
Integrationsprobleme bei Finanzunternehmen mit Data Analytics Tools,"Sehr geehrter Kundendienst, unser Finanzunternehmen erlebt Schwierigkeiten bei der Integration von Data Analytics Tools, was die Arbeitsprozesse zur Investitionsoptimierung beeinträchtigt. Vermutlich liegt die Ursache in Softwareinkompatibilitäten aufgrund veralteter Versionen. Wir haben bereits versucht, die Anwendungen neu zu starten, die Software zu aktualisieren und die Verbindungen zu den Datenquellen zu überprüfen, jedoch ohne Erfolg. Trotz unserer Bemühungen besteht das Problem weiterhin und wir benötigen zusätzliche Unterstützung, um die Angelegenheit zu klären. Wir würden eine Anleitung oder Unterstützung begrüßen, um die Herausforderung zu bewältigen und die Arbeitsabläufe zur Investitionsoptimierung wieder in den Normalzustand zu versetzen. Bitte teilen Sie uns den nächsten Schritt mit.","Bitte prüfen Sie das Problem und kontaktieren Sie <tel_num>, um weitere Details zu besprechen. Vereinbaren Sie einen geeigneten Termin zur Behebung der Integrationsprobleme bei den Data Analytics Tools, um die Beeinträchtigung der Arbeitsprozesse zur Investitionsoptimierung zu beseitigen.",Incident,Customer Service,medium,de,52,Integration,Software Incompatibility,Data Analytics,Financial Sector,Troubleshooting,Software Update,Data Integration,
Problem mit der Investment-Analytics-Plattform entdeckt,"Die Investment-Analytics-Plattform des Unternehmens ist unerwartet abgestürzt, vermutlich infolge kürzlicher Updates an Inkscape und Simulink. Erste Maßnahmen zur Fehlerbehebung umfassten das Neustarten der betroffenen Systeme und die Überprüfung der Softwarekompatibilität; bisher war dies erfolgreich. Das Problem führt zu erheblichen Störungen im täglichen Geschäftsbetrieb, weshalb dringend Unterstützung benötigt wird, um die Ursache zu beheben. Bitte geben Sie eine Anleitung für die nächsten Schritte oder mögliche Lösungen, die das Team anbieten kann, und schätzen Sie den Aufwand.","Das Problem prüfen und unter <tel_num> Kontakt aufnehmen, um die nächsten Schritte zu besprechen und potenzielle Lösungen für den Absturz der Investment-Analytics-Plattform zu erörtern.",Incident,Product Support,medium,de,52,Crash,Performance,Outage,Recovery,Software,Update,,
Bericht über IT-Service-Ausfälle am heutigen Tag,"Sehr geehrter Kundensupport,<br><br>ich möchte Sie darüber informieren, dass die IT-Service-Ausfälle bei Gesundheitsdienstleistern gemeldet wurden, was die Datensicherheit und den Krankenhausbetrieb beeinträchtigt hat.<br>Die möglichen Ursachen für die Ausfälle scheinen in Netzwerk-Konfigurationsfehlern zu liegen.<br>Wir haben versucht, das Problem durch einen Neustart der Server, Anwendungspatches und andere Maßnahmen zu beheben, jedoch war die Lösung nicht erfolgreich.<br>Ich würde Ihre Unterstützung bei der Anleitung zur schnellen Behebung des Problems sehr schätzen, um die Kontinuität unserer Dienste sicherzustellen.<br>Bitte lassen Sie mich wissen, falls Sie weitere Informationen benötigen, um eine schnelle Lösung zu ermöglichen.","Kontaktieren Sie <tel_num>, um die nächsten Schritte zur Behebung der IT-Service-Ausfälle bei den Gesundheitsdienstleistern zu besprechen.",Problem,Service Outages and Maintenance,high,de,52,Outage,Disruption,Recovery,Network,Hardware,Security,,
,"A security breach took place at the hospital, leading to the compromise of sensitive medical data systems. The suspect is believed to have carried out a phishing attack. An initial antivirus scan was performed as a precaution. The system has been temporarily isolated to prevent further damage. We are treating this incident with utmost seriousness, conducting a comprehensive investigation to identify the cause and extent of the breach. Additionally, we are reviewing security protocols thoroughly to prevent similar incidents in the future. We will keep you informed of any updates and appreciate your understanding and cooperation during this time.",investigation contact,Problem,Technical Support,medium,en,52,Security,Virus,Outage,Disruption,Recovery,,,
Data Integration System Error Occurred Today,"A financial organization encountered data integration issues affecting their investment analysis, probably due to software incompatibility. The first troubleshooting steps included restarting applications and checking network connections, but these did not resolve the problem. Assistance is needed to fix the issue.","Examine data integration problems at the financial organization, likely resulting from software incompatibility. Contact <tel_num> to discuss troubleshooting procedures to resolve the problem affecting investment analytics.",Incident,General Inquiry,low,en,52,Bug,Network,Performance,Disruption,Recovery,,,
Skalierbare SaaS-Projektmanagement-Software mit Stabilitätsproblemen bei hoher Nutzerzahl,"Die skalierbare SaaS-Projektmanagement-Plattform stürzt bei hoher Nutzerbelastung häufig ab. Vermutlich liegt eine Serverüberlastung vor. Versuche, die Datenbankabfragen zu optimieren, sowie die Serverkapazität zu erweitern, waren erfolglos. Die Leistung der Plattform verschlechtert sich erheblich, wenn mehrere Benutzer gleichzeitig darauf zugreifen, was zu Fehlern und Ausfällen führt. Um das Problem zu beheben und die Zuverlässigkeit der Plattform sowie die Nutzerzufriedenheit sicherzustellen, sind weitere Maßnahmen erforderlich.","Sehr geehrter <name>, wir haben Ihre E-Mail bezüglich der Schwierigkeiten mit der skalierbaren SaaS-Projektmanagement-Plattform erhalten. Uns ist bewusst, dass die Plattform bei hoher Nutzerzahl häufig abstürzt, wahrscheinlich aufgrund einer Serverüberlastung. Um das Problem zu lösen, möchten wir gerne einen Anruf vereinbaren, um mögliche Lösungen und weitere Details zu besprechen. Bitte teilen Sie uns einen passenden Termin mit, damit wir unter <tel_num> anrufen und das Thema erörtern können. Eine Vorbereitung auf das Gespräch wäre hilfreich, daher könnten Sie uns weitere Informationen zu den kürzlichen Optimierungsversuchen und der aktuellen Serverkonfiguration bereitstellen.",Problem,IT Support,high,de,52,Performance,Outage,Disruption,Security,,,,
Support Request: Digital Campaign Disruption,"Customer Support, I am reporting an incident related to the digital campaigns managed by the marketing agency. Unexpectedly, the campaigns have come to a halt, which we suspect is due to software integration problems across the listed products. Our team attempted to resolve the issue by performing system reboots and updates, but unfortunately, these efforts did not succeed. Additionally, we contacted the vendors for assistance and have yet to receive a resolution. This situation is concerning for our business operations, and we are eager to find a solution as soon as possible. Could you please look into this matter?","<name>, we have received your email regarding the issue with the marketing agency's digital campaigns. We will investigate the situation and provide guidance on how to proceed. To facilitate the investigation, additional information from you may be required. If needed, please contact <tel_num> to discuss further. Kindly let us know a convenient time for a call. Our goal is to identify the root cause and implement a fix promptly. Thank you for your patience and cooperation.",Incident,Product Support,high,en,52,Disruption,IT,Tech Support,Software Integration,System Reboot,,,
Fehler bei digitaler Werbekampagne,"Die Plattform der digitalen Kampagnenagentur konnte trotz korrekter Konfiguration keine Anzeigen schalten. Es besteht die Vermutung eines Systemfehlers oder API-Problems. Es wurde bereits versucht, die Software neu zu starten und den Cache zu leeren.","Sehr geehrte/r <name>, es tut uns leid zu hören, dass die Plattform der digitalen Kampagne trotz korrekter Einrichtung keine Anzeigen schalten konnte. Wir verstehen, dass Sie bereits versucht haben, die Software neu zu starten und den Cache zu leeren. Wir werden das Problem weiter untersuchen. Könnten Sie bitte weitere Details zur Fehlermeldung bereitstellen, die Sie erhalten haben, sowie die Schritte, die Sie unternommen haben, um den Fehler zu beheben? Zusätzlich wären die genaue Uhrzeit des Vorfalls und die betroffenen Anzeigen hilfreich. Falls erforderlich, können wir auch einen Anruf vereinbaren.",Problem,Technical Support,high,de,52,Bug,Performance,Outage,Disruption,Software,API,System Error,
System Crashes and Data Synchronization Issues Identified,"An incident affecting multiple products was reported, leading to system crashes and data synchronization problems. Suspected causes include server overload and integration errors. Attempts to resolve the issue involved restarting services, clearing caches, and reviewing logs, but no solution was found. Likely, scalability issues are the underlying cause.",We received an email regarding system crashes and data synchronization problems. The technical team is conducting further investigation and will escalate the issue for resolution. Please allow us to contact you for additional information.,Incident,Technical Support,high,de,52,Crash,Performance,Outage,Disruption,Recovery,Bug,,
Digitale Kampagnen sind erfolgreich,"Sehr geehrter Kundenservice, ich möchte auf ein Problem aufmerksam machen, das meine Marketingaktivitäten beeinträchtigt. Die digitalen Kampagnen verzeichnen eine deutliche Abnahme der Interaktionen. Nach Recherchen vermuten wir, dass die Ursache möglicherweise in Softwareintegrationskonflikten zwischen mehreren Plattformen liegt. Wir haben versucht, die betroffenen Produkte zu aktualisieren und neu zu starten, jedoch blieb das Problem bestehen. Wir befürchten, dass unsere Fähigkeit, die Zielgruppe zu erreichen und unsere Marketingziele zu erfüllen, beeinträchtigt sein könnte. Könnten Sie bitte das Problem untersuchen und eine Anleitung zur Lösung bereitstellen?\""","Wir haben eine E-Mail bezüglich der Probleme mit den digitalen Kampagnen erhalten. Wir werden die Angelegenheit prüfen und unter <tel_num> Kontakt aufnehmen, um weitere Details zu besprechen und eine Lösung für die Behebung der Softwareintegrationskonflikte zu finden, die die Marketingaktivitäten beeinträchtigen.",Incident,Customer Service,medium,de,52,Product,Marketing,Performance,Disruption,Software,Platform,,
Issues with Project Performance,"Users report intermittent performance issues with the SaaS project management system. The problems may be caused by resource conflicts affecting hardware and software components. Troubleshooting involved restarting services, clearing caches, and updating software versions, which resolved the issues. Further assistance is needed to identify and fix the root cause of the problems. Please provide instructions for the next steps.","Investigate the issue by contacting <tel_num>, discuss additional troubleshooting measures, plan a detailed analysis, and identify the source of the performance problems.",Incident,Technical Support,medium,de,52,Performance,Hardware,Software,Troubleshooting,Service,Root Cause,,
,Seeking guidance on how to securely manage medical data with Microsoft Translator in Excel within a hospital environment. We aim to implement a system that accurately translates patient information while ensuring confidentiality and compliance with regulatory standards. Could you provide best practices or recommendations for securing medical data in this context?,"<name> is glad to assist with securing medical data using Microsoft Translator in Excel within hospital infrastructure. To maintain confidentiality and adhere to regulatory standards, it is recommended to implement secure data transfer protocols and encrypt sensitive patient information. It is also crucial to ensure that users have access only with necessary permissions and clearance. We suggest reviewing Microsoft's guidelines for securing medical data and ensuring compliance with regulations like HIPAA. If you'd like, we can discuss this further.",Request,Billing and Payments,medium,en,52,Security,Compliance,Data Privacy,Healthcare,Regulation,Confidentiality,Standards,Best Practice
Problems with Digital Tools,"The marketing agency is facing connectivity problems with their digital tools, including Antenne, Cisco Webex, Docker, Maple, Mailchimp, Smartsheet, Chef, SD card, and QuickBooks. These issues are probably due to network outages. The team has attempted to resolve the problem by restarting devices and verifying network settings, but the issues persist. They have also checked for software updates and confirmed that devices are correctly configured. Despite these efforts, the problems remain unresolved. Your prompt assistance in resolving this matter would be highly appreciated. Thank you.","Please investigate the issue. Kindly provide any error messages, network details, and support contact <tel_num>. Let us know if additional troubleshooting steps are required.",Incident,Technical Support,low,en,52,Network,Outage,Disruption,IT,Tech Support,,,
Enhancing Investment Analytics Efficiency,"Customer Support is seeking assistance in optimizing their investment analytics by integrating DataRobot with ClickUp workflows. They request guidance on streamlining the investment analysis process. Currently, they utilize DataRobot's predictive modeling within ClickUp for workflow management and aim to combine these platforms to boost both efficiency and accuracy. Specifically, they want to learn best practices for configuring ClickUp workflows to seamlessly interact with DataRobot models. Any recommendations or guidance would be appreciated.","We are happy to assist with integrating DataRobot and ClickUp. Please share your current setup details, and we can schedule a call to discuss best practices for configuring workflows.",Request,Product Support,low,en,52,Performance,Feature,Documentation,Feedback,,,,
Sofortige Aktualisierung der Strategien im digitalen Marketing,"Sehr geehrter Kundendienst, ich möchte die Aktualisierung unserer digitalen Marketingstrategien anfordern, da mehrere Produkte betroffen sind. Ziel ist es, das Markenwachstum zu fördern und die Kundenbindung zu stärken. Derzeit liefern die bestehenden Strategien nicht die gewünschten Resultate, weshalb eine Neubewertung unseres Ansatzes notwendig ist. Ich würde gern ein Treffen mit dem Marketingteam vereinbaren, um potenzielle Änderungen und die Umsetzung neuer Taktiken zu besprechen. Diese umfassen Social-Media-Kampagnen, E-Mail-Marketing und Suchmaschinenoptimierung. Überzeugt bin ich, dass die richtige Strategie die Markenbekanntheit steigern und den Umsatz erhöhen kann. Bitte teilen Sie mir passende Termine mit.","Sehr geehrter <name>, wir haben Ihre Anfrage zur Aktualisierung der digitalen Marketingstrategien erhalten, um das Markenwachstum und die Kundenbindung zu verbessern. Gerne vereinbaren wir einen Termin mit dem Marketingteam, um potenzielle Änderungen und neue Taktiken zu besprechen. Um das aktuelle Vorgehen besser zu verstehen, könnten Sie bitte weitere Informationen zu den gewünschten Themenbereichen im digitalen Marketing bereitstellen? Sie können uns unter <tel_num> kontaktieren, um die Details des Treffens zu finalisieren.",Change,Human Resources,medium,de,52,Strategy,Digital Marketing,Customer Engagement,Brand Growth,Marketing Team,Update,Planning,
Berichtetes Problem im Bereich IT-Sicherheit im Krankenhaus,"Mehrere Geräte des Gesundheitsdienstleisters haben Verbindungsprobleme, was die IT-Sicherheitsmaßnahmen im Krankenhaus beeinträchtigt. Möglicherweise wurden Störungen durch eine fehlerhafte Netzwerkkonfiguration verursacht. Die betroffenen Geräte wurden neu gestartet, und die Firewall-Einstellungen wurden geprüft, jedoch ohne Erfolg.","Das Problem ist zu untersuchen. Bitte stellen Sie zusätzliche Details zur Netzwerkkonfiguration der betroffenen Geräte bereit, um weitere Unterstützung zu ermöglichen.",Incident,IT Support,medium,de,52,Security,Network,Outage,Disruption,Recovery,,,
Anleitung für Investitionen,"Sehr geehrter Kundenservice, ich wende mich an Sie, um Ratschläge zur Optimierung meiner Anlagestrategien mithilfe von Datenanalyse-Tools zu erhalten. Ich habe verschiedene Funktionen und Möglichkeiten der Plattform erkundet und würde gern Expertenrat einholen, um das volle Potenzial auszuschöpfen. Besonders interessiert mich, mehr über unterschiedliche Metriken und Indikatoren zu erfahren, sowie die Werkzeuge, die mir helfen können, fundierte Investitionsentscheidungen zu treffen. Können Sie mir bitte eine Anleitung geben, wie ich die Datenanalyse-Tools zur Investitionsoptimierung nutzen kann? Über Tipps zu bewährten Praktiken bei der Dateninterpretation würde ich mich ebenfalls freuen.","Sehr geehrter <name>, vielen Dank, dass Sie den Kundenservice bezüglich der Investitionsberatung und der Nutzung von Datenanalyse-Tools kontaktiert haben. Um Ihre Anlagestrategien zu optimieren, empfehle ich Ihnen, den Benutzerleitfaden durchzulesen, der einen Überblick über die verfügbaren Metriken und Indikatoren bietet. Zudem stellt unsere Webseite eine Reihe von Tutorials und Webinaren bereit, die Ihnen dabei helfen können, Daten besser zu interpretieren und fundierte Entscheidungen zu treffen. Wenn Sie eine persönliche Beratung wünschen, können Sie gerne einen Termin mit unseren Experten vereinbaren. Bitte teilen Sie uns eine passende Zeit für einen Anruf unter <tel_num> mit.",Request,Billing and Payments,medium,de,52,Product,Documentation,Feedback,Investment,Strategy,Data Analysis,Platform,Tool
,"Facing challenges with the marketing agency's digital advertising efforts. The campaigns are underperforming, which is hindering the brand's growth. Despite making adjustments to ad creatives, refining target audiences, and optimizing campaign timings, there has been no notable progress. Assistance is needed to determine the underlying cause and find a solution to get the campaigns back on track.","Assist with digital campaign issues. To better understand the problem, please provide details about current campaigns, including budget distribution and key performance indicators. It would also be helpful to know which specific metrics are not meeting expectations. Let's schedule a call at your convenience to discuss and identify potential solutions to realign the campaigns. Please inform us of a suitable time for the call and ensure we can reach you at <tel_num>.",Incident,Returns and Exchanges,medium,en,52,Marketing,Campaign,Advertising,Digital,Brand,Performance,Assistance,
Project Management SaaS,Encountering errors due to the integration of multiple products. Likely caused by compatibility issues.,"We apologize for the problems with the Project Management SaaS. To resolve the compatibility conflicts, please share details about the integrated products and the errors experienced. This information will assist us in investigating and finding an appropriate solution. If necessary, we can arrange a call to discuss further. Kindly let us know a convenient time for you.",Incident,Returns and Exchanges,low,en,52,Bug,Performance,Disruption,Recovery,Software Compatibility,,,
Support Needed for Data Breach,"Please note that multiple data breaches have been reported by a healthcare provider, indicating that medical records stored in their IT systems have been compromised. These breaches may be linked to outdated security protocols. Despite efforts to update software, change passwords, and enhance firewall settings, the measures have not been successful. We are concerned about the security of our patients' information and seek assistance in identifying and resolving system vulnerabilities. Could you please provide guidance on the procedures to investigate and remediate these breaches?","<name> is requesting support regarding data breaches. We understand the urgency and importance of protecting patient information. To proceed with investigating and resolving the breaches, I recommend conducting a thorough vulnerability assessment of the healthcare provider's IT systems. This will help identify the root cause and develop an effective plan to prevent future incidents. I am available to schedule a call to discuss the details of the assessment and answer any questions. Would you be available for a conversation within the next 24 hours, preferably at <tel_num>, if that works for you?",Problem,Returns and Exchanges,medium,de,52,Security,Data Breach,IT,Tech Support,,,,
Discrepancy in Billing Synchronization Payment Information,"Payment details do not align across various products, indicating a potential API integration problem.",Received an email concerning a billing synchronization payment data mismatch. Please investigate the possible API integration issue and seek assistance if necessary.,Incident,Billing and Payments,medium,en,52,Billing,Payment,API,Synchronization,Discrepancy,,,
Digital Campaign Performance Challenges,"Customer Support, I am bringing attention to the recent decline in performance of our digital campaigns. Despite implementing initial adjustments and targeting modifications, we have not observed significant improvements. It is possible that recent algorithm updates have impacted our campaigns, and I would like to request assistance in identifying the underlying cause of the issue. Our team has attempted several optimization strategies, but the results remain unsatisfactory. We believe that with your expertise, we can work together to resolve this problem and get our campaigns back on track. Could you please assist?","<name>, sorry to hear that your digital campaigns are underperforming despite the initial adjustments. I would be happy to help identify the root cause of the issue. To better understand the situation, could you please provide details about the campaigns, including targeting options and any recent changes made? Additionally, sharing data related to campaign performance and adjustments would be helpful. This information will enable us to offer tailored guidance and recommendations moving forward. Please review this information and contact <tel_num> to discuss further.",Incident,Customer Service,low,en,52,Performance,Issue,Algorithm,Assistance,,,,
Assistance with Gaming Products,I would like to inquire about the possibility of integrating SaaS gaming headsets and joysticks. Could you provide detailed documentation and best practice guides for the integration process? Any tips to ensure smooth compatibility and optimal performance would be appreciated. Please share relevant resources or tutorials to facilitate an easier onboarding. I look forward to your response and exploring integration possibilities.,"Dear <name>,\n\nThank you for your interest in integrating SaaS gaming headsets and joysticks. Our team is happy to provide the necessary documentation and best practice guides to ensure seamless compatibility and peak performance. We offer a comprehensive manual outlining the integration process, including tips and troubleshooting advice for optimal results. Please send us your documentation request. Additionally, we provide tutorials and webinars covering various aspects of the integration process, along with an overview of available resources and tools to assist you.",Request,Product Support,medium,de,52,Product,Documentation,Training,Support,Feature,,,
Hoher Betrag auf der letzten Rechnung,"Sehr geehrter Kundenservice, ich möchte Ihre Aufmerksamkeit auf ein Problem mit meiner letzten Rechnung lenken. Bei der Überprüfung habe ich festgestellt, dass der berechnete Betrag ungewöhnlich hoch ist. Ich vermute, dass dies auf einen Systemfehler in der Abrechnungssoftware zurückzuführen sein könnte. Ich habe bereits zuvor den Support kontaktiert, aber das Problem ist bisher nicht gelöst. Ich würde es sehr schätzen, wenn Sie den Vorfall prüfen und den Fehler so bald wie möglich korrigieren könnten. Bitte lassen Sie mich wissen, falls Sie weitere Informationen benötigen, um die Angelegenheit zu klären. Ich freue mich auf eine Rückmeldung und darauf, gemeinsam eine Lösung zu finden. Vielen Dank.","Sehr geehrter <name>, ich überprüfe derzeit das Problem mit Ihrer letzten Rechnung. Damit ich Ihnen bestmöglich helfen kann, bitte ich Sie, die betreffende Rechnungsnummer <acc_num> mitzuteilen. Ich werde die Abrechnungsdetails prüfen und nach einem möglichen Systemfehler suchen. Falls erforderlich, können wir auch telefonisch unter <tel_num> weitere Details besprechen. Ich schätze Ihre Geduld und die Zusammenarbeit, um eine schnelle Lösung des Problems zu erreichen. Ich werde Sie über die Korrektur des Fehlers auf dem Laufenden halten.",Problem,Billing and Payments,medium,de,52,Billing,Refund,Payment,Error,Software,Support,,
Access to Data Delays Impacting Various Platforms,Currently facing delays in data access within Excel.,"<name>, we apologize for the data access delays affecting Excel. Kindly provide detailed information about the issue, including any specific error messages and the time the problem started. We will investigate and work to resolve the issue as quickly as possible. For further assistance, please contact <tel_num>.",Incident,Billing and Payments,low,en,52,Performance,Outage,Disruption,Recovery,,,,
