subject,body,answer,type,queue,priority,language,version,tag_1,tag_2,tag_3,tag_4,tag_5,tag_6,tag_7,tag_8
Guide for Integrating QuickBooks Online SaaS Project Management,"Customer Support, seeking assistance with integrating the QuickBooks Online SaaS project management platform. Could you provide details on the integration process, its benefits, the setup procedure, and any potential limitations? I would greatly appreciate information on data synchronization between the two systems and any additional fees related to the integration. Additionally, are there any specific requirements or prerequisites that need to be met for integrating the QuickBooks Online platform? I look forward to hearing back as it will help enhance our project management.","Dear [name], to guide you through integrating the QuickBooks Online SaaS project management platform, it offers benefits such as streamlined invoicing and expense tracking. Please provide more details on the setup process and limitations. Kindly allow us to call you at <tel_num> for a detailed discussion.",Request,Technical Support,medium,en,400,Documentation,Feature,IT,Tech Support,,,,
Exploring Integration of Existing Data Analytics Tools with Zapier,I'm interested in integrating Zapier with our current data analytics tools to streamline our data analysis and automate tasks. Could you provide more details on the process? I would appreciate any help you can offer. Looking forward to your response.,"Thank you for your interest in integrating Zapier with your data analytics tools. Zapier is compatible with a wide range of data analytics tools, enabling streamlined data analysis and automation of tasks. To determine the best approach for integration, could you please provide specific details about your existing tools? We hope to achieve a seamless integration. I would be happy to discuss this further and can be reached at <tel_num> for a convenient call to explore our options.",Request,Billing and Payments,medium,en,400,Feature,Feedback,IT,Tech Support,,,,
Secure Medical Data Systems Implementation,Address enhanced security protocols for medical data management in hospital systems to ensure compliance and safeguard sensitive information.,"Thank you for contacting us about secure medical data systems. We take data security very seriously and are committed to ensuring compliance and protecting sensitive information. We recommend enhancing security measures for medical data management in hospital systems by implementing multi-layered encryption, access controls, and regular security audits. We would be happy to discuss and provide a customized solution for your organization. We are available to call at your convenience to discuss the next steps and provide further assistance.",Change,Product Support,high,en,400,Security,Compliance,IT,Tech Support,,,,
Issues with Analytics-Dashboard,"Investment optimization is displaying incorrect signals on the Analytics-Dashboard. This issue seems to have arisen after the recent software update. We have restarted the program and cleared the cache, but the problem persists. Please assist us in resolving this issue as soon as possible.","We will investigate the issues with the Analytics-Dashboard. Please provide details about the incorrect signals and any recent software updates. Additionally, let us know when the problem first occurred. If necessary, we can arrange a call to discuss the problem in more detail and find a solution for account <acc_num>. Please provide an appropriate time window for the call, contact number: <tel_num>.",Incident,Technical Support,high,de,400,Bug,Performance,IT,Tech Support,Feature,,,
Probleme der Sicherheit medizinischer Daten,Brauchen Unterstützung,"Hierbei helfen wir bei Sicherheitsproblemen. Bitte beschreiben Sie mehr über das Problem mit den medizinischen Daten, damit wir besser helfen können.",Incident,Product Support,low,de,400,Security,IT,Tech Support,,,,,
Strategies for Digital Marketing Brands,Seeking customer support to explore digital marketing strategies for brand growth. Could you provide details on the services you offer? I would greatly appreciate any information that could guide our approach to digital marketing to help our business grow. Thank you for your time and assistance. I look forward to hearing from you soon.,"To provide you with information on digital marketing strategies, please allow us to call you for a convenient time to discuss the details of our services offered.",Request,Billing and Payments,medium,en,400,Feedback,Sales,IT,Tech Support,,,,
Request for Information on Data Analytics Solutions for Investment Strategies,"I appreciate your interest in our data analytics solutions designed to optimize investment strategies. Our services encompass data analysis and reporting, predictive modeling, and portfolio optimization. We utilize advanced tools and techniques to assist clients in making informed investment decisions. To provide you with more specific details, could you please let us know the type of investments you are focusing on and the current challenges you are looking to optimize? This will allow us to tailor our services to better meet your needs.","Thank you for your interest in our data analytics solutions aimed at optimizing investment strategies. Our services include data analysis and reporting, predictive modeling, and portfolio optimization. We employ advanced tools and techniques to help clients make informed investment decisions. To provide you with more detailed information, could you please specify the type of investments you are targeting and the current challenges you wish to address? This will enable us to better tailor our services to your needs.",Request,Sales and Pre-Sales,medium,en,400,Feedback,Sales,IT,Tech Support,,,,
Functionality Inquiry,"I would like to learn more about project management features. Could you provide more details on scalable SaaS functionalities for project management? I am interested in understanding how the platform can support team growth and adapt to changing needs. Specifically, I am curious about automation of workflows, collaboration tools, and reporting features. Thank you for your time and assistance. I look forward to hearing back soon.","For further information on project management features, please contact us at <tel_num>.",Request,Customer Service,high,de,400,Feature,Feedback,Performance,IT,Tech Support,,,
Technischer Support-Anfrage,"Benutzer erleben interne, leistungsschwache Leistungen des Projektverwaltungsinstruments während der Gipfelnutzungsjahre. Diese sind auf erhöhte Serverbelastungen und Netzwerkprobleme zurückzuführen. Obwohl die Serverleistung überwacht wurde und die Dienste neugestartet wurden, blieb das Problem bestehen. Unterstützung wird benötigt, um das Problem bald zu lösen.","Wir erhalten Ihre technische Support-Anfrage über leistungsschwache Leistungen des Projektverwaltungsinstruments. Um das Problem zu untersuchen, kontaktieren Sie uns bitte unter <tel_num>. Wir vereinbaren einen Termin für eine weitere Diskussion und die Lösung des Problems.",Incident,Technical Support,high,de,400,IT,Tech Support,Performance,Network,Bug,,,
Sicherheitsprobleme im Medizinischen Datenystem,"Sehr geehrte Kundensupport, ein Versuch des autorisierten Zugriffs wurde im Medizinischen Datenystem festgestellt, der auf veralteten Sicherheitsprotokollen basiert. Vorübergehende Sicherheitsmaßnahmen wurden eingeführt und die Protokolldaten wurden vorläufig geprüft, um die Situation zu beurteilen. Das Team untersucht derzeit den Vorfall, um die möglichen Auswirkungen einer eventuellen Verletzung festzustellen und notwendige Maßnahmen zu ergreifen, um zukünftige Vorfälle zu vermeiden. Sobald weitere Informationen verfügbar sind, informieren wir die beteiligten Parteien. Bitte informieren Sie uns, falls weitere Informationen zur Unterstützung erforderlich sind.","Wir bedanken uns für Ihre schnelle Mitteilung über die bisherigen Maßnahmen bezüglich des medizinischen Daten-Sicherheitsproblems. Wir stehen Ihnen zur Verfügung, falls weitere Unterstützung erforderlich ist. Bitte informieren Sie uns über Fortschritte der Untersuchung, falls Sie Unterstützung benötigen.",Incident,Customer Service,medium,de,400,Security,IT,Tech Support,Performance,,,,
Problem with Billing System Updates,"A billing issue has arisen, affecting payments for multiple products. It seems linked to recent system updates. After verifying and attempting a system reboot, the issue still persists. Please assist us in resolving this matter soon to avoid any disruptions.",Investigate the billing system issue by contacting <tel_num> to discuss and resolve the problem as soon as possible.,Incident,Billing and Payments,high,en,400,Billing,Payment,Disruption,Recovery,Maintenance,,,
Issue with Display,"Facing issues with the display on the SaaS platform Acer Predator XB273K Monitor. The monitor is showing compatibility issues with the resolution settings. The monitor software has already been restarted, but the problem persists. Looking forward to your support in resolving this issue.","For the display issue on the SaaS platform Acer Predator XB273K Monitor, please contact us soon so we can discuss potential solutions and work towards a resolution.",Incident,Product Support,high,de,400,Bug,Performance,IT,Tech Support,,,,
Support for Enhancing Data Analytics Capabilities,"Request for improving data analysis skills and optimizing investments in affected products. Aim to make better-informed decisions, enhance performance, and provide necessary insights with current analytical tools to promote business growth. Wish to see more advanced features such as predictive modeling and real-time data visualization. Need to be able to react quickly to market changes and stay competitive. Believe that improvements can significantly impact the business. Looking forward to hearing back soon.",Received request for enhancing data analysis capabilities and optimizing investments. Understand the importance of advanced features like predictive modeling and real-time data visualization to boost business growth. Would like to discuss specific requirements. Please provide more details on the current analytical tools in use and the expected impact of the improvements. Can arrange a call to discuss the next steps and work on your request.,Change,Technical Support,low,de,400,Feature,Performance,Feedback,Documentation,IT,Tech Support,,
Anforderung zur Verbesserung der digitalen Marketingstrategie,"Sehr geehrte Kundenservice, ich bitte um Unterstützung bei der Optimierung unserer digitalen Marketingstrategien. Unsere Aktuelle Strategie trägt zur Markenentwicklung auf verschiedenen Plattformen und für unsere Produkte bei, aber wir glauben, dass eine sorgfältigere Leitung unserer Onlinepräsenz uns einen breiteren Publikumkreis erreichen ermöglicht. Wir schätzen, wenn Sie eine umfassende Analyse unserer aktuellen Strategie durchführen und uns Verbesserungsvorschläge geben könnten. Insbesondere interessiert uns die Verbesserung der Nutzung von Sozialmedien, Suchmaschinenoptimierung und Inhaltsmarketing.","Wir werden Ihre Anforderung zur Verbesserung der digitalen Marketingstrategie umfassend durchsehen und Ihnen Vorschläge zur Optimierung von Sozialmedien, Suchmaschinenoptimierung und Inhaltsmarketing liefern, um Ihre Onlinepräsenz und Markenwachstum zu verbessern.",Change,Product Support,medium,de,400,Feedback,Feature,Documentation,Sales,,,,
Brauchbare Hilfe bei der Digitalen Marketing Unterstützung,"Lieber Kundenservice, ich möchte eine wichtige Angelegenheit melden. Unsere Markenagentur ist derzeit konfrontiert mit vermindertem Markenengagement aufgrund der aktuellen digitalen Strategien. Die veralteten Inhalte und ineffizienten Ziele sind die Ursache. Trotz aller Bemühungen, um unsere Kampagnen zu optimieren und Inhalte zu aktualisieren, konnten wir bisher nur signifikante Verbesserungen feststellen. Das Team hat verschiedene Ansätze versucht, die Ergebnisse sind jedoch erfreulich. Wir glauben jedoch, dass eine strategische Überprüfung und die Erkundung neuer Wege dringend notwendig sind, um das Engagement zu steigern. Könnten Sie uns bitte unterstützen?","Wir freuen uns, Ihnen bei Ihren digitalen Marketinganliegen zu helfen. Bitte teilen Sie uns die aktuellen Details zu Ihren Strategien und Bemühungen mit. Sobald es sich ergibt, können wir einen Termin für ein Gespräch vereinbaren.",Incident,Sales and Pre-Sales,low,de,400,Feedback,Performance,Feature,IT,Tech Support,,,
Message Regarding Unexpected Billing Increases,Recently received a monthly statement with an unexpected rise in the bill amounts. This increase seems to be due to recent account adjustments. I have reviewed the account balance with the customer support and requested an explanation. I look forward to receiving a detailed explanation of the billing increase.,"I have received your request regarding the unexpected increase in your billing amount. I apologize for any inconvenience this may have caused. I am pleased to assist in resolving this matter. To better understand the situation, please provide your account number, the date of the statement, and a brief description of any recent changes or adjustments. I will thoroughly examine the account to identify the cause of the increase and may need to contact you for additional information.",Problem,Billing and Payments,medium,de,400,Billing,Account,Refund,Feedback,,,,
Request for Update on Marketing Agency Strategy,"Customer Support, requesting an update on the marketing agency's digital strategy. The current digital strategy is yielding the desired results, but service outages are affecting brand growth. I believe a revised strategy would help us better reach our target audience and improve our overall brand presence. I would appreciate it if you could review the matter and provide a plan for updating the digital strategy. This should include an analysis of the current strategy, identification","<name>, thank you for your email regarding the update on the marketing agency's digital strategy. We understand the importance of an effective digital strategy in achieving your brand growth goals. We would be happy to assist in reviewing the current strategy and providing recommendations for improvement. To better understand the current challenges and objectives, could you please provide more information about the service outages and the desired results you are aiming to achieve? This will enable us to provide a tailored plan for updating the digital strategy.",Change,Service Outages and Maintenance,high,en,400,Feedback,Outage,Performance,Recovery,Documentation,,,
Unvorhergesehene Unterbrechung beeinträchtigt kritische Systeme und Sicherung medizinischer Daten in Krankenhäusern,"Es gab eine unerwartete Unterbrechung, die kritische Systeme in der IT-Infrastruktur von Krankenhäusern beeinträchtigt hat, insbesondere die Sicherung medizinischer Daten. Die Unterbrechung wurde möglicherweise durch einen Netzwerkausfall oder Hardware-Fehler verursacht und hat mehrere Geräte beeinflusst. Vorläufige Maßnahmen wurden bereits umgesetzt, um das Problem zu beheben.","Wir bestätigen die gemeldete Unterbrechung. Sie hat kritische Systeme und insbesondere die Sicherung medizinischer Daten in Krankenhäusern beeinträchtigt. Wir verstehen, dass die gravierende Natur des Problems potenzielle Auswirkungen auf die Betriebsprozesse haben kann. Dringende Maßnahmen wurden eingeleitet, um die Ursache der Unterbrechung zu ermitteln und möglicherweise einen Netzwerkausfall oder Hardware-Fehler zu identifizieren und zu beheben.",Incident,Service Outages and Maintenance,high,de,400,Outage,Disruption,Recovery,Backup,Hardware,Network,IT,Tech Support
Prüfung von Abrechnungsunterschieden mithilfe digitaler Werkzeuge aufgrund neuer Abonnementänderungen,"Sehr geehrter Kunde, bedanken Sie sich für Ihre Aufmerksamkeit hinsichtlich der Abrechnungsunterschiede, die aufgrund der neuen Abonnementänderungen mit digitalen Werkzeugen aufgetreten sind. Das Team wird den Kontoauszug prüfen, die Genauigkeit gewährleisten und eventuelle Probleme lösen. Bitte geben Sie uns die Gelegenheit, diese Angelegenheit zu studieren. Falls Sie eine Kontonummer haben, wäre eine schnelle Referenz sehr hilfreich und wird in unserer Antwort vermerkt. Wir informieren Sie im Fortschritt und geben Ihnen weitere Anfragen, falls es erforderlich ist, um die Lösung zu erreichen.","geehrter Kunde, bedanken Aufmerksamkeit hinsichtlich Abrechnungsunterschiede digitalen Werkzeugen aufgrund neuer Abonnementänderungen. Team Kontoauszug prüfen, Genauigkeit gewährleisten eventuelle Probleme lösen. Bitte lassen einstudieren. Falls Kontonummer Hand haben, wäre schnelle Referenz hilfreich, Antwort vermerken. Fortschritt weitere Anfrage informieren, falls erforderlich ist, Lösung erreichen.",Incident,Billing and Payments,medium,de,400,Billing,Account,Refund,Performance,Feedback,IT,Tech Support,
Issue Regarding Tracking,Conversion tracking on websites is operating correctly after the latest plugin update.,"Examine the issue related to tracking; since it is caused by the latest plugin update, contact for additional information to fulfill the requirement and resolve the problem if necessary.",Problem,Technical Support,high,de,400,Bug,Performance,Documentation,IT,Tech Support,,,
Boost Data Analytics Integration Across Our Products,"Customer Support is requesting an enhancement in data analytics integration across all impacted products. This would significantly enhance our ability to make investment optimization decisions more efficiently. Our team currently spends a considerable amount of time manually collecting and analyzing data, which leads to errors and delays. By integrating advanced data analytics tools, we can make more informed decisions and optimize investments more effectively. We would appreciate it if you could look into this matter and provide a solution.","<name>, thank you for your email regarding the enhancement of data analytics integration across our products. We will review your request and explore possible solutions to improve our investment optimization decision-making efficiency. We will contact you soon to discuss the details and provide a timeline for implementation.",Change,Product Support,high,en,400,Feature,Feedback,IT,Tech Support,,,,
Problem with SaaS Integration,"The project management SaaS is facing sporadic connectivity issues with the various integrated tools and devices. This problem might be due to network configurations or compatibility issues. Steps like restarting devices, updating software, and checking network settings have been taken, but the issue still persists and is impacting productivity. Assistance is needed to resolve this matter.","Dear [Name], we acknowledge the issue with the SaaS integration. We regret to hear about the connectivity problems with your project management SaaS. To better assist, we propose scheduling a call to discuss the issue in detail. I am available at your convenience. Please let us know a suitable time for the call, or provide the necessary information about the integrated tools, devices, and network configurations to start investigating. Contact number: <tel_num>",Problem,IT Support,medium,en,400,Network,Performance,Disruption,IT,Tech Support,,,
Improve Data Analytics Tools,Improve data analytics tools for better investment optimization,Thank you for your suggestion to enhance data analytics tools for better investment optimization. We will review your request and consider implementing upgrades to improve our services. Please contact us if you need to provide additional information regarding this matter.,Change,Sales and Pre-Sales,low,en,400,Feature,Feedback,IT,Tech Support,,,,
Enhance Compatibility for Improved Performance in Project Management SaaS,"We aim to update the compatibility settings for various software and hardware to enhance integration within your project management SaaS platform, ultimately improving performance.","To review and enhance the compatibility settings for your project management SaaS platform, we need to better integrate the software and hardware you use. This will help us provide a more detailed update of the necessary compatibility settings. For your convenience, please provide a list of the specific software and hardware you are currently using. Once we have this information, we can schedule a call at <tel_num> to discuss further. After the update is complete, we will notify you, and <acc_num> will be updated with the new settings for a thorough review.",Change,IT Support,medium,en,400,Feature,Performance,IT,Tech Support,,,,
Dringlicher Fehler in Datenanalyse beeinträchtigt Investitionsentscheidungen,"Ein kritischer Fehler trat während der Datenanalyse auf, was die Investitionsoptimierungsentscheidungen verzögert hat. Es besteht die Vermutung, dass unerwartete Softwareversionen oder Datenformate die Ursache sein könnten. Obwohl die Plattformen regelmäßig aktualisiert und die Datensicherheit überprüft wurde, hält sich der Fehler weiterhin. Bitte teilen Sie weitere Details zu den verwendeten Softwareversionen und Datenformaten, damit wir das Problem ermitteln können. Sollten Sie diese Angelegenheit zu einem späteren angemessenen Zeitpunkt erörtern möchten, kontaktieren Sie uns an dem genannten Zeitpunkt. Für weitere Schritte können Sie auch den angegebenen Kontakt für sofortige Unterstützung nutzen.","Wir stehen Ihnen zur Verfügung, um den kritischen Fehler in der Datenanalyse zu lösen. Bitte geben Sie mehr Details zu den verwendeten Softwareversionen und Datenformaten, damit wir das Problem ermitteln können. Sollten Sie diese Angelegenheit zu einem späteren angemessenen Zeitpunkt erörtern möchten, kontaktieren Sie uns an dem genannten Zeitpunkt. Alternativ können Sie sofortige Unterstützung über den angegebenen Kontakt <tel_num> oder Konto <acc_num> erhalten.",Incident,Technical Support,high,de,400,Bug,Performance,Security,IT,Tech Support,,,
Users Experience Crashes Exporting Projects on Smartsheet Android Devices,"Multiple users are reporting crashes when exporting projects on Smartsheet using Android devices, which might be linked to compatibility issues with Avast Free Antivirus. Reinstalling or temporarily disabling the antivirus software has resolved the issue for some. Assistance is needed to troubleshoot and fix the problem.","I'm here to assist with an issue where users are experiencing crashes while exporting projects on Smartsheet from their Android devices. It has been noted that several users are encountering these crashes, and it may be related to compatibility issues with Avast Free Antivirus. Although reinstalling or temporarily disabling the antivirus software has resolved the issue for some, we would like to further investigate the problem. To better understand the situation, could you please provide details on the Android device model and the version of Smartsheet used? Additionally, it would be helpful to know if there are any specific error messages displayed.",Incident,Product Support,medium,en,400,Bug,Crash,Performance,Hardware,IT,Tech Support,,
System Crashes During Project Exports,"We are facing system crashes during project exports, which we believe are due to memory overload with large datasets. Despite attempts to optimize data processing routines and increase memory allocation, the problem persists. Please help us resolve this issue.","We are investigating the system crashes encountered during project exports. To assist you better, could you please provide details on the datasets and the optimization steps you have taken so far? We would like to schedule a call at your convenience to discuss possible solutions. Please let us know a suitable time to reach you at <tel_num>.",Incident,Technical Support,high,en,400,Bug,Crash,Performance,IT,Tech Support,,,
Problem with Investment Calculations,"A financial company encountered inconsistencies in investment return calculations using H2O.ai SQL Server analytics. The issue might be due to data integration errors or outdated algorithms. To date, the team has reviewed the data sources and updated the software, but the inaccuracies still persist. Despite efforts to troubleshoot, the problem remains unresolved. We would greatly appreciate it if you could look into this matter and provide a solution as soon as possible. Please let us know if you need any additional information.","Service Desk under <name> is addressing the issue related to investment calculations using H2O.ai SQL Server analytics. We understand that the team has already reviewed the data sources and updated the software, but inaccuracies still persist. To better understand the issue, we would like to request information on the errors experienced and the troubleshooting steps taken so far. If possible, please provide this information at a good time for a call at <tel_num> to discuss and determine the next steps to resolve the issue.",Problem,Returns and Exchanges,low,en,400,Bug,Performance,IT,Tech Support,Documentation,,,
Urgent Support Required - Data Breach in Hospital System,"A data breach has been encountered in the hospital's system, resulting in the compromise of patient records.","I am writing to acknowledge the urgent need for support regarding the data breach issue in the hospital's system. I understand the severity of the situation and the importance of protecting patient records. To assist further, please provide details about the breach, the date it occurred, and any error messages you have received. I am available to discuss this issue further and would be happy to schedule a call at your earliest convenience. Please let me know a suitable time to call you at <tel_num> in regards to <acc_num>.",Incident,IT Support,high,en,400,Security,IT,Tech Support,Outage,,,,
