subject,body,answer,type,queue,priority,language,version,tag_1,tag_2,tag_3,tag_4,tag_5,tag_6,tag_7,tag_8
Assistance Required for Guidance Data Analytics Integration,Seeking guidance on integrating data analytics tools with the Touchscreen-Monitor Ansible system for investment optimization. Can you offer recommended practices for the integration process? Any resource information to assist in initiating this project would be appreciated.,Happy to assist with data analytics integration. Please provide details of your current setup and specific requirements so I can offer tailored recommendations and best practices for integrating with the Touchscreen-Monitor Ansible system.,Request,Product Support,high,en,52,Product,Feature,Documentation,IT,Tech Support,,,
Report Minor UI Lag Issues,"Incident report: Minor UI lag has been observed, possibly due to recent server updates. Restarted the affected servers, but the issue persists intermittently. Further investigation is needed to resolve the issue.","Received report of minor UI lag issues, which are likely caused by recent server updates. The team will conduct an investigation to resolve the issue. If additional information is needed, contact <tel_num> to assist in resolving the matter promptly.",Incident,Technical Support,low,en,52,Performance,Outage,Recovery,IT,Tech Support,,,
Lösungen für Probleme bei digitalen Kampagnen gefunden,"Unsere Marketingagentur hat mehrere Software- und Hardwareausfälle erlebt, die die digitalen Kampagnen beeinträchtigten. Mögliche Ursache könnten Kompatibilitätskonflikte sein. Geräte wurden neu gestartet und Softwareversionen aktualisiert, um das Problem zu beheben. Das Team arbeitet daran, Konflikte künftig zu verhindern und einen reibungslosen Ablauf unserer digitalen Kampagnen sicherzustellen.","<name>, danke, dass Sie uns bezüglich der Probleme bei digitalen Kampagnen aufgrund von Kompatibilitätskonflikten kontaktiert haben. Wir schätzen die Maßnahmen, die Sie ergriffen haben, um das Problem durch Neustart der Geräte und Aktualisierung der Softwareversionen zu beheben. Gerne möchten wir ein Gespräch vereinbaren, um mögliche langfristige Lösungen zu besprechen und zukünftige Konflikte zu vermeiden. Wäre ein passender Zeitpunkt für ein Gespräch möglich? Bitte teilen Sie uns eine geeignete Zeit unter <tel_num> per E-Mail mit.",Incident,Technical Support,high,de,52,Bug,Hardware,Performance,Disruption,Maintenance,,,
Expansion Strategies,"Customer support team, I am seeking guidance on how to optimize digital strategies to enhance brand growth across various technology products. As a business owner eager to expand my brand's online presence and reach a broader audience, I am uncertain about the best approach to achieve this goal. Could you please provide detailed instructions and recommendations on how to effectively optimize digital strategies for brand growth across multiple tech platforms? I would also appreciate the opportunity to discuss this further via a call at <tel_num> to evaluate the effectiveness of these digital strategies. I look forward to your assistance in growing my brand's online footprint.","<name>, thank you for contacting the customer support team. To optimize digital strategies for brand growth across multiple tech products, we recommend developing a unified brand identity and customizing marketing efforts to leverage each platform's unique features. We can provide detailed guidance and tailored recommendations. Please let us know if you're available for a call at <tel_num> to discuss and explore measures for assessing the effectiveness of these digital strategies. We look forward to helping you expand your brand's online presence.",Request,Technical Support,medium,en,52,Feedback,Sales,Lead,IT,Tech Support,,,
Support for Investment Data Integration,"Dear Customer Support, I am seeking detailed instructions on how to integrate Zoho CRM with PowerPoint 2021 for investment data presentations. I aim to develop interactive and dynamic presentations that effectively display investment information to clients. Despite searching online, I have been unable to find a comprehensive guide that details the steps involved in connecting these two tools. Could you please provide a step-by-step process for establishing this connection? Your assistance would be greatly appreciated.","Hello <name>, to assist with integrating Zoho CRM with PowerPoint 2021, you should utilize Zoho CRM's API through a third-party integration tool. I recommend visiting Zoho CRM's official website for specific instructions on available integrations. When creating impactful investment data presentations, consider using interactive templates that support real-time data updates. If you require detailed guidance, please let us know to arrange a call at your convenience.",Request,Customer Service,high,en,52,IT,Tech Support,Documentation,Feedback,,,,
,"Customer Support, I am reaching out to inquire about the digital marketing strategies your company employs to enhance brand growth across various tech products. I am interested in this field and believe it would be highly beneficial to gain insights into the approaches and techniques your team uses. Could you please provide details about the strategies you implement to promote brand awareness and increase sales across different tech products? I am particularly interested in understanding the role of social media and content marketing.","<name> We appreciate your interest in the digital marketing strategies our team uses. We adopt a multi-channel approach to promote brand awareness and drive sales across our tech products, utilizing social media, content marketing, and influencer partnerships to reach our target audience. Please let us know a convenient time for a call at <tel_num>. Alternatively, you can provide specific details about your interests, and we will share the relevant information, including metrics and standard practices.",Request,Sales and Pre-Sales,low,en,52,Feedback,Sales,Lead,Marketing,Strategy,Technology,Brand,Customer Support
,"Facing sporadic login problems that are preventing access. This might be related to a recent update in the authentication process. I have already tried clearing the cache and resetting passwords, but the problem continues. I would appreciate prompt assistance in resolving this issue. Please advise on any further steps we should take to fix the problem.","We are glad to assist with the intermittent login issues you're experiencing. We understand you've already attempted clearing the cache and resetting passwords, yet the problem remains. To better troubleshoot, could you please provide details about any error messages received and the frequency of login failures? Additionally, we would like to arrange a call to discuss the issue and explore potential solutions. If a call is convenient for you, kindly let us know a suitable time to contact you at <tel_num>.",Incident,Technical Support,medium,en,52,Login,Security,Authentication,Performance,IT,Tech Support,,
Problem with Project Management SaaS Platform,"Customer Support reports an incident involving the project management SaaS platform. The client is experiencing sporadic outages across various integrations, potentially linked to recent API updates that may have caused conflicts. Attempts to resolve the issue by reverting the last update and restarting services have been unsuccessful. Your prompt assistance in examining this matter and providing a solution would be highly appreciated. Please inform me if additional information is required. Thank you for your time.","<name>, we appreciate you reporting an issue with the project management SaaS platform. We apologize for the inconvenience caused by the intermittent outages. To proceed with a thorough investigation, could you please provide <acc_num> details regarding the recent API updates? We are eager to assist in resolving this issue promptly. If needed, we can also schedule a call at a convenient time to discuss further.",Incident,Technical Support,medium,en,52,Outage,Disruption,Recovery,Software,Support,Update,Integration,
Enhancement of Investment Optimization Systems,"Dear Customer Support, I am submitting a request for the upgrade of our hardware and software tools to improve data analytics capabilities for investment optimization. Our existing system is outdated and lacks essential features, preventing us from obtaining accurate and timely insights. We believe that upgrading these tools will enable us to make better-informed investment decisions and enhance overall performance. Specifically, we are interested in integrating new data visualization software and upgrading hardware to boost processing power. Your assistance in this matter would be highly valued.","<name>, thank you for your request to upgrade your hardware and software tools to enhance investment optimization. We will review your requirements and provide a quote along with a timeline for the upgrade. To proceed, we may need additional details about your current system. Please contact <tel_num> to discuss any questions or to schedule a call at your convenience.",Change,Product Support,medium,en,52,Feature,Performance,Hardware,Software,Analytics,Optimization,,
Datenschutz und Verschlüsselung medizinischer Daten,"Sehr geehrter Kundenservice, ich bitte um eine Anleitung zur Implementierung einer sicheren Datenverschlüsselung für medizinische Aufzeichnungen im Microsoft Dynamics 365 Krankenhaus-IT-Bereich. Es ist mir bewusst, dass der Schutz sensibler Patientendaten von größter Wichtigkeit ist. Ich möchte die besten Praktiken und Methoden zur Datenverschlüsselung in Dynamics 365 kennenlernen sowie Informationen zu spezifischen Konfigurationen und Einstellungen, die aktiviert werden müssen. Zudem freue ich mich über Empfehlungen zu Drittanbieter-Tools oder Plugins, die die Sicherheit unserer medizinischen Daten weiter verbessern können. Ich bin an allen relevanten Details interessiert.","Sehr geehrter <name>, vielen Dank, dass Sie den Service-Desk bezüglich der Datenverschlüsselung medizinischer Aufzeichnungen in Microsoft Dynamics 365 kontaktiert haben. Um die Sicherheit sensibler Patientendaten zu gewährleisten, empfehlen wir, die integrierten Verschlüsselungsfunktionen von Dynamics 365 zu aktivieren, beispielsweise die feldbezogene Verschlüsselung und die Verschlüsselung im Ruhezustand. Außerdem sollten Sie prüfen, ob die Anforderungen der HIPAA-Richtlinien erfüllt sind. Für zusätzliche Sicherheit können Sie den Einsatz von Drittanbieter-Tools oder Plugins in Betracht ziehen, um den Datenschutz weiter zu verbessern. Wenn Sie weitere Unterstützung benötigen, bitten wir um zusätzliche Informationen.",Request,Billing and Payments,medium,de,52,Security,Privacy,Data Encryption,Medical Data,Healthcare,Sensitive Data,Compliance,
,"Customer Support, I am reaching out to inquire about best practices for securing medical data using Ansible within a hospital's infrastructure. Could you provide guidance on how to ensure the confidentiality, integrity, and availability of sensitive patient information? I would also appreciate any recommendations or resources you could share on this topic. Thank you for your time and assistance.","<name>, thank you for your inquiry regarding the security of medical data with Ansible. To ensure confidentiality, integrity, and availability of patient information, I recommend implementing role-based access controls, encrypting sensitive data, and regularly updating your Ansible playbooks. For more detailed guidance, I would be happy to discuss this further; please let me know a convenient time to schedule a call so I can provide tailored recommendations and relevant resources.",Request,IT Support,medium,en,52,Security,Data Privacy,Confidentiality,Infrastructure,Support,Best Practices,,
Reported Security Concern at Hospital,"The healthcare organization encountered several connectivity problems with devices impacting hospital security. A potential network setup error may have led to the disruption. Devices were restarted, and firewall configurations were checked, but the issue persisted.",Please investigate the problem and provide details about the affected devices and network setup assistance.,Incident,IT Support,medium,en,52,Security,Network,Disruption,Infrastructure,,,,
Detected Discrepancies in Investment Forecasts,"Customer Support, reporting an issue with the financial firm's investment forecasts. Observed that the predictions are inaccurate, possibly due to problematic data integration. The team attempted to recalibrate the algorithms and data sources, but the problem persists. We are concerned that this may impact investment decisions and would like to request assistance in resolving the issue. Could you please review and suggest solutions for improvement? We appreciate your prompt attention to this matter and look forward to your response.","We received your email regarding the discrepancies in investment forecasts, which are suspected to stem from flawed data integration. We are investigating the issue and will provide recommendations for improvements. Kindly share details about the algorithms and data sources used, and contact <tel_num> for further discussion.",Problem,Customer Service,low,en,52,Disruption,Data,Performance,Security,IT,Tech Support,,
Problems with Financial Projections,A financial organization is facing problems with unreliable investment predictions even after utilizing DataRobot analytics solutions. Attempts to recalibrate models and update data sources have not yielded satisfactory results. The organization is requesting support to address this issue and enhance the accuracy of their forecasts.,"<name> Service Desk has received your message concerning issues with financial forecasts. To better assist you, please provide details about which DataRobot models are producing subpar results. We can also arrange a call at <tel_num> to discuss the necessary steps. Kindly let us know a convenient time for the call, and we will coordinate accordingly.",Problem,Customer Service,low,en,52,Performance,Security,Feedback,IT,,,,
,"A financial organization encountered inconsistencies in data impacting their investment analysis, potentially due to software conflicts among various products. The preliminary measures involved verifying data sources and rebooting the impacted applications. Further investigation is required to address the problem.",Examine software conflicts and data inconsistencies to fix the issue affecting investment analytics. Contact information is necessary.,Incident,Returns and Exchanges,low,en,52,Bug,Performance,Software Conflict,Investigation,Data Inconsistency,,,
Incident Impacting Several Products,"Customer Support,\n\nI am submitting a report regarding an incident in the Product Support queue classified as medium priority, which is affecting multiple products, including the Smart Home Hub.\n\nThe issue description is as follows: The project management SaaS experienced sporadic outages, disrupting user workflows. \n\nThis downtime appears to be caused by spikes in database load. \n\nI attempted to resolve the problem immediately by rebooting the system and clearing the cache; however, this did not fully resolve the issue.","<name>, I am writing to confirm receipt of your email concerning the incident impacting multiple products, including the Smart Home Hub. We understand that the project management SaaS experienced intermittent outages due to database load spikes. Rebooting and clearing the cache did not completely solve the problem. We will investigate the matter further and work on finding a solution. To assist with the resolution, could you please provide details about the downtime, including its frequency, duration, and when the occurrences happened? If necessary, we can schedule a call to discuss this in more detail.",Incident,Product Support,medium,en,52,Outage,Disruption,Performance,Support,,,,
,"Customer support, a financial institution experienced a service disruption affecting multiple devices involved in software data analysis and investment optimization. The issue appears related to network compatibility problems. Initial troubleshooting steps included system restarts and software updates, but the problem persists. We require additional assistance to resolve the issue and prevent future disruptions. Please help us identify the root cause promptly and find an effective solution. We appreciate your quick attention to this matter and look forward to your prompt response. The disruption has caused significant inconvenience, and resolution is urgent.","Case assigned. To resolve the service interruption, we need more information about the affected devices and their software. Please provide the details. Call <tel_num> to discuss further details and plan a solution so that normal operations can resume as soon as possible.",Incident,Service Outages and Maintenance,medium,de,52,Disruption,Network,Software,IT,Tech Support,,,
Update zu Synchronisationsproblemen bei Aufgaben,"Sehr geehrter Kunde,<br><br>Es wurden gelegentlich Verzögerungen bei der Synchronisation von Aufgabenaktualisierungen gemeldet, möglicherweise verursacht durch Spitzen bei der Serverauslastung. Um das Problem zu beheben, haben wir den Cache geleert und den Server neu gestartet. Die durchgeführten Maßnahmen sind wie folgt:<br><br>1. Cache geleert: Dies wurde durchgeführt, um sicherzustellen, dass veraltete Daten entfernt wurden und das System wieder ordnungsgemäß starten kann.<br>2. Server neu gestartet: Dies wurde ebenfalls durchgeführt, um sicherzustellen, dass der Server mit den neuesten Konfigurationen läuft und weitere Verzögerungen vermieden werden.<br><br>Wir überwachen die Situation genau.","Sehr geehrter <name>, vielen Dank für Ihre E-Mail bezüglich der Synchronisationsprobleme bei der Aufgabenaktualisierung. Wir schätzen die Maßnahmen, die Sie ergriffen haben, um das Problem zu beheben, einschließlich des Leeren des Caches und des Neustarts des Servers. Falls das Problem weiterhin besteht, bitten wir um zusätzliche Details, die uns bei der Untersuchung helfen können. Ein Anruf unter <tel_num> kann bei Bedarf geplant werden.",Incident,Returns and Exchanges,low,de,52,Performance,Disruption,Maintenance,IT,Tech Support,,,
Inquiry Regarding Scalability and Integration Capabilities of SaaS Platform,"Hello Customer Support Team, I am reaching out to inquire about the scalability and integration capabilities of your SaaS platform. Could you please provide detailed documentation and guidance on how the system handles increased traffic and data storage? I would greatly appreciate information on various integration options available, as well as API compatibility with third-party software. Additionally, it would be helpful to know about any limitations or restrictions, and the level of customization available. I look forward to hearing back from you as we explore how this platform can meet our business needs. Thank you for your time.","We appreciate your interest in our SaaS platform and would be happy to provide the information you need to determine if the system meets your business requirements. We will share detailed documentation on scalability and integration capabilities with you. Our platform is designed to handle increased traffic and data storage with automatic scaling and load balancing. We offer APIs to support various third-party software integrations. For specific information on customization options and potential limitations, we would like to schedule a discussion with you.",Request,IT Support,high,en,52,Feature,Documentation,Performance,IT,Tech Support,,,
Requirements for Medical Records Data Encryption Methods,Can you supply comprehensive details on data encryption strategies to safeguard medical records within hospital systems?,"<name>, thank you for contacting us about data encryption methods for protecting medical records in hospital environments. We offer a variety of solutions designed to secure sensitive medical data, including cutting-edge encryption technologies for data storage systems. Our solutions are developed to meet the highest standards of data security and comply with applicable regulations. To provide you with detailed and customized information, kindly share your current system details and specific requirements.",Request,Customer Service,medium,en,52,Security,Data Encryption,Medical Records,Hospital System,Privacy,Compliance,,
Digitale Tools aufgrund Überlastung ausgefallen,"Sehr geehrter Kundenservice, ich möchte ein Problem mit den digitalen Werkzeugen unserer Marketingagentur melden. Die Tools fallen sporadisch aus, vermutlich wegen Serverüberlastung. Wir haben bereits grundlegende Fehlerbehebungen wie Systemneustarts versucht, doch das Problem besteht weiterhin. Die Häufigkeit der Ausfälle nimmt zu, was den Betrieb erheblich stört. Wir bitten um eine dringende Überprüfung der Angelegenheit und um eine Lösung, um weitere Störungen zu vermeiden. Bitte informieren Sie uns, falls Sie zusätzliche Informationen benötigen. Vielen Dank für Ihre Unterstützung.",Baldige Untersuchung und Rückmeldung,Incident,IT Support,medium,de,52,Outage,Disruption,Recovery,Maintenance,IT,Tech Support,,
Billing Discrepancies Encountered by Financial Institution,"Dear Customer Support,<br><br>I am submitting a report regarding a critical problem with the billing system of a financial institution. The issue involves errors that impact several products related to investment data analytics and optimization. These problems are likely due to system integration issues. Our team has attempted to review invoices and reset payment gateways, but unfortunately, no solution has been found.<br><br>The errors have led to incorrect billing and payments, significantly disrupting business operations. We are concerned that this issue may persist and require urgent attention.","This is to acknowledge receipt of your report regarding billing errors within the financial institution's system. We understand the urgency of the matter given its impact on business operations. To assist with the investigation, please provide detailed information about the errors encountered, including specific error messages and invoice numbers. If you'd like to discuss this further, kindly let us know a convenient time for a call, and we will be happy to arrange it.",Problem,Billing and Payments,high,en,52,Billing,Disruption,Outage,Payment,Account,,,
Downtime Problem in Project Management System,"The project management SaaS encountered sporadic outages impacting several products. The suspected cause is conflicts from a recent Docker update. After restarting the containers, the problem remains. We are currently investigating the issue and working toward a solution. Kindly inform us if you have any questions or concerns.",Thank you for the update. Please provide a detailed report once the issue is resolved and inform us of any necessary actions on our part.,Incident,Product Support,medium,en,52,Outage,Disruption,Recovery,Maintenance,Bug,Performance,,
Reported Disruptions in Healthcare Provider Data Access Today,"Customer Support is currently managing data access disruptions impacting hospital operations. Preliminary assessments indicate potential misconfigurations in network security settings. We have restarted the affected services and updated firewall rules, but the issue persists. The situation raises concerns about its impact on patient care, and we require urgent assistance to troubleshoot and resolve the problem. Kindly advise on the next steps to address this matter. We appreciate your prompt attention and look forward to your response.","We regret to hear that hospital systems are experiencing data access issues. We are eager to assist in resolving this swiftly. Please provide any error messages encountered and details of the steps already taken. If needed, we can arrange a call to troubleshoot the problem at your earliest convenience. Let us know a suitable time for this discussion.",Problem,IT Support,medium,en,52,Disruption,Network,Security,IT,Tech Support,,,
Several Tools Experiencing Malfunctions,"Customer Support reports multiple SaaS project management applications are not functioning correctly. The affected tools include Smart-Türklingel, DocuSign, VLC, Hadoop, PDFfiller, Laravel, and Cisco IOS. These issues began following recent software updates. Attempts to resolve the problems by restarting systems, checking network connections, and reverting recent changes have been unsuccessful. It appears that the root cause is likely related to the recent updates. Your prompt assistance would be highly appreciated.","<name>, thank you for contacting us regarding the issues you're facing with several SaaS project management tools. We regret to hear that problems started after recent software updates, and that restarting systems, verifying network connections, and rolling back changes haven't resolved the issue. We are eager to investigate the matter further and provide a solution as soon as possible. Could you please share specific details such as the error messages, symptoms observed in the tools, and include any relevant screenshots? Additionally,",Incident,Product Support,high,en,52,Bug,Performance,Network,Outage,Disruption,,,
