subject,body,answer,type,queue,priority,language,version,tag_1,tag_2,tag_3,tag_4,tag_5,tag_6,tag_7,tag_8
,"Dear customer support at the marketing agency, we are experiencing a sudden decrease in website visitors. Possible causes may include changes in SEO strategies or updates to Google's algorithm. Our team has attempted to restore the visitor count by optimizing keywords and conducting analyses, but the visitor numbers remain low. Please call for further assistance with instructions on improving website visibility and increasing visitor numbers.","Please go through the case at <tel_num> to set up a connection and discuss possible solutions for further assistance. We can work on improving website visibility and visitor numbers, which are tracked in account <acc_num>.",Incident,IT Support,high,de,400,Feedback,Performance,Documentation,,,,,
Strategies for Enhancing Digital Marketing and Brand Growth,Could you provide information on digital marketing strategies to boost brand growth? It would greatly help us understand how to improve our online presence and reach a wider audience. Thanks for your assistance; we look forward to hearing back soon.,"We will review your request and provide a detailed response regarding digital marketing strategies, brand growth, and improving online presence.",Request,Technical Support,medium,en,400,Feedback,Sales,Feature,,,,,
Concerns About Securing Medical Data with Docker Redis 6.2,"Inquiring about securing medical data using Docker Redis 6.2 systems. Looking for guidance on how to properly configure and implement these technologies to ensure the confidentiality, integrity, and availability of sensitive medical information. Additionally, interested in leveraging Docker's containerization capabilities and Redis' in-memory data storage to enhance system performance and scalability. However, need assurance that the implementation will meet the required security standards and regulations. Please provide assistance.","Thank you for your concern regarding the security of medical data using Docker Redis 6.2. To ensure the confidentiality, integrity, and availability of sensitive information, I recommend implementing encryption, access controls, and regular security updates. I can provide best practices and recommendations for configuring Docker Redis to meet security standards and regulations. For detailed guidance, please let's schedule a call at <tel_num> to discuss your specific requirements and provide relevant resources to support your implementation.",Request,Technical Support,high,en,400,Security,Performance,Feature,IT,Tech Support,,,
Anfrage Unterstützung,Können Sie Informationen zu Datenanalysediensten und Investitionsstrategien bereitstellen?,"Sehr geehrte/r [Name], vielen Dank, dass Sie sich gemeldet haben. Das Servicezentrum hat Ihre Anfrage erhalten. Ihr Interesse an unseren Datenanalysediensten bedanken wir uns herzlich. Das Angebot umfasst Portfolioanalyse, Risikobewertung und Leistungsoptimierung, um Ihnen bei informierten Investitionsentscheidungen zu helfen. Wir freuen uns, Ihnen detaillierte Informationen zur Verfügung zu stellen und die Dienstleistungen so anzupassen, dass sie Ihren individuellen Bedürfnissen entsprechen. Wenn Sie ein Gespräch wünschen, lassen Sie uns bitte wissen, wann es Ihnen am besten passt. Sie erreichen uns unter [Telefonnummer] oder per E-Mail. Wir stehen Ihnen gerne zur Verfügung.",Request,Technical Support,high,de,400,Feedback,IT,Tech Support,,,,,
,"Customer Support, Lately, there have been suspicious access attempts on our healthcare systems, suggesting a possible security breach. Despite our efforts to review logs and enhance password security, signs of unauthorized access continue. We need your help in identifying and resolving this issue to ensure the security of our systems. Could you please provide guidance on the next steps we should take? We greatly appreciate a prompt response to this matter.","To assist with this case, please review the provided information and provide guidance on the next steps to resolve the potential security breach. We will arrange a convenient time to discuss the details and the assistance required.",Incident,Customer Service,medium,en,400,Security,Account,IT,Tech Support,,,,
Assistance with Secure Backup of Medical Data,"Dear Customer Support Team, I am writing to seek assistance with securing medical data using CyberLink PowerDirector 19 for our hospital IT setup. Could you provide guidance on how to ensure the confidentiality, integrity, and availability of sensitive patient data while meeting legal requirements? I am particularly interested in robust security structures, including recommendations for data encryption, access controls, and secure storage systems. I would appreciate any resource recommendations you can provide. Thank you for your understanding and support. I look forward to your prompt response.","Dear <name>, thank you for your inquiry regarding the secure backup of medical data using CyberLink PowerDirector 19 for our hospital IT setup. To ensure the confidentiality, integrity, and availability of sensitive patient data, it is recommended to implement data encryption and access controls. Consider using the AES encryption method for data encryption, and for access controls, implement role-based access control and multifactor authentication. Secure storage systems should be encrypted, and access controls should be applied to both cloud storage and on-premises storage systems. We look forward to discussing these details and providing additional recommendations.",Request,IT Support,medium,de,400,Backup,Security,IT,Tech Support,,,,
,"geehrte Kundenservice, interessiere mich für mehr digitale Strategien, um die Markengröße zu verbessern. Könnten Sie mehr Methoden und Techniken nennen, die helfen, Markenbewusstsein und Engagement aufzubauen? Freue mich darauf, Ansätze zu erfahren, insbesondere in Bezug auf Sozialmedien-Marketing und Inhaltscreativität sowie die Kundenerfahrung. Zusätzlich würde ich gerne mehr über Analytics-Messwerkzeuge und deren Nutzung zur Überwachung der Erfolgsrate von Strategien erfahren. Vielen Dank für Ihre Unterstützung. Ich freue mich darauf, bald von Ihnen zu hören. freundliche Grüße, [Ihr Name]","danken Sie für Ihr Interesse an digitalen Strategien und der Verbesserung der Markengröße. Unsere Ansätze umfassen die Kombination von Sozialmedien-Marketing, Inhaltscreativität und der Verbesserung der Kundenerfahrung. Wir nutzen verschiedene Analytics-Messwerkzeuge, um die Erfolgsrate unserer Strategien zu überwachen. Unser Team erstellt ansprechende Inhalte und nutzt Sozialmedien-Plattformen, um das Markenbewusstsein zu erhöhen und den Kundenaufwand zu fördern. Wir verwenden Datenanalyse, um die Leistung zu überwachen und basierend auf den Daten die richtigen Entscheidungen zu treffen. Wir freuen uns darauf, die Strategien in mehr Detail zu besprechen und Ihnen mehr Informationen über unsere Ansätze im Bereich digitaler Marketing zu liefern. Ich freue mich darauf, bald von Ihnen zu hören. freundliche Grüße, [Ihre Team]",Request,Customer Service,high,de,400,Feedback,Marketing,Documentation,Performance,Tech Support,,,
Issues with SaaS Platform Runtime,"Unexpected interruptions have been affecting the Project Management SaaS platform, impacting user access. The issues seem to be due to configuration errors following recent server updates. We have attempted to restart the affected services and revert to the latest configurations, but the problem persists. Please provide a prompt solution to this matter.","I confirm the issues with the SaaS platform runtime and apologize for any inconvenience caused. I understand that we have tried restarting the affected services and reverting to the latest configurations, but the problem remains. To assist, I would appreciate more detailed information, including error messages, and would like to see the steps we have taken since the last updates. It would be helpful if you could call at the agreed-upon time to discuss finding a solution. Please provide a suitable time for the call.",Incident,IT Support,high,de,400,Bug,Outage,Performance,IT,Tech Support,,,
Concerning Server Performance Delays,"Have experienced sporadic latency during peak hours, likely due to inadequate server capacity and inefficient queries.","Addressing the reported concerns about server performance delays. To better diagnose the issue, could you please provide specifics on the latency issues, including the exact times they occurred and any error messages received? This information will help in reviewing server capacity and query efficiency to identify the root cause and recommend necessary adjustments.",Problem,Technical Support,high,en,400,Performance,Network,IT,Tech Support,,,,
Upgrade Financial Data Analysis Tools,"Requesting improvements in data analytics tools to enhance investment optimization, performance tracking, and financial operations for better decision-making.","<name>, thank you for your email regarding enhancements to the financial data tools. I appreciate your feedback and would like to discuss further. Could you please provide specific details about the enhancements you are looking for in the data analytics tools? I am happy to review and discuss possible solutions at your earliest convenience. I am available to call at <tel_num> to discuss further.",Change,Returns and Exchanges,medium,en,400,Feature,Performance,Feedback,IT,,,,
Problem with Accessing Financial Reports,Users are unable to access recent financial reports after the latest update. The issue was resolved by restarting and clearing the cache successfully.,"Dear [Name], we acknowledge the issue with accessing financial reports post the recent update. We understand that restarting and clearing the cache resolved the problem. Kindly provide more details on the error messages users are receiving. It would be helpful to schedule a call at [Tel Number] to discuss the issue and work towards a resolution. Please let us know a suitable time for the call, or continue via email if preferred. We are happy to assist with account number [Acc Num].",Incident,Billing and Payments,medium,en,400,Bug,Performance,IT,Tech Support,,,,
