subject,body,answer,type,queue,priority,language,version,tag_1,tag_2,tag_3,tag_4,tag_5,tag_6,tag_7,tag_8
Concerns About Underperforming Marketing Campaigns,"Despite using digital strategies, our marketing campaigns are not performing well. There might be a misalignment between the product messaging and the target audience's preferences causing this issue. We have analyzed the data, adjusted our ad spending, and conducted A/B testing, but have not seen any improvements.","<name> understands your concerns about the underperformance of your marketing campaigns, despite the implementation of digital strategies. A misalignment between the product messaging and the target audience's preferences is a plausible cause. Since you have already analyzed the data, adjusted the ad spending, and conducted A/B testing without seeing any improvements, we would like to discuss this further with you. Could you please provide us with more information on the target audience and the product messaging? This would be very convenient.",Problem,Customer Service,high,en,400,Feedback,Performance,Product,Feature,Sales,,,
Support for Login Problems,"A user is experiencing intermittent login difficulties with the SaaS platform, which may be related to recent server updates. The user has already tried clearing the cache and logging in from multiple browsers but to no avail. They have also attempted different login credentials, but the issue still persists. The user is feeling frustrated and requests assistance to resolve the issue as soon as possible. Please look into the matter and provide a solution or workaround.",We will investigate the login issue and contact you soon to resolve it and provide a workaround for the user.,Incident,IT Support,medium,en,400,Login,IT,Tech Support,Performance,Outage,,,
Update Billing Analytics Software,Request for an update in the billing processes' analytics software integration.,"{name},\n\nWe appreciate your reaching out to us concerning the request for an update in the billing processes' analytics software integration. We are happy to assist with this matter and look forward to optimizing your billing setup.\n\nTo provide a tailored solution, could you please furnish us with the specific changes you would like to make to the billing process? This includes any new payment methods, updated billing cycles, or changes to existing account information (account number: <acc_num>).\n\nAdditionally, we would",Change,Billing and Payments,medium,en,400,Billing,Software,Feature,IT,Tech Support,,,
Improving Digital Marketing Tactics for Enhanced Brand Expansion,"Hello Customer Support, I am writing to request an update on our digital marketing strategies. My goal is to enhance brand growth and customer engagement across different platforms. My objective is to increase our online presence and foster meaningful connections with our audience. I would greatly appreciate it if you could provide guidance on the latest trends and practices to help us achieve this. Please let me know the next steps to implement these changes. Thank you for your time and assistance.","We will assist in updating your digital marketing strategies for brand expansion. To better understand your goals, we would like to discuss them with you and provide tailored guidance. I am available for a call at your convenience to explore the latest trends and practices that can help enhance your online presence and customer engagement.",Change,Customer Service,medium,en,400,Feedback,Sales,Product,Feature,,,,
Enhancing Security for Medical Data Systems,"Requesting detailed information on securing medical data in hospital settings. Could you provide details on encryption methods, access controls, and network security measures? Your guidance on compliance with relevant regulations and standards would be greatly appreciated. Thank you for your assistance with this matter.","Offering information on securing medical data systems. Recommend implementing encryption methods, access controls, and network security measures to protect sensitive data. For compliance with relevant regulations and standards, suggest reviewing the guidelines of the Health Insurance Portability and Accountability Act (HIPAA). Would be happy to discuss further and provide detailed guidance at your convenience.",Request,Technical Support,high,en,400,Security,IT,Performance,Documentation,,,,
Fehlerhaftes Abrechnungssystem,"Es werden fehlerhafte Abrechnungen und unklare Rechnungen erlebt. Diese Fehlerrückstände sind auf Abrechnungssystemfehler und Konto-Konfigurationsfehler zurückzuführen. Der Support wurde bereits kontaktiert, aber die Probleme behalten sich bestehen. Bitte helfen Sie dabei, den Fall zu lösen.","Sehr geehrte(n) [Name],\n\nich möchte Ihnen mitteilen, dass ich die Abrechnungssystemfehler und unklaren Rechnungen für das Konto [acc_num] erhalten habe. Entschuldigen Sie die Unannehmlichkeiten, die dies verursacht hat, und ich bin bereit, dabei zu helfen, das Problem zu lösen. Um das Problem besser zu verstehen, könnten Sie bitte mehr Details zu den fehlerhaften Abrechnungen und unklaren Rechnungen bereitstellen, damit wir darauf einigen können. Ich würde gerne einen Anruf vereinbaren, um dies zu besprechen. Falls ein späterer Anruf möglich wäre, lassen Sie mich bitte wissen. Vielen Dank.",Incident,Billing and Payments,medium,de,400,Billing,Account,Bug,Support,,,,
Comprehensive Guidelines for Secure Medical Data in Hospitals,Is it possible to offer detailed guidelines on securing medical data within a hospital's IT infrastructure? It is essential to ensure the confidentiality and integrity of patient records.,"We can provide general guidelines. For a detailed discussion on securing medical data within your hospital's infrastructure, please call us at <tel_num> for your convenience.",Request,IT Support,high,en,400,Documentation,Security,Performance,Feedback,,,,
,"Software zur Verarbeitung von Investment-Analysen-Software hat die Daten korrekt beim letzten Update verarbeitet. Versucht, das System neu zu starten und die Caches zu leeren.","Bestätigung E-Mail erhalten. Bitte geben Sie mehr Details zum Problem. Ich bin bereit, Ihnen bei der Beratung und Lösung Ihres Problems mit der Investment-Analysen-Software zu helfen.",Incident,Product Support,medium,de,400,Bug,Performance,IT,Tech Support,,,,
dringender Fall: Verschiedene Geräte-Funktionalitäten Netzwerkverbindung abgelehnt,"dringenden Fehler festgestellt, bei Geräten konnten mehrere Anwendungen keine Netzwerkkonnektivität aufbauen, was möglicherweise auf Softwareupdates oder Hardwareprobleme zurückzuführen ist. Neustarten oder Neuinstallation könnte das Problem beheben.",Bitte geben Sie weitere Details und kontaktieren Sie uns zu einer guten Zeit für einen Rückruf.,Incident,IT Support,high,de,400,Network,Hardware,Bug,Performance,IT,Tech Support,,
Issue with Medical Data Access System,"Facing difficulties with secure access to medical information. The issue is related to hardware compatibility and software conflicts. The systems have been restarted, drivers have been updated, and a malware scan was conducted, but the problem persists. The team has tried various steps to resolve the issue, but it remains unresolved. We kindly request your assistance to resolve the problem soon and ensure the security and integrity of our medical data.","To assist with the Medical Data Access System issue, please provide more details about the error messages. We can arrange a call to further investigate and resolve the problem.",Problem,Technical Support,low,de,400,Bug,Hardware,Network,Performance,Virus,IT,Tech Support,
Optimierung von Datenanalysetools und Investitionsoptimierung,"Sehr geehrte Kundensupport, ich möchte darauf hinweisen, dass die Verbesserung von Datenanalysetools sehr wichtig ist. Dies würde erheblich zu besseren Investitionsoptimierungsstrategien und Berichtsfähigkeiten führen. Eine verbesserte Datenanalyse ermöglicht es uns, informiertere finanzielle Entscheidungen zu treffen. Ich glaube, dass die Modernisierung unserer Tools die Effizienz erhöhen und Kosten reduzieren kann. Zudem würden verbesserte Berichtsfähigkeiten eine effektivere Überwachung der Fortschritte ermöglichen. Ich schätze Ihre Unterstützung beim Thema und freue mich darauf, bald eine Lösung anzubieten. Danke für Ihre Zeit und Unterstützung.","Sehr geehrter <name>, vielen Dank für Ihr Anliegen bezüglich der Verbesserung der Datenanalysetools und der Investitionsoptimierung. Wir befassen uns bereits mit möglichen Lösungen, um die Berichtsfähigkeiten und die Effizienz zu verbessern. Könnten Sie uns bitte mehr über Ihre aktuellen Anforderungen zu den Tools erzählen? Sie können telefonisch auf <tel_num> mit uns Kontakt aufnehmen, falls weitere Diskussionen notwendig sind. Wir schätzen jede Rückmeldung und freuen uns darauf, Ihnen zu helfen.",Change,Product Support,medium,de,400,Feature,Feedback,Performance,Documentation,,,,
Eilend benötigte Unterstützung,"Es wurde ein Datenverlust festgestellt, die Patientendaten im IT-System des Krankenhauses sind dadurch gefährdet, insbesondere aufgrund der Software-Updates.","Ich werde sofort Maßnahmen bezüglich des gemeldeten Datenverlusts ergreifen. Bitte geben Sie mehr Details zum betroffenen System und der Software-Update-Prozedur an. Ein Telefonat planen, um weitere Maßnahmen mit den Spezialisten zu besprechen und die Situation zu beheben. Wenn sich geeignete Zeit ergibt, vereinbaren wir das Telefonat.",Problem,Technical Support,high,de,400,Bug,Performance,Security,IT,Tech Support,,,
Unterstützung für die Markenentwicklung,Können wir die Stagnation des Markenwachstums trotz variabler Strategien umgehen?,"Um die Stagnation des Markenwachstums anzugehen, könnten Sie bitte mehr Details über die Strategien geben, die bisher implementiert wurden. Ich freue mich darauf, mögliche Lösungen genauer zu besprechen, sobald ein passender Zeitpunkt verfügbar ist, telefonisch.",Problem,Returns and Exchanges,low,de,400,Feedback,Sales,Marketing,,,,,
Verbessern der Sicherheitsprotokolle für medizinische Datenverwaltungssysteme,"Verbessern Sie die Sicherheitsprotokolle, um medizinische Daten und die Anmeldeinformationen der Benutzer zu schützen.","Die Sicherheitsprotokolle für medizinische Datenverwaltungssysteme werden verbessert, um zusätzliche Verschlüsselungsmethoden und Zugriffssteuerungen zu implementieren und die Anmeldeinformationen der Benutzer zu schützen. Das Team überprüft derzeit die laufenden Systeme und bereitet Empfehlungen für Verbesserungen vor. Falls zusätzliche Informationen zur aktuellen Einrichtung erforderlich sind, um fortzufahren, steht Ihnen gerne telefonisch eine spezifische Zeit zur Verfügung. Ich kann unter der Nummer <tel_num> <acc_num> erreicht werden, um weitere Details zu besprechen. Bitte geben Sie mir geeignete Zeit an.",Change,IT Support,high,de,400,Security,Documentation,IT,Tech Support,,,,
Probleme bei der Leistung der Marketing-Kampagne identifiziert,"Die Leistungsindikatoren unserer Markenbotschaft deuten auf eine Standstill hin. Aktuelle Kampagnen wurden mit A/B-Tests analysiert, jedoch sind die Ergebnisse suboptimal. Die überholten digitale Strategien und das Mangel an Datenanalyse-Tools scheinen die Ursache zu sein. Unterstützung wird benötigt, um effektivere Lösungen zu implementieren und das Markenwachstum zu fördern.","Ich möchte Ihre E-Mail über Leistungsprobleme in der Marketing-Kampagne anerkennen. Um die aktuelle Situation besser zu verstehen, könnten Sie detaillierte Informationen über die digitale Strategie und die verwendeten Datenanalyse-Tools bereitstellen. Wir könnten gerne ein Telefonat vereinbaren, sobald es Ihnen passt. Bitte teilen Sie geeignete Zeiten mit. Darüber hinaus sollten Sie die Leistungsindikatoren und die Ergebnisse der A/B-Tests vorbereiten, um gemeinsam effektivere Lösungen zu implementieren und das Markenwachstum zu fördern.",Incident,Human Resources,low,de,400,Performance,Feedback,IT,Tech Support,,,,
Support for Enhancing Brand Engagement,"There has been a notable decline in brand engagement metrics on various digital platforms. This may be due to recent algorithm changes or content strategy adjustments. Efforts to boost engagement through enhanced outreach, targeted ads, and social media posts have shown some positive results.","\""Name\"" will write an acknowledgment email regarding the significant decline in brand engagement metrics across multiple digital platforms. We appreciate you bringing this to our attention and would like to better understand the situation to identify the root cause. Could you please provide specific details on any recent algorithm changes or content strategy adjustments and the expected outcomes? Additionally, it would be helpful to know more about the targeted ads and social media efforts.",Incident,Product Support,high,en,400,Feedback,Performance,Product,Feature,Sales,,,
Brauche Unterstützung bei der Integration von Asana und Cisco Webex Meetings für Projektkooperation,"Ich benötige detaillierte Informationen zum Integration-Prozess. Bitte geben Sie mir ausführliche Schritte und Anforderungen. Das würde mir helfen, die Teamkollaboration effizienter zu gestalten.","Ich werde Ihnen ausführliche Schritte und Anforderungen zur Integration von Asana und Cisco Webex Meetings bereitstellen. Bitte rufen Sie mich in Kürze an, um die Details zu besprechen.",Request,Product Support,medium,de,400,Feature,IT,Tech Support,Feedback,,,,
Erkannte Sicherheits- und Datensperrerverletzung,Möchten Sie Hilfe?,"Wir haben ein Sicherheits- und Datensperrerverletzung-Problembeschrieben. Bitte geben Sie mehr Details zum Problem, damit wir besser helfen können. Wir benötigen Ihre Kontoinformationen, um den Fall zu untersuchen. Bitte rufen Sie uns in Ordnung auf Ihrer registrierten Rufnummer an, um diese Angelegenheit zu besprechen.",Incident,Product Support,low,de,400,Security,Alert,IT,,,,,
Technische Schwierigkeiten bei der SaaS-Plattform,"Wir bemerken häufige Stürze bei Ihrem MacBook Air. Es besteht der Verdacht, dass Kompatibilitätsprobleme zwischen Adobe Photoshop CC 2021 und PHP 8.0 die Ursache sein könnten.","Sehr geehrte(r) <name>, wir müssen uns mit den technischen Problemen auseinandersetzen, die die Nutzung unserer SaaS-Plattform auf Ihrem MacBook Air beeinträchtigen. Wir verstehen, dass Sie Kompatibilitätsprobleme zwischen Adobe Photoshop CC 2021 und PHP 8.0 vermuten. Um Ihnen besser zu helfen, bitten wir Sie, mehr Details über die Stürze bereitzustellen, etwa Fehlernachrichten, die Sie erhalten haben, und die Schritte, die Sie ausgeführt haben, bevor der Sturz eintritt. Bitte bestätigen Sie außerdem die aktuelle Version unserer SaaS-Plattform, die Sie verwenden. Diese Informationen werden dem technischen Team zur Untersuchung zur Verfügung gestellt.",Incident,Product Support,high,de,400,Bug,Crash,Performance,IT,Tech Support,,,
Bewerbung für digitale Strategiedienstleistungen,"Ich bin interessiert, mehr über digitale Strategiedienstleistungen zu erfahren. Könnten Sie mehr Details geben? Insbesondere interessiert es mich, zu erfahren, ob diese Dienstleistungen die Markengröße fördern können. Die bereitgestellten Informationen, insbesondere zum Ansatz und den Vorteilen der Dienstleistungen, schätze ich sehr.","Sehr geehrte [name], vielen Dank für Ihre Anfrage. Ich freue mich, über digitale Strategiedienstleistungen zu sprechen und zu erläutern, wie wir die Markengröße fördern können. Sie können sich gerne an [tel_num] wenden, um mehr Details zu erhalten und auf mögliche Fragen zu antworten.",Request,Returns and Exchanges,low,de,400,Feedback,Sales,Lead,,,,,
Support for Integrating Third-Party Tools,"Hello Customer Support, I am reaching out for assistance with integrating third-party tools into my project management SaaS. Could you provide some guidance on this matter? I would greatly appreciate any resources or help you can offer to get me started. Specifically, I am looking for information on the types of tools that can be integrated, the process of setting up integrations, and any potential limitations or considerations I should be aware of. Thank you for your time and support. I look forward to hearing back soon.","Hello, thank you for reaching out to the support team regarding the integration of third-party tools. We can offer guidance on a range of integrations with popular tools, and you can find more information on our website. To get started, please visit our support page for step-by-step guides and documentation. If you need further assistance, I would be happy to schedule a call at a convenient time to discuss your specific requirements and potential limitations. Please let me know a suitable time for the call at <tel_num>. I look forward to discussing this further.",Request,Service Outages and Maintenance,high,en,400,Feature,Documentation,Feedback,IT,Tech Support,,,
Unapproved Entry into Medical Files,There was an unauthorized access to medical data within the hospital's IT systems. Efforts to address the issue involved changing passwords and enhancing security measures.,We take this incident very seriously and would appreciate detailed information about the unauthorized access to medical data. Please provide all relevant details so we can investigate and assist you further.,Incident,Billing and Payments,high,en,400,Security,Bug,IT,Tech Support,,,,
,"Kundenservice, Firma erlebt technische Probleme mit Datenaufbereitungstools, vermutlich aufgrund von Softwarekonflikten, unkompatiblen Hardware-Elementen oder Systemupdates, möglicherweise falscher Konfigurationen. Die Kunden haben bereits versucht, die Geräte neu zu starten, Softwareupdates durchzuführen und den Cache zu leeren, aber die Probleme bestehen nach wie vor.","<name> Service-Desk, die technischen Probleme mit den Datenaufbereitungstools zu erkennen. Wir sind bereit, weitere Details zu Systemupdates und Fehlkonfigurationen zu hören, um die Ursache der Probleme zu identifizieren. Falls erforderlich, können wir telefonisch einen Termin vereinbaren, um Ihnen behilflich zu sein. Anruf: <tel_num>",Problem,Technical Support,medium,de,400,Bug,Hardware,Performance,IT,Tech Support,,,
Update Billing Details for Digital Strategy Services,"I hope this message finds you well. We are writing to request an update of our billing details for the digital strategy services we utilize. Recently, our company has changed its payment medium, and we need to ensure that the billing process runs smoothly. Could you please assist us in updating our billing details as soon as possible? Your quick response on this matter would be greatly appreciated. We look forward to your prompt response.","I am pleased to assist with updating the billing details for our digital strategy services. To proceed, I will need to verify the provided information. Could you please provide me with the name of your company, the service account associated with these services, and the new billing address along with your preferred payment method? I prefer to receive this information via email to keep the thread organized, but I am available to discuss this over the phone at a convenient time for you. Please let me know which method works best for you to ensure that the billing details are updated as quickly as possible.",Change,Billing and Payments,low,de,400,Billing,Payment,Account,Update,Feedback,,,
Inquire About Integrating Sage Accounting,"Inquiring about the integration of Sage Accounting into our project management SaaS. Could you provide detailed information on the integration process, its benefits, the setup procedure, and potential costs? Your assistance in providing comprehensive information on this matter is greatly appreciated, as we are interested in exploring ways to streamline our accounting and project management processes. Specifically, we would like to know about the available APIs and plugins for integration, as well as any tutorials or guides that could help us with this implementation.",Review and contact for further assistance,Request,Sales and Pre-Sales,low,en,400,Feature,Documentation,IT,Tech Support,,,,
Dienstleistungen in Datenanalyse,"Hallo <name>, danken Sie für Ihr Interesse an unseren Datenanalyse-Dienstleistungen zur Optimierung von Investitionen. Wir bieten verschiedene Analyselösungen an, die Kunden bei der Fazit ziehen von Investitionen unterstützen. Unsere Dienstleistungen umfassen Portfolioanalyse und Marktuntersuchungen. Wir können Ihnen Fallstudien und Empfehlungen von vorherigen Kunden zur Verfügung stellen. Lassen Sie uns den besten Ansatz für Ihre Anliegen besprechen und vereinbaren wir eine Telefonkonferenz, um die Convenienz zu gewährleisten. Bitte geben Sie eine geeignete Zeit an, und Sie können mich unter <tel_num> erreichen, um die Konferenz zu planen.","geehrte <name>, danken Sie für Ihr Interesse an unseren Datenanalyse-Dienstleistungen zur Optimierung von Investitionen. Wir bieten verschiedene Analyselösungen an, die es Kunden ermöglichen, informierte Entscheidungen zu treffen. Unsere Dienstleistungen umfassen Portfolioanalyse und Marktuntersuchungen. Wir können Ihnen Fallstudien und Empfehlungen von vorherigen Kunden zur Verfügung stellen. Lassen Sie uns den besten Ansatz für Ihre Anliegen besprechen, und wir stehen Ihnen gerne zur Verfügung, um eine Telefonkonferenz zu vereinbaren, um die Convenienz zu gewährleisten. Bitte geben Sie eine geeignete Zeit an, und Sie können mich unter <tel_num> erreichen, um die Konferenz zu planen.",Request,Product Support,medium,de,400,Feedback,Sales,IT,Tech Support,,,,
Anfrage nach Details zu digitalem Strategie-Produkt Dell UltraSharp U2720Q,"Könnten Sie mehr Details über digitale Strategie-Produkte für den Dell UltraSharp U2720Q bereitstellen? Ich bin interessiert, um Pläne für Produktmarketing zu entwerfen. Die bereitgestellten Informationen schätze ich sehr.",Wir können Ihnen Informationen zu digitalen Strategien für das Dell UltraSharp U2720Q geben. Sie können sich jedoch für weitere Informationen an uns wenden.,Request,Returns and Exchanges,high,de,400,Product,Feature,Sales,Feedback,,,,
Enhance Data Security,Write about enhancing security in Data Management Systems with a focus on patient health data. It is crucial to ensure compliance with legal regulations and to safeguard patient information. Urgent attention should be given to current system vulnerabilities to prevent data breaches. It is highly valued if immediate action can be taken to address this matter and implement necessary measures to protect sensitive patient data.,Received request to enhance security in our health data management systems. Forwarding this to the security team to implement necessary measures to protect sensitive patient data. Further discussions can be arranged for additional details.,Change,Technical Support,high,de,400,Security,Compliance,Alert,IT,Virus,,,
Query for Payment Disputes,A financial entity has identified inconsistencies in billing through the payments system. A potential reason for these issues could be problems with the integration of analytics tools.,"Acknowledged the support inquiry about payment discrepancies, which might be due to integration challenges with analytics tools. We will look into this matter and contact you shortly. Please furnish details about the discrepancies to assist us. Kindly call the registered contact number to discuss the issue further.",Incident,Billing and Payments,medium,en,400,Billing,Payment,Bug,Performance,Documentation,,,
Sichere Verwaltung von Krankenhausdaten,"Können Sie Details zu sicheren Datenverwaltungslösungen für Krankenhäuser erhalten, die Oracle Database 19c nutzen?","Wir können Ihnen Informationen zu sicheren Datenverwaltungslösungen für Krankenhäuser, die Oracle Database 19c verwenden, mitteilen, einschließlich Verschlüsselung und Zugriffskontrollfunktionen. Möchten Sie ein detailliertes Dokument? Bitte vereinbaren Sie einen Anruf, um dies zu besprechen. <tel_num>",Request,Billing and Payments,low,de,400,Security,IT,Tech Support,Documentation,,,,
Concern Regarding Software Efficiency,"Dear Customer Support,<br>A significant performance problem has surfaced with the project management software when it is used alongside Adobe Audition and Zoom simultaneously. This may be due to resource allocation conflicts or software incompatibility.<br>We have attempted to restart the applications, clear caches, and monitor CPU usage, but the issue still persists.<br>We would greatly appreciate any assistance you can provide to resolve this matter. Thank you for your support.","Thank you for reaching out to us regarding the performance issue with the project management software. To better assist you, could you please provide us with any error messages you are seeing, as well as the exact versions of the software you are using? This will help us troubleshoot the issue more effectively. If needed, we can schedule a call at a convenient time for you, please let us know a suitable time to reach you at <tel_num>.",Incident,Product Support,high,en,400,Performance,IT,Tech Support,,,,,
