subject,body,answer,type,queue,priority,language,version,tag_1,tag_2,tag_3,tag_4,tag_5,tag_6,tag_7,tag_8
Protection of Medical Data Best Practices with DocuSign SAP,Provide access to best practices for securing medical data,"Recommend implementing robust access controls, encrypting sensitive information, and using a secure integration mechanism with DocuSign SAP to ensure the confidentiality and integrity of medical data.",Request,Customer Service,medium,de,400,Documentation,Security,IT,,,,,
Anfrage zur Unterstützung der Integration von ClickUp,"Kontakt aufnehmen, um Informationen zur Integration von ClickUp in DataRobot zu erhalten. Das Ziel ist die Verbesserung der Effizienz in der Projektverwaltung. Könnten Sie detailliertere Informationen zur Integration bereitstellen, inklusive notwendiger Schritte und Anforderungen? Wir können Ihnen Ressourcen zur Verfügung stellen, um die Integration zu beginnen, und schätzen Ihre Unterstützung. Vielen Dank für Ihre Unterstützung. Ich freue mich darauf, bald von Ihnen zu hören.","Sehr geehrte [name], vielen Dank für Ihre Nachricht. Wir werden uns an den Servicedesk wenden, um Informationen zur Integration von ClickUp in DataRobot zu erhalten. Die notwendigen Schritte zur Integration werden Ihnen bereitgestellt. Bitte besuchen Sie die Website mit den Dokumentationen für die ClickUp-Integration. Sollten Sie weitere Hilfe benötigen, rufen Sie uns an unter [tel_num]. Ich freue mich darauf, Ihre Fragen während des Prozesses zu beantworten.",Request,Customer Service,medium,de,400,Feedback,IT,Tech Support,Feature,,,,
,"There is a potential data breach that has impacted the security of medical data. This could be due to weak access controls and outdated software. Steps taken include updating antivirus definitions, tightening user permissions, and assessing system logs for any suspicious activity. We are taking this incident very seriously and are working to resolve it promptly.","<name>, we appreciate the prompt notification regarding the potential data breach affecting medical data security. We acknowledge the measures taken, including updating antivirus definitions and tightening user permissions. Please assist in resolving the incident by providing us with the details of the breach, including the date and time it occurred, and any suspicious activity found in the system logs. We will work closely to ensure the issue is resolved promptly and that the security system is restored.",Incident,Product Support,low,en,400,Security,Virus,IT,Tech Support,,,,
System-Crashes in unserem Projekt-Management-System tritt häufig auf,"Unser Team meldet sich regelmäßig über System-Crashes. Diese Probleme könnten auf Kompatibilitätsprobleme zwischen unserer Software und Antivirus-Software sowie Hardwarekomponenten zurückzuführen sein. Bitte versuchen Sie, die Software zu aktualisieren und die Systeme neu zu starten.","Wir empfehlen, die Schritt-für-Schritt-Anleitungen für die Problembehebung zu überprüfen und uns falls nötig zu kontaktieren.",Incident,Technical Support,high,de,400,Bug,Crash,Hardware,Performance,Virus,IT,Tech Support,
Support für Data Analytics,Brauche zusätzliche Informationen über die Daten.,"Sehr geehrte [name],\n\nvielen Dank für Ihre Nachricht. Das Service-Desk steht Ihnen zur Verfügung, um Ihre Fragen zur Datenanalyse zu beantworten. Um Ihnen optimale Unterstützung zu bieten, könnten Sie bitte mehr Details über die Art und Art der Dateninformationen geben, die Sie benötigen. Dies ermöglicht es uns, eine genaue und hilfreiche Antwort zu erstellen. Falls eine telefonische Diskussion erforderlich ist, können wir einen geeigneten Termin planen. Bitte geben Sie uns eine geeignete Zeit an, um Sie telefonisch an [tel_num] zu erreichen.\n\nVielen Dank und freundliche Grüße.",Request,Returns and Exchanges,low,de,400,IT,Tech Support,Documentation,Feedback,,,,
Request for Assistance with Reported System Outage,"Dear Customer Support, I am submitting this report on the system outage that has impacted access to our project management tools. It is possible that the issue may have arisen due to a recent software update. Despite my efforts to restart the affected applications and devices, the problem still persists. I would greatly appreciate it if you could look into this matter and provide a solution as soon as possible. Please let me know if there is any additional information you need to facilitate the resolution of this issue. Thank you for your time and assistance with this matter. I look forward to your response.",We will investigate the reported system outage and work towards finding a solution. Please provide the details of the software update and any specific error messages you are encountering to assist us further.,Incident,Human Resources,low,en,400,Outage,Disruption,IT,Tech Support,,,,
Improve User Interface for Project Management SaaS,"Sent request for enhancement of the user interface in the project management SaaS to improve navigation and accessibility. The current interface is overwhelming for new users and takes time to get familiar with the layout. An intuitive design would greatly benefit the overall user experience. Suggested improvements include simplifying the menu system, adding clear labels and instructions, and incorporating accessibility features such as high contrast mode and keyboard navigation. Changes would","Received your email requesting enhancements to the user interface for the project management SaaS. Appreciate the suggestions to simplify the menu system, add clear labels and instructions, and incorporate accessibility features. Forwarding your request to the development team for consideration in future updates. Would like to discuss further; please let us know a suitable time for a call at <tel_num> to gather more information and requirements. Thank you for your feedback, we look forward to touching base soon.",Change,Technical Support,high,en,400,Feature,Feedback,Documentation,,,,,
Langsame Aufchargezeit für Dashboard,"Benutzererfahrung ist beeinträchtigt durch hohe Serveranforderungen, was zu langsamem Laden des Dashboards führt.","Wir werden uns bewusst mit der Optimierung der Serverleistung auseinandersetzen, um die Ladestzeiten für das Konto <acc_num> der Benutzer zu verbessern.",Problem,Returns and Exchanges,medium,de,400,Performance,Bug,IT,Tech Support,,,,
Anomalie im Sicherheitsbereich,"Rekently, ein Sicherheitsverstoß bei medizinischen Daten im IT-System eines Krankenhauses wurde identifiziert. Es wird vermutet, dass veraltete Software und inkorrekt eingerichtete Benutzerberechtigungen die Ursache für die Schwachstelle waren. Momentan wurden Malware-Suchaktionen durchgeführt, und Benutzerzugriffe wurden eingeschränkt. Allerdings benötigen wir zusätzliche Unterstützung, um die Sicherheit unserer Systeme zu sichern.","Um den Sicherheitsverstoß zu bewältigen, benötigen wir mehr Informationen über den aktuellen Systemzustand und die Maßnahmen, die bisher eingesetzt wurden. Bitte vereinbaren Sie ein Telefonat, um weitere Unterstützung zu besprechen.",Incident,Technical Support,high,de,400,Security,Virus,IT,Tech Support,,,,
Support for Investments,"Decrease in Performance Indicators for Investment Optimization, possibly due to recent algorithm updates or data system connection issues.","Currently investigating the issues with Performance Indicators for Investment Optimization, which could be due to recent algorithm updates or data system connection issues. Could you please provide detailed information on the specific indicator that has decreased, when it started, and any other relevant details to help further investigate and offer a solution?",Incident,Human Resources,high,de,400,Performance,Network,Bug,IT,Tech Support,,,
Hilfe zur Datenanalyse erforderlich,Die finanzielle Firma meldet Probleme mit Datenanalyse und Investitionsoptimierung aufgrund von Softwareintegrationsfehlern.,"Sehr geehrte [name],\n\nich möchte mich um die Meldung zu Datenanalyse-Ausfällen und Investitionsoptimierung aufgrund von Softwareintegrationsfehlern kümmern. Um die Fehler besser zu verstehen und zu beheben, bitten wir Sie, detaillierte Informationen über den Fehler bereitzustellen, einschließlich der Beobachtungen und der Schritte, die Sie bisher unternommen haben. Sobald dies erforderlich ist, sind wir gerne bereit, eine Konferenz einzuleiten. Bitte teilen Sie uns geeignete Zeiten für die Konferenz mit [tel_num]. Sie können die Kommunikation lieber weiterhin per E-Mail fortsetzen, wenn Sie möchten. Wir werden unser Bestes tun.\n\nBeste Grüße",Incident,Customer Service,low,de,400,Bug,Performance,IT,Tech Support,,,,
,"Dear Customer Support, I am inquiring about the data analytics services you offer, particularly how they can be used to optimize investment strategies. Could you provide detailed information on the types of services you offer, such as predictive modeling, portfolio analysis, and risk assessment? I would greatly appreciate any case studies or examples of how you have assisted clients in the past. Additionally, could you provide information on the cost and implementation process for these services? I look forward to hearing back from you soon.","Dear [Name], thank you for reaching out to our customer support team. We appreciate your interest in our data analytics services, which include predictive modeling, portfolio analysis, and risk assessment to optimize investment strategies. We can provide case studies and examples of how we have assisted clients in the past. Regarding the cost and implementation process, we would be happy to discuss these with you. We are available to call at your convenience to discuss your specific needs and answer any questions you may have. Please let us know a time that works for you.",Request,Technical Support,high,en,400,Feedback,Documentation,IT,Tech Support,,,,
Verbesserung der Markensichtbarkeit online durch Effizienzverbesserungen,"Sehr geehrte Kundensupport, bitte überprüfen Sie, ob wir das Potenzial nutzen können, unsere Markensichtbarkeit mit Squarespace zu verbessern. Wir möchten unsere Online-Präsenz erweitern und freuen uns auf Tipps zu den besten Praktiken, wie Sie mit Squarespace Markensichtbarkeit erhöhen können. Besonders interessiert uns die Optimierung unserer Websites für Suchmaschinen und die Nutzung von Sozialmedien zur Vertrafbringerung und Anziehung von Verkehr auf unsere Seite. Vielen Dank für Ihre Geduld und Unterstützung. Wir freuen uns darauf, bald von Ihnen zu hören.","Wir bieten Ratschläge zur Optimierung von Squarespace-Websites für Suchmaschinen Nutzung und die Nutzung von Sozialmedien, um Verkehr auf Ihre Seite zu lenken. Bitte kontaktieren Sie uns zu einem geeigneten Zeitpunkt, um weitere Diskussionen zu führen.",Request,Customer Service,medium,de,400,Feedback,Feature,Documentation,,,,,
Verschlüsselung medizinischer Daten mit Docker und Django,"Geachte Kundensupport, \nIch richte mich an Sie, um die Verschlüsselung medizinischer Daten in unserem IT-System des Krankenhauses zu erfragen. Wir verwenden derzeit Docker und Django 3.2 und interessieren uns für die besten Praktiken zur Gewährleistung der Vertraulichkeit, Integrität und Verfügbarkeit sensibler Patientendaten. \nKönnen Sie uns Empfehlungen zur Umsetzung robuster Sicherheitsmaßnahmen geben, wie z.B. Verschlüsselung, Zugriffskontrolle und Sicherungen? Eine Anleitung zur Einhaltung relevanter Vorschriften wie HIPAA würden wir ebenfalls schätzen. \nDarüber hinaus möchten wir wissen, ob es bestimmte","geachte [Ihr Name],\nich danke Ihnen für Ihre Sorge bezüglich der Verschlüsselung medizinischer Daten in Ihrem Krankenhaus-IT-System. Um die Vertraulichkeit, Integrität und Verfügbarkeit sicherzustellen, empfehle ich die Umsetzung von Verschlüsselung, Zugriffskontrolle und regelmäßigen Sicherungen. Bitte beachten Sie die Sicherheitsanleitungen auf unserer Website zur Einhaltung der Vorschriften wie HIPAA. Spezielle Konfigurationen für Docker und Django finden Sie ebenfalls auf unserer Website. Falls Sie weitere Hilfe benötigen, sind wir gerne bereit, telefonische Verhandlungen zu vereinbaren, um das Setup zu besprechen und individuelle Ratschläge zu geben. Bitte teilen Sie uns mit,",Request,IT Support,medium,de,400,Security,IT,Tech Support,Documentation,,,,
Report on Security Incident Involving Data Breach,"The hospital's system faced a security breach that exposed medical records. This incident might have happened due to outdated security measures. Steps are being taken to secure the system, including applying necessary patches and reviewing access logs to prevent further unauthorized access.",We confirm receipt of the security incident report and appreciate the swift actions taken to secure the system. Please provide us with a timeline for further guidance on preventing similar breaches in the future.,Incident,Technical Support,high,en,400,Security,Bug,Outage,IT,Tech Support,,,
,"Sehr geehrte Kundenservice, ich melde einen unerwarteten Systemausfall an, bei dem während der Datenanalyse und Investitionsoptimierung Probleme aufgetreten sind. Mögliche Ursachen könnten neueste Softwareupdates oder eine Serverüberlastung sein. Trotz des Versuchs, die Dienste neu zu starten und die Updates zurückzurückschalten, behält das Problem seinen Verlauf. Ich schätze, dass Sie dringend eine Untersuchung durchführen und eine Lösung bereitstellen, um das System wieder online zu bringen. Der Ausfall hat einen bedeutenden Einfluss auf unsere Geschäftsaktivitäten und eine Verspätung bei der Behebung des Problems könnte zu erheblichen Verlusten führen.","Sehr geehrte [Name], wir haben Ihre E-Mail zur Behebung des Systemausfalls bei der Datenanalyse und Investitionsoptimierung erhalten. Wir werden sofort mit der Untersuchung des Problems beginnen und Sie mit den Details und einem prompten Handlungsplan zur Behebung der Situation verbinden.",Incident,IT Support,high,de,400,Outage,Performance,IT,Tech Support,Maintenance,,,
