subject,body,answer,type,queue,priority,language,version,tag_1,tag_2,tag_3,tag_4,tag_5,tag_6,tag_7,tag_8
,"Seeking guidance on integrating Zapier with existing data analytics tools. Would appreciate detailed information on the process. I am eager to learn how Zapier can help us streamline data analysis and automate tasks. Specifically, I would like to know the types of data analytics tools that are compatible with Zapier's requirements for integration. Thank you for your time and assistance. I look forward to hearing back soon.","Thank you for your interest in integrating Zapier with data analytics tools. Zapier is compatible with a wide range of data analytics tools, which allows for streamlined data analysis and automation of tasks. To determine the best approach for integration, could you please provide specific details about your existing tools? I hope this will help us achieve our goals. I would be happy to discuss this further and am available to call at <tel_num> to explore our options.",Request,Billing and Payments,medium,en,400,Feature,Documentation,IT,Tech Support,,,,
Issues with Engagement Metrics of Latest Campaigns,"Observing a decline in engagement metrics for the most recent campaigns. This decrease may be attributed to changes in social media algorithms. Adjustments have been made to the target audience segmentation and content strategies, but the results are still low.","Hello, we are here to assist with the issues regarding engagement metrics for your latest campaigns. To better understand the situation, could you please provide more details on the specific metrics that have declined and the social media platforms where this is occurring? Additionally, it would be helpful to know more about the changes made to the target audience segmentation and content strategies. This information will aid us in finding a precise solution to your problem, particularly concerning your campaigns.",Incident,Product Support,high,de,400,Performance,Feedback,Documentation,,,,,
Bericht: Systemfehler bei Marketing-Plattform,"Es wird bemerkt, dass die Marketing-Plattform häufig Ausfälle erlebt, was die Umsetzung von Kampagnen und die Kommunikation mit Kunden stört. Es ist möglich, dass die neuesten Systemupdates die Ursache sind. Ich habe versucht, das System neu zu starten und die Caches zu leeren, aber das Problem behält seinen Ursprung. Ich benötige Unterstützung, um das Problem schnell zu beheben und den Einfluss auf die Geschäftstätigkeit zu minimieren.","Sehr geehrte [Name], ich möchte Ihnen bestätigen, dass ich Ihren Bericht über Systemfehler bei der Marketing-Plattform erhalten habe. Ich erkenne an, dass häufige Ausfälle die Umsetzung von Kampagnen und die Kommunikation mit Kunden stören. Es ist möglich, dass die neuesten Systemupdates die Ursache sind. Ich schätze, dass Sie bereits versucht haben, das System neu zu starten und die Caches zu leeren. Ich möchte Ihnen helfen, das Problem schnell zu beheben und den Einfluss auf die Geschäftstätigkeit zu minimieren. Bitte geben Sie mir mehr Informationen zu den Fehlermeldungen, damit ich Ihnen besser helfen kann.",Incident,Technical Support,high,de,400,Outage,Disruption,Performance,IT,Tech Support,,,
,"Greetings, would it be possible to provide guidance on optimizing investment strategies through the use of data analytics products? Thank you.","We can help optimize investment strategies using data analytics products. To proceed, we would like to schedule a call to discuss your specific needs. I am available for a call at your convenience; please let me know a suitable time to reach you at <tel_num>.",Request,Returns and Exchanges,high,en,400,Feedback,Product,Feature,Sales,,,,
Reported Login Failures During Peak Hours,"Hello Customer Support, we are facing sudden login failures predominantly during peak usage hours. This might be due to server overload or issues with session handling. We have attempted to restart the server and clear the cache, but the problem still persists. The issue started yesterday and recurs every hour. Our team has tried troubleshooting, but we need your assistance to resolve it. Could you please investigate the matter and provide a solution at your earliest convenience? We appreciate prompt attention to this matter and look forward to your response.",We will investigate the login failure issue. Please provide your account number and a good time to call at <tel_num> for further discussion. Our technical team will work on resolving the issue as soon as possible.,Incident,Customer Service,high,en,400,Login,Performance,Outage,IT,Tech Support,,,
Betreff: Meldung über Absturz der Projektmanagement-Software,"Sehr geehrte Kundensupport, ich melde einen Fehler in der Projektmanagement-Software. Das Programm brach während einer Team-Kollaborations-Sitzung ab und könnte auf mangelnde Serverressourcen zurückzuführen sein. Ich habe versucht, die Anwendung neu zu starten und Systemeinstellungen zu optimieren, aber das Problem behält sich trotzdem bestehen. Der Crash verursacht signifikante Verzögerungen in unserem wichtigen Projekt. Ich schätze es, wenn Sie das Problem schnell behandeln und eine Lösung anbieten können. Bitte teilen Sie mich mit, wenn Sie weitere Informationen benötigen, um das Problem zu lösen.","Sehr geehrte [Name], entschuldigen Sie die Unannehmlichkeiten, die durch den Absturz der Projektmanagement-Software verursacht wurden. Wir möchten Ihnen helfen, das Problem zu lösen. Könnten Sie bitte mehr Details zur Fehlermeldung und den optimierten Systemeinstellungen bereitstellen? Um weitere Informationen zu erhalten, mögen Sie vielleicht eine Anfrage stellen. Teilen Sie mir bitte ein geeignetes Zeitfenster mit, wann Sie kontaktiert werden können, [Telefonnummer].",Incident,Human Resources,medium,de,400,Crash,Performance,Network,IT,Tech Support,,,
Seeking Guidance on Securing Medical Data Using PyTorch in a Hospital Setting via Microsoft Teams,Need advice on securing medical data using PyTorch in a hospital setting through Microsoft Teams. Ensure the confidentiality and integrity of patient data.,Provide guidance on securing medical data using PyTorch in a hospital setting via Microsoft Teams. Ensure the confidentiality and integrity of patient data. Please provide details about your current setup for better assistance.,Request,Product Support,low,en,400,Security,Documentation,IT,Tech Support,,,,
Incident of Unauthorized Access to Patient Billing Records,"There was an incident involving unauthorized access to patient billing records. Passwords have been reset, security protocols have been updated, and a malware scan has been conducted.","Dear [name], we appreciate you bringing to our attention the incident of unauthorized access to patient billing records. We are glad to hear that immediate actions have been taken, including resetting passwords, updating security protocols, and conducting a malware scan. We would like to request more information about the incident, such as the date and time it occurred, to help investigate and prevent future incidents. It would be convenient to discuss this further over the phone. Please call us at [tel_num] for a scheduled call to gather more details and provide any additional support needed.",Incident,Billing and Payments,medium,en,400,Security,Bug,Virus,Performance,IT,Tech Support,,
Support for PostgreSQL 13,Inquiry about Utilizing PostgreSQL 13 for Data Analysis and Investment Optimization. Interested in learning about the advantages and best practices for using a Database Management System for data analysis and investment optimization. Which key features and tools should be considered? Can you share specific application examples and case studies?,"Response regarding the Utilization of PostgreSQL 13 for Data Analysis and Investment Optimization. Key features include advanced data types and indexes. Detailed insights into best practices are available. Please schedule a call to discuss your specific needs, and we can review relevant application examples and case studies at a convenient time.",Request,Human Resources,low,de,400,Feature,IT,Tech Support,,,,,
