subject,body,answer,type,queue,priority,language,version,tag_1,tag_2,tag_3,tag_4,tag_5,tag_6,tag_7,tag_8
Inquiry About Benefits of Digital Strategy Services for Brand Growth,Is it possible to receive information on how digital strategy services can benefit brand growth?,"Digital strategy services are crafted to assist businesses in growing and thriving online. We offer a range of services, including social media management, content creation, and search engine optimization. Our team of experts works to develop a customized strategy that meets the unique needs and goals of each client. I would be happy to schedule a call to discuss how these services can benefit your brand's growth. I am available at your convenience, so please let me know a suitable time for the call.",Request,Technical Support,low,en,400,Feedback,Sales,IT,Tech Support,,,,
Strategies for Promoting Gaming PCs Software Subscriptions Digitally,"Hello Customer Support, I am inquiring about digital strategies to promote products like Gaming PCs and software subscriptions. Could you provide an approach on how to market these items online? I am particularly interested in learning about social media campaigns, email marketing efforts, and tactics used to reach the target audience. Additionally, I would appreciate any insights on how to share and measure the success of these strategies based on the data collected. Thank you for your time and assistance.","Hello, we appreciate your interest in digital strategies for promoting Gaming PCs software subscriptions. An approach to marketing these items online involves a multi-channel strategy, including social media campaigns, email marketing efforts, and targeted online advertising. We utilize platforms such as Facebook, Twitter, and Instagram to reach the target audience. Our email marketing efforts focus on newsletters, promotions, and new product releases. We also leverage influencer partnerships and content marketing to enhance our reach.",Request,Billing and Payments,high,en,400,Feedback,Product,Feature,Sales,IT,Tech Support,,
,"geehrte Kundenservice, ich schreibe Ihnen, um Informationen zur Erweiterung der Sicherheitslösung für den Zugriff auf medizinische Daten und Kommunikationssysteme, die betroffene Produkte und Dienstleistungen betreffen. Es ist entscheidend, die Vertraulichkeit und Integrität sensibler medizinischer Informationen sicherzustellen. Ich möchte wissen, welche Maßnahmen für die Behandlung der Probleme ergreifen werden und wann diese Maßnahmen umgesetzt werden können. Ich schätze Ihre Aufmerksamkeit zu diesem Thema und freue mich auf eine baldige Rückmeldung. Bitte lassen Sie mich wissen, falls zusätzliche Informationen benötigt werden, um den Prozess zu beschleunigen.","geehrte <name>, danke, ich wende mich in Bezug auf die Umsetzung der erweiterten Sicherheitslösung für den Zugriff auf medizinische Daten und Kommunikationssysteme. Wir nehmen die Vertraulichkeit und Integrität sensibler medizinischer Informationen ernst. Wir überprüfen derzeit die Sicherheitsprotokolle und werden Maßnahmen zur Behandlung der Probleme ergreifen. Um Ihre spezifischen Bedenken besser zu verstehen, könnten Sie bitte mehr Informationen über die betroffenen Produkte und Dienstleistungen geben. Wir sind bereit, eine Verbindung unter <tel_num> herzustellen, um das Thema zu besprechen.",Change,IT Support,high,de,400,Security,IT,Tech Support,Performance,,,,
,"Dear customer support, we are experiencing a critical system error while accessing data analytics tools from multiple devices, which might be due to recent software updates causing compatibility issues. We have already attempted to reinstall the affected applications and checked the network connectivity, but the issue still persists. We urgently need your assistance to resolve this matter. We would greatly appreciate it if you could provide a prompt solution and guide us through the necessary troubleshooting steps to restore the functionality.",We are reviewing the critical system error issue. Please provide the exact error message and details of the affected devices to guide us in the troubleshooting steps. We will schedule a call at your convenience to resolve the matter promptly.,Incident,Technical Support,high,en,400,Bug,Network,Performance,IT,Tech Support,,,
Problem with Digital Marketing Tools Invoicing,observed unforeseen charges in the invoice. Kindly help in addressing this matter.,"will assist with the issue related to unexpected charges in digital marketing tools invoicing. To better understand the issue, could you please provide details of the charges? I will investigate the matter and contact you at a suitable time to discuss further. Please let me know a convenient time to call at <tel_num>.",Problem,Billing and Payments,medium,en,400,Billing,Payment,Refund,Feedback,,,,
Unterstützung bei der Abwehr von Niedergang bei Marketing-Agenturen,"Unsere Marke erlitt einen Niedergang in den Markeinspannungen. Wir möchten Ihnen helfen, dieses Problem besser zu verstehen. Bitte teilen Sie uns mehr Informationen zur Verfügung, insbesondere spezifische Metriken, bei welchem Zeitraum sie abgenommen haben, und was in den letzten Zeiten an Marketingstrategien geändert wurde. Wir freuen uns darauf, mögliche Lösungen zu besprechen und zur Telefonbesprechung Zeit zu finden, um den genauen Sachverhalt zu klären.","Geehrte [name], tut uns leid, dass Marketing-Agenturen einen Niedergang in den Markeinspannungen erlebt haben. Um Ihnen besser zu helfen, möchten wir mehr Informationen von Ihnen erhalten, insbesondere spezifische Metriken, abgenommen haben, Zeitraum, geschehen ist. Haben Sie in den letzten Zeiten an Ihrer Marketingstrategie geändert? Wir freuen uns darauf, mögliche Lösungen zu besprechen und eine Telefonbesprechung zu vereinbaren, um den Sachverhalt genauer zu klären.",Incident,Returns and Exchanges,medium,de,400,Feedback,Performance,Documentation,IT,,,,
Enhancing Brand Growth with Digital Strategies,Is it possible to get details on how digital strategies can effectively boost brand growth?,"Dear [Name], thank you for your interest in digital strategies for brand growth. We offer customized solutions to enhance your online presence and engagement. I would be happy to discuss this with you further. I am available for a call at your convenience to explore strategies that can benefit your brand. Let's discuss the information via email as well.",Request,Customer Service,high,en,400,Feedback,Sales,Feature,,,,,
,"Customer service, address issue, health service providers were exposed to unauthorized access of medical data due to weak security settings on Ubuntu systems. Outdated software potentially contributed to the misaligned IT protocols. Provider is working to secure the data, updating Ubuntu settings and training personnel on data protection.","Please review the request regarding unauthorized access to medical data due to weak security settings on Ubuntu systems. To better assist, I would like to discuss the matter over the phone. Could you please provide a convenient time window for a call at <tel_num>, to discuss the next steps and ensure data security for future incidents?",Problem,Returns and Exchanges,medium,de,400,Security,IT,Tech Support,Performance,Training,,,
Subscription Fee Concern,"The customer was charged a higher fee in the current month due to a plan change. After verifying account details and attempting to contact support, they received a response. They require assistance with the unexpected charge and request help in resolving the issue promptly.",We are reviewing the unexpected subscription fee charge and will look into the matter. Please allow us to investigate and contact us at <tel_num> to discuss and provide a resolution.,Incident,Billing and Payments,low,en,400,Billing,Account,Refund,Performance,Feedback,Tech Support,,
Investigation into Drops in Investment Returns,"Noted a sudden decrease in investment returns. This could be due to outdated data sets or flawed analytics models. So far, data sources have been reviewed and models recalibrated, but returns are still below optimal levels. Assistance in resolving this is greatly appreciated.","Would be happy to help with the issue of investment returns. To better understand the problem, could you please provide details on the data sources and analytics models that have been reviewed? Additionally, knowing your account number and contact information would be helpful as we look further into this, and I would be available to discuss next steps by phone if that is more convenient.",Problem,Returns and Exchanges,medium,en,400,Bug,Performance,Documentation,Feedback,,,,
Mitteilung über Datenverlust-Ereignis,"Ein Datenverlust-Ereignis ist aufgetreten, möglicherweise wurden sensiblen medizinischen Datenmaterialien ausgesetzt durch einen Phishing-Angriff aufgrund veralteter Sicherheitsprotokolle. Die Antivirus-Software wurde aktualisiert und Mitarbeiter wurden über digitale Bedrohungen informiert, um die Sicherheit der Daten zu verbessern.","Sehr geehrte/r [Name], danke für Ihren Bericht über das Datenverlust-Ereignis. Ich schätze Ihre Bemühungen, indem Sie die Antivirus-Software aktualisiert und Mitarbeiter über digitale Bedrohungen informiert haben. Ich würde gerne den Vorfall genauer besprechen. Könnten Sie bitte ein Gespräch vereinbaren und mir mitteilen, wie der Verlust-Ereignis bereits mit Maßnahmen beantwortet wurde? Bitte geben Sie mir ein geeignetes Zeitfenster an, [Telefonnummer]. Vielen Dank.",Incident,IT Support,high,de,400,Security,Virus,Performance,IT,Tech Support,,,
Support for Dropping Engagement Rates in Marketing Campaigns,"Noted the decrease in engagement rates for recent marketing campaigns, which may be attributed to recent algorithm changes on social media platforms. Despite testing various ad formats and adjusting targeting parameters to enhance performance, the results have not been satisfactory. The team is closely monitoring the situation and seeks guidance on adapting the strategy to new algorithms. We would appreciate any recommendations or suggestions that could assist in improving the campaign's performance and increasing engagement.","Understand the concern regarding the drop in engagement rates for marketing campaigns due to recent algorithm changes on social media platforms. Would be happy to assist in adapting the strategy to new algorithms. To better understand the current situation, could you please provide details on the current campaigns, including the specific social media platforms and ad formats being used. This will enable us to provide tailored recommendations to improve campaign performance and increase engagement rates. We can schedule a call to discuss further.",Problem,Service Outages and Maintenance,medium,en,400,Feedback,Performance,IT,Tech Support,,,,
,"Dear Customer Support, I am reporting a network connectivity issue that has disrupted access to our essential digital tools, which are crucial for our brand's growth strategies. The problem may have arisen from a recent firmware update on the Aruba 2530 switch. I have already tried rebooting the switch and verifying the connections, but the issue still persists. I would greatly appreciate it if you could look into this matter and provide a solution at your earliest convenience. Please let me know if you need any additional information from me. Thank you for your time and assistance.","Dear [name], thank you for reporting the network connectivity issue. We apologize for the disruption to your digital tools. We are investigating the issue, which may have been caused by a recent firmware update on the Aruba 2530 switch. To assist further, could you please provide the switch's serial number and the exact error message you are seeing? If we need more information, we will schedule a call to discuss the issue in detail. Please let me know a convenient time for you to call at [tel_num]. We will work to resolve the issue as soon as possible.",Incident,Technical Support,medium,en,400,Network,Performance,IT,Tech Support,,,,
IT-System-Sicherheitsfragen,"Es wurde ein autorisierter Zugriff auf das Spitälfachsystem festgestellt. Umgehende Maßnahmen wurden ergriffen, jedoch bestehen weiterhin Bedenken hinsichtlich der Datensicherheit.","Wir nehmen diese Angelegenheit ernst und werden sie sofort untersuchen. Bitte geben Sie zusätzliche Informationen an, um eine Lösung zu finden.",Incident,Technical Support,high,de,400,Security,IT,Tech Support,Alert,,,,
Concern about Hospital System Potential Data Breach,There is a detected potential data breach in the hospital system caused by unauthorized access.,We take this potential data breach very seriously and are ready to assist. Please provide details on the unauthorized access. We request a call at your earliest convenience to discuss this matter.,Problem,IT Support,high,en,400,Security,IT,Tech Support,,,,,
H2O AI Support,"Requesting information regarding the compatibility of H2O.ai with PHP 8.0 for SaaS integration. Could you provide details on any known issues or limitations? Since we plan to integrate H2O.ai into our SaaS application, we want to ensure a seamless experience for our users. Any guidance or documentation you can provide would be greatly appreciated. Thank you for your assistance.","I'm glad to assist with your inquiry regarding H2O.ai compatibility with PHP 8.0 for SaaS integration. The system supports PHP 8.0 without major issues. However, to confirm full compatibility and identify any potential limitations, it would be helpful to review your specific use case. Please provide details on your planned integration of H2O.ai products and the expected workflow. This will allow me to provide tailored guidance and relevant documentation. I look forward to discussing this further.",Request,Technical Support,medium,en,400,Feature,Documentation,Feedback,Tech Support,,,,
Änderung der Rechnungsadresse für das digitale Werkstättenabonnement,"Ich möchte bitten, die Rechnungsadresse für mein digitales Werkstättenabonnement zu aktualisieren. Dies ist von entscheidender Bedeutung und beeinflusst auch Markenwachstumsstrategien und Marketinginitiativen. Es ist wichtig, dass die Rechnungsadresse stets aktuell ist, um jegliche Störungen unserer Dienstleistungen zu vermeiden. Könnten Sie die Aktualisierung bitte unterstützen? Ich habe die notwendigen Dokumente angehängt. Bitte teilen Sie mich mit, falls weitere Informationen erforderlich sind. Ich schätze eine schnelle Bearbeitung dieser Angelegenheit und freue mich auf Ihre Rückmeldung.","Ihre Anfrage zur Aktualisierung der Rechnungsadresse für das digitale Werkstättenabonnement haben wir erhalten. Wir haben die angeschickten Dokumente durchgesehen und werden die Aktualisierung entsprechend verarbeiten. Falls weitere Informationen erforderlich sind, werden wir Sie kontaktieren. Bitte warten Sie 24-48 Stunden, bis die Aktualisierung abgeschlossen ist. Sie werden eine Bestätigungsemail erhalten, sobald die Aktualisierung erfolgreich war.",Change,Billing and Payments,low,de,400,Billing,Maintenance,Disruption,Document,Feedback,,,
Request for Support During Service Outage,Currently facing service outage issues with medical data systems,Initiating investigation into the problem,Incident,Service Outages and Maintenance,medium,en,400,Outage,Disruption,IT,Tech Support,,,,
Enhancing Security Protocols for Healthcare Data,"We are addressing your concerns about enhancing security measures for healthcare data in hospital systems to protect sensitive information across all affected products. This involves implementing robust firewalls, encrypting sensitive data, and ensuring compliance with regulatory requirements. Regular security audits and updates are essential to prevent data breaches and guarantee the confidentiality, integrity, and availability of healthcare data.","Thank you for your email regarding the enhancement of security protocols for healthcare data in hospital systems. We understand the importance of protecting sensitive information and ensuring compliance with regulatory requirements. We are taking immediate action to implement robust firewalls and encrypt sensitive data across all affected products. Our team will conduct regular security audits and updates to prevent data breaches and ensure the confidentiality, integrity, and availability of healthcare data. We would like to schedule a meeting to discuss this further.",Change,Customer Service,medium,en,400,Security,Compliance,IT,Tech Support,Performance,,,
Failure of Investment Tool,The investment analytics tool encountered problems processing data inputs due to software compatibility issues. Restarting the tool and re-importing the data were not successful.,"Dear [Name], we apologize for the issue with the investment analytics tool. We are investigating the software compatibility issues. Please provide your operating system and tool version for further assistance. We need to schedule a call at your convenience at [Tel Num] to resolve this issue as soon as possible. Please let us know a convenient time for the call regarding account [Acc Num].",Incident,Product Support,medium,en,400,Bug,Performance,IT,Tech Support,,,,
Support for Google Nest Wifi Integration,Looking for assistance with integrating Google Nest Wifi Router into a project management SaaS. Could you please provide guidance on this? Thank you!,"Thank you for reaching out to our service desk regarding the integration of Google Nest Wifi Router into a project management SaaS. We would be happy to provide guidance on this matter, but we need more information about your current setup. Could you please provide us with the necessary details so we can achieve the integration? It would be convenient to schedule a call at <tel_num> to discuss and get you the necessary information to assist you accordingly. Your account number is <acc_num>.",Request,Returns and Exchanges,low,en,400,IT,Tech Support,Feedback,Feature,,,,
Securing Medical Data in Hospital Settings,Request detailed solutions,"Provide comprehensive solutions for securing medical data in hospital environments, including encryption, access controls, and regular security audits. Our solutions are designed to meet industry standards and protect patient confidentiality. I would like to discuss these with you and am available to call at your convenience to explore solutions that meet your specific needs.",Request,Sales and Pre-Sales,medium,en,400,Security,Documentation,IT,Tech Support,,,,
Assistance with Marketing,"The Marketing Team has observed a decline in participation metrics for the last month. This suggests ineffective campaigns and misaligned target groups. We recommend reviewing current strategies, adjusting the content, and striving for success. Assistance is needed to analyze the situation and find solutions to improve brand engagement.",Review the case at <tel_num> to further discuss and find a solution.,Incident,Human Resources,low,de,400,Feedback,Sales,Marketing,Performance,,,,
System Absturz - Hilfe erforderlich,"Sehr geehrte Kundenservice-Teams,<br>Wir erleben einen Systemabsturz bei unserer Projektmanagement-Software-as-a-Service, insbesondere die Benutzerzugriffsfunktionen sind beeinträchtigt.<br>Das Problem scheint mit Kompatibilitätsproblemen zu Node.js 14.17 und neueren Updates der integrierten Werkzeuge in Verbindung zu stehen.<br>Obwohl wir versucht haben, den Server neu zu starten und die Updates zu rückgängig zu machen, besteht das Problem weiterhin.<br>Wir benötigen dringend Ihre Unterstützung, um das Problem zu beheben und die vollständige Funktionalität des Systems wiederherzustellen.<br>Bitte geben Sie uns eine schnelle Lösung und leiten Sie die notwendigen Schritte zur Lösung des Problems ein.<br>Wir danken Ihnen für Ihre dringende Beachtung des Problems.","Das Problem zu erläutern, rufen Sie uns unter <tel_num>. Diskutieren Sie die weitere Schritt-für-Schritt-Anleitung und mögliche Lösungen für den Systemabsturz bei der Projektmanagement-Software-as-a-Service.",Incident,Technical Support,high,de,400,Bug,Crash,Network,Performance,IT,Tech Support,,
Support Request for Customer Service,"The Marketing--Agents-Campaign-Analytik-Dashboard is displaying data. This issue might be related to a recent system update. I have tried refreshing the page and clearing the browser cache. We would appreciate your help in quickly resolving this issue. If you could provide us with suggestions or help debug and fix the problem, that would be great. Thank you for your time and support.","We are dealing with the issue of the Marketing--Agents-Campaign-Analytik-Dashboards, which is showing data. For further debugging, please provide the exact error message and a screenshot of the problem. Additionally, please confirm the browser and operating system you are using. It may be necessary to arrange a call to discuss the issue in more detail. Please provide a suitable time window for contact at <tel_num> if you prefer to continue communication via email. We will provide you with guidelines for debugging and fixing the problem shortly.",Incident,Technical Support,medium,de,400,Tech Support,Performance,Feedback,,,,,
Support Request for Eclipse IDE Crashes,"Facing frequent crashes with Eclipse IDE 2021-06 while processing large datasets for analysis. This might be due to insufficient memory allocation or conflicts with installed software. Despite increasing memory settings and reinstalling Eclipse, the issue still persists. I would appreciate any guidance to resolve this issue. Configuration changes or software updates could help stabilize the IDE. Please let us know if there's any additional information needed to better assist.","In response to your support request regarding frequent crashes with Eclipse IDE 2021-06. We understand that increasing memory settings and reinstalling Eclipse did not resolve the issue. To better assist you, could you please provide more information about your system configuration and the specific datasets you are processing? Additionally, knowing the exact error message you receive from Eclipse would be very helpful.",Problem,Technical Support,high,en,400,Bug,Crash,Performance,IT,Tech Support,,,
Issue with Software Updates,"Project management software is failing on multiple devices. Tried uninstalling the software and updating drivers, but the problem persists. Compatibility issues with conflicting drivers are suspected.","Dear [name],\n\nWe apologize for the issues you are experiencing with updates to our project management software. I understand that you have attempted to uninstall the software and update the drivers, but the problem still exists. I would like to investigate further to determine if the issue is due to compatibility problems or conflicting drivers. Could you please provide more details about the devices you are using and the operating systems they run? Additionally, it would be helpful to know which version of the software you are currently using. Please also provide your account number [acc_num] so we can assist you better.",Problem,Technical Support,medium,de,400,Bug,Performance,IT,Tech Support,,,,
Digital Marketing Campaigns Have Come to a Halt,"Our digital marketing campaigns are not yielding the expected results. Despite attempts to refine ad optimization and content, the outcomes are still unsatisfactory. We urgently need assistance in refining our targeting strategy.","We can assist in reviving your digital marketing efforts. To provide more effective guidance, could you please share more details about your current campaign, such as the target audience and specific goals? Additionally, it would be beneficial to know the exact metrics that indicate the underwhelming performance. Based on this information, we can offer tailored advice to enhance your results. For a more detailed discussion, please let us know a convenient time to call at <tel_num>.",Problem,Product Support,medium,en,400,Feedback,Performance,Feature,IT,Tech Support,,,
Issue with Financial Analysis Tool,The Financial Analysis Tool is producing disconnected forecasts due to outdated data processing methods. Attempts to update data and review parameters have not resolved the issue.,"We will handle the issue with the Financial Analysis Tool via email, which provides disconnected forecasts. To better assist, please provide more details on the outdated data processing and the reviewed parameters. We are available to discuss a solution over the phone at your convenience. Please provide an appropriate time to call: <tel_num>. ",Problem,Technical Support,medium,de,400,Bug,Performance,Feature,Documentation,,,,
Sicherung medizinischer Daten und Verbesserung der IT-Infrastruktur,"Geliebter Kundensupport, ich bitte um Hilfe bei der Sicherung medizinischer Daten und der Verbesserung der IT-Infrastruktur. Es ist wichtig, die Vertraulichkeit, Integrität und Verfügbarkeit sensibler medizinischer Informationen zu gewährleisten. Ich schätze Rat und Anleitungen, um die IT-Infrastruktur zu verbessern und den erforderlichen Standards gerecht zu werden. Bitte informieren Sie mich, falls weitere Informationen notwendig sind. Danke für Ihre Unterstützung. Ich freue mich darauf, von Ihnen zu hören.","Geliebter [Name], ich werde Ihnen helfen, die Sicherung medizinischer Daten und die Verbesserung der IT-Infrastruktur zu verbessern. Um die aktuellen Probleme besser zu verstehen, bitten wir Sie, uns mehr Details zu den betreffenden Problemen zu geben. Bitte rufen Sie mich unter [Telefonnummer] an, um eine weitere Diskussion und Empfehlungen zur Verbesserung der IT-Infrastruktur durchzuführen.",Change,Customer Service,high,de,400,Backup,Security,IT,Tech Support,Performance,Documentation,,
