subject,body,answer,type,queue,priority,language,version,tag_1,tag_2,tag_3,tag_4,tag_5,tag_6,tag_7,tag_8
Required Solutions for Safeguarding Medical Data,"I am inquiring about security solutions for protecting medical data in hospital settings through Customer Support. Could you provide details on the types of security measures and information on encryption and access controls? I would greatly appreciate any case studies, whitepapers, or related materials on this topic. Additionally, could you inform me about the compliance certifications these solutions have, specifically HIPAA? Please let me know if there are any webinars or demos available to learn more about these solutions. I look forward to your response.",Please contact <tel_num> to discuss medical data security solutions and to receive the requested information.,Request,Sales and Pre-Sales,low,en,400,Security,Documentation,IT,Tech Support,,,,
Potential Security Breach: Unauthorized Access to Sensitive Data,"Dear Customer Support, <br>We are writing to inform you about a potential security breach in our hospital systems. The security team has detected an unauthorized access attempt to sensitive medical data. <br>The incident is suspected to be due to inadequate security configurations and outdated software. <br>We have initiated a system-wide security audit to update the affected software and prevent future incidents. <br>We would appreciate your assistance in providing recommendations to enhance our security measures. <br>Please","Please take security breaches seriously and assist us. To better understand the incident, could you please provide details of the detected unauthorized access attempt, including the date and time it occurred. Your review of this information will help us provide recommendations to enhance our security measures.",Incident,IT Support,medium,en,400,Security,Incident,Alert,IT,,,,
Optimize Data Analytics Retrofits,Enhance data analytics tools for better investment retrofits and reporting processes.,Review and optimize data analytics tools to ensure improved investment retrofits and reporting processes.,Change,Returns and Exchanges,low,de,400,Performance,Product,Feature,Feedback,,,,
Issue with Google Cloud Platform,Currently experienced downtime involves a server maintenance-scaling process. Restarting and scaling the server to fix the errors.,We will investigate the issue with Google Cloud Platform. Please provide your account and contact details so we can assist further.,Problem,Service Outages and Maintenance,high,de,400,Outage,Maintenance,Performance,IT,Tech Support,,,
Niedrige Beteiligungsraten in Digitalen Marketingkampagnen,"Wir beobachten niedrige Beteiligung und Konvertierungsrate für unsere digitalen Marketingkampagnen. Veraltete Strategien und unefektive Ziele könnten die Ursache sein. Überprüfen Sie die E-Mail-Beschluss, um die Situation besser zu verstehen. Möchten Sie die aktuellen Strategien und Ziele besprechen? Wir könnten zusätzliche Details zu den bislang vorgenommenen Anpassungen bereitstellen. Rufen Sie uns unter <tel_num> an, um eine Besprechung zu vereinbaren und mögliche Lösungen zu erörtern.","Überprüfen Sie die E-Mail-Beschluss bezüglich der niedrigen Beteiligungsraten in unseren digitalen Marketingkampagnen. Es wäre hilfreich, die aktuellen Strategien und Ziele besser zu verstehen. Könnten Sie mehr Details zu den bislang vorgenommenen Anpassungen bereitstellen? Rufen Sie uns unter <tel_num> an, um eine Besprechung zu vereinbaren und mögliche Lösungen zu erörtern.",Incident,Product Support,high,de,400,Feedback,Feature,Documentation,,,,,
Urgent Case of Hospital Data Breach Reported,Data breach identified in hospital systems,Investigate the data breach issue and furnish details on the assistance provided for the reported incident in the hospital systems,Incident,Returns and Exchanges,high,en,400,Security,Outage,IT,Tech Support,,,,
Serious Malfunction in Data Analytics Tool Noted,"Customer Support, reporting critical malfunction in one of the data analytics tools, which has disrupted the investment optimization processes. Possible causes of the issue may include software incompatibility or recent updates. Attempts to restart the applications or reinstall updates have been unsuccessful. We would greatly appreciate your assistance in resolving this issue as soon as possible. Please let us know if you require any additional information to facilitate the troubleshooting process. Thank you for your attention.","<name>, thank you for reaching out about the critical malfunction in the data analytics tool. We are sorry to hear that it has disrupted your investment optimization processes. We understand the urgency of this matter and are here to assist as soon as possible. To better understand the issue and facilitate the troubleshooting process, could you please provide us with the error messages and the exact steps you have taken so far? Additionally, it would be helpful if you could provide us with your account number and the version of the software.",Incident,Technical Support,high,en,400,Bug,Performance,IT,Tech Support,Maintenance,,,
Request for Enhancement of Data Analytics Tools,"Dear Customer Support, I am writing to request enhancements to the data analytics tools currently used across our software and hardware products. The current tools have limited capability to provide real-time insights, which hinders our ability to optimize investments and reporting. I believe that upgrading these tools will allow us to make more informed decisions, thereby improving our overall performance. The affected products include our flagship software and several hardware devices. I would greatly appreciate it if you could look into this matter and provide a solution at your earliest convenience. Thank you.",Thank you for your request to enhance the data analytics tools. We have received your request and will review it. Please provide any additional information needed so we can proceed with a solution.,Change,Technical Support,medium,en,400,Feature,Product,Feedback,,,,,
Query for Data Analytics Services,"Would like to seek information on data analytics services aimed at optimizing investment strategies, as it would greatly assist us in making informed decisions to maximize returns. We are very interested in learning about your area of expertise and would appreciate your assistance. We look forward to hearing back from you soon.","Dear [Name], thank you for reaching out to our service desk regarding data analytics services that optimize investment strategies. We appreciate your interest and would be happy to provide you with the necessary information. Our data analytics services utilize advanced tools and techniques to analyze market trends and provide actionable insights to inform investment decisions. To better understand your specific needs, could you please provide us with more details on your current investment strategies and goals?",Request,Customer Service,medium,en,400,Feedback,Sales,IT,Tech Support,,,,
Unterstützung für Investitionsanalyse mit DataRobot,"Sehr geehrte Kundenservice, ich schreibe an, um nachzufragen, wie DataRobot die Investitionsanalyse verbessern kann. Könnten mehr Informationen, Funktionen und Werkzeuge von DataRobot zur Unterstützung der Investitionsanalyse bereitgestellt werden? Ich suchte nach Verbesserungen unserer Portfolio-Risikomanagement-Fähigkeiten und glaube, dass die maschinellen Lernfunktionen und die Automatisierung von DataRobot einen wertvollen Vorteil darstellen könnten. Ich freue mich auf jegliche Informationen, die mir helfen, mein Ziel zu erreichen. Vielen Dank für Ihre Zeit und Hilfe. Ich freue mich auf eine baldige Rückmeldung.","Wir können Ihnen Informationen zu den Funktionen und Werkzeugen von DataRobot im Bereich Investitionsanalyse geben, einschließlich der maschinellen Lernfunktionen und der Automatisierung. Sollten eine Telefonkonferenz zur weiteren Diskussion verfügbar sein, können wir eine am <tel_num> buchen.",Request,Customer Service,medium,de,400,Feedback,Feature,Documentation,IT,Tech Support,,,
Request for Support Concerning Performance Tracking,"There are irregularities observed in the performance tracking analytics system, which might be related to recent updates in the data analytics tools.",Please investigate the analytics system issues related to recent data analytics tools updates. Kindly provide details regarding the irregular performance tracking for further assistance.,Problem,Customer Service,medium,en,400,Performance,IT,Tech Support,Feedback,,,,
Inquiry About Available Data Analytics Tools for Investment Optimization,"I reached out to Customer Support to inquire about the data analytics tools that can help optimize investment strategies. Could you provide details on the types of tools available to assist in making informed investment decisions? I would greatly appreciate any information, including relevant resources and recommendations. Thank you for your assistance, and I look forward to hearing back soon. Please let me know if any additional information is needed.",We offer a variety of data analytics tools to optimize investment strategies. These tools provide insights and trends to help make informed decisions. We can discuss the available options and resources. Please let us know a suitable time to call at <tel_num> to provide you with the information and answer any questions you may have regarding the data analytics tools.,Request,IT Support,low,en,400,Feedback,Documentation,Tech Support,,,,,
,"I am facing connectivity issues with digital marketing tools that are integrated into our platform hardware. Recent software updates might be causing compatibility problems. Despite rebooting devices, verifying network settings, and reinstalling the software, the issues still persist. Customers who are having trouble need our help to resolve the matter. Please provide a solution and troubleshooting steps to address this issue.",Please review the issue and provide troubleshooting steps to solve the connectivity problems with the digital marketing tools and platform hardware. We will then investigate further to assist you.,Incident,Technical Support,high,en,400,Network,Hardware,Performance,Bug,Tech Support,,,
Details zur Nutzung von Google Cloud Platform für die Sicherung medizinischer Daten in Gesundheitsapplikationen,Könnten Sie detaillierte Informationen zur Nutzung von Google Cloud Platform zur Sicherung medizinischer Daten in Gesundheitsapplikationen liefern? Insbesondere benötige ich Informationen über die Einhaltung von Vorschriften und Sicherheitsmaßnahmen.,Google Cloud bietet Sicherheitsinformationen für Gesundheitsapplikationen zur Verfügung.,Request,Technical Support,low,de,400,Security,Backup,IT,Tech Support,,,,
Hilfe für Krankenhaus-IT-Systeme,Können Sie Daten zum Schutz medizinischer Informationen in Krankenhaus-IT-Systemen bereitstellen? Vorab danke für Ihre Unterstützung und Anleitungen zum Thema.,"Wir bieten eine Reihe von Lösungen für den Schutz medizinischer Daten in Krankenhaus-IT-Systemen, darunter Verschlüsselungs- und Zugriffssteuerungsprodukte. Bitte geben Sie gerne weitere Informationen, wenn Sie spezielle Anforderungen haben. Sie können sich gerne zu einem passenden Zeitpunkt bei uns kontaktieren, um eine angepasste Lösung für das IT-System Ihres Krankenhauses zu erhalten. Bitte teilen Sie mir den geeigneten Zeitpunkt für die Kontaktaufnahme mit.",Request,Billing and Payments,low,de,400,IT,Tech Support,Security,Documentation,Training,,,
,"Gehörte Kundenservice, ich schreibe an, um mehr über die Nutzung von Datenanalysewerkzeugen in IBM Cloud für die Optimierung von Investitionen zu erfahren. Gibt es detaillierte Informationen und Möglichkeiten, um diese Werkzeuge effektiv zu nutzen, um informierte Investitionsentscheidungen treffen zu können? Ich bin daran interessiert, verschiedene IBM Cloud-Analyswerkzeuge kennenzulernen, zu verstehen, wie sie verwendet werden können, um Marktentwicklungen zu analysieren, Investitionsausgänge vorherzusagen und potenzielle Chancen zu identifizieren. Eine Liste mit weiteren Anleitungen und Ressourcen wäre sehr geschätzt, um den Zusammenhang zwischen den Werkzeugen und deren Anwendung zu verstehen. Ich danke Ihnen für Ihre Unterstützung und freue mich auf Ihre Rückmeldung.","Wir bieten Informationen über Datenanalysewerkzeuge in IBM Cloud für die Optimierung von Investitionen. Unsere verschiedenen Werkzeuge unterstützen die Analyse von Marktentwicklungen, die Vorhersage von Ergebnissen und mehr. Gern besprechen wir, wie wir Ihnen bei der Erkundung der Möglichkeiten unserer Werkzeuge helfen können, um Ihre Investitionsentscheidungen zu unterstützen. Lassen Sie uns telefonisch in Kontakt treten, wenn dies für Sie passend ist, um relevante Ressourcen zu teilen.",Request,Billing and Payments,medium,de,400,Feedback,Product,Feature,Documentation,,,,
,"Customer Support, Last night, the agency faced connectivity issues with digital tools, which disrupted our brand growth strategies. The problem might have arisen due to a potential modem failure or network instability. We attempted to reset the modem and restart the devices, but to no avail. The issue continued, causing significant disruptions to our operations. We kindly request your assistance in resolving this matter as soon as possible. Please inform us of the necessary steps to restore normalcy.",Please contact us at <tel_num> to discuss the connectivity issue and we will guide you through the next steps to resolve the problem.,Incident,Technical Support,high,en,400,Network,Performance,Disruption,IT,Tech Support,,,
,"have noticed a sharp decline in website traffic, which is affecting the brand's online presence. this could be due to recent updates made to Drupal Commerce. steps taken such as clearing the site cache and testing different browser settings have not been successful. we would appreciate your assistance in resolving this issue.",ready to assist with the issue of sudden website traffic decline. kindly provide details on any recent updates made to Drupal Commerce and if any error messages are being observed. would be available to schedule a call at a convenient time to discuss and troubleshoot the issue related to your website. account number: <acc_num>.,Incident,Technical Support,low,en,400,Performance,Network,IT,Tech Support,Feedback,,,
Detected Unauthorized Access Attempt on Medical Data System,"An unauthorized access attempt was detected in the system, which was triggered by a phishing email. Initial security protocols have been activated and are effective.",Immediate actions are being taken to secure the system and prevent further unauthorized access. Please contact us at <tel_num> for assistance and to discuss additional security measures.,Incident,Customer Service,medium,en,400,Security,IT,Tech Support,Virus,,,,
Issue with Security Systems,"Unauthorized access attempts to medical data systems have been detected. This is due to outdated security protocols. So far, antivirus software has been updated and user rights reviewed. There is concern about potential breaches of sensitive information and a desire for comprehensive investigation and implementation of additional security measures in the future.",immediately investigate,Problem,Billing and Payments,medium,de,400,Security,Virus,Performance,IT,Tech Support,,,
Avid Pro Tools,"Avid Pro Tools scheitert beim Export von Audioprojekten auf meinem iMac, obwohl die Software aktualisiert ist. Ich habe auch das System neu gestartet.","Bitte überprüfen Sie das Problem mit Avid Pro Tools, das beim Betrieb des iMac zu Abstürzen führt. Wir möchten diskutieren, wie ein Kompatibilitätsproblem behoben werden kann. Bitte teilen Sie uns mehr Details zu Ihrer System- und Softwareversion mit. Wenn Sie dies lieber telefonisch tun möchten, rufen Sie bitte an <tel_num> unter Konto-Nr. <acc_num> für die Problemlösung.",Problem,Product Support,medium,de,400,Product,Feature,IT,Tech Support,,,,
Probleme bei der Synchronisation von Projektdaten auf verschiedenen Geräten,"Ich habe Probleme bei der Synchronisation von Projektdaten auf verschiedenen Geräten bemerkt. Die Netzwerkunstabilität und Softwarefehler könnten dahinterstecken. Ich habe versucht, die Geräte neu anzuschließen und den Cachepuffer zu leeren, aber das Problem behält sich trotzdem bestehen. Ich freue mich, wenn Sie mir helfen können, eine glatte Datenzugriffsmöglichkeit zu gewährleisten.","Um die Synchronisationsprobleme zu untersuchen, kontaktieren Sie uns telefonisch unter <tel_num>. Wir werden Ihnen weitere Unterstützung anbieten, um das Problem zu lösen.",Problem,Technical Support,medium,de,400,Bug,Network,Performance,IT,Tech Support,,,
Hilfe bei ActiveCampaign-Analyse,"Ich würde gerne mehr über ActiveCampaign-Datenanalyse erfahren und Optimierungsmöglichkeiten kennenlernen. Könnten Sie bitte mehr Informationen zum Thema geben? Ich freue mich, falls Sie Ratschläge und Ressourcen liefern können, die mir bei der Vertrautheit mit ActiveCampaign helfen. Vielen Dank für Ihre Unterstützung.","Können wir per Telefon Informationen zur Analysefähigkeiten und Optimierungsmaterialien zu ActiveCampaign besprechen, sobald es passt? Ein Anruf würde mich interessieren?",Request,Sales and Pre-Sales,low,de,400,Feedback,Documentation,Tech Support,,,,,
Problem with Smart Thermostat,"We are facing connectivity issues with the Smart Thermostat that we are using with Microsoft Azure. This might be due to recent network configuration changes or software updates. We have already restarted the devices and checked the firewall settings, but the issue still persists.","Thank you for reaching out to us regarding the issue with your Smart Thermostat. We apologize for the inconvenience you are experiencing with the Microsoft Azure connectivity. To further troubleshoot the problem, could you please provide us with details about the network configuration changes and the recent software updates mentioned? Additionally, we would like to know the exact error message you are seeing. If needed, we can schedule a call at <tel_num> to discuss the issue and find a solution that is convenient for you. Please let us know a time that works for you.",Problem,Technical Support,medium,en,400,Network,Performance,Bug,IT,Tech Support,,,
Details zur Nutzung von Datenanalyse und Anlageoptimierung,Könnten Sie uns mehr Informationen zur Nutzung von Datenanalyse und Anlageoptimierung sowie zu den verwandten Dienstleistungen geben?,"Wir können Ihnen Informationen zur Nutzung von Datenanalyse und Anlageoptimierung sowie zu den verwandten Dienstleistungen bereitstellen. Bitte geben Sie mehr Details zu Ihren spezifischen Anforderungen, um Ihnen besser zu helfen. Falls Sie dies benötigen, können Sie sich gerne telefonisch bei uns melden, um ein Gespräch zu vereinbaren.",Request,Customer Service,medium,de,400,Feature,Documentation,Feedback,,,,,
Request for Details on Sage Accounting Integration,"Dear Support Team, I am writing to inquire about the Sage Accounting SaaS platform integration. Could you provide more detailed information? It would be helpful if you could share the setup procedure, the benefits and features of using the Sage Accounting platform. Specifically, I am interested in the data synchronization process and any limitations of the offered support. Thank you for your time and support. I look forward to your prompt response.","Dear [Name], thank you for your email regarding the Sage Accounting integration platform. We are pleased to offer detailed information on the setup procedure and the benefits and features of using the platform. If you are available for a phone conference, please let us know a convenient time. You can reach us at number [Tel Number] for further details which can also be sent via email.",Request,Billing and Payments,low,de,400,Feature,Documentation,IT,Tech Support,,,,
Twitch Support Inquiry,Is it possible to gain insights into using Twitch Studio Beta for digital marketing strategies? I am interested in exploring new methods to reach my audience and would greatly appreciate some guidance and recommendations. I look forward to your assistance!,"I would be happy to assist you with leveraging Twitch Studio Beta for digital marketing strategies. To better understand your needs, could you please provide information on your current marketing goals and target audience? I will be able to offer tailored guidance and recommendations. Please let me know a convenient time to discuss this further over the phone at <tel_num>. I look forward to scheduling a call to explore this further.",Request,Technical Support,medium,en,400,Feedback,Sales,Tech Support,,,,,
Frage zur Digitalisierung und Markenentwicklung,"Sehr geehrte Kundenservice, ich habe eine Frage zu digitalen Strategien für Markenentwicklung und Produktverbesserungen. Könnten Sie Informationen zu den Dienstleistungen und deren Vorteilen für Unternehmen bereitstellen? Ich freue mich auf Einzelheiten zu unserem Ansatz bei digitalen Marketingstrategien, um die Online-Präsenz unserer Marke zu verbessern. Vielen Dank für Ihre Zeit und ich freue mich darauf, Ihre Antwort zu hören.","Sehr geehrte <name>, wir bieten eine Vielzahl von digitalen Strategien an, um Markenentwicklung zu verbessern, einschließlich Social-Media-Verwaltung und Suchmaschinenoptimierung. Unsere Dienstleistungen helfen, die Online-Präsenz zu erhöhen und Verkaufszuwächse zu erreichen. Ich wäre gerne bereit, mehr Informationen über die Vorteile unserer Dienstleistungen für Ihr Unternehmen zu besprechen. Bitte geben Sie ein günstiges Zeitfenster an, um telefonisch mehr über unsere Dienstleistungen zu erläutern. Vielen Dank.",Request,Customer Service,medium,de,400,Feedback,Feature,Documentation,Sales,IT,,,
Verbessern Datenanalyse-Fähigkeiten,"Ich beschreibe Verbesserungen unserer Datenanalyse-Fähigkeiten, Optimierung von Investitionen, Integrierung relevanter Werkzeuge, um bessere Einsichten und Entscheidungsfindung zu ermöglichen.","Sehr geehrte [Name], vielen Dank für Ihre Nachricht. Wir möchten uns bemühen, unsere Datenanalyse-Fähigkeiten zu verbessern, Investitionen in Google Cloud Platform zu optimieren und relevante Werkzeuge zur Integrierung zu nutzen, um bessere Einsichten und Entscheidungsfindung zu fördern. Um unsere Anstrengungen besser zu koordinieren, könnten Sie uns bitte mehr Informationen zu Ihren spezifischen Anforderungen zur Verbesserung geben und das aktuelle Setup beschreiben. Das ermöglicht es uns, eine maßgeschneiderte Lösung anzubieten. Wir freuen uns, eine weitere Diskussion zu dieser Angelegenheit telefonisch fortzusetzen, sobald es uns gelegen ist.",Change,Sales and Pre-Sales,medium,de,400,Feedback,Training,IT,,,,,
User Encountering Frequent Application Crashes While Accessing Project Management Tool,"Hello Customer Support, our users are frequently experiencing application crashes when using the project management tool. This issue might be due to compatibility problems with recent software updates. Despite our efforts to resolve the issue, such as reinstalling the application, clearing the cache, and updating dependencies, the problem continues to persist. We kindly request your assistance in identifying the root cause and providing a solution to ensure seamless functionality across all platforms.",Please investigate the issue and contact us at <tel_num> to discuss and find a solution.,Problem,IT Support,medium,en,400,Crash,Performance,IT,Tech Support,,,,
,"customer support, seeking to effectively leverage Microsoft Dynamics 365 for digital marketing strategies. Would greatly appreciate insights and information on the practices and tools available within the platform to enhance customer engagement and streamline marketing efforts. Any guidance or resources would be highly appreciated. Thank you for your assistance. Looking forward to hearing from you soon.","customer, thank you for reaching out to our support team. We would be happy to help with your inquiry regarding Microsoft Dynamics 365. To effectively utilize the platform for digital marketing strategies, I recommend exploring the customer engagement and marketing automation tools available. One practice is to set up personalized customer journeys and leverage analytics to track and measure the effectiveness of your marketing efforts. A range of resources is available, including webinars, tutorials, and user guides, which can provide you with in-depth information.",Request,Technical Support,high,en,400,Feedback,Sales,IT,Tech Support,,,,
Query on API Integration Features for Project Management,"Customer Support, we are inquiring about the API integration features and scaling options for project management services. We are interested in expanding our current system and would like to know about the capabilities of the API. Could you provide information on the types of integrations it offers, such as data synchronization and workflow automation? Additionally, we would like to know about any limitations or restrictions, such as the number of users and projects that can be managed through the API. We appreciate your time and look forward to hearing back with detailed information.","Dear [name], thank you for reaching out to our customer support team regarding your inquiry about API integration features and project management. We appreciate the opportunity to provide you with information that can support the expansion of your current system. The API offers a range of integration capabilities, including data synchronization and workflow automation, which can help streamline project management processes and improve efficiency. It supports integration with various third-party applications and services, allowing you to leverage the tools you already use.",Request,IT Support,high,en,400,Feature,Documentation,Feedback,IT,Tech Support,,,
