subject,body,answer,type,queue,priority,language,version,tag_1,tag_2,tag_3,tag_4,tag_5,tag_6,tag_7,tag_8
Hilfe bei Sicherheitslücken,"Es gab einen Unfall mit unbefugtem Zugang zu Sicherheitsmaßnahmen, die auf medizinische Daten abzielen. Die veralteten Sicherheitsprotokolle scheinen der Ursache zu sein, und obwohl wir versucht haben, die Daten zu sichern, indem wir verbesserte Passwortsicherheitsrichtlinien und Systeme-Updates implementiert haben, haben die Sicherheitslücken weiter bestanden. Wir benötigen dringend Ihre Unterstützung, um die Situation zu beheben und die Sicherheit unserer medizinischen Daten zu gewährleisten.","Sehr geehrte/r [Name],\n\nich antworte auf Ihre E-Mail in Bezug auf den Vorfall mit Sicherheitslücken, der medizinische Daten betroffen ist. Ich verstehe die Dringlichkeit dieser Situation und den Notwendigkeit, sie sofort zu beheben. Um Ihnen besser zu helfen, wäre es hilfreich, wenn Sie mir weitere Informationen zum Vorfall liefern könnten, insbesondere den Datum und die Uhrzeit des Vorfalls sowie eventuelle Fehlermeldungen. Ich freue mich auch auf Details zu den bisher umgesetzten verbesserten Passwortsicherheitsrichtlinien und Systeme-Updates. Bitte teilen Sie mir ein angemessenes Zeitfenster mit, bei dem ich Sie anrufen kann, um diese Angelegenheit zu besprechen. Im Moment empfehle ich Ihnen, [telefonnummer] anzurufen.\n\nMit freundlichen Grüßen,\n[Ihr Name]",Incident,Product Support,medium,de,400,Security,Bug,IT,Tech Support,Performance,Alert,,
Issue with Data Processing Device,The data processing device is generating inconsistent outputs. The latest software update might be the cause of the altered input data. Restarting the program and clearing the cache buffer did not resolve the issue. Please assist us in finding a quick solution to this problem.,"I will investigate the issue with the data processing device, which is producing inconsistent outputs. I would like to know more about the changes introduced by the latest software update. Could you please provide more details on the changes? It may be necessary to schedule a call to discuss and find a solution. Let me know when you are available for the call. I will then set up the connection to resolve the issue.",Problem,Technical Support,low,de,400,Bug,Performance,IT,Tech Support,,,,
Concern Regarding Delays in Analytical Reports,"Customer Support, currently experiencing delays in receiving analytical reports as per the report issue. This delay is affecting the investment decision-making process. Recently, there were software updates that altered data integration. Despite restarting the system and checking data pipelines, the issue remains unresolved. I would greatly appreciate it if you could look into this matter and provide a solution as soon as possible. The delay is causing significant inconvenience and impacting my ability to make informed decisions. Please provide further details on the software updates and data integration changes made recently, and confirm the exact timeframe of the delay. If possible, let's schedule a call to discuss this further. I am available at <tel_num> or any alternative time convenient for you. Thank you for your prompt attention to this matter.","Dear <name>, we are aware of the delay in your analytical reports and are looking into the issue. To better understand the problem, could you please provide details on the software updates and changes made to data integration recently? Additionally, please confirm the exact timeframe of the delay you are experiencing. Should you need to discuss this further, we are available for a call at your convenience. Please provide a suitable time, or I am available at <tel_num>. Your prompt assistance in resolving this matter is greatly appreciated to minimize its impact on your decision-making processes. Thank you.",Incident,Returns and Exchanges,medium,en,400,Performance,Disruption,IT,Tech Support,,,,
Guide for Integrating SendGrid SaaS,"Hi there, we're reaching out to the customer support team for detailed guidance on integrating SendGrid into our project management SaaS. Our goal is to enhance our communication capabilities by utilizing SendGrid's email services. Could you provide step-by-step instructions and point us in the direction of relevant resources? We would greatly appreciate information on setup, configuration, and troubleshooting. We look forward to hearing back from you to help us successfully integrate the SendGrid platform.","Thank you for your interest in integrating the SendGrid SaaS project management platform. For detailed guidance, please visit our website's resources section to find step-by-step instructions and documentation for setup, configuration, and troubleshooting. If you require additional assistance, please let us know a convenient time to call at <tel_num> for a discussion. Alternatively, you can contact us using <acc_num> for priority support. We look forward to helping you successfully integrate the SendGrid platform.",Request,Technical Support,low,en,400,Documentation,Feature,IT,Tech Support,,,,
,"We are encountering frequent crashes during IntelliJ IDEA data analysis tasks on our MacBook Air. This might be due to insufficient memory allocation. We have already attempted to update IntelliJ IDEA, clear temporary files, and restart the MacBook Air multiple times, but the issues continue to persist.","<name>, I'm sorry to hear that you are experiencing frequent crashes during IntelliJ IDEA data analysis tasks on your MacBook Air. It's good that you have already taken the troubleshooting steps of updating IntelliJ IDEA, clearing temporary files, and restarting the MacBook Air multiple times. However, since the issues persist, it would be helpful to investigate further. Please provide any error messages you receive when IntelliJ IDEA crashes. Additionally, could you let us know the current memory allocation details?",Problem,Technical Support,high,en,400,Crash,Performance,IT,Tech Support,,,,
Concern with Data Analytics Platform,"The data analytics platform is currently failing to generate accurate investment forecasts, which may be due to recent software updates. After restarting the application and clearing the cache, the issue still persists. The forecasts are inconsistent and do not reflect current market trends. Despite troubleshooting, the problem remains unresolved. I would appreciate it if you could look into this matter and provide a solution as soon as possible.","Dear [Name], we acknowledge the issue you are experiencing with the data analytics platform regarding inaccurate investment forecasts. We understand that you have already attempted to troubleshoot by restarting the application and clearing the cache, but the problem still persists. To better assist you, could you please provide details on the recent software updates mentioned, including version numbers and dates of installation? Additionally, it would be helpful to know any specific error messages you are seeing when attempting to generate forecasts. Thank you.",Incident,Product Support,high,en,400,Bug,Performance,IT,Tech Support,Feedback,,,
Support for Integrating Microsoft Teams Project Management SaaS,"Would be grateful for comprehensive guidance on integrating the Microsoft Teams project management SaaS. Would really appreciate detailed, step-by-step instructions and any relevant documentation to help with the process. Thanks for your assistance!","<name> values your interest in integrating Microsoft Teams project management SaaS and thanks for reaching out to the service desk team. We would be happy to provide detailed guidance on the integration process. Integrating Microsoft Teams allows users to receive notifications and updates directly within Teams channels. To get started, you will need a <acc_num> Microsoft Teams account. Please follow the step-by-step instructions and relevant documentation provided to facilitate the integration process. Thank you!",Request,Customer Service,high,en,400,Feature,Documentation,Feedback,IT,Tech Support,,,
Support for Enhancing Data Analytics,"I am writing to request an improvement in the data analysis integration for the relevant product. This enhancement will significantly optimize investment decisions and aid customers in making informed choices, thereby promoting business growth. I believe that such an improvement would be a valuable addition to our products. Could you please review the possibility of implementing this and provide more details for further consideration? Thank you for your time in contemplating this. I look forward to hearing back soon.",Thank you for your inquiry regarding enhancing data analysis. We are considering this request and will review the possibility of implementation. Please provide any additional specific details that would aid in further evaluation. ,Change,Customer Service,medium,de,400,Feedback,Product,Feature,Sales,,,,
Kompetenzen zur API-Integration und Betriebsmanagement,Könnten Sie zusätzliche Informationen zu diesem Thema liefern?,"Sehr geehrte/r [Name], ich freue mich, Ihnen zusätzliche Informationen zu den Kompetenzen bezüglich der API-Integration und Betriebsmanagement zu liefern. Die API ermöglicht es, verschiedene Systeme einfach zu integrieren und einen effizienten Datenaustausch zu verwaltung. Um Ihre Anforderungen besser zu verstehen, wäre es hilfreich, wenn Sie den Kontext und Details Ihres Integrationsfalles näher beschreiben könnten. Ich bin bereit, baldmöglichst eine Telefonkonferenz anzubieten, um weitere Aspekte zu besprechen.",Request,Technical Support,high,de,400,Feature,Documentation,IT,Tech Support,,,,
,"Customer Support, I am seeking information on the data analytics services you offer, particularly in the area of portfolio management. Could you provide details on how data analytics can optimize investments and portfolio management? I am interested in learning about the tools and techniques used to analyze market trends and make informed investment decisions. Specifically, I would like to know how data analytics can help us identify potential risks and opportunities, and how it can be integrated with our existing portfolio management systems. I look forward to your response.",We will call you soon.,Request,Customer Service,medium,en,400,Feedback,Sales,IT,Tech Support,,,,
Support Service Interruption,Facing difficulties with the project management system,"<name> sincerely regrets the inconvenience caused by the service outage in the project management system. Could you please share the details of the issues you are experiencing, including any specific error messages or problems? This will help us assist you more effectively. We are also available to schedule a call at a convenient time for you to discuss the issue and provide a solution. Please let us know a suitable time for a call at <tel_num>.",Incident,Technical Support,high,en,400,Outage,Disruption,IT,Tech Support,,,,
Query Regarding Offered Digital Marketing Services,"Dear Customer Service, I reach out to inquire about the digital marketing strategies and services offered by your firm. Could you please provide more information on the services that can aid in brand growth? I would appreciate details on pricing and success stories from previous clients to help me make an informed decision to retain these services. I look forward to your response shortly.",We will provide details on the digital marketing services and pricing shortly. Please establish contact for further details.,Request,Billing and Payments,medium,de,400,Feedback,Sales,Lead,,,,,
,"Erlebten Störungen im Datenanalyseflussdiagramm, die Optimierung von Investitionen beeinträchtigen. Die Integrationseinbußen können auf die Softwareprodukte zurückgeführt werden. Versucht, die Anwendungen neu zu starten und die Netzwerkverbindung zu überprüfen, jedoch behält das Problem während des Verlaufs Bestand. Brauchen Hilfe, um das Problem schnell zu lösen und die Auswirkungen auf die Operationen zu minimieren.","Um Ihnen bei den Störungen im Datenanalyseflussdiagramm zu helfen, möchten wir mehr Informationen erhalten. Bitte geben Sie mehr Details, insbesondere die spezifischen Softwareprodukte, die betroffen sind, sowie genaue Fehlermeldungen. Wir können gerne telefonisch besprechen, sobald es Ihnen recht ist. Bitte teilen Sie die geeignete Zeit für den Anruf mit, <tel_num>.",Incident,Technical Support,high,de,400,Network,Performance,Disruption,IT,Tech Support,,,
,Es treten due zu Serveroverloads Zugriffsprobleme auf.,"Wir entschuldigen die dadurch verursachten Unannehmlichkeiten aufgrund der Serveroverloads. Das Team arbeitet daran, das Problem so schnell wie möglich zu beheben. Bitte versuchen Sie es später erneut. Falls das Problem weiterhin besteht, geben Sie mehr Details und wir können eine vereinbarte Telefonkonferenz mit dem Nummer <tel_num> organisieren, um das Problem zu besprechen.",Incident,Technical Support,high,de,400,Bug,Network,Performance,Disruption,IT,,,
Technischer Unterstützungsantrag,"Die Projektmanagement-Software-as-a-Service (SaaS) bricht ab und zu aus, obwohl Redis 6.2 integriert ist, was möglicherweise auf Kompatibilitätsprobleme zurückzuführen sein könnte. Nach dem Neustart von Redis und dem Leerstellen des Caches behält das Problem seine Existenz bei. Bitte helfen Sie uns, dieses Problem zu lösen.","Überprüfen Sie den technischen Unterstützungsantrag bezüglich des Bruchs der Projektmanagement-SaaS mit integriertem Redis 6.2. Um Ihnen behilflich zu sein, benötige ich zusätzliche Details zu den Fehlern. Wir sollten einen Anruf vereinbaren, um mögliche Kompatibilitätsprobleme und die nächsten Schritte zu besprechen. Sind Sie verfügbar für einen Anruf?",Problem,Product Support,high,de,400,Bug,Performance,IT,Tech Support,,,,
Bewerberbericht Datenanalyse-Dienstleistungen,"Kann ich Informationen über Datenanalyse-Dienstleistungen und wie diese bei der Optimierung von Investitionsstrategien helfen, erhalten? Danke.","Sehr geehrte [Name], vielen Dank für Ihr Interesse an unseren Datenanalyse-Dienstleistungen. Wir bieten angepasste Lösungen, um die Optimierung Ihrer Investitionsstrategien und die Datenanalyse zu unterstützen, um wertvolle Erkenntnisse zu gewinnen. Ich freue mich, diese Angebote mit Ihnen zu besprechen. Könnten Sie bitte mehr Details über Ihre spezifischen Bedürfnisse und Anforderungen liefern? Sollten Sie weitere Details zu unseren Dienstleistungen benötigen, rufen Sie uns gerne unter [Tel Nummer] an und vereinbaren wir einen Termin für eine Besprechung. Vielen Dank.",Request,Billing and Payments,high,de,400,Feedback,Product,Feature,Sales,IT,,,
Improving Team Collaboration with Discord,Seeking advice on integrating Discord for project management SaaS to boost team collaboration. Would appreciate guidance on which features are available and how to set them up. Want to understand the benefits of using Discord for team collaboration and how it can enhance the project management experience. Please inform on the specific steps required to integrate Discord SaaS.,"Thank you for your interest in integrating Discord for enhanced project management SaaS and improved team collaboration. The process of setting up the integration involves navigating to the integrations section within the SaaS platform, selecting Discord from the list of available integrations, and authorizing the connection to configure settings according to your needs. The Discord integration offers features such as real-time chat notifications and automated updates to keep the team well-informed. Using Discord for team collaboration can significantly enhance the project management experience.",Request,Customer Service,high,en,400,Feature,Feedback,Documentation,IT,Tech Support,,,
Request for API Support,"The external API integration has encountered issues, leading to disruptions in project task updates. A potential cause may be a rate limit being exceeded. Despite restarting the service and verifying API keys, the problem still exists. I would greatly appreciate it if you could review the matter and provide a solution at your earliest convenience.","<name> has acknowledged the API integration issue that is causing disruptions in project task updates. It is understood that you have already restarted the service and verified the API keys, but the issue persists. To better assist you, we would like to request additional information. Could you please provide us with the exact error message you are receiving and the timestamp of when the issue occurred? This will help us investigate the matter and determine if the rate limit has indeed been exceeded.",Incident,Technical Support,high,en,400,API,Network,Disruption,Performance,Tech Support,,,
,"Dear Customer Support, I am reaching out to inquire about the enhanced security measures implemented for managing medical data across our critical products and tools in healthcare operations. It is of utmost importance to ensure the protection of sensitive patient information and adherence to regulatory requirements. I would greatly appreciate any information you could provide on the current security protocols in place, as well as your plans for future enhancements. Thank you in advance for your assistance, and I look forward to hearing from you soon.","We appreciate your concern regarding security measures for managing medical data across our critical products and tools in healthcare operations. We understand the importance of protecting sensitive patient information and ensuring compliance with regulatory requirements. Our current security protocols include encryption, firewalls, and access controls to safeguard patient data. We conduct regular security audits and risk assessments to identify and mitigate potential vulnerabilities. We are continually reviewing and updating our security measures to ensure they remain effective and aligned with industry standards.",Change,IT Support,low,en,400,Security,Product,Feedback,,,,,
Betreff: Notwendigkeit von Upgrades unserer digitalen Werkzeuge und Infrastrukturen,"Sehr geehrte Kundenservice, wir möchten die Notwendigkeit der Upgrades unserer digitalen Werkzeuge und Infrastrukturen zur Verbesserung der Effizienz und des Reachs unserer Zielgruppe ansprechen. Dabei handelt es sich um Markenwachstumstechniken und Marketingbüros, die eine wesentliche Rolle bei der Ausführung effektiver Marketingkampagnen und der Fähigkeit, data-basierte Entscheidungen zu treffen, spielen. Eine verbesserte digitale Infrastruktur könnte uns dabei helfen, unser Reach zu erweitern und effektiver mit unserer Zielgruppe zu verbunden zu bleiben. Wir schätzen Ihre Unterstützung und freuen uns auf eine Diskussion dieser Themen.","Sehr geehrte [name], wir schätzen sehr, dass Sie sich mit der Notwendigkeit der Upgrades unserer digitalen Werkzeuge und Infrastrukturen und deren Unterstützung für Markenwachstumstechniken und Marketingbüros besprechen möchten. Wir verstehen die Bedeutung effizienter und effektiver digitaler Lösungen, um Marketingkampagnen auszuführen und data-basierte Entscheidungen zu treffen. Wir sind bereit, den Thema besprechen und mögliche Lösungen erörtern. Um den aktuellen Stand der Anforderungen besser zu verstehen, könnten wir bitte Informationen zu unseren bestehenden digitalen Werkzeugen und Infrastrukturen erhalten. Darüber hinaus würden wir uns freuen, die Zeit für ein Gespräch zu vereinbaren.",Change,Service Outages and Maintenance,medium,de,400,Feature,Performance,Feedback,IT,,,,
Antrag auf Unterstützung für Verbesserung der Kompatibilität von Corsair Dark Core RGB Pro SE Maus mit macOS-Programmen,"Ich bitte um Unterstützung bei der Verbesserung der Kompatibilität der Corsair Dark Core RGB Pro SE Maus mit macOS-Programmen, insbesondere bei den Problemen mit Scrollen und Klicken. Ein Software-Update oder Patch könnten eine Lösung sein. Die Maus ist ein hochleistungsfähiges Gaming-Mausrad und eine bessere Kompatibilität würde die Benutzererfahrung erheblich verbessern. Ich freue mich auf Ihre Unterstützung, um das Problem zu lösen. Bitte geben Sie mir mehr Details zu den Problemen, damit ich Ihnen helfen kann.","Ihren Antrag zur Kompatibilitätsprobleme mit der Corsair Dark Core RGB Pro SE Maus und macOS-Programmen erhalten. Um Ihnen besser zu helfen, könnten Sie bitte mehr Details zu den Problemen mit Scrollen und Klicken geben. Danach werde ich mögliche Lösungen untersuchen, einschließlich möglicher Software-Updates und Patches.",Change,Product Support,medium,de,400,Product,Feature,Feedback,Tech Support,,,,
Website Accessibility Issue,"Since yesterday afternoon, we have been experiencing problems accessing the website.","We received your email regarding the website issue, which started yesterday afternoon. The case will be forwarded to the technical team for prompt resolution.",Problem,IT Support,medium,de,400,Bug,Performance,Disruption,IT,Tech Support,,,
Services for Safeguarding Medical Data,Is there a possibility of obtaining detailed information on services that secure medical data and improve hospital security? I would greatly appreciate it if you could provide more details.,"Dear [Name],\n\nWe offer a wide range of medical data security services designed to protect sensitive patient information and enhance hospital security. Our services include data encryption, access control, and threat detection. We also provide security audits and compliance consulting to ensure adherence to regulatory requirements. Please feel free to provide more information about your specific needs so that we can offer a customized solution. I would be available to discuss further at your convenience. Please let us know when you are available for a call.\n\nBest regards,\n[Your Name]",Request,Customer Service,medium,en,400,Security,Documentation,IT,Tech Support,,,,
Concerns About Security in Medical Data Systems,"Experiencing security vulnerabilities in medical data systems due to outdated software settings. Even after updating software and firewalls, problems continue. Seeking help to address these vulnerabilities and ensure the security of medical data.",Please review the security issues related to your medical data and contact <tel_num> to discuss how we can assist in resolving these vulnerabilities.,Problem,Product Support,medium,en,400,Security,Bug,IT,Tech Support,,,,
,"geehrte Kundenservice, ich interessiere mich für weitere Informationen zur Nutzung von Datenaufbereitungsdiensten. Könntet ihr Informationen zur Verfügung stellen, wie diese Dienste beitragen können, um Investitionsstrategien zu optimieren? Ich wäre dankbar, wenn ihr zusätzliche Details mitteilen könntet. Vielen Dank für eure Unterstützung. Ich freue mich darauf, bald von euch zu hören.","geehrter <name>,\n\nwir bedanken uns für euren Interesse an unseren Datenaufbereitungsdiensten. Diese Dienste helfen bei der Optimierung eurer Investitionsstrategien und bieten Einblicke in Marktentwicklungen und Muster. Wir nutzen fortschrittliche Werkzeuge und Techniken, um Daten zu analysieren und handlungsorientierte Empfehlungen zu geben. Wenn ihr mehr darüber erfahren möchtet, freuen wir uns, telefonisch einzuholen und die spezifischen Vorteile unserer Dienste zu besprechen. Könntet ihr einen passenden Zeitpunkt für eine Telefonkonferenz vorschlagen? Bitte informiert uns über ein passendes Zeitfenster, damit wir uns anpassen können.\n\nMit freundlichen Grüßen,\n<name>",Request,Technical Support,high,de,400,Feedback,IT,Tech Support,,,,,
Improve Data Analytics Tools for Better Investment Optimization,We aim to enhance our data analytics tools to improve investment optimization.,Let's review and enhance the data analytics tools to better optimize investments. Please provide details so we can discuss this further and explore the opportunity at your convenience.,Change,General Inquiry,medium,en,400,Feature,Feedback,Documentation,,,,,
Probleme der Softwarekompatibilität melden,"Gesuchte Kundenservice, wir haben Schwierigkeiten bei der Umsetzung von Kampagnen aufgrund von Softwarekompatibilitätsproblemen, die auf ungenügende Integration und veraltete Softwareversionen zurückzuführen sind. Trotz Aktualisierung der Geräte und Neustarts der Anwendungen blieben die Probleme bestehen. Wir benötigen Ihre Unterstützung, um das Problem bald zu beheben und weitere Verzögerungen zu vermeiden. Bitte teilen Sie uns die nächsten Schritte mit, die zur Lösung des Problems erforderlich sind. Wir danken Ihnen für Ihre schnelle Unterstützung und Ihr Engagement in dieser Angelegenheit.","Geliebter [Name], wir bestätigen Ihren E-Mail-Bericht über die Softwarekompatibilitätsprobleme bei Markenagentur. Um Ihnen besser zu helfen, könnten wir mehr Details über die verwendeten Softwareversionen auf den Geräten benötigen. Es wäre schön, wenn wir telefonisch miteinander sprechen könnten, um die nächsten Schritte zu besprechen und das Problem zu lösen. Wann passen Sie am besten telefonisch mit mir zusammen? Bitte geben Sie ein geeignetes Zeitfenster an, damit ich direkt eine Verbindung herstellen kann und das Troubleshooting für die Lösung der Kompatibilitätsprobleme überwachen kann, während wir die Geräte beobachten.",Problem,Customer Service,low,de,400,Bug,Performance,IT,Tech Support,,,,
