subject,body,answer,type,queue,priority,language,version,tag_1,tag_2,tag_3,tag_4,tag_5,tag_6,tag_7,tag_8
Support Needed for Service Outages,"Facing service interruptions that are affecting access to medical data for hospital operations. These outages seem to be due to recent system updates causing a system overload. We have attempted to resolve the issue by rebooting systems and clearing caches, but the problem continues. Urgent assistance is required to troubleshoot and resolve this issue.","The Service Desk is here to assist with the service outages you're experiencing. It's crucial that we address this critical issue which is impacting medical data access and hospital operations. To better help troubleshoot, could you provide details on the updates that were recently installed and any exact error messages you are receiving? We would like to schedule a call to discuss this issue and work on a resolution. I would be available to call at your earliest convenience and prefer to call at <tel_num>. ",Problem,Service Outages and Maintenance,high,en,400,Outage,Disruption,Performance,Recovery,IT,Tech Support,,
Problem with Investment Analysis Software,"The investment analysis tool is experiencing disruptions, impacting analytics. Recent updates have led to compatibility issues, which may be causing conflicts. Restarting devices and reinstalling applications have not resolved the problem.",Please investigate the issue with the investment analysis tool. Provide details on any error messages and the symptoms you are experiencing for better assistance.,Incident,Product Support,medium,en,400,Disruption,Performance,Bug,IT,Tech Support,,,
Elasticsearch Security Features,Request for information on securing medical data with Elasticsearch,"Offer general guidance on securing medical data using Elasticsearch, including encryption and access controls. For more specific advice regarding the current Elasticsearch setup and security concerns, further details would be appreciated. We are ready to assist further.",Request,Customer Service,low,en,400,Security,Documentation,Feedback,,,,,
Unerwartetes Sinken der Website-Besucherzahlen,"Die Website-Besucherzahlen haben letzte Woche unerwartet gesunken, was möglicherweise auf kürzlich durchgeführte Algorithmus-Änderungen zurückzuführen ist. Wir haben bereits SEO-Optimierungen vorgenommen und eine neue Werbekampagne gestartet, um die Situation zu verbessern.","Gewiddeltes Herr/n <name>,\n\nich bestätige die E-Mail bezüglich des unerwarteten Sinkens der Website-Besucherzahlen, was möglicherweise auf kürzlich durchgeführte Algorithmus-Änderungen zurückzuführen ist. Wir haben bereits Schritte unternommen, um SEO zu optimieren und eine neue Werbekampagne zu starten, was ein guter Anfang ist.\n\nUm die Angelegenheit weiter zu ermitteln, würde ich gerne mehr Details zu den spezifischen Änderungen erfahren, die vorgenommen wurden, sowie den aktuellen Status der Website-Besucherzahlen. Bitte geben Sie mehr Details zu den spezifischen Algorithmus-Änderungen, die Sie meinten, relevant sind.\n\nWenn erforderlich, können wir eine Telefonkonferenz vereinbaren unter <tel_num>.",Incident,Product Support,high,de,400,Performance,Bug,Feedback,,,,,
Advice on Optimizing Investment Analytics with Firebase and ClickUp,"Hello, I am reaching out for assistance in optimizing investment analytics using Firebase and ClickUp. Could you guide me on how to integrate these tools to enhance my investment tracking and analysis capabilities? I am currently utilizing Firebase for data storage and ClickUp for project management, and I am looking for ways to streamline my workflow and gain deeper insights from the data. Specifically, I am interested in learning about best practices for syncing data between these two platforms and how to avoid common pitfalls. Thank you for your time.",I would be happy to assist with integrating Firebase and ClickUp for investment analytics. Could you please provide more details about your current setup? We can discuss further by contacting me at <tel_num>.,Request,General Inquiry,low,en,400,Feature,Documentation,Feedback,IT,Tech Support,,,
Challenges in Marketing Strategies for Brand Growth,"Marketing efforts have slowed down. Upon reviewing recent analytics, inconsistencies were discovered. Attempts to update campaigns and enhance social media presence have not yielded positive results. Assistance is needed to resolve these issues and restart brand growth.",We will assist,Problem,Product Support,medium,en,400,Feedback,Sales,Marketing,Performance,Documentation,,,
Request for Information on Digital Strategies for ESET NOD32 Antivirus,Seeking information on digital marketing strategies to promote ESET NOD32 Antivirus. Interested in understanding how online marketing can help increase brand awareness and sales.,"Would be happy to discuss digital marketing strategies for promoting ESET NOD32 Antivirus. We can use a combination of social media, email marketing, and search engine optimization to increase brand awareness and sales. If you would like to learn more, please let me know so we can schedule a call to provide more detailed information and answer any questions you may have.",Request,Billing and Payments,medium,en,400,Feature,Feedback,Sales,IT,Tech Support,,,
Technische Anfrage,"Betreff: technisches Problem bei der Datenanalyse-Plattform. Das Investitions-Modellierungs-Run hat einen Verarbeitungsfehler aufgewiesen. Das Problem besteht darin, dass obwohl das System neu gestartet und der Cache geleert wurde, der Fehler weiterhin besteht. Die Fehlermeldung ist informativ, aber wir wissen nicht, wie wir sie lösen sollen. Wir schätzen Ihre Hilfe sehr, um eine Lösung für das Problem zu finden. Bitte teilen Sie uns mit, wenn Sie weitere Informationen benötigen. Wir freuen uns darauf, von Ihnen zu hören. Vielen Dank für Ihre Unterstützung.","Betreff: Antrag bezüglich technischen Problems bei der Datenanalyse-Plattform. Ich bestätige Ihren Antrag. Entschuldigung für die Unannehmlichkeiten, die verursacht wurden. Ich freue mich, Ihnen behilflich zu sein, um das Problem zu lösen. Um das Problem besser zu verstehen, wäre es hilfreich, wenn Sie uns mehr Details zur Fehlermeldung und den Schritten bereitstellen, die Sie bereits ausgeführt haben, bevor das Problem aufgetreten ist. Falls es notwendig ist, können wir telefonisch diskutieren. Bitte rufen Sie mich unter der Nummer <tel_num> an und geben Sie ein passendes Zeitfenster an. Vielen Dank.",Incident,IT Support,high,de,400,Bug,Performance,IT,Tech Support,,,,
Request for Moodle Redis Security Guidance,"Hello Support Team, I am reaching out to inquire about securing medical data using Moodle Redis version 6.2 in our hospital's IT system. We are looking to implement a robust and secure system for storing and managing sensitive patient information. Could you provide us with guidance on best practices for configuring Moodle Redis to ensure the confidentiality, integrity, and availability of medical data? We would greatly appreciate any recommendations or resources that could help us achieve our goal, specifically regarding encryption methods and access controls.","We can provide guidance on securing medical data with Moodle Redis, including encryption methods, access controls, and backup procedures. Please let us know your specific requirements, and we would like to schedule a call at your convenience. Please let us know a suitable time to reach you at <tel_num> to assist with your query regarding <acc_num>.",Request,Technical Support,high,en,400,Security,IT,Tech Support,Documentation,,,,
,"Wir haben einen kritischen Systemausfall in unserer SaaS-Projektmanagement-Plattform bemerkt. Das Problem scheint auf Kompatibilitätsprobleme mit PHP 8.0-integrierten Werkzeugen und Plugins hinzuweisen. Wir haben den Server gestartet und die Logs geprüft, außerdem haben wir die Plugins aktualisiert, aber das Problem behält sich beständig. Wir bitten um Unterstützung, um dieses Problem so bald wie möglich zu beheben und den Dienstunterbrechungen aus dem Weg zu gehen.","Wir haben einen E-Mail-Bericht über den kritischen Systemausfall in der SaaS-Projektmanagement-Plattform erhalten. Leider scheint das Problem auf Kompatibilitätsprobleme mit PHP 8.0-integrierten Werkzeugen und Plugins zu beruhen. Wir verstehen, dass Sie bereits versucht haben, das Problem zu beheben, indem Sie den Server gestartet, die Logs geprüft und die Plugins aktualisiert haben. Es wäre hilfreich, wenn wir mehr Informationen oder spezifische Fehlermeldungen erhalten könnten, um das genaue Plugin identifizieren zu können, das betroffen ist. Zusätzlich könnten wir gerne telefonisch Kontakt aufnehmen, um eine Lösung zu besprechen.",Incident,IT Support,high,de,400,Outage,Disruption,Performance,Tech Support,,,,
,"To Customer Support, I need help with a critical issue in the project management tool. A key feature, task assignment, has stopped working and I suspect it might be due to a recent code update. I've attempted a rollback and cleared the cache but the problem still exists. I've tried to troubleshoot it myself, but I haven't been able to resolve it. I would greatly appreciate it if you could look into this matter urgently and provide a solution as soon as possible. Please let us","<name>, thank you for reporting the issue with the project management tool. Could you please provide a convenient time to call at <tel_num> so we can gather more information to find a workable solution? <acc_num>.",Incident,Product Support,high,en,400,Bug,Performance,Feature,IT,Tech Support,,,
,"Customer Support,<br>A data analytics tool is not functioning, which is hindering investment optimizations. This problem might be due to recent software updates. Despite attempts at rebooting and troubleshooting, the issue remains unresolved. We require your assistance to resolve this and get the tool back to normal operations. Could you please help us identify the root cause and provide a solution to prevent similar issues in the future? We greatly appreciate your prompt attention to this matter and look forward to your response.",We will investigate the issue with the data analytics tool related to recent software updates. Please provide the update version and any error messages that you have encountered. We can discuss these details further by contacting us at <tel_num>.,Incident,Customer Service,medium,en,400,Bug,Performance,IT,Tech Support,,,,
Hilfe bei Datenverlust-Arbeitsschritt,"Ein Datenverlust wurde in den IT-Systemen des Krankenhauses festgestellt, was möglicherweise die Sicherheit der Patientendaten gefährdet. Das Team hat sofortige Software-Updates und Sicherheitsprüfungen durchgeführt, konnte dennoch das Problem nicht vollständig beheben. Wir benötigen Unterstützung, um die Angelegenheit so schnell wie möglich zu klären und die Sicherheit der Patientendaten zu gewährleisten. Bitte geben Sie Anweisungen für die nächsten Schritte.","Seien Sie gegrüßt, im Folgenden antworten wir auf das Datenverlust-Ereignis im Krankenhaus. Ich verstehe die Bedeutung der Situation und die Notwendigkeit schneller Maßnahmen. Ich würde mich freuen, eine Besprechung zu vereinbaren, um die Details des Problems sowie die bereits ergriffenen Schritte zu besprechen. Bitte geben Sie mir eine geeignete Zeit per Telefon <tel_num>, damit wir die nächsten Schritte unternehmen und die Sicherheit der Patientendaten gewährleisten können, bis die Angelegenheit geklärt ist.",Problem,Technical Support,medium,de,400,Bug,Security,IT,Tech Support,,,,
Aktualisierung von Express JS,"Sehr geehrte Kundenservice, ich möchte die Aktualisierung der Kompatibilität von Express.js in unserem Softwareprodukt für das Projektmanagement und unsere SaaS-Plattform bitten. Momentan verursacht die Integration Schwierigkeiten, da die aktuelle Version von Express.js veraltet ist. Ich schätze es, wenn Sie Anleitungen zur Aktualisierung von Express.js zur Verfügung stellen könnten, um eine glatte Integration in unser Softwareprodukt zu gewährleisten. Eine Aktualisierung ist für die Leistung und Sicherheit unserer Plattform von entscheidender Bedeutung. Bitte teilen Sie mich mit, wenn weitere Informationen erforderlich sind. Ich freue mich auf Ihre Rückmeldung.",Ihre Anfrage wird telefonisch über <tel_num> bearbeitet. Bitte kontaktieren Sie uns für weitere Informationen.,Change,Returns and Exchanges,low,de,400,Feature,Documentation,Performance,Security,IT,Tech Support,,
,Suche nach Datensicherheitslösungen für IT-Systeme von Gesundheitsdienstleistern in Krankenhäusern. Ich danke und bitte um vorangestellte Unterstützung. Geben Sie mir eine Auskunft zur Angelegenheit.,Wir bieten robuste Datensicherheitslösungen für Gesundheitsdienstleister und Krankenhäuser. Sie können eine detaillierte Broschüre per E-Mail erhalten und die Lösungen ausführlich einsehen.,Request,Customer Service,medium,de,400,Security,IT,Tech Support,Maintenance,,,,
Analyse von Datenunterschieden,Bestimmen der Datenunterschiede in Investitionsmetriken. Versuchte Lösungen umfassen die Wiederherstellung des Softwareprogramms und die Überprüfung der Datenquellen.,"Ich werde eine Untersuchung der Datenunterschiede in Investitionsmetriken durchführen. Um die Situation besser zu verstehen, benötige ich mehr Details über die spezifischen Datenunterschiede und die Schritte, die bisher unternommen wurden. Bitte teilen Sie mir mehr über die Probleme mit, damit ich Ihnen helfen kann. Die Kontonummer benötige ich, um die Untersuchung durchzuführen. Bitte geben Sie die notwendigen Informationen, damit ich Ihnen assistieren kann.",Problem,Technical Support,high,de,400,Bug,Performance,Recovery,IT,Tech Support,,,
Issues with Delayed Response Times Noted Lately,"Recently, users have reported experiencing slow response times when accessing project dashboard features during peak hours of increased user traffic. Efforts to identify and address potential bottlenecks in server performance and optimize database queries have been made, but the issues persist. We are still working on resolving the issue.",Received an email regarding the reported issues with delayed response times on the project dashboard. Offering assistance to provide detailed information on server performance during peak hours to help resolve the issue.,Incident,Customer Service,low,en,400,Performance,Network,IT,Tech Support,,,,
Login Concerns,A user has reported intermittent login difficulties with the project management SaaS platform following recent server maintenance.,We are aware of the login concerns with the project management SaaS platform related to recent server maintenance. Our team is investigating the issue and will provide an update soon. Please let us know if the issue persists so we can assist with troubleshooting.,Incident,Technical Support,medium,en,400,Login,Performance,Maintenance,IT,Tech Support,,,
Recent Performance Slowdown Noted,"Lately, there have been reports of slow performance. This might be due to increased server load following recent updates. We have cleared the caches and optimized database queries, but the issue still persists.",Received your email concerning the slow performance issues. Kindly provide details on the server load and recent updates to aid in the investigation. It would also be helpful to know the current server utilization to proceed with troubleshooting.,Problem,Customer Service,medium,en,400,Performance,Bug,IT,Tech Support,,,,
,"unerwarteter Dienstausfall verursacht Unterbrechungen. Es wurde versucht, Hardware neu zu starten, Verbindungen zu überprüfen und den Dienstleistungsstatus zu prüfen. Ein Lösungsansatz wurde gefunden, jedoch fortbestehen die Probleme, was die digitale Marketingstrategie beeinträchtigt.","unerwarteten Dienstausfall untersuchen. Bitte geben Sie Ihre Kontodaten an, damit wir einen Rückruf vereinbaren können und weitere Maßnahmen besprechen. Vielen Dank für Ihre Meldung.",Incident,Technical Support,high,de,400,Outage,Disruption,Hardware,Network,Performance,IT,Tech Support,
Guide for Integrating Smart Kitchen Devices,"Inquiring about the integration of Smart-Küchengeräte into our SaaS project management platform. Could you please provide detailed guidance on how to successfully integrate the devices? I would greatly appreciate step-by-step instructions, including any necessary code snippets and API documentation. Additionally, could you inform me of any specific requirements or compatibility considerations we should be aware of? I am excited about the potential benefits of this integration and look forward to hearing back soon. Thank you for your assistance. I am looking forward to it.","\""name\"", thank you for your email regarding the integration of Smart-Küchengeräte into our SaaS project management platform. We are here to assist with the integration and will provide detailed guidance through our API documentation. Please allow us to call you at <tel_num> to discuss specific requirements and compatibility considerations. We will provide step-by-step instructions and necessary code snippets to ensure a successful integration. We look forward to speaking with you soon to discuss further.",Request,Technical Support,high,en,400,Documentation,Feature,Tech Support,,,,,
Investment Optimization Tools,"Dear customer support, could you provide information on investment optimization tools that are compatible with Microsoft OneNote and JIRA? I am looking for tools that can help me make informed investment decisions and streamline my workflow. I would greatly appreciate any recommendations or guidance you can provide. Thank you for your time and assistance. I look forward to hearing back from you soon.","Dear [name], thank you for reaching out to our service desk. We can provide information on investment optimization tools that are compatible with Microsoft OneNote and JIRA. Several tools are available that can help you make informed investment decisions and streamline your workflow. To better understand your specific needs, could you please provide more information about the type of investments you are looking to optimize? We would be happy to discuss and provide recommendations, and we are available to discuss in more detail at your convenience.",Request,Billing and Payments,medium,en,400,Feature,Documentation,Feedback,Tech Support,,,,
Notice of Billing Discrepancies Across Various Services,"Dear Support Team, our organization is encountering billing discrepancies for several products and services. There might be a mix-up in subscription renewals or payment processing mistakes causing this issue. We have already reviewed our billing records and reached out to customer support, but the problem remains unresolved. We kindly request your assistance in resolving this matter as soon as possible. Please inform us if any additional information is needed. Thank you for your prompt attention to this matter.","Hello [name], we are writing to acknowledge your email regarding the billing discrepancies you are experiencing with multiple services. We apologize for the inconvenience and will assist in resolving this matter as soon as possible. To better understand and address the issue, we would appreciate it if you could provide us with your account number and specific billing statements that show the discrepancies. Additionally, any detailed information about your interactions with our customer support team would be helpful. Thank you for your time and assistance.",Incident,Billing and Payments,medium,en,400,Billing,Payment,Refund,Account,Disruption,Support,,
Support for GIMP Required,Could you provide guidelines on optimizing GIMP for data analysis in the investment sector? Thank you!,I am pleased to assist with optimizing GIMP for data analysis. Please provide more context on specific requirements and needs to better support the investment sector.,Request,Technical Support,low,de,400,Feedback,IT,Tech Support,,,,,
Unterstützung für TensorFlow in SAP ERP,"Sehr geehrte Kundenservice-Team, ich möchte mich an der Anfrage für die Unterstützung bei der Integration von TensorFlow in SAP ERP wenden. Ich hoffe, Sie könnten mir dabei helfen, die notwendigen Ressourcen und Dokumentationen zu erhalten, um den Umsetzung meines Projekts zu erleichtern. Ich freue mich darauf, Informationen und Möglichkeiten zur Verwendung von maschinellem Lernen in der Anlageoptimierung mit TensorFlow in SAP ERP zu erhalten. Insbesondere interessiert mich, welche APIs und Werkzeuge verfügbar sind, die die Integration erleichtern. Ich danke Ihnen im Voraus für Ihre Unterstützung und freue mich auf Ihre Rückmeldung. Herzliche Grüße","Wir werden Ihnen die notwendigen Ressourcen für die Integration von TensorFlow in SAP ERP bereitstellen. Bitte geben Sie uns Ihre Kontonummer, damit wir uns in angenehmer Zeit per Anruf in Verbindung setzen können, um weitere Details zu besprechen und die verfügbaren APIs zu erläutern.",Request,Customer Service,low,de,400,Documentation,Feature,IT,Tech Support,,,,
Challenge with Login User Accounts,"We are facing a significant login challenge that is stopping users from accessing their accounts. This issue might be related to recent server updates. Steps like restarting the server and checking configurations have been taken, but the issue still exists and users are unable to log in.","Acknowledged the login issue with user accounts. Sorry to hear that recent server updates might have caused this problem. Given that steps like server restarts and configuration checks have already been attempted and the issue persists, we need to troubleshoot further. To do this, we will need more information, specifically the error messages users are receiving when trying to log in. Could you please provide these details? Once we have the necessary information, we can schedule a call to discuss the issue and find a resolution.",Incident,Customer Service,high,en,400,Login,IT,Tech Support,Performance,,,,
Suche nach weiteren Details zu einem Projektmanagementtool,"Ich bin an einem Projektmanagementtool interessiert und würde gerne mehr über seine Skalierbarkeit und Integrationsoptionen erfahren. Ich möchte wissen, ob es anpassbar ist und ob es die Bedürfnisse von Teams erfüllt, insbesondere in Bezug auf drittparteiige Integrationsmöglichkeiten.","Wir freuen uns, dass Sie sich für die Merkmale unseres Projektmanagementtools interessieren. Bitte lassen Sie uns die Gelegenheit haben, uns telefonisch zu kontaktieren, um Ihnen mehr Informationen bereitzustellen.",Request,Product Support,medium,de,400,Feature,Documentation,Feedback,,,,,
IT-Consulting,authorized access detected,"Dear <name>, we take the security of our systems seriously and have detected an authorized access. We would like to investigate the matter and request additional information such as the date, time of the incident, and any notable activity observed. We would like to arrange a call to discuss this in more detail. Would a telephone conversation at your convenience be suitable? Please provide your preferred time to reach you at <tel_num>. ",Incident,Product Support,medium,de,400,IT,Tech Support,Account,Login,,,,
Concern Over Marketing Performance,"The marketing agency observed a decline in brand engagement. This could be due to recent algorithm changes or ineffective ad targeting. Despite reviewing ad performances and adjusting settings, there has been no improvement.",Would like to discuss this issue further. Please provide details on the ad performances and the adjustments made so we can assist better.,Incident,Customer Service,medium,en,400,Performance,Feedback,Marketing,Tech Support,,,,
Inquiries About Project Management SaaS Billing Plans,"I contacted Customer Support to inquire about the billing options for a project management SaaS service. Could you provide details on the different plans available, including their features and pricing? I would appreciate it if you could explain the payment terms and whether any discounts are offered for long-term commitments or large teams. Additionally, could you clarify if there are any setup fees or other associated costs for using the SaaS service? I am interested in learning more about the billing options available to me. Thank you for your assistance.","Thank you for reaching out to our support team regarding the billing options for the project management SaaS service. We offer several plans that vary in features and pricing, which you can find on our website. We do provide discounts for long-term commitments and large teams. There may be setup fees and additional costs for certain services. I would be happy to discuss the available payment terms in more detail. Please let me know a convenient time to call at <tel_num> for further discussion.",Request,Billing and Payments,low,en,400,Billing,Payment,Product,Feature,Feedback,Sales,,
