subject,body,answer,type,queue,priority,language,version,tag_1,tag_2,tag_3,tag_4,tag_5,tag_6,tag_7,tag_8
Request for Architectural Specifications of the SaaS Platform,"Dear Support Team,\n\nI hope this message finds you well. I am currently assessing the potential integration of the SaaS platform within our organization. To conduct a comprehensive technical evaluation, I kindly request detailed information regarding the platform's architectural design. Specifically, I am interested in understanding the core components, data flow, security measures, scalability options, and any relevant compliance frameworks that the platform adheres to.\n\nA clear understanding of these architectural aspects will greatly assist our team in ensuring compatibility and planning a seamless deployment.",Thank you for your inquiry. Please send a brief email with the architectural documentation.,Request,Customer Service,low,de,51,Product,Feature,IT,Tech Support,,,,
Discrepancies in Billing Across Multiple Items,"Dear Customer Support Team,\n\nI am reaching out regarding billing inconsistencies identified on my account involving several products. Our agency has noticed irregular charges on several devices' software subscriptions. We suspect recent subscription modifications or system updates may have contributed to these discrepancies.\n\nOur billing department has conducted a thorough review of the invoices and has attempted to identify the root cause of the issue. Despite these efforts, the discrepancies persist unresolved. This ongoing problem raises concerns and affects our budgeting and financial planning.\n\nWe kindly request your assistance.","Thank you for contacting us regarding the billing discrepancies on your account. We understand how crucial accurate billing is for your financial planning, and we apologize for any inconvenience caused. To assist you further, please send us the specific invoice numbers along with summaries of the affected products or subscriptions. This information will enable us to investigate the inconsistencies more efficiently. Once we have these details, we will conduct a comprehensive review of your account and, if necessary, escalate the case to our billing and technical teams for a complete resolution.",Incident,Billing and Payments,medium,de,51,Billing,Account,Software,Discrepancy,,,,
Dienstunterbrechung,"Sehr geehrtes Support-Team,\n\nich möchte eine Problemmeldung im Zusammenhang mit einer Störung der Cloud SaaS-Plattform einreichen. Seit heute Morgen bestehen Schwierigkeiten beim Zugriff auf die Plattform, inklusive gelegentlicher Ausfälle und verzögerter Reaktionszeiten. Diese Störung beeinträchtigt die Geschäftsprozesse erheblich, insbesondere bei den wichtigsten Aufgaben im Bereich Kundenverwaltung.\n\nKönnten Sie bitte den aktuellen Status des Dienstes aktualisieren und eine ungefähre Zeitspanne für die Behebung nennen? Außerdem wären Hinweise auf temporäre Workarounds oder Maßnahmen, die wir ergreifen könnten, um die Auswirkungen zu verringern, sehr hilfreich.\n\nVielen Dank im Voraus.","<name>,\n\nich danke Ihnen für die Meldung der Störung bei der Cloud SaaS-Plattform. Unser technisches Team untersucht derzeit aktiv die Ursachen der Ausfälle und der verzögerten Reaktionszeiten. Wir können momentan keinen genauen Zeitrahmen für die vollständige Behebung nennen, werden Sie jedoch umgehend informieren, sobald wir weitere Details haben. In der Zwischenzeit empfehlen wir, den Browser-Cache zu leeren und die Plattform erneut zu öffnen. Falls möglich, teilen Sie uns bitte den Firmennamen sowie spezifische Fehlermeldungen mit, um die Problemlösung zu erleichtern.",Problem,Customer Service,high,de,51,Outage,Disruption,Performance,Network,,,,
Anfrage zur Unterstützung und Klärung des Support-Falls,"Sehr geehrtes Support-Team,\n\nich hoffe, diese Nachricht erreicht Sie wohlbehalten. Ich nehme Kontakt auf, da ich kürzlich eine Support-Anfrage gestellt habe und bemerkt habe, dass die Beschreibung meines Problems möglicherweise nicht ausreichend war. Ich möchte mich für eventuelle Unannehmlichkeiten entschuldigen und biete gerne eine detailliertere Erklärung an, um eine schnellere Lösung zu ermöglichen.\n\nKönnten Sie mir bitte mitteilen, ob ich die Support-Anfrage aktualisieren oder eine neue Anfrage mit präziseren Informationen einreichen sollte? Ich möchte sicherstellen, dass alle erforderlichen Details bereitgestellt werden, damit Ihr Team das Problem genau identifizieren kann.","Vielen Dank für Ihre Bereitschaft, weitere Details zu Ihrer Support-Anfrage zu übermitteln. Sie müssen eine neue Anfrage einreichen. Bitte antworten Sie direkt auf die ursprüngliche Support-Ticket-Nachricht und fügen Sie eine ausführliche Beschreibung des Problems bei, inklusive relevanter Schritte, Screenshots, Fehlermeldungen und kürzlicher Änderungen, die damit im Zusammenhang stehen könnten. Das hilft uns, das Problem so schnell wie möglich präzise zu diagnostizieren und zu beheben. Falls Sie eine Referenznummer des vorherigen Tickets haben, fügen Sie diese bitte ebenfalls bei. Sobald wir Ihre Nachricht erhalten haben,...",Incident,General Inquiry,medium,de,51,Support,Tech Support,Issue,Assistance,,,,
Request for Clarification on Billing and Payment Procedures,"Dear Customer Support Team,\n\nI hope this message reaches you well. I am writing to seek clarification about the billing and payment procedures associated with my account. I've noticed some inconsistencies in recent invoices and would like to understand the detailed breakdown of charges applied. Specifically, I am uncertain about the timing of payments, the accepted payment methods, and any potential fees that may be involved.\n\nAdditionally, it would be helpful if you could provide information about setting up automatic payments and the available payment plans. I am eager to understand these options.","Thank you for reaching out regarding your billing concerns, <name>. We understand how important it is to have clear and accurate billing information. To address the discrepancies you've mentioned, could you please specify which invoices or charges seem incorrect? This will help us review your account and provide a detailed breakdown. Our payment process generally involves online payments through credit card or bank transfer, with the due date indicated on the invoice. Please note that late fees may apply if payments are received after the due date.",Request,Billing and Payments,medium,en,51,Billing,Payment,Account,Clarification,,,,
Optimierungsvorschlag,"Sehr geehrtes Kundenserviceteam,\n\nich hoffe, diese Nachricht erreicht Sie wohlbehalten. Ich möchte eine Anfrage bezüglich der Implementierung und Anpassung der Verschlüsselungs-, Compliance- und Überwachungsprozesse für mehrere unserer Schlüsselprodukte und -dienstleistungen stellen. Dabei liegt der Schwerpunkt auf verschlüsselten USB-Drives, Outlook, Mesh-WLAN-Systemen sowie IoT-Geräten für Gesundheitsdatenintegrationen.\n\nAufgrund der kritischen Natur der Produkte, die sensible Daten verarbeiten, ist es essenziell, robuste Verschlüsselungstechnologien sicherzustellen, um unbefugten Zugriff und Datenverstöße zu verhindern. Zudem muss die Einhaltung branchenüblicher Standards und regulatorischer Anforderungen regelmäßig überprüft werden.","Vielen Dank für Ihre ausführliche Anfrage zu Verbesserungen im Bereich Verschlüsselung, Compliance und Überwachungsprozesse. Wir werden einen individuell zugeschnittenen Plan entwickeln. Dafür benötigen wir noch Klärung bezüglich der verwendeten Versionen der jeweiligen Produkte sowie der aktuellen Problempunkte und Prioritäten. Sobald wir diese Informationen erhalten, werden wir eine umfassende Strategie skizzieren, die Software- und Hardware-Updates, Zeitpläne und erforderliche Ressourcen umfasst.",Change,Product Support,low,de,51,Security,Product,Feature,IT,Tech Support,,,
Optimierung der Abläufe im Multi-Abteilungs-Marketing,"Sehr geehrtes Kundenservice-Team,\n\nich möchte mich erkundigen, inwieweit die Nutzung von Workflows im Multi-Abteilungs-Marketing durch fortschrittliche Datenanalysen und Automatisierung die zentrale Verwaltung von Konten verbessern kann. Das Unternehmen strebt an, die Koordination von Kampagnen zu optimieren und die Leistungsbewertung der Marketingkanäle zu verbessern. Ich bin der Ansicht, dass die Implementierung entsprechender Strategien die Gesamteffektivität im Marketing deutlich erhöhen könnte.\n\nBesonders interessiert bin ich an bewährten Methoden zur Integration von Datenanalyse-Tools, um Echtzeit-Einblicke für verschiedene Abteilungen zu ermöglichen. Außerdem wären Informationen zu Automatisierungstechniken hilfreich, um wiederkehrende Aufgaben zu vereinfachen.","Vielen Dank für Ihre Anfrage, <name>. Um Ihnen die relevanteste Beratung bieten zu können, könnten Sie bitte mitteilen, welche Analyse- und Automatisierungstools Ihr Team derzeit nutzt? Das wird uns dabei helfen, kompatible Lösungen zu empfehlen, bewährte Praktiken zu studieren und Fallstudien vorzuschlagen, die auf Ihre Umgebung zugeschnitten sind.",Request,Technical Support,high,de,51,Feature,Performance,Coordination,Automation,Marketing,Data Analysis,Workflow,
Urgent Device Failures,"Support Team, encountering numerous severe device failures including projectors, smart devices, firewalls, screens, and tablets. The issues seem related to network segmentation errors possibly caused by a cyber threat. Despite automated fixes, firewall reboots, and endpoint surveillance, full recovery has been achieved. Immediate help is needed to address connectivity issues and avoid service interruptions. Kindly advise the next steps promptly.","Thank you for reporting the urgent device failures and the measures already implemented. To assist you promptly, please provide details about the current situation. Confirm which devices are showing error codes or specific failure messages. Are the affected devices connected to physical or virtual network segments? Given the mention of a potential cyber attack, inform us if you have observed unauthorized access, unusual traffic, or ransom notes. Security measures should be prioritized.",Incident,Technical Support,high,en,51,Bug,Hardware,Network,Security,Disruption,Outage,,
Anfrage zu Best Practices für API-Integrationen bei der Verbindung externer Geräte,"Sehr geehrtes Support-Team,\n\nich hoffe, diese Nachricht erreicht Sie wohlbehalten. Ich wende mich an Sie, um detaillierte Hinweise zu den bewährten Methoden für die Integration unserer cloud-basierten SaaS-Plattform mit verschiedenen externen Geräten zu erhalten. Besonders interessiert bin ich an sicheren und effizienten Ansätzen, um verschlüsselte USB-Sticks, Webcams sowie intelligente Geräte mit unserer Plattform zu verbinden.\n\nUnser Ziel ist es, eine reibungslose Interoperabilität sicherzustellen und gleichzeitig die Datenschutz- und Leistungsanforderungen zu erfüllen. Daher wären Richtlinien, empfohlene Architekturmodelle und SDK-Informationen hilfreich. Zudem bitten wir um Bereitstellung von Beispielcodes und umfassende Dokumentationen zu Authentifizierung, Datenübertragung sowie empfohlenen Protokollen. Bitte geben Sie auch Auskunft über benötigte SDKs und Testwerkzeuge, inklusive Angaben zur Programmiersprache und Plattform.\n\nLassen Sie uns wissen, ob Sie ein Gespräch wünschen.","Vielen Dank für Ihre Anfrage zu Best Practices bei der Nutzung unserer verfügbaren APIs. Wir empfehlen die Verwendung unserer REST- und WebSocket-APIs, um eine sichere Verbindung externer Geräte wie verschlüsselte USB-Sticks, Webcams und Smart-Geräte zu gewährleisten. Bitte teilen Sie uns die bevorzugten Gerätetypen und Einsatzumgebungen mit, damit wir spezifische Kompatibilitätsdetails und Beispielcodes bereitstellen können. Unsere umfassenden Dokumentationen zu Authentifizierung, Datenübertragungsprotokollen sowie empfohlenen Architekturen stehen ebenfalls zur Verfügung. Für SDK-Informationen und Testwerkzeuge geben Sie bitte die Programmiersprache und Plattform an. Bei Fragen oder Wunsch nach einem Gespräch stehen wir gerne zur Verfügung.",Request,Technical Support,medium,de,51,Feature,IT,Tech Support,Security,,,,
Mehrere Geräte funktionieren nicht ordnungsgemäß,"Sehr geehrter Kundendienst,\n\nMehrere unserer Geräte sind in unseren täglichen Abläufen nicht einsatzfähig. Wir vermuten, dass die Ursache mit jüngsten Änderungen im Netzwerk- oder Stromsetup zusammenhängt und die Hardware beeinträchtigt. Grundlegende Troubleshooting-Maßnahmen wie Neustarts der Geräte und Überprüfung der Kabel wurden bereits erfolgreich durchgeführt. Wir würden eine schnelle Unterstützung bei der Lösung des Problems sehr schätzen.\n\nVielen Dank.","Vielen Dank, dass Sie uns wegen der Probleme mit mehreren Geräten kontaktiert haben. Um Ihnen besser helfen zu können, bitten wir Sie, die Modellarten der betroffenen Geräte sowie eventuelle Fehlermeldungen oder Hinweise auf kürzliche Änderungen im Netzwerk- oder Stromsystem mitzuteilen. Teilen Sie uns außerdem mit, ob das Problem auf bestimmte Geräte beschränkt ist. Falls Sie einen Anruf bevorzugen, geben Sie bitte eine geeignete Zeit und Telefonnummer an, unter der wir Sie erreichen können. Wir freuen uns auf Ihre Rückmeldung und darauf, das Problem zügig zu beheben.",Incident,Human Resources,low,de,51,Hardware,Network,Troubleshooting,Performance,,,,
Connecting Systems,"Dear Customer Support Team,\n\nI hope this message reaches you well. I am reaching out to request detailed instructions on integrating rule-based investment strategies with big data analytics platforms. Our organization is currently evaluating options for onboarding and wants to ensure a smooth integration process that aligns with our technical infrastructure and data analysis frameworks.\n\nSpecifically, I am interested in understanding the compatibility of our investment strategies with popular big data analytics tools and platforms such as Apache Hadoop, Apache Spark, and cloud-based solutions.","Thank you for your inquiry about integrating rule-based investment strategies with big data analytics platforms. Our platform provides RESTful APIs and detailed documentation that covers authentication procedures, data formats (mainly JSON and CSV), rate limitations, and error management. We support integrations with widely-used big data tools, including Apache Hadoop and Apache Spark, as well as various cloud-based analytics environments. Our systems are capable of managing real-time and batch processing workflows, enabling seamless data analysis and decision-making.",Request,Technical Support,high,en,51,Product,Feature,IT,Tech Support,,,,
Anfrage zur Klärung des Rückgabe- und Umtauschprozesses,"Sehr geehrtes Kundendienstteam,\n\nich hoffe, diese Nachricht erreicht Sie wohl. Ich schreibe Ihnen, um eine Klärung bezüglich des Rückgabe- und Umtauschprozesses meines kürzlich getätigten Kaufs zu erbitten. Die auf Ihrer Website verfügbaren Informationen habe ich geprüft, aber bestimmte Aspekte bleiben für mich unverständlich, beispielsweise die Voraussetzungen für Ansprüche, den Zeitrahmen für die Bearbeitung von Rückgaben und Umtausch sowie die Schritte, die ich bei meiner Anfrage befolgen muss.\n\nKönnten Sie bitte eine detaillierte Anleitung bereitstellen, die den gesamten Ablauf beschreibt? Besonders interessiert mich, welche Dokumente erforderlich sind und welche Artikel betroffen sind.","Vielen Dank für Ihre Kontaktaufnahme. Bitte teilen Sie uns Ihre Bestellnummer mit, damit wir Ihnen eine spezifische Rückgabe- und Umtauschanleitung für Ihren Einkauf zukommen lassen können.",Problem,Returns and Exchanges,low,de,51,Return,Refund,Product,Customer Service,,,,
Excel Formula Computation Issue,"Dear Customer Support Team,\n\nI hope this message finds you well. I am currently facing a problem with Microsoft Excel formulas in my spreadsheet not computing accurately. Despite verifying the formulas multiple times, the results are either incorrect or not updating when I change the input values as expected.\n\nI have attempted basic troubleshooting methods, such as ensuring that automatic calculation mode is active and restarting the application, but the issue remains. This problem affects my ability to work efficiently since I depend heavily on precise calculations.","Thank you for reaching out regarding the issue with Excel formulas not calculating properly. We understand how crucial accurate computations are and appreciate the troubleshooting steps you've already performed.\n\nSince you've confirmed that automatic calculation mode is enabled and you've restarted the application, the next step is to examine the spreadsheet for circular references, which can sometimes prevent formulas from updating correctly. To do this, go to the Formulas tab, select Error Checking, and then Circular References. If any are found, try resolving them accordingly.",Problem,Technical Support,low,en,51,Bug,Performance,Software,Documentation,,,,
Request for Product Swap,"Dear Customer Support Team,\n\nI am formally requesting to swap the product I recently bought, as it is causing problems that directly affect the operation of the SaaS platform. The product in question is vital for core functions, and its current condition is disrupting service delivery, leading to considerable inconvenience.\n\nFor context, I expected the product to integrate smoothly with my existing SaaS setup. However, shortly after deployment, I started experiencing unexpected errors and performance issues.\n\nThank you for addressing my request for a product exchange. To proceed, could you please provide the product name, serial number, purchase date, and a detailed description of the errors experienced? This information will help us speed up the process. Once received, please inform me of the necessary documentation and outline the next steps, including approximate timeframes for the exchange. If preferred, I am open to discussing this over the phone; kindly let me know a convenient time for a call. I appreciate your understanding of the urgency and your commitment to resolving this matter.","Thank you for reaching out regarding your product exchange request. To proceed, please provide the product name, serial number, purchase date, and a detailed description of the encountered errors. This information will help us expedite the process. Once we receive these details, we will guide you through the required documentation and outline the next steps, including estimated timelines for the exchange. If you prefer to discuss this over the phone, please let us know a suitable time for a call. We understand the urgency and are dedicated to resolving this issue promptly.",Incident,Returns and Exchanges,medium,en,51,Product,Support,Request,Disruption,,,,
Update regarding Marketing Agency Framework,"Dear Customer Support,\n\nI am reaching out to request a revision of our marketing agency framework. We aim to incorporate new technologies to enhance our current services, covering data-driven analytics and video user experience production. Additionally, improving our account management capabilities is a top priority to better serve our clients. We also intend to adopt growth hacking strategies, focus on emerging channels, and maintain a competitive edge through innovation. Kindly inform us of the necessary procedures to implement these changes and any support you can provide.","Thank you for your inquiry. Please specify the current agency structure and your desired timeline, so we can recommend specific steps and support options to assist you effectively.",Change,Customer Service,high,de,51,Feature,Feedback,IT,Tech Support,,,,
Request for In-Depth Details on Product Integration Procedure,"Dear Support Team,\n\nI hope this message finds you well. I am reaching out to inquire about comprehensive information regarding the product integration process. Our team is currently evaluating various options, and understanding the specific details of the product integration is crucial for making an informed decision.\n\nCould you please provide detailed information on the following aspects:\n\n1. Integration prerequisites: What are the technical requirements for integrating the product with existing systems? Are there any particular hardware or software dependencies we should be aware of?\n\n2. Supported platforms and environments: Could you specify which operating systems and environments are compatible with the product?","Thank you for your inquiry regarding the product integration process. To proceed, could you please specify which of our products you are interested in, as the integration details may vary? Generally, the integration requires a standard Windows, macOS, or Linux environment, supporting common browsers and programming languages such as Python, Java, and .NET. API documentation can be accessed via our developer portal; I will send you the link once you confirm your product interest. The typical integration timeframe is approximately three weeks, depending on system complexity. Technical support is available during our business hours.",Request,Technical Support,high,de,51,Product,Documentation,Support,Technical Support,,,,
Questions About Integration Methods and Onboarding of New Hardware and Software in SaaS Platform,"Dear Support Team,\n\nI hope this message reaches you well. I am seeking comprehensive details about the procedures and best practices for integrating new hardware and software components into a microservices-oriented SaaS environment. Our organization aims to improve our understanding of how to effectively incorporate various elements while ensuring system stability and scalability.\n\nIn particular, I am interested in learning the recommended steps your team advises for integrating new hardware devices and software modules. Additionally, any insights on tools and resources available for this process would be appreciated.","Thank you for reaching out. To provide you with customized guidance and resources, could you please specify the hardware and software you plan to integrate? Also, let us know your preferred contact method and whether you need detailed documentation or support.",Request,IT Support,medium,en,51,Product,Documentation,Integration,Hardware,Software,SaaS,Tech Support,
Seeking Assistance with Seamless Performance Marketing Analytics Integration,"Dear Customer Support Team,\n\nI am looking for comprehensive guidance on how to incorporate Performance Marketing Analytics into our existing NAS system to enable unified data access and detailed reporting. My aim is to optimize our operations by enhancing data-driven decision processes through effective system consolidation.\n\nCould you please outline the essential steps and configurations needed for a smooth integration? Moreover, I would appreciate recommendations on specific tools, APIs, or workflows suitable for this purpose. Your support is crucial to ensuring a successful connection.","Thank you for reaching out about integrating Performance Marketing Analytics with your NAS system for centralized data access and reporting. To provide precise advice, could you specify which Performance Marketing Analytics platforms you are utilizing and the version of your NAS system? Typically, integration involves connecting via APIs or data connectors supported by your platforms, and may require setting up secure data transfers such as SFTP or SMB for scheduled exports.",Request,IT Support,high,en,51,Feature,Performance,Analytics,Support,,,,
Analytics System Downtime,"Dear Customer Support,\n\nI am reporting a problem with the real-time analytics platform, which seems to be currently down. This disruption is affecting our capacity to observe and analyze live data flows, which are essential for our operations. I have observed the analytics dashboard updating, but attempts to refresh the data do not produce new results.\n\nCould you please provide an update on the status of this outage and an estimated time for resolution? Additionally, any information regarding the cause of the disruption would be helpful to understand its potential effects on our business functions.\n\nThank you.",Thank you for notifying us about the analytics system outage. Our team is actively investigating the issue and will provide an update soon with an estimated resolution timeframe. We appreciate your patience during this time.,Incident,Service Outages and Maintenance,medium,en,51,Outage,Disruption,Performance,Analytics,IT,Tech Support,,
Anfrage zur Klärung eines Vorfalls,"Sehr geehrtes Kundendienstteam,\n\nich hoffe, diese Nachricht erreicht Sie wohlauf. Ich kontaktiere Sie, um eine Klärung im Zusammenhang mit einem kürzlich aufgetretenen Vorfall zu erbitten. Leider sind die bisher bereitgestellten Informationen nicht vollständig genug, um die Situation vollständig zu verstehen. Ich würde Ihre Unterstützung bei der Bereitstellung weiterer Details sehr schätzen.\n\nKönnten Sie bitte zusätzliche Informationen zum Vorfall bereitstellen, einschließlich relevanter Zeitpunkte und der bisher ergriffenen Maßnahmen? Ebenso wäre es hilfreich zu wissen, ob noch laufende Konsequenzen bestehen und ob weitere Schritte meinerseits notwendig sind, um das Problem effizient zu lösen.\n\nVielen Dank im Voraus für Ihre Unterstützung.",Bitte stellen Sie detaillierte Informationen zum Vorfall bereit.,Incident,Customer Service,low,de,51,Support,Incident,Documentation,Feedback,,,,
