subject,body,answer,type,queue,priority,language,version,tag_1,tag_2,tag_3,tag_4,tag_5,tag_6,tag_7,tag_8
Dienstleistungen zur Datenanalytischen Investition,"Würden Sie mehr Details zu den Datenanalyseleistungen und deren Potenzial für die Optimierung von Investitionsstrategien geben? Es wäre toll, mehr über die verwendeten Werkzeuge und Techniken zu erfahren, um die Entscheidungen unserer Kunden zu unterstützen. Ich freue mich auf Ihre Rückmeldung und bin gespannt auf die zusätzlichen Details zu Ihren Dienstleistungen. Bitte teilen Sie mir die genauen Kontaktdaten zur Verfügung, damit wir uns am Telefon treffen können und die besten Möglichkeiten für Ihre Dienstleistungen besprechen können, um unsere Investitionsbedürfnisse zu unterstützen.","Sehr geehrte [Name], vielen Dank für Ihr Interesse an unseren Datenanalytischen Investitionsdienstleistungen. Unser Team verwendet fortschrittliche Werkzeuge und Techniken, um unseren Kunden verlässliche Investitionsstrategien zu bieten. Wir freuen uns darauf, die Details zu unseren Dienstleistungen zu besprechen und zusätzliche Informationen bereitzustellen. Bitte teilen Sie uns gezielt ein Gespräch am Telefon [Tel Nummer] mit, damit wir uns am besten geeigneten Zeitpunkt treffen und Ihre Investitionsbedürfnisse mit unseren Dienstleistungen unterstützen können.",Request,Customer Service,low,de,400,Feedback,Sales,IT,Tech Support,,,,
Verschlüsselung von medizinischen Daten in PostgreSQL,"Sehr geehrte Kundensupport, ich wende mich an Sie, um Informationen zur Verschlüsselung von medizinischen Daten in PostgreSQL zu erhalten, insbesondere im Zusammenhang mit Krankenhausaufgaben. Es wäre sehr hilfreich, Rat zur Umsetzung umfassender Sicherheitsmaßnahmen zu erhalten, um sensible Patientendaten zu schützen. Könnten Sie Empfehlungen zu Verschlüsselung, Zugriffskontrolle und Sicherungsvorgängen geben? Ich freue mich sehr auf Ihre praktischen Empfehlungen und danke Ihnen im Voraus für Ihre Unterstützung. Ich freue mich auf Ihre baldige Antwort.","Sehr geehrte [name], danke für Ihre Anfrage bezüglich der Verschlüsselung von medizinischen Daten in PostgreSQL im Zusammenhang mit Krankenhausaufgaben. Um sensible Patientendaten zu schützen, empfehlen wir die Umsetzung umfassender Verschlüsselungsmethoden, z.B. SSL/TLS für die Datenübertragung und die internen Verschlüsselungsfunktionen von PostgreSQL. Zugriffskontrolle ist entscheidend, indem wir den Zugang für autorisierte Mitarbeiter beschränken. Sicherungsvorgänge sollten regelmäßig durchgeführt werden, wobei sicherheitsreichliche Standorte für die gespeicherten Sicherungen vorgesehen sind. Wir freuen uns darauf, weitere detaillierte Empfehlungen und Praktiken zur Verfügung zu stellen. Vielen Dank für Ihre Unterstützung und wir freuen uns auf Ihre baldige Rückmeldung.",Request,Billing and Payments,medium,de,400,Bug,Security,IT,Tech Support,,,,
,"geehrte Kundenservice, ich möchte Sie auf die Notwendigkeit hinweisen, dass die Implementierung erweiterten Sicherheitsmaßnahmen bei medizinischen Daten in IT-Systemen und Geräten besonders wichtig ist. Es ist entscheidend, Patientendaten vor eventuellen Datenverlusten zu schützen. Bitte unternehmen Sie sofort die notwendigen Schritte, um die aktuellen Sicherheitsprotokolle zu überprüfen und zu verbessern. Dies umfasst die Sicherstellung, dass Geräte und Systeme mit den neuesten Sicherheitspatches aktualisiert sind und dass der Zugriff auf sensible Informationen nur für autorisierte Personale eingeschränkt ist. Ich glaube, dass es notwendig ist, die Vertrauensstellung der Patienten in Bezug auf den Schutz ihrer Daten aufrechtzuerhalten. Ich freue mich auf Ihre Rückmeldung.","geehrte <name>, wir danken Ihnen für Ihre Besorgnis bezüglich der Sicherheit medizinischer Daten. Wir verstehen die Bedeutung des Schutzes der Patientendaten vor potenziellen Datenverlusten. Wir werden die aktuellen Sicherheitsprotokolle überprüfen und bewerten, ob sie im Einklang mit den Branchenstandards stehen. Teil der Überprüfung wird die Aktualisierung der Sicherheitspatches für Geräte und Systeme sowie die Einschränkung des Zugriffs auf sensible Informationen für autorisierte Personale sein. Wir nehmen die Sicherheit der Patientendaten ernst und werden sofort die notwendigen Maßnahmen ergreifen, um potenzielle Schwachstellen zu beseitigen. Sie erhalten bald einen Aktualisierungsbericht.",Change,IT Support,medium,de,400,Security,IT,Tech Support,Performance,,,,
Problems with Digital Strategy Campaign Performance,"Our digital strategy campaigns are underperforming, resulting in reduced brand visibility and engagement. Despite adjusting our ad spend, the results have remained unchanged. We need assistance in enhancing our campaign targeting and ad creatives.",I would be pleased to help improve your digital strategy campaigns. Let's discuss and identify the best course of action. Could you please provide information on your current targeting and ad creatives? We can schedule a call at your earliest convenience to review the details of your campaigns.,Problem,Returns and Exchanges,medium,en,400,Performance,Feedback,Feature,IT,Tech Support,,,
Request for Information on Digital Strategies and Services,"Hello Customer Support, I am writing to inquire about the digital strategies and services your company offers to aid in brand growth. Could you provide more information on how your company approaches digital marketing services for your clients? I would greatly appreciate any detailed information you can provide about the strategies and services you offer. Thank you, I look forward to hearing from you at your earliest convenience.","Dear [Name], thank you for your inquiry regarding our digital strategies and services. We offer a range of services including social media management and content creation, all designed to help drive brand growth. We would be happy to discuss our approaches in more detail. Please let us know if you would like to schedule a call at a convenient time for you.",Request,Returns and Exchanges,low,en,400,Feedback,Sales,IT,Tech Support,,,,
Request for Updating Product Offerings,I am writing to request an update on product offerings integrations within our scalable SaaS platform. This update is aimed at improving project management efficiency to better serve our customers. I believe such an update is necessary to stay competitive in the market and to enhance the user experience. I would greatly appreciate if you could look into implementing the necessary changes soon.,Thank you for reaching out to us regarding the updates to product offerings integrations within our scalable SaaS platform. We appreciate your feedback and agree that it is essential to stay competitive and provide a better user experience. We will look into the matter and assess the necessary changes. Could you please provide specific details on the updates you are requesting? You can contact us at <tel_num> to discuss the needed changes.,Change,Sales and Pre-Sales,medium,en,400,Feature,Product,Feedback,IT,Tech Support,,,
Details zur Integration von Barcode-Scannern in unsere SaaS-Plattform,"Hallo, wir möchten mehr über die Integration von Barcode-Scannern in unsere SaaS-Plattform für das Projektmanagement erfahren. Könnten Sie uns bitte mehr Informationen zum Thema geben? Freuen uns darauf, Ihnen Dokumentation und Anleitungen zur Verfügung zu stellen, um den Integrationsprozess zu beginnen.","Sehr geehrte [name], vielen Dank für Ihr Interesse an der Integration von Barcode-Scannern in unsere SaaS-Plattform. Wir empfehlen Ihnen, sich im Support-Portal umzusehen, wo Sie die nötigen Dokumentation und Anleitungen zur Integration finden können. Falls Sie weitere Unterstützung benötigen, teilen Sie bitte ein günstiges Zeitfenster mit, und wir rufen Sie gerne an, um die nächsten Schritte zu besprechen. Mit freundlichen Grüßen, [acc_num]",Request,Customer Service,low,de,400,Feature,Documentation,IT,Tech Support,,,,
Hospital Systems Security Incident,Security breach identified in hospital systems.,We are taking immediate action to address the security breach in the hospital systems to protect patient data. Please call at your earliest convenience to discuss further. Kindly let us know a suitable time to contact you.,Incident,Product Support,medium,en,400,Security,IT,Tech Support,,,,,
Concern Regarding Investment Analysis Tool,"The investment analysis tool offers accurate forecasts of current market trends. However, it might be outdated due to flawed algorithms and improper dataset integration. After reviewing the data sources and attempting to recalibrate the system, the issues still persist. Please assist in resolving this issue as soon as possible.","We acknowledge the issue with the investment analysis tool and assure you that immediate action will be taken to address the problem. To better understand the issue and provide a prompt resolution, could you please provide details on the specific forecasts that are inaccurate and any error messages encountered? Additionally, we would like to schedule a call at your convenience to discuss this further. Please let us know a suitable time for contact at <tel_num>.",Problem,Customer Service,medium,en,400,Bug,Performance,Feature,Documentation,,,,
Inquiry About Data Analytics Services,Could you provide details on data analytics services that optimize investment strategies? Thank you.,We can provide information on data analytics services that optimize investment strategies. Please allow us to contact you at your convenient time to discuss the details.,Request,Customer Service,low,en,400,Feedback,Sales,IT,Tech Support,,,,
Strategies for Brand Growth,"Inquiring about Customer Support regarding digital strategies for brand growth services. Looking for detailed information on the services you offer to assist businesses in growing. Specifically interested in the approach to social media marketing, content creation, and search engine optimization. Would greatly appreciate if you could provide this information, along with case studies and testimonials from previous clients. Thank you for your assistance. Looking forward to hearing back soon.","Dear [Name], thank you for your interest in brand growth services. We offer customized digital strategies, including social media marketing, content creation, and search engine optimization, to help businesses grow. We would be happy to provide more details and share case studies from previous clients. We are available to call at your convenience to discuss further; please let us know a suitable time, and we can call you at [Tel Number] to explore our services and assist your business.",Request,Customer Service,medium,en,400,Feedback,Sales,IT,Tech Support,,,,
Required Assistance,"There has been an unauthorized access attempt on the hospital's system, which is causing concern about the security of medical data. We have reviewed and updated the security protocols.","Dear [name], we appreciate you bringing this to our attention and are glad to hear that the security protocols have been reviewed and updated. To further investigate the unauthorized access attempt, could you please provide us with the details of the incident, including the date and time it occurred? If necessary, we will schedule a call at your convenient time at <tel_num> to discuss this matter and ensure the security of medical data. Thank you.",Incident,Customer Service,medium,en,400,Security,IT,Tech Support,,,,,
