subject,body,answer,type,queue,priority,language,version,tag_1,tag_2,tag_3,tag_4,tag_5,tag_6,tag_7,tag_8
Support for Integrating Monday.com with Xcode,"I can provide comprehensive instructions for integrating Monday.com with Apple Xcode 12.5 and Android 12. Please specify the particular features you wish to connect with Monday.com via Xcode. Our team can supply detailed, step-by-step guidance along with the required APIs and software development kits. Including example screenshots would be helpful to clarify the process. If needed, we can also arrange a call at your preferred time to walk through the integration.","Dear Customer, \n\nI am happy to assist with integrating Monday.com with Apple Xcode 12.5 and Android 12. To ensure I provide the most accurate information, could you please specify which features you intend to connect with Monday.com through Xcode? Our team can offer detailed, step-by-step instructions along with the necessary APIs and software development kits to facilitate the integration. Including example screenshots can help illustrate the process more clearly. If you prefer, we can schedule a call at a convenient time to guide you through the setup.",Request,Customer Service,medium,en,52,IT,Tech Support,Documentation,Feature,,,,
Enhance Monday.com Integrations Now,Facing issues with Monday.com integrations and require assistance with macOS problems. I need help in optimizing Outlook and Python settings to improve data analytics performance. Could you please offer guidance? I have tried some methods already but haven't seen the desired results. I appreciate any help you can provide. Thank you for your assistance.,"I'm glad to help with issues related to Monday.com integrations on macOS. To better assist you, could you please provide details on the issues you're experiencing and the steps you've taken so far? We can then discuss and provide guidance on optimizing your Outlook and Python settings to improve data analytics performance.",Change,IT Support,high,en,52,Feature,Performance,Integration,Guidance,,,,
Wachstumsstrategien,"Sehr geehrter Kundenservice, ich wende mich an Sie, um Ratschläge zur Optimierung digitaler Strategien für das Markenwachstum über mehrere Technologieprodukte hinweg zu erhalten. Geschäftsinhaber möchten ihre Online-Präsenz ausbauen und verschiedene Tech-Produkte nutzen, um eine breitere Zielgruppe zu erreichen. Allerdings sind sie unsicher, welcher Ansatz am besten geeignet ist, um ihre Ziele zu erreichen. Können Sie detaillierte Anleitungen zur Optimierung digitaler Strategien für das Markenwachstum über mehrere Tech-Produkte hinweg bereitstellen? Wir schätzen Ihre Beratung und Empfehlungen sehr. Besonders interessiert sind wir an kohärenten Strategien.","Sehr geehrter <name>, vielen Dank, dass Sie den Kundensupport kontaktiert haben. Um das Markenwachstum durch die Optimierung digitaler Strategien über mehrere Tech-Produkte hinweg zu fördern, empfehlen wir, eine einheitliche Markenidentität zu entwickeln und Marketingmaßnahmen an den einzigartigen Merkmalen Ihrer Plattform auszurichten. Gerne stellen wir detailliertere Anleitungen und Empfehlungen bereit. Falls ein Anruf unter <tel_num> möglich ist, würden wir gern gemeinsam die Wirksamkeit Ihrer digitalen Strategien besprechen und evaluieren. Wir freuen uns darauf, Ihnen bei der Erweiterung Ihrer Online-Präsenz zu helfen.",Request,Technical Support,medium,de,52,Strategy,Digital,Growth,Technology,Business,Online Presence,,
Healthcare Systems Data Breach,"Customer Support, I am raising an urgent concern regarding data breaches affecting healthcare providers. Recently, there have been incidents where patient information security was compromised due to misconfigured hospital systems. Despite initial measures such as updating firewalls and conducting antivirus scans, the problem remains unresolved. It is crucial to address this issue promptly to safeguard sensitive patient data. I would appreciate it if you could investigate the matter and provide a solution to prevent similar breaches in the future.","<name>, thank you for bringing this critical issue to our attention. We take data security very seriously and will investigate the matter promptly. To better understand the situation, could you please provide details about the misconfigured hospital systems and the steps taken so far? We also need to know which specific healthcare providers are affected. Please contact us at <tel_num> to discuss the issue further and to receive guidance on implementing solutions to prevent future breaches. Let us know your earliest availability for a call.",Problem,IT Support,high,en,52,Security,Data Breach,Outage,Disruption,Recovery,,,
,Ich benötige Unterstützung bei der Anwendung von RapidMiner für Anlagestrategien in der finanziellen Datenanalyse. Können Sie eine detaillierte Anleitung und die verfügbaren Ressourcen bereitstellen?,"Gerne unterstütze ich Sie bei der Verwendung von RapidMiner für Anlagestrategien in der finanziellen Datenanalyse. Für eine ausführliche Anleitung empfehle ich, die offizielle RapidMiner-Dokumentation sowie das Community-Forum zu konsultieren, die umfassende Informationen für den Einstieg in die Nutzung der Plattform für Finanzanalysen bieten. Zusätzlich enthält unsere Website einen detaillierten Leitfaden mit Schritt-für-Schritt-Anweisungen zur Anwendung von RapidMiner bei Anlagestrategien. Wenn Sie möchten, können wir einen Termin vereinbaren, um den Prozess gemeinsam durchzugehen und spezifische Fragen zu klären. Bitte teilen Sie mir eine passende Zeit mit, um mich unter <tel_num> zu erreichen.",Request,Customer Service,high,de,52,Feature,Documentation,Support,Data Analysis,,,,
Unresponsive Digital Tools and Update Request,"The marketing team's digital platforms, such as Moodle, GitHub, and PowerPoint 2021, are not responding. The issue appears to be related to network software problems. After restarting devices and verifying internet connectivity, the problem remains unresolved. The team has attempted troubleshooting but has been unable to fix the issue. This unresponsiveness is causing substantial delays in ongoing projects. We would appreciate your assistance in resolving this matter promptly. Please advise us on any additional steps we should take.",Please look into the digital tools issue by contacting <tel_num>. Discuss troubleshooting procedures and arrange a call to resolve the problem as soon as possible.,Incident,IT Support,high,en,52,Network,Performance,Disruption,IT,Tech Support,,,
System Fails During Peak Hours,Users have reported that the system frequently crashes during busy periods.,"We are investigating the recurring reports of system failures from users. Could you please provide details of any error messages encountered and the times when crashes happen? Additionally, we need to know the operating system and software versions in use. We would like to arrange a call to discuss this issue further; please let us know your earliest available time at <tel_num> for a call.",Problem,Technical Support,high,en,52,Performance,Outage,Disruption,Recovery,,,,
Optimierung der Online-Marke,"Sehr geehrte Kundensupport, bitte geben Sie detaillierte Informationen über Methoden zur Verbesserung der digitalen Strategie, damit das Markenpräsenz und die Kundenengagementstiefe erhöht werden können. Insbesondere interessiert es uns, mehr über Sozialmedienkampagnen, Inhaltsmarketing und E-Mail-Marketingstrategien zu erfahren. Darüber hinaus möchten wir erfahren, wie Analytiktools genutzt werden können, um die Effektivität unserer Anstrengungen zu messen. Vielen Dank für Ihre Zeit und Ihr Engagement. Ich freue mich darauf, Ihre Antwort zu hören.","Sehr geehrte <name>, vielen Dank, dass Sie sich an unser Kundensupport-Team gewandt haben. Wir freuen uns, Ihnen detaillierte Informationen zur digitalen Strategie zur Verbesserung des Markenpräsenzes und der Engagementstiefe zu liefern. Wir werden Ihnen eine Kombination aus Sozialmedienkampagnen, Inhaltsmarketing und E-Mail-Marketing zur Verfügung stellen, um das Markenbewusstsein und die Kundeninteraktion zu erhöhen. Wir nutzen verschiedene Analytiktools, um die Effektivität unserer Bemühungen zu messen. Falls Sie ein Gespräch zum Diskutieren wünschen, geben Sie bitte in Kürze eine Zeit an und rufen Sie uns unter der Nummer <tel_num> an, um weitere Details zu besprechen.",Request,Billing and Payments,medium,de,52,Marketing,Digital Strategy,Social Media,Content Marketing,Email Marketing,Analytics,Customer Engagement,
Request for Assistance with Data Security Breach,"Recently, we identified a possible data breach due to unusual network activity. Our investigation indicates that outdated firewall configurations may have played a role in this incident. We promptly updated the firewall and ran a comprehensive system scan; however, the problem persists. We are worried about the potential exposure of sensitive patient information and seek your help to resolve this issue promptly. Could you please advise on the appropriate next steps to secure our network and safeguard sensitive data?","We are here to assist you with the data breach concern and want to assure you that your issue is being taken seriously. To better understand the situation, we would like to discuss the details over the phone at your earliest convenience. In the meantime, we recommend closely monitoring network activity and implementing additional security measures to prevent further breaches. We will guide you through the next steps to ensure your network remains secure and sensitive information is protected.",Problem,Technical Support,high,en,52,Security,Outage,Disruption,Recovery,,,,
Issue with Investment Tool,The Investment Optimization Tool crashes during data analysis.,Sorry for the issue with the Investment Optimization Tool. Could you please provide more details about the error message you receive when it crashes? I am happy to assist in resolving the problem. Let's schedule a call to troubleshoot and fix the issue.,Problem,Technical Support,high,de,52,Feature,Software,Investment,Analytics,Data Analysis,,,
,"Customer Support, I am expressing concerns regarding the digital strategies executed by the marketing agency. Despite our efforts, there has been an increase in brand visibility. I suspect the issue may lie in the campaign targeting or limited content variations. The current approach might not be effectively reaching the intended audience, leading to low engagement and brand awareness. I would appreciate it if you could review this matter and offer guidance on how to enhance the campaign targeting and overall digital strategy. Thank you for your time.","<name>, thank you for reaching out to us with your concerns about the digital marketing strategy. We will review your campaign targeting and provide guidance on how to improve it. To better understand your current approach, please share details about your target audience and the content variations in place. This will help us identify areas for improvement and suggest effective strategies for your business. Feel free to contact us soon to discuss further; we are available for a call at your convenience.",Problem,Customer Service,low,en,52,Feedback,Marketing,Campaign,Engagement,Strategy,Digital,Brand Visibility,
,"Customer Support, preparing a report on a critical incident that impacted the system. The problem caused a system outage affecting several products. The initial suspicion points to server overload or a configuration mistake. The team promptly took action by restarting services and closely monitoring logs for anomalies that could reveal the root cause. Despite these efforts, the issue remains unresolved. The situation is ongoing.",We received an email concerning the system outage. We are investigating the issue and offering assistance. Please provide detailed error messages and server logs analysis. Contact us at <tel_num> to discuss the next steps.,Incident,Sales and Pre-Sales,high,en,52,Outage,Disruption,Server Overload,Configuration,System Problem,Critical Incident,Service Log,Technical Support
Digital Campaign Platform Outage for Marketing Agency,"The digital campaign platform used by the marketing agency has encountered unforeseen downtime. I have restarted the services, cleared the cache, and reviewed the configurations, but the problem remains unresolved. The ongoing issue is disrupting operations.",Kindly provide further details to assist in resolving this issue.,Incident,Technical Support,medium,en,52,Outage,Disruption,Recovery,Maintenance,,,,
,interested in integrating RapidMiner into current data analytics infrastructure. currently utilize a variety of tools and platforms for managing and analyzing data. interested in leveraging RapidMiner to enhance these capabilities. would appreciate guidance on how to integrate RapidMiner into the existing infrastructure. please provide details on the technical requirements and potential challenges that may arise during the integration process.,"thank you for your interest in integrating RapidMiner into your existing data analytics infrastructure. to provide the best guidance, we would like to know more about your current setup. could you please provide us with information on the specific platforms and tools you are currently using? this will help us offer tailored advice on the technical requirements and the integration process. we can also discuss the potential challenges associated with this approach and find a convenient time to discuss this further over a phone call.",Request,Technical Support,high,en,52,Product,Feature,Documentation,Technical Support,,,,
Medical Data Security Solutions in Healthcare,"Customer Support is reaching out to inquire about healthcare solutions for securing medical data within hospital systems. Could you provide details on the types of solutions you offer, including encryption techniques, access control mechanisms, and network security protocols? We would also appreciate information regarding compliance certifications such as HIPAA. Furthermore, could you share case studies or examples of successful implementations of these solutions in healthcare environments? We are interested in understanding how your solutions help safeguard sensitive medical information.","<name>, thank you for your interest in healthcare solutions for securing medical data in hospital systems. We offer a variety of solutions, including encryption techniques, access control systems, and network security measures that are HIPAA compliant. We can also share case studies of successful implementations in healthcare settings. To provide more detailed information, please let us know a convenient time for a call at <tel_num>.",Request,Billing and Payments,low,en,52,Security,Data Privacy,Compliance,Encryption,Access Control,Network Security,,
Abrechnungsinformationen,"Interessiert an unserer SaaS-Projektmanagement-Software und den verfügbaren Zahlungsplänen. Könnten Sie eine detaillierte Aufstellung der Kosten sowie mögliche Rabatte bereitstellen? Zusätzlich wären Informationen zu kostenlosen Testversionen und Demos hilfreich, um eine fundierte Entscheidung darüber treffen zu können, ob diese Lösung den Bedürfnissen entspricht.","Sehr geehrter Kunde, wir danken Ihnen für Ihr Interesse an unserer SaaS-Projektmanagement-Software. Wir bieten verschiedene Zahlungspläne und Abrechnungsoptionen an. Gerne stellen wir eine detaillierte Kostenübersicht inklusive möglicher Rabatte bereit. Zudem bieten wir kostenlose Testversionen an. Bitte teilen Sie uns einen passenden Termin für ein Gespräch mit, um weitere Details zu besprechen und eventuelle Fragen zur Preisgestaltung zu klären.",Request,Billing and Payments,medium,de,52,Billing,Payment,Subscription,Discount,Test Version,Software,Project Management,Cost Analysis
Strengthened Security Protocols for Healthcare Facilities,"Customer Support is emphasizing the importance of adopting advanced security protocols within hospital systems to safeguard medical data. It is vital to ensure compliance with relevant regulations to protect sensitive patient information from unauthorized access. Implemented measures encompass data encryption, firewall deployment, and routine security assessments. Furthermore, offering training to hospital personnel on data protection practices is essential to prevent security breaches. We would appreciate your assistance in reviewing and providing guidance on implementing these enhanced security strategies for medical data management in hospital environments.","Please review and advise on implementing advanced security measures for hospital medical data, including data encryption and staff training.",Change,Technical Support,medium,en,52,Security,Healthcare,Data Protection,Compliance,Unauthorized Access,Patient Data,IT,
,"Customer Support, I am reaching out to request detailed instructions for integrating Cassandra 4.0 into a scalable SaaS project management platform. Could you please provide a step-by-step guide and direct me to the appropriate documentation? I would also appreciate information regarding compatibility, configuration, performance optimization, and integration procedures. Additionally, any advice on handling potential challenges and common pitfalls during the integration process would be very helpful. I look forward to your assistance in finding a solution that meets our requirements.","<name>, thank you for your interest in integrating the Cassandra 4.0 platform. For comprehensive, step-by-step instructions and relevant documentation, please visit our support website where we offer a dedicated integration guide. If you need further assistance, feel free to let us know a suitable time for a callback at <tel_num> to discuss your specific needs and provide personalized support.",Request,Customer Service,medium,en,52,Product,Documentation,Performance,Integration,Support,,,
Recurring Downtime and Performance Degradation Reported,"Customer Support team, I am bringing to your attention the recurring downtime and sluggish performance that users are experiencing on our SaaS platform. Despite initial efforts to resolve these issues by restarting services and increasing resource limits within the Kubernetes clusters, the problems continue. It is possible that improper resource allocation within the clusters is contributing to the slowdown. Your prompt attention to this matter would be highly appreciated to find a solution that guarantees the smooth functioning of the platform. Details of the issue are as follows.","<name>, we acknowledge the recurring downtime and performance issues on the SaaS platform. We will investigate resource distribution within the Kubernetes clusters to identify the underlying cause. Kindly provide <acc_num> with specific timestamps when the issues occur for analysis. Please contact <tel_num> to discuss the next steps and potential solutions to ensure the platform operates smoothly.",Incident,Technical Support,medium,en,52,Performance,Outage,Disruption,Recovery,,,,
Benötigte Unterstützung bei der Verbesserung von Anlagestrategien,"Sehr geehrter Kundenservice, ich möchte mich erkundigen, ob Ihre Datenanalyse-Services genutzt werden können, um Anlagestrategien zu optimieren. Könnten Sie bitte detaillierte Informationen zu den Arten der Analysen bereitstellen, die angeboten werden und wie diese bei Anlageentscheidungen angewendet werden können? Ich freue mich auf eine Anleitung, um die Dienste zu starten und Kunden bei der Nutzung zu unterstützen. Zudem interessiere ich mich für die Vorteile, die die Nutzung Ihrer Datenanalyse-Tools bei der Verbesserung von Anlagestrategien bietet. Vielen Dank für Ihre Zeit, ich freue mich auf eine baldige Rückmeldung.","Sehr geehrter <name>, vielen Dank, dass Sie den Support kontaktiert haben. Wir bieten verschiedene Datenanalyse-Services an, die bei der Optimierung von Anlagestrategien unterstützen können. Zu unserem Angebot gehören Portfolioanalysen und Markttrendprognosen. Ich schlage vor, einen Termin für ein Gespräch zu vereinbaren, um Ihre spezifischen Bedürfnisse zu besprechen und eine Anleitung zur Nutzung unserer Dienste zu geben. Bitte teilen Sie uns eine passende Zeit mit, unter <tel_num> können wir weitere Details besprechen. Wir freuen uns darauf, Sie bei der Verbesserung Ihrer Anlagestrategie zu unterstützen.",Request,Customer Service,low,de,52,Feature,Feedback,Support,Analysis,Improvement,,,
Report of Digital Tools Malfunction,Facing sporadic failures with digital tools.,Conduct an immediate investigation and get in touch promptly.,Incident,Technical Support,low,en,52,Bug,Performance,Disruption,Recovery,,,,
Integrationsproblematik,"Ein Finanzinstitut stößt auf Schwierigkeiten bei der Integration von Zoho CRM mit einem SQL Server für Investment-Analysen. Es wird vermutet, dass es einen Konflikt bei der Datensynchronisation gibt. Es wurden Dienste neu gestartet und API-Einstellungen überprüft, doch das Problem besteht weiterhin. Bitte unterstützen Sie bei der Lösung dieses Problems.","Bitte überprüfen Sie die Integrationsprobleme zwischen Zoho CRM und dem SQL Server. Um das Problem besser zu verstehen, könnten Sie bitte weitere Details zum Konflikt bei der Datensynchronisation bereitstellen? Wir möchten die genaue Fehlermeldung kennen und wissen, seit wann das Problem besteht. Falls notwendig, können wir einen Anruf vereinbaren, um die Lösung gemeinsam zu besprechen. Teilen Sie bitte eine passende Zeit mit, damit wir <tel_num> bezüglich des Kontos <acc_num> anrufen können.",Incident,Technical Support,medium,de,52,Integration,Server,Data Synchronization,Troubleshooting,System Issue,IT,Tech Support,
SaaS Scaling Manual,Is it possible to provide comprehensive documentation on effective scaling practices for a SaaS platform to manage increased traffic and user growth while maintaining performance?,send manual,Request,Product Support,medium,en,52,Documentation,Performance,Infrastructure,Scalability,Platform,,,
Google Translate API Integration for SaaS Project,Could you provide a detailed guide for integrating the Google Translate API into a scalable SaaS project management platform? I would like to understand the steps and requirements for the integration.,Please contact us for integration details.,Request,Customer Service,medium,de,52,Feature,Documentation,IT,Tech Support,,,,
Investment Optimization System Crash,"The data analytics platform responsible for investment optimization has experienced a crash, potentially due to conflicting recent software updates. After restarting the servers and reinstalling the essential applications, the issue was temporarily resolved.","Regarding the crash of the investment optimization data analytics platform, please provide the specific error message encountered. Confirm if recent software updates may be causing conflicts. I am available for a call at <tel_num> to discuss this issue further. Kindly inform me of a suitable time; I am happy to assist in resolving the problem, account number <acc_num>.",Incident,Technical Support,high,en,52,Crash,Performance,Software Update,IT,Tech Support,,,
Sudden Disruption in Healthcare Data Access,"Dear Customer Support, I am reporting a disruption in data access affecting multiple devices used by a healthcare provider. The possible causes might include network misconfiguration or a security breach. We have already taken initial troubleshooting steps such as rebooting devices, inspecting firewall settings, and verifying user permissions. Nonetheless, the problem persists and requires further assistance to resolve. Your prompt attention to this matter would be highly appreciated.",<name> received an email concerning a priority issue with healthcare data access disruption. We would like to gather additional information to assist further. Please provide details about the network configuration and security measures in place. We may need to schedule a call at <tel_num> to discuss this; kindly let us know your earliest availability for a call.,Incident,Customer Service,medium,en,52,Disruption,Network,Security,IT,Tech Support,,,
Marketing Firm Underperformed,"The digital marketing strategies employed by the agency did not succeed in enhancing brand expansion, potentially due to poor targeting. Despite modifying campaigns, the outcomes remained unchanged. Assistance is needed to address this problem and identify a new approach.","Assist with the issues encountered with the marketing firm. To better understand the situation, please provide details about the digital strategies used and the specific results you anticipated. Additionally, knowing the target audience, objectives, and brand growth goals would be beneficial. I would like to arrange a call to discuss this in more detail; please let me know your earliest availability and a suitable time to connect at <tel_num>.",Problem,Customer Service,low,en,52,Performance,Feedback,Marketing,Strategy,Agency,Campaign,,
Empfohlene Vorgehensweisen zum Schutz medizinischer Daten,"Könnten Sie Details zu bewährten Methoden zum Schutz medizinischer Daten in Krankenhaus-IT-Systemen bereitstellen? Es ist wichtig, die Vertraulichkeit, Integrität und Verfügbarkeit sensibler Patientendaten zu sichern. Hinweise zu Verschlüsselungstechniken, Zugriffskontrollmechanismen und Datensicherungsprozessen wären sehr willkommen.","Wir legen großen Wert auf den Schutz medizinischer Daten und gewährleisten Vertraulichkeit, Integrität sowie Verfügbarkeit. Zu den bewährten Praktiken zählen Verschlüsselungsmethoden, Zugriffsbeschränkungen und regelmäßige Datensicherungen. Detaillierte Informationen zu den Verfahren können wir gerne bereitstellen. Möchten Sie einen Anruf vereinbaren, um alles zu besprechen?",Request,Technical Support,high,de,52,Security,Data Privacy,Encryption,Confidentiality,Healthcare Data,Data Integrity,Data Availability,
