subject,body,answer,type,queue,priority,language,version,tag_1,tag_2,tag_3,tag_4,tag_5,tag_6,tag_7,tag_8
Support for SaaS Integration,"Customer Support is inquiring about integrating the scalable SaaS project management platform Xero with Magento 2.4. Could you supply detailed information regarding the integration process, including the necessary steps, prerequisites, and any potential limitations? We would also appreciate access to documentation resources that outline the integration procedure. Furthermore, we are interested in understanding any additional costs or fees involved in the integration. Our goal is to streamline project management and accounting workflows by implementing this integration.","We can assist with integrating the SaaS solution Xero into Magento 2.4. Please review the request and provide detailed information about the integration process, requirements, and any additional costs or fees associated with it.",Request,Customer Service,low,en,52,Feature,Documentation,IT,Tech Support,,,,
Support Required for Billing Concerns,"Facing billing difficulties across several healthcare products. Despite performing initial troubleshooting steps such as system restarts, the problem remains unresolved. I suspect the issue may be related to integration errors or outdated payment components. I would appreciate it if you could investigate this matter and offer a solution promptly. Please let me know if further details are needed to resolve the issue. I look forward to your response. Thank you for your time and assistance.",Please review the billing concern by contacting <tel_num> to discuss and provide a solution as soon as possible.,Problem,Billing and Payments,low,en,52,Billing,Payment,Support,Issue,Troubleshooting,Integration,Error,
,"Customer Support, I am interested in learning about investment optimization services that utilize data analytics. Could you provide detailed information regarding billing and payment options for these services? I would like to know the accepted payment methods, any discounts available for long-term commitments, and any additional fees associated with the services. I look forward to your response as I explore how these services can help optimize my investments. Thank you for your time and assistance. Sincerely, [Your Name]",We offer a variety of payment options and discounts for long-term commitments. Please feel free to give us a call at your convenience to discuss the details and address any questions you may have regarding our investment optimization services.,Request,Billing and Payments,medium,en,52,Billing,Payment,Discount,Service,Customer Support,Investment,Analytics,Long-term Commitment
,"Bitte melden Sie das Problem mit der Datenanalyseplattform und der Optimierung der Investitionen. Die Plattform ist unerwartet abgestürzt, möglicherweise infolge kürzlicher Softwareaktualisierungen. Nach einem ersten Neustart wurde ein Systemcheck durchgeführt, jedoch besteht das Problem weiterhin. Wir haben versucht, das Problem zu beheben, konnten es jedoch bislang nicht lösen. Wir schätzen, dass eine schnelle Problemlösung möglich ist, wenn wir weitere Details erhalten. Bitte informieren Sie uns, falls Sie zusätzliche Informationen benötigen, um das Problem zu beheben. Ich stehe zur Verfügung, um die notwendigen Details zu besprechen.","Untersuchen Sie das Problem der Datenanalyseplattform. Bitte stellen Sie Kontodaten, wie z.B. die Kontonummer, bereit, um eine schnellere Lösung zu ermöglichen. Rufen Sie uns an, um weitere Details zu besprechen.",Incident,Returns and Exchanges,medium,de,52,Crash,Performance,Outage,Maintenance,Software Update,,,
Anfrage zu SaaS-Projektmanagement-Details,"Ich interessiere mich für die SaaS-Projektmanagement-Software. Können Sie detaillierte Dokumentationen zu Integrationsmöglichkeiten bereitstellen? Ich möchte mehr über Skalierbarkeits- und Anpassungsoptionen erfahren. Bitte teilen Sie relevante Ressourcen und Anleitungen, die beim Verständnis und der Integration der Software in bestehende Systeme helfen.","Sehr geehrter <Name>, vielen Dank für Ihr Interesse an unserer SaaS-Projektmanagement-Software. Gerne stelle ich Ihnen detaillierte Dokumentationen und Informationen zu den Integrationsmöglichkeiten sowie Skalierbarkeits- und Anpassungsoptionen zur Verfügung. Erlauben Sie mir, Ihnen umfassende Ressourcen und Anleitungen zu senden, die bei der Integration der Software in Ihre bestehenden Systeme unterstützen. Bei weiteren Fragen stehe ich Ihnen gerne zur Verfügung. Vereinbaren Sie bei Bedarf einen Gesprächstermin, um spezifische Anliegen zu klären.",Request,Returns and Exchanges,low,de,52,Product,Documentation,Feature,Integration,Scalability,Support,,
Gesundheitstechnologielösungen,"Ich möchte Kontakt aufnehmen, um Informationen zu Sicherheitslösungen für Gesundheitsdaten sowie Integrationsdienste für Krankenhaus-IT-Systeme zu erhalten. Könnten Sie bitte Details mitteilen, wie Ihre Lösungen den Schutz, die Integrität und die Verfügbarkeit sensibler Patientendaten sichern? Ich schätze auch Informationen darüber, wie Ihre Dienste eine nahtlose Integration in bestehende Krankenhaus-IT-Systeme ermöglichen, einschließlich elektronischer Patientenakten und klinischer Anwendungen. Zusätzlich interessiere ich mich für etwaige Compliance-Zertifizierungen Ihrer Lösungen, beispielsweise HIPAA oder ICD-10. Bitte geben Sie einen umfassenden Überblick über Ihre Dienste.","Bitte senden Sie einen detaillierten Überblick über Ihre Lösungen zum Schutz von Gesundheitsdaten und deren Integration in Krankenhaus-IT-Systeme, einschließlich Informationen zu Compliance-Zertifizierungen wie HIPAA. Erläutern Sie, wie die Vertraulichkeit, Integrität und Verfügbarkeit sensibler Patientendaten gewährleistet werden. Für weitere Details können Sie mich per E-Mail kontaktieren oder anrufen, um die Angelegenheit persönlich zu besprechen.",Request,Customer Service,low,de,52,Security,IT,Tech Support,Data Privacy,,,,
Anfrage zur Integration der skalierbaren SaaS-Projektmanagementplattform mit Firebase,"Sehr geehrter Kundendienst, ich möchte mich erkundigen, ob die Firebase-Plattform in der Lage ist, eine skalierbare SaaS-Projektmanagementlösung zu integrieren. Können Sie detaillierte Richtlinien für die Integration bereitstellen? Ich bin daran interessiert, mehr darüber zu erfahren, wie Firebase genutzt werden kann, um das Projektmanagement-Erlebnis zu verbessern. Insbesondere möchte ich die erforderlichen Schritte kennen, um Firebase einzurichten, die notwendigen Berechtigungen zu konfigurieren und häufig auftretende Probleme im Integrationsprozess zu beheben. Zusätzlich freue ich mich über Ratschläge zu bewährten Praktiken, um die Leistung und Sicherheit der Projektmanagementplattform zu optimieren.","<name>, wir schätzen Ihr Interesse an der Integration der Firebase SaaS-Projektmanagementplattform. Um Ihre Anfrage zu beantworten, können wir bestätigen, dass die Firebase-Integration die Verbesserung des Projektmanagement-Erlebnisses unterstützt. Für die Einrichtung von Firebase sollten Sie zunächst ein Firebase-Projekt erstellen, das Firebase SDK installieren und die erforderlichen Berechtigungen konfigurieren. Wir empfehlen, die offizielle Dokumentation mit schrittweisen Anleitungen zum Integrationsprozess zu konsultieren. Zudem stellen wir eine Troubleshooting-Anleitung bereit, die häufige Probleme und deren Lösungen beschreibt.\n\nZur Optimierung der Leistung und Sicherheit Ihrer Projektmanagementplattform durch die Nutzung von Firebase schlagen wir vor, die empfohlenen Praktiken und Best Practices zu befolgen.",Request,Customer Service,medium,de,52,Security,IT,Tech Support,Product,Documentation,,,
Revise Support for Integration Updates,Drafting a request to enhance integration performance support across various products within a scalable SaaS project management system. Updating this is vital to maintain smooth operation and efficiency. Kindly provide an estimated timeline for the implementation. Please inform us if further details are required to assist with the process.,"<name> has received the request for integration updates to the SaaS project management platform, will review the requirements and provide an estimated timeline for deployment. For additional information, please contact <tel_num> via email.",Change,Product Support,high,en,52,Performance,Support,Integration,Product,Project management,Scalability,Implementation,
System Crashes During Peak Hours,"Experiencing frequent system crashes during peak times, potentially caused by resource shortages or integration conflicts. Services have been restarted and caches cleared, but issues persist. Assistance is needed to resolve the problem.","We received an email regarding system crashes during busy periods. To assist you further, could you please provide additional details such as error messages, steps you have taken so far? Would you like to schedule a call to discuss the issue in detail? Is <tel_num> a good number to reach you at a convenient time?",Problem,Product Support,high,de,52,Crash,Performance,Outage,Disruption,Recovery,,,
Integrating the Smartsheet Cloud-Based SaaS Platform,"Customer Support is reaching out to inquire about integrating the scalable Smartsheet SaaS project management solution. Could you supply detailed instructions on the process? I would like to understand the steps involved, any required configurations, and possible limitations. Additionally, I would appreciate information on managing data synchronization and security. Please provide a comprehensive guide with relevant resources. I look forward to your response as we explore integration options. Thank you for your time.","To assist with integrating the Smartsheet SaaS platform, please let us know a convenient time for a call to discuss the process requirements in detail.",Request,Technical Support,low,en,52,Product,Documentation,Security,IT,Tech Support,,,
,"Sehr geehrter Kundenservice, ich bitte um eine umfassende Dokumentation der bewährten Verfahren für die Integration von Kubernetes Smart-Licht in unsere skalierbare SaaS-Projektmanagementplattform. Derzeit befinden wir uns in der Planungs- und Implementierungsphase, um eine robuste Infrastruktur aufzubauen, die unsere wachsende Nutzerbasis unterstützt. Ich bin der Meinung, dass Kubernetes Smart-Licht eine entscheidende Rolle bei dieser Aufgabe spielen kann. Könnten Sie bitte verfügbare Ressourcen, Tutorials, Leitfäden und Fallstudien bereitstellen, um den Einstieg in die Integration zu erleichtern? Eine Unterstützung durch Anleitungen würde ich sehr schätzen, um einen reibungslosen und erfolgreichen Ablauf zu gewährleisten.","Sehr geehrter <name>, vielen Dank, dass Sie unser Support-Team kontaktiert haben. Wir schätzen Ihr Interesse an der Integration von Kubernetes Smart-Licht in unsere SaaS-Projektmanagementplattform. Gerne stellen wir eine allgemeine Dokumentation mit bewährten Verfahren für die Integration bereit. Für eine spezifischere Anleitung, die auf Ihr Projekt zugeschnitten ist, bitten wir Sie, uns weitere Details zu Ihrer aktuellen Infrastruktur und Ihren spezifischen Anforderungen mitzuteilen. Dies ermöglicht es uns, gezieltere Ressourcen und Unterstützung anzubieten. Falls erforderlich, können wir auch einen Anruf unter <tel_num> vereinbaren, um die Details zu besprechen. Wir freuen uns auf Ihre Rückmeldung.",Request,Human Resources,medium,de,52,Documentation,Infrastructure,Scalability,Project Management,Integration,Feedback,,
Issue with Hospital IT Systems,"Sehr geehrter Kundenservice, Gesundheitsdienstleister haben Schwierigkeiten beim Zugriff auf Daten in den Krankenhaus-IT-Systemen, möglicherweise infolge kürzlich durchgeführter Software-Updates. Ein Neustart des Systems sowie Antivirus-Scans wurden versucht, doch das Problem besteht weiterhin. Wir benötigen Unterstützung, um die Störung so schnell wie möglich zu beheben und die Patientenversorgung möglichst wenig zu beeinträchtigen. Bitte helfen Sie bei der Fehlerbehebung und stellen Sie eine Lösung für das Problem bereit. Wir schätzen Ihre rasche Aufmerksamkeit in dieser Angelegenheit und freuen uns auf eine baldige Rückmeldung.","Sehr geehrter <name>, vielen Dank, dass Sie sich mit dem Service-Desk wegen der Probleme mit den Krankenhaus-IT-Systemen an uns gewandt haben. Ich verstehe die Dringlichkeit, das Problem zu lösen und die Störungen in der Patientenversorgung zu minimieren. Um Ihnen besser helfen zu können, könnten Sie bitte weitere Details zu Fehlermeldungen oder Symptomen bereitstellen, die Sie erleben? Ich würde gerne einen Anruf vereinbaren, um die beste Vorgehensweise zur Behebung des Problems zu bestimmen. Wären Sie zu einem bestimmten Zeitpunkt für einen Anruf verfügbar? Bitte teilen Sie uns eine passende Zeit mit, wir werden Sie unter <tel_num> kontaktieren, um das Problem zügig zu besprechen.",Problem,Technical Support,medium,de,52,Security,Hardware,Performance,Outage,Disruption,IT,Tech Support,
Security Protocols Enhancement,"Customer Support, I am writing to draw urgent attention to the necessity of implementing advanced security measures for medical data within hospital systems across designated hardware and software platforms. Protecting medical information is of utmost importance, as any breach could lead to serious repercussions. Consequently, it is crucial to proactively adopt measures that secure sensitive data. I request immediate action to establish comprehensive security protocols, such as encryption, firewalls, and access controls, to ensure data safety.","<name>, thank you for contacting us regarding the need for improved security protocols for medical data in hospital systems. We take the protection of sensitive information very seriously and are dedicated to safeguarding it. We will review our current security measures and implement additional safeguards, including encryption, firewalls, and access controls. A detailed plan with a timeline for implementation will be provided. If necessary, you may contact <tel_num> to discuss this further. We appreciate your concerns and will address them promptly.",Change,Product Support,medium,en,52,Security,Hardware,Software,Outage,Disruption,,,
Probleme mit der Ausfallsicherheit der SaaS-Plattform,"Die SaaS-Plattform erfährt gelegentlich Unterbrechungen, wobei mehrere Integrationen betroffen sind. Kürzliche Updates könnten Konflikte bei der Kompatibilität verursacht haben. Das Problem wurde durch einen Neustart der Dienste und das Löschen der Cache-Dateien behoben. Für weitere Unterstützung und um das Problem dauerhaft zu lösen, wird zusätzliche Hilfe benötigt.","Wir untersuchen derzeit die Ausfälle der SaaS-Plattform, die Sie erleben. Um Ihnen besser helfen zu können, möchten wir einen Anruf vereinbaren, um das Problem im Detail zu besprechen. Bitte teilen Sie uns einen passenden Zeitpunkt für den Anruf mit. In der Zwischenzeit prüfen wir, ob die kürzlichen Updates möglicherweise Konflikte in der Kompatibilität verursacht haben, die zum Problem beitragen könnten. Wir arbeiten daran, das Problem so schnell wie möglich zu beheben und eine geeignete Lösung bereitzustellen.",Incident,Product Support,high,de,52,Bug,Outage,Disruption,Maintenance,Recovery,Support,,
Assistance with Data Analytics,"Customer support is seeking detailed instructions on how to utilize data analytics tools to enhance investment strategies efficiently. They are currently using the platform and believe they need proper guidance. Could you provide a step-by-step guide and share resources or best practices for using data analytics tools? Specifically, they want to learn how to identify trends, analyze market data, and make well-informed investment decisions.",Please provide guidance on how to effectively use data analytics tools. Kindly allow a call at your preferred time to discuss detailed instructions and best practices for optimizing investment strategies.,Request,Product Support,high,en,52,Product,Support,Documentation,Feedback,Trend,Market,Decision,
Report on Data Access Error,"Customer Service, please report that the healthcare provider has experienced data access errors affecting multiple systems, including IBM SPSS and Azure Elasticsearch. The issue began after a recent security update, which may have caused network authentication problems. Efforts to restart affected services and verify user credentials have not resolved the issue. These errors are disrupting hospital IT systems and causing operational disturbances. We kindly request assistance in resolving this matter promptly. Please advise on the next steps to resolve the problem.","<name>, we apologize for the data access issues impacting the hospital's IT systems. We understand the urgency of this matter and are ready to assist. To better investigate the problem, could you please provide additional details about the recent security update and whether you believe the cause is related to network authentication errors? Additionally, we would like to schedule a call at your earliest convenience to discuss further details. Is <tel_num> a suitable number to reach you? We look forward to working closely to resolve this issue swiftly and appreciate your cooperation.",Incident,Service Outages and Maintenance,high,de,52,Security,Network,Outage,Disruption,IT,Tech Support,,
Unusual Activity Affecting Healthcare System Data,"Currently encountering unusual activities that are interfering with the NAS-System SAP ERP. The issue might be caused by outdated antivirus programs. Attempts to resolve this by rebooting the systems, updating the software, and running Malwarebytes scans have not been successful. Assistance is needed to resolve this problem and prevent interruptions to healthcare services.","<name> will assist with the issue. To better understand the problem, please provide details about the suspicious activity being experienced. We would like to schedule a call at <tel_num> to discuss and arrange for a specialist to review the systems and antivirus software to resolve the issue as soon as possible.",Problem,Technical Support,high,en,52,Security,IT,Outage,Disruption,Virus,,,
Sicherheitsverletzung in IT-System des Krankenhauses,"Das IT-System des Krankenhauses hat eine Sicherheitsverletzung erlitten, bei der mehrere Produkte betroffen waren. Die Antivirus-Software wurde aktualisiert, die Systeme durchsucht und Passwörter geändert. Allerdings behält das Problem bestanden.","Wir sind besorgt über die Sicherheitsverletzung in Ihrem IT-System des Krankenhauses. Um Ihnen besser zu helfen, bitten wir um weitere Details zum Problem und bestätigen, dass die Aktualisierungen und Passwörteränderungen bestanden haben. Bitte vereinbaren Sie einen Anruf, um weitere Lösungen zu besprechen.",Problem,IT Support,high,de,52,Security,IT,Virus,Product,,,,
"Request for Documentation on SaaS Scalability, Practices, and Project Management Integration","Could you supply documentation detailing the scalability features, best practices, project management integration, and related information for the SaaS platform? I require comprehensive details on these topics.","<name> has received a request for documentation concerning SaaS scalability features, best practices, and project management integration. Please provide an in-depth guide that includes extensive information on these subjects. The guide should highlight key scalability functionalities, available integration options, and recommended project management practices. If there are specific questions or further clarifications needed, kindly let us know a suitable time for a call at <tel_num>. We are happy to assist with any information required regarding <acc_num>.",Request,Technical Support,high,en,52,Documentation,Feature,Scalability,Project Management,Integration,Best Practices,,
App Crash Reports,"Users frequently report app crashes on Android 12 and iOS following recent project updates, potentially caused by recent Terraform deployment errors. Attempts to resolve the issue by performing a quick rollback and clearing the cache have not prevented the crashes from continuing.","Received an email regarding app crash reports on Android 12 and iOS after recent project updates, possibly linked to recent Terraform deployment issues. Investigate the problem by contacting <tel_num> and discuss further troubleshooting steps or potential solutions.",Problem,IT Support,high,de,52,Crash,Performance,Bug,Outage,,,,
Urgent Data Security Assistance Needed,"A healthcare organization identified unauthorized access to patient information. It appears that the VPN-router's security configurations may have been compromised. Passwords have been reset, and firmware updates attempted, but the problem continues. Immediate help is essential to prevent data breaches and safeguard sensitive patient details. Kindly advise on further measures to implement. The team requires on-site support to resolve the issue.",Please review the case and contact <tel_num> to discuss potential on-site support options at <acc_num>.,Incident,Product Support,medium,en,52,Security,Outage,Disruption,Recovery,VPN,Firmware,Data Breach,
Scalability Capabilities and Best Practices,"Dear Customer Support, I am reaching out to inquire about the scalability capabilities of your SaaS platform. As our business expands, it becomes crucial for our software solutions to adapt to growing demands. Could you please provide comprehensive documentation on the implementation of scalability features and best practices? This information will help us better understand how to optimize our use of the platform to ensure smooth growth. Specifically, we are interested in guidance on managing increased traffic, data storage, and user administration. Additionally, we would appreciate any further information you can provide.","<name>, thank you for contacting us regarding the scalability features of our SaaS platform. We would be happy to supply detailed documentation on best practices for scaling. To assist you more effectively, we suggest scheduling a call at <tel_num> to discuss your specific needs and requirements, and to offer tailored guidance on managing traffic, data storage, and user management. Please let us know a convenient time for the call.",Request,Customer Service,medium,en,52,Performance,Feature,Documentation,IT,,,,
,"Customer Support, I am reaching out to request assistance with updating and optimizing the integration of multiple products within our SaaS project management platform. Our objective is to enhance scalability and overall performance. At present, the system is experiencing slowdowns and inefficiencies due to outdated integrations. We would be grateful for guidance on how to achieve smooth integration and improved performance. Could you please provide a detailed step-by-step plan or recommend a specialist who can assist us? We look forward to your prompt response.","<name>, we can assist with optimizing your SaaS project management platform. To better understand your needs, please share details about the current integrations and the specific slowdowns you're encountering. We can then provide a comprehensive step-by-step plan or recommend a specialist to help you achieve seamless integration and improved performance.",Change,Technical Support,high,en,52,Performance,Support,Integration,Scalability,Efficiency,System Slowdown,,
,Könnten Sie bitte umfassende Integrationsoptionen für Redis 6.2 in eine skalierbare SaaS-Projektmanagementplattform bereitstellen?,"Sehr geehrter Kunde, wir bieten verschiedene Integrationsmöglichkeiten für Redis 6.2 in unserer SaaS-Projektmanagementplattform, darunter API-basierte und Plugin-basierte Lösungen. Für detaillierte Informationen können wir gerne einen Anruf vereinbaren, um Ihre spezifischen Anforderungen zu besprechen und eine maßgeschneiderte Lösung anzubieten. Ist der Termin unter <tel_num> für Sie passend, oder bevorzugen Sie eine andere Zeit?",Request,Returns and Exchanges,low,de,52,Feature,Product,Scalability,Integration,Project Management,,,
,"Customer Support, I am reaching out to request an update on billing and payment options across various products. Our SaaS project management platform is expanding quickly, and we need to enhance scalability. At present, our billing system is disjointed, which complicates payment management and tracking. I would like to request a unified billing system that can handle multiple products and payment methods. This would significantly improve our financial management and simplify the payment process for customers.",We will review your request for a consolidated billing system and will provide guidance on implementation options shortly.,Change,Billing and Payments,low,en,52,Billing,Payment,Product,Feature,Performance,IT,Tech Support,
Preisinformationen,"Könnten Sie bitte eine detaillierte Übersicht der Preis- und Abrechnungsoptionen für die Nutzung des KNIME Docker Bereichs in der Finanzdatenanalyse bereitstellen? Ich benötige eine umfassende Aufschlüsselung der Kosten, um mein Projekt entsprechend zu planen.","Gerne stelle ich eine detaillierte Übersicht der Preis- und Abrechnungsoptionen für die Nutzung des KNIME Docker Bereichs in der Finanzdatenanalyse bereit. Bitte erlauben Sie mir, einen passenden Zeitpunkt für einen Anruf zu vereinbaren, um Ihre spezifischen Anforderungen zu besprechen und eine umfassende Kostenaufstellung zu geben. Wäre der Anruf unter <tel_num> zu Ihrer bevorzugten Zeit möglich?",Request,Billing and Payments,high,de,52,Billing,Price,Payment,Cost analysis,,,,
