subject,body,answer,type,queue,priority,language,version,tag_1,tag_2,tag_3,tag_4,tag_5,tag_6,tag_7,tag_8
Sicherheitsupdate für medizinische Dokumente,"Sehr geehrter Kundendienst, ich möchte eine Aktualisierung unserer aktuellen Sicherheitsmaßnahmen anfordern, um den Schutz medizinischer Unterlagen in den Krankenhaus-IT-Systemen zu verbessern. Es ist von größter Bedeutung, die Sicherheit und Integrität der Patientendaten zu gewährleisten. Daher bitte ich um die Umsetzung folgender Maßnahmen: Einführung der Multi-Faktor-Authentifizierung, regelmäßige Sicherheitsüberprüfungen sowie die Verschlüsselung sensibler Daten. Außerdem würde ich gerne ein Treffen mit dem Team vereinbaren, um den aktuellen Stand unserer Sicherheitsmaßnahmen zu besprechen.","Anfrage für die Verbesserung der Sicherheitsprotokolle bei medizinischen Unterlagen in den Krankenhaus-IT-Systemen erhalten. Ein Treffen mit dem Team wird vereinbart, um die Implementierung der Multi-Faktor-Authentifizierung, Sicherheitsüberprüfungen und die Datenverschlüsselung zu besprechen. Bitte kontaktieren Sie <tel_num>, um einen passenden Termin zu vereinbaren und weitere Details bezüglich <acc_num> zu klären.",Change,Billing and Payments,low,de,52,Security,Product,Feature,Documentation,,,,
Issue with Service at Marketing Agency,"The marketing agency experienced a significant service outage, which affected the delivery of their digital strategy. The probable cause was server overload. Initial troubleshooting steps included restarting the server and conducting network diagnostics, but the problem persists. The team is actively working to resolve the issue as quickly as possible. In the meantime, we recommend checking for updates on social media channels. If you have any questions or concerns, please do not hesitate to contact us. We apologize for any inconvenience caused and thank you for your patience and understanding.","<name>, I am writing to confirm receipt of your email regarding the issue with the service at the marketing agency. I understand that the team has already taken initial troubleshooting measures, including restarting the server and performing network diagnostics, but the problem remains unresolved. I appreciate your suggestion to check social media channels for updates and will do so. However, I would like a more detailed update on the current status of the issue and an estimated time for resolution. If necessary, I am open to a phone call for further clarification. Could you please specify a suitable time to reach <tel_num>?",Incident,Service Outages and Maintenance,high,de,52,Outage,Disruption,Network,Server,Performance,IT,Tech Support,
Request for Assistance with Marketing Strategies,"Customer support has observed that recent digital marketing campaigns have experienced low engagement levels. It appears that the current targeting methods may be outdated, which could be causing a disconnect with the intended audience. Despite efforts to optimize the advertisements, the results have shown only slight improvements. This situation raises concerns about potential negative impacts on the brand's visibility and sales. We would highly value any guidance or recommendations from your team to help us overhaul our targeting approach.","<name>, I acknowledge your email regarding the low engagement in recent digital campaigns and want to offer our support. Our team would be pleased to assist in restructuring your targeting strategies to boost engagement. To better understand the current situation and provide customized advice, could you please share details about your target audience and the optimization efforts undertaken thus far? Additionally, knowing your specific goals for these digital campaigns would be helpful. If convenient, I would like to arrange a meeting to discuss this further.",Incident,Returns and Exchanges,low,en,52,Feedback,Marketing,Campaign,Performance,Strategy,,,
Digital Campaigns Are Significantly Underperforming,"Customer support team, I am reaching out regarding the digital campaigns that are not meeting the anticipated performance standards. Despite reviewing the campaign configurations and recent modifications, the problem continues. There may be targeting or execution errors that require correction. I would appreciate it if you could examine this matter and offer guidance on how to enhance the performance of these digital campaigns. Please let me know if you need any additional information to resolve the issue. I look forward to your prompt response. Thank you.",Please review the digital campaigns and investigate potential targeting or execution errors. Kindly provide the account number and campaign names to assist with the investigation.,Incident,Product Support,medium,en,52,Performance,Outage,Disruption,Recovery,Technical Support,,,
Sicherheitsaspekte der WeChat-Integration,Könnten Sie bitte umfassende Sicherheitsrichtlinien und bewährte Verfahren für die Integration von WeChat in die IT-Systeme des Krankenhauses bereitstellen?,"Bitte stellen Sie die detaillierten Sicherheitsrichtlinien für die WeChat-Integration in die Krankenhaus-IT-Systeme zur Verfügung. Das Sicherheitsteam wird die Dokumente mit den besten Praktiken und Protokollen senden. Sollten Sie weitere Fragen zum Integrationsprozess haben, können wir gerne einen Anruf vereinbaren, um diese zu klären.",Request,Technical Support,high,de,52,Security,IT,Tech Support,,,,,
Regelmäßige Timeout-Fehler auf der SaaS-Plattform gemeldet,"Sehr geehrter Kundenservice,<br><br>wir möchten Ihre Aufmerksamkeit auf ein Problem lenken, das unsere Nutzer bei der Verwendung unserer SaaS-Plattform erleben: wiederholte Timeout-Fehler. Dieses Problem tritt insbesondere während Stoßzeiten auf, was wir auf eine mögliche Serverüberlastung zurückführen.<br><br>Zur Behebung des Problems haben wir den Server neu gestartet und die Anzahl der Instanzen erhöht. Trotz dieser Maßnahmen besteht das Problem weiterhin. Kunden berichten weiterhin von Timeouts, was ihre Produktivität beeinträchtigt.<br><br>Wir bitten Sie, die Angelegenheit dringend zu prüfen und eine Lösung zu finden, um zukünftige Vorfälle zu vermeiden.","Sehr geehrter <name>,<br><br>vielen Dank, dass Sie uns bezüglich der häufigen Timeout-Fehler auf unserer SaaS-Plattform kontaktiert haben. Wir entschuldigen uns für die Unannehmlichkeiten, die dadurch für unsere Kunden entstehen. Unser Ziel ist es, die Angelegenheit schnell zu untersuchen und eine geeignete Lösung zu finden.<br><br>Bitte senden Sie uns weitere Details zu den Fehlermeldungen, die Ihre Kunden erhalten, sowie die genauen Zeitpunkte, zu denen die Timeouts auftreten. Außerdem würden wir gern mehr über die Änderungen erfahren, die an den Serverinstanzen vorgenommen wurden.<br><br>Falls erforderlich, können wir auch einen Anruf unter <tel_num> vereinbaren, um die Situation zu besprechen und möglicherweise temporären Zugriff zu gewähren.",Problem,Technical Support,high,de,52,Bug,Performance,Outage,Disruption,Recovery,,,
Digital Strategy Enhancement,"Dear Customer Support Team,\n\nI am writing to request an update on the digital strategy tools order aimed at improving our marketing agency's brand development and campaign efficiency. The existing tools are outdated and do not offer the insights capabilities necessary to compete effectively in today's rapidly evolving digital environment.\n\nWe are seeking to implement new tools that will enable us to better monitor campaign performance, analyze our target audience, and develop engaging content. Specifically, we are interested in tools that can assist with these objectives.\n\nThank you for your assistance.",Please review the request by contacting <tel_num> to schedule a meeting where we can discuss available tools and integration options.,Change,IT Support,medium,en,52,Feedback,Product,Feature,Documentation,,,,
,Users have reported experiencing performance problems and outages across several products. Recent updates to the platform might be responsible for causing system overloads. Restarting services and clearing caches have temporarily resolved the issue. Further investigation is required to determine the underlying cause.,We have received reports of performance issues and outages affecting multiple products. The matter has been escalated to the technical team for further investigation to identify the root cause. Kindly provide details of recent platform updates and any steps already taken. A call can be scheduled at <tel_num> to discuss the situation further.,Incident,Technical Support,high,en,52,Performance,Outage,Disruption,Recovery,Bug,,,
Support erforderlich wegen Plattformabsturz,"Sehr geehrter Kundenservice, ich möchte ein Problem mit der Investitionsoptimierungsplattform melden. Während der Stoßzeiten stürzte die Plattform ab, vermutlich aufgrund einer Datenüberlastung durch mehrere integrierte Produkte. Ich habe bereits Troubleshooting-Maßnahmen wie Systemneustart, Cache-Löschen und Software-Updates durchgeführt, doch das Problem besteht weiterhin. Trotz dieser Bemühungen bleibt die Plattform instabil, da die Datenmenge nicht bewältigt wird. Wir würden eine schnelle Unterstützung bei der Lösung des Problems sehr schätzen, da die Abläufe beeinträchtigt sind. Könnten Sie bitte eine Lösung prüfen und eine Anleitung für das weitere Vorgehen bereitstellen? Ich stehe für weitere Informationen zur Verfügung.","Sehr geehrter <Name>, vielen Dank, dass Sie uns bezüglich des Problems mit der Investitionsoptimierungsplattform kontaktiert haben. Wir entschuldigen uns für die Auswirkungen auf Ihre Abläufe. Unser Ziel ist es, eine schnelle Lösung für das Problem zu finden. Bitte stellen Sie uns weitere Informationen bereit, einschließlich etwaiger Fehlermeldungen, der genauen Schritte, die Sie bisher unternommen haben, sowie die Version der Plattform. Es wäre auch hilfreich zu wissen, wie die Datenmenge während der Stoßzeiten verarbeitet wird. Wir werden die Informationen prüfen und eine Lösung sowie eine Anleitung für das weitere Vorgehen bereitstellen. Falls notwendig, können wir auch einen Anruf planen.",Problem,Technical Support,high,de,52,Crash,Outage,Performance,Disruption,Recovery,IT,Tech Support,
,Enhance investment approaches using sophisticated data analytics technologies.,Thank you for your email. I am interested in discussing how data analytics tools can assist in optimizing investment strategies. Please share details about your current investment objectives so I can better support you.,Change,Technical Support,medium,en,52,Feature,Data Analytics,Technology,Investment,,,,
,"The company encountered system performance issues impacting multiple products due to network congestion caused by intensive data analytics operations. Initial troubleshooting steps included rebooting systems and applying software updates to affected devices. Despite these efforts, the performance problems continued, disrupting the efficiency of processing investment data. We require support to address and resolve these issues to guarantee prompt and precise data handling.","We seek assistance with system performance issues affecting various products stemming from network congestion. To better understand the problem and develop an effective solution, please provide details about the network infrastructure and the specific data analytics tasks that are causing the overload. Additionally, sharing any error messages or symptoms experienced would be helpful. We can arrange a call at your convenience to discuss the situation and work towards a resolution that ensures timely and accurate processing of investment data. Kindly let us know your availability.",Incident,Technical Support,high,en,52,Performance,Network,Outage,Disruption,Recovery,,,
IT-Disruptions in the Healthcare System,"Dear Customer Service, we are experiencing IT disruptions that are affecting multiple devices and software within the healthcare system. The issue appears to be caused by a network configuration error. Our initial troubleshooting included restarting switches and verifying device connections. However, the problem persists, and we require additional assistance to resolve it. We would appreciate guidance on the next steps. Please let us know if you need further information to assist with troubleshooting. We look forward to your prompt response.","<name>, thank you for reaching out regarding the IT disruptions in the healthcare system. We understand the urgency and are committed to resolving the issue. To assist you further, could you please provide more details about the network configuration and device connections? If necessary, we can arrange a call to discuss the problem in more detail. Is there a suitable time for a call? Please share a convenient time at <tel_num>.",Incident,Technical Support,low,de,52,Disruption,Network,IT,Tech Support,,,,
,"Customer Support, preparing a report on the digital tools used by the marketing agency, including Shopify, Firebase, and BigCommerce, which are not performing as expected. We suspect there might be an integration glitch leading to data synchronization problems. Despite efforts to clear cache, update the software, and restart the WLAN router, the issue persists. Our team has attempted troubleshooting, but the issues remain unresolved. We would greatly appreciate your assistance in identifying the root cause and providing a solution to optimize these digital tools.",Please review the issue and contact <tel_num> to discuss and gather additional information to facilitate the investigation.,Problem,Technical Support,medium,en,52,Bug,Performance,Network,Disruption,Recovery,IT,Tech Support,
,"Sehr geehrter Kundenservice, ich kontaktiere Sie, um Sie darüber zu informieren, dass ein Gesundheitsdienstleister ungewöhnliche Zugriffsversuche auf medizinische Daten festgestellt hat, was auf einen möglichen Phishing-Angriff hindeuten könnte. Unsere erste Reaktion bestand darin, die Firewall-Regeln zu aktualisieren und die Überwachung zu erhöhen. Glücklicherweise wurden bisher keine Datenverletzungen festgestellt. Wir nehmen diese Angelegenheit sehr ernst und arbeiten daran, die Sicherheit unserer Systeme zu gewährleisten. Wir werden Sie über weitere Entwicklungen auf dem Laufenden halten. Bitte lassen Sie uns wissen, falls Sie Fragen oder Bedenken haben. Wir schätzen Ihre Aufmerksamkeit und Ihr Anliegen sehr.","Sehr geehrter <Name>, wir danken Ihnen für die schnelle Benachrichtigung bezüglich eines möglichen Phishing-Angriffs auf unsere medizinischen Datensysteme. Es freut uns zu hören, dass die ersten Maßnahmen wie die Aktualisierung der Firewall-Regeln und die erhöhte Überwachung bereits getroffen wurden und bisher keine Datenverletzungen aufgetreten sind. Der Schutz unserer Systeme und sensibler Daten ist uns äußerst wichtig. Wir bitten Sie, uns weitere Informationen über die Art der ungewöhnlichen Zugriffsversuche sowie die bisher ergriffenen Maßnahmen zukommen zu lassen, um die Sicherheit unserer Systeme weiterhin zu gewährleisten. Könnten Sie uns bitte detailliertere Angaben machen?",Incident,Returns and Exchanges,low,de,52,Security,Data Breach,Phishing,Firewall,Monitoring,,,
Assistance Needed for Technical Issue,"Dear Customer Support Team, I am reporting a problem with the data analytics platform. The platform is experiencing sluggish performance when processing reports, likely due to outdated Python 3.9 libraries. Our team has tried updating dependencies and restarting the affected servers, but the problem remains. We would be grateful for guidance on resolving this issue. Could you please offer troubleshooting advice or suggest possible solutions? I am available to provide further details or context if necessary. Thank you for your time.",Please review the issue and contact <tel_num> to discuss troubleshooting procedures and explore potential solutions for the slow processing problem on the data analytics platform.,Incident,Technical Support,medium,en,52,Performance,Bug,Technical Support,,,,,
Data Security Incident Notification,"We are informing you that our healthcare provider has experienced a potential data security incident affecting several systems. The cause of the disruption is currently unknown, but it is suspected to involve malware and unauthorized access. Our team has initiated preliminary malware scans and firewall inspections. We are taking immediate measures to contain and resolve the issue. We will keep you updated as more information becomes available.","Dear Customer, we apologize for the potential data security incident impacting our healthcare provider and multiple systems. Our team has already taken initial steps to contain the situation, including malware detection and firewall reviews. We are continuing our investigation and working to resolve the issue as quickly as possible. We will provide updates as new information emerges. If you have any concerns or wish to discuss this matter further, please let us know a convenient time to call you at <tel_num> regarding your account <acc_num>.",Incident,Technical Support,high,en,52,Security,Disruption,Malware,IT,Notification,,,
Assistance Required for Digital Marketing,Current digital marketing strategies are not yielding the anticipated growth for the brand. Potential issues could be ineffective targeting and outdated content strategies. Efforts to review analytics and adjust campaigns have not shown improvements. Assistance is needed to enhance brand growth.,Please review your digital marketing strategies and contact us at <tel_num> to discuss potential solutions and the next steps for improving brand growth.,Problem,Technical Support,medium,en,52,Marketing,Strategy,Analytics,Campaign,Content,Growth,Brand,
Medical Data Security Concern,"Customer support is facing sporadic access problems that are affecting the security of medical data and disrupting hospital operations. Potential causes include a failure of the RAID controller combined with antivirus software conflicts. Troubleshooting steps such as firmware updates, antivirus scans, and system reboots have been attempted but did not resolve the issue. The problem continues to pose risks to the overall functionality of medical data and hospital systems. We would appreciate your assistance in addressing this matter.",We are happy to help resolve this issue. Please provide your account number and contact details so we can investigate further. We may need to schedule a call at a convenient time to discuss the next steps for resolving the RAID controller failure and antivirus conflicts affecting medical data security and hospital operations.,Problem,Product Support,low,en,52,Security,IT,Tech Support,Disruption,,,,
Network Assistance Request,"The connectivity of the Ubiquiti UniFi Dream Machine antenna has been lost, affecting digital campaign operations. There may be conflicts with the network firmware. Devices have been restarted and firmware has been updated, but the problem remains. We require support to resolve this issue.","Dear Customer, we apologize for the inconvenience caused by the lost connectivity of the Ubiquiti UniFi Dream Machine antenna, which is impacting your digital campaign management. We understand that you've already attempted to restart the devices and update the firmware, but the problem persists. To assist with troubleshooting potential network firmware conflicts, could you please provide details of any error messages you are encountering and the current firmware version? We would also like to arrange a call to discuss the issue further. Please let us know your availability for a call.",Incident,Product Support,medium,en,52,Network,Support,Firmware,Hardware,Connectivity,,,
Guide to Integrating Alteryx with MySQL,"Customer Support team seeks detailed instructions on how to integrate Alteryx with MySQL to enhance investment data analytics. The team faces challenges in streamlining their processes and believes that a comprehensive guide would significantly improve their workflow. Specifically, they want to learn how to connect Alteryx to a MySQL database, develop data models, and create reports and dashboards. Additionally, they would appreciate practical examples and best practices for common use cases involving Alteryx and MySQL. Looking forward to your assistance.","<name>, I will provide a detailed guide on integrating Alteryx with MySQL. To better support you, please schedule a call at <tel_num> to discuss your specific requirements. Alternatively, I can send you a step-by-step tutorial on connecting Alteryx to a MySQL database and creating data models. Kindly let me know which option you prefer. I am happy to assist you in optimizing your investment data analytics.",Request,Product Support,high,en,52,Documentation,Support,Data Integration,Analytics,Workflow,Database,Report,Dashboard
Digital Campaign Not Meeting Expectations on Various Platforms,"Customer Support, I am reaching out to highlight a critical concern regarding our marketing agency's multi-product digital campaign. Although we had high expectations initially, the campaign is underperforming unexpectedly. We have tried rebooting the system and conducting preliminary diagnostics, but the problem persists. The subpar results might be due to integration issues among different platforms. We would greatly appreciate your assistance in identifying the root cause and providing an appropriate solution to resolve this matter.",Please review the campaign issues by contacting <tel_num> to arrange a convenient time for investigation and resolution of the integration challenges across the digital platforms.,Incident,Product Support,high,en,52,Performance,Disruption,Feedback,IT,Tech Support,,,
Optimierung der Datenanalysefähigkeiten,"Sehr geehrter Kundenservice, ich möchte die Verbesserung der Datenanalysetools unserer Finanzfirma beantragen, die für Investitionsentscheidungen genutzt werden. Vielleicht ist bekannt, dass die Datenanalyse im Finanzsektor eine entscheidende Rolle spielt, da sie Unternehmen ermöglicht, fundierte Entscheidungen zu treffen und der Konkurrenz voraus zu sein. Derzeit sind die Fähigkeiten der Datenanalysetools begrenzt, was es erschwert, Anlagestrategien zu optimieren und datenbasierte Entscheidungen zu treffen. Meiner Meinung nach würde die Verbesserung unserer Datenanalysetools erheblichen Einfluss auf die Leistung und Rentabilität unseres Unternehmens haben. Durch verbesserte Datenanalysen könnten wir effizienter arbeiten und bessere Ergebnisse erzielen.","Sehr geehrter <name>, wir haben Ihre Anfrage zur Verbesserung der Datenanalysetools erhalten. Wir werden die Anfrage prüfen und möglicherweise unter der Nummer <tel_num> Kontakt aufnehmen, um weitere Details zu besprechen. Bitte stellen Sie zusätzliche Informationen zu den aktuellen Tools und den gewünschten Verbesserungen bereit. Wir bemühen uns, so schnell wie möglich eine Lösung anzubieten, die Ihren Anforderungen entspricht.",Change,Product Support,high,de,52,Performance,Data,Feedback,,,,,
Bekanntmachung zu Datenverarbeitungswerkzeugen,"Ich schreibe, um Informationen zu Datenverarbeitungswerkzeugen zu erhalten, die die Nutzung optimieren und Investitionsstrategien erkunden können. Könnten Sie bitte Details, Funktionalitäten und Vorteile dieser Werkzeuge geben? Ich schätze die bereitgestellten Informationen zur Informationsbasierten Investitionsentscheidungen sehr und würde es schätzen, wenn Sie mehr Details zu den Instrumenten liefern könnten. Damit ich Ihr Angebot besser bedienen kann, bitte geben Sie gerne mehr Informationen zu Ihren aktuellen Investitionszielen an.","Sehr geehrte [Name], vielen Dank für Ihre E-Mail in Bezug auf die Datenverarbeitungswerkzeuge. Diese Werkzeuge sind darauf ausgerichtet, wertvolle Erkenntnisse für die Optimierung von Investitionsstrategien zu liefern. Sie bieten eine Reihe von Funktionalitäten, darunter Datenvisualisierung, Portfolioanalyse und Risikobewertung, die es Benutzern ermöglichen, informiertere Investitionsentscheidungen zu treffen. Diese Funktionalitäten bieten einen Vorteil durch Marktvoraussagen. Ich wäre gerne bereit, mehr Informationen zu den Vorteilen unserer Werkzeuge zu liefern. Um Ihre Bedürfnisse besser zu verstehen, bitte geben Sie mehr Details zu Ihren aktuellen Investitionszielen an.",Request,Customer Service,low,de,52,Security,Information,Documentation,,,,,
Systemic Issues at Marketing Agency,The marketing agency has experienced multiple system disruptions affecting key products. Possible causes include integration conflicts following recent updates. Attempts to resolve the issue by restarting affected systems and applying patches have not succeeded. We require assistance to resolve the problem promptly and minimize operational impacts. Kindly provide instructions for the next steps.,"We received your email regarding the system disruptions at the marketing agency. To assist you effectively, please provide additional details about the issues and the patches applied. We would like to schedule a call at the earliest convenience to discuss the problem and support you in resolving it quickly. Please let us know a suitable time, and we will call you at <tel_num>.",Incident,IT Support,high,de,52,Disruption,Outage,Integration,Maintenance,Recovery,System,Update,Issue
