subject,body,answer,type,queue,priority,language,version,tag_1,tag_2,tag_3,tag_4,tag_5,tag_6,tag_7,tag_8
,"Eine Sicherheitsverletzung bei medizinischen Daten hat die IT-Systeme des Krankenhauses kompromittiert, wobei ein möglicher Phishing-Angriff oder Malware-Infektion vermutet wird. Erste Versuche zur Behebung des Problems umfassten Passwortänderungen und Systemüberprüfungen. Dennoch ist eine weitergehende Untersuchung erforderlich, um die Ursache des Vorfalls zu ermitteln. Das IT-Team des Krankenhauses arbeitet daran, den Schaden zu begrenzen und weiteren unbefugten Zugriff zu verhindern. Die Untersuchung ist im Gange, um das Ausmaß der Verletzung festzustellen und die verantwortlichen Personen oder Gruppen zu identifizieren. Das Krankenhaus bemüht sich, die betroffenen Patienten zu informieren und zu unterstützen.","Sie haben eine E-Mail bezüglich der Sicherheitsverletzung im Krankenhaus erhalten. Ein Experte wird zugewiesen, um Unterstützung zu leisten. Bitte teilen Sie Ihre Kontaktnummer mit, damit die nächsten Schritte besprochen und das Problem so schnell wie möglich eingedämmt und gelöst werden können.",Incident,Customer Service,high,de,52,Security,Malware,Phishing,Investigation,System,IT,,
,"Können zusätzliche Details zu digitalen Strategien von der Agentur bereitgestellt werden, um das Marktwachstum effizient zu unterstützen? Ich würde gerne mehr Techniken und Werkzeuge kennenlernen und anwenden.",kontaktieren,Request,Product Support,low,de,52,Marketing,Strategy,Digital,Growth,Technology,Tools,,
Security Incident in Hospital's Medical Data System,"The hospital's medical data system has been compromised, possibly due to a security breach. Initial attempts to update the firewall were unsuccessful. We need assistance to resolve this issue and prevent future breaches. Please provide guidance on the next steps we should take. We are concerned about the potential consequences of the breach and want to ensure that our systems are secure. We would appreciate your support and recommendations to help us address this situation.","Acknowledging receipt of the email regarding the potential security breach in the hospital's medical data system. I understand the urgency and importance of resolving this issue to prevent further breaches and protect sensitive patient information. To better assist you, could we schedule a call to discuss the details of the breach and the steps that have been taken so far? I am available at your convenience. In the meantime, I recommend disconnecting the affected system from the network to prevent any potential damage. Please proceed accordingly.",Incident,Technical Support,high,en,52,Security,IT,Tech Support,,,,,
Update der Benutzeroberfläche für das SaaS-Projektmanagement,"Probleme bei der Navigation auf der Plattform. Könnten die Benutzeroberfläche überarbeitet werden, um sie benutzerfreundlicher und effizienter zu gestalten?",Die Anfrage umgehend an das Entwicklungsteam zur Überprüfung weiterleiten.,Change,Customer Service,low,de,52,Bug,User Interface,SaaS,Navigation,Usability,,,
,"Sehr geehrter Kundenservice, ich bin daran interessiert, mehr über Investitionsoptimierungsdienste zu erfahren und wie Datenanalysen dabei unterstützen können. Könnten Sie mir bitte detaillierte Informationen zu den Abrechnungs- und Zahlungsoptionen der Dienste mitteilen? Ich möchte wissen, welche Zahlungsmethoden akzeptiert werden, ob Rabatte für langfristige Verpflichtungen angeboten werden und ob zusätzliche Gebühren im Zusammenhang mit den Diensten anfallen. Ich freue mich auf eine Rückmeldung, um herauszufinden, wie Ihre Dienste bei der Optimierung meiner Investitionen helfen können. Vielen Dank für Ihre Zeit und Unterstützung. Mit freundlichen Grüßen, [Ihr Name]","Wir bieten verschiedene Zahlungsmethoden sowie Rabatte für langfristige Verpflichtungen an. Gerne rufe ich Sie an, um Details zu besprechen und Ihre Fragen zu den Investitionsoptimierungsdiensten zu beantworten.",Request,Billing and Payments,medium,de,52,Product,Feature,Billing,Payment,Refund,Feedback,,
Interruptions in Digital Marketing Productivity Tools,"Drafting a report on multiple disruptions in digital marketing tools that are hindering the marketing agency's capacity to promote brand growth through digital strategies. The suspected cause appears to be software and hardware compatibility issues. Despite performing basic troubleshooting steps like device reboots, the problem remains unresolved. The team depends heavily on tools for campaign management, analytics, and content development. These disruptions are affecting productivity and our ability to meet deadlines. Your assistance in resolving this issue promptly would be greatly appreciated.","<name> is assisting with disruptions in digital marketing productivity tools. To better understand the problem, could you please provide details about the specific tools and any error messages encountered? We may need to schedule a call at <tel_num> to discuss and determine the appropriate next steps to resolve the issue as soon as possible for the marketing agency.",Incident,Technical Support,low,en,52,Disruption,Productivity,Software,Hardware,Compatibility,Troubleshooting,Digital Marketing,Agency
System Crash Disrupted Investment Optimization Today,"Dear Customer Support, Our data analytics system unexpectedly crashed, causing a disruption in the investment optimization process. We suspect server overload or a software bug. The system was restarted and the latest patches were applied, but the issue persists. The crash occurred during a critical phase, risking potential financial losses. Despite attempting to restart the system and applying recent updates, the problem remains unresolved. We urgently request a thorough investigation and a prompt solution. Please advise on the next steps.",Please examine the system crash issue. Kindly provide system logs and error messages for further analysis and troubleshooting. Contact <tel_num> to discuss the next steps.,Problem,Technical Support,high,de,52,Crash,Disruption,Performance,Bug,IT,Tech Support,,
,"Sehr geehrter Kundenservice, ich wende mich an Sie, um Rat bezüglich der Integration digitaler Strategien zur Steigerung des Markenwachstums und der Marketingaktivitäten zu erhalten. Unser Team möchte unsere Online-Präsenz verbessern und die Interaktion mit unserer Zielgruppe erhöhen. Könnten Sie Empfehlungen geben, wie wir soziale Medien, E-Mail-Marketing und die Erstellung von Content effektiv nutzen können, um unsere Ziele zu erreichen? Wir sind auch daran interessiert, mehr über die neuesten Trends und bewährte Praktiken im digitalen Marketing zu erfahren. Vielen Dank für Ihre Zeit und Unterstützung. Ich freue mich auf Ihre baldige Rückmeldung. Mit freundlichen Grüßen","Sehr geehrter <name>, gerne unterstützen wir Sie bei der Integration digitaler Strategien zur Steigerung des Markenwachstums. Um Ihre Bedürfnisse besser zu verstehen, würden wir ein Gespräch vereinbaren, um Ihre aktuellen Marketingaktivitäten und Ziele zu besprechen. Wären Sie zu einem passenden Zeitpunkt für ein Gespräch verfügbar? Wir können Empfehlungen für soziale Medien, E-Mail-Marketing und Content-Erstellung geben, um Ihre Zielsetzungen zu erreichen.",Request,Technical Support,high,de,52,Marketing,Digital Strategy,Social Media,Online Presence,Customer Service,Brand Growth,Email Marketing,Team Collaboration
Datenverarbeitungsstörungen,"Das Unternehmen erlebte Verzögerungen bei der Datenverarbeitung, was die Investmentanalyse beeinträchtigte.",Das Datenverarbeitungsproblem sollte sofort überprüft werden.,Problem,Customer Service,medium,de,52,Performance,Disruption,Outage,Data Processing,,,,
Request for Assistance with Vagrant Integration,"Customer support team, I am reaching out to request comprehensive documentation on integrating the Vagrant SaaS project management platform. I would like to understand the step-by-step process for setting up Vagrant and configuring it to work smoothly with the platform. Could you please provide guides, tutorials, or relevant resources that would facilitate this integration? I look forward to your response and hope to find a solution to my query. Thank you for your time and assistance. I appreciate your help and look forward to your prompt reply.","<name>, thank you for contacting the support team regarding the integration of Vagrant with the SaaS project management platform. We appreciate your interest in connecting the platform with Vagrant. To assist with the setup and configuration, we can provide detailed guides and tutorials. To better understand your specific needs, could you please share information about your environment and the desired outcome of the integration? If necessary, we can also schedule a call at <tel_num> to discuss further. Additionally, please find general information about the platform's API included.",Request,Billing and Payments,high,en,52,Product,Documentation,Support,Integration,,,,
,"Sehr geehrter Kundendienst,\n\nich möchte Sie über einen Vorfall mit unserer SaaS-Plattform informieren. Mehrere Produkte sind von Dienstunterbrechungen betroffen. Das Problem scheint kürzliche Änderungen an der Infrastruktur verursacht zu haben, möglicherweise im Zusammenhang mit Backend-Skalierungsproblemen.\nUnser Team arbeitet daran, das Problem durch Serverneustarts und die Optimierung der Datenbankabfragen zu beheben. Leider besteht das Problem weiterhin.\nWir befürchten, dass die Störung die Kunden beeinträchtigen könnte. Daher setzen wir alles daran, die Ursachen schnellstmöglich zu identifizieren und eine Lösung umzusetzen.\nWir bitten um Ihre Unterstützung.","Sehr geehrter <Name>, vielen Dank, dass Sie uns bezüglich der Dienststörung der SaaS-Plattform kontaktiert haben. Gerne unterstützen wir Sie bei der Fehlerbehebung. Könnten Sie bitte weitere Details zu den kürzlichen Infrastrukturänderungen und den beobachteten Fehlermeldungen bereitstellen? Wir werden die Informationen prüfen und sich mit Ihnen unter <tel_num> in Verbindung setzen, um die nächsten Schritte zu besprechen.",Incident,Returns and Exchanges,high,de,52,Outage,Disruption,Maintenance,Performance,Server,Backend,Infrastructure,Database
,"Can you supply documentation on SaaS scalability capabilities, best practices, project management, and integration? I require detailed information.","<name> has received a request for documentation on SaaS scalability features, best practices, project management, and integration. Please provide a comprehensive guide that includes detailed information on these topics. The guide should cover essential scalability features, available integration options, and project management practices. If you'd like to discuss specific questions, please inform us of a convenient time for a call at <tel_num>. We are happy to assist with any information needed regarding <acc_num>.",Request,Technical Support,high,en,52,Documentation,Feature,Project Management,,,,,
Anfrage zum Sage Accounting Support,"Sehr geehrtes Kundendienstteam, ich möchte mich erkundigen, ob die Sage Accounting Projektmanagement-SaaS-Plattform integriert werden kann. Könnten Sie bitte umfassende Dokumentationen zum Ablauf bereitstellen? Eine Schritt-für-Schritt-Anleitung und zusätzliche Ressourcen wären sehr hilfreich, um den Einstieg zu erleichtern. Vielen Dank im Voraus für Ihre Unterstützung. Ich freue mich auf Ihre Rückmeldung.","Wir stellen die benötigte Dokumentation und eine Anleitung zur Integration der Sage Accounting Plattform bereit. Bitte erlauben Sie uns, <tel_num> zu kontaktieren, um weitere Details zu besprechen.",Request,Billing and Payments,medium,de,52,Documentation,Support,Account,IT,Tech Support,,,
Report on Data Access Issues,"Customer support has documented an incident where a healthcare provider faced data access disruptions impacting multiple platforms such as IBM SPSS, Azure, and Elasticsearch. The problem began following a recent security update, which may have led to network authentication errors. Despite attempts to restart affected services and verify user credentials, the issue persists. These failures are disrupting hospital operations. Assistance is requested to resolve this issue promptly.","<name>, we apologize for the data access issues affecting the hospital's systems. We recognize the urgency of this matter and are prepared to help. To better investigate the problem, could you please share details about the recent security update and any suspected network authentication errors? Additionally, we would like to arrange a call at your earliest convenience to discuss this further. Would <tel_num> be a suitable contact number? We look forward to working closely with you to resolve this issue swiftly.",Incident,Service Outages and Maintenance,high,en,52,Security,Network,Disruption,IT,Tech Support,,,
Reported Login Issues Today,The platform encountered occasional login problems.,"<name>, we apologize for the inconvenience caused by the intermittent login failures on the platform. Our technical team is currently investigating the issue and working to resolve it as soon as possible. Please provide the details of the error message you received, as this information may help us identify the root cause of the problem. If you would like to schedule a call to discuss the issue at your convenience, please contact us at <tel_num>. We are happy to assist you regarding your account number <acc_num>. Please let us know a suitable time.",Problem,Technical Support,medium,en,52,Login,Security,IT,Tech Support,,,,
Digital Marketing Approaches Achieving Anticipated Expansion,"Customer Support,<br><br>Our digital marketing tactics are producing the expected increase in brand visibility. However, this may be due to ineffective targeting or outdated campaign methods. We have optimized advertising budgets and refreshed creative content, yet see only slight progress.<br><br>We have employed various strategies to reach our target audience, including social media initiatives and search engine optimization. Nonetheless, analytics indicate that engagement and conversion rates are below our projections.<br><br>We",Review digital marketing strategies and contact <tel_num> to discuss potential enhancements and recommend subsequent actions.,Problem,Technical Support,medium,en,52,Marketing,Feedback,Campaign,Brand Visibility,Strategy,Creative Content,,
,The SaaS platform faced sporadic outages caused by compatibility problems with Node.js 14.17 during Ansible deployment processes. Restoring previous Node.js versions and restarting services successfully resolved the problem.,We received an email about the SaaS platform downtime due to Node.js compatibility issues. Kindly share the error messages encountered so we can assist in troubleshooting the problem.,Incident,Customer Service,medium,en,52,Outage,Disruption,Recovery,Maintenance,Compatibility,Deployment,Service Restart,
Report on Website Downtime Issues,"Dear Customer Service, I am reaching out to report that our website, managed by our marketing agency, frequently experiences outages. These issues seem to be related to recent server updates. Despite restarting the servers and checking configurations, the problem persists. We have tried to resolve the issue, but the website remains inaccessible at times. We would appreciate it if you could investigate this matter urgently and provide a prompt solution. Please let us know if you require any additional information to resolve the issue. You can contact us via email or by phone. Thank you for your prompt attention.","Dear <name>, we apologize for the website downtime you are experiencing. We will investigate the issue promptly, especially focusing on the recent server updates and configuration checks. Could you please provide the exact error messages encountered when trying to access the website, as well as the frequency of the outages? You can reach us at <tel_num> or via email to discuss further details and facilitate a quick resolution.",Incident,Technical Support,high,de,52,Outage,Disruption,Recovery,Maintenance,IT,Tech Support,,
,"The digital strategies implemented by the marketing agency are expected to enhance brand visibility. Despite increased advertising expenditure and refined content, growth has plateaued. I would like to request a review of the current strategy to pinpoint areas for improvement and receive suggestions for more effective targeting.","I'm happy to assist with reviewing the current digital approach. I would like to schedule a call to discuss your objectives and current initiatives in detail. Please let me know a convenient time for a call at <tel_num>. To prepare for the discussion, it would be helpful if you could share information about your target audience, recent metrics, website traffic, and social media engagement. This will aid in identifying potential improvements and providing tailored recommendations for better audience targeting.",Problem,Product Support,medium,en,52,Marketing,Strategy,Content,Brand Visibility,Advertising,Performance,Improvement,
Digital Strategy to Boost Brand Awareness,I would like to learn more about digital strategies for enhancing brand awareness. Could you provide details on the plan to increase brand presence across multiple platforms?,I will send the details via telephone as soon as it is convenient.,Request,Returns and Exchanges,high,de,52,Marketing,Strategy,Brand Awareness,Digital Marketing,Social Media,Campaign,,
Digitale Strategien für Markenentwicklung,"Sehr geehrter Kundenservice, ich möchte mich nach Dienstleistungen im Bereich digitaler Strategien zur Markenentwicklung erkundigen. Könnten Sie bitte detailliertere Informationen zu den angebotenen Services sowie deren Erfolgskriterien bereitstellen? Ich bin daran interessiert zu erfahren, wie Ihre Dienstleistungen Unternehmen dabei unterstützen können, im digitalen Raum erfolgreich zu wachsen. Besonders interessieren mich Ansätze im Bereich Social-Media-Marketing, Content-Erstellung und Suchmaschinenoptimierung. Was unterscheidet Ihre Dienstleistungen in der Branche, und welche Ergebnisse kann man erwarten? Ich freue mich auf Ihre Rückmeldung und darauf, mehr über Ihre digitalen Strategiedienstleistungen zu erfahren.","Sehr geehrter <name>, wir bieten individuell abgestimmte Dienstleistungen im Bereich digitaler Strategien zur Markenentwicklung an, darunter Social-Media-Marketing, Content-Erstellung und Suchmaschinenoptimierung. Gerne erläutern wir Ihnen unsere Ansätze und Erfolgskriterien. Bitte teilen Sie uns mit, wann es Ihnen passt, unter <tel_num> anzurufen.",Request,IT Support,high,de,52,Marketing,Strategy,Brand Development,Content Creation,,,,
SaaS platform disruption impacting several integrated services unexpectedly,Encountering server congestion,Examining the server congestion issue perturbing the SaaS platform; will furnish an update shortly.,Incident,Product Support,medium,en,52,Disruption,Network,Performance,Outage,,,,
Financial Institution Experiences System Slowdowns During Data Analysis,"A financial organization focused on investment data analytics has encountered system performance issues, experiencing slowdowns during KNIME and Azure data processing workflows. The likely causes include resource overloads and software conflicts. Attempts to resolve the problem by restarting systems, updating software, and checking network connectivity have been unsuccessful. The issue persists, and support is being sought to identify and fix the root cause. System logs have been reviewed, revealing errors, but the exact cause remains uncertain. Could you please provide guidance or instructions on how to resolve this issue? Your assistance and recommendations would be appreciated to restore smooth system operation.","<name> Service Desk is available to assist with system slowdowns. To better understand the problem, could you please provide additional details from the system logs? It would also be helpful to know the system specifications and the versions of KNIME and Azure in use. We can arrange a call to discuss the issue and possibly guide troubleshooting steps. Please let us know a suitable time for a call, or contact us at <tel_num>. We look forward to collaborating to resolve the problem and ensure smooth system performance.",Problem,Technical Support,low,de,52,Performance,Network,IT,Disruption,,,,
,"Dear Customer Support, I am reaching out to inquire about the security features and compliance measures in place for protecting medical data within your data protection systems. Could you please provide details on the protocols and safeguards that are used to ensure the confidentiality, integrity, and availability of sensitive patient information? I would greatly appreciate information on data encryption, access controls, and any relevant certifications or audit processes. This information will help me better understand your systems and ensure the confidentiality, integrity, and availability of the medical data. Thank you in advance for your assistance with this matter. I look forward to hearing from you soon.","Dear [Name], we appreciate your inquiry regarding the medical data protection systems. Our systems utilize robust data encryption and access controls to ensure confidentiality and integrity. We hold relevant certifications and undergo regular audits. We would be happy to provide detailed information; please let us know if you would like to call at [Tel_num] to discuss further.",Request,Product Support,medium,en,52,Security,Compliance,Data Protection,Confidentiality,Integrity,Availability,,
,"Customer Support, I am reaching out to inquire about the digital strategies employed for brand growth marketing. Could you provide insights into the methods and techniques used to enhance brand visibility and engagement? I am particularly interested in learning about social media strategies, content creation, and advertising tactics. Additionally, I would appreciate information on how to measure the success of digital marketing efforts and the tools used to analyze results. Thank you for your time and assistance. I look forward to hearing from you.","<name>, thank you for your interest in digital marketing strategies. Our approaches include social media engagement, targeted content creation, and advertising campaigns. To measure success, we utilize analytics tools that track engagement metrics. If you'd like more detailed information, I would be happy to discuss this further. Please let me know a convenient time for a call, and I will arrange to reach you at <tel_num>.",Request,Customer Service,low,en,52,Feedback,Marketing,Social Media,Content Creation,Strategy,Engagement,,
Issues with Data Analysis Tools,"Encountered errors with Data Analysis Tools affecting multiple products. Possible system incompatibility and performance issues. Systems were restarted and software updated; however, the problem persists and requires further investigation.","To delve into the issues with the Data Analysis Tools, please contact us at <tel_num> for further discussions regarding the solution to the problem.",Incident,Product Support,medium,de,52,Bug,Performance,Compatibility,Software,Investigation,,,
Schutz medizinischer Daten und Datensicherheit,"Bitte richten Sie Ihre Aufmerksamkeit auf eine potenzielle Sicherheitslücke bei der Absicherung medizinischer Daten, die kürzlich bei einem Gesundheitsdienstleister aufgetreten ist. Trotz Aktualisierung unserer Firewall-Konfigurationen und der Anwendung der neuesten Patches besteht das Problem weiterhin. Es ist wahrscheinlich, dass die aktuellen Sicherheitsprotokolle veraltet sind und eine umfassende Überarbeitung notwendig ist. Wir würden Ihre Unterstützung bei der Verbesserung der Sicherheitsmaßnahmen schätzen, um potenzielle Verstöße zu verhindern. Der Schutz der Vertraulichkeit der medizinischen Informationen unserer Patienten hat höchste Priorität. Wir sind bestrebt, im Team zusammenzuarbeiten,","Bitte bestätigen Sie den Erhalt dieser Nachricht und teilen Sie uns weitere Details zu dem spezifischen Problem mit, das Sie erlebt haben, einschließlich etwaiger Fehlermeldungen oder beobachteter Symptome.\n\nUm Empfehlungen zur Verbesserung der Sicherheitsmaßnahmen zu geben, können wir gerne ein Gespräch vereinbaren, um die aktuellen Sicherheitsprotokolle und bisherige Maßnahmen zu besprechen. Wäre ein Anruf zu einem für Sie passenden Zeitpunkt möglich?",Problem,Product Support,medium,de,52,Security,Bug,Outage,Maintenance,Recovery,,,
Data Problems in Investment Optimization System,"Customer Support reports a problem with generating reports on the investment optimization platform. The platform is encountering data integration errors, possibly linked to recent software updates. Initial troubleshooting steps such as rebooting the system and clearing the cache have been attempted but did not resolve the issue. The customer is worried that this problem might impact the accuracy of investment decisions and requests assistance. Could you please investigate the root cause of the issue and suggest a solution?","To look into this issue, please provide the account number and a convenient time for a callback at <tel_num> to discuss further.",Incident,Product Support,medium,en,52,Bug,Performance,Data,Software Update,Troubleshooting,,,
