subject,body,answer,type,queue,priority,language,version,tag_1,tag_2,tag_3,tag_4,tag_5,tag_6,tag_7,tag_8
Optimierung der Datenintegration zwischen Plattformen,"Sehr geehrte Kundenservice-Abteilung, ich schreibe, um Verbesserungen in den Datenintegrationsfähigkeiten der Plattformen zu beantragen, was die Effizienz der Anlagenanalyse und die Qualität der Entscheidungsfindung erhöhen könnte. Im Moment stellen die Verschmelzung von Daten aus verschiedenen Quellen für mein Team eine Herausforderung dar, was unsere Fähigkeit, informierte Entscheidungen zu treffen, einschränkt. Durch die Verbesserung der Datenintegration könnte das gesamte Geschäftsprozessleistung gesteigert und die Produktivität erhöht werden, was das Geschäftswachstum fördern würde. Ich hoffe, Sie können die Angelegenheit in Betracht ziehen. Vielen Dank.","Sehr geehrte [Name], vielen Dank, dass Sie sich an den Kundenservice gewandt haben, um Verbesserungen in der Datenintegration der Plattformen zu beantragen. Wir verstehen die Herausforderungen, die die Verschmelzung von Daten aus verschiedenen Quellen für Ihr Team bereitet. Wir schätzen Ihre Rückmeldung und glauben, dass Verbesserungen in der Anlagenanalyse und der Qualität der Entscheidungsfindung erreicht werden können. Wir sind definitiv daran interessiert, mögliche Lösungen für die Verbesserung der Datenintegration zu suchen. Um Ihre Anforderungen besser zu verstehen, könnten Sie bitte mehr Informationen zu den spezifischen Plattformen und Datenquellen geben, denen Sie aktuell arbeiten. Bald werden wir Kontakt aufnehmen, um diese Angelegenheit zu besprechen.",Change,Product Support,medium,de,400,Feature,Performance,Documentation,Feedback,,,,
Support for Enhancing Digital Growth Strategies,Our marketing agency is facing challenges in driving brand growth through digital strategies. Recent algorithm changes might have affected our visibility. We have tried optimizing our campaigns and improving targeting but haven't seen significant results. We need assistance to improve our online presence and effectively reach our target audience.,"I understand your concerns regarding digital growth strategies and the potential impact of recent algorithm changes on visibility. To better assist you, could you please provide information on your current digital strategies and the specific challenges you are facing? This will help us provide a tailored solution to improve your online presence and effectively reach your target audience. If you are available, we would like to schedule a call at <tel_num> to discuss and explore possible solutions.",Problem,Sales and Pre-Sales,medium,en,400,Feedback,Sales,IT,Tech Support,,,,
,"Probleme mit datenanalytischen Tools aufgrund von Hardwarekompatibilitätsschwierigkeiten, veralteter Software und mangelnder Ressourcen werden beschrieben.","Es wurde ein E-Mail-Bericht über die Funktionsstörung der datenanalytischen Tools geschickt, die auf Hardwarekompatibilitätsschwierigkeiten, veraltete Software und mangelnde Ressourcen zurückzuführen sind. Wir freuen uns darauf, Ihnen bei der Lösung des Problems behilflich zu sein. Bitte teilen Sie uns mit, wann Sie ein Telefonat einrichten können, um weitere Details zu besprechen.",Incident,Customer Service,high,de,400,Hardware,Performance,Bug,Documentation,,,,
Support for Marketing Enhancements,"Request for assistance in improving digital marketing strategies for products affected by recent changes. Believe integrating these efforts will enhance brand visibility and customer engagement. Suggestions include social media campaigns, email marketing, and targeted advertising. Looking forward to the support team's guidance and assistance in achieving our goals. Please inform about the schedule for a meeting to discuss further.","Ready to help with your marketing support needs, particularly in enhancing digital marketing strategies for products impacted by recent changes. To better understand your requirements, could you please provide specific details on the products and the recent changes? I am happy to schedule a meeting to discuss and explore options such as social media campaigns and targeted advertising. Please let me know a convenient time to arrange this meeting.",Change,Technical Support,high,en,400,Feedback,Sales,Marketing,Documentation,Tech Support,,,
Support Request: Performance Issues with Applications on Ubuntu Apache Hadoop,We have noticed performance problems with applications running on Ubuntu 22.04 LTS with Apache Hadoop 3.2.1. The latest updates and configuration changes might be the cause. Please check the application after a restart to see if that resolves the resource usage issue.,"We have received a support request regarding performance issues with applications on Ubuntu and Apache Hadoop. To investigate the problem, we kindly ask for more details on the recent updates and configuration changes. We are also available to discuss the issue over a call. If you are available for a call, please provide a suitable time window. You can contact us at <tel_num>.",Problem,Technical Support,high,de,400,Performance,IT,Tech Support,,,,,
Request for Insights into Data Analytics Services Support,"Could you provide more details on Data Analytics Services, Optimization Strategies, and how these can assist in making informed and responsible decisions? Thank you for your support and assistance in this matter.",We can offer more details on Data Analytics Services via telephone at your earliest convenience.,Request,Customer Service,high,de,400,IT,Tech Support,Feedback,Performance,Documentation,,,
Support for Data,"A potential data loss event was detected in the IT systems of the hospital due to outdated security protocols. Initially, security checks and software updates were performed, but a thorough investigation is necessary to address any network issues.",An investigative team will be sent to conduct a thorough examination and implement necessary security measures to prevent further losses and protect the hospital's IT systems.,Incident,Technical Support,medium,de,400,Bug,Security,Network,Performance,IT,Tech Support,,
Support for Data Analysis Issues,"Encountering inconsistent results during data analysis. Despite confirming data integrity and updating the software system, the issues persist.",Please provide more details about the data analysis and the software system used to further assist in resolving the problem.,Problem,General Inquiry,high,de,400,Bug,Performance,IT,Tech Support,,,,
Probleme throughout Zugriff auf Online-Dienste bei der Marketing-Agentur,"Die Marketing-Agentur hat Schwierigkeiten throughout dem Zugriff auf QuickBooks Online RapidMiner gemeldet. Netzwerkprobleme und Software-Updates scheinen die Ursache zu sein. Nach Neustarten betroffener Geräte und Überprüfung der Kabelverbindungen blieben die Probleme bestehen. Die Teammitglieder müssen häufig die Werkzeuge zur Durchführung täglicher Betriebsprozesse umgehen, was die Produktivität beeinträchtigt. Wir schätzen, dass wir rechtzeitig mit einer Lösung für das Problem helfen könnten. Bitte geben Sie detaillierte Informationen zu den Fehlermeldungen, damit wir spezifische Probleme analysieren und versuchen können, den Zugriff auf die Dienste wiederherzustellen. Darüber hinaus möchten wir wissen, wann die Störungen begonnen haben und ob in der Nähe Änderungen an Netzwerk- oder Gerätekonfigurationen vorgenommen wurden. Wenn weitere Untersuchungen erforderlich sind, freuen wir uns, Ihnen dabei zu helfen.","Es tut uns leid, dass die Marketing-Agentur Schwierigkeiten throughout dem Zugriff auf QuickBooks Online RapidMiner hat. Die täglichen Betriebsprozesse sind durch diese Störungen stark beeinträchtigt. Um Ihnen rechtzeitig zu helfen, bitten wir Sie, detaillierte Informationen zu den Fehlermeldungen zu geben, damit wir spezifische Probleme analysieren können. Darüber hinaus möchten wir wissen, wann die Störungen begonnen haben und ob in der Nähe Änderungen an Netzwerk- oder Gerätekonfigurationen vorgenommen wurden. Wenn weitere Untersuchungen erforderlich sind, freuen wir uns, Ihnen dabei zu helfen.",Problem,IT Support,medium,de,400,Network,Performance,IT,Tech Support,Bug,Disruption,,
Secure Medical Data 3D Printers in Kubernetes,Could you provide details on securing medical data from 3D printers integrated with Kubernetes? It's important to ensure compliance.,"<name> appreciates your concern regarding securing medical data from 3D printers integrated with Kubernetes. To ensure compliance, we recommend implementing encryption and access controls for printed data. The Kubernetes integration involves role-based access control and auditing. For detailed information, let's schedule a call at your convenience to discuss security measures and compliance protocols. <name> is available for a call at <tel_num>. Would you prefer another time?",Request,Technical Support,medium,en,400,Security,Compliance,Product,IT,Tech Support,,,
Issue with Avid Pro Tools Crashing Identified,"I have encountered unanticipated crashes with Avid Pro Tools 2021.6 on my MacBook Pro workstation. The issue might be related to incompatibility with Apache Hadoop 3.2.1. Despite reinstalling and updating the software, the crashes continue to occur.","Dear [Name], we apologize for the issues you are experiencing with Avid Pro Tools 2021.6. To troubleshoot the problem, could you please provide any error messages you receive during the software crashes? Additionally, could you share the system configuration details related to Apache Hadoop 3.2.1 and how it is used in conjunction with Pro Tools? We are happy to assist in resolving the issue and are available to call at [Tel Num] at your convenience to discuss further.",Incident,Technical Support,medium,en,400,Bug,Crash,Performance,IT,Tech Support,,,
,"The urgency of the matter is to address the pressing issue of security breaches involving medical data. Recently, there have been unauthorized access attempts which have raised significant concerns for our hospital's department. This issue could be due to outdated software and weak access protocols. Immediate action has been taken, such as updating passwords and implementing two-factor authentication. However, further assistance is required to ensure the integrity of the security measures. I would greatly appreciate guidance on additional steps to strengthen these measures.","Thank you for your email regarding the concerns about the security of medical data. Upon reviewing the issue, I recommend taking additional measures to strengthen the security protocols. Please allow us to contact you at <tel_num> to discuss a follow-up plan that will ensure the integrity of the data and prevent future incidents.",Problem,Technical Support,high,en,400,Security,IT,Tech Support,Performance,,,,
