subject,body,answer,type,queue,priority,language,version,tag_1,tag_2,tag_3,tag_4,tag_5,tag_6,tag_7,tag_8
,"Customer Support, <br>A potential data breach has been detected in the hospital systems, which may have compromised medical records due to outdated software vulnerabilities. Initial security patches have been implemented, and antivirus software has been updated, but concerns remain. <br>The breach potentially exposed sensitive patient information, including names, addresses, and medical histories. We are taking this matter seriously and would like assistance in conducting a thorough investigation and implementing additional security measures. Could you please provide details on the outdated software vulnerabilities that may have caused the breach? This would guide us in taking the appropriate actions and recommending enhancements to security. We need to schedule a call at a time convenient for you to discuss this further.",<name> acknowledges your concern regarding the potential data breach in the hospital systems. We will proceed with the investigation and implementing additional security measures. It is necessary that you provide information on the security patches applied and the outdated software vulnerabilities that may have caused the breach. This will help us guide our course of action and recommend enhancements to security. Please schedule a call at a time convenient for you so we can discuss this further.,Incident,Returns and Exchanges,low,en,400,Security,Bug,Virus,IT,Tech Support,,,
Enhance Security Measures for Medical Data Access,"We need to put in place stronger security protocols for accessing medical data across all relevant devices and applications to protect patient confidentiality. This involves encrypting sensitive information, ensuring secure access controls, and regularly updating software to prevent data breaches.","Acknowledged the request to implement enhanced security protocols for medical data access. The focus will be on encrypting sensitive information, securing access controls, and regularly updating software to prevent data breaches, all aimed at ensuring patient confidentiality. A detailed plan and timeline for implementation will be provided shortly.",Change,Technical Support,medium,en,400,Security,IT,Tech Support,Documentation,,,,
,"Dear Customer Support, I am bringing to your attention an issue with my recent billing. A marketing agency has overcharged for services related to multiple products, leading to an unexpected high bill. Despite reviewing previous invoices and contacting billing support, the issue remains unresolved. I believe this might be due to errors in invoice calculations or misapplied discounts. I would appreciate it if you could look into this matter and provide a resolution as soon as possible. Please let us know.","Dear [Name], we acknowledge your email regarding the billing issue with the recent invoice [acc_num]. We apologize for the inconvenience caused and are happy to assist in resolving this matter. To facilitate our investigation, could you please provide a copy of the disputed invoice and any previous correspondence with billing support? This information will be needed, and we may require a convenient time to call you at [tel_num] to discuss further. We will review the calculations and discounts applied to your account and get back to you with a resolution as soon as possible.",Problem,Billing and Payments,high,en,400,Billing,Payment,Refund,Product,Disruption,,,
Issue with Optimization Software Functionality,The optimization software correctly processes facility data due to potential compatibility issues with Redis 6.2. Efforts to resolve the issue included restarting the Redis service and checking application logs for errors. Further assistance is needed to address the problem.,"Dear customer, I confirm the issue with the optimization software functionality due to potential compatibility problems with Redis 6.2. I can assist further by collecting information on the errors in the application logs. Could you please provide the log data? Additionally, we can arrange a call to discuss the problem in detail and explore possible solutions. I would be available to discuss the call, would you prefer to suggest a time slot? Please indicate a convenient time, I look forward to assisting you.",Incident,Product Support,medium,de,400,Bug,Performance,IT,Tech Support,,,,
,"experienced a security breach affecting medical data systems, resulting in the compromise of sensitive patient information. The incident may have occurred due to vulnerabilities in the network configuration or outdated software. We have attempted to patch critical systems and enhance firewall protections, but the issue persists. Immediate assistance is needed to resolve this issue and prevent future breaches. Please provide guidance on the next steps to take.","We would like to contact you regarding the security breach affecting your medical data systems and schedule a call at your earliest convenience to discuss the issue in detail. Please let us know a suitable time for the call at <tel_num>. In the meantime, please attempt to apply the necessary patches and changes to the network configuration, while preserving the current state for the investigation. We will provide guidance on the next steps to resolve the issue and prevent future breaches.",Incident,Technical Support,high,en,400,Security,Network,Performance,Bug,IT,Tech Support,,
,"Möchten Sie zusätzliche Details zu Integrationsfähigkeiten für SaaS und Redis 6.2 erhalten? Wir sind bereit, mehr über die Kompatibilität und mögliche Anwendungsfälle auszuführen.",Wir können Ihnen Informationen zu Integrationsfähigkeiten für Redis 6.2 und möglichen Anwendungsfällen per E-Mail oder Telefonanruf zur Verfügung stellen.,Request,Sales and Pre-Sales,low,de,400,Feature,Documentation,,,,,,
,"geehrte Kundensupport, ich melde Leistungsprobleme bei der Projektmanagement-Software-as-a-Service-Plattform. Dieses Problem behindert die Teamkommunikation und ist durch erhöhte Nutzlast und Schwierigkeiten bei der Integration mit Drittanbietern verursacht worden. Trotz Versuche, das Problem durch Cacheclearing, Anpassung der Nutzerrechte und Durchlesen der Systemprotokolle zu lösen, behält es seinen Ursprung bei. Ich schätze es sehr, wenn Sie das Problem schnellstmöglich lösen. Bitte geben Sie mir weitere Informationen, um den Lösungsprozess zu erleichtern. Ich freue mich auf Ihre Antwort. Vielen Dank.","geehrte <name>, vielen Dank, dass Sie sich bei dem Leistungsproblem der Projektmanagement-Software-as-a-Service-Plattform meldeten. Entschuldigen Sie die Unannehmlichkeiten, die Sie verursacht haben. Wir sind verpflichtet, das Problem so schnell wie möglich zu lösen. Um mehr zu erfahren und den Problemkreis besser zu verstehen, könnten Sie bitte die detaillierte Beschreibung der Integrationsschwierigkeiten mit Drittanbietern bereitstellen, die Sie haben kämpfen? Zusätzlich wäre es hilfreich, wenn Sie uns genaue Fehlermeldungen und die genauen Schritte beschreiben, die Sie bisher unternommen haben, um das Problem zu lösen. Falls erforderlich, können wir telefonisch in Kontakt treten. Vielen Dank.",Problem,Technical Support,medium,de,400,Performance,IT,Tech Support,Bug,Documentation,,,
Effektive Sicherung medizinischer Daten mit Symantec Endpoint Protection,"Sehr geehrte Kundensupport, ich möchte mich erkundigen, wie Symantec Endpoint Protection für die Sicherung medizinischer Daten in medizinischen Einrichtungen eingesetzt werden kann. Könnten Sie Details zu den besten Praktiken und Konfigurationen für die Gewährleistung der Vertraulichkeit, Integrität und Verfügbarkeit von vertraulichen medizinischen Informationen geben? Ich wäre sehr dankbar, wenn Sie Ratschläge zur Implementierung von Verschlüsselung, Zugriffskontrollen und Eindringlingserkennung geben könnten. Darüber hinaus interessiert mich, welche speziellen Funktionen und Module von Symantec Endpoint Protection für medizinische Organisationen besonders nützlich sind. Ich freue mich auf Ihre Rückmeldung.","Sehr geehrte [Name], danke, dass Sie sich an unser Kundensupport-Team gewandt haben. Um die Sicherung medizinischer Daten mit Symantec Endpoint Protection zu gewährleisten, empfehlen wir die Implementierung von Verschlüsselung, Zugriffskontrollen und Eindringlingserkennung. Die Lösung bietet Funktionen wie Gerätekontrolle und Anwendungskontrolle, die medizinische Organisationen besonders nützlich machen können. Führe gerne detaillierte Informationen und Konfigurationsanleitungen telefonisch durch. Bitte geben Sie mir ein geeignetes Telefonzeitfenster [Telefonnummer]. Ich freue mich darauf, spezifische Konfigurationen für Ihre Umgebung zu erläutern.",Request,Billing and Payments,medium,de,400,Backup,Security,IT,Tech Support,,,,
An Issue Regarding a Data Breach,"There was a data breach where confidential medical records were exposed. This issue appears to be due to vulnerabilities in outdated software and misconfigurations. Stronger access controls have been implemented, and relevant software has been updated, but the problem persists. Further support is needed to resolve the issue and prevent future breaches.","Please find the response to the data breach email. I understand the sensitivity of the matter and appreciate the steps that have been taken so far, which include implementing stronger access controls and updating the software. To better assist you, could you please share more details about the breach and the steps that have been taken? I would be happy to arrange a call to discuss further and determine the next steps to resolve the issue and prevent future breaches.",Incident,Returns and Exchanges,medium,de,400,Security,IT,Tech Support,Bug,,,,
Concern About Decrease in Online Engagement,"We have observed a decline in online engagement although we have maintained consistent digital marketing activities. This could be due to recent algorithm modifications or campaign fatigue. Our team has tried to optimize content and adjust ad spending, but the results have been minimal. We are worried that this trend might persist and we need to find the root cause. Could you provide guidance on potential solutions and offer support to help us enhance our online engagement?","We understand your concern regarding the decrease in online engagement despite your consistent digital marketing efforts. To better assist you, we can provide you with current digital marketing strategy details and specific metrics that show the decline. We would like to schedule a call at a convenient time to discuss potential solutions and offer support to help improve online engagement. Please let us know a suitable time to contact you at <tel_num> via email.",Incident,Customer Service,medium,en,400,Feedback,Performance,Sales,IT,Tech Support,,,
Inquiry About Billing Options for Smart Roboter Lawn Mowers,"Dear Customer Support, I am writing to inquire about the billing options available for the Smart Roboter Lawn Mowers and the associated products. Could you please provide information on the different plans and their pricing? I would greatly appreciate it if you could include any discounts or promotions that may be available. Additionally, I would like to know about any additional fees that are charged for the associated products. Thank you for your time and assistance. I look forward to hearing back from you soon.","Thank you for your interest in the Smart Roboter Lawn Mowers and the associated products. We offer various billing plans with different pricing options. Detailed information on the plans, pricing, and any available discounts will be discussed with you. Please let us know a convenient time to call at <tel_num> or your preferred time to discuss the options and answer any questions you may have regarding additional fees. We look forward to assisting you.",Request,Billing and Payments,medium,en,400,Billing,Payment,Product,Feedback,,,,
Issues with Data Analytics Across Several Platforms,"Our company is currently facing data analytics issues across various platforms, which is disrupting our investment optimization processes. These issues might have arisen from incompatible software updates or outdated systems. Our attempts to resolve the problem by restarting the systems and updating the applications have been unsuccessful. We urgently require your assistance to address this issue and prevent any further disruptions.","Thank you for your email regarding the data analytics issues across multiple platforms. To better assist you, could you please provide specific error messages and details about the updates that have been recently applied? Additionally, could you share the exact platforms affected and the steps you have taken so far to resolve the issue? For a more detailed discussion, I am available to call at your convenience. Please let me know a suitable time to reach you at <tel_num>.",Incident,Technical Support,high,en,400,Bug,Performance,Disruption,Maintenance,IT,Tech Support,,
,Problems with software integration,Kindly share details for assistance in troubleshooting the software integration issues.,Problem,Technical Support,high,en,400,Bug,Performance,IT,Tech Support,,,,
Probleme mit ClickUp,"Sehr geehrte Kundenservice, ich schreibe Ihnen, um eine Notiz zu hinterlassen, dass wir intermittierende Verbindungsprobleme mit ClickUp feststellen, die den Zugriff auf Projektmanagementfunktionen behindern. Diese Probleme könnten durch die neuesten Updates, konfliktierende Software oder Netzwerkunstabilität verursacht worden sein. Trotz der Netzwerkeinstellungen und Anwendungscaches aufräumen blieben die Probleme bei verschiedenen Geräten und Benutzerkonten bestehen. Ich schätze Ihre Hilfe bei der Lösung dieses Problems. Bitte lassen Sie mich wissen, falls Sie weitere Informationen benötigen, um den Fehler zu beheben. Vielen Dank für Ihre Unterstützung.","Sehr geehrte [Name], vielen Dank für Ihre Meldung zum ClickUp-Fehler. Um die Fehlerbehebung zu unterstützen, könnten Sie bitte einen genauen Fehlerbericht mit der Referenznummer [Acc_Num] teilen? Falls erforderlich, können Sie telefonisch unter der Nummer [Tel_Num] Kontakt aufnehmen, um die Angelegenheit zu besprechen.",Incident,Product Support,medium,de,400,Network,Performance,IT,Tech Support,Bug,Outage,Disruption,
Probleme bei realzeitlichen Datenaktualisierungen,"Betreff: Problem mit realzeitlichen Datenaktualisierungen bei Investmentdashboard<br>Dear Kundensupport,<br>Diese E-Mail dient zur Meldung eines Problems mit dem Investmentdashboard der Finanzfirma. Die erwarteten realzeitlichen Datenaktualisierungen funktionieren nicht korrekt. Bereits betroffene Anwendungen wurden neu gestartet und der Cache geleert, jedoch besteht das Problem weiterhin. Das Problem scheint auf einen Synchronisierungsfehler zurückzuführen, der bei WordPress und IBM Cloud auftritt. Ich freue mich auf die Schnelle Bereitstellung einer Lösung. Falls weitere Informationen für die Lösung des Problems notwendig sind, lassen Sie es mich bitte wissen. Vielen Dank.","Um das Problem zu untersuchen, steht Ihnen eine Anrufoption zur Verfügung, um zusätzliche Informationen zur Lösung des realzeitlichen Datenaktualisierungsproblems bereitzustellen.",Incident,IT Support,high,de,400,Bug,Performance,Disruption,IT,Tech Support,,,
Occasional Access Problems with Project Management Tool,"Users have reported sporadic access difficulties with the project management tool. This might be caused by server overload. We have already tried restarting the server and optimizing database queries, but the issues continue. The team is actively investigating the root cause and working on a solution to ensure consistent access.","We appreciate your efforts to resolve the issue. Since it persists, could you please provide the exact error message and the time it occurred? This will help us escalate the matter to the technical team for further assistance. Additionally, we can schedule a call at your convenience to discuss the issue further.",Incident,Technical Support,high,en,400,Bug,Network,Performance,IT,Tech Support,,,
Performance Issues with Digital Tools for Brand Growth,"Dear Customer Service, over the past few days, the digital tools for brand growth have been malfunctioning, significantly impacting campaign implementation and communication. These issues are believed to be due to conflicts between different software versions. Despite attempts to troubleshoot and restart individual devices, the problems persist. Our team is actively working on these tools, but the interruptions are causing significant delays. We believe that addressing this matter urgently could provide a workaround and bring the systems back online.","For assistance with the digital tools, please call <tel_num>. Further steps will require additional information.",Incident,IT Support,medium,de,400,Performance,Disruption,IT,Tech Support,,,,
Issue with Economic Data,Our economic firm has noticed discrepancies in the investment analysis results. These differences seem to be due to potential software integration issues.,"Please find an email confirmation regarding the issues with economic data discrepancies in the investment analysis results, which may be due to possible software integration problems. For further discussions on solutions, please contact us at <tel_num>.",Problem,Customer Service,high,de,400,Bug,Performance,IT,Tech Support,Documentation,,,
Unterstützung für Projektmanagementfunktionen in bestehenden Produkten,"Ich möchte um die Implementierung von Projektmanagementfunktionen in unsere bestehenden Produkte bitten. Diese Integration könnte die Effizienz der Zusammenarbeit erheblich verbessern und den Nutzern einen wertvollen Vorteil bieten. Ich freue mich darauf, weitere Informationen bereitzustellen, um die Anfrage voranzutreiben.","Ihre Anfrage zur Integration von Projektmanagementfunktionen in unsere bestehenden Produkte haben wir erhalten. Wir danken Ihnen für Ihre Vorschläge und werden diese in unsere zukünftige Entwicklung einbeziehen. Um die Anforderungen besser zu verstehen, könnten wir mehr Details zu den spezifischen Funktionen benötigen, die Sie umgesetzt sehen möchten. Wir helfen Ihnen, einen möglichen Zeitplan für die Integration zu bewerten und stellen Ihnen gerne Hilfe zur Verfügung, falls weitere Diskussionen erforderlich sind. Wenn dies notwendig ist, lassen Sie uns wissen, wann ein Telefonat am geeigneten Zeitpunkt stattfinden kann.",Change,Sales and Pre-Sales,low,de,400,Feature,Feedback,IT,Tech Support,,,,
,Update marketing strategy to enhance brand visibility through targeted digital campaigns and increased social media engagement to reach customers.,Received your request to update the marketing strategy to enhance brand visibility. We will implement targeted digital campaigns and increase social media engagement to reach customers. Would you like to schedule a call to discuss the new strategy and answer any questions you may have? Please let us know a suitable time for the call as it will be convenient. We can contact you at <tel_num> to discuss further.,Change,Customer Service,low,en,400,Feedback,Sales,Marketing,Documentation,,,,
Kopfzeile-Rechnungsbeziehungen-Einstellungen,Bieten Sie Details zu Rechnungen,Die Details der Rechnungsbeziehungen in der Kopfzeile liefern. Bitte referieren Sie sich zum Konto <acc_num> und rufen Sie für weitere Informationen dienummer <tel_num> an.,Request,Billing and Payments,medium,de,400,Billing,Payment,Refund,Documentation,,,,
Detaillierte Anleitungen zur PyTorch-Datenanalyse,"Können detaillierte Anleitungen zur effektiven Nutzung von PyTorch für Datenanalyse und Optimierung von Investitionen bereitstellen? Dies soll helfen, informierte Entscheidungen zu treffen und maximalen Ertrag zu erzielen. Vielen Dank für Ihre Zeit und Hilfe bei dieser Angelegenheit.","Ich freue mich, Ihnen Ratschläge zur Nutzung von PyTorch für Datenanalyse und Investitionsoptimierung zu geben. Um Ihnen besser zu helfen, bitte geben Sie mehr Informationen zu Ihrem aktuellen Setup und Ihren spezifischen Zielen. Anpassungsfähige Ratschläge und empfehlenswerte Ressourcen werden vorgeschlagen. Es ist ratsam, ein Anruf auf <tel_num> zu tätigen, um weitere Diskussionen zu beginnen. Bitte geben Sie ein geeignetes Zeitfenster an, um über Ihre PyTorch-Datenanalyse-Abfrage <acc_num> zu sprechen.",Request,Billing and Payments,high,de,400,Documentation,Feedback,Feature,,,,,
Service Outage Impacting Project Management Tools Integration,"Encountered service issues with project management tools integration, specifically with ActiveCampaign, Xero, and MongoDB 4.4. Recent updates may have caused conflicting configurations. Rollbacks and service restarts have been attempted but did not resolve the issue. Assistance is required to address this problem.","We are currently investigating the service outage impacting project management tools integration with ActiveCampaign, Xero, and MongoDB 4.4. Please provide any error messages you are seeing and details about the recent updates made to assist us further.",Incident,Product Support,medium,en,400,Outage,Disruption,Recovery,IT,Tech Support,,,
,"Hello Customer Support, I am inquiring about detailed instructions for integrating Airtable project management software. I would greatly appreciate your guidance and offer any necessary steps that could be involved in the integration process, including any potential complications that may arise. Thank you in advance for your assistance. I look forward to hearing back from you soon.","Dear [name], we appreciate your interest in integrating Airtable project management software. To assist you, we need information on your current setup requirements. Could you please provide us with a brief description of your plan for the integration? Also, we would need step-by-step instructions and any guidance on potential complications. If you are available, we can schedule a call at [tel_num] to discuss and ensure a smooth integration process. We look forward to hearing back from you soon.",Request,Customer Service,low,en,400,Documentation,Feedback,IT,Tech Support,,,,
Hilfe bei medizinischer Datensicherheit aufgrund veralteter Software,"Der Verlust von medizinischen Daten wird auf veraltete Software zurückgeführt. Trotz der Durchführung von Updates und der verstärkten Sicherheitsmaßnahmen bleibt das Problem bestehen. Sofortige Unterstützung ist erforderlich, um vertrauliche Informationen sicherzustellen.","Die Probleme mit der medizinischen Datensicherheit aufgrund der veralteten Software untersuchen. Bitte geben Sie weitere Details zu den durchgeführten Updates und den Sicherheitsmaßnahmen. Sie können mich am Telefon anrufen: <tel_num>, um eine weitere Diskussion zu beginnen.",Incident,Technical Support,high,de,400,Security,Bug,Performance,IT,Tech Support,,,
,"Customer support, focusing on the significance of improving security measures in medical data management systems within a healthcare setting. Patient privacy is a top priority and must be protected to prevent unauthorized access. This involves the implementation of strong firewalls, encryption methods, and secure data storage solutions. Our goal is to ensure the confidentiality and integrity of patient data, thereby maintaining trust and adhering to the highest standards of care.","<name>, we appreciate your concern about enhancing security protocols in medical data management systems. We take the protection of patient privacy very seriously and are committed to safeguarding sensitive information. We will review our current security measures and consider implementing additional robust protocols, such as strong firewalls and encryption methods, to ensure the confidentiality and integrity of patient data. Please let us know a good time to discuss this further, and we can call you at <tel_num>.",Change,IT Support,medium,en,400,Security,IT,Tech Support,Feedback,,,,
Unforeseen Decline in Brand Engagement Metrics Noted,"There has been a drop in brand engagement metrics. Recent adjustments to the algorithms may have missed the mark, leading to this decline. After analyzing the data and adjusting our strategies, we haven't seen the improvements we were hoping for yet.","\""<name>\"" received an email regarding the unforeseen decline in brand engagement metrics. To better understand the situation, they would like to discuss it with you. Could you please provide details on the recent algorithm changes and the strategies that have been adjusted? It would be possible to schedule a call at your convenience to discuss the matter and explore potential solutions. Please let us know a suitable time for the call at <tel_num>.",Incident,Human Resources,medium,en,400,Feedback,Performance,Documentation,,,,,
Issues with Campaign Execution,"We have observed that the campaign execution is irregular across different platforms, which might be due to changes in the algorithms. Despite adjusting the audience settings and reallocating budget resources, we have not yet seen any improvement. The issue persists and requires further assistance to optimize the campaign.","Dear <name>, I confirm receipt of your email regarding the issues with campaign execution across various platforms. I understand that, despite the adjustments to audience settings and reallocating budget resources, the problem still persists. To effectively address this, I would like to gather more current information on the campaigns, including the target audience and budget allocation. This will help me provide a more precise solution. If convenient, please call at <tel_num> for a detailed discussion to find the best course of action.",Problem,Technical Support,low,de,400,Bug,Performance,Feedback,Tech Support,,,,
