subject,body,answer,type,queue,priority,language,version,tag_1,tag_2,tag_3,tag_4,tag_5,tag_6,tag_7,tag_8
Scalable Project Management SaaS Solutions,Can you share more about the product integration options for scalable project management SaaS? I would appreciate any guidance that could help my business. Thank you for your time and assistance.,I would be happy to discuss scalable project management SaaS integration options. Please let me know a good time to call at <tel_num> for further details.,Request,Customer Service,high,en,400,Product,Feature,Feedback,Tech Support,,,,
Issue with Billing on SaaS Subscription,There has been a billing error that led to unexpected charges. This might be related to the recent payment processing update.,"Dear [name], I am sorry to hear that you are experiencing a billing error on your SaaS subscription. We would like to investigate this matter and resolve the issue as soon as possible. Could you please provide your account number and a detailed description of the unexpected charges incurred? We are available to call you at [tel_num] to discuss and provide a solution to rectify the situation. Please let us know a convenient time to call. We appreciate your cooperation and look forward to resolving this issue for you.",Problem,Billing and Payments,low,en,400,Billing,Payment,Bug,Refund,,,,
Seek Assistance with Marketing Strategies,Encountering difficulties with digital marketing strategies,"<name>, we need guidance on marketing strategies. Could you please specify the particular issues you are facing with digital strategies? This will help us better understand your situation and provide an effective solution. For a more detailed discussion, I prefer to call at a convenient time. Please let me know a suitable time to reach you at <tel_num>. Looking forward to your response to assist with your marketing needs. Ticket number: <acc_num>",Incident,Customer Service,high,en,400,Feedback,Sales,Lead,IT,Tech Support,,,
Problem with Investment Optimization Models,"During routine data analysis, the investment optimization models have been producing inconsistent results. This issue has emerged following recent algorithm updates. I have confirmed that the settings have not changed from previous iterations, which produced reliable outcomes. Initial troubleshooting steps, such as reverting to the old algorithms and recalibrating data inputs, have not resolved the issue. I would appreciate your assistance in resolving this matter to ensure the accuracy and reliability of the models.",Acknowledged the issue with the investment optimization models and the inconsistent results following recent algorithm updates. Would like to schedule a call at the earliest convenience to discuss and determine the next steps to resolve the issue and ensure the accuracy of the models. Please let me know a suitable time for the call at <tel_num>.,Incident,Returns and Exchanges,high,en,400,Bug,Performance,Documentation,Feedback,IT,Tech Support,,
Request for Monday.com Integration Guidance,In need of assistance with integrating Monday.com for GNU Compiler Collection project tracking. Would be grateful for a detailed explanation of the integration's benefits and any resources that could help us implement it smoothly. Your support would be greatly appreciated. Looking forward to your response.,Please review the integration details for Monday.com and the benefits it offers. We can discuss further at your convenience.,Request,Customer Service,low,en,400,Feature,Documentation,Feedback,Tech Support,,,,
Marketing Campaign,metrics are not meeting expectations,would like to discuss the underperforming metrics of the marketing campaign. Please provide details and availability for a call at <tel_num> to investigate the issue. This campaign is associated with account number <acc_num> and was led by <name>.,Incident,Product Support,medium,en,400,Feedback,Sales,,,,,,
Problem mit unerwarteten Software-Abstürzen bei der Projektverwaltungsoberfläche,Erlebt unerwarteten Software-Absturz während der Nutzung unserer Projektverwaltungsoberfläche. Mehrere integrierte Werkzeuge wurden benutzt. Der Absturz könnte Kompatibilitätsproblemen bei macOS Monterey oder anderen Softwarekomponenten zuzuordnen sein. Nach Aktualisierung der Software und Überprüfung der Kompatibilitätsstellungen sowie des Systems auf Fehlern beharrt das Problem weiterhin.,"Für eine Ausführliche Erklärung des Software-Absturz-Problems rufen Sie uns am <tel_num> zurück. Wir können die Rückrufzeitpunkt vereinbaren, um das Kompatibilitätsproblem bei macOS Monterey zu lösen.",Incident,IT Support,high,de,400,Bug,Crash,Performance,IT,Tech Support,,,
Strategien für den digitalen Markenwachstum,"Sehr geehrte Kundensupport, ich möchte mehr über digitale Strategien erfahren, insbesondere darüber, wie wir die Markengröße durch Methoden und Techniken der Markenvisibilität und des Nutzerengagements verbessern können. Insbesondere interessiert mich die Rolle von sozialen Medien, Content-Marketing und Suchmaschinenoptimierung in unserer digitalen Strategie. Darüber hinaus möchte ich mehr über die verwendeten Indikatoren und die Erfolgsmessung erfahren, die den Beitrag zur Gesamtkreislaufbewegung des Markens beitragen. Ich freue mich auf Ihre Rückmeldung.","Wir werden Ihre Anfrage bearbeiten und Ihnen Details zu unseren digitalen Markenwachstumsstrategien sowie zu verwendeten Indikatoren und Erfolgsmessung liefern. Vielen Dank, IhrReach out.",Request,Returns and Exchanges,medium,de,400,Feature,Feedback,Documentation,Tech Support,,,,
Skalierbare Funktionalitäten in SaaS-Lösungen,"Lieber Kundensupport, ich möchte mehr Informationen zu Skalierbarkeit in unseren Projektmanagement-SaaS-Lösungen erhalten. Könnten Sie bitte Details zu der Art und Weise erzählen, wie die Plattform bei erhöhtem Verkehr und großen Projekten umgeht? Ich möchte gerne mehr über die Unterstützung für Skalierbarkeit und die angebotenen Funktionalitäten erfahren, insbesondere über Lastverteilung, Datenbankverwaltung und Caching-Fähigkeiten. Zusätzlich freue ich mich über weitere Informationen zu den Preisplänen und deren Beziehung zur Skalierbarkeit. Vielen Dank für Ihre Zeit und Unterstützung.","Lieber [Name], ich schreibe Ihnen, um Ihre Anfrage zum Thema Skalierbarkeit unserer Projektmanagement-SaaS-Lösungen zu beantworten. Unsere Plattform ist so konzipiert, dass sie Probleme bei erhöhtem Verkehr und großen Projekten umgehen kann, was es den Kunden ermöglicht, ihre Betriebsprozesse zu skalieren. Um Ausfällen oder Leistungsproblemen entgegenzuwirken, nutzen wir Lastverteilung, um den Verkehr gleichmäßiger auf mehrere Server zu verteilen, sodass einzelne Server nicht überlastet werden. Das Datenbankverwaltungs-System ist darauf ausgelegt, große Datenmengen zu verwalten und bietet Funktionen wie automatische Indizierung und Query-Optimierung, um schnelle Abfragen zu gewährleisten.",Request,Customer Service,medium,de,400,Feature,Documentation,Tech Support,,,,,
Datensperrung - Unterstützung durch Kundenservice erforderlich,"Es gab eine Datensperrung, medizinische Daten könnten möglicherweise über ungesicherte Kanäle preisgegeben worden sein. Die veraltete Software und fehlerhafte Konfigurationen scheinen die Ursache zu sein. Die Antivirensoftware wurde aktualisiert und ein Systemaudit durchgeführt, was die Lösung ermöglicht hat. Es wird dringend Hilfe benötigt, um weitere Sperrungen zu vermeiden. Bitte geben Sie Anweisungen für die nächsten Schritte. Ich danke Ihnen für Ihre rasche Beachtung dieser Angelegenheit.","Ich bestätige die E-Mail und berichte über die Datensperrung, medizinische Daten könnten möglicherweise über ungesicherte Kanäle preisgegeben worden sein. Ich verstehe die Dringlichkeit dieser Angelegenheit und die Notwendigkeit für rasche Hilfe. Um Ihnen besser behilflich zu sein, möchte ich nachfragen, ob die Ergebnisse des Systemaudits und die durchgeführten Updates der Antivirensoftware gemeldet wurden. Könnten Sie bitte mehr Details zur Ergebnisse des Audits und den beobachteten Fehlern bereitstellen? Darüber hinaus möchte ich einen Anruf vereinbaren, um die nächsten Schritte zu besprechen und das Problem zu lösen.",Incident,Technical Support,medium,de,400,Bug,Hardware,Virus,IT,Tech Support,,,
Security Incident: Data Leak,"Our hospital has encountered a substantial data leak that may have affected medical data within our system, likely as a result of outdated software vulnerabilities.","We confirm the report of a data leak affecting medical data within our hospital systems, which may be linked to outdated software vulnerabilities. This matter should be escalated to the security team for immediate attention. Please proceed with an investigation and provide us with detailed information about the breach, including the date it was discovered and any error messages received. You can contact us at <tel_num> to discuss the necessary steps. <acc_num> is noted for reference.",Incident,Technical Support,high,en,400,Security,Bug,Performance,IT,Tech Support,,,
Bericht über Datensicherheitsunfall,"Es wurde ein Datensicherheitsunfall gemeldet, bei dem unautorisierte Zugriff auf medizinische Daten stattgefunden hat. Dies scheint auf möglicherweise fehlerhafte Firewall-Einstellungen zurückzuführen sein. Das Team hat bereits dringende Maßnahmen ergriffen, um die Zugriffssteuerungen zu verschärfen und die Benutzerrechte zu überprüfen, um zukünftige Vorfälle zu vermeiden. Wir arbeiten intensiv daran, den Unfall zu beseitigen und die Sicherheit unserer Systeme zu gewährleisten. Wir bedanken uns für Ihre Aufmerksamkeit bezüglich dieses Problems und freuen uns auf Ihre Unterstützung bei der Lösung der Angelegenheit.","Sehr geehrte/r <name>, wir haben Ihre Meldung über den Datensicherheitsunfall bezüglich eines unautorisierten Zugriffs auf medizinische Daten erhalten, der möglicherweise auf fehlerhafte Firewall-Einstellungen zurückzuführen sein könnte. Wir möchten Ihnen für die nachdrücklichen Maßnahmen danken, die Sie ergriffen haben, um die Zugriffssteuerungen zu verschärfen und die Benutzerrechte zu überprüfen. Wir sind bereit, Ihnen bei der Lösung des Problems zu helfen. Um Ihnen besser behilflich zu sein, benötigen wir möglicherweise zusätzliche Details zu der Sache, einschließlich dem Datum und der Uhrzeit, zu der der Unfall eingetreten ist, und je nach Bedarf weitere relevante Informationen. Falls erforderlich, planen wir einen Anruf an das Nummern:<tel_num>. Vielen Dank.",Incident,Technical Support,low,de,400,Security,Incident,Bug,Performance,Alert,,,
,"geehrte Kundensupport, bitte unterstützen Sie bei der Sicherung medizinischer Daten, die in der Verbindung und Integration mit DocuSign und MySQL 8.0 erfolgen. Gesundheitsdienstleister, die sensible Patientendaten verwalten, müssen sicherstellen, dass diese geschützt sind. Momentan nutzen wir DocuSign für elektronische Unterschriften und MySQL 8.0 für die Datenbankverwaltung. Könnten Sie uns informieren, ob die Systeme integrieren können, während immer HIPAA-Kompliance gewährleistet bleibt? Insbesondere interessieren wir uns für Verschlüsselungsmethoden, Zugriffssteuerungen und Audit-Protokolle. Darüber hinaus wären wir dankbar für weitere Informationen.","geehrter [name], schätzen wir Ihre Anfrage zur Sicherung medizinischer Daten in der DocuSign-MySQL 8.0-Integration. Um HIPAA-Kompliance sicherzustellen, empfehlen wir Ihnen, Verschlüsselungsmethoden wie TLS und AES zu verwenden, um Datenübertragungen während der Ruhe zu schützen. Zugriffssteuerungen und Audit-Protokolle können mithilfe der eingebauten Funktionen von MySQL 8.0, insbesondere der Zugriffsbasierten Zugriffssteuerung und der Protokollierung, implementiert werden. DocuSign bietet ebenfalls Funktionen zur Dokumentenverschlüsselung und Zugriffssteuerung. Wir freuen uns, eine eingehende Diskussion zu führen und konkrete Anleitungen zu geben. Sie wären uns sehr willkommen.",Request,Customer Service,high,de,400,Security,Backup,IT,Tech Support,,,,
Differenzien bei Investitionsanalyseberichten und Software-Aktualisierungen,"Betreuer Kundenservice, ich bemerke Unterschiede in den Investitionsanalyseberichten, die von Datenanalyse-Tools erstellt wurden. Die kürzlich installierten Software-Aktualisierungen könnten Änderungen an den Datensätzen verursacht haben. Ich habe versucht, das Software-System neu zu installieren, die Dateneingaben zu überprüfen und den Cache zu leeren, aber die Probleme blieben bestehen. Diese Unterschiede führen zu Unstimmigkeiten in den finanzlichen Prognosen und beeinflussen den Entscheidungsprozess. Ich schätze es, wenn Sie die Angelegenheit unverzüglich behandeln und mir Anweisungen zur Lösung des Problems geben könnten. Bitte lassen Sie mich wissen, wenn Sie weitere Informationen benötigen. Ich freue mich auf Ihre Rückmeldung.","Betreuer <name>, ich untersuche derzeit die Unterschiede in den Investitionsanalyseberichten. Um die Angelegenheit besser zu verstehen, könnten Sie bitte spezifische Fehlermeldungen oder Beispiele für die beobachteten Unterschiede mitteilen. Ich freue mich, Sie am Telefon <tel_num> zu besprechen, um die nächsten Schritte zur Lösung des Problems zu ermitteln. Ich wäre freundlich, wenn Sie mir dazu bereitstehen würden.",Problem,Customer Service,medium,de,400,Bug,Performance,IT,Tech Support,,,,
Verbesserung von Leistungsschwierigkeiten bei Adobe Photoshop CC 2021,"Sehr geehrte Kundensupport, ich bitte Sie um Anleitungen zur Optimierung der Leistung von Adobe Photoshop CC 2021 in einer SaaS-Umgebung. Ich habe Verzögerungen und Langsamkeiten beim Programm festgestellt und würde gerne erfahren, welche Vorgehensweisen oder Richtlinien Sie anbieten können, um die Leistung zu verbessern. Insbesondere interessiert mich, welche Einstellungen oder Konfigurationen angepasst werden können, um das Softwarepaket optimal nutzen zu können. Darüber hinaus würde ich gerne erfahren, welche Empfehlungen Sie zur Anpassung der Systemanforderungen und zu Updates geben können, um die Leistung zu optimieren. Ich freue mich über Ihre Unterstützung. Danke.","Sehr geehrter <name>, vielen Dank, dass Sie die Leistungsschwierigkeiten bei Adobe Photoshop CC 2021 gemeldet haben. Um die Leistung zu verbessern, stellen Sie sicher, dass das System den empfohlenen Anforderungen entspricht und es die neueste Version des Softwareprogramms ist. Versuchen Sie, Einstellungen wie den Scratch-Disk und den Grafikprozessor anzupassen. Wenn Probleme bestehenbleiben, freue ich mich über die Gelegenheit, darüber zu sprechen. Lassen Sie mich wissen, wann eine gute Zeit für ein Telefonat ist, und ich freue mich, mit Ihnen zu sprechen. <tel_num>",Request,Service Outages and Maintenance,high,de,400,Performance,Bug,IT,Tech Support,,,,
Concerns Over Medical Data Security,"It is imperative to draw attention to the necessity of enhanced security protocols for medical data. Given the sensitivity of medical data, it requires the highest level of protection. Please implement robust security measures to ensure compliance and protection across all affected products. This includes encryption, secure storage, and access controls. Additionally, regular security audits and updates are necessary to prevent data breaches. I would greatly appreciate it if you could provide information on the current security measures in place.","We appreciate your concern about the importance of securing sensitive medical data. We understand your request for enhanced security protocols for medical data, which should include encryption, secure storage, access controls, and regular security audits and updates. We want to assure you that we take the security of medical data very seriously and have implemented various measures to ensure compliance and protection. However, we would like to provide you with detailed information on our current security measures.",Change,Human Resources,low,en,400,Security,Compliance,IT,Tech Support,,,,
Unapproved entry into hospital network,Assistance needed for security violation,Initiate investigation into security breach at once and respond promptly,Problem,Returns and Exchanges,low,en,400,Security,Network,IT,Tech Support,,,,
Issue with Analytics Software Crash,"Customer Support, please review the following issue with the analytics software. The problem is as follows: the analytics software has crashed during data analysis, which might be due to memory overload with large datasets. Steps taken include restarting the software and optimizing data inputs, but the issue remains unresolved. Also, I have ensured that the software is up to date and that the system meets the minimum requirements, but the issue still persists. Your assistance in resolving this matter would be greatly appreciated. Please contact us at <tel_num> for further assistance.",We will investigate the crash issue with the analytics software. Please contact us at <tel_num> for further assistance.,Incident,Technical Support,low,en,400,Crash,Performance,IT,Tech Support,,,,
Urgent Improvement of Digital Strategy,"Customer Support, requesting improvements to our digital strategies as a result of persistent service outages impacting our core marketing tools and equipment. These outages have caused substantial disruptions to our operations, leading to missed deadlines and lost opportunities. Our team heavily depends on these tools to execute marketing campaigns, and frequent downtime significantly hinders our ability to meet our goals. We urge immediate action to address these issues to prevent future outages. Possible solutions could include",Received your request to enhance digital strategies due to service outages. We will review and respond with a plan of action shortly. Please allow us to investigate and contact you soon at <tel_num>.,Change,Service Outages and Maintenance,high,en,400,Outage,Disruption,Performance,Recovery,Feedback,IT,Tech Support,
Billing Problem,"Noted issues with billing discrepancies across various products, likely due to a technical glitch during the system upgrade.",We apologize for the inconvenience caused by the technical glitch. Please provide your account number so we can investigate the discrepancies and resolve the issue. Review the necessary contact information for further assistance.,Problem,Billing and Payments,high,en,400,Billing,Refund,Performance,Bug,Documentation,,,
Problem with Syncing Project Updates Across Devices,"The user is unable to sync project updates across devices using the Smart-Thermometer Chef applications following recent software updates. Despite clearing the app cache and reinstalling, the issue still exists. The user has attempted multiple troubleshooting steps but the problem continues.","We are investigating the issue with syncing project updates across devices in the Smart-Thermometer Chef applications due to recent software updates. Could you please provide the version numbers of the applications and devices you are using? Additionally, we would like to schedule a call to discuss the issue in more detail. Please let us know a convenient time to reach you at <tel_num>.",Problem,Customer Service,low,en,400,Bug,Performance,IT,Tech Support,,,,
Reported Slow Performance Issue,"Users are facing slow performance when accessing project dashboards due to the increased load from ongoing projects. We have attempted server scaling and database indexing, which showed some improvement. Assistance is needed to fully resolve the issue.","Received your email about the slow performance issue with project dashboards. To better assist you, I would like to discuss the issue over the phone. I am available to call at your convenience to provide more details and determine the next steps to resolve the issue. Please let me know a suitable time for the call.",Problem,Technical Support,high,en,400,Performance,IT,Tech Support,Maintenance,,,,
Concerning Investment Analysis Delays,There were delays in obtaining the investment analysis results due to challenges with data integration.,"<name> sincerely apologizes for the delay in providing the investment analysis results, which were caused by issues with data integration. We are working to resolve this matter as soon as possible. To better assist you, could you please provide us with more specific details about the analysis data that needs access? If it would be helpful, we can schedule a call at a convenient time for you. Please let us know a suitable time to reach you at <tel_num>. We greatly appreciate your patience and cooperation while we work to provide a timely solution.",Incident,Sales and Pre-Sales,medium,en,400,Performance,Feedback,IT,Tech Support,,,,
Support for Integrating QuickBooks Online with Elasticsearch,Is it possible to provide detailed specifications for integrating QuickBooks Online with Elasticsearch within a SaaS platform? I need to know the compatibility and specific requirements.,"We appreciate your interest in integrating QuickBooks Online with Elasticsearch within a SaaS platform. Our system supports integration through a secure API connection with QuickBooks Online, enabling seamless data synchronization. To ensure compatibility and facilitate efficient data indexing and searching, we need to confirm specific requirements. This will require knowing your current setup, including the version of QuickBooks Online and your Elasticsearch configuration.",Request,Product Support,high,en,400,Feature,Documentation,Tech Support,,,,,
Report on Service Downtime,"We have experienced significant service downtime, with several connected applications affected. The issue seems to stem from a recently implemented software update, which disrupted integrations. Restarting the affected systems and clearing caches did not resolve the problem permanently. We require assistance to quickly resolve this issue.",Please review the service downtime report at <tel_num>. Further steps for diagnosis and solving the problem can be discussed <acc_num>. Please contact us for assistance.,Problem,Service Outages and Maintenance,high,de,400,Outage,Disruption,Maintenance,Performance,IT,Tech Support,,
Enhancing Google Meet for Team Collaboration,Could you share more on optimizing Google Meet to boost team collaboration? I am interested in learning about the features and tools available to enhance our team's productivity and communication. Could you also guide us on specific settings and configurations to use for Google Meet? I would appreciate any recommendations you can provide to help us make better use of the platform and improve team collaboration.,"We can offer guidance on optimizing Google Meet for team collaboration. With Google Meet, explore features such as screen sharing, recording meetings, and integrating Google Workspace tools. I recommend reviewing the settings and configurations to ensure they align with your team's needs. If you would like to discuss further, please let me know a convenient time for a call, as I am happy to assist with specific recommendations for your team.",Request,Technical Support,high,en,400,Feature,Feedback,Documentation,IT,Tech Support,,,
Support für Integration von BigCommerce und ClickUp in Projektmanagement,Können detaillierte Anleitungen für die Integration von BigCommerce in ClickUp für Projektmanagement bereitgestellt werden?,"Integrationsanleitungen werden bereitgestellt. Bitte lassen Sie sich gelegenheitsweise verbinden, um die Details und Anforderungen für die Integration von BigCommerce in ClickUp für Projektmanagement zu besprechen.",Request,IT Support,medium,de,400,Feature,Documentation,Tech Support,,,,,
Notwendigkeit der IT-Sicherheitsprüfungen,Aufgetretene Sicherheitslücken haben Unsicherheiten hinsichtlich der IT-Sicherheit geweckt. Die Aktualisierung der Antivirus-Software und die Durchführung der ersten Server-Audit-Untersuchungen sind wichtige Schritte.,"Sehr geehrte/n [Name],\n\nich teile Ihre Befürchtungen bezüglich der IT-Sicherheitsmaßnahmen in Anbetracht der neu aufgetretenen Sicherheitslücken. Die Aktualisierung der Antivirus-Software und die Durchführung der ersten Server-Audit-Untersuchungen sind gute Anfangsschritte.\n\nUm die Sicherheitslage zu verbessern, empfehle ich eine umfassende Überprüfung unserer IT-Sicherheitsmaßnahmen. Dies umfasst die Bewertung der Firewall-Konfigurationen, die Überprüfung der Zugriffskontrollen und die Anpassung der Angriffsbehandlungsvorschriften. Ich freue mich, mit Ihnen telefonisch über die Möglichkeiten einer umfassenden Sicherheitsprüfung zu sprechen, um die nächsten Schritte und den besten Weg zur Sicherheitsverbesserung zu bestimmen.",Problem,Billing and Payments,high,de,400,Security,IT,Tech Support,Maintenance,,,,
Concern Regarding Security Breach at Hospital,"An unauthorized access attempt has been detected on the hospital's systems, indicating a possible vulnerability that was exploited.","Dear [Name], we are taking immediate action regarding the unauthorized access attempt detected on the hospital's systems. Our team will investigate the potential vulnerability that was exploited to prevent future incidents. To assist with the investigation, could you please provide us with information about the detected attempt, including the date and time it occurred, as well as relevant system logs? If necessary, we may need to schedule a call to discuss this further. I am available at [tel_num] to speak with one of our cybersecurity specialists at your convenience.",Incident,Product Support,high,en,400,Security,IT,Tech Support,Alert,,,,
