subject,body,answer,type,queue,priority,language,version,tag_1,tag_2,tag_3,tag_4,tag_5,tag_6,tag_7,tag_8
,"Eine Sicherheitsverletzung wurde entdeckt, die die Vertraulichkeit der IT- und medizinischen Daten im Krankenhaus beeinträchtigt hat. Möglicherweise sind veraltete Software-Schwachstellen die Ursache; erste Patches wurden bereits durch Scans identifiziert, jedoch bestehen die Probleme weiterhin. Weitere Untersuchungen sind notwendig, um das Problem zu beheben.","Das Krankenhaus erkennt die Sicherheitsverletzung an. Experten werden beauftragt, die Angelegenheit zu untersuchen und zu beheben. Bitte gestatten Sie uns, einen Anruf zu vereinbaren, um die nächsten Schritte zu besprechen und einen Plan zur Behebung der veralteten Software-Schwachstellen zu entwickeln.",Incident,Billing and Payments,medium,de,52,Security,Vulnerability,IT,Software,Investigation,Patch,Scan,
Server Problems,"Facing issues with project dashboards. Might be due to server overload after the recent update, leading to downtime. Server was restarted, cache cleared, and update was reverted.",Received an email about server issues affecting project dashboards. Kindly provide any error messages you are seeing and the current status of the server. We will investigate and discuss possible solutions to resolve the issue.,Incident,General Inquiry,medium,en,52,Server,Performance,Outage,Disruption,Recovery,,,
Anfrage zu Digitalen Marketingdienstleistungen für Markenentwicklung,"Ich bin daran interessiert, mehr über Strategien im digitalen Marketing zu erfahren, die das Wachstum unserer Marke fördern. Bitte stellen Sie zusätzliche Informationen bereit, wie Ihr Unternehmen dabei unterstützen kann.","Gerne bespreche ich digitale Marketingdienstleistungen mit Ihnen. Bitte lassen Sie uns einen Anruf vereinbaren, um weitere Details zu erörtern und Ihre Fragen zu Strategien für das Markenwachstum zu klären.",Request,IT Support,high,de,52,Marketing,Brand Development,Digital Strategy,Growth,Digital Marketing,Business Information,,
Increasing Concerns Over Healthcare Data Security,"Customer Support is raising awareness about an urgent issue concerning the security of the healthcare provider's systems. Recently, there have been incidents of unauthorized access that have jeopardized the confidentiality of medical records stored in hospital systems. Despite the deployment of firewall updates and antivirus scans, some vulnerabilities remain unaddressed. It is believed that these issues may stem from outdated security protocols that are no longer effective. The situation is serious, and immediate measures are required to resolve these concerns. We request assistance in conducting a comprehensive review, scheduling a security audit, updating protocols, and strengthening system defenses. Kindly allow us to contact <tel_num> to discuss appropriate steps and arrange a suitable time for the audit.","To address these concerns, please review the issues, arrange a security audit, update protocols, and improve system defenses. Kindly permit us to contact <tel_num> to discuss the necessary steps and schedule the audit at a convenient time.",Problem,Technical Support,medium,en,52,Security,IT,Alert,Disruption,,,,
Verbindungsprobleme mit der Datenbank,"Sehr geehrter Kundenservice, ich erfahre sporadische Verbindungsabbrüche bei der Datenbank, die auf SQL Server und Cassandra 4.0 basiert. Das Problem könnte auf Netzwerk-Latenzzeiten in Azure zurückzuführen sein. Das Team hat bereits versucht, die Dienste neu zu starten und die Netzwerkprotokolle zu überprüfen, jedoch wurde bisher keine Lösung gefunden. Die Fehler treten unregelmäßig und unvorhersehbar auf, was die Ursachenfindung erschwert. Ich würde Ihre Unterstützung bei der Anleitung zur Problemlösung sehr schätzen. Bitte prüfen Sie die Angelegenheit und schlagen Sie mögliche Maßnahmen vor, um das Problem zu beheben.","<name>, ich untersuche das Verbindungsproblem mit der Datenbank, insbesondere bei SQL Server und Cassandra 4.0. Ich recherchiere derzeit und möchte zusätzliche Informationen anfordern, einschließlich der Netzwerkprotokolle und etwaiger Fehlermeldungen, die wir erhalten haben. Könnten Sie bitte Details bereitstellen und einen passenden Zeitpunkt nennen, an dem ich Sie unter <tel_num> anrufen kann, um das Thema zu besprechen? Ich werde mein Bestes tun, um Anleitungen zur Fehlerbehebung zu geben und eine Lösung zu finden, wobei die mögliche Netzwerk-Latenz in Azure berücksichtigt werden sollte. Bitte prüfen Sie die bereitgestellten Informationen und schlagen Sie die nächsten Schritte vor.",Incident,Customer Service,low,de,52,Network,Disruption,Performance,IT,Tech Support,,,
Tägliche intermittierende Serviceausfälle bei integrierten Produkten,"Sehr geehrter Kundendienst, ich möchte auf wiederkehrende Serviceunterbrechungen hinweisen, die mehrere integrierte Produkte betreffen. Das Problem scheint während der Stoßzeiten durch Überlastung des Backend-Servers verursacht zu werden. Ich habe versucht, das Problem durch einen Systemneustart und das Löschen der Caches zu beheben, doch die Unterbrechungen bestehen weiterhin. Trotz meiner Bemühungen beeinträchtigen die Unterbrechungen nach wie vor den täglichen Betrieb. Ich würde es sehr schätzen, wenn die Angelegenheit schnellstmöglich untersucht und eine Lösung gefunden werden könnte. Bitte lassen Sie mich wissen, falls Sie weitere Informationen benötigen.","Bitte untersuchen Sie das Problem und nennen Sie die Kontonummer sowie eine passende Rückrufzeit, um die Details zu besprechen.",Incident,Service Outages and Maintenance,low,de,52,Outage,Disruption,Recovery,Performance,,,,
Server Performance Problems Encountered Today,"A user reported experiencing frequent slowdowns during peak hours, likely due to server overload or inadequate resource allocation. Restarting the application and clearing the cache did not resolve the problem. The issue continues to impact the user experience. Kindly investigate and resolve this matter as soon as possible.","We received an email regarding the server performance issue. Please investigate the cause of the slowdowns and work towards resolving the problem promptly. Kindly provide details of any error messages or symptoms observed. If necessary, schedule a call at <tel_num> to discuss the issue further and facilitate a quick resolution for account <acc_num>.",Problem,Customer Service,medium,en,52,Performance,Outage,Disruption,Recovery,,,,
Hospital System Problems,"Customer Support, a healthcare provider has encountered difficulties accessing data within hospital systems, potentially due to recent software updates. Attempts to resolve this included rebooting the system and running antivirus scans, but the problem remains. We require assistance to resolve this promptly to reduce disruptions to patient care. Kindly help us troubleshoot and provide a solution to this issue. We appreciate your prompt attention and look forward to your response.","<name>, thank you for contacting the service desk regarding the hospital system issue. We understand the urgency of resolving this to minimize disruptions to patient care. To assist you more effectively, could you please share any error messages or symptoms you are experiencing? We would also like to schedule a call to troubleshoot the problem and determine the appropriate course of action. Please let us know a convenient time to contact <tel_num> and discuss this matter.",Problem,Technical Support,medium,en,52,Bug,Disruption,Security,IT,Tech Support,,,
,"Customer Support, I am reaching out to highlight an issue with the company's data analytics platform. The platform is unable to successfully integrate multiple software tools, causing delays in investment optimization. Despite efforts such as restarting the system, updating the software, and initial troubleshooting, the problem remains unresolved. It may be related to compatibility issues among the various products in use. I would greatly appreciate it if you could look into this matter and provide a solution as soon as possible regarding the integration tools.","<name>, thank you for bringing this issue to our attention. We apologize for the inconvenience caused by the integration failure of the data analytics platform. We will investigate potential compatibility problems and work towards a solution. Could you please provide details about the software tools you are trying to integrate and any error messages received? Feel free to call <tel_num> to discuss this further.",Incident,Technical Support,high,en,52,Bug,Performance,Outage,Disruption,Recovery,IT,Tech Support,
Potential Medical Data Breach Due to Outdated Software,"A hospital has experienced a possible exposure of medical data, likely caused by outdated software patches. Initial actions taken included updating antivirus definitions, scanning all devices, and reviewing network access logs. Despite these efforts, the issue persists. We have contacted customer support for assistance in managing the security breach. We are concerned about the possible impact on patient information and would like to request help in identifying the root cause and implementing solutions to prevent recurrence.",This email addresses a potential medical data exposure caused by outdated software patches. I would like to arrange a call at <tel_num> to discuss the situation in more detail. Please provide information about the specific software patches involved and suggest a convenient time for the call. This will help us determine the next steps to resolve the security breach.,Incident,Product Support,low,en,52,Security,Outage,Disruption,Recovery,IT,Tech Support,,
,"Customer Support, reporting an issue with the project management SaaS platform where slow performance occurs during peak hours, likely due to server overload. Initial troubleshooting included server restarts and database query optimization, but the problem remains. Despite these efforts, the platform continues to experience sluggishness, inconveniencing users. We would greatly appreciate it if you could investigate the matter and provide a solution to resolve the server issues.","<name>, thank you for reporting the issue with the project management SaaS platform regarding slow performance caused by server overload. We apologize for the inconvenience this has caused our users. We understand that initial troubleshooting steps, such as restarting servers and optimizing database queries, have been attempted but the problem persists. To assist our investigation, could you please provide details on any specific error messages, the times when slow performance occurs, and any recent changes made to the system configuration?",Problem,General Inquiry,low,en,52,Performance,Outage,Disruption,Recovery,IT,Tech Support,,
Aktualisierung der Integration in die Digitalstrategie über verschiedene Plattformen hinweg,"Sehr geehrter Kundendienst, ich möchte um eine Aktualisierung unserer Integrationen im Bereich der Digitalstrategie für Plattformen wie Spotify und Coursera bitten. Dies soll dazu beitragen, das Markenwachstum zu fördern und eine breitere Zielgruppe zu erreichen. Ich würde es begrüßen, wenn Sie mein Anliegen annehmen und eine Lösung bereitstellen könnten. Bitte informieren Sie mich, falls weitere Details erforderlich sind. Vielen Dank für Ihre Zeit und Unterstützung. Ich freue mich auf eine baldige Rückmeldung.","Ihre Anfrage zur Integration in die Digitalstrategie wird geprüft. Wir werden in Kürze Kontakt aufnehmen, um die Angelegenheit zu besprechen und bei Bedarf zusätzliche Informationen anzufordern.",Change,Sales and Pre-Sales,low,de,52,Feature,Integration,Digital Strategy,Platform,Growth,Customer Service,,
Investment Strategy,"Sehr geehrter Kundendienst, ich schreibe, um Unterstützung bei der Optimierung unserer Datenanalyseprozesse im Zusammenhang mit unserer Anlagestrategie zu erbitten. Die Optimierung betrifft mehrere Systeme, darunter Datenbanken und Sicherheitssoftware. Ich möchte Rat hinsichtlich des am besten geeigneten Ansatzes sowie Empfehlungen für Werkzeuge und Ressourcen einholen, die uns bei der Erreichung unserer Ziele unterstützen können. Ziel ist es, die Effizienz und Genauigkeit unserer Anlagestrategie zu verbessern. Ich schätze Ihre Unterstützung bei dieser Angelegenheit sehr. Bitte lassen Sie mich wissen, falls Sie weitere Informationen benötigen, um fortzufahren.","Bitte prüfen Sie die Anfrage und kontaktieren Sie <tel_num>, um den besten Ansatz sowie geeignete Werkzeuge zur Optimierung der Datenanalyseprozesse im Zusammenhang mit der Anlagestrategie zu besprechen.",Change,Product Support,medium,de,52,Feedback,Security,IT,Tech Support,,,,
Netzwerkzugangsproblem,"Der Gesundheitsdienstleister erlebte zeitweise Verzögerungen beim Zugang zu sicheren medizinischen Daten. Das Problem wurde vermutlich durch kürzliche Änderungen in der Netzwerkkonfiguration verursacht. Nach einem Netzwerk-Reset und erneutem Versuch der Benutzer-Authentifizierung besteht das Problem weiterhin. Eine weitere Untersuchung ist notwendig, um die Ursache zu identifizieren und zu beheben. Bitte unterstützen Sie dabei, das Problem so schnell wie möglich zu lösen, um einen ununterbrochenen Zugriff auf kritische medizinische Informationen zu gewährleisten.","Der Netzwerkzugang sollte umgehend überprüft werden. Könnten Sie bitte weitere Details zu den kürzlichen Änderungen in der Netzwerkkonfiguration sowie genaue Fehlermeldungen bei den Zugriffsversuchen bereitstellen? Kontaktieren Sie <tel_num>, um die nächsten Schritte zu besprechen und eine Lösung zu planen.",Incident,Product Support,low,de,52,Network,Security,Disruption,IT,Tech Support,,,
,"A financial organization is facing sluggish data processing, which is affecting their investment analysis. The problem might stem from integration issues between MATLAB, PostgreSQL, and AWS. Initial troubleshooting steps like system restart have been attempted, but the issue remains unresolved. Assistance is needed to address this problem promptly to reduce operational disruptions.","We have received your request regarding the slow data processing issue at the financial firm. To better understand the situation, please provide details about the integration setup and any errors encountered. We would like to arrange a call at your convenience to discuss and explore potential solutions. Kindly inform us of a suitable time for a call at <tel_num> so we can proceed with troubleshooting the integration problems across MATLAB, PostgreSQL, and AWS.",Problem,Technical Support,low,en,52,Performance,Disruption,IT,Tech Support,,,,
Problem with Accessing the Project Dashboard,"Customer Support is facing sporadic difficulties with users reaching the project dashboard. The probable cause might be server overload or connectivity problems. Initial measures have been implemented, including server restarts, log reviews, and cache clearing. Despite these efforts, the issue remains unresolved and requires further assistance. Could you please examine the matter and offer a solution at your earliest convenience? Thank you for your prompt attention; we look forward to your response soon.",We will investigate and contact you shortly,Problem,Technical Support,medium,en,52,Performance,Network,Outage,Disruption,Recovery,,,
,"Dear Customer Support Team,\n\nI am reaching out to request assistance with incorporating Hemingway Editor into our digital marketing strategies. As you may know, the Hemingway Editor is a tool designed to simplify writing by highlighting complex sentences and suggesting alternative phrases to enhance clarity.\n\nOur team is interested in utilizing this tool to improve the readability and overall quality of our content. However, we need detailed guidance on how to effectively integrate it into our existing workflows and strategies.\n\nCould you please provide us with step-by-step instructions?","Please provide detailed, step-by-step instructions for integrating Hemingway Editor into digital marketing strategies. Send us a guide on best practices for using the tool to optimize blog posts and social media updates. Feel free to contact <tel_num> for further discussion.",Request,Technical Support,medium,en,52,Feedback,Product,Feature,Documentation,,,,
Microsoft Dynamics Assistance,"Customer Support team, I am seeking detailed instructions on how to integrate Microsoft Dynamics 365 with Avast Premium Security for secure investment data analytics. Our organization aims to utilize these platforms to improve data security and analytics capabilities. Could you please provide a comprehensive, step-by-step guide for the integration process, including necessary configuration adjustments and troubleshooting advice? Our primary concern is to ensure that our investment data stays protected and compliant with relevant industry standards. Additionally, could you please assist with further information?","Please provide guidance on integrating Microsoft Dynamics 365 with Avast Premium Security. To better assist you, I would like to schedule a call at <tel_num> to discuss your specific requirements and offer detailed, step-by-step instructions for the integration, ensuring your investment data remains secure and compliant with industry regulations.",Request,Billing and Payments,high,en,52,Security,IT,Tech Support,Documentation,Feature,,,
,"Customer support team is addressing a report regarding an issue with the investment data analytics system. The system has encountered data discrepancies, likely due to synchronization errors. Our team has attempted to resolve the problem by rebooting servers and verifying data pipelines, but unfortunately, the issue persists. Upon reviewing system logs, inconsistencies in the data synchronization process have been identified. We are concerned that this problem may be leading to inaccurate analytics, which could impact investment decisions. We would greatly appreciate your assistance in this matter.","<name>, thank you for reporting the issue with the investment data analytics system. We apologize for any inconvenience caused by the data discrepancies. To assist you further, could you please provide the system logs you mentioned, specifically details of the inconsistencies found? If necessary, we can schedule a call at <tel_num> to discuss this in more detail. Please let us know a convenient time; we are happy to help resolve this matter.",Incident,Product Support,medium,en,52,Bug,Performance,Outage,Disruption,Recovery,IT,Tech Support,
Bericht über Schwierigkeiten mit der Marketingkampagne,Das Marketingunternehmen erlebt aufgrund jüngster Änderungen am Plattformalgorithmus eine inkonsistente Kampagnenleistung. Die Anpassung der Zielgruppen in den Anzeigen hat die Ergebnisse verbessert.,"Sehr geehrter <Name>,\n\nich schreibe Ihnen bezüglich des Berichts über Probleme mit der Marketingkampagne und der inkonsistenten Kampagnenleistung infolge kürzlicher Änderungen am Plattformalgorithmus. Es tut uns leid zu hören, dass die Anpassung der Zielgruppen in den Anzeigen zu einer erwarteten Verbesserung der Ergebnisse geführt hat. Um das Problem besser zu verstehen und eine effektivere Lösung anbieten zu können, bitten wir Sie, uns weitere Informationen zur Kampagne bereitzustellen, wie beispielsweise spezifische Kennzahlen, die den Erwartungen entsprechen, sowie eventuelle Fehlermeldungen, die möglicherweise aufgetreten sind.\n\nAußerdem",Incident,Product Support,medium,de,52,Performance,Outage,Disruption,Recovery,,,,
Alteryx Integration with Oracle Database Support,"Customer support inquiry regarding best practices for integrating Alteryx with Oracle Database 19c to enhance investment analytics workflows. Seeking guidance on optimizing data processing and analytics using available tools. Would appreciate any recommendations or resources that could assist in improving workflow efficiency. Specifically interested in advice on data connectivity, workflow automation, and data visualization. Thank you for your assistance; I look forward to your response.","<name>, thank you for contacting the service desk. We appreciate your interest in optimizing your investment analytics workflow with Alteryx and Oracle Database 19c. For data connectivity, we recommend using the Oracle Database connector in Alteryx to establish a secure connection. To automate workflows, consider utilizing Alteryx's built-in tools such as Event Handler and Scheduling features. For data visualization, explore the various options available within Alteryx, including charts and maps. We can schedule a call to discuss further if needed.",Request,IT Support,medium,en,52,Product,Support,Integration,Database,Automation,Guidance,Efficiency,
Digital Marketing Solutions,"Customer Support, I am reaching out to inquire about billing details and payment options for digital marketing solutions. Specifically, I am interested in learning about services related to brand expansion. Could you provide a comprehensive breakdown of costs and available payment plans? I would also appreciate information about the services offered that can assist in growing my business. Please inform me of any additional fees or charges associated with these services. Thank you for your time and assistance. I look forward to your response.","<name>, thank you for contacting us regarding digital marketing solutions. We offer tailored brand growth services with a variety of payment options. I would be happy to provide a detailed cost breakdown and discuss the available plans. Please let us know a convenient time to call at <tel_num> so we can go over your questions and any associated fees. We look forward to speaking with you and helping your business grow.",Request,Billing and Payments,medium,en,52,Billing,Payment,Customer Support,Service,Product,,,
Unterstützung bei Digital Marketing Herausforderungen,"Sehr geehrter Kundenservice, ich bitte um Unterstützung bei meinen digitalen Marketingaktivitäten. Unsere Marketingagentur hat Schwierigkeiten, das Markenwachstum durch digitale Strategien voranzutreiben. Trotz Überarbeitung der Kampagnenpläne und Verbesserungen in der Suchmaschinenoptimierung sowie der Steigerung der Aktivitäten in den sozialen Medien sind nur begrenzte Fortschritte sichtbar. Das Problem scheint in einer unklaren Zielgruppenanalyse und inkonsistenten Inhalten zu liegen. Wir haben verschiedene Ansätze ausprobiert, doch die Ergebnisse sind enttäuschend. Ich würde Ihre Empfehlungen schätzen, um unsere digitale Marketingstrategie zu optimieren und letztlich das Markenwachstum zu fördern. Vielen Dank.","<name>, ich verstehe Ihre Bedenken hinsichtlich der digitalen Marketingaktivitäten und der mangelnden Verbesserungen trotz der Überarbeitungen der Kampagnenpläne und der gesteigerten Aktivitäten in den sozialen Medien. Um Ihnen besser helfen zu können, würde ich gerne die Zielgruppenanalyse und die Content-Strategie genauer besprechen. Könnten Sie bitte weitere Informationen zu Ihrer aktuellen digitalen Marketingstrategie bereitstellen, einschließlich Zielgruppendemografie und Content-Kalender? Dies würde uns ermöglichen, gezieltere Ratschläge und Empfehlungen zur Verbesserung Ihrer digitalen Marketingstrategie zu geben, um das Markenwachstum zu steigern. Ich freue mich auf einen passenden Zeitpunkt, um Sie anzurufen und die Details zu besprechen. Wäre das für Sie in Ordnung?",Problem,Human Resources,low,de,52,Marketing,Strategy,Performance,Customer Support,,,,
Report of Failure in Investment Optimization System,"Customer Support,\n\nOur company's data analytics platform experienced a crash in the investment optimization module, potentially due to software conflicts or hardware overload. Initial troubleshooting steps included restarting applications and performing hardware diagnostics, but the issue persisted. Despite these efforts, the problem remains unresolved, and we are seeking further assistance.\n\nThis crash occurred during a critical period for investment optimization, causing substantial delays and risking significant financial impact. The team has attempted to identify the root cause, but the complexity has hindered resolution.","We have received a report concerning a failure in the investment optimization system. Please escalate this issue to the technical team for urgent investigation. To assist further, kindly confirm a convenient time for a callback to discuss the details and arrange a potential remote session to diagnose and resolve the problem.",Incident,Technical Support,high,en,52,Crash,Hardware,Performance,Disruption,Recovery,Software Conflict,,
Frequent App Crashes,"The application crashes during task synchronization on iOS Shopify, potentially due to update conflicts.",We apologize for the inconvenience caused by the app crashing during task sync on iOS Shopify. Could you please provide details about the update conflicts you are experiencing? We are happy to assist in resolving this issue. Kindly let us know a convenient time for a callback at <tel_num>.,Problem,Customer Service,low,en,52,Crash,Performance,Bug,Disruption,,,,
,"Customer Support is seeking guidance on scheduling maintenance windows for our SaaS project management platform. We aim to reduce the impact on users and would appreciate your advice on best practices. Could you please share recommendations for effectively scheduling maintenance windows, especially strategies to minimize downtime and ensure users are notified in advance? Additionally, we would like to know about specific tools and resources available to assist with this process.","To assist with scheduling maintenance windows that minimize downtime and ensure user notifications, please let us know a convenient time for a call to discuss further.",Request,Service Outages and Maintenance,medium,en,52,Maintenance,IT,Tech Support,Outage,Disruption,Recovery,,
