subject,body,answer,type,queue,priority,language,version,tag_1,tag_2,tag_3,tag_4,tag_5,tag_6,tag_7,tag_8
Problem with Payment Services,Encountered unforeseen billing troubles with subscription services. These arose from an error in the payment processing system. Checked payment information and tried to address any discrepancies through customer support.,Received your email about the issues with payment services and apologize for the inconvenience caused by the error in the payment processing system. We are looking into the matter and attempting to resolve the discrepancies. Could you please provide the specific error message you received and more details about the issue with your subscription services to better assist in finding a solution? It would be helpful to discuss further at your convenient time.,Incident,Billing and Payments,medium,en,400,Billing,Payment,Disruption,Bug,Tech Support,,,
Secure Handling of Medical Data with OBS Studio,In need of customer support to guide securely managing medical data using OBS Studio and Sony Vegas Pro 18 for video editing and streaming. Must ensure that sensitive patient information is protected and compliant with relevant regulations. Would appreciate recommendations on best practices and securing medical data with software tools. Looking forward to your assistance and look forward to hearing back soon.,Please contact <tel_num> to discuss securing medical data with OBS Studio and Sony Vegas Pro 18.,Request,IT Support,medium,en,400,Security,IT,Tech Support,Feedback,,,,
Problem mit der Projektverwaltungstraffikplattform,"Wir erleben einen unerwarteten Ausfall der Projektmanagement-Plattform. Es scheint, dass die neuesten Code-Updates mit dem Server haben zu tun. Wir haben bereits versucht, zur vorherigen Version zurückzukehren und die Serverkapazität zu erhöhen, aber das Problem behält sich hartnäckig. Das Team wird erhebliche Verzögerungen erleben, da es kritische Projektinformationen nicht zugreifen kann. Wir schätzen Ihr Engagement, die Angelegenheit schnellstmöglich zu lösen. Bitte informieren Sie uns, wenn Sie weitere Informationen benötigen, um das Problem zu lösen.","Sehr geehrte [Name],\n\nich bestätige Ihre E-Mail in Bezug auf das Problem mit der Projektverwaltungstraffikplattform. Ich verstehe die Bedeutung der Situation und den Einfluss auf die Fähigkeit des Teams, kritische Projektinformationen zu erhalten. Wir werden das Problem ernst nehmen und alles tun, um es schnellstmöglich zu lösen.\n\nUm die Ursache des Problems besser zu verstehen, bitten wir um zusätzliche Informationen. Bitte teilen Sie den genauen Fehlerhinweis mit, damit wir versuchen, das System zu zugreifen und relevante Logdateien und Screenshots zu erhalten, die uns weiterhelfen.\n\nVielen Dank und beste Grüße",Problem,Technical Support,high,de,400,Outage,Disruption,Performance,IT,Tech Support,,,
Data Sync Delays,"Customers are facing delays in data synchronization because of high server load. Despite optimizations, the issues continue to persist.",Acknowledged the email concerning data synchronization delays. Kindly furnish details on the server load and the optimizations implemented. This will aid in investigating and assisting to resolve the issue.,Problem,Product Support,high,en,400,Performance,Network,Bug,Maintenance,,,,
,"I am preparing a report on significant disruptions in digital marketing strategies due to software compatibility issues. Recent updates to key applications might be causing these problems. We have attempted reinstalling the affected software and updating device drivers, but the issue still persists. I would greatly appreciate your assistance in resolving this matter.","I am pleased to offer help with the software compatibility issues affecting your digital marketing strategies. To better understand the problem, I would like to know the recent updates and any error messages you are encountering. Could you please provide details on the affected software and devices? I am available to discuss further and can contact you at your convenience; please let me know a suitable time.",Incident,Technical Support,medium,en,400,Disruption,Software,Performance,IT,Tech Support,,,
Fehlermeldung für Datenaufarbeitungs-Tool,"Bitte melden Sie folgendes Problem mit dem Datenaufarbeitungs-Tool: Das Tool bricht unerwartet bei der Nutzung ab. Dies könnte auf eine Mangelhaftigkeit des HyperX Fury 32GB DDR4-Speichers zurückzuführen sein. Versucht man, das Programm neu zu starten und den Cache zu löschen, bleibt das Problem bestehen. Gestern funktionierte das Tool perfekt. In den letzten Tagen wurden Änderungen am System vorgenommen. Ich schätze, es wäre hilfreich, wenn Sie das Problem schnell bearbeiten und eine Lösung anbieten könnten. Bitte lassen Sie mich wissen, falls weitere Informationen benötigt werden.","Sehr geehrte/r [Name], vielen Dank für Ihre Meldung zum Problem mit dem Datenaufarbeitungs-Tool. Entschuldigen Sie die Unannehmlichkeiten, die verursacht wurden. Die von Ihnen bereitgestellten Details wurden bereits beachtet, einschließlich der möglichen Ursache, die mit der HyperX Fury 32GB DDR4-Speicherkapazität zusammenhängt. Um das Problem genauer zu untersuchen, bitten wir Sie, den genauen Fehlermeldungstext anzugeben, der sich beim Absturz des Tools einstellt, sowie die genaue Versionsnummer Ihres Betriebssystems zu bestätigen. Falls nötig, können wir telefonisch Kontakt aufnehmen, um zusätzliche Informationen zu sammeln. Wären Sie damit einverstanden? Wir werden unser Bestes tun, um das Problem so schnell wie möglich zu lösen. ",Incident,Product Support,low,de,400,Bug,Performance,IT,Tech Support,,,,
Irregular Investment Performance Indicators Amidst Analytics Software Challenges,"Facing irregular investment performance indicators that seem linked to issues within the analytics software. This could be due to outdated algorithms or data integration problems. Despite attempts to recalibrate models and refresh data inputs, the discrepancies continue to exist. Assistance is required to resolve this issue.","Please review the issue and contact <tel_num> for further discussion. Kindly provide detailed information about the discrepancies and the specific analytics tools being used, as this will help us better assist in resolving the irregular investment performance indicators.",Problem,Customer Service,medium,en,400,Performance,Bug,IT,Tech Support,,,,
Guidance on Securing Medical Data with Salesforce,I am seeking advice on practices for securing medical data using Salesforce CRM. Could you provide guidance on implementing strong security measures to protect sensitive patient information? I would appreciate any recommendations or resources that can help ensure compliance with regulatory requirements.,"I can provide guidance on securing medical data with Salesforce, including implementing robust security measures to ensure compliance with regulatory requirements. Please allow me to call at your earliest convenience to discuss this further.",Request,Customer Service,low,en,400,Security,Compliance,IT,Tech Support,,,,
Informationen zu Rechnungsstellungsmöglichkeiten für SaaS-Projektmanagement-Plattform,"Ich hoffe, es geht Ihnen gut. Ich schreibe an, um detaillierte Informationen zu den verfügbaren Rechnungsstellungsmöglichkeiten für unsere SaaS-Projektmanagement-Plattform zu erhalten. Könnten Sie mir die jeweiligen Preisangaben für die verfügbaren Pläne sowie eventuelle Rabatte und Promos mitteilen? Ich würde mich freuen, wenn Sie mir diese Informationen zur Verfügung stellen könnten. Danke für Ihre Unterstützung und freue mich darauf, bald von Ihnen zu hören.","Sehr geehrte Kundenservice,\n\nich freue mich, Ihnen bei Ihrer Anfrage zu Rechnungsstellungsmöglichkeiten für unsere SaaS-Projektmanagement-Plattform behilflich zu sein. Wir bieten derzeit drei Pläne an: Grundplan, Premiumplan und Unternehmensplan.\n\nDer Grundplan kostet monatlich pro Benutzer, der Premiumplan kostet pro Benutzer, während der Unternehmensplan sich auf die spezifischen Bedürfnisse Ihrer Organisation abstimmt.\n\nJeder der Pläne verfügt über unterschiedliche Funktionen. Der Grundplan umfasst grundlegende Projektmanagement-Tools, während der Premiumplan zusätzliche Funktionen und fortgeschrittene Berichterstattung sowie die Integration von Werkzeugen bietet.",Request,Billing and Payments,high,de,400,Billing,Payment,Refund,Feature,Documentation,Sales,,
Issue with Billing for Digital Products,"Dear Customer Support, I am writing to bring to your attention a billing error that has resulted in overcharges for multiple digital products. This issue might have arisen due to system glitches since the last update. Steps have been taken to resolve this, including reviewing the invoices and reaching out to customer support, but unfortunately, the issue persists. The overcharges have caused inconvenience, and I would appreciate it if you could look into the matter urgently. I have already tried troubleshooting the problem by checking my account settings and payment history.","<name>, thank you for reaching out regarding the billing error for digital products. We apologize for the inconvenience caused. To assist you further, could you please provide your <acc_num> and a detailed list of the overcharged products? We will investigate the matter urgently and aim to provide a solution and rectify the error as soon as possible.",Incident,Billing and Payments,high,en,400,Billing,Payment,Refund,Bug,Disruption,,,
Issues with Data Analytics Software,The data analytics software is causing problems with investment evaluations because the drivers are outdated.,"I will send an acknowledgment email regarding the issues with the data analytics software due to outdated drivers. I recommend resolving the issue by updating to the latest driver version. If you need assistance with the update process, please let me know, and I will be happy to guide you through scheduling a call at your convenience to walk you through the steps.",Problem,IT Support,medium,en,400,Bug,Performance,Product,Feature,Documentation,,,
Sichere Medizinische Datenerfassungssysteme,"Ersetzen erweiterte Sicherheitsmaßnahmen Datenerfassung im Bereich Medizin IT-Systeme in Krankenhäusern, um unerlaubten Zugriff und Datenverletzungen zu verhindern. Sie helfen, sensible Patientendaten vor cyberbasierten Angriffen zu schützen.","Vielen Dank für Ihre E-Mail zur sichereren Medizinischen Datenerfassungssysteme. Wir nehmen die Datenschutzfrage ernst und sind verpflichtet, sensible Patientendaten zu schützen. Wir werden die aktuellen Sicherheitsmaßnahmen überprüfen und erweiterte Protokolle einsetzen, um unerlaubten Zugriff und Datenverletzungen zu verhindern. Bitte kontaktieren Sie uns, um weitere Details zur Implementierung zu besprechen.",Change,Service Outages and Maintenance,high,de,400,Security,Virus,Network,Bug,,,,
Concern About Marketing Connectivity,"A significant issue has emerged with connectivity that is impacting our marketing strategies. This might be related to recent software updates or hardware compatibility issues. Efforts to resolve the issue, such as rebooting devices and checking network settings, have not been successful.","Acknowledging the issue with marketing connectivity, I am sorry to hear that the problem continues despite previous attempts to resolve it, including rebooting devices and checking network settings. We would like to investigate this further. Could you please provide details on the recent software updates and hardware specifications used? It would be helpful to discuss this issue with you, and I would be available for a call at your convenience.",Incident,Technical Support,medium,en,400,Network,Hardware,Bug,Performance,IT,Tech Support,,
Message - Breach in Customer Support,"Experienced a breach involving protected medical data. Recent software degradation is to blame. Temporary security patches have been implemented, but further anomalies have occurred. The team is partially working on rectifying the breach to ensure system security. Updates will be provided as more information becomes available.",Thank you for the report. We will investigate the breach and assist in finding a solution.,Incident,Technical Support,high,de,400,Security,Performance,Outage,IT,Tech Support,,,
Facing Service Outage Potentially Due to Infrastructure Overload,"Our service is experiencing an outage possibly due to infrastructure overload. The team has restarted the affected servers, but the issue still persists. We are actively working to resolve it and will provide updates shortly. Possible resolution is ongoing.",We acknowledge the service outage and appreciate the team's efforts to resolve it. Please provide an estimated time for resolution. You can contact us at <tel_num> for further discussion.,Incident,Service Outages and Maintenance,high,en,400,Outage,Disruption,Performance,IT,Tech Support,,,
Request for Enhanced Features,Your request for enhancements in integration features for affected products on the project management platform aims to improve the user experience and overall satisfaction.,"Dear [Name],\n\nThank you for your email requesting enhancements to the integration features for affected products on the project management platform. We understand the importance of improving the user experience and overall satisfaction. Could you please provide more details on the specific enhancements you would like to see? This will help us better understand your requirements and prioritize accordingly. We are available to schedule a call to discuss further.",Change,Technical Support,high,en,400,Feature,Feedback,Product,,,,,
Problem with ClickUp Payment Processing,"The user is unable to process the payment for their ClickUp subscription due to a billing system error, specifically insufficient funds. The user has attempted to update their payment information and contacted their payment provider, but the issue still persists. They need assistance to resolve this issue so they can continue using the ClickUp services.","We are investigating the issue with the ClickUp payment process for your account <acc_num>. To assist further, we would need more information, such as the error message received. Could you please provide a detailed description of the error messages? You can contact <tel_num> to discuss the next steps.",Problem,Billing and Payments,medium,en,400,Payment,Billing,Refund,Disruption,Tech Support,,,
Assistance with Digital Strategies to Enhance Brand Visibility,"I am seeking support regarding digital strategies that can enhance brand visibility using the Hemingway Editor. Could you provide some information on the topic and share examples or case studies that demonstrate the effectiveness of these strategies? Additionally, I would appreciate it if you could let me know how using the Hemingway Editor can help improve our brand's online presence. I look forward to hearing from you soon.","We appreciate your interest in using the Hemingway Editor to enhance digital strategies and improve brand visibility. Our team uses this tool to simplify and clarify content, making it more accessible to a wider audience and thereby improving online presence. We have seen significant success with this approach, as various case studies have shown that brands have experienced increased engagement and visibility after implementing these strategies. We would be happy to provide more specific information and schedule a call at your convenience to discuss the benefits and solutions further.",Request,Technical Support,high,en,400,Feedback,Sales,IT,Tech Support,,,,
Problem with Data Access in Hospital System,Facing data access problems due to outdated software configuration errors.,Investigate the issue with the hospital system and contact assistance as soon as possible.,Incident,Returns and Exchanges,low,en,400,Bug,Performance,IT,Tech Support,,,,
Support Request for Issues with Investment Optimization Algorithms,"Dear Customer Support, we are experiencing malfunctions with our investment optimization algorithms that are producing inaccurate analysis results. This may have occurred due to recent software updates. After restarting the system and clearing the cache, the issue still persists. We would greatly appreciate it if you could look into this matter urgently and provide a solution as soon as possible. Please let us know if we need to provide any additional information. We look forward to hearing from you soon.","Dear [Name], acknowledging your email regarding the malfunction with the investment optimization algorithms. We understand the urgency of the matter and will assist in resolving the issue as soon as possible. We have documented the details of the problem, including the recent software updates and the steps taken so far, such as restarting the system and clearing the cache. We would like to request any additional information from you, including any exact error messages and the version numbers of the software currently in use. We appreciate your cooperation.",Incident,IT Support,high,en,400,Bug,Performance,IT,Tech Support,,,,
Problem with Investment Analysis,"Faced unanticipated discrepancies in investment analysis using various software tools. Might be due to data synchronization issues across the platforms. After attempting to reconfigure settings and updating the software, the problem still exists. Require help to resolve this to ensure accurate investment analysis.",Examine the issue and contact us at <tel_num> to discuss. We will schedule the necessary resolution time to address the investment analysis discrepancies and ensure accurate data synchronization.,Incident,Customer Service,medium,en,400,Bug,Performance,Documentation,IT,Tech Support,,,
Issue with Eclipse Integration,"Financial firm experiencing discrepancies in data due to integration issues. Eclipse IDE is problematic, possibly due to compatibility issues with macOS Monterey. Despite attempts to update Eclipse and verify data sources, the issue persists.","Please investigate the Eclipse integration problem, particularly in relation to macOS Monterey. To better assist you, could you provide more detailed information on the discrepancies and the steps you have taken so far? You can contact us at <tel_num> for further discussion.",Incident,Product Support,medium,de,400,Bug,Performance,IT,Tech Support,,,,
Enhancing Data Analytics Investment Efficiency,"Customer Support, reaching out to discuss practices for optimizing data analytics investments on AWS and Google Cloud Platform. Currently, our team is struggling to streamline the data processing and analysis workflow, leading to delayed insights and lost opportunities. We are seeking guidance on how to leverage the capabilities of these cloud platforms to improve our data analytics pipeline. Specifically, we would like to know how to optimize data storage, processing, and visualization on AWS and Google Cloud.","Thank you for reaching out to our customer support team regarding the optimization of your data analytics investment on AWS and Google Cloud Platform. We understand the challenges your team is facing in streamlining your data processing and analysis workflow. To improve your data analytics pipeline, we recommend leveraging cloud-based services such as Amazon S3 for data storage and Google BigQuery for data processing. For data visualization, consider utilizing tools like Tableau and Power BI. We will provide tailored guidance to meet your specific needs.",Request,Technical Support,high,en,400,Feedback,Performance,Feature,Documentation,IT,Tech Support,,
Hilfe zur digitalen Markengröße,Könnten Sie mehr Details zu den digitalen Strategien und deren Auswirkungen auf die Markengröße geben? Ich möchte gerne mehr darüber erfahren.,"Sehr geehrte [name], vielen Dank für Ihr Interesse an digitalen Strategien bezüglich der Markengröße. Ich freue mich, Ihnen mehr Informationen zu geben, die den Bedürfnissen Ihres Geschäftes dienen. Diese Strategien sind darauf zugeschnitten, die Online-Präsenz und das Engagement für Ihre Marke zu steigern. Lassen Sie uns darüber diskutieren, wie unsere Dienstleistungen und Produkte Ihre Markengröße fördern können. Um Ihre Bedürfnisse besser zu verstehen, könnten Sie bitte mehr Details über Ihre aktuellen Herausforderungen und Ziele geben. Ich freue mich darauf, einen Telefonischen Gesprächstermin mit Ihnen abzustimmen. Bitte geben Sie mir eine Rückmeldung.",Request,Technical Support,low,de,400,Feedback,Feature,Documentation,,,,,
Aktualisierung von digitalen Werkzeugen für Wachstum,"Betreuer Kundenservice, ich melden die Notwendigkeit der Aktualisierung digitaler Werkzeuge, die Plattformen und Marktwachstumsstrategien unterstützen. Es gibt diverse Anwendungen auf verschiedenen Geräten, die aktualisiert werden müssen, um sicherzustellen, dass die Marke im Markt wettbewerbsfähig bleibt. Die derzeitigen Werkzeuge sind veraltet und bieten nicht die notwendigen Funktionalitäten. Ich schätze, es schnellstmöglich eine Lösung anzubieten. Bitte geben Sie mir die notwendigen Informationen, um die Aktualisierung voranzutreiben. Vielen Dank für Ihre Unterstützung.","Betreuer <name>, danke, dass gemeldet haben, die Aktualisierung der digitalen Werkzeuge für Wachstumsstrategien. Ich verstehe die Bedeutung, um im Markt wettbewerbsfähig zu bleiben. Um Ihnen besser zu helfen, bitte ich Sie, spezifische Details über die Funktionalitäten der spezifischen Werkzeuge zu geben, die benötigt werden. Dies wird mir helfen, eine individuelle Lösung zu finden, die Ihren Bedürfnissen entspricht. Es ist notwendig, einen Anruf an <tel_num> zu vereinbaren, um dies zu besprechen. Bitte teilen Sie mir ein geeignetes Zeitfenster mit. Ich schätze Ihre Geduld und freue mich auf Ihre Rückmeldung.",Change,IT Support,low,de,400,Feature,Maintenance,IT,Tech Support,,,,
Urgent Security Support,"Customer Support, <br>An unauthorized access attempt has been detected on the hospital's systems, which could potentially compromise the integrity of medical data. This incident might have occurred due to outdated software vulnerabilities or misconfigured network settings. So far, we have updated antivirus definitions, reviewed access logs, and initiated the security patching process. <br>We kindly request immediate assistance in investigating the matter and providing recommendations to prevent future occurrences. <br>Please let","{name}, we are taking immediate action on your urgent security support request regarding the unauthorized access attempt detected on the hospital's systems. To proceed, we need more information, including the exact nature of the detected attempt and the current status of the security patching process. Please provide details on the access logs and any outdated software vulnerabilities. Based on the information provided, we will be able to offer recommendations to prevent future occurrences. If necessary, we may need to schedule a call at {tel_num}.",Incident,Technical Support,medium,en,400,Security,Network,Virus,Bug,Performance,,,
Problems with Billing Differences,"We are experiencing billing inconsistencies that are impacting the agency's digital strategy tools and equipment. These issues might have arisen from recent account modifications or payment processing mistakes. So far, we have verified transaction records and contacted customer support for further clarification. We would greatly appreciate it if you could look into this matter and provide a resolution at your earliest convenience. Please inform us if there is any additional information required to help expedite the process.",Please review and provide the necessary account information related to the billing discrepancies.,Incident,Billing and Payments,low,en,400,Billing,Payment,Account,Refund,Feedback,IT,Tech Support,
Needed Assistance for Project Support,"While using the project management tool, I have noticed that the loading times have become much longer during peak hours, possibly due to server limitations under high traffic. I tried clearing the cache and refreshing the app, but the issue still persists. I would greatly appreciate it if you could look into this matter and provide a solution as soon as possible. The increased loading times are affecting my productivity and overall experience with the tool. Please let me know.",Thank you for bringing this issue to our attention and apologizing for any inconvenience caused. We will look into the project management tool's loading times and aim to provide a solution in a timely manner. Additional steps will be taken to resolve the issue as soon as possible.,Problem,Technical Support,low,en,400,Performance,Network,IT,Tech Support,,,,
