subject,body,answer,type,queue,priority,language,version,tag_1,tag_2,tag_3,tag_4,tag_5,tag_6,tag_7,tag_8
Data Accessibility Problem,The healthcare organization faced an interruption in data access. It is probable that recent security updates created conflicts. Efforts to revert the system and reconfigure the firewall have not succeeded.,"<name>, we acknowledge the data access problem you are facing. We are investigating the root cause of the disruption and would like to collect information regarding recent security updates attempted to resolve the issue. Could you please share details of any error messages or symptoms observed? We are happy to schedule a call at a convenient time to discuss the next steps in resolving this matter.",Incident,Product Support,medium,en,52,Security,Outage,Disruption,IT,Tech Support,,,
Incorporate SaaS Adobe,Can you supply documentation for integrating SaaS Adobe Illustrator CC 2021 with Figma?,"<name>,\nThank you for your interest in integrating SaaS Adobe Illustrator CC 2021 with Figma. To assist you effectively, we would like to provide the appropriate integration documentation. However, we need some additional information to ensure we deliver the most relevant guidance. Could you please confirm which specific features associated with your current <acc_num> account you wish to integrate? You can find general information on our website, but for detailed, customized documentation, we need further details from you. Alternatively, we would be happy to discuss this further.",Request,Technical Support,low,en,52,Documentation,Software,SaaS,Adobe,,,,
Billing Discrepancies in Integrated Products,"Preparing a report on billing inconsistencies impacting several integrated products. The problem may stem from API synchronization errors with the payment gateway on the SaaS platform. Attempts to resolve the issue included resetting payment modules and verifying account credentials, but the problem remains unresolved. We would appreciate your assistance in examining this matter and providing a prompt resolution.","We have received your email regarding billing discrepancies across integrated products, potentially caused by API synchronization issues. We will investigate the situation and request you to review the account <acc_num>. Please contact us soon at <tel_num> to discuss further.",Problem,Billing and Payments,medium,en,52,Billing,Payment,Account,Disruption,Support,,,
"Digital Strategies by Marketing Agency Not Meeting Expectations, Notable Stagnation in Brand Expansion","The digital marketing tactics are underperforming, leading to a halt in brand development. Efforts to enhance campaigns and refresh content have not yielded improvements. There may be a problem with the integration of the tools used, which could be causing the issue.",Assess the account <acc_num> by reaching out to <tel_num> to explore possible resolutions related to digital strategies and tool integration.,Problem,Sales and Pre-Sales,medium,en,52,Performance,Disruption,Maintenance,Feature,,,,
Anfrage zur Bewerbung von Red Enterprise Linux Drupal,"Sehr geehrte Kundenservice, ich möchte gerne über die Bewerbung von Red Enterprise Linux Drupal im Zusammenhang mit besten Praktiken sprechen. Könnten Sie mir detaillierte Richtlinien zur effektiven Bewerbung dieses Produkts zur Verfügung stellen? Insbesondere bin ich an den besten Marketingkanälen, Inhalten und Engagementstrategien interessiert. Gibt es spezielle Werkzeuge oder Ressourcen, die Sie empfehlen können, um Red Enterprise Linux Drupal effektiv zu bewerben? Ich freue mich auf jegliche Ratschläge und Unterstützung. Danke für Ihre Zeit und Unterstützung.","Sehr geehrte [Name], wir danken Ihnen für Ihr Interesse an der Bewerbung von Red Enterprise Linux Drupal. Wir empfehlen Ihnen, die detaillierten Richtlinien für die digitale Strategie zu besuchen und sich auf unserer Website die verfügbaren Ressourcen und Anleitungen durchzulesen. Effektive Marketingkanäle umfassen soziale Medien, Inhaltskreation, Blogs, Webinare. Wir empfehlen auch die Beteiligung an Foren und Online-Gruppen der Open-Source-Gemeinschaft. Falls Sie spezifische Ratschläge und Unterstützung benötigen, stehen unsere Experten Ihnen telefonisch zur Verfügung. Bitte geben Sie für einen Anruf geeignetes Zeitfenster an. Der Telefonnummer ist [Tel_Num].",Request,Product Support,low,de,52,IT,Tech Support,Feedback,,,,,
Request for Assistance with Digital Marketing Strategies,"I am expressing concern regarding the digital strategies employed by the marketing agency, which are expected to enhance brand growth. Despite our efforts, we have observed low engagement levels from our target audience. I believe there may be a misalignment with our target demographics and would like to request assistance in identifying the underlying issues. We have tried modifying content timing, but unfortunately, there has been no improvement. I would appreciate it if you could provide guidance on how to better align our digital strategies with the needs and preferences of our target audience.","We understand your concern about the marketing agency's digital strategies not meeting brand growth expectations. To assist you more effectively, could you please share details about your target audience, including their demographics and preferences? Additionally, information about the specific digital channels currently in use and any adjustments made to content timing so far would be helpful. With this information, we can review and offer more targeted guidance to better align your strategies.",Problem,Customer Service,high,en,52,Feedback,Marketing,Strategy,Digital Marketing,Audience,Engagement,,
,"Customer Support, requesting an update on digital strategy tools. We seek assistance in improving our brand growth and the effectiveness of our marketing campaigns. Our current tools are outdated and limit our ability to reach our target audience. We would be grateful if you could provide information on the latest tools and technologies available, which would help us create engaging content and boost our online presence. Thank you for your time and support.","<name>, thank you for your request regarding updates to digital strategy tools to enhance brand growth and improve marketing campaign performance. We understand the significance of utilizing the latest tools and technologies to develop engaging content and expand your online reach. To better assist you, could you please share details about your current digital strategy tools and specific features you wish to update? This will enable us to offer the most suitable solutions. Alternatively, we can arrange a call at your convenience.",Change,Technical Support,high,en,52,Customer Support,Marketing,Feedback,Strategy,Campaign,Digital,Effectiveness,
Inquiry Regarding Digital Marketing Services and Brand Expansion,Can you supply comprehensive billing and payment method details?,"<name> appreciates your interest in our digital marketing solutions. We are pleased to offer detailed information on our billing and payment options. Our standard payment terms involve a monthly retainer fee with net 30-day payment conditions. We accept major credit cards and can provide invoices in electronic or paper format based on your preference. New clients are required to pay an initial setup fee, which covers onboarding and campaign setup expenses. We also offer tailored payment plans to suit individual needs.",Request,Billing and Payments,medium,en,52,Billing,Payment,Marketing,Brand Expansion,,,,
Financial Issue,"The financial institution encountered inaccurate analysis results of investment data due to inconsistent data inputs, leading to failed attempts at system recalibration.",Additional details needed,Problem,Customer Service,medium,de,52,Finance,Data Integrity,System Calibration,Investment,Accuracy,,,
Billing Discrepancy Notification,A financial organization utilizing data analytics encountered billing discrepancies impacting several software devices. There may be a system integration malfunction. Multiple payment retries and system restarts have failed to resolve the issue. The errors continue to occur across different platforms.,We are currently reviewing the billing discrepancy report and would like to discuss solutions to resolve the problem. Please provide detailed information about the errors encountered. A suitable time for a call to assist with the system integration issue can be arranged.,Incident,Billing and Payments,high,en,52,Billing,Payment,Disruption,Outage,Software,System Integration,,
Hospital System Security Incident,"A recent security incident compromised medical records and disrupted hospital operations. The breach may have resulted from outdated software patches. Initial efforts included firewall enhancements and system scans, but problems continue. We are concerned about patient data safety and urgently seek help to address this issue. Kindly advise on the next steps to resolve the matter.","We received your email regarding the security incident affecting hospital systems and would like to arrange a call at the earliest convenience to discuss the details. Please inform us of a suitable time for a call at <tel_num>. In the meantime, ensure the compromised systems are isolated to prevent further damage, and the team should gather logs for breach analysis.",Incident,Technical Support,high,en,52,Security,IT,Outage,Disruption,Recovery,,,
SAP ERP System Integration Assistance,"Customer Support is requesting comprehensive integration instructions for the SaaS platform with SAP ERP on Microsoft Windows 10 Pro. They are seeking a detailed, step-by-step guide to connect the systems, along with documentation resources to better understand the process. Please inform us of any specific requirements or prerequisites necessary for the integration. We appreciate your prompt assistance and look forward to your response.","<name>, thank you for contacting the support team regarding the integration of the SaaS platform with SAP ERP on Microsoft Windows 10 Pro. We will provide detailed, step-by-step instructions to ensure a smooth integration process. To assist you more effectively, could you please specify the current SAP ERP version and the particular modules in use? This will enable us to supply the most relevant documentation resources. Additionally, we can arrange a call at your convenience to walk you through the process if needed. Please let us know your preferred time.",Request,Customer Service,medium,en,52,Product,Documentation,Support,Integration,ERP,System,,
Enhance Integration Assistance,Drafting a request to improve integration performance support across various products within a scalable SaaS project management system. Updating essential components to guarantee smooth operation and optimal efficiency. Kindly inform us of the timeline for implementation. Please advise if further details are required to assist with the process.,"<name> has received the integration enhancement request for the SaaS project management platform, will review the requirements, and provide an estimated timeline for deployment. For additional information, please contact <tel_num> via email.",Change,Product Support,high,en,52,Feature,Support,Performance,Integration,Implementation,Scalability,,
,"The brand development efforts for the marketing agency have plateaued despite implementing digital strategies. We attempted to optimize campaigns and analyze analytics, which yielded some progress. However, we are worried that our targeting may be insufficient, resulting in low engagement from our intended audience. We would appreciate guidance on how to refine our targeting to restore the brand's growth trajectory. Could you offer suggestions or recommendations for the next steps?","To address your concerns and enhance brand growth through improved targeting, please share details of your current strategies and analytics. This information will help us provide more tailored recommendations.",Problem,Returns and Exchanges,medium,en,52,Feedback,Marketing,Campaign,Analytics,Performance,Strategy,Growth,
Anfrage für umfassende Dokumentation zu Data Analytics,"Sehr geehrter Kundenservice, ich bitte um eine ausführliche Dokumentation der Data Analytics-Tools, um meine Strategien für Finanzinvestitionen zu verbessern. Könnten Sie bitte Informationen bereitstellen, welche Tools genutzt werden und wie der Zugriff erfolgt? Ich würde eine Anleitung begrüßen, um die besten Ressourcen effizient nutzen zu können. Vielen Dank im Voraus für Ihre Zeit und Unterstützung. Ich freue mich auf Ihre Rückmeldung.","<name>, wir stellen die umfassende Dokumentation der Data Analytics-Tools zur Verfügung. Bitte erlauben Sie uns, <tel_num> anzurufen, um die Nutzungsmöglichkeiten zu besprechen. Senden Sie uns bitte Ihre registrierte E-Mail-Adresse, damit wir das Konto <acc_num> verknüpfen können.",Request,IT Support,high,de,52,Documentation,Data Analytics,Support,Information,Resource,Access,Guidance,
Revise Integration Assistance,Drafting a request to enhance integration performance support across various products within a scalable SaaS project management system. It's essential to update this information to guarantee smooth operation and optimal efficiency. Kindly provide an estimated timeline for the implementation. Please inform us if further details are required to assist with the process.,"<name> has received the request to update integration support for the SaaS project management platform, will review the requirements, and supply an implementation timeline. For additional information, please contact <tel_num> via email.",Change,Product Support,high,en,52,Feature,Performance,Support,Integration,Project Management,,,
,"Sehr geehrter Kundenservice, ich möchte ein Problem mit dem Investitionsoptimierungstool melden. Das Tool zeigt eine Fehlermeldung bei der Datenverarbeitung, was ich auf ein kürzlich durchgeführtes Software-Update zurückführe. Ich vermute, dass das Update Fehler bei der Datenintegration verursacht hat, die die ordnungsgemäße Funktion des Tools verhindern. Ich habe versucht, die Systeme neu zu starten und das Update zurückzusetzen, doch das Problem besteht weiterhin. Ich würde es sehr schätzen, wenn Sie das Problem schnell untersuchen und eine Lösung anbieten könnten. Das Investitionsoptimierungstool ist eine kritische Komponente unserer Geschäftsprozesse, und ein Ausfall führt zu erheblichen Störungen. Vielen Dank im Voraus.","Wir haben Ihre E-Mail bezüglich des Problems mit dem Investitionsoptimierungstool erhalten. Unser Team wird die Angelegenheit prüfen. Bitte kontaktieren Sie uns unter <tel_num>, um die nächsten Schritte zu besprechen und mögliche Lösungen zur Fehlerbehebung zu erörtern. Teilen Sie uns auch einen passenden Zeitpunkt für einen Anruf mit. Für eine effektivere Unterstützung benötigen wir zusätzliche Informationen zur Systemkonfiguration.",Incident,Technical Support,high,de,52,Bug,Performance,Software Update,Data Integration,Critical Issue,System Error,,
Hospital System Problem,"The hospital's system encountered problems with data access, possibly due to a cybersecurity intrusion or system misconfiguration. Devices have been restarted, network connections verified, user permissions checked, and initial security scans performed.",We received an email regarding the hospital system issue. We are investigating the data access problems and would like to arrange a call at the earliest convenience to discuss the next steps and potential solutions. Please inform us of a suitable time for a call at <tel_num>.,Problem,IT Support,medium,en,52,Security,Network,Outage,Disruption,Recovery,,,
,"Sehr geehrter Kundenservice, ich möchte ein Problem beim Datenzugriff des Gesundheitsdienstleisters melden. Es gibt Verzögerungen beim Zugriff auf Patientendaten, möglicherweise aufgrund von Integrationsproblemen mit AWS, Elasticsearch oder Zapier-Workflows. Das Team versucht, das Problem durch einen Neustart der Systeme und das Leeren der Caches zu beheben, jedoch blieb das Problem bestehen. Es besteht die Befürchtung, dass die Fähigkeit, Patienten rechtzeitig zu versorgen, beeinträchtigt werden könnte. Wir schätzen eine dringende Prüfung der Angelegenheit und eine möglichst schnelle Lösung. Bitte informieren Sie uns.","Sehr geehrter <Name>, ich schreibe bezüglich des Problems beim Zugriff auf Patientendaten aufgrund von Integrationsproblemen mit AWS, Elasticsearch und Zapier-Workflows. Ich verstehe die Dringlichkeit der Angelegenheit und deren potenziellen Einfluss auf die Versorgung der Patienten. Ich möchte bei einer schnellen Lösung des Problems behilflich sein. Um das Problem besser zu verstehen und eine Lösung zu finden, bitte ich um weitere Informationen. Könnten Sie bitte die genauen Fehlermeldungen mitteilen, die Sie erleben, sowie die Schritte, die Sie bisher zur Fehlerbehebung unternommen haben? Zusätzlich...",Problem,Billing and Payments,medium,de,52,Security,IT,Tech Support,Disruption,Data Access,Integration,Workflow,
Probleme bei der täglichen Synchronisierung mehrerer Produkte,"Mehrere Software- und Hardwareprodukte synchronisieren intermittierend mit unserer SaaS-Plattform. Geräte wurden neu gestartet und der Cache wurde geleert, was zum Erfolg führte.","<name>, ich bestätige den Erhalt Ihrer Meldung bezüglich der täglichen Synchronisationsprobleme mit mehreren Produkten unserer SaaS-Plattform. Es freut mich zu hören, dass das Neustarten der Geräte und das Leeren des Caches das Problem gelöst haben. Um die Angelegenheit weiter zu untersuchen, benötige ich zusätzliche Informationen. Könnten Sie bitte eine detaillierte Liste der spezifischen Software- und Hardwareprodukte bereitstellen, die betroffen sind, sowie den ungefähren Zeitpunkt, wann das Problem erstmals aufgetreten ist? Falls gewünscht, können wir auch einen Anruf unter <tel_num> vereinbaren, um die Situation gemeinsam zu besprechen.",Incident,Technical Support,medium,de,52,Performance,Hardware,Software,Disruption,Recovery,,,
Issues with Data Synchronization Systems,"A financial organization encountered errors during data synchronization involving QuickBooks Online, SQL Server 2019, and investment analysis tools. The problem might be due to integration malfunctions within the systems. The team has tried rebooting the systems and applying software updates, but the issue remains unresolved. Assistance is required to resolve the problem and guarantee smooth data synchronization.","To help resolve the data synchronization issue, please share the specific error messages you are receiving. Additionally, schedule a call so we can troubleshoot the QuickBooks Online, SQL Server 2019, and related system integration problems.",Incident,Product Support,low,en,52,Bug,Performance,Disruption,Recovery,Software Update,,,
System Crash Due to Overload,"Encountered a crash in the Investment Optimization System, which may be due to data overload or software errors. The system has been restarted, and logs have been checked, but the errors persist. Assistance is needed to resolve the issue.","Dear <name>, thank you for reporting the problem with the Investment Optimization System. We apologize for the inconvenience caused. Our team is ready to assist in resolving the issue. Please provide more details about the system crash, such as specific error messages and any recent changes or data modifications made to the system. This will help us better understand the problem and offer a precise solution. If necessary, we can arrange a call to diagnose the issue. Thank you.",Incident,Customer Service,high,de,52,Crash,Performance,Hardware,Software Error,,,,
Assistance,Could you supply detailed documentation on best practices for scaling a SaaS project management platform? I am seeking guidance to enhance performance and guarantee a smooth user experience.,"<name> thanks you for your interest in optimizing the performance of our SaaS project management platform. A comprehensive documentation set is available on our website. For personalized support and to discuss specific strategies for scaling your platform effectively, we can arrange a call at your earliest convenience. If you are available at <tel_num>, we can initiate the call, or if you prefer us to call back at a different time, please let us know. We are happy to assist with any questions regarding <acc_num>.",Request,Technical Support,low,en,52,Documentation,Feature,Performance,Feedback,,,,
Datenintegration,"Sehr geehrter Kundenservice, ich kontaktiere Sie, um auf ein Problem aufmerksam zu machen, das unser Unternehmen bei der Datenintegration über verschiedene Plattformen hinweg erlebt. Trotz unserer Bemühungen, die Systeme zu aktualisieren und zu synchronisieren, konnten wir das Problem nicht beheben. Es scheint durch inkompatible Softwareversionen verursacht zu werden, was zu erheblichen Betriebsstörungen führt. Wir haben versucht, das Problem durch Software-Updates zu beheben, jedoch waren diese Versuche erfolglos. Wir würden Ihre Unterstützung bei der Lösung des Problems sehr schätzen und wären dankbar für Anleitungen. Könnten Sie uns bitte weiterhelfen?","Sehr geehrter <name>, ich schreibe Ihnen bezüglich des Datenintegrationsproblems, das unser Unternehmen erlebt. Wir verstehen die durch die Störungen verursachten Betriebsbeeinträchtigungen. Um Ihnen besser helfen zu können, könnten Sie bitte weitere Details zu den verwendeten Softwareversionen sowie die spezifischen Fehler, auf die Sie gestoßen sind, bereitstellen? Diese Informationen helfen uns, eine genauere Lösung anzubieten. Falls notwendig, können wir auch einen Anruf planen, um das Problem direkt zu besprechen. Bitte teilen Sie uns eine passende Zeit mit, um Sie unter <tel_num> zu kontaktieren.",Problem,Returns and Exchanges,low,de,52,Bug,Performance,Disruption,Maintenance,Software,Compatibility,,
Security Notifications Across Multiple Systems,Received security alerts related to McAfee and MongoDB. Potential configuration vulnerabilities detected. The preliminary troubleshooting included system scans and firewall assessments.,Contact <tel_num> to review the case and discuss potential configuration modifications for McAfee and MongoDB systems.,Incident,Technical Support,high,en,52,Security,Alert,Configuration,Vulnerability,Troubleshooting,System Scan,Firewall Assessment,
Support for Elasticsearch Search Failures,"Submitting a report regarding intermittent search failures in our Elasticsearch instance, which are affecting our SaaS platform. The issue might be caused by outdated dependencies on Debian 10. We have attempted restarting services and reviewing logs, but the problem persists. We would appreciate it if you could investigate this matter and help us find a solution as soon as possible. Please let us know if you need any additional information or troubleshooting steps we have taken.","We are investigating the reported Elasticsearch search failure issue. To better understand the problem, could you please provide the specific error messages, relevant logs, and the current version of Elasticsearch in use? Additionally, have you considered updating Debian 10 dependencies to the latest versions? If not, we can offer guidance on how to proceed. If needed, we can also schedule a call to discuss troubleshooting steps and answer any questions you might have to facilitate the resolution process. Please let us know a convenient time for a call if necessary.",Incident,Technical Support,low,en,52,Bug,Performance,Outage,Disruption,Recovery,IT,Tech Support,
Disruptions in Digital Tools Impede Brand Growth,"Experiencing issues with Grammarly Twitch Studio Beta. Restarted applications, checked internet connection, updated software, but problems persist.",Investigate problems with digital tools and consider reaching out for additional support.,Incident,IT Support,low,de,52,Disruption,Network,Performance,Software,IT,Tech Support,,
SaaS Support Inquiry,"Customer Assistance,\n\nThe client has expressed challenges in comprehending the SaaS scalability capabilities demonstrated during pre-sales presentations.\n\nA potential cause might be the use of intricate technical terminology.\n\nTo date, we have offered simplified explanations along with supplementary documentation.\n\nWe would be grateful for your guidance on how to enhance the client's grasp of SaaS scalability features.\n\nThank you for your support.\n\nBest regards,\n[Your Name]","[Name], glad to assist with the SaaS support inquiry. To better understand the issue and provide effective help, could you please share details about which specific scalability features presented during the pre-sales demos are causing confusion? I would also be happy to arrange a call at <tel_num> to discuss the necessary support. Thank you for reaching out, and I look forward to helping improve the client's understanding of SaaS scalability features related to <acc_num>.",Problem,Sales and Pre-Sales,high,en,52,Support,Customer Support,SaaS,Scalability,Technical Support,Pre-sale,Inquiry,
Financial Company Encounters Integration Challenges,"A financial organization focused on optimizing investment data analytics is experiencing integration problems across various products. The issue may be due to incompatible software versions. Initial troubleshooting steps, such as software updates, have not resolved the problem. Assistance is required to address this issue.",Kindly supply details about the software versions and products involved to facilitate troubleshooting and support.,Problem,Sales and Pre-Sales,low,en,52,Integration,Software Compatibility,Data Analytics,Financial Services,Troubleshooting,Support,,
