subject,body,answer,type,queue,priority,language,version,tag_1,tag_2,tag_3,tag_4,tag_5,tag_6,tag_7,tag_8
Security Update,Request to update user permissions for enhanced security compliance,<name> has received your request to update user permissions to enhance security compliance. The process will be initiated immediately and you will be notified upon completion. Please let us know if you have any further questions.,Change,IT Support,medium,en,400,Security,Notification,Alert,IT,,,,
Probleme mit der Anmeldung,"Nutzer beschweren sich von abwechselnden Anmeldefehler, die auf Server-Zeitüberschreitungen und Authentifizierungsfehler zurückzuführen sind.","Sehr geehrte/r [Name],\n\nich bestätige die E-Mail mit Anmeldefehler-Problemen entgegengenommen zu haben. Benutzer erleiden Anmeldefehler aufgrund von Server-Zeitüberschreitungen und Authentifizierungsfehlern. Entschuldigung für die Unannehmlichkeiten. Ich stehe Ihnen zur Verfügung, um das Problem zu beheben.\n\nBitte teilen Sie mir die genauen Fehlermeldungen und die Schritte mit, die Sie bisher unternommen haben, um sich anzumelden. Es wäre außerdem hilfreich zu wissen, wann die Fehler am häufigsten auftreten. Möglicherweise vereinbare ich ein Telefonat, um das Problem zu besprechen.\n\nVielen Dank.\n\nGrüße",Incident,Product Support,medium,de,400,Login,Bug,Network,Performance,IT,Tech Support,,
Medizinische Daten-Sicherung,"Kontaktieren Sie mich, um beste Praktiken für die Sicherung medizinischer Daten und Krankenhausauftritte zu besprechen. Ich benötige Details zu den Maßnahmen zur Gewährleistung der Vertraulichkeit, der Integrität und der Verfügbarkeit vertraulicher Patientendaten. Bitte geben Sie Anleitungen für die Implementierung robuster Sicherheitsmaßnahmen, einschließlich Verschlüsselung, Zugriffskontrolle und Auditing. Darüber hinaus interessiere ich mich für Compliance-Anforderungen, insbesondere für die Einhaltung von HIPAA. Bitte teilen Sie mir Informationen über verfügbare Werkzeuge und Technologien zur sicheren Datenspeicherung und Verarbeitung mit. Ich freue mich darauf, mit Ihnen zu telefonieren und detaillierte Informationen zum Schutz medizinischer Daten zu besprechen.","Sehr geehrte [Name], ich bedanke mich für Ihre Anfrage bezüglich der Sicherung medizinischer Daten und Krankenhausauftritte auf AWS mit Apache Hadoop. Um die Vertraulichkeit, Integrität und Verfügbarkeit vertraulicher Patientendaten zu gewährleisten, empfehle ich die Implementierung von Verschlüsselung, Zugriffskontrolle und Auditing. Die Einhaltung von HIPAA-Regelungen ist ebenfalls von großer Bedeutung. Ich werde Ihnen gerne Ratschläge zur Verfügung stellen und die verfügbaren Werkzeuge und Technologien zur sicheren Datenspeicherung und Verarbeitung vorstellen. Ich freue mich darauf, Sie telefonisch auf [Tel_Num] anzurufen, um detaillierte Informationen zum Schutz medizinischer Daten zu besprechen.",Request,Technical Support,high,de,400,Backup,Security,Documentation,IT,,,,
Unterstützung in der Gesundheitsversorgung,"Sehr geehrte Kundenservice, ich bitte um Informationen zu Sicherheitslösungen im Bereich Gesundheitsversorgungsdaten für IT-Dienstleistungen an Krankenhäuser. Könnten Sie mir bitte Details zu den angebotenen Dienstleistungen wie Datenverschlüsselung, sichere Speicherung und Netzwerksicherheit geben? Es wäre sehr schön, wenn Sie mir auch spezifische IT-Dienstleistungen für Krankenhäuser, einschließlich Software- und Hardwarelösungen, näher erläutern könnten. Darüber hinaus wäre ich interessiert zu erfahren, inwiefern die angebotenen Dienstleistungen den Branchenstandards und Vorschriften entsprechen, z.B. HIPAA. Ich freue mich auf Ihre Rückmeldung und danke Ihnen für Ihre Unterstützung. Ich freue mich darauf, bald von Ihnen zu hören. Bitte",Ich werde die Informationen bald per E-Mail an Sie senden.,Request,Human Resources,low,de,400,Security,IT,Tech Support,Hardware,Network,Performance,,
Assistance with Healthcare Data Breach,"A data breach has been detected in the healthcare system, potentially compromising medical records. Steps taken to secure the network and update antivirus software have been initiated. Please provide further details and the steps you have taken so far for investigation and support.",We are here to assist with the data breach issue. Could you please provide more details and the steps you have already taken for investigation and support?,Problem,IT Support,medium,en,400,Security,Network,Virus,IT,Tech Support,,,
Bitten um Unterstützung bei Datenanalyse,"Können Sie detaillierte Informationen zu den Datenanalyse-Dienstleistungen, die Optimierung von Investmentstrategien unterstützen? Fälligkeiten, um Gewinne zu maximieren, sind hilfreich. Vielen Dank für Ihre Zeit und Unterstützung bei dieser Angelegenheit. Ich freue mich darauf, von Ihrer Rückmeldung zu hören.","Sehr geehrte/r [Name], vielen Dank für Ihre Anfrage. Wir haben sichert, dass wir mit den Datenanalyse-Dienstleistungen und der Optimierung von Investmentstrategien vertraut sind. Wir bieten verschiedene Lösungen an, um Fälligkeiten bei der Gewinnmaximierung zu unterstützen. Um Ihnen besser zu helfen, könnten Sie uns, bitte, mehr Informationen zu Ihren spezifischen Bedürfnissen und Zielen bereitstellen. Ich freue mich darauf, dies zu besprechen. Sie können uns gerne anrufen, sobald Ihnen ein passendes Zeitfenster zur Verfügung steht, um die Details zu besprechen. [Telefonnummer]",Request,Technical Support,high,de,400,Feedback,IT,Tech Support,,,,,
Problem with Integration Products,"Facing integration challenges with our project management SaaS tool, specifically with Western Digital Book Duo and Salesforce CRM. We have attempted reinstalling connectors and updating software, but the issue continues. Can you assist in resolving this problem?",I will help with the integration issue. Please provide any error messages you are receiving. I will schedule a call to troubleshoot and resolve the issue related to the Western Digital Salesforce integration. <acc_num>,Incident,Product Support,medium,en,400,Bug,Performance,Product,Feature,Tech Support,,,
Report on Unauthorized Access Incident,"There has been an unauthorized access incident within the hospital's systems, which has potentially compromised medical data. This issue might be due to outdated security protocols or user negligence. Steps taken include resetting passwords and strengthening access controls, but the issue persists. Immediate assistance is required to resolve the matter and prevent further breaches.","Dear [Name],\n\nThank you for your email regarding the unauthorized access incident within our hospital's systems. We understand the severity of the situation and the potential for data compromise. To better assist you, could you please provide us with more information about the incident, including the date and time it occurred and any error messages you received? It would also be helpful if we could schedule a call to discuss the issue in detail and determine the best course of action.\n\nI am available at your convenience. Please let us know a time that works for you.\n\nBest regards,\n[Your Name]",Incident,Customer Service,high,en,400,Security,Incident,IT,Tech Support,Alert,,,
Improve Data Analytics Tools for Investment Optimization,"Seeking assistance in enhancing the data analytics tools for investment optimization. The current tools lack the detailed insights needed to make informed investment decisions. I am interested in advanced features such as real-time data tracking, predictive analytics, and customizable dashboards. These enhancements would significantly improve the investment experience and lead to better returns. Looking forward to your support.","{name}, we have received your request to enhance the data analytics tools for investment optimization and appreciate your feedback on the importance of advanced features for making informed investment decisions. We are currently reviewing the available tools and exploring ways to implement real-time data tracking, predictive analytics, and customizable dashboards. To better understand your specific needs and priorities, could you please provide more detailed information on the features you would like to see?",Change,Returns and Exchanges,medium,en,400,Feature,Feedback,IT,,,,,
Detected Unauthorized Access to Medical Data Systems,"An unauthorized access attempt was detected on our medical data systems. This may have occurred due to a phishing attack. We have implemented additional security protocols and conducted staff training. We need your assistance with this matter as it has raised significant concerns regarding data privacy and security. Please provide immediate attention to prevent potential breaches and guidance on how to proceed with the investigation and recommended measures to enhance our security systems. Your prompt response is greatly appreciated, and we look forward to your support.",Please call immediately,Incident,Technical Support,high,en,400,Security,Virus,IT,Tech Support,Training,Notification,Alert,
Seeking Insights on Digital Strategies for Brand Growth Online,"Customer Support, please address the inquiry about digital strategies that can enhance brand growth through specific products. Could you provide detailed information on the methods and techniques used to increase brand visibility and engagement? I am particularly interested in learning about the role of social media, content marketing, influencer partnerships, and digital strategy. Additionally, I would like to know more about the products that can help businesses achieve their marketing goals. Please provide relevant information.",We will review your inquiry and provide a detailed response regarding the digital strategies and products available. Thank you for reaching out to our team.,Request,Customer Service,medium,en,400,Feedback,Sales,Product,Feature,Documentation,Tech Support,,
Application Support,Application issues during peak hours are likely due to server overload and inadequate resource allocation.,"Dear [name], thank you for reaching out regarding the application disruptions you experienced during peak hours. We apologize for the inconvenience caused and take your concerns seriously. We would like to investigate further to better assist you. Could you please provide us with more details about the disruptions, including any exact error messages or symptoms? We will review the server resource allocation to determine any necessary adjustments to prevent future disruptions. To schedule a call, please contact us at [tel_num].",Incident,IT Support,high,en,400,Bug,Performance,Network,Outage,IT,Tech Support,,
Security Requirement,Please implement improved security measures to protect the medical data in our hospital systems right away for enhanced safety.,"Understood the critical need to secure medical data in hospital systems. I will review the current security protocols and implement any necessary enhancements. For better assistance, could you please provide specific details about your security concerns? You can call at <tel_num> to discuss and establish a timeline for implementation.",Change,Customer Service,high,en,400,Security,Documentation,IT,Tech Support,,,,
Support Issue for Customer,"Over the past few days, our project management-based SaaS system has been experiencing intermittent connection issues. The user is also reporting compatibility problems with several integrated tools, such as Alteryx, Drupal, and IFTTT, which seem to be related to the SteelSeries Rival 3 Wireless Mouse. The user has tried resetting the mouse, updating the software, and establishing proper connections, but the issues persist. They are looking forward to support in resolving this problem.",Please contact us at <tel_num> to address this issue and begin discussing potential solutions for the connection problem.,Incident,Technical Support,low,de,400,Network,Performance,IT,Tech Support,,,,
Request for Updating SaaS Integration,Need to update the SaaS integration to improve compatibility and functionality within project management workflows. Please update the affected products.,<name> has received your request to update the SaaS integration to enhance compatibility and functionality in project management workflows. We will review the affected products and assess the necessary updates. Could you please provide information on any current integration issues and desired enhancements? Feel free to contact <tel_num> to discuss the details and provide a timeline for the update.,Change,IT Support,high,en,400,Feature,IT,Tech Support,,,,,
Issue with Reporting Feature,"A user has reported that the reporting feature is experiencing slow loading times, which they believe might be due to recent database optimizations. The user has already cleared their cache and restarted the server, but the issue still persists. This is significantly impacting their productivity. They would greatly appreciate if we could look into this matter and provide a solution as soon as possible. Please let us know if additional information is needed.","We have received your email regarding the reporting issue and will investigate further. Could you please provide more details on the recent database optimizations and the exact error message you are receiving? Additionally, it may be helpful to contact [tel_num] to discuss the issue further and provide a solution to resolve the slow loading times.",Incident,Technical Support,low,en,400,Performance,Bug,IT,Tech Support,,,,
Concern about Data Analytics Tool,The data analytics tool is generating inconsistent results. Recent software updates might be causing data input errors. Efforts to revert to previous versions and validate input data were unsuccessful.,"In response to the issue with the data analytics tool, I understand you are experiencing inconsistent outputs. It's noted that reverting to previous versions and validating input data did not resolve the issue. To investigate further, we need some additional information. Please provide the exact error message you are seeing and the steps you took to attempt to resolve the issue. It would also be helpful to know the version of the software you are currently using and the approximate time frame of the problem.",Incident,Human Resources,medium,en,400,Bug,Performance,Feature,IT,Tech Support,,,
Support Inquiry Form,"Requesting to enhance the integration functionality within the SaaS platform. Currently, the compatibility with listed products and services is limited, and I believe an improvement in this area would greatly benefit the users. I would appreciate it if you could look into this matter and consider implementing the necessary changes to enhance the integration functionality. This would significantly improve the overall user experience and make the platform more versatile.","<name>, thanks for your email regarding the enhancement of integration functionality within the SaaS platform. We appreciate your feedback and will consider implementing the necessary changes to improve the compatibility of listed products and services. Please discuss this matter further at your convenience by calling <tel_num>. Alternatively, please provide specific details on the products and services you would like to see integrated, as this will help us better understand your requirements.",Change,IT Support,high,en,400,Feature,Feedback,Product,Tech Support,,,,
Strategies for ClickUp Brand Growth,"Customer Support, could you explore digital strategies to enhance brand growth, particularly in relation to integrating ClickUp and Airtable? I would appreciate detailed information on the tools used to boost brand visibility and engagement. Please share specifics on the features and benefits of the integration to help drive business success. Kindly provide relevant information and resources to better understand the topic. I look forward to hearing back soon. Thank you for your assistance.",Please contact <tel_num> to discuss the details and benefits of the ClickUp Airtable integration.,Request,Product Support,low,en,400,Feedback,Feature,Documentation,Sales,IT,,,
Request for Google Keep Integration with ClickUp,"I am writing to request the integration of Google Keep with ClickUp. This would enhance the efficiency of project management and note-taking, allowing users to manage Google Keep notes within ClickUp, thereby simplifying workflows and boosting productivity. I believe this feature would be beneficial to users, enhancing the overall ClickUp experience.","Dear [name], thank you for your request to integrate Google Keep with ClickUp. We appreciate your feedback and understand the potential benefits of this feature. Your request will be passed on to the development team for further consideration. If you have further suggestions or want to discuss this topic, please contact us. We can arrange a meeting at your convenience at [phone number], or you can provide more information about a specific use case to help demonstrate how the integration should function.",Change,General Inquiry,low,de,400,Feature,Feedback,IT,Tech Support,,,,
Support for Investment Analysis Tools,"The investment analysis tools are not responding, which is affecting the optimization of decision-making possibly due to software conflicts from recent updates.","We are looking into the issue with the investment analysis tools, which may be caused by recent software conflicts and updates. Please contact us at <tel_num> to discuss scheduling a resolution. Kindly let us know a convenient time to call. Thank you for reporting the issue related to account <acc_num>.",Incident,Technical Support,high,en,400,Bug,Performance,Feature,IT,Tech Support,,,
,"Facing connectivity problems with various products such as Smart-Garagentoröffner and Elasticsearch. Recent software updates might have led to compatibility issues. I have restarted the affected devices and verified the server status, but the issues still persist. I kindly request your assistance in resolving this matter.",Please investigate the connectivity issues with Smart-Garagentoröffner and Elasticsearch. You can contact us at <tel_num> to discuss potential troubleshooting steps and possible solutions. Your account number is <acc_num>.,Incident,IT Support,medium,en,400,Network,Performance,Bug,IT,Tech Support,,,
Update IntelliJ IDEA to the Latest Version,"Dear Support Team, I am writing to request an update to the latest version of IntelliJ IDEA. Currently, there are compatibility issues with existing projects and tools. Updating to the latest version can significantly enhance workflow and productivity. We appreciate your assistance in providing the necessary steps to update and offer solutions to resolve the compatibility issues. We look forward to hearing back soon. Thank you for your understanding and support. We are committed to helping you efficiently address this issue.","Dear [Name], thank you for your message. Our support team will address your request to update IntelliJ IDEA to the latest version. We understand the compatibility issues you are experiencing and are here to assist. To proceed with the update, we recommend checking the latest version on our website and following the installation instructions. If you need further assistance, please share this information so we can guide you through the update process. Alternatively, we can arrange a call at a convenient time, such as [phone number]. Please provide your preferred time slot.",Change,IT Support,medium,de,400,Feature,Performance,IT,Tech Support,,,,
Inquiry About Integrating DocuSign SaaS for Project Management,Would like to know more about integrating the DocuSign SaaS project management solution as it could significantly boost workflow efficiency. I am particularly interested in learning about the implementation process and its benefits. I appreciate your assistance and look forward to hearing back soon.,"Thank you for your interest in integrating the DocuSign SaaS project management solution. This integration can streamline your workflow and increase productivity through electronic signatures and automated document management. We can discuss the implementation process in more detail, and to do so effectively, could you please provide information about your current workflow and specific requirements? I would be happy to schedule a call at your convenience to explore the solution and develop a tailored implementation plan.",Request,Billing and Payments,medium,en,400,Feature,Feedback,IT,Tech Support,,,,
Verbesserung der Markensichtbarkeit online effektiv,"Sehr geehrte Kundensupport, wir nutzen Squarespace und suchen nach Möglichkeiten, unsere Markensichtbarkeit online zu verbessern. Es wäre sehr hilfreich, wenn Sie uns Anleitungen und Tipps geben könnten, um die Nutzung von Squarespace zu optimieren und so unsere Markensichtbarkeit zu erhöhen. Insbesondere interessiert es uns, erfahren zu werden, wie wir unsere Website für Suchmaschinen optimieren und Verkehr über Soziale-Medien lenken können. Vielen Dank für Ihre Unterstützung und freuen uns auf Ihre Rückmeldung in Kürze.","Wir werden Ihnen Anleitungen zum Optimieren von Squarespace-Websites für Suchmaschinen und zur Nutzung von Soziale-Medien zur Verkehrslenkung geben. Bitte kontaktieren Sie uns zu einem geeigneten Zeitpunkt, um diese Themen zu besprechen.",Request,Customer Service,medium,de,400,Feedback,Feature,Documentation,,,,,
Probleme bei Zugriff auf Software nach neuestem Systemupdate,"Nach dem recenten Systemupdate hat die Marketing-Agentur Schwierigkeiten beim Zugriff auf Software. Obwohl die betroffene Software neu gestartet und Netzwerkverbindungen zurückgesetzt wurden, bestehen die Probleme weiterhin.","Ich untersuche derzeit die Störungen bei dem Zugriff auf die Software bei der Marketing-Agentur, die nach dem recenten Systemupdate aufgetreten sind. Um eine genauere Untersuchung durchzuführen, könnten Sie bitte mehr Details und spezifische Fehlermeldungen zur betroffenen Software bereitstellen. Für eine Lösung ist ein Anruf erforderlich. Bitte rufen Sie uns unter dem folgenden Nummernverzeichnis an, um die Lösung zu besprechen. Das Nummernverzeichnis lautet: <tel_num>.",Incident,IT Support,medium,de,400,Bug,Network,Performance,IT,Tech Support,,,
Error with Google Cloud,A critical system error occurred during the use of Google Cloud Platform for data analysis. The issue seems to stem from conflicting software versions and network disruptions. Restarting affected applications and clearing the cache did not resolve the problem. We would be glad to assist in quickly solving the issue.,"Dear <name>, we regret to hear about the problems you've encountered with Google Cloud Platform. To better assist you, could you please provide more details from the error message, including the steps you have already taken? We would be happy to arrange a call to discuss further. Would today be a convenient time to reach you at <tel_num>? If not, please provide a time that works for you to ensure we can address the issue with your <acc_num> account.",Incident,IT Support,medium,de,400,Bug,Network,Performance,Disruption,IT,Tech Support,,
Issue with Project Management Functionality,"Many users have reported difficulties with the project management features, particularly when synchronizing data across different platforms. This likely points to inconsistent API integrations. We are currently working on a solution, which includes clearing caches and reinstalling the software, and so far, these steps have been successful. We need your assistance in identifying the root cause and implementing the solution.","I would like to acknowledge that you have brought to our attention the issue with the project management functionality, where the features are being used to synchronize data across various platforms. It appears that our attempts to resolve the issue by clearing caches and reinstalling the software have been successful so far. To better understand the root cause of the problem, we need more detailed information, such as specific error messages and symptoms that users are experiencing. Could you please provide detailed descriptions of the issues, relevant screenshots, and logs? Additionally, we would like to arrange a conversation at a convenient time to discuss the issue in more detail and explore potential solutions.",Incident,Returns and Exchanges,medium,de,400,Bug,Performance,IT,Tech Support,Documentation,Feature,,
