subject,body,answer,type,queue,priority,language,version,tag_1,tag_2,tag_3,tag_4,tag_5,tag_6,tag_7,tag_8
Notification on Data Breach in Hospital Systems,"A data breach has been detected in the hospital systems, potentially compromising patient medical data. This may have occurred due to a vulnerability in the Apache Hadoop setup. The team is taking immediate actions to secure the data, including updating software and enhancing encryption protocols. It is crucial to rectify the situation to prevent future breaches. The team is working diligently to notify affected patients and provide necessary support. We understand the severity of the issue and are committed to protecting patient data. Please acknowledge receipt of this email.","<name> acknowledges receipt of the email regarding the data breach in hospital systems, which has compromised patient medical data due to a potential vulnerability in the Apache Hadoop setup. Appreciates the immediate actions being taken to secure the data, including updating software and enhancing encryption protocols. Notifying affected patients and providing support are steps in the right direction. Would like to request information on the current status of the breach and the protocols being put in place.",Problem,Product Support,medium,en,400,Security,Notification,Alert,IT,Tech Support,,,
,"Can you provide specifics on SaaS features, scalability options, and project management?","Please provide information on SaaS features, scalability options, and project management. This will allow for a more convenient call to discuss the details.",Request,Sales and Pre-Sales,medium,en,400,Feature,Performance,Feedback,Documentation,,,,
Brauche Unterstützung bei Marketingstrategien,Erlebe Schwierigkeiten bei digitalen Strategien,"Sehr geehrter <name>, hier sind Marketingstrategien, die Ihnen helfen können. Ich kann Ihre Herausforderungen bei digitalen Strategien berichten. Bitte geben Sie mehr Informationen zu Ihrem spezifischen Problem, damit ich eine effektivere Lösung anbieten kann. Wenn Sie lieber telefonisch zusammenarbeiten möchten, stehe ich Ihnen gerne zur Verfügung und kann ein passendes Zeitfenster für einen Anruf vereinbaren. Geben Sie bitte Ihre passende Zeit an, um den Anruf <tel_num> zu vereinbaren. Ich freue mich darauf, Ihre Marketingbedürfnisse mit <acc_num> zu unterstützen.",Incident,Customer Service,high,de,400,Feedback,Sales,Training,IT,,,,
,"Customer Support, I am seeking detailed information on securing medical data within osCommerce hospital systems. I would greatly appreciate any guidance or recommendations you can offer. Securing sensitive medical data is of the utmost importance to me, and I want to ensure our systems are compliant with all relevant regulations. Thank you in advance for your assistance. I look forward to hearing from you soon. Sincerely, [Your Name]",We can provide information on securing medical data for osCommerce hospital systems and ensuring compliance with relevant regulations. Please contact us at [tel_num] to discuss the details and any recommendations you need.,Request,Customer Service,low,en,400,Feedback,Documentation,IT,Tech Support,,,,
Request for Detailed Integration Guide for Google Keep,"Dear Customer Support Team, I am writing to request comprehensive documentation for integrating Google Keep into our project management SaaS platform. We believe that this integration would significantly improve the functionality and provide users with a more streamlined experience. Could you please provide a step-by-step guide for the integration process? Additionally, it would be greatly appreciated if you could include relevant screenshots and videos to help illustrate the process. Also, we are aware of the specific requirements and limitations, so please let us know if there is any additional information we need to consider.","Thank you for your interest in integrating Google Keep into your project management SaaS platform. We will provide detailed documentation and step-by-step instructions for the integration process, including relevant screenshots. Our team will send you the necessary information and requirements for the integration, and please allow us some time to prepare the documentation.",Request,Technical Support,medium,en,400,Documentation,Feature,Feedback,IT,,,,
Identified Inconsistency in Returns Data,"Detected discrepancies in returns data for various products, impacting the precision of investment analysis. The anomaly might be due to errors in data integration. Despite cross-verifying records and recalibrating analytics dashboards, the issue remains unresolved. Kindly provide assistance to address this matter at the earliest convenience.","Please review the issue and contact us at <tel_num> to discuss and schedule a suitable time for resolving the inconsistency in returns data, which is affecting investment analysis.",Incident,Returns and Exchanges,medium,en,400,Return,Issue,Product,Analytics,Feedback,Tech Support,,
Problem with Subscription Payment Handling,"Lately, the subscription payment has failed, likely because of outdated billing details. Despite attempts to update the payment information, errors persist, obstructing access to premium features.","Please review your account <acc_num> to assist in updating the billing information, which will help resolve the issue. Our contact number for this process is <tel_num>.",Problem,Billing and Payments,medium,en,400,Payment,Billing,Account,Subscription,Performance,,,
Support Request for PostgreSQL SaaS Integration Documentation,"Hello, I am seeking comprehensive documentation for integrating PostgreSQL with our SaaS project management platform. Could you furnish a detailed step-by-step guide along with necessary configuration settings and API keys? Also, any troubleshooting tips for common issues during the integration process would be greatly appreciated. If possible, could you provide examples of successful integrations? Your timely assistance is highly valued. Looking forward to your response.","Dear [Name], we will provide detailed documentation for integrating PostgreSQL with your SaaS platform, including step-by-step instructions and troubleshooting tips. We will also share examples of successful integrations. Please allow us to send this information via email or schedule a call at [Tel Num] for further discussion.",Request,Product Support,high,en,400,Documentation,IT,Tech Support,Feature,,,,
Variation in Investment Yield,"Dear Customer Service,\nDuring data analysis, an unexpected variation in investment yield was identified. This discrepancy may be due to incorrect data integration from outdated software. Despite attempting to clean the data inputs and update the analysis tools, the issue persists. This difference is causing inconsistencies in our financial reports and concerns the accuracy of our investment portfolios. We would appreciate it if you could quickly investigate the case and propose a solution. Please contact us if additional information is needed. Thank you.","To investigate the variation in investment yield, please call <tel_num>. Further processing and discussing the next steps to resolve the problem will follow.",Incident,Returns and Exchanges,low,de,400,Bug,Performance,Maintenance,IT,Tech Support,,,
Request for Clarification on Digital Promotion Strategies for Gaming Products,Could you provide more details on digital strategies to promote gaming products? Thank you!,I will send the information on digital promotion strategies for gaming products via email shortly. Thank you.,Request,Human Resources,medium,en,400,Feedback,Sales,Feature,Documentation,,,,
Elasticsearch für Digitale Marketing,Können Sie Einblicke liefern?,"Elasticsearch unterstützt bei Digitaler Marketing-Beratung. Als Such- und Analyse-Engine kann es Markenstrategien optimieren. Gern sprechen wir darüber. Bitte geben Sie mehr spezifische Einblicke, wir freuen uns darauf, Ihnen zu helfen.",Request,Product Support,medium,de,400,Feature,Documentation,Feedback,Tech Support,,,,
Verschluß von Arztinformationen 2-in-1Convertible-Notebook mit Norton 360,"Bitte kontaktieren Sie, um die besten Praktiken für die Sicherstellung von Arztinformationen 2-in-1Convertible-Notebook herauszufinden. Das Norton 360-Software ist installiert, aber ich benötige mehr Informationen, um richtig eingerichtet zu werden, um vertrauliche medizinische Informationen zu schützen. Könnten Sie ein paar Anleitungen zur Verfügung stellen? Ihre Empfehlungen würden geschätzt werden.","Sehr geehrte [name], ich bedanke mich für Ihre Besorgnis bezüglich der Sicherstellung von Arztinformationen 2-in-1Convertible-Notebook mit Norton 360. Um vertrauliche medizinische Informationen zu schützen, empfehle ich, dass Firewallschutz aktiviert und die Installation von Updates bestätigt wird. Darüber hinaus sollten Sie das Virtuelle privates Netzwerk einrichten und die vollständige Festplattenverschlüsselung aktivieren. Es wäre hilfreich, diese Punkte im Detail zu besprechen. Könnten Sie mir mitteilen, wann es Ihnen am besten passt, um anzurufen und mehr personalisierte Anleitungen zu erhalten, falls Sie Fragen haben?",Request,Technical Support,medium,de,400,Product,Feature,Documentation,Tech Support,,,,
Reported Security Issue in Healthcare System,"The system encountered unauthorized access attempts to medical data. Firewall settings were updated, and a security audit was conducted, but the issue continues.",Acknowledging the reported security issue in the healthcare system. Please provide details on the security audit conducted and the updated firewall settings. Let's schedule a call to discuss the next steps for resolving the issue; I will be available at your convenience.,Problem,Technical Support,high,en,400,Security,IT,Tech Support,,,,,
,"geehrte Kundenservice, es freut mich, über Verbesserungen unserer digitalen Marketingwerkzeuge und Strategien sprechen zu können. Ich denke, dass es Raum gibt, um die Markengröße und das Engagement zu steigern, indem wir Produkte nutzen, die wir bereits haben, und uns auf die Entwicklung von personalisierten Marketingkampagnen, die Verbesserung der Social-Media-Verwaltung und eine überarbeitete Datenanalyse konzentrieren. Zudem glaube ich, dass es vorteilhaft wäre, neue Marketingkanäle zu erforschen, wie z.B. Partnerschaften mit Einflussrechtern und Inhaltsmarketing. Ich schätze die Möglichkeit, diese Vorschläge zu besprechen und bin bereit, über die Überwachung von Kundenverhaltenspräferenzen zu sprechen. Könnten Sie ein geeignetes Zeitfenster für einen Telefonanruf nennen, um die Ideen zu besprechen? Ich freue mich darauf, bald mit Ihnen über die Implementierung dieser Vorschläge für die Markenvisibilität und die Verbesserung der Kundeninteraktion zu sprechen.","geehrte <name>, vielen Dank für Ihre umfassenden Vorschläge zur Verbesserung unserer digitalen Marketingwerkzeuge und Strategien. Wir schätzen die Einbindung in der Suche nach Möglichkeiten, um die Markengröße und das Engagement zu steigern. Wir sind bereit, alle vorgeschlagenen Ideen zu besprechen, insbesondere die Entwicklung von personalisierten Marketingkampagnen, die Verbesserung der Social-Media-Verwaltung und eine überarbeitete Datenanalyse. Könnten Sie bitte ein geeignetes Zeitfenster nennen, um über diese Ideen zu sprechen? Ich freue mich darauf, bald mit Ihnen über die Implementierung dieser Vorschläge zu sprechen, um die Markenvisibilität und die Kundeninteraktion zu verbessern. freundliche Grüße",Change,Technical Support,high,de,400,Feedback,Product,Feature,Documentation,Sales,Marketing,,
Seeking Insights on Data Analytics for Investment Optimization,"Hello Customer Support, I am interested in learning more about how data analytics can enhance investment optimization strategies, particularly in portfolio management and risk assessment. Could you provide some information or guidance on this topic? I would greatly appreciate any resources or support you can offer. Thank you in advance for your assistance, and I look forward to hearing from you soon.","We will provide you with information on how data analytics enhances investment optimization strategies, specifically in portfolio management and risk assessment. We will be in touch soon to discuss this further.",Request,Customer Service,medium,en,400,Feedback,Sales,IT,Tech Support,,,,
,"Dear Customer Support, I am encountering performance lag in the project dashboard section. This issue might be due to an increase in user load during peak hours. Despite clearing the cache and refreshing the page, the problem continues. I would greatly appreciate if you could look into this matter and provide a solution to improve the dashboard performance. Please let us know if there is any additional information needed to resolve the issue. Thank you for your time and assistance. I look forward to your response.",Received your email regarding the performance lag in the project dashboard section. We will investigate this matter. Please provide your account number and the exact time when the issue occurred to assist us in resolving it.,Problem,Technical Support,low,en,400,Performance,Disruption,IT,Tech Support,,,,
Improving Digital Strategies for Brand Expansion,I am keen to learn more about digital strategies that can enhance brand growth for software products. Could you provide detailed specifics on the approaches and techniques used? I would greatly appreciate any information on strategies that have helped software companies achieve their goals.,"I would be happy to provide information on digital strategies that enhance brand growth for software products. The approaches include search engine optimization, pay-per-click advertising, and social media marketing. These strategies have helped numerous software companies achieve their goals by increasing their online presence and driving traffic to their websites. I would like to schedule a call to discuss your specific needs and provide tailored information. I am available for a call at your convenience, please let me know.",Request,Product Support,medium,en,400,Feedback,Sales,Feature,Documentation,,,,
Support Request for Integration Optimization,"Dear Customer Support Team, I am writing to request your assistance in optimizing the integration of affected products within our SaaS platform. The current integration is causing inefficiencies in our project management workflow, and I believe that with some adjustments, we could significantly enhance productivity. I would greatly appreciate any guidance you could provide on how to optimize the integration. Please let us know if there are any additional steps we need to take and the information you require from us. Looking forward to hearing back from you soon. Thank you for your assistance.","We appreciate you reaching out to our team for assistance in optimizing the integration of affected products within your SaaS platform. To better understand the current integration inefficiencies, we would like to request more information about the specific challenges you are facing in your project management workflow. Could you please provide us with details on the products you are trying to integrate and the issues you are encountering? This will enable us to provide tailored guidance and support. If necessary, we may need to schedule a call to discuss and determine the best course of action.",Change,IT Support,high,en,400,Feature,Performance,Feedback,IT,Tech Support,,,
Support Needed for Optimizing Data Analytics Strategies with MySQL 8.0,"I am seeking guidance on optimizing data analytics strategies using MySQL 8.0 to enhance investment decision-making. Can you provide insights on how to leverage MySQL 8.0's features to improve data-driven decision making? I would greatly appreciate any tips or practices you can share. Specifically, I am interested in learning about query optimization, indexing, and data visualization techniques. I look forward to your assistance and am available to discuss further at your convenience.","I can provide guidance on optimizing data analytics strategies using MySQL 8.0 to improve data-driven decision making. To leverage MySQL 8.0's features, focus on query optimization and indexing. For query optimization, consider using the EXPLAIN statement to analyze query performance. For indexing, use the CREATE INDEX statement to enhance data retrieval. I can offer additional tips on data visualization techniques and am available to discuss and provide tailored advice at your convenience. Please call at <tel_num> for further assistance.",Request,Product Support,medium,en,400,Performance,Feature,Documentation,Tech Support,,,,
Security Advice for Medical Data,I need assistance in improving the security of medical data using available products. Can you provide guidance on encryption and access controls?,"Please provide security advice for medical data, including recommendations on encryption and access controls, using suitable products. We can arrange a call for a more detailed discussion.",Request,Billing and Payments,low,en,400,Security,Product,Feature,IT,Tech Support,,,
,"Our marketing agency has observed a significant drop in brand engagement metrics over the past week. This may be due to recent algorithm changes on social media platforms. We have already analyzed our content strategy and made some minor adjustments, which have shown some improvement. However, we are now seeking assistance to identify the root cause of the issue and explore potential solutions to restore engagement metrics. Could you please provide guidance on how to navigate these changes and improve our brand's online presence?","I would be happy to help investigate the sudden drop in brand engagement metrics. To better understand the issue, could you please provide specific details on which metrics have decreased and what adjustments were made to the content strategy? It would also be helpful to know which social media platforms you first noticed the decline in engagement. Based on this information, I can offer guidance on navigating the algorithm changes and improving your brand's online presence. When would be a convenient time for us to schedule a call to discuss this further?",Incident,Customer Service,medium,en,400,Feedback,Performance,Feature,,,,,
Concerning System Security Incident,Detected an unauthorized access attempt that could jeopardize medical data. Passwords have been updated and firewall settings strengthened.,Please review the incident and contact <tel_num> to discuss further investigation and mitigation steps.,Incident,Product Support,medium,en,400,Security,IT,Tech Support,,,,,
Required Assistance for Campaign Success,"Hello Customer Support, recently, our digital campaign strategies have hit a snag, resulting in lower brand engagement. This might be due to ineffective messaging or targeting issues. We've already reviewed and adjusted our content and ad spend, but the results are still not satisfactory. Our team is working hard to optimize these campaigns, but we need some additional guidance to get back on track. Could you please provide us with expert advice and recommendations to improve our digital campaign strategies? We would greatly appreciate your assistance.","Hello [Name], we're glad to assist you with your digital campaign strategies. It's clear that you're experiencing decreased brand engagement despite your efforts to review and adjust content and ad spend. To better assist you, could you please provide more information about your current campaigns, target audience, and the specific channels you're using? This will help us provide tailored guidance and recommendations. We would like to schedule a call to discuss your campaigns in detail and provide expert advice to improve your digital campaign strategies.",Incident,Product Support,medium,en,400,Feedback,Sales,IT,Tech Support,,,,
,"A user has reported intermittent access issues with the project management dashboard, which might be related to network congestion or backend server overload. The user has already tried clearing the cache and switching browsers, but the issue persists.","We acknowledge the intermittent access issues with the project management dashboard reported by one user. We understand that clearing the cache and switching browsers did not resolve the issue. We would like to investigate further and gather more information, including any error messages and the symptoms experienced by the user. Could you please provide us with the exact error message and any other relevant information? If necessary, we will schedule a call at <tel_num> to discuss a workable resolution. Please let us know.",Incident,Customer Service,medium,en,400,Network,Performance,Disruption,IT,Tech Support,,,
,"wirten Sie, um Integration von Zapier mit bestehenden Datenanalysetools zu besprechen. Gibt es detaillierte Informationen zum Integrationsprozess? Sie möchten mehr über die Möglichkeiten erfahren, wie Zapier Datenanalyse und Aufgaben automatisieren kann. Insbesondere interessiert Sie die Art der Datenanalysetools, die mit Zapier kompatibel sind und welche Anforderungen für die Integration bestehen. Ich freue mich auf Ihre Rückmeldung in Kürze und danke Ihnen für Ihre Zeit und Unterstützung.","danken wir Ihrem Interesse an der Integration von Zapier mit Datenanalysetools. Zapier ist kompatibel mit einer Vielzahl von Datenanalysetools und ermöglicht die effiziente Automatisierung von Datenanalyse-Aufgaben. Wir können Ihnen genaue Informationen zur Integration liefern, sobald wir mehr über die bestehenden Tools und Ihre spezifischen Wünsche wissen. Wir freuen uns darauf, die Details im Detail zu besprechen und können gerne ein Gespräch zu diesem Thema vereinbaren. Bitte rufen Sie uns unter <tel_num> an, um ein passendes Termin zu finden, um die Möglichkeiten zu erkunden.",Request,Billing and Payments,medium,de,400,Feature,Documentation,Feedback,IT,Tech Support,,,
Efficiently Enhance Digital Marketing Tools,"Adjust and support the optimization of our digital marketing tools with strategic advice to enhance brand growth and visibility across various platforms. This includes social media, search engine, and email marketing. I am delighted to share guidance on best practices and techniques to help you achieve your goals. Please let me know if you are available for a consultation at <tel_num>. I look forward to discussing ways to improve your online presence.","I am pleased to assist in optimizing your digital marketing strategies. Let's discuss your current setup and understand your goals better. I would be happy to arrange a consultation. Please provide a convenient time slot to call at <tel_num>. We can explore best practices and techniques to enhance brand growth and visibility on social media, search engines, and email marketing. I am looking forward to speaking with you to refine your online presence at <acc_num>.",Change,Technical Support,medium,de,400,Feedback,Sales,Feature,,,,,
Assistance with Medical Data Breach Related to Outdated Software,"There is a potential breach of medical data due to outdated software. Even though security updates have been implemented, the issue continues to persist. Urgent help is required to secure sensitive information.","Regarding the medical data breach related to outdated software, we need more details to assist you. Please provide information on the updates and security measures that have been taken so far. You can contact us at <tel_num> for further discussion.",Incident,Technical Support,high,en,400,Bug,Security,IT,Tech Support,,,,
Trouble with Premium Features Access,"Recently, users have encountered difficulties accessing premium features in various software products, such as Grammarly and Kaspersky. This may be due to system integration errors or recent updates. Attempts to resolve the issue, such as restarting the applications and clearing the cache, have not been successful.","We are investigating issues with accessing premium features across multiple software products. To better assist you, could you please provide any error messages you are seeing? Alternatively, we would be happy to schedule a call to troubleshoot the issue. You can reach us at <tel_num>. Alternatively, please let us know a convenient time to contact you regarding <acc_num>.",Problem,Returns and Exchanges,low,en,400,Bug,Performance,Feature,IT,Tech Support,,,
Support for SaaS Project,"Customer Support, seeking details on integrating MySQL with SaaS project management software. Would greatly appreciate any guidance or documentation that could help me get started. Specifically, I am interested in learning about the compatibility, potential limitations, and how to use the MySQL software. I look forward to hearing back as I am excited to explore and leverage this integration to enhance our project management capabilities. Thank you for your time and assistance.",Please contact <tel_num> to discuss the details and options for integrating MySQL.,Request,IT Support,medium,en,400,Documentation,Feedback,Feature,IT,Tech Support,,,
Issues with Accessing Notion Today,"An employee reported difficulties accessing Notion and Microsoft Dynamics 365. Tried resetting passwords, clearing cache, and installed the latest software updates, but without success.",Additional Information Required,Incident,Human Resources,low,de,400,Login,IT,Tech Support,Performance,Employee,,,
