subject,body,answer,type,queue,priority,language,version,tag_1,tag_2,tag_3,tag_4,tag_5,tag_6,tag_7,tag_8
Several Integrations Failed Abruptly Today,"Problem: Numerous product integrations have failed unexpectedly, leading to a widespread system outage. This may be related to recent software update incompatibilities. Attempts to reboot services and rollback updates have been unsuccessful. The issue remains unresolved, and urgent assistance is required to address the situation.","<name>, this is to confirm receipt of your report regarding the failure of multiple product integrations causing a system-wide disruption. We regret to hear about the difficulties you're facing. We understand that you've already tried rebooting services and rolling back recent updates without success. Our team will investigate the matter and work towards providing a solution promptly. Kindly share details about the recent software update applied and the specific error messages encountered at your earliest convenience.",Incident,Customer Service,high,en,52,Network,Outage,Disruption,Recovery,Software,Integration,System,
,"Sehr geehrter Kundendienst, ich möchte einen kürzlichen Sicherheitsvorfall in den IT-Systemen unseres Krankenhauses melden. Es wurde ein Verstoß festgestellt, bei dem Patientendaten möglicherweise durch veraltete PostgreSQL-Konfigurationen offengelegt wurden. Erste Maßnahmen wie Firewall-Updates und Antiviren-Scans wurden bereits durchgeführt, doch konnten die Schwachstellen nicht vollständig beseitigt werden. Es wurden zudem Versuche unternommen, die Integrationen des Smart-Wassermelders und der Smart-Türklingel zu überprüfen, jedoch ohne Erfolg. Dieser Vorfall hat erhebliche Bedenken hinsichtlich der Sicherheit unserer Systeme geweckt, und wir sind bemüht, eine Lösung zu finden. Wir schätzen Ihre Unterstützung und Anleitung, um das Problem zu beheben.","Sehr geehrter <name>, es tut mir leid, vom Sicherheitsvorfall in den IT-Systemen unseres Krankenhauses zu hören. Um das Problem zu beheben, empfehle ich, die PostgreSQL-Konfigurationen auf die neueste Version zu aktualisieren und eine gründliche Überprüfung der Sicherheitseinstellungen des Systems durchzuführen. Gerne können wir einen Anruf vereinbaren, um die Details des Vorfalls zu besprechen und weitere Schritte zu empfehlen. Wäre ein passender Zeitpunkt für Sie verfügbar? Bitte teilen Sie mir eine geeignete Zeit mit, oder kontaktieren Sie mich unter <tel_num>.",Incident,Customer Service,high,de,52,Security,Outage,Disruption,Backup,Virus,IT,Tech Support,
,Can you offer guidance on optimizing workflows for financial data analytics using ClickUp and QuickBooks Online? Assistance in streamlining the process would be appreciated.,Glad to assist. Please permit a call at your convenience to discuss optimization strategies for financial data analytics workflows with ClickUp and QuickBooks Online.,Request,Service Outages and Maintenance,high,en,52,Feature,Documentation,Feedback,Support,,,,
Security Vulnerabilities in Healthcare Infrastructure,Facing security challenges related to patient information within hospital information systems.,Investigate the issue by reaching out to <tel_num> to discuss concerns regarding the security of medical data and hospital systems.,Problem,Technical Support,high,en,52,Security,Healthcare,Vulnerability,Infrastructure,,,,
,"Sehr geehrter Kundenservice, ich möchte auf ein Problem mit der Datenanalyseplattform unseres Unternehmens aufmerksam machen. Die Integration mehrerer Softwaretools in die Plattform ist gescheitert, was zu Verzögerungen bei der Investitionsoptimierung führt. Trotz Versuchen, das Problem durch Systemneustarts und Software-Updates vorläufig zu beheben, besteht das Problem weiterhin. Möglicherweise liegt eine Kompatibilitätsproblematik zwischen den verwendeten Produkten vor. Wir schätzen, wenn Sie die Angelegenheit schnellstmöglich annehmen und eine Lösung bereitstellen könnten. Die Integrationstools sind entscheidend für den Investitionsoptimierungsprozess, und weitere Verzögerungen könnten erhebliche Folgen haben.","Sehr geehrter <name>, herzlichen Dank, dass Sie uns auf das Problem aufmerksam gemacht haben. Wir entschuldigen uns für die Unannehmlichkeiten, die durch die Störung der Integration unserer Datenanalyseplattform entstanden sind. Wir untersuchen derzeit mögliche Kompatibilitätsprobleme und arbeiten an einer Lösung. Könnten Sie bitte weitere Details zu den verwendeten Softwaretools, die Sie zu integrieren versuchen, sowie etwaige Fehlermeldungen, die Sie erhalten haben, bereitstellen? Sie können uns unter <tel_num> anrufen, um gegebenenfalls weitere Details zu besprechen.",Incident,Technical Support,high,de,52,Bug,Performance,Outage,Disruption,Maintenance,Software,Integration,Compatibility
Verbindung von Magento mit PyCharm Analyse-Workflows,"Sehr geehrter Kundendienst, ich möchte anfragen, ob Magento in Verbindung mit PyCharm Professional 2021.1 für die verbesserten Investment-Analyse-Workflows integriert werden kann. Könnten Sie bitte Details zur Einrichtung dieser Integration mitteilen? Ich möchte die notwendigen Schritte verstehen sowie spezielle Konfigurationsanforderungen kennen. Ziel ist es, den Arbeitsprozess zu optimieren und die Investment-Analyse-Fähigkeiten zu verbessern. Bitte stellen Sie die entsprechenden Dokumentationen und Ressourcen bereit, um den Einstieg zu erleichtern. Ich schätze Ihre Unterstützung und freue mich auf Ihre Rückmeldung.",Bitte stellen Sie die Schritte zur Integration sowie die erforderlichen Anforderungen für Magento und PyCharm bereit.,Request,Billing and Payments,medium,de,52,Performance,Security,IT,Tech Support,,,,
Anfrage zu Abrechnungs- und Integrationsinformationen,"Sehr geehrter Kundenservice, ich möchte mich erkundigen, welche Möglichkeiten es gibt, Abrechnungsinformationen zwischen Microsoft SQL Server 2019 und Zoho CRM zu integrieren. Könnten Sie bitte detaillierte Informationen bereitstellen, wie eine Integration zwischen den beiden Systemen realisiert werden kann? Außerdem wäre ich dankbar, wenn Sie die verbundenen Kosten für die Integration mitteilen könnten. Vielen Dank im Voraus für Ihre Unterstützung. Ich freue mich auf eine zeitnahe Rückmeldung.","Sehr geehrter <Name>, vielen Dank für Ihre E-Mail bezüglich der Abrechnungs- und Integrationsmöglichkeiten zwischen Microsoft SQL Server 2019 und Zoho CRM. Um Ihnen möglichst präzise Auskünfte geben zu können, benötige ich zusätzliche Details zu Ihrer aktuellen Infrastruktur. Könnten Sie bitte nähere Angaben zu Ihrer bestehenden Systemumgebung machen, um die Integration entsprechend zu planen? Was die Kosten betrifft, so hängen diese vom Umfang der gewünschten Einrichtung und den erforderlichen Diensten ab. Wir bieten verschiedene Integrationslösungen an und würden diese gerne näher mit Ihnen besprechen. Es wäre schön, wenn wir einen Termin für ein Gespräch vereinbaren könnten.",Request,Billing and Payments,medium,de,52,Billing,Integration,Support,Assistance,,,,
Enhanced Security Measures for Medical Data,"We need to implement stronger security protocols to secure medical data on affected devices and systems, ensuring compliance and protection. This involves encrypting sensitive information and regularly updating software.",<name> acknowledges the importance of securing medical data and the critical role in protecting sensitive information. We take data protection very seriously and are committed to ensuring the security of medical data across all devices and systems. We will review our current protocols and implement any necessary enhancements to ensure compliance with relevant regulations. This includes encrypting sensitive information and regularly updating software to prevent unauthorized access. We will also conduct regular security audits to identify and address any vulnerabilities.,Change,Customer Service,low,en,52,Security,Compliance,Data Protection,Software,Sensitive Information,,,
Technical Problem with the Analytics Platform,"The company's data analytics platform experienced an unexpected crash, interrupting investment optimization activities. A potential software bug or server overload is suspected. We restarted the systems, reviewed the logs, and confirmed data integrity, but the problem persists.",Reach out to support for assistance with the analytics system problem,Problem,Technical Support,high,en,52,Crash,Performance,Bug,Outage,System,Software,,
Software Support Inquiry,Could you please provide detailed guidance on how to integrate the PowerPoint 2021 SaaS platform? I need step-by-step instructions to ensure a seamless integration process.,"<name>, thank you for reaching out to our support team. We appreciate your interest in integrating the PowerPoint 2021 SaaS platform. A comprehensive guide is available on our website, which provides step-by-step instructions for seamless integration. Please visit the support page and search for the PowerPoint 2021 integration guide. If you need any further assistance or have questions, please let us know. We are happy to help. Contact us at <tel_num> for immediate support.",Request,Customer Service,low,en,52,Software,Support,Guidance,Integration,Instruction,,,
Performance Challenges with Financial Firm Operations,"The financial organization responsible for investment analytics is experiencing performance degradation across several products, potentially due to system conflicts. Despite restarting devices and updating software, the problems continue. Assistance is required to troubleshoot and enhance system efficiency.","To assist with the performance challenges, please provide more details about the system conflicts and the specific products impacted. Let us know a suitable time for a call to discuss and resolve these issues.",Incident,Product Support,low,en,52,Performance,IT,Tech Support,,,,,
Nötige Konfiguration der Skalierbarkeitseigenschaften,"Könnten Sie eine detaillierte Anleitung zur Konfiguration der Skalierbarkeitseigenschaften für unsere SaaS-Projektmanagement-Plattform bereitstellen? Ich möchte verstehen, wie ich den Projektbetrieb effizient skalieren kann.","Wir können eine Anleitung zur Konfiguration der Skalierbarkeitseigenschaften bereitstellen. Bitte überprüfen Sie die Online-Dokumentation. Falls Sie Hilfe benötigen, können wir telefonisch verhandeln, um den Prozess zu führen, sobald es Ihnen am besten passt.",Request,Technical Support,medium,de,52,Performance,Configuration,Scalability,Documentation,IT,,,
Identifiziert Sicherheitslücke bei medizinischen Daten,"Erste Untersuchung umfasste die Prüfung der Zugriffslogs; obwohl das Problem weiterhin besteht, stammt es möglicherweise von den neuesten Systemupdates. Das Produkt ist betroffen. Wir arbeiten aktiv daran, das Problem zu beheben und die Sicherheit unserer Systeme zu gewährleisten.","Sehr geehrte/r [Name],\n\nWir bedanken uns für Ihre Mitteilung und entschuldigen die entstandene Sorge. Wir verstehen die Bedeutung der möglichen Sicherheitslücke, insbesondere in Bezug auf medizinische Daten. Das Team arbeitet aktiv daran, die Ursache zu identifizieren und eine Lösung zu finden, um zukünftige Vorkommen zu verhindern.\n\nDa das Problem möglicherweise von den neuesten Systemupdates stammt, werden wir die Updates erneut überprüfen und die Qualitätskontrollprozesse prüfen, um Lücken zukünftig zu vermeiden. Wir sind verpflichtet, die Sicherheit und die Integrität unserer Systeme und Daten zu gewährleisten.\n\nBitte kontaktieren Sie uns, wenn Sie weitere Informationen benötigen.",Incident,Product Support,low,de,52,Security,Bug,Outage,Recovery,,,,
Interruption of Medical Data Services,"A security breach has compromised medical data, leading to system outages. The potential cause appears to be outdated security measures. Efforts have been made to address this by updating antivirus software and resetting network configurations.","<name>, we are aware of the disruption to medical data services due to a breach and are currently investigating the root cause. While initial measures such as updating antivirus programs and resetting network settings have been implemented, further action may be necessary. Please provide details about the breach and the current status of the system. We would like to schedule a call at your convenience to discuss the next steps and explore possible solutions to prevent future disruptions. Kindly let us know a suitable time to contact you.",Problem,Technical Support,high,en,52,Outage,Disruption,Security,Network,Virus,,,
,"Kundenservice eines Finanzunternehmens erlebte eine Störung im Service, die mehrere Geräte betraf und sich auf Software, Datenanalyse sowie Investitionsoptimierung auswirkte. Das Problem schien mit Netzwerk- und Kompatibilitätsproblemen zusammenzuhängen. Erste Maßnahmen zur Fehlerbehebung umfassten Systemneustarts und Software-Updates, jedoch blieb das Problem bestehen. Weitere Unterstützung ist notwendig, um die Ursache zu ermitteln und zukünftige Störungen zu vermeiden. Wir bitten um Ihre Hilfe bei der Identifikation der Ursachen und um eine möglichst schnelle Bereitstellung einer Lösung. Wir schätzen Ihre zügige Aufmerksamkeit für dieses Anliegen und freuen uns auf eine baldige Rückmeldung. Die Störung besteht weiterhin.","Der Fall wurde zugeordnet. Um das Service-Problem zu beheben, benötigen wir zusätzliche Informationen zu den betroffenen Geräten und deren Software. Bitte stellen Sie die entsprechenden Details bereit. Rufen Sie uns unter <tel_num> an, um die Angelegenheit zu besprechen und eine Lösung zu planen, damit die Betriebsabläufe so schnell wie möglich wieder normal laufen.",Incident,Service Outages and Maintenance,medium,de,52,Bug,Performance,Disruption,Maintenance,System,Support,,
Meldung eines Problems bei der Daten-Synchronisierung,"Sehr geehrter Kundendienst,\n\nich möchte ein Problem mit der Daten-Synchronisierung zwischen ClickUp und JIRA Software melden. Unser Finanzunternehmen erlebt Störungen bei Investment-Analysetools aufgrund dieses Problems. Es wird wahrscheinlich durch einen Integrationsfehler oder Verbindungsprobleme verursacht, möglicherweise im Zusammenhang mit dem Netgear CM1000.\n\nWir haben bereits versucht, die Geräte neu zu starten, die Integrationen zurückzusetzen sowie die Software-Versionen zu aktualisieren, doch das Problem besteht weiterhin. Trotz unserer Bemühungen konnten wir keine Lösung finden.\n\nIch würde es begrüßen, wenn Sie das Problem schnellstmöglich untersuchen und eine Lösung anbieten könnten. Bitte informieren Sie mich, sobald Sie das Problem annehmen und eine Lösung bereitstellen können. Sie können mich unter <tel_num> anrufen, um die Angelegenheit zu besprechen.","Das Problem mit der Daten-Synchronisierung zwischen ClickUp und JIRA Software wird zeitnah überprüft. Wir werden weitere Informationen sammeln und eine Lösung anbieten. Bitte erwarten Sie einen Anruf unter <tel_num>, um die Angelegenheit zu besprechen.",Problem,Technical Support,medium,de,52,Bug,Performance,Disruption,Recovery,IT,Tech Support,,
Digitale Marketinglösungen,"Könnten Sie bitte ausführliche Preisinformationen und Zahlungsmethoden für unsere digitalen Marketingangebote bereitstellen, die mehrere Softwareprodukte umfassen? Es ist wichtig, die Kosten und Zahlungsbedingungen zu verstehen, um eine fundierte Entscheidung treffen zu können.","<name>, vielen Dank für Ihre E-Mail bezüglich unserer Softwarelösungen im digitalen Marketing. Gerne stellen wir Ihnen detaillierte Preis- und Zahlungsinformationen zur Verfügung. Unsere Dienstleistungen umfassen Social-Media-Management, Suchmaschinenoptimierung und Content-Erstellung, wobei die Kosten je nach Umfang und Dauer des Projekts variieren. Für ein individuelles Angebot bitten wir um zusätzliche Informationen zu Ihren spezifischen Anforderungen und den gewünschten Produkten. Wir freuen uns auf einen Termin, um die Details zu besprechen und Fragen zu unseren Dienstleistungen sowie Zahlungsbedingungen zu klären.",Request,Billing and Payments,high,de,52,Feature,Pricing,Payment,Software,Marketing,Cost,Decision,Information
Inquiry Regarding Scalability Features and Integration Options,"Dear Customer Support,\n\nI am reaching out to inquire about the available options for integrating scalability features within your SaaS platform. Our team is currently assessing various solutions to meet our project management requirements and is interested in understanding how your platform supports growth. Could you please provide detailed documentation on the scalability features, including any limitations or constraints? Additionally, I would like to know about the integration options available, such as APIs, webhooks, and pre-built integrations with popular project management tools.\n\nThank you for your assistance.","Hello <name>,\n\nThank you for contacting our customer support team. We appreciate your interest in our SaaS platform. I would be happy to provide you with detailed information regarding the scalability features and integration options. Our comprehensive guide outlines the platform's capabilities, including APIs, webhooks, and pre-built integrations with popular project management tools. If you'd like, I can send the documentation directly; please let me know if you prefer that. Alternatively, we can schedule a call at your convenience to discuss your specific needs and answer any questions.",Request,Customer Service,medium,en,52,Product,Feature,Documentation,Feedback,,,,
Analyseplattform für Investitionsdaten,"Die Analyseplattform für Investitionsdaten des Unternehmens stürzt häufig ab, wenn große Datenmengen verarbeitet werden. Mögliche Ursache könnte ein Konflikt infolge eines kürzlich durchgeführten Software-Updates sein.","Wir entschuldigen uns für die Probleme mit der Analyseplattform für Investitionsdaten. Das Problem wird behoben. Bitte stellen Sie die Absturzprotokolle der aktuellen Update-Version für eine weitere Analyse bereit. Dies wird uns helfen, die Ursache zu identifizieren und eine Lösung anzubieten.",Incident,IT Support,high,de,52,Performance,Outage,Disruption,Maintenance,Software Update,,,
Daten-Synchronisierung fehlgeschlagen,"Die Projektdatensynchronisierung mit ClickUp und Monday.com sowie IntelliJ IDEA 2021.1 hat versagt. Es wurde ein neues Serverupdate durchgeführt, das API-Integrationen störte. Die Anwendungen wurden neu gestartet und die API-Zugangsdaten wurden überprüft, jedoch ohne Erfolg.","Bitte überprüfen Sie die neuesten Serverupdate und die API-Integrationen, um die Daten-Synchronisierungsprobleme zu beheben. Geben Sie uns die Kontonummer und eine benutzerfreundliche Rückrufzeit an, damit wir weitere Fehlerbehebungsmaßnahmen besprechen.",Problem,Technical Support,medium,de,52,Bug,Performance,Outage,Disruption,Recovery,,,
Request for Clarification on Digital Strategy Services,I am inquiring about the digital strategy services offered to support our brand growth. Could you please provide detailed guidance on the services that will assist us in achieving our objectives? I would greatly appreciate any information you can provide regarding this matter.,A call at your preferred time would be preferred for discussing the digital strategy services.,Request,Technical Support,medium,en,52,Feedback,Sales,Lead,Documentation,,,,
Modification Inquiry,"Please urgently revise the billing platform Rennlenkrad, Babbel, Maus to guarantee scalability and smooth payment transactions. Assist in avoiding possible problems and enhancing the overall user experience.","<name> has received a modification inquiry regarding the billing platform <company_name> to ensure scalability and seamless payment processing. We recognize the significance of this update in preventing potential issues and in improving customer satisfaction. Our technical team will review and prioritize this request. We will contact you within the next 24 hours to discuss details and provide an implementation timeline. If this matter is urgent, please inform us of a suitable time for a call at <tel_num>.",Change,Billing and Payments,high,en,52,Billing,Payment,Performance,User Experience,Scalability,,,
Performance Concerns with the Financial Data Analytics Platform,"Dear Customer Support, I am reporting an issue with the financial firm's data analytics platform used for investment optimization reports. The platform occasionally experiences slowdowns, which I suspect may be linked to recent software updates. Our initial troubleshooting steps involved rebooting the system and examining logs, but the problem continues. We attempted to identify patterns or correlations, yet have not been able to determine the root cause. The sluggish performance is impacting our capacity to make prompt investment decisions, and we are concerned about this ongoing issue.",We will contact you shortly,Incident,IT Support,medium,en,52,Performance,Software Update,Troubleshooting,Analytics Platform,,,,
Security Procedures for Medical Data,"Customer Support, I am requesting detailed information about the security measures in place for Outlook Adobe Sign, which is used within medical data management systems. As a user, I want to ensure that personal medical information is safeguarded against unauthorized access. Could you please provide the following details: <br>1. What encryption techniques are employed to secure data during transmission and storage? <br>2. What authentication protocols are used to verify user identities? <br>3. What access control mechanisms are implemented?","<name>, thank you for your concern regarding the security of medical data. Our organization prioritizes data protection and has established comprehensive security protocols for Outlook Adobe Sign. We utilize encryption technologies such as TLS and AES to secure data both in transit and at rest. Authentication is enforced through multi-factor authentication processes to verify user identities. Access controls are in place to restrict access to sensitive information, and we have incident response plans ready in case of security breaches. Regular reviews and updates to these measures are conducted to maintain security integrity.",Request,Returns and Exchanges,medium,en,52,Security,Data Protection,Encryption,Access Control,Medical Data,Information Security,,
Support Request Regarding Platform Downtimes,The agency is experiencing outages with Microsoft Office platforms. Clearing the cache and resetting have resolved the issue.,"Investigate platform outage issues <tel_num> for additional support, and contact for further discussions on solutions.",Incident,Technical Support,medium,de,52,Outage,Disruption,Recovery,Platform,Cache,Support,,
,"The agency's digital tools did not update and synchronize content correctly, possibly due to software compatibility issues or server misconfigurations. Efforts were made to resolve the issue, such as restarting servers, clearing cache, reinstalling applications, and checking network settings.","We have received your report about the digital tools issue. We will investigate the software compatibility and server configuration. Please allow us some time to look into the matter and contact you soon to provide a solution. If you could, please provide any additional information needed.",Incident,Technical Support,medium,en,52,Bug,Performance,Network,Disruption,IT,Tech Support,,
Meldung eines Serverüberlastungsproblems,"Nutzer berichten von Systemverlangsamungen und Fehlern während der Stoßzeiten, wahrscheinlich aufgrund einer Serverüberlastung. Es wurden Versuche unternommen, Dienste neu zu starten und den Cache zu leeren, doch das Problem besteht weiterhin. Zusätzliche Unterstützung ist erforderlich, um die Ursache zu beheben.",Untersuchen Sie das Problem der Serverüberlastung und kontaktieren Sie bei Bedarf die technische Unterstützung für weitere Fehlerbehebungsmaßnahmen.,Incident,Sales and Pre-Sales,medium,de,52,Performance,Outage,Disruption,Recovery,Hardware,,,
,"Durchführung gezielter digitaler Marketingkampagnen, Steigerung der Markenbekanntheit, Verbesserung des Engagements der Kunden für die betroffenen Produkte sowie die Optimierung des gesamten Kundenerlebnisses, um das Geschäftswachstum durch strategische Online-Initiativen voranzutreiben.","Wir freuen uns auf die Umsetzung gezielter digitaler Kampagnen für Ihre Produkte. Um Ihre Bedürfnisse besser zu verstehen, bitten wir Sie, uns weitere Informationen zu den betreffenden Produkten sowie zur aktuellen digitalen Marketingstrategie bereitzustellen. Dies ermöglicht es uns, individuell zugeschnittene Ratschläge und Empfehlungen zu geben. Wenn Sie lieber telefonisch sprechen möchten, teilen Sie uns bitte eine passende Zeit mit, unter <tel_num> anzurufen. Wir freuen uns darauf, die Möglichkeiten zur Steigerung der Markenbekanntheit und Kundenbindung gemeinsam zu erkunden.",Change,Product Support,medium,de,52,Marketing,Campaign,Brand Awareness,Engagement,Customer Experience,Digital Marketing,Strategy,Online Initiative
SaaS Scaling Guide,Could you provide comprehensive documentation on best practices for scaling a SaaS platform to effectively manage increased traffic and user growth while maintaining performance?,send guide,Request,Product Support,medium,en,52,Documentation,Performance,Feature,,,,,
