subject,body,answer,type,queue,priority,language,version,tag_1,tag_2,tag_3,tag_4,tag_5,tag_6,tag_7,tag_8
Details on Project Management SaaS Features,"Can you furnish details on the project management SaaS features and scalability options? I am keen to learn about the tool's support for team workflows and how it accommodates growth. Specifically, I would like to know about the different pricing plans and customization options available. Thank you for your assistance, and I look forward to hearing back soon.",I would be happy to provide information on the project management SaaS features and pricing plans. Please allow me to call at your convenience to discuss further.,Request,IT Support,medium,en,400,Feature,Feedback,Documentation,Sales,,,,
Support for VLC Media Player,Seeking assistance with integrating VLC Media Player into project management software. Could you provide detailed guidance on how to achieve this integration? What are the necessary steps and requirements? I would greatly appreciate any documentation or help that could guide me in getting started. Please let me know the specific system requirements and any compatibility issues that I should be aware of.,Your request for instructions on integrating VLC Media Player will be reviewed. Please allow us to contact you at a convenient time for further discussion.,Request,Customer Service,medium,en,400,Documentation,Tech Support,Feature,Feedback,,,,
Query on Digital Strategies,"Dear Customer Support, I am inquiring about the digital strategies your company employs to enhance brand growth. I would greatly appreciate any detailed insights or information you can share on this topic. Thank you for your assistance and look forward to hearing from you soon. Your guidance would help me better understand and improve brand visibility to reach a wider audience. Please let me know if there are any additional resources or materials I can refer to. I am eager to learn more about this subject and explore it further.","Hello, thank you for reaching out to our customer support team. Our company uses various digital strategies to enhance brand growth, such as social media marketing and online advertising. I will provide a list of recommended resources and materials for you. I would prefer to send you the information via email, but I can also call you at <tel_num> to discuss further. Please let me know a convenient time to contact you regarding <acc_num>.",Request,Billing and Payments,medium,en,400,Feedback,Sales,Documentation,IT,Tech Support,,,
Technische Probleme bei SaaS-Videokonferenzen,"Wir leiden häufig unter Abtrennungen während der SaaS-Videoanrufe bei Zoom und Skype. Die Probleme scheinen auf Überlast des Servers und schlechten Netzwerkverbindungen zurückzuführen. Das System wurde bereits neu gestartet, die Netzwerke umgestellt und Softwareaktualisierungen durchgeführt, dennoch besteht das Problem weiterhin. Das Team steht Ihnen zur Verfügung und ist bereit, zusätzliche Informationen zur Bearbeitung des Problems bereitzustellen.","Wir antworten auf Ihre E-Mail bezüglich des technischen Problems mit den häufigen Abtrennungen bei den SaaS-Videokonferenzen bei Zoom und Skype. Wir schätzen die bisherigen Fehlerbehebungsmaßnahmen sehr. Um Ihnen behilflich zu sein, möchten wir mehr Informationen zur Netzwerkinfrastruktur und Server-Konfiguration sammeln. Könnten Sie bitte mehr Details zur Netzwerkinfrastruktur und den genauen Fehlern mitteilen? Wir sind bereit, eine Telefonkonferenz zu vereinbaren, um das Problem zu diskutieren und eine Lösung zu finden.",Problem,Customer Service,medium,de,400,Bug,Network,Performance,IT,Tech Support,,,
Tech Support Concern,"A potential customer reported issues accessing the SaaS demo. This problem might have arisen due to high server traffic and overloads. After checking the server status and clearing the cache, the issue still persists. The customer managed to access the demo, but had a poor experience. We need to address this problem promptly to ensure a smooth experience for our customers and prevent further incidents.","Confirm that the issues related to accessing the SaaS demo have been reported by the potential customer. Thank you for checking the server status and clearing the cache, and understand that the problem still exists. I would like to diagnose the issue and ask for any details about the error and the steps the customer took to resolve it. Additionally, it would be helpful to have the specific timeframe when the issue occurred to identify server overloads. I would also like to further discuss this matter.",Incident,Sales and Pre-Sales,medium,de,400,Tech Support,Performance,Network,Disruption,,,,
Probleme mit dem Kundenservice,Der Analyse-Dashbeitrag zeigt falsche Metriken an.,"Entschuldigung für das Problem mit dem Analyse-Dashbeitrag, der falsche Metriken anzeigt. Bitte geben Sie mehr Informationen zur Ursache der falschen Metriken, damit wir das Problem lösen können.",Problem,Product Support,medium,de,400,Bug,Performance,Feedback,Documentation,IT,,,
Details on Securing Medical Data for Hospital Products and Services,Could you provide more details on how your hospital's products and services secure medical data? Thank you.,"<name>, thank you for reaching out regarding the security of medical data for our hospital's products and services. We take data protection very seriously and have implemented robust measures to ensure the confidentiality, integrity, and availability of sensitive medical information. Our products and services are designed not only to meet but to exceed industry standards for data security, including compliance with relevant regulations such as HIPAA. We utilize advanced encryption methods, secure data storage, and access controls to protect medical data.",Request,Product Support,medium,en,400,Security,Product,Feature,Documentation,,,,
Fehlerhafte Analyseergebnisse in Investitionsoptimierungsmodul gemeldet,"Sehr geehrte Kundenservice,\n\nwir begegnen Schwierigkeiten im Zusammenhang mit dem Investitionsoptimierungsmodul, da unzutreffende Analyseergebnisse produziert werden. Das Problem scheint auf Integrationsschwierigkeiten mit externen Datenquellen zurückzuführen. Trotz mehrerer Versuche, die Eingabedaten neu zu synchronisieren und die Parametereinstellungen anzupassen, konnte das Problem bisher nicht gelöst werden.\n\nDie unzutreffenden Ergebnisse bereiten Schwierigkeiten bei der Fehlernährung von Investitionsentscheidungen und wir benötigen Hilfe, um das Problem so schnell wie möglich zu lösen. Wir freuen uns auf Rat und Unterstützung, um die Integration externer Datenquellen zu klären und die Parametereinstellungen anzupassen, sodass die Analyseergebnisse korrekt sind.\n\nBitte","Sehr geehrte [name],\n\nvielen Dank, dass Sie uns über die Fehlerhafte Analyseergebnisse im Investitionsoptimierungsmodul informieren. Leider können wir derzeit keine fundierten Investitionsentscheidungen treffen, da die Schwierigkeiten bestehen bleiben. Wir verstehen die Dringlichkeit und sind entschlossen, so schnell wie möglich eine Lösung für das Problem zu finden.\n\nUm das Problem besser zu verstehen, könnten Sie uns bitte mehr Details zur Integration externer Datenquellen und den Parametereinstellungen geben, die Sie bisher angepasst haben. Zusätzlich wäre es hilfreich, wenn Sie uns genaue Fehlermeldungen zu den Ergebnissen angeben könnten.\n\nWir vereinbaren eine Anrufzeit, um dies zu klären.",Problem,Customer Service,low,de,400,Bug,Performance,Product,Tech Support,,,,
Umsetzung erweiteter Sicherheitsmaßnahmen für medizinische Daten,"Bitte umfassende Informationen zu den spezifischen Anforderungen und dem aktuellen Stand bereitstellen. Vorbereiten Sie die Bewertung der Implementierung, um die nächsten Schritte für das Konto <acc_num> zu bestimmen.","Anfrage zur Umsetzung erweiterter Sicherheitsmaßnahmen für medizinische Daten bearbeiten. Bitte detaillierte Informationen zu spezifischen Anforderungen und dem aktuellen Stand vorbereiten, um die Bewertung der Implementierung vorzunehmen und die nächsten Schritte für das Konto <acc_num> zu bestimmen.",Change,Product Support,low,de,400,Security,Account,IT,Tech Support,,,,
Beratung zu Sicherung medizinischer Daten auf IBM Cloud,"Lieber Kundenservice, ich möchte mich an Sie wenden, um die besten Praktiken zur Sicherung medizinischer Daten auf IBM Cloud zu erlangen, insbesondere für den Bereich der IT-Abteilung eines Krankenhauses. Ich würde gern Empfehlungen zu Richtlinien zur Verschlüsselung der Daten, Zugriffssteuerungen und der Einhaltung relevanter Vorschriften bekommen. Darüber hinaus interessiere ich mich für zusätzliche Sicherheitsfunktionen von IBM Cloud, die verwendet werden können, um vertrauliche medizinische Informationen zu schützen. Ich freue mich auf Ihre Unterstützung. Vielen Dank für Ihre Zeit.","Lieber [Name], danke, dass Sie sich an uns wenden. Wir danken für Ihre Anfrage bezüglich der Sicherung medizinischer Daten auf IBM Cloud. Empfehlungen zu Verschlüsselung, Zugriffssteuerungen und der Einhaltung von Vorschriften richten wir Ihnen unsere Website zur Verfügbarmachung der IBM Cloud-Sicherheitsfunktionen. Falls Sie weitere spezifische Informationen benötigen, um die Einsetzung dieser Funktionen zu besprechen, freuen wir uns, einen passenden Zeitpunkt für ein Telefonat auszumachen. Bitte geben Sie uns geeignetes Zeitfenster an, um Sie zu erreichen. [Telefonnummer]",Request,Billing and Payments,high,de,400,Security,IT,Tech Support,Documentation,,,,
Probleme bei der Datenanalyse-Plattform,"Die Unternehmens-Datenanalyse-Plattform zeigt Leistungsprobleme, die auf Ressourcenbeschränkungen und fehlerhafte Docker-Containern zurückzuführen sind. Versuche, die MongoDB-Aufrufe in den betroffenen Containern zu optimieren, haben die Situation nicht verbessert. Bitte helfen Sie bei der Behebung des Problems.","Die Docker-Containern sollten überprüft werden, insbesondere die MongoDB-Aufrufe, um das Leistungsproblem der Datenanalyse-Plattform zu beheben.",Incident,IT Support,medium,de,400,Performance,Bug,IT,Tech Support,,,,
,"Customer Support, we are writing to request the implementation of enhanced data analytics features to improve investment optimization and decision-making efficiency. This would involve the development of advanced algorithms and models to analyze market trends and provide actionable insights. Our goal is to enable informed decision-making and drive business growth. We believe this feature would be a valuable addition to the platform and look forward to hearing back soon. Thank you for your time and consideration.","<name>, thank you for reaching out with your request for enhanced data analytics features to improve investment optimization decision-making efficiency. We appreciate your feedback and are constantly looking for ways to improve our platform. The development of advanced algorithms and models to analyze market trends and provide actionable insights is an interesting idea that we would like to explore further. We would like to discuss the proposal in detail to understand the specific requirements. Could you please provide us with the necessary information?",Change,Product Support,high,en,400,Feature,Feedback,IT,Tech Support,,,,
Notwendige Technische Unterstützung,"Sehr geehrte Kundensupport, wir begegnen momentan unregelmäßigen Ladezeiten bei unserer Projektmanagement-Plattform. Möglicherweise ist dies auf erhöhte Nutzungsdaten zurückzuführen. Wir haben bereits den Cache geleert, die Serverleistung überprüft und die Anwendungsdiener neu gestartet. Trotz unserer Anstrengungen besteht das Problem weiterhin. Wir schätzen Ihre Unterstützung, um bald eine Lösung anzubieten. Bitte geben Sie uns, falls nötig, weitere Informationen zur Verfügung, um das Problem zu lösen.","Sehr geehrte [name], danke für Ihre Nachricht. Wir werden uns um das Problem bald kümmern und versuchen, eine Lösung zu finden. Könnten Sie uns bitte die detaillierte Fehlermeldung zu [acc_num] zur Verfügung stellen? Falls nötig, können wir auch telefonisch nach dem Problem suchen, um die beste Lösung zu ermitteln.",Problem,Technical Support,medium,de,400,Tech Support,Performance,IT,Network,,,,
Problem with Discord Integration API Permissions,There have been delays in project updates due to the integration process.,"<name> sincerely regrets the delays in project updates during the integration with Discord. To better understand and resolve the issue, we would like to gather some information from you. Please provide the exact steps you took during the integration and the expected outcome. Additionally, could you confirm any error messages you received and specify the type of API permissions that were granted? This information will help us investigate and provide a solution to minimize future delays in project updates. We would appreciate it if you could schedule a call at a convenient time for you.",Incident,Technical Support,low,en,400,Bug,Performance,IT,Tech Support,,,,
Seeking to Update Feature Compatibility Across Products,"Initiating request to update feature compatibility across impacted products with the aim of enhancing integration and user experience, thereby optimizing project management and significantly boosting workflow productivity.",Acknowledged request to update feature compatibility across products to enhance integration and user experience in project management. The request will be forwarded to the development team for review. Please expect further communication for additional discussion.,Change,Sales and Pre-Sales,low,en,400,Feature,Product,Feedback,,,,,
Support Inquiry for PostgreSQL 13 Integration,Looking for assistance in integrating PostgreSQL 13 with a SaaS project management solution? Need help with setting up configuration to ensure smooth data migration and compatibility.,"<name> thanks for your interest in integrating PostgreSQL 13 with a SaaS project management solution. To ensure smooth data migration and compatibility, I recommend reviewing the PostgreSQL integration documentation, which provides step-by-step guidance on setting up the configuration. If you have any specific questions, please let us know as we are happy to help. Alternatively, we can schedule a call at <tel_num> to discuss your requirements in detail and provide personalized support. Your account number is <acc_num>. Please advise on the best course of action.",Request,Customer Service,medium,en,400,Feature,Documentation,IT,Tech Support,,,,
Terraform Integration in Data Analytics Assistance,Is there a way to get details on the Terraform integration for data analytics investment optimization?,"To provide information on Terraform integration for data analytics investment optimization, please allow us to call for a convenient time to discuss the details of the integration.",Request,Customer Service,low,en,400,Feature,IT,Tech Support,Feedback,,,,
Problem with Data Analytics Tools Synchronization,"A financial firm is encountering issues with data analytics tools failing to sync with investment platforms. This may be due to software compatibility conflicts or API changes. Steps such as restarting applications, clearing caches, and checking for updates have been taken, but the issue persists. I would appreciate it if you could look into this matter and provide a solution as soon as possible.","Dear [Name], I acknowledge the issue with data analytics tools failing to sync with investment platforms at your financial firm. I understand that steps have already been taken to troubleshoot the issue, including restarting applications, clearing caches, and checking for updates. Please provide details on the software and API versions being used. Additionally, I would like to schedule a call at your convenience to discuss the matter further. Please let me know a suitable time for the call at [tel_num]. Best regards.",Problem,Product Support,high,en,400,Bug,Performance,IT,Tech Support,,,,
Investigation Needed for Investment Analytics Problem,Facing inconsistent investment performance analytics due to data discrepancies and model calibration issues.,Please investigate the data discrepancies and model calibration issues impacting investment performance analytics. Kindly provide detailed information about the irregularities you are experiencing for a thorough review.,Problem,Customer Service,medium,en,400,Bug,Performance,Documentation,Feedback,,,,
Erreichung der Erwartungen in der Markencampagne,Die Metriken der Markencampagne sind momentan niedrig.,"Bald werden die Markencampagne-Metriken überprüft und falls erforderlich, kontaktieren wir Sie.",Incident,Returns and Exchanges,medium,de,400,Feedback,Performance,Sales,,,,,
Problem mit dem Investitionsoptimierungswerkzeug,"Das Investitionsoptimierungswerkzeug integriert die Daten korrekt, trotzdem bestehen Softwarekompatibilitätsschwierigkeiten. Versucht, Programme neu zu installieren und die Datenverbindungen zu überprüfen, das Problem behält sich jedoch bestehen. Bitte teilen Sie mir bei Bedarf die Art der Softwarekompatibilitätsschwierigkeiten und spezifische Fehlermeldungen mit. Es wäre auch hilfreich, die Version des Investitionsoptimierungswerkzeugs und das verwendete Betriebssystem sowie das Laufgerät zu kennen. Es wäre schön, telefonisch über mögliche Lösungen zu sprechen. Das Telefonnummer ist <tel_num>. Ein Termin wäre vorzugsweise möglich.","Geehrte/r <name>, entschuldigen Sie bitte das Problem, das mit dem Investitionsoptimierungswerkzeug einhergeht. Dank Ihrer Bemühungen, das Problem durch Neustart und Überprüfung der Datenverbindungen zu beheben. Um Ihnen bestmöglich zu helfen, möchte ich wissen, in welcher Art die Softwarekompatibilitätsschwierigkeiten bestehen und ob Sie spezifische Fehlermeldungen erhalten haben. Zudem wäre es hilfreich, die genaue Version des Investitionsoptimierungswerkzeugs, das verwendete Betriebssystem sowie das Laufgerät zu kennen. Es wäre schön, telefonisch über mögliche Lösungen zu sprechen. Die Telefonnummer ist <tel_num>. Ein Termin wäre vorzugsweise möglich.",Problem,Product Support,low,de,400,Bug,Performance,IT,Tech Support,,,,
Finanzielle Firma: Probleme bei der Datensynkronisierung und Investment-Analyse aufgrund von Netzwerkunstabilität,Es gibt Schwierigkeiten bei der Datensynkronisierung und der Investment-Analyse aufgrund von Netzwerkunstabilität. Versuche zur Lösung umfassen den Neustart des Routers und das Optimieren der Gerätelaufstellung. Allerdings behält das Problem trotzdem anhaltend an.,"Es wird empfohlen, die Datensynkronisierungsprobleme und die Netzwerkunstabilität genauer zu untersuchen. Bitte geben Sie mehr Details zur Netzwerkkonfiguration und zu möglichen Fehlern, damit wir das Problem besser beurteilen können und Ihnen weitere Hilfe anbieten können.",Problem,Technical Support,medium,de,400,Network,Performance,Disruption,IT,Tech Support,,,
Microsoft Teams,Können Sie Details zur Nutzung von Microsoft Teams im Zusammenhang mit erweiterten digitalen Marketingstrategien liefern? Vielen Dank!,"Sehr geehrte/n [Name], ich freue mich, Ihnen bei Ihrer Anfrage zur Nutzung von Microsoft Teams in Bezug auf digitale Marketingstrategien behilflich zu sein. Microsoft Teams kann zur Verbesserung der Zusammenarbeit und Kommunikation innerhalb von Teammitgliedern sowie mit Kunden genutzt werden. Um mehr über die Nutzung von Microsoft Teams in digitalen Marketingstrategien zu erfahren, empfehle ich Ihnen, sich die Online-Ressourcen und Tutorials anzusehen. Falls Sie spezielle Fragen haben, können wir eine Telefonkonferenz vereinbaren, sobald ein zustimmender Termin gefunden wurde. Bitte teilen Sie den geeigneten Zeitpunkt für den Anruf [Telefonnummer].",Request,Technical Support,high,de,400,Feature,Feedback,IT,Tech Support,,,,
Sicherheitsfall medizinischer Daten,"Sehr geehrte Kundenservice,<br>Wir haben einen Sicherheitsfall identifiziert, der potenziell auf unautorisierten Zugriff auf medizinische Daten zurückzuführen sein könnte. Dies lag an einer falsch konfigurierten Netzwerksicherheitsmauer. Bislang wurden die Zugriffsprotokolle geprüft, und Sicherheitsrichtlinien wurden vorübergehend verstärkt.<br>Wir nehmen diesen Fall ernst und arbeiten daran, den Umfang des Falles zu bestimmen. Darüber hinaus überprüfen wir gründlich unsere Sicherheitsprozesse, um zukünftig ähnliche Fälle zu vermeiden.<br>Bitte melden Sie sich bei Bedarf an, um weitere Informationen oder Unterstützung zu erhalten.","Vielen Dank für Ihre Mitteilung und die bisherigen Maßnahmen. Bitte kontaktieren Sie uns, falls weitere Informationen oder Unterstützung erforderlich sind.",Incident,IT Support,medium,de,400,Security,Network,Bug,Performance,,,,
Request for Updating Server Configuration,"Dear customer support, I am writing to request an update to our server configurations to enhance performance during peak usage times. The current configuration is causing slow loading times, which is negatively impacting user experience. I would like to request an increase in server resources to handle high traffic. This could include upgrading the RAM, CPU, and adding a server cluster. I would appreciate it if the upgrade could be done without affecting the existing services. Please let me know.","Thank you for reaching out to us regarding the server configuration update. We understand the importance of enhancing performance during peak usage times. To better assess your request, could you please provide us with information about your current server setup and usage patterns? We will review the possibilities of upgrading the RAM, CPU, and adding a server cluster without affecting existing services. If you need further assistance, please schedule a call at <tel_num> at your convenience.",Change,Service Outages and Maintenance,medium,en,400,Performance,Network,IT,Tech Support,,,,
Assistance with Unexpected Invoice,"Received an unexpected invoice with additional charges. This might have occurred due to a billing error or miscommunication. So far, we have reviewed the contract and requested clarification from the billing department. We would appreciate it if you could look into the matter and provide a revised invoice with an explanation of the additional charges.","Dear [name], we are writing this email to acknowledge your concern regarding the unexpected invoice with additional charges. We understand your concern and would be happy to assist in resolving this matter. To better understand the issue, could you please provide your account number, invoice number, and any specific questions you have? We will review your account and investigate any billing discrepancies. If necessary, we may need to contact you for further discussion. We are available for a call at your convenience, but prefer to contact you at [tel_num]. We will provide a revised invoice once the matter is resolved.",Problem,Billing and Payments,low,en,400,Billing,Refund,Account,Feedback,,,,
Concern Regarding the Investment Analytics Tool,"Dear Customer Support, <br>I am writing to report an issue with the Investment Analytics Tool. The tool is unexpectedly halting data processing. I suspect that the high memory usage might be due to software compatibility issues. <br>So far, I have tried restarting the program and deleting temporary files, but the problem persists. <br>I look forward to receiving a quick solution. Please inform me if any additional information is needed. <br>Thank you.",Received your email regarding the issue with the Investment Analytics Tool. Additional information may be required to help resolve the issue. Please provide any further details and indicate when it would be convenient to discuss further.,Incident,Product Support,low,de,400,Bug,Performance,IT,Tech Support,,,,
Problem Sudden Increase in System Latency During Peak Usage Hours,"Noted a sudden spike in system latency during peak usage hours. This might be due to unoptimized database queries. Tried scaling resources and clearing caches, but no improvement was observed. Assistance in resolving this issue would be greatly appreciated.","Acknowledged the issue of experiencing system latency during peak usage hours. To better understand the problem, please provide details on the database queries suspected of causing the issue and the specific steps taken to scale resources and clear caches. Additionally, would like to schedule a call to discuss further. Available at the earliest convenience. Please let me know a suitable time to contact at <tel_num> for assistance in resolving the issue.",Incident,IT Support,high,en,400,Performance,Network,IT,Tech Support,,,,
Issues with Financial Reports,"Our finance firm has noticed discrepancies in investment analysis reports after recent software updates. These discrepancies seem to be due to incompatibility with existing data sources. Despite trying to revert the updates and reconfigure the analysis, the issue persists. Please assist in resolving this problem quickly.","I will investigate the issues with the financial reports. To better assist, please provide more details on the discrepancies observed following the software updates. We can arrange a call at your convenience to discuss further. Please provide an appropriate time to contact at <tel_num>. Alternatively, you can email the requested information and I will attend to it as soon as possible at <acc_num>.",Incident,Returns and Exchanges,medium,de,400,Bug,Performance,Documentation,,,,,
