subject,body,answer,type,queue,priority,language,version,tag_1,tag_2,tag_3,tag_4,tag_5,tag_6,tag_7,tag_8
,"Dear Customer Support, I am encountering an issue with securing medical data during routine operations. I suspect it might be due to integration conflicts between multiple software applications. I have already tried updating Norton 360, restarting my Mac Mini, and adjusting the barcode scanner settings, but the problem still persists. I would greatly appreciate your assistance in resolving this matter. Please let me know if you need any additional information from me. Thank you for your support.",We will investigate the integration conflicts that could be causing the security issue with your medical data. Please provide us with the versions of the software applications involved and any relevant analysis. We can discuss the next steps by contacting you at <tel_num>. Thank you.,Problem,IT Support,low,en,400,Bug,Hardware,IT,Tech Support,,,,
Guidelines for Secure Medical Data in Hospitals,Is it possible to provide comprehensive guidelines for securing medical data within a hospital's IT infrastructure? It is crucial to ensure the confidentiality and integrity of patient records.,"We can provide general guidelines, but for a detailed discussion on securing medical data within your hospital's infrastructure, please call us at <tel_num> for your convenience.",Request,IT Support,high,en,400,Documentation,Security,IT,,,,,
Problem with HubSpot CRM Integration,"A marketing agency is facing difficulties with the HubSpot CRM integration across various devices. Recent updates to PowerPoint 2021 on macOS Monterey might be the cause. Despite attempts at troubleshooting, including reinstalling HubSpot and checking connections, the issue continues. We require assistance to resolve this problem.",Please investigate the HubSpot CRM integration issue and contact us for troubleshooting and resolution.,Incident,Product Support,low,en,400,Bug,Performance,Network,IT,Tech Support,,,
Assistance with Investment Data Analysis Problems,Noticing inconsistent investment performance analytics due to data discrepancies and model calibration issues.,Please investigate the data discrepancies and model calibration issues that are impacting the investment performance analytics. Kindly provide detailed information about the irregularities you are experiencing for a comprehensive review.,Problem,Customer Service,medium,en,400,Bug,Performance,Documentation,IT,Tech Support,,,
Bitten um detaillierte Informationen zu digitalen Strategiedienstleistungen und Markenwachstum,"Ich würde gerne mehr über die Dienstleistungen erfahren, die Ihnen helfen, die Online-Präsenz Ihrer Unternehmen zu erweitern und neue Kunden zu erreichen. Besonders interessiert mich die digitalen Strategie und wie sie zum Markenwachstum beitragen können. Ich würde gerne mehr über Social-Media-Verwaltung, Content-Creations und Online-Werbung erfahren. Danke für Ihre Unterstützung.","Wir bieten angepasste digitale Strategiedienstleistungen an, die speziell zum Markenwachstum entwickelt wurden. Unser Angebot umfasst Social-Media-Verwaltung, Content-Creations und Online-Werbung. Diese Dienstleistungen sind darauf ausgelegt, die Online-Präsenz Ihrer Unternehmen zu erweitern und neue Kunden zu erreichen. Sprechen wir gerne darüber, wie unsere Dienstleistungen Ihnen helfen können. Wir freuen uns auf Ihren Anruf und freuen uns darauf, gezielter zu arbeiten. Sie können uns gerne anrufen unter <tel_num> für weitere Diskussionen.",Request,Billing and Payments,medium,de,400,Feature,Documentation,Feedback,Sales,IT,Tech Support,,
Digital Campaign Performance Issues,Noted that recent digital campaigns have not achieved the desired engagement levels.,"Dear [name], we are sorry to hear that recent digital campaigns have not driven the expected engagement. To better understand the issue and provide a solution, could you please provide details about the campaigns, their goals, the target audience, and the channels used? Additionally, it would be helpful to know the specific metrics used to measure engagement. If available, we would like to schedule a call at [tel_num] to discuss and explore options for improving campaign performance. Alternatively, please let us know a convenient time for you.",Problem,Product Support,low,en,400,Performance,Feedback,IT,Tech Support,,,,
Support Needed for Digital Strategy Impediment,"Our marketing agency encountered a digital strategy impediment. We have attempted to resolve it by troubleshooting software updates, including Malwarebytes and IntelliJ IDEA, but the issues continue to occur across various platforms.",We are here to assist with your digital strategy impediment. Please provide us with more details about the issue. You can contact us at <tel_num> to discuss further assistance for your <acc_num> account.,Problem,Customer Service,medium,en,400,Bug,Performance,IT,Tech Support,Feature,Documentation,,
Concern Regarding Data Analytics Software,"Dear Support Team, Recently, the data analytics software caused a critical investment analysis session to crash. This might be due to insufficient memory resources. After restarting the affected systems and checking for software updates, the issue still persists. The team relies heavily on the software for daily operations, and any disruption is causing significant delays. We would greatly appreciate if you could look into this matter urgently and provide a solution or guidance to resolve the issue. Please let us know.","Hello [Name], Thank you for your email regarding the issue with the data analytics software. We understand the urgency of the situation and its impact on your daily operations. To better assist you, could you please provide the error message received when the software crashed, along with the specifications of the system running on it, including the operating system and available memory? Additionally, it would be helpful to know the version of the data analytics software you are using and when the last update was installed. Your convenience is valued.",Incident,Technical Support,medium,en,400,Bug,Performance,Disruption,Maintenance,IT,Tech Support,,
,"The agency's social media advertisements are not achieving the expected engagement due to issues with the targeting and algorithm changes. After adjusting the targeting settings and enhancing the ad creatives, the results are still low.",Need more information,Problem,Technical Support,low,en,400,Feedback,Performance,Product,Feature,,,,
Security Incident: Identification of Potential Exposure in Medical Data Systems,"A security incident has been identified, which may have exposed patient information due to outdated protocols and human error.","\""Name\"" is taking the security incident with the medical data systems very seriously and is currently investigating the matter to determine the extent of potential exposure to patient information. We understand the importance of protecting sensitive data and sincerely apologize for any concern this may have caused. We believe the breach occurred due to outdated protocols and human error, and we are taking immediate action to update our security measures and retrain our staff to prevent such incidents in the future. We are also notifying affected parties and providing support.",Incident,Technical Support,high,en,400,Security,Bug,Performance,IT,Tech Support,,,
Seeking Guidance on Implementing Enhanced Security Measures for Medical Data Management in Hospital Infrastructure,I am in need of assistance with implementing enhanced security measures for managing medical data in our hospital infrastructure. Ensuring compliance and data integrity are crucial for our healthcare industry. I would like to learn about the best practices and available solutions to protect sensitive medical information. Could you provide me with information and guidance on this matter? I would greatly appreciate your help and look forward to hearing from you soon.,"We understand the importance of implementing enhanced security measures for medical data management in hospital infrastructure. To ensure compliance and data integrity, we can discuss practices such as encryption, access controls, and regular security audits. We would be happy to provide information and guidance on the available solutions. Could you please provide us with details about your current infrastructure and specific security concerns so that we can better understand your needs and provide a tailored solution? We prefer to discuss this further.",Change,IT Support,medium,en,400,Security,Compliance,IT,Tech Support,Feedback,,,
Sicherheitslücke in Medizinischen Systems,"Es wurde eine Sicherheitslücke in medizinischen Datensystemen identifiziert, die auf veraltete Verschlüsselungsmethoden zurückzuführen ist. Die Sicherheitsprotokolle wurden aktualisiert, und Schulungen für die Angestellten durchgeführt, um die Risiken zu mindern und den Datenschutz zu stärken.","Sehr geehrte [Name], wir bedanken uns für die schnelle Aktion zur Behebung der potenziellen Sicherheitslücke in den medizinischen Datensystemen. Die Sicherheitsprotokolle wurden aktualisiert, und Schulungen für die Angestellten durchgeführt. Um den Schutz vertraulicher Informationen weiterhin zu gewährleisten, empfehlen wir Ihnen, regelmäßige Sicherheitsprüfungen und Schwachstellenanalysen durchzuführen. Es wäre von Vorteil, den Notfallplan zu überprüfen, um sicherzustellen, dass er für die Bezugnahme auf zukünftige Sicherheitslücken effektiv ist. Falls Sie Unterstützung benötigen, melden Sie sich bitte unter [Telefonnummer], um das Thema erläutern zu lassen.",Problem,IT Support,high,de,400,Security,IT,Employee,Training,Feedback,,,
Probleme mit Unterbrechungen,"Unsere Anwendungen leiden unter intermittenter Unterbrechung, was möglicherweise auf kürzlich durchgeführte Serveraktualisierungen zurückzuführen ist. Die betroffenen Dienste wurden bereits neugestartet, und der Serverload wird überwacht.","Sehr geehrte [Name], wir verstehen Ihre Sorge über die intermittent auftretenden Unterbrechungen bei mehreren Anwendungen und schätzen die Schritte, die Sie bisher unternommen haben, um das Problem zu beheben. Um zukünftige Vorfälle zu vermeiden, möchten wir weitere Informationen zu den neuesten Aktualisierungen sammeln, die durchgeführt wurden, und den aktuellen Serverload überwachen. Könnten Sie uns bitte weitere Details zur Aktualisierung und den Serverload-Metriken liefern? Falls Sie weitere Unterstützung benötigen, können Sie uns telefonisch unter [Telefonnummer] erreichen.",Incident,Service Outages and Maintenance,low,de,400,Outage,Disruption,Maintenance,IT,Tech Support,,,
Problem with Monthly Invoices,"Dear Customer Support, we are drawing your attention to a billing discrepancy that occurred in the user's invoicing for the previous month. This issue might have resulted from a recent system update. So far, we have reviewed the transaction logs and confirmed the user's account settings. However, we require your assistance to resolve this matter. The discrepancy has caused confusion among users, and we would like to request your help in investigating and resolving it as soon as possible. Could you please provide more details about the discrepancy, including the date and amount of the invoices in question, and your account number (<acc_num>)? This information will assist us in providing a solution as quickly as possible. If you need to discuss further, please contact us at <tel_num>. We appreciate your attention to this matter and look forward to resolving it.","Dear [Name], we are investigating the billing discrepancy reported regarding your monthly invoices. To assist us further, could you please provide details about the discrepancy, including the date and amount of the invoices in question, and your account number (<acc_num>). We will provide a solution as soon as possible. If you need to discuss this further, please contact us at <tel_num>. We appreciate your attention to this matter and look forward to resolving it.",Incident,Billing and Payments,medium,en,400,Billing,Payment,Account,Refund,Performance,,,
Troubleshooting Needed for Connectivity Issues with Google Nest Wifi Router,"Marketing campaigns have been halted due to connectivity problems with the Google Nest Wifi Router. There might be network overload during peak usage times. I have already restarted the router and checked all device connections, but the issue persists. I would greatly appreciate your help in resolving this as soon as possible to minimize downtime and get the campaigns back on track.","I understand you are experiencing connectivity issues with your Google Nest Wifi Router, which is affecting your marketing campaigns. I would be happy to assist in resolving this issue. Please provide me with the details of your network setup and any exact error messages you are seeing. I would like to schedule a call at the earliest convenience to troubleshoot the issue and work towards a solution. Please let me know a suitable time for a call at <tel_num> to get your campaigns back on track as soon as possible.",Incident,Technical Support,high,en,400,Network,Performance,Disruption,IT,Tech Support,,,
Issues with Network Performance,"Dear Customer Support, <br><br>I am writing to report a critical issue with our investment data analysis. Several important applications, including Evernote and Figma, are experiencing significant performance issues. I suspect that network congestion on the TP-Link 16-port switch is affecting data transfer. <br><br>To date, I have tried to resolve the issue by restarting the switch and checking the connections, but the problem persists. I look forward to receiving guidance from your team on how to support the resolution of this problem. I hope for a swift solution.","Dear [Your Name], <br><br>Thank you for clarifying the network performance issue affecting your investment data analysis. I am sorry to hear that the problem persists despite restarting the TP-Link 16-port switches and checking the connections. Could you please provide more details about your network configuration and any specific error messages you are seeing when using Evernote and Figma? Additionally, it would be helpful to know the current firmware version installed on the TP-Link switch. Let's arrange a call to discuss further.",Incident,IT Support,high,de,400,Network,Performance,Bug,IT,Tech Support,,,
HubSpot CRM Integration,"Guten Tag Kundensupport, ich würde gerne nachfragen, ob die Integration von HubSpot CRM und Zoho Books für die Verfolgung von Investitionen funktioniert. Könnten Sie bitte mehr Informationen über die Wechselwirkungen zwischen diesen beiden Plattformen geben, um die Verfolgung von Investitionen zu erleichtern? Schätzen Sie es, die Vorteile der Verwendung von HubSpot CRM und Zoho Books in Erklärung zu geben, wie z.B. vereinfachte Datenverwaltung und erweiterte Berichtsfunktionen. Darüber hinaus würde ich gerne erfahren, welche konkreten Anforderungen es gibt, um die Integration beider Plattformen durchzuführen.","Guten Tag <name>, vielen Dank für Ihre Nachricht. Wir werden uns um die Informationen zur Integration von HubSpot CRM und Zoho Books kümmern. Die Wechselwirkungen zwischen diesen beiden Plattformen und deren Auswirkungen auf die Verfolgung von Investitionen werden wir bereitstellen. Um eine glatte Integration durchzuführen, müssen bestimmte Anforderungen erfüllt werden. Wir bieten gerne relevante Dokumentationen an. Es wäre angemessen, wenn wir uns bei der Diskussion der Vorteile und Konfigurationsanforderungen telefonisch treffen könnten. Oder Sie könnten die Ressourcen gerne per E-Mail an die Adresse <email> <acc_num> erhalten, um sie anzusehen.",Request,Technical Support,high,de,400,Feature,Documentation,Feedback,Tech Support,,,,
Inquiry About SaaS Solution Integrations with Shopify and Airtable,"Hello, thank you for your interest in the integration capabilities of our SaaS solution with Shopify and Airtable. Our solution provides a seamless integration between platforms, enhancing workflow and functionality. We would be happy to provide detailed information about the setup, functionality, and any potential limitations. To discuss this further at your convenience, could we please schedule a call? Please let us know a suitable time to reach you at <tel_num>.","Dear <name>, we appreciate your interest in the integration capabilities of our SaaS solution with Shopify and Airtable. Our solution offers seamless integration between platforms, streamlining workflows and enhancing functionality. We would like to provide you with detailed information regarding the setup, functionality, and any potential limitations. To discuss this further at your convenience, we would like to schedule a call. Please let us know a suitable time to reach you at <tel_num>.",Request,Returns and Exchanges,medium,en,400,Feature,Feedback,Sales,Tech Support,,,,
Recurring Connection Problems with SaaS Application on Diverse Devices,"I am reaching out to document the ongoing connectivity issues with the SaaS application across different devices. After multiple attempts to resolve the issue by resetting the devices, updating firmware and adjusting network settings, the problem still persists. It is possible that the issue stems from compatibility problems with the network configuration across various products. Despite thorough troubleshooting, the issue remains unresolved. I would greatly appreciate it if you could look into this matter and provide a solution at your earliest convenience. Please.",I have received your email concerning the connectivity issues with the SaaS application. We will investigate this matter and kindly ask you to provide your account number so we can discuss this further at your convenience.,Problem,Product Support,high,en,400,Network,Performance,Disruption,IT,Tech Support,,,
Datensperrverletzung bei Gesundheitsystemen entdeckt,Bitte helfen Sie bei der Behebung des Problems,"unternehmen sofortige Maßnahmen, um die Datensperrverletzung bei Gesundheitsystemen zu untersuchen. Kontaktieren Sie uns unter <tel_num>, um weitere Hilfe zu erhalten und das Problem zu lösen.",Problem,Customer Service,low,de,400,Security,Bug,IT,,,,,
Support Request Required,Issue with Data Analysis Toolkit,"Dear <name>, we apologize for the malfunction in the Data Analysis Toolkit. Could you please provide more details about the error, such as any error messages received, to help us address the issue more effectively? It may be necessary to discuss this further via a phone call. Please provide an appropriate time, <tel_num>.",Incident,Customer Service,medium,de,400,Bug,Performance,IT,Tech Support,,,,
Unzusammenhängende Ergebnisse in Investment-Modell,Unzusammenhängende Ergebnisse im Investment-Modell aufgrund von Datengüteproblemen,"Sehr geehrte/r [Name],\n\nich habe Einen E-Mail mit unzusammenhängenden Ergebnissen aus dem Investment-Modell aufgrund von Datengüteproblemen erhalten. Könnten Sie bitte mehr Details zur Ursache und Natur der unzusammenhängenden Ergebnisse geben, damit wir sie besser verstehen können? Ich freue mich darauf, eine Lösung für das Problem zu finden. Falls ein Telefonat erforderlich ist, stehe ich Ihnen gerne zu einem geeigneten Zeitpunkt zur Verfügung, um die Angelegenheit zu besprechen.\n\nMit freundlichen Grüßen,",Problem,Customer Service,low,de,400,Bug,Performance,Feedback,Documentation,,,,
Analyse und Optimierung von Investitionsstrategien mit Hilfe von QuickBooks Online,Können Einblicke in die Optimierung von Investitionsstrategien durch Datenanalyse von QuickBooks Online gewonnen werden? Vielen Dank für Ihre Unterstützung bei dieser Angelegenheit.,"Sehr geehrte/r [Name],\n\nvielen Dank für Ihre Anfrage. Die Optimierung von Investitionsstrategien mithilfe von Datenanalyse in QuickBooks Online ist möglich. Diese Plattform bietet verschiedene Werkzeuge und Funktionen, um data-basierte Entscheidungen für Investitionsstrategien zu treffen. Durch die Nutzung der Berichtsfunktionen können finanzielle Daten analysiert und Ausgaben sowie Einnahmen verfolgt werden, um Trends und Muster zu identifizieren. Darüber hinaus können Budgetplanung- und Prognosewerkzeuge verwendet werden, um vorausblickende Modelle zu erstellen und Investitionsentscheidungen zu unterstützen. ",Request,Technical Support,medium,de,400,Performance,Documentation,Feedback,IT,Tech Support,,,
Support for Integrating Wolfram Mathematica into Project Management Platform,"Greetings from the support team. We have received your inquiry about integrating Wolfram Mathematica into the project management SaaS platform you are working on. We are excited about the prospect of using Mathematica as a powerful tool for your project, given its advanced computational capabilities. However, we are unsure about the steps required to integrate it with your platform. Could you please provide us with more detailed information about your specific requirements so that we can guide you better? We would also appreciate any documentation, tutorials, or support resources you can share. Specifically, we would like to know which APIs or plugins are available to facilitate this integration. We look forward to hearing from you.","Hello [name], thank you for reaching out to our support team regarding the integration of Wolfram Mathematica into your project management SaaS platform. We appreciate your interest in using Mathematica as a valuable tool for your project and are happy to assist you. To better assist you, could you please provide us with more detailed information about your specific requirements so that we can determine the best approach for achieving the integration? We offer APIs and plugins that can facilitate this process, and we would like to discuss the details to determine the most effective method. If convenient, we would like to schedule a call at your earliest convenience at [tel_num] to discuss this further. Thank you.",Request,Technical Support,high,en,400,Feedback,Feature,Documentation,Tech Support,,,,
Issue with Delay Adobe Creative Cloud,"Facing delays in accessing Adobe Creative Cloud services, which has affected my project timeline. This issue might have arisen after the last maintenance updates.",Will investigate the issue with delays in Adobe Creative Cloud. Will communicate further details and potential solutions shortly.,Incident,Customer Service,low,de,400,Performance,Maintenance,IT,Tech Support,,,,
,Ich möchte mich über die Avast Premium Security IT-Bedingungen für Krankenhäuser informieren. Könnten Sie mehr Informationen zu der Verschlüsselung und dem Schutz medizinischer Daten bereitstellen?,"Vielen Dank für Ihr Interesse an Avast Premium Security und die Krankenhaus-IT-Bedingungen. Avast bietet eine umfangreiche Verschlüsselung und Schutz für sensible medizinische Daten. Wir freuen uns, Ihre Bedürfnisse mit einer angepassten Lösung zu erfüllen. Bitte teilen Sie uns weitere Details zu Ihrer aktuellen IT-Infrastruktur und spezifischen Sicherheitsbesorgnisse mit. Wir können gerne einen Termin für eine Telefonkonferenz vereinbaren, um diese Details zu besprechen.",Request,IT Support,high,de,400,Security,Documentation,Feedback,,,,,
Detection of Unauthorized Access to Sensitive Data,"Dear Customer Support,<br>We are reaching out to inform you about a potential security breach in our hospital systems. The security team has identified an unauthorized access attempt to sensitive medical data.<br>The incident is suspected to be caused by inadequate security configurations and outdated software. We have already initiated a system-wide security audit to update the affected software and prevent future incidents.<br>We would appreciate your assistance in providing recommendations to enhance our security measures.<br>Thank you.","We take security breaches very seriously and are here to assist you. To better understand the incident, could you please provide details on the detected unauthorized access attempt, including the date and time it occurred? Your review of this information will help us provide the necessary recommendations to enhance our security measures.",Incident,IT Support,medium,en,400,Security,Network,Virus,Incident,Alert,,,
Sicherung Krankenhausdaten in Hospital-IT-Systemen,"kompakte Informationen zu Sicherung Krankenhausdaten in IT-Systemen, die Krankenhäuser zur Bereitstellung von Dienstleistungen nutzen, erforderlich?","Lösungen zur Sicherung Krankenhausdaten in IT-Systemen anbieten. Dienstleistungen umfassen Datensicherung, Zugriffssteuerung und regelmäßige Sicherheitsprüfungen. Diskutieren Sie gerne mehr aktuelle IT-Systeme und Krankenhaus-spezifische Sicherheitsanliegen. Freuen wir uns auf die Vereinbarung eines Telefonkonferenz-Gelegenheiten, um die Dienstleistungen zu erläutern und sicherzustellen, dass sie den Anforderungen zur Sicherung Krankenhausdaten gerecht werden. Bitte geben Sie die geeignete Zeit für die Konferenz bekannt.",Request,Customer Service,medium,de,400,Backup,IT,Tech Support,Security,Maintenance,,,
Exploring Data Analytics for Investment in Adobe Creative Cloud and Zoho Books,Could you provide more details on using data analytics for investment in Adobe Creative Cloud and Zoho Books? I need some guidance on integrating these tools.,"Thank you for your interest in leveraging data analytics for investment in Adobe Creative Cloud and Zoho Books. We would appreciate knowing your current setup and the specific aspects of data analytics you are looking to integrate. Could you please provide more details on what you are trying to achieve? This will help us give you tailored advice. We are available to schedule a call at <tel_num> at your convenience. Alternatively, you can communicate with us via",Request,Billing and Payments,high,en,400,Feature,Feedback,Documentation,Sales,,,,
