subject,body,answer,type,queue,priority,language,version,tag_1,tag_2,tag_3,tag_4,tag_5,tag_6,tag_7,tag_8
Request for Assistance with MATLAB R2021a SaaS Integration,"Could you provide specific details on integrating the MATLAB R2021a project management SaaS solution? I am interested in learning how to successfully merge these tools to enhance our workflow. Specifically, I would like to know about any compatibility issues, the necessary configuration steps, and the potential benefits of integrating the MATLAB SaaS solution. I appreciate your time and assistance on this matter, and I look forward to hearing from you soon.","I would be happy to assist with integrating the MATLAB R2021a SaaS solution. Please provide detailed information, and could you please give me a convenient time to call and discuss compatibility and configuration steps?",Request,Customer Service,low,en,400,Feature,Tech Support,Documentation,,,,,
Guidance on Securing Medical Data in Hospitals,Could you provide guidance on practices for securing medical data within hospital systems to ensure confidentiality and integrity of patient information?,"We can provide guidance on securing medical data in hospital systems to ensure confidentiality and integrity of patient information. Practices include implementing access controls, encrypting sensitive data, and regularly updating security software. For additional recommendations, please call <tel_num> or provide information via email.",Request,Human Resources,low,en,400,Security,Documentation,IT,,,,,
Issue with Anlage Calculations,"The financial firm encountered discrepancies in the use of H2O.ai and SQL Server during the Anlagenturnover calculations. The problem seems to stem from integration errors and outdated algorithms. Despite the team having reviewed the source files and updated the software, uncertainties persist. We are attempting to resolve the issue, but it remains unresolved. We estimate that we could address the matter quickly with a solution if additional information is provided. Please inform us of any further details necessary for a thorough analysis.","Service Desk is ready to assist with the Issue with Anlage Calculations involving the use of H2O.ai and SQL Server. I understand that the team has already reviewed the source files and updated the software, but uncertainties still exist. To better understand the problem, we need more information about the errors encountered and the troubleshooting steps taken so far. Please give us a good time to call so we can discuss the next steps and resolve the issue for account <acc_num>. Contact number: <tel_num>",Problem,Returns and Exchanges,low,de,400,Bug,Performance,IT,Tech Support,Documentation,,,
,I need assistance with integrating TensorFlow into my Ruby on Rails project for data analytics. Could you provide some resources or tutorials to help me get started?,"Sure, I can provide resources and tutorials for integrating TensorFlow with Ruby on Rails. Please allow us to call and discuss the details further.",Request,IT Support,high,en,400,Feedback,Documentation,IT,Tech Support,,,,
Enhance Digital Tools Efficiency,We request the optimization of digital tools to boost brand visibility and growth. Streamlined integration and support are believed to enhance overall performance and reach a broader audience.,We appreciate your interest in optimizing digital tools to enhance brand visibility and growth. Please contact us at <tel_num> to discuss your request and explore possible solutions at <acc_num>.,Change,IT Support,medium,en,400,Feature,Performance,Feedback,IT,,,,
Digital Strategy Performance Inquiry,"Notices that the digital strategies are not performing as expected, which is affecting brand growth due to integration challenges.","Dear <name>, we acknowledge your concern regarding the underperformance of digital strategies. To better understand the specific integration issues you are facing, could you please provide more details about the problems you are encountering? This will help us to provide a tailored solution to address the impact on brand growth. If convenient, let's schedule a call at a time that works for you to discuss this further. Please let me know a suitable time to reach you at <tel_num>. Thank you.",Problem,Product Support,low,en,400,Performance,Feedback,Feature,Documentation,,,,
,There was an outage with the network that impacted data retrieval for investment analytics because of a failure in the Aruba 2530 48G Switch. Basic troubleshooting was tried but did not resolve the issue.,"Received an email about the network outage which affected data retrieval for investment analytics due to the failure of the Aruba 2530 48G Switch. I'm sorry to hear that basic troubleshooting did not resolve the issue. I would be happy to assist you. Please provide any error messages and details of the steps you have taken so far. If needed, we can schedule a call at your convenience to discuss the issue in detail and determine the next steps to get the network back online. Please let me know.",Incident,Technical Support,high,en,400,Outage,Network,Performance,IT,Tech Support,,,
Support for Accelerating Brand Growth,"Despite implementing various digital strategies, the marketing department is experiencing challenges in brand growth. The inefficiency of current tools and the lack of a coordinated strategy are believed to be the primary issues. Efforts to optimize campaigns using Evernote and Zapier have resulted in minimal improvements. We are seeking a more effective solution to strengthen our online brand presence and boost sales. Could you provide guidance on the best tools and strategies to achieve our goals? Your insights and recommendations would be highly valued.","I understand your concern regarding the slowed brand growth despite the implementation of various digital strategies. To better assist you, could you please provide more details about your current marketing activities, including your target audience and specific goals? This will enable me to offer more tailored advice regarding the most suitable tools and strategies to help you achieve your objectives. I am open to discussing options like marketing automation tools and social media management software. If a phone conference is available, we can delve into more details.",Problem,Customer Service,low,de,400,Feedback,Performance,Feature,IT,Tech Support,,,
Refresh Digital Marketing Strategies,"Customer Support, requesting an update to our digital marketing strategies to enhance brand growth and customer engagement across various platforms. Our current strategies are yielding the desired results, but we need to adapt to changing market trends. We would greatly appreciate a comprehensive plan to improve our online presence and reach a wider audience. This should include social media, email marketing, and search engine optimization. We look forward to your response.",We will review your request to update the digital marketing strategy. Please allow us to contact you at <tel_num> to discuss and provide a comprehensive plan to enhance your online presence.,Change,Customer Service,medium,en,400,Feedback,Sales,IT,Tech Support,,,,
Technical Troubleshooting,"Facing technical challenges with several software applications, which are impacting marketing efforts. Recent software updates might be causing compatibility issues. Despite reinstallation and verifying system updates, the problems continue.","We are investigating technical issues with the software products you are experiencing difficulties with. Please provide specific details about the products and the errors you are encountering. Additionally, we need your account information, including the account number, to address this matter effectively and find a suitable solution.",Problem,Technical Support,high,en,400,Bug,Performance,IT,Tech Support,Documentation,,,
Unerlaubter Zugriff auf medizinische Daten,"Der Gesundheitsversorgungsanbieter hat einen unerlaubten Zugriff auf medizinische Daten erlebt, was möglicherweise auf veraltete Sicherheitsprotokolle zurückzuführen sein könnte. Obwohl Systemaudits durchgeführt und Software aktualisiert wurden, behalten die Probleme ihren Bestand. Es wird gebeten, Unterstützung bei der Lösung des Problems und zur Erhöhung der Sicherheitsmaßnahmen, um sensible Informationen zu schützen, zu erhalten.","Den Fall durchzugehen, wird Kontakt zum Support ermöglichen, um weitere Unterstützung bei Sicherheitsverbesserungen zu besprechen.",Problem,Returns and Exchanges,medium,de,400,Security,Virus,IT,Tech Support,,,,
Verwaltungsfähigkeiten Verbessern durch Intelligente Geräte Integration,"Die Anforderung umfasst die Integration intelligenter technologischer Software, um die Projektverwaltungsfähigkeiten zu verbessern.","Sehr geehrte [Name], wir haben Ihre Anfrage zur Integration intelligenter technologischer Software erhalten, die die Projektverwaltungsfähigkeiten verbessern soll. Das Team wird Ihre Anfrage bald bearbeiten und kontaktieren. Bitte geben Sie mehr Details zu den spezifischen Geräten und Software, die Sie integrieren möchten, damit wir eine genaue Bewertung der Implementierungsinformationen liefern können.",Change,IT Support,medium,de,400,Feature,IT,Tech Support,,,,,
Inquiry about SaaS Project Management Tool,"Hello Customer Support, I am writing to inquire about the billing features of the SaaS project management tool. Could you please provide details on the available plans, payment options, and any discounts that may be offered? I am particularly interested in understanding how the tool scales to meet the growing needs of my business. Additionally, I would appreciate information on the level of support provided and the security measures in place to protect user data. I look forward to hearing back soon.","Dear [Name], thank you for your inquiry regarding the SaaS project management tool. We will provide you with detailed information about the plans and features. Please call [Tel Number] to discuss further.",Request,Billing and Payments,medium,en,400,Billing,Payment,Feature,Product,Security,Feedback,Sales,
Assistance Required for RapidMiner Integration,"Hello customer support, I am reaching out to seek guidance on integrating RapidMiner SaaS project management software into my project. Could you provide some guidance and documentation resources to help me get started? Specifically, I would like to know about the available APIs and tools for integration. I appreciate your time and assistance. I look forward to hearing back from you soon.","Dear [name], thank you for reaching out to our support team. We would be happy to assist you with integrating RapidMiner SaaS project management software. Please find the API documentation on our website. If you have any further questions or need additional assistance, we are glad to schedule a call at [tel_num] to discuss further with you.",Request,Technical Support,medium,en,400,Feature,Documentation,IT,Tech Support,,,,
Exploring Digital Strategies for Brand Growth,I am seeking information on digital strategies that contribute to brand growth. Could you provide details on your approach and share relevant case studies? I am interested in learning about strategies that have contributed to the growth of successful brands.,"Thank you for your interest in digital strategies for brand growth. Our approach focuses on creating engaging content and leveraging social media platforms to reach target audiences. We have seen significant successes with previous clients, resulting in increased brand awareness and customer engagement. I would be happy to share relevant case studies with you. Let's discuss further; I am available for a call or you can email me directly at [email protected]",Request,Technical Support,medium,en,400,Feedback,Sales,Feature,Documentation,,,,
Concerns Regarding Declining Engagement Rates in Digital Campaigns Due to Algorithm Changes and Ineffective Targeting,"Our digital campaigns have seen a decline in engagement rates, which is largely attributed to recent algorithm changes and ineffective targeting strategies. The current results are not satisfactory.","I understand your concerns about the declining engagement rates in your digital campaigns, which are largely due to recent algorithm changes and ineffective targeting strategies. To improve the results, I suggest reviewing your current targeting strategy and adjusting it according to the latest algorithm updates. Please provide more details about your current campaigns, including targeting options, ad creatives, so I can provide specific guidance. Alternatively, for a more detailed discussion, please let me know a suitable time to call and discuss further.",Incident,Product Support,low,en,400,Feedback,Performance,Feature,,,,,
,"Dear customer support, we are writing to inquire about enhancing security protocols for medical data management systems to ensure compliance and protect patient information. Essential steps include implementing robust access controls and encrypting sensitive data to prevent unauthorized access. We offer customized solutions to meet specific needs. To better understand your requirements, could you please provide information on your current infrastructure and how you manage medical data? We would like to schedule a call to discuss further.","Thank you for your concern regarding enhancing security protocols for medical data management systems to ensure compliance and protect patient information. Implementing robust access controls and encrypting sensitive data are essential steps in preventing unauthorized access. We offer customized solutions to meet specific needs. To better understand your requirements, please provide information on your current infrastructure and how you manage medical data. We would like to schedule a call to discuss further.",Change,Product Support,medium,en,400,Security,IT,Tech Support,,,,,
Healthcare Provider's Data Breach Due to Outdated Software and Inadequate Security Measures,"A healthcare provider has faced a data breach owing to outdated software and insufficient security measures. Despite updating the software and conducting a security audit, vulnerabilities persist. We need your assistance in identifying and addressing these weaknesses to ensure that security systems effectively protect sensitive patient information.","We are reaching out to address the security vulnerabilities faced by the healthcare provider due to a data breach. To better assist you, we would like to schedule a call to discuss the details of the security audit and the updated software. Please let us know a convenient time for the call at <tel_num>. To provide a proper assessment and recommendations for improvement, we need information on the existing vulnerabilities and the current security measures in place.",Incident,Technical Support,medium,en,400,Security,Bug,Virus,IT,Tech Support,,,
Issue with Billing Discrepancy on Adobe Effects GitHub After Recent System Update,"There was a billing discrepancy on Adobe Effects GitHub following the recent system update. I attempted to reconcile my account and contacted customer service, but the issue remains unresolved. Assistance is needed to resolve this issue.","We will assist with resolving the billing discrepancy issue for Adobe Effects GitHub. Please provide your account number and a detailed description of the issue, including the amount in question. Our team will investigate and work to resolve the matter as soon as possible. We are available for a call at a later time or prefer to discuss and resolve the issue via email for your convenience.",Incident,Billing and Payments,medium,en,400,Billing,Account,Refund,Performance,Support,,,
Verbessern Sie unverzüglich unsere Datenanalyse-Tools,"Ich schlage vor, die Datenanalyse-Tools zu verbessern, indem wir integrierende Funktionen hinzufügen, die eine bessere Investitionsoptimierung und Leistungsüberwachung ermöglichen. Derzeitige Tools bieten eingeschränkte Einblicke, die notwendigen Informationen zur Fälligkeit von geprüften Entscheidungen. Ich würde gerne fortschrittlichere Funktionalitäten sehen, wie z.B. Echtzeitdatenüberwachung, anpassbare Dashboards und die Integration mit Investitionsplattformen. Diese Verbesserungen könnten das Investitionsverhalten erheblich verbessern und uns dabei helfen, mehr geprüfte Entscheidungen zu treffen.",Wir werden Ihre Anfrage zur Verbesserung der Datenanalyse-Tools und deren -integrierungen unverzüglich prüfen.,Change,Product Support,medium,de,400,Feature,Performance,Feedback,IT,,,,
Ensuring Compliance for Medical Data Security,"Looking for assistance with securing access to medical data in Outlook 2021. Could you provide guidance on the necessary steps to ensure our systems meet the required compliance standards? It is crucial to protect sensitive patient information by ensuring the software is up to date with the latest security patches. Please provide detailed instructions and recommend any available resources for further learning. Your help is greatly appreciated, and I look forward to hearing from you soon.","Thank you for your concern regarding securing medical data. To ensure compliance, we recommend enabling encryption and two-factor authentication in Outlook 2021. Please regularly update the software to the latest security patches. For detailed instructions, please visit our website or contact us at <tel_num> to schedule a call. Additional resources for learning are also available. Please let us know a suitable time for a call to discuss your specific requirements and provide personalized guidance on securing medical data.",Request,Technical Support,high,en,400,Security,Compliance,IT,Tech Support,,,,
Boosting Brand Presence with Smart Products,Offer insights into digital strategies,Offer insights into digital strategies to boost brand presence with smart products. Please provide an outline of key approaches and suggest a convenient time for a call to discuss in detail. <tel_num>,Request,Sales and Pre-Sales,medium,en,400,Feedback,Sales,Feature,,,,,
Assistance with Investment Optimization,"Hello Customer Support, I am inquiring about the analytics tools you offer to enhance investment optimization. Could you provide details on their features, benefits, and how they integrate with existing systems, including customization options? I am particularly interested in understanding how these tools can help me identify trends, analyze data, and make informed investment decisions. I believe that access to advanced analytics could significantly improve my investment outcomes, and I am eager to learn more about your solutions.",We will review your inquiry and provide a detailed response regarding the analytics tools and investment optimization solutions shortly.,Request,Product Support,medium,en,400,Feature,Feedback,IT,Tech Support,,,,
Issue with Data Query,"Users are reporting recurring issues with data queries on the SaaS platform. There are compatibility issues with Node.js, MySQL, and Magento. Services have been restarted and relevant packages have been updated, but the problem persists.","Dear <name>, we would like to inform you about the issue with the data query on the SaaS platform. We are sorry to hear that users are still experiencing problems despite the restarts of the services and updates to the relevant packages. We will investigate the compatibility issues with Node.js, MySQL, and Magento. Please provide detailed information, including error logs, configuration details, and versions of the technologies being used. We would like to discuss the matter further. If a phone conference is available at your convenience, please let us know when.",Incident,Technical Support,medium,de,400,Bug,Performance,Documentation,Tech Support,,,,
Performance Concern,"The data analytics platform is currently experiencing slow performance during investment simulations. This could be due to resource overloading or software compatibility issues. We have already attempted to restart the server, update Python libraries, and optimize Docker containers, but the issue still persists. This slow performance is impacting our ability to run simulations in a timely manner and make informed investment decisions. We would greatly appreciate your assistance in resolving this matter as soon as possible. Please let us know if you need more details or if a call would be more convenient. Our contact number is <tel_num> and your account number is <acc_num>. Thank you.","We are looking into the performance issue with the data analytics platform. To troubleshoot, could you please provide us with details about your system configuration, including the server specifications and the version of the operating system? Additionally, it would be helpful to know the exact error messages and the symptoms you are experiencing during the investment simulations. If further information is needed, we can schedule a call to discuss this further. Please let us know a suitable time to reach you at <tel_num> for account <acc_num>. Thank you.",Problem,Technical Support,medium,en,400,Performance,Bug,IT,Tech Support,,,,
Help with CRM Connectivity Problem,"Our marketing agency is facing connectivity issues with Salesforce and Microsoft Teams. The problem might have arisen due to recent software updates. We have already restarted the systems and checked the network settings, but the issue still persists. We would greatly appreciate your assistance in resolving this matter, which is affecting our productivity. Please let us know if there are any additional steps we need to take and the information you require from us.",I would be happy to help with your Salesforce and Microsoft Teams connectivity issue. Could you please provide any error messages you are seeing? This will help me guide you through the next steps to resolve the issue. It would also be convenient to discuss this further over a call.,Incident,Technical Support,high,en,400,Network,IT,Tech Support,Performance,,,,
Support Required for Integrating Kaspersky,Can you furnish information on integrating the Kaspersky Internet Security project management SaaS? I need guidance on the technical requirements and setup process. Your assistance would be greatly appreciated!,"I can provide guidance on integrating the Kaspersky Internet Security project management SaaS. To assist further, please provide details on your current setup and technical requirements, so we can proceed with the successful integration.",Request,IT Support,high,en,400,IT,Tech Support,Security,Documentation,Feedback,,,
Verbesserung digitaler Marketingstrategien und Anhebung der Markenpräsenz und Kundenengagement,"Es ist wichtig, unsere digitale Marketingstrategie zu verbessern und die Markenpräsenz sowie das Kundenengagement unserer Agentur zu stärken.","Wir freuen uns, die Verbesserung Ihrer digitalen Marketingstrategie und die Anhebung der Markenpräsenz und des Kundenengagements unterstützen zu können. Bitte geben Sie uns mehr Details zu Ihren aktuellen Strategien und Zielen. Sie können sich an uns via <tel_num> wenden, um weiterzudenken.",Change,Product Support,high,de,400,Feedback,Sales,Feature,,,,,
Seeking Effective Digital Strategies for Brand Growth,I am looking to inquire about effective digital strategies that can enhance brand growth. Could you provide information on the products or services listed that have been utilized to achieve similar goals? I would greatly appreciate any guidance or recommendations that can help me make informed decisions.,"I am delighted to help with your inquiry regarding effective digital strategies for enhancing brand growth. To better understand your needs, could you please provide information on your current brand status and the specific areas where you are looking to improve? This will allow me to provide tailored guidance and recommendations. Generally, the products and services we offer are designed to help businesses like yours achieve their growth goals, including targeted digital marketing and analytics solutions. I would be happy to discuss these products in detail and explain how they can be beneficial.",Request,IT Support,medium,en,400,Feedback,Sales,Product,Feature,,,,
Details on Integrating Elasticsearch 7.13 for SaaS Project Management,Could you provide more information on integrating Elasticsearch 7.13 for a scalable SaaS project management solution? I need to know the steps and requirements for a successful integration.,"To integrate Elasticsearch 7.13 for a SaaS project management solution, you will need API access and specific plugin installation. Please provide your account number and a detailed description of the project requirements. We can then outline the necessary steps and provide a list of technical specifications for a successful integration. To discuss further at your convenience, please let us know a suitable time to contact you at <tel_num>.",Request,Sales and Pre-Sales,medium,en,400,Feature,Documentation,IT,Tech Support,,,,
Investment-Optimierungsmodell bricht während der Analyse großer Datensätze zusammen,"Die Softwarekompatibilität und die Speicherbeanspruchung während der Analyse großer Datensätze führen zu Problemen. Das Modell bricht oft zusammen, was durch mehrfache Neustarts und das Leeren von Caches nicht behoben wird. Bitte geben Sie Unterstützung an.","Wir untersuchen derzeit das Problem mit dem Zusammenbruch des Investment-Optimierungsmodells während der Analyse großer Datensätze. Um Ihnen besser zu helfen, bitte geben Sie mehr Details zur verwendeten Software und Systemkonfiguration. Ich möchte gerne einen Anruf planen, um weitere Informationen zu sammeln und mögliche Lösungen zu besprechen. Bitte teilen Sie geeignete Zeiten für den Anruf <tel_num>. Alternativ können Sie mich jederzeit kontaktieren und Ihre Verfügbarkeit teilen.",Problem,Product Support,high,de,400,Bug,Performance,IT,Tech Support,,,,
