subject,body,answer,type,queue,priority,language,version,tag_1,tag_2,tag_3,tag_4,tag_5,tag_6,tag_7,tag_8
Bericht über Probleme bei Systemaktualisierungen im Finanzunternehmen,"Das Finanzunternehmen hat mehrere Produktausfälle erlebt, was die Investitionsanalysen beeinträchtigt hat. Mögliche Ursache sind Konflikte bei Systemupdates. Es wurden Neustart- und Diagnoseschritte unternommen. Das technische Team des Unternehmens arbeitet an der Behebung des Problems, jedoch besteht das Problem weiterhin. Die Ausfälle haben zu erheblichen Verlusten bei Kunden und im Unternehmen geführt, weshalb eine schnelle Lösung notwendig ist, um weitere Verluste zu vermeiden. Das technische Team versucht, die Ursachen des Problems zu identifizieren, doch gestaltet sich dies aufgrund der Systemkomplexität als herausfordernd. Das Unternehmen erwägt,",Wir haben eine E-Mail bezüglich der Systemaktualisierungsprobleme erhalten und möchten diese besprechen. Bitte teilen Sie uns einen passenden Termin mit. Ich kann unter <tel_num> anrufen. Können Sie die nächsten Schritte zur schnellen Lösung des Problems unter <acc_num> unterstützen?,Incident,Service Outages and Maintenance,high,de,52,Performance,Outage,Disruption,Recovery,IT,Tech Support,,
Request for Data Analytics Assistance,"Dear Customer Support, I am reaching out to request comprehensive guidance on integrating data analytics tools to enhance investment strategies. Could you please provide detailed, step-by-step instructions on how to effectively use these tools? Additionally, I would appreciate any supplementary resources or documentation that can assist with the process. I am particularly interested in learning how to leverage data visualization and predictive modeling features to identify trends and opportunities. Thank you for your time and support. I look forward to your prompt response.","<name>, thank you for contacting the service desk regarding your data analytics support request. We appreciate your interest in utilizing our tools to optimize investment strategies. To assist you, we recommend reviewing the user manual and tutorial videos available on our website, which provide detailed, step-by-step instructions for using data visualization and predictive modeling features effectively. If you require personalized assistance, please let us know a convenient time for a call to guide you through the integration process.",Request,Technical Support,medium,en,52,Feature,Documentation,Support,Data Analytics,,,,
Failure in Data Synchronization,"Dear Customer Support, I am preparing a report on a critical issue affecting our financial firm's analytics platforms. We are experiencing data synchronization problems across several systems, which we believe may be caused by software conflicts. Our team has attempted to resolve the issue by restarting the affected systems and updating the software versions, but unfortunately, these attempts have been unsuccessful. The failures have led to incomplete and inaccurate data, obstructing our ability to make well-informed business decisions. We kindly request your assistance in investigating this matter.","<name>, thank you for reporting the data synchronization failure affecting the financial firm's analytics platforms. We're sorry to hear that restarting and updating the software did not resolve the issue. To assist with the investigation, could you please provide details about the affected systems and any specific error messages encountered? Additionally, it would be helpful to know the current software versions in use. We are happy to discuss this further via call at <tel_num>. Please let us know a convenient time for a call. Our technical team is ready to assist.",Incident,Customer Service,high,en,52,Bug,Performance,Disruption,Recovery,IT,Tech Support,,
Datenproblematik,Die Investitionsmodelle des Unternehmens liefern unpräzise Analyseergebnisse.,Bitte prüfen Sie das Datenproblem bei den Investitionsmodellen. Können Sie weitere Details zu den ungenauen Analyseergebnissen bereitstellen? Gerne können wir dies auch telefonisch besprechen. Wäre heute ein Anruf unter <tel_num> möglich?,Problem,Technical Support,high,de,52,Data,Analysis,Investment,Business,Issue,,,
,"Sehr geehrter Kundendienst, ich möchte mich erkundigen, ob es möglich ist, ein skalierbares SaaS-Projektmanagement-Tool in WordPress und BigCommerce zu integrieren. Könnten Sie bitte detaillierte Dokumentationen zum Prozess bereitstellen? Ich möchte die erforderlichen Schritte sowie potenzielle Herausforderungen verstehen. Besonders interessieren mich die APIs, Plugins, die für die Integration notwendig sind, sowie mögliche Anpassungsoptionen. Meiner Ansicht nach würde eine Integration in diese beliebten E-Commerce-Plattformen die Projektmanagement-Fähigkeiten erheblich verbessern. Vielen Dank im Voraus für Ihre Zeit und Unterstützung. Ich freue mich auf Ihre Rückmeldung. Mit freundlichen Grüßen,",Bitte senden Sie eine kurze Integrationsdokumentation mit den Details zu.,Request,Product Support,medium,de,52,Product,Documentation,Feature,API,Integration,Scalability,,
Assistance with Cisco Webex Support,Can you offer detailed integration options between Cisco Webex Meetings and KNIME data analytics platforms?,"I can provide information on integrating Cisco Webex Meetings with KNIME data analytics platforms. To offer detailed options, I need to understand your specific requirements and setup. Please share the details of your environment and objectives, and I will be happy to assist you further.",Request,Customer Service,high,en,52,Support,IT,Tech Support,Product,Integration,,,
Alert on Potential Security Breach,A customer has reported a possible security breach impacting medical data in the hospital's systems. There may have been an intrusion attempt via malware. Efforts to restart systems and run antivirus scans have been unsuccessful; the issue continues and requires urgent attention. We need immediate assistance to resolve this matter.,"Take this potential security breach seriously and we will assist in resolving it as soon as possible. To better understand the situation and provide immediate assistance, we need information about the incident, including the date and time it was first detected, and any error messages received. Please let us know a suitable time for a call at your earliest convenience so we can discuss the issue in detail and determine the appropriate course of action. You can contact us at <tel_num>. ",Problem,Technical Support,medium,en,52,Security,Virus,Outage,Disruption,Alert,IT,Tech Support,
Marketing Strategy Fails to Boost Brand Growth,"The digital strategies implemented by the marketing agency did not effectively enhance the expected brand growth. There might be a misalignment with the target audience. No corrective actions have been taken yet. The agency's approach does not resonate well with the intended audience, leading to stagnant growth. It is essential to reassess and adjust the strategy to better align with the target audience's needs and preferences in order to achieve the desired outcomes and improve brand visibility.",We recommend reviewing the marketing strategy and scheduling a call to discuss potential adjustments that better align with the target audience. We are available for a call at your earliest convenience to discuss this further.,Problem,Product Support,medium,en,52,Marketing,Strategy,Brand Growth,Digital Marketing,Target Audience,Misalignment,Corrective Action,Visibility
SaaS Platform Performance Problem,"Customer Support reports a significant decline in performance of the SaaS platform under heavy load conditions. The initial assessment indicates that the problem might be linked to caching conflicts involving Redis 6.2. Attempts to resolve the issue by clearing caches and restarting servers have not resulted in improvements. The platform's response times have markedly increased, adversely affecting user experience. We are concerned that the root cause could be related to caching strategies or server configurations. Would","We received your email concerning the SaaS platform issue. To assist you more effectively, please provide details about your server configuration and caching strategies. Kindly share information about your Redis setup and any recent modifications. We can also arrange a call at <tel_num> to discuss and troubleshoot the problem further.",Problem,Product Support,high,en,52,Performance,Outage,Disruption,Recovery,Maintenance,,,
Intermittent Medical Records Access Problems Detected,"Dear Customer Support, I am submitting a report regarding difficulties in accessing protected medical data. Our healthcare organization has observed sporadic access disruptions, possibly linked to a recent system update. We have attempted restarting servers and verifying network connections, but the issue remains unresolved. This problem is causing daily operational delays and raises concerns about its possible effect on patient care. We would be grateful if you could investigate this matter urgently and provide a prompt solution. Thank you.","<name>, I am writing to acknowledge receipt of your email concerning the intermittent access problems with medical records. We understand the urgency of this issue and its potential impact on patient care. Our team will investigate the matter and work towards delivering a solution as soon as possible. To assist you more effectively, please share any error messages you have encountered and detail the specific steps you have already taken. Additionally, we would like to arrange a call to discuss the issue in detail and explore potential troubleshooting options.",Problem,Customer Service,low,en,52,Network,Disruption,Outage,IT,Tech Support,,,
Anfrage zur Unterstützung des SaaS-Projekts,"Sehr geehrte Kundensupport, ich melde einen Ausfall der SaaS-Projektmanagement-Plattform. Mehrere Produkte wurden betroffen. Mögliche Ursachen könnten Serverüberschuss, die neueste Aktualisierung oder Netzwerkfehler sein. Das Team versucht, das Problem durch Neustart der Server, Rollback der letzten Aktualisierung und Überprüfung der Netzwerkverbindungen zu beheben. Allerdings hält sich das Problem beständig. Ich freue mich auf eine dringende Lösung und bitte um konkrete Maßnahmen zur Beseitigung des Problems. Zudem bitte ich um eine Rückmeldung über den Fortschritt der Ermittlungen. Vielen Dank.","Um den Ausfall der SaaS-Plattform zu untersuchen, steht Ihnen der Kontakt zu uns über <tel_num> zur Verfügung, um zusätzliche Informationen zu erliefern.",Incident,Service Outages and Maintenance,high,de,52,Outage,Disruption,Network,Server,Maintenance,Recovery,,
Zugriffsproblem bei Gesundheitsdaten,"Der Gesundheitsdienstleister hat unautorisierte Zugriffsversuche auf medizinische Daten festgestellt. Nach Aktualisierung der Redis- und PostgreSQL-Versionen sowie Verschärfung der Firewall-Regeln bestehen weiterhin verdächtige Aktivitäten. Für eine weiterführende Untersuchung wird Unterstützung benötigt, um die Sicherheit der sensiblen Patientendaten zu gewährleisten und möglichen Datenverlust zu verhindern.","Antworten Sie per E-Mail bezüglich des Zugriffsproblems bei den Gesundheitsdaten. Wir nehmen die Sicherheit der sensiblen Patientendaten sehr ernst. Bitte stellen Sie weitere Details zu den verdächtigen Aktivitäten bereit, einschließlich Datum und Uhrzeit der unbefugten Zugriffsversuche. Wir möchten einen passenden Zeitpunkt für einen Anruf vereinbaren, beispielsweise unter <tel_num>, um die möglichen nächsten Schritte zu besprechen und die Sicherheit der medizinischen Daten sowie die Vermeidung potenzieller Datenverluste im Zusammenhang mit Konto <acc_num> zu gewährleisten.",Problem,Technical Support,low,de,52,Security,Access,Data Privacy,Investigation,Firewall,Sensitive Data,,
Potential Security Breach in Hospital System,"A potential security breach has been detected in the hospital system, possibly due to compromised access controls. Fortunately, only certain products are affected. An early investigation is currently underway to determine the cause and extent of the breach. The hospital's team is working diligently to resolve the issue and prevent further breaches. The investigation is still in its early stages, and the information provided is preliminary.",We acknowledge the notification regarding the potential security breach in the hospital system. We appreciate the prompt investigation being conducted by the hospital's team. Please schedule a follow-up call to discuss the incident and necessary next steps. I will be available to call at <tel_num> to provide an update on the investigation and any additional information that has been gathered so far.,Incident,Technical Support,high,en,52,Security,IT,Disruption,Investigation,Alert,,,
Assistance Required for Digital Strategy Assistance,"Problems with Airtable, IBM Cloud, and Google Keep are interfering with our digital strategy processes. The issues may be due to recent updates or integration complications. Attempts to fix the problems have been made but were unsuccessful. We require help to troubleshoot and restore our workflows to normal.","Support needed for digital strategy. Please share details about the issues with Airtable, IBM Cloud, and Google Keep. We would like to arrange a call at your convenience to discuss the problems in detail and work towards a solution. Contact number: <tel_num>.",Problem,IT Support,high,en,52,Feature,IT,Tech Support,,,,,
Customer Support Regarding Data Breach,A healthcare organization has reported a data breach that may have exposed medical records due to misconfigured Kubernetes clusters. An initial attempt was made to mitigate the problem through firewall modifications.,The support team is aware of the issue and is actively working to fully resolve the data breach. Additional security measures are being investigated and implemented to prevent similar incidents in the future.,Incident,Technical Support,high,en,52,Security,Data Breach,IT,Tech Support,,,,
Bericht über Unterbrechungen beim Zugriff auf Gesundheitsdaten am heutigen Tag,"Sehr geehrter Kundendienst, es kommt zu Unterbrechungen beim Zugriff auf Daten, die die Krankenhaus-IT-Systeme betreffen. Erste Untersuchungen deuten auf mögliche Fehlkonfigurationen in den Netzwerksicherheitseinstellungen hin. Die betroffenen Dienste wurden neu gestartet und die Firewall-Regeln aktualisiert, doch das Problem besteht weiterhin. Die Auswirkungen auf die Patientenversorgung sind besorgniserregend, und wir benötigen umgehend Unterstützung bei der Fehlerbehebung, um eine Lösung zu finden. Bitte informieren Sie uns über die nächsten Schritte. Wir schätzen eine schnelle Bearbeitung unseres Anliegens und freuen uns auf eine Rückmeldung. Das Problem verursacht erhebliche Störungen im Ablauf, daher ist eine zügige Lösung erforderlich.","Es tut uns leid zu hören, dass die Krankenhaus-IT-Systeme Unterbrechungen beim Datenzugriff erfahren. Wir möchten bei der schnellen Behebung des Problems helfen. Könnten Sie bitte weitere Details wie Fehlermeldungen, erhaltene Informationen sowie die bisher ergriffenen Maßnahmen bereitstellen? Wir müssten einen Anruf vereinbaren, um das Problem zu beheben. Wäre ein frühestmöglicher Termin für Sie möglich? Bitte teilen Sie uns eine passende Zeit mit.",Problem,IT Support,medium,de,52,Network,Disruption,Security,IT,Tech Support,,,
Security Protocols for Microsoft SQL Server 2019 in Hospital Data Management,"Could you please furnish a detailed security guide for Microsoft SQL Server 2019, specifically for hospital data management? This should include information on data encryption, access controls, and backup procedures. It is crucial to ensure the security and integrity of patient data. Please provide a comprehensive guide on implementing these protocols.","I will provide a detailed security guide for Microsoft SQL Server 2019, including encryption, access controls, and backup procedures, to ensure the security and integrity of patient data. I will send this guide shortly.",Request,Billing and Payments,high,en,52,Security,Backup,Data,Encryption,Access Control,Protocol,IT,
Connectivity Problems Impacting Data Analytics Processes,"The firm faced connectivity disruptions that interfered with data analytics operations. The issue may stem from a misconfiguration in the firewall Redis settings. Efforts to resolve this included restarting services and updating software, but the problem persists. Kindly help identify the underlying cause and suggest a solution to restore data analytics capabilities.","We are reviewing your email concerning the connectivity problems affecting data analytics workflows. To assist you effectively, please share the specific error messages you are encountering. Additionally, could you provide a suitable time for a call at <tel_num> to discuss and pinpoint the root cause, enabling us to offer an appropriate solution to restore functionality?",Problem,Technical Support,high,en,52,Network,Disruption,Connectivity,Performance,Outage,Security,,
Healthcare System Disruptions,"Customer Support reports experiencing issues that are impacting multiple devices within the healthcare software system. The problem might stem from network configuration errors. Initial troubleshooting steps included restarting switches and checking device connections. Nevertheless, the issue persists, and we need further assistance to resolve it. We would appreciate any guidance on the next steps to take. Please inform us if additional information is required to aid in troubleshooting.","<name>, thank you for contacting us regarding the disruptions in the healthcare system. We understand the urgency of resolving this issue. To assist you better, please provide details about your network configuration and confirm device connections. We might need to arrange a call to discuss the issue in more detail. If a call is convenient, kindly let us know a suitable time at <tel_num>.",Incident,Technical Support,low,en,52,Disruption,Network,IT,Tech Support,,,,
Skepsis bezüglich der Resultate der jüngsten Digital-Marketingkampagne,"Die Digital-Agentur hat die Markenbekanntheit durch die Kampagne gesteigert; jedoch bestehen Bedenken hinsichtlich möglicher Fehler bei der Zielgruppensegmentierung und Kommunikationsproblemen. Es werden Strategien zur Anpassung und Neugestaltung der Kampagne geprüft. Wir schätzen, dass wir eine Lösung finden und eine Erklärung für die Thematik bereitstellen können.",Wir werden die digitalen Kampagnen zeitnah analysieren und uns bezüglich möglicher Lösungen und Erklärungen für die Probleme bei der Markenbekanntheit in Verbindung setzen.,Incident,Technical Support,medium,de,52,Performance,Disruption,Feedback,Marketing,Strategy,Communication,,
Secure Patient Information,Could you furnish the necessary documentation that secures patient information?,"I can provide the required documentation securing patient information. Please allow me to send the security protocols and guidelines. If you have any specific questions, feel free to address them afterwards.",Request,IT Support,medium,en,52,Security,Documentation,Patient Information,,,,,
,"Customer Support, I am reaching out to inquire about scalable SaaS project management solutions. Could you provide detailed information on integration options and pricing? I am particularly interested in learning about customization features that can meet our organization's specific requirements. Additionally, I would appreciate details on available trials and demos that would allow us to evaluate the software before making a purchase. Please include relevant case studies and testimonials from existing clients. I look forward to your response as we explore potential options.","<name>, thank you for your interest in our scalable SaaS project management platform. We offer a variety of integration options and customization features to suit your organization's unique needs. Our pricing plans depend on the number of users and the features required. We also provide free trials and demos so you can evaluate the software before committing to a purchase. Additionally, we can share relevant case studies and testimonials from our current clients. To discuss the best solution for your organization, please let us know a convenient time for you.",Request,Sales and Pre-Sales,medium,en,52,Feature,Customer Support,SaaS,Customization,Integration,Pricing,,
Unterstützung bei Datensicherheit,"Sehr geehrter Kundenservice, ich möchte mich erkundigen, ob Malwarebytes 4.4 in die Google Cloud Platform integriert werden kann, um die Datensicherheit zu erhöhen. Könnten Sie mir eine Anleitung zum Ablauf geben? Ich möchte die einzelnen Schritte kennen, die dabei erforderlich sind, sowie potenzielle Herausforderungen, die auftreten könnten. Zusätzlich freue ich mich über Empfehlungen bewährter Verfahren, um eine reibungslose Integration sicherzustellen. Mein Ziel ist es, die Sicherheit meiner Daten durch eine vorteilhafte Integration zu verbessern. Bitte informieren Sie mich, ob entsprechende Ressourcen oder Dokumentationen für den Vorgang vorhanden sind.","<name>, vielen Dank, dass Sie den Service-Desk kontaktiert haben. Wir helfen Ihnen bei der Integration von Malwarebytes in die Google Cloud Platform. Wir senden Ihnen die notwendigen Dokumentationen und Schritte zu. Erlauben Sie mir, <tel_num> anzurufen, um weitere Details zu besprechen und eine auf Ihr <acc_num>-Konto zugeschnittene Lösung anzubieten.",Request,Technical Support,high,de,52,Security,IT,Support,Guidance,,,,
,"Customer Support, I am reaching out to inquire about the digital marketing strategies your agency employs to effectively drive brand growth. Could you please provide detailed information on the methods and techniques used? It would be helpful if you could include specific examples of successful campaigns you've executed in the past and the results achieved. I am interested in understanding the approach your team applies in business. Additionally, I would like to know about your team's experience and expertise in digital marketing.","<name>, thank you for your email and for your interest in our digital marketing services. We utilize a range of strategies including social media management, SEO, and targeted advertising to drive brand growth. Our team has extensive experience and relevant certifications in digital marketing. We have run successful campaigns for various clients, resulting in significant increases in brand awareness and sales. We would be happy to discuss this further with you. Please let us know a convenient time for a call at <tel_num> to explore our services.",Request,Customer Service,low,en,52,Feedback,Sales,Lead,,,,,
Verbindung von ClickUp mit IBM Cloud-Services,"Sehr geehrter Kundenservice, ich möchte mich erkundigen, ob es möglich ist, die verbesserte Skalierbarkeit des Projektmanagements durch die Integration von ClickUp mit IBM Cloud zu realisieren. Könnten Sie mir hierzu eine Anleitung bereitstellen? Ich interessiere mich für die Vorteile sowie potenzielle Herausforderungen. Außerdem freue ich mich über Empfehlungen zur Umsetzung der Integration, da ich meine Projektmanagementfähigkeiten verbessern möchte und denke, dass die Integration hierbei einen Vorteil bieten könnte. Bitte informieren Sie mich über die notwendigen Schritte, die ich unternehmen sollte. Vielen Dank für Ihre Zeit und Unterstützung. Ich freue mich auf Ihre baldige Rückmeldung.","<name>, wir danken für Ihr Interesse an der Integration von ClickUp mit IBM Cloud-Services. Eine solche Verbindung kann die Fähigkeiten im Projektmanagement verbessern. Gerne besprechen wir die Vorteile und möglichen Herausforderungen. Vereinbaren Sie dazu einen Anruf unter <tel_num> zu einem für Sie passenden Zeitpunkt. Bitte teilen Sie uns eine geeignete Zeit mit. Wir werden Sie auch über die empfohlenen Schritte zur reibungslosen Umsetzung informieren. Wir freuen uns darauf, Sie bei der Integration zu unterstützen und die Skalierbarkeit Ihres Projektmanagements zu erhöhen.",Request,Product Support,medium,de,52,Performance,Integration,Documentation,Feedback,,,,
Data synchronization problems encountered by financial institution,"Customer Support, preparing a report on a critical problem impacting investment analytics. A financial institution has encountered data synchronization failures across several products, which has severely hindered the ability to deliver precise investment insights. Despite efforts to reboot systems and verify data sources, the issue remains unresolved. We suspect that integration conflicts might be the underlying cause. Your assistance in resolving this matter promptly would be highly valued.",Please review the issue by contacting <tel_num> to discuss and decide on the next steps to resolve the data synchronization problem.,Incident,Sales and Pre-Sales,medium,en,52,Performance,Disruption,Recovery,Security,,,,
