subject,body,answer,type,queue,priority,language,version,tag_1,tag_2,tag_3,tag_4,tag_5,tag_6,tag_7,tag_8
,I would like to explore digital strategies for brand growth. Could you provide more details and share some relevant case studies? I am keen to understand the strategies that have contributed to the success of brand growth in the past.,"Thank you for your interest in digital strategies for brand growth. Our approach involves creating engaging content and leveraging social media platforms to reach target audiences. We have seen significant successes with previous clients, resulting in increased brand awareness and customer engagement. I would be happy to share relevant case studies with you. For further discussion, I would be available for a call or you can directly email me at <email>.",Request,Technical Support,medium,en,400,Feedback,Sales,Feature,,,,,
Technische Störung bei mehreren SaaS-Anwendungen,"Wir haben unerwartete Laufzeitstörungen bei mehreren SaaS-Anwendungen bemerkt, die möglicherweise auf Serverbelastung und Datenbankprobleme zurückzuführen sind.","Sehr geehrte/r [Name],\n\nleider habe ich technische Probleme bei mehreren SaaS-Anwendungen festgestellt. Diese Störungen könnten auf Serverbelastung und Datenbankprobleme zurückzuführen sein. Ich würde mich freuen, die Lösung dieses Problems so schnell wie möglich zu finden. Könnten Sie bitte mehr Informationen zur Fehlermeldung und den betroffenen Anwendungen sowie den Zeitpunkt der Störung und eventuelle Änderungen im System bereitstellen? Das würde mir sehr helfen. Wenn Sie möchten, können wir telefonisch vereinbaren, wann wir uns unter [Telefonnummer] treffen. Vielen Dank im Voraus und ich wünsche Ihnen einen schönen Tag.",Incident,Product Support,high,de,400,Bug,Performance,Outage,Disruption,IT,Tech Support,,
Problem with Monthly Subscription Double Charging,"My monthly subscription was charged twice during the billing cycle. This may have occurred due to a system glitch causing overlapping transactions. I have already checked my payment methods and tried re-subscribing, but the issue still persists. I would greatly appreciate it if you could look into this matter and provide a refund for the extra charge as soon as possible. Please let me know if you need any additional information to resolve this issue.","<name>, I'm sorry to hear that you were charged twice for your monthly subscription. We will investigate this matter and work on refunding the extra charge as soon as possible. To assist with the resolution, could you please provide your account number and the dates of the double charges? If you need to discuss this further, you can contact us at <tel_num>. Please allow 24-48 hours for us to look into the issue, and we will update you regarding the refund and any additional steps required to prevent this issue in the future.",Problem,Billing and Payments,high,en,400,Billing,Refund,Payment,Disruption,Account,,,
Kritisches Problem bei unserer Datenanalyse-Software,"Ein kritisches Problem bei unserer Datenanalyse-Software ist aufgetreten, das die genaue Investment-Optimierung behindert. Dies wurde durch recente Updates auf Magento 2.4 verursacht. Reboot-Vorgänge und Patches wurden bereits durchgeführt.","Es tut uns leid, dass Sie Probleme mit der Datenanalyse-Software haben. Könnten Sie bitte mehr Details und mögliche Fehlermeldungen geben? Wir planen ein Telefonat, um Ihnen zu helfen. Sie können uns anrufen unter <tel_num>.",Incident,IT Support,medium,de,400,Bug,Performance,IT,Tech Support,,,,
Notifying about suspected security violation event observed lately,Unapproved entry into medical records found,"Consider security breaches critically, supply specifics regarding unauthorized access to medical records, proceed with an investigation and contact <tel_num> for further discussion.",Incident,Product Support,low,en,400,Security,Notification,Alert,,,,,
Modify digital marketing tactics,Seek to enhance marketing strategies to boost brand growth on chosen product platforms and increase customer interaction.,"Acknowledged your request to update digital marketing strategies for enhanced brand growth and customer engagement. We will proceed by scheduling a call to discuss the selected product platforms in detail. Kindly provide a suitable time for the call at <tel_num> or send a list of questions to gather necessary information for our next steps. Alternatively, use <acc_num> to proceed.",Change,Customer Service,low,en,400,Feedback,Sales,Product,Feature,,,,
Details on Integration,"Is it possible to get comprehensive details on integrating Google Keep into a scalable project management SaaS solution? I am keen to understand the technical requirements as well as any potential limitations. Thank you for your assistance, and I look forward to hearing back soon.",We will provide detailed specifications for integrating Google Keep into your SaaS solution. Please allow us some time to review your request and discuss the technical requirements and potential limitations. We can also arrange a call at your convenience to further discuss these matters.,Request,IT Support,high,en,400,Feature,Feedback,IT,Tech Support,,,,
Software Support Query,"I am encountering unexpected crashes in my project management software on my Ubuntu system. The crashes might be due to compatibility issues or conflicts with applications like Notion and HubSpot CRM. Despite attempting to restart, reinstall, and update my drivers, the issue persists. I would appreciate your help in resolving this matter. Please let me know what additional steps are needed and the information you require from me.","To better assist with your software issue on Ubuntu, please provide details about the crashes, including any error messages you are receiving. Also, could you let me know the version of your project management software? This may be necessary for further discussion. Please call <tel_num> if you need to discuss this further. Is this okay with you?",Problem,Technical Support,medium,en,400,Bug,Crash,Performance,IT,Tech Support,,,
Informationen über die Integration von Telegram,Ich möchte mehr Details über die Integration von Telegram in unser Projektmanagement-Software-As-a-Service-Angebot erhalten. Welche Schritte und Anforderungen sind notwendig für die Integration?,"Wir unterstützen die Integration von Telegram. Bitte besuchen Sie unsere Website, um die detaillierte Dokumentation der Schritte und Anforderungen zu lesen. Für Rückfragen können Sie einen Anrufwunsch hinterlassen, um eine Rückrufanfrage zu erhalten und eine Diskussion zu führen.",Request,Customer Service,medium,de,400,Feature,Documentation,IT,Tech Support,,,,
Optimization of Data Analytics in Financial Firms,"Customer Support, seeking detailed information on data analytics solutions that can enhance investment optimization for financial firms. Specifically, interested in the tools and techniques you provide that can assist financial firms in making data-driven decisions and improving their investment strategies. Additionally, would greatly appreciate any case studies or examples of successful implementations of these solutions. Thank you for your assistance, and look forward to hearing back soon.","<name>, we offer a range of data analytics tools designed to enhance investment optimization for financial firms, enabling them to make data-driven decisions and improve their investment strategies. We can provide case studies and examples of successful implementations. Please contact <tel_num> to discuss further; we are available to assist at your convenience in exploring these solutions in more detail.",Request,Sales and Pre-Sales,low,en,400,Feedback,Product,Feature,Tech Support,,,,
Securing Medical Data in a Hospital Environment with Microsoft Dynamics 365,"Customer Support, can provide details on how to secure medical data using Microsoft Dynamics 365 in a hospital setting? Given the sensitive nature of patient information, it's crucial to ensure data is protected from unauthorized access. Would appreciate any information on the security features implemented by Microsoft Dynamics 365, particularly regarding data encryption, access controls, and auditing capabilities.","Dear Customer Support, \n\nThank you for your inquiry regarding securing medical data using Microsoft Dynamics 365 in a hospital environment. Microsoft Dynamics 365 includes several robust security features such as data encryption, access controls, and auditing capabilities. Data encryption ensures that sensitive patient information remains protected during transit and at rest. Access controls enable role-based permissions, ensuring that only authorized personnel have access. Auditing capabilities provide the necessary visibility into the system to monitor and manage security effectively.\n\nBest regards,",Request,Customer Service,low,en,400,Security,Product,Feature,IT,,,,
Solutions for Securing Medical Data in Hospital IT Environments,Seeking reliable and efficient methods to protect sensitive patient data from unauthorized access in hospital IT environments. Appreciate the time and support provided on this matter. Looking forward to hearing back soon.,"Dear <name>, thank you for your interest in solutions for securing medical data in hospital IT environments. Our team offers comprehensive and reliable solutions to protect sensitive patient data from unauthorized access. We are pleased to discuss our services in detail and provide customized solutions that meet your needs. Could you please provide an appropriate time window for a call to continue our discussion? Looking forward to supporting your medical data security needs soon.",Request,Customer Service,medium,de,400,Security,Performance,IT,Tech Support,Feedback,,,
Probleme mit der Leistung der SaaS-Anwendung,"Sehr geehrte Kundenservice, ich habe Leistungsprobleme bei der Projektmanagement-Aufgaben der SaaS-Anwendung festgestellt. Diese Probleme könnten auf neue Software-Updates oder Systemressourcenbeschränkungen hindeuten. Obwohl ich versucht habe, die Einstellungen zu optimieren und das Hardware neu zu starten, bestehen die Probleme weiterhin. Ich schätze Ihre Unterstützung bei der Fehlerbehebung und würde es schätzen, wenn Sie mir weitere Informationen zur Verfügung stellen. Vielen Dank für Ihre Unterstützung. Ich freue mich darauf, bald von Ihnen zu hören.","Sehr geehrte [name], vielen Dank für Ihre Meldung. Wir kümmern uns um die Leistungsprobleme der SaaS-Anwendung. Bitte geben Sie einen günstigen Zeitpunkt an, um telefonisch weitere Schritte und mögliche Lösungen zu besprechen.",Problem,Technical Support,low,de,400,Performance,Bug,Hardware,Tech Support,,,,
Detected Inconsistencies in Analytics Data Today,"Customer Support,<br><br>We are encountering problems with the investment optimization tool, resulting in inconsistent analytics results. The issue might be related to integration problems with external data sources. Despite retrying data resynchronization and adjusting parameter settings, we have been unable to resolve the problem.<br><br>The inconsistent results are making it difficult to make informed investment decisions, and we require assistance in resolving this matter as soon as possible. We would appreciate any guidance on troubleshooting the integration.","Dear [Name],<br><br>We appreciate you reaching out to us regarding the issue with inconsistent analytics results in the investment optimization tool. We are sorry to hear that you are experiencing difficulties making informed investment decisions due to this problem. We understand the urgency of the matter and are committed to assisting you in resolving it as soon as possible.<br><br>To better understand the issue, could you please provide us with more details about the integration with external data sources and the parameter settings you have adjusted so far? Additionally, this information would be very helpful.",Problem,Customer Service,low,en,400,Bug,Performance,IT,Tech Support,Feedback,,,
Netgear Nighthawk Mesh Wi-Fi 6 System Details,Could you provide more information on digital strategies?,"General information on digital strategies can be provided, but I need more context for a specific response. The email mentioned a Netgear Nighthawk Mesh Wi-Fi 6 System. Are you asking about digital strategies related to the product? Please provide more details so I can better assist you. If you prefer, I can call at a convenient time to discuss further.",Request,Customer Service,high,de,400,Product,Feature,Documentation,IT,Tech Support,,,
Hilfe bei Investitionen,Können Sie Einblicke in die Optimierung von Investitionen durch die Nutzung von Datenanalyse-Tools geben?,"Wir können Informationen zur Nutzung von Datenanalyse-Tools zur Optimierung von Investitionen bereitstellen. Bitte geben Sie mehr Details zu Ihren aktuellen Investitionen und Zielen an, um personalisierte Ratschläge und Leitlinien anbieten zu können.",Request,Customer Service,medium,de,400,Feedback,Product,Feature,Documentation,,,,
Urgent: Possible Data Breach in Medication Log System Identified,"A potential data breach was identified, possibly due to outdated security protocols. Access logs were reviewed and passwords updated.",Received notification of a possible data breach in the medication log system. Immediate verification and system backup will be initiated. Further updates will be provided as necessary.,Incident,Technical Support,medium,de,400,Security,IT,Alert,Tech Support,,,,
Resolution for Integration Challenges,"We are here to assist you with the integration issues you are facing with your marketing agency's digital tools during campaign execution. There might be disruptions due to API limitations or configuration issues. So far, troubleshooting efforts with Notion, Zapier, and Slack integrations have not been successful. We would appreciate your guidance in resolving these issues to ensure a seamless campaign execution.","<name>, we are glad you reached out to our support team regarding the integration issues with your digital tools during campaign execution. We apologize for any disruptions you have experienced. To better assist you, could you please provide more details on the API limitations or configuration issues you suspect are causing the problem? Additionally, it would be helpful to know any specific error messages you are encountering with Notion, Zapier, and Slack. Once you are available, we can schedule a call to discuss this further. Please let us know.",Incident,Technical Support,low,en,400,Integration,Disruption,Performance,Feedback,IT,Tech Support,,
Unterstützung für autorisierten Zugriff auf medizinische Daten,"Es wurde ein autorisierter Zugriff auf medizinische Daten festgestellt, was möglicherweise auf falsch konfigurierte Firewall-Einstellungen zurückzuführen ist. Ursprünglich wurden Systemprotokolle und Firewall-Einstellungen geprüft. Der Problemfall erfordert jedoch zusätzliche Hilfe. Bitte geben Sie Anweisungen zur weiteren Untersuchung und Lösung des Problems.","Bitte überprüfen Sie den Fall hinsichtlich autorisierter Zugriffe auf medizinische Daten. Um mir besser behilflich zu sein, benötige ich mehr Details aus den Systemprotokollen und den aktuellen Firewall-Einstellungen. Bitte bereiten Sie die Protokolle der letzten 24 Stunden und die aktuellen Firewall-Einstellungen vor, um eine umfassende Untersuchung und Lösung durchzuführen.",Incident,Customer Service,medium,de,400,Security,IT,Tech Support,Performance,,,,
Concerning Medical Data Security Issues,Unauthorized access attempts to the medical data server have been detected. Security configuration errors may be the cause. We have improved the firewall settings and updated the antivirus software.,"Please confirm receipt of this email. We have reported the security issue related to medical data, specifically the unauthorized access attempts to the medical data server. Steps have been taken to improve firewall settings and update the antivirus software. We would like to discuss the best approach to determine the cause of the security configuration errors, which may have led to this issue, and provide further details on the unauthorized access attempts to better assist us. Could you please provide information on the suspected security configuration errors and any additional details regarding the unauthorized access attempts?",Incident,Technical Support,high,de,400,Security,Virus,IT,Tech Support,,,,
Ratung für Sicherung medizinischer Daten in HubSpot CRM PostgreSQL-Umgebungen,"Ratung, ob es möglich ist, Sicherung medizinischer Daten in HubSpot CRM PostgreSQL-Umgebungen durchzuführen? Danke.","Wir freuen uns, Ihnen zu raten, Sicherung medizinischer Daten in HubSpot CRM PostgreSQL-Umgebungen durchzuführen. Um mit den Vorschriften von HIPAA in Einklang zu bleiben, ist es wichtig, umfassende Sicherheitsmaßnahmen einzuführen, einschließlich Verschlüsselung, Zugriffskontrolle und regelmäßiger Backups. Wir bieten spezifische Empfehlungen zu Praktiken an, sobald wir mehr Details über das aktuelle Setup und Bedenken erhalten. Sollten Sie verfügbar sein, um weiterzudenken, lassen Sie uns wissen, wann ein geeigneter Zeitpunkt für Sie ist.",Request,Technical Support,medium,de,400,Backup,Security,IT,Tech Support,,,,
Support for Medical Data Locking Issue,"There might be a locking of medical data due to outdated software. Despite recent updates and enhanced security measures, the issue persists. Immediate support is required to secure sensitive information.",Address the medical data locking issue related to outdated software. Need more details to assist; please provide specifics on the updates and security measures implemented so far. Call us at <tel_num> for further discussion.,Incident,Technical Support,high,de,400,Bug,Security,Performance,IT,Tech Support,,,
Problem mit CRM-Software-Update,"Neues Software-Update verursacht Störungen in den CRM-Tools für Projektmanagement. Versuche, das Problem zu beheben, indem ich das Gerät neu gestartet und die Software-Integrationen erneut authentifiziert habe, aber das Problem behält sich hartnäckig bei. Ich benötige Hilfe, um das Problem schnell zu beheben.","Ich werde das Problem mit der CRM-Software-Update untersuchen. Um Ihnen besser zu helfen, könnten Sie mir bitte die Versionsnummer und eventuelle Fehlernachrichten geben, die Sie erhalten haben. Ich möchte einen Anruf planen, um das Problem zu beheben. Wären Sie freundlich und geben Sie mir die früchtesten verfügbaren Zeitfenster an? Sie können mich unter <tel_num> erreichen, und Ihr Kontonummer lautet <acc_num>.",Incident,Technical Support,medium,de,400,Bug,Performance,IT,Tech Support,,,,
Concern About SaaS Application Performance,"A significant performance issue has emerged, impacting the SaaS application, causing slow response times and timeouts. This may be related to recent updates or integrations with Repeater, Norton Antivirus, and WooCommerce. We have tried restarting the server, optimizing queries, and rolling back recent changes, but the issue remains unresolved. We need your assistance to resolve this issue promptly to minimize downtime and prevent further disruptions.","To address the SaaS application performance issue, we would like to discuss it with you. Please let us know a convenient time to call and gather the necessary information. In the meantime, could you confirm your account number and provide any exact error messages you are seeing? This will help us better understand the issue and work towards a resolution.",Incident,Technical Support,high,en,400,Performance,Disruption,Outage,IT,Tech Support,,,
Support Required for Digital Marketing with Mailchimp,"Could you offer details on integrating Mailchimp's digital marketing strategies? We aim to enhance our email campaigns and automate the workflow. Thank you for your assistance, and we appreciate your support; we look forward to hearing from you soon.",I would be happy to assist with integrating Mailchimp's digital marketing strategies. Please provide details on your current workflow and email campaigns so I can better assist you.,Request,IT Support,high,en,400,Feedback,IT,Tech Support,,,,,
,"Sehr geehrte Kundenservice, ich bitte um Erlaubnis, Anleitungen zur Sicherstellung der medizinischen Datensicherheit in Kubernetes-Umgebungen für Krankenhäuser zu erhalten. Es ist wichtig zu beachten, dass diese Einrichtungen sensible Patientendaten verarbeiten und strengsten Sicherheits-Compliancemaßstäben unterliegen. Es wäre sehr hilfreich, wenn wir die besten Praktiken zur Implementierung von Kubernetes-Umgebungen kennenlernten, um Vertraulichkeit, Integrität und Verfügbarkeit der medizinischen Daten zu gewährleisten. Insbesondere interessieren uns Netzwerkrichtlinien, Zugriffskontrollen und Datenverschlüsselungsmethoden. Könnten Sie mir Dokumentationen zur Verfügung stellen, die die notwendigen Schritte beschreiben?","Sehr geehrte [Name], ich danke Ihnen für Ihre Anfrage bezüglich der Datensicherheit in Kubernetes-Umgebungen für medizinische Anforderungen. Wir empfehlen, sich die besten Praktiken durch Studium von Dokumentationen zu Netzwerkrichtlinien, Zugriffskontrollen und Datenverschlüsselungsmethoden zu versichern. Wir können uns gerne telefonisch verabreden, um diese Themen weiter zu diskutieren. Bitte geben Sie mir geeignetes Zeitfenster an, damit ich Ihnen individuell und gezielt beraten kann, medizinische Anforderungen und Krankenhausaufwand passende Ratschläge zu geben.",Request,Technical Support,high,de,400,Security,IT,Tech Support,Documentation,,,,
Detailed Information on Scalable Project Management Solutions,Can you provide detailed information on scalable SaaS capabilities for project management solutions?,"We offer a range of SaaS solutions for scalable project management, including workflow automation and resource allocation tools. We would be happy to provide detailed information and discuss solutions that meet your specific needs. We are available to discuss further at your convenience.",Request,Technical Support,high,en,400,Feature,Documentation,Sales,,,,,
Support for Investment Guidance,Please contact us for utilization of data analysis tools from AWS to optimize investments. Could we provide insights and recommendations on the best tools for a start strategy? I am pleased to share any advice and available resources.,"We advise on the use of data analysis tools from AWS to optimize investments. For further details, please call to discuss the best tools and investment assistance resources. Could we arrange a meeting to discuss these topics?",Request,Technical Support,high,de,400,Feedback,IT,Tech Support,,,,,
Investment Analysis Variations,"A financial organization is facing unanticipated discrepancies in investment analysis caused by data synchronization problems. Despite attempts at data reconciliation and reinstallation, inconsistencies persist.",Please review the investment analysis variations and data synchronization issues. Kindly provide details on the inconsistencies you are experiencing so we can assist you.,Problem,Technical Support,high,en,400,Bug,Performance,IT,Tech Support,,,,
Unbefugtes Zugriffsbemühen sofort erkannt,"Unbefugtes Zugriffsbemühen wurde in den Krankenhaus-IT-Systemen erkannt. Veraltete Software und ungesicherte Netzwerkkonfigurationen sind dahingehend verantwortlich. Firewalls wurden eingerichtet, um Softwarevulnerabilitäten zu beheben.","Sehr geehrte/r [Name],\n\nich antworte auf die E-Mail-Beschwerde bezüglich unbefugten Zugriffsbemühens in den Krankenhaus-IT-Systemen. Vielen Dank, dass Sie sofort Maßnahmen ergreifen, wie die Einführung von Firewalls und die Behebung von Softwarevulnerabilitäten.\n\nUm die Sicherheitsvorkehrungen unserer Systeme zu überprüfen, bitten wir um zusätzliche Informationen zur Natur des unbefugten Zugriffsbemühens, einschließlich Datum, Uhrzeit und eventuell empfangener Fehlermeldungen. Diese Informationen helfen uns, die genauen Netzwerkkonfigurationen zu aktualisieren.\n\nSollten weitere Maßnahmen erforderlich sein, können Sie sich gerne mit uns in Verbindung setzen, um weitere Besprechungen zu vereinbaren.\n\nMit freundlichen Grüßen,\n[Ihr Name]",Incident,Technical Support,high,de,400,Security,Network,Bug,Performance,IT,,,
Concerns Regarding Declining Engagement in Marketing Campaign,Currently experiencing low engagement rates in the marketing campaign. The issue might be due to inadequate audience targeting or misaligned messaging. Efforts to refine targeting and optimize ad placements have shown minimal improvement. Assistance is needed to identify the root cause and find a solution to boost engagement.,"Would appreciate a more detailed discussion on the marketing campaign issue. Please provide specific details on targeting, messaging, and strategies used, to help better understand the problem.",Incident,Returns and Exchanges,low,en,400,Feedback,Performance,Marketing,Product,Feature,,,
Investment Strategy Guidelines,Can you provide guidelines for optimizing investment strategies and using data analysis tools to make informed decisions?,"We offer general guidelines and the use of data analysis tools for investment strategies. If you would like more information, please schedule a meeting or we can proceed at your convenience.",Request,Product Support,high,de,400,Feedback,Documentation,IT,,,,,
