subject,body,answer,type,queue,priority,language,version,tag_1,tag_2,tag_3,tag_4,tag_5,tag_6,tag_7,tag_8
Could Provide Details on Project Management SaaS Features and Pricing Options?,"I would appreciate it if you could provide detailed information on the features and pricing options of your project management SaaS platform. Specifically, I am interested in learning about the tools and services that are offered, particularly those related to task management, team collaboration, and reporting capabilities. Additionally, I would like to know if there are any discounts or promotions currently available. Thank you for your assistance.","We appreciate your interest in the project management SaaS features and pricing options offered by our platform. Our suite of tools and services provides a comprehensive range of features, including support for task management, team collaboration, and reporting capabilities. The platform offers an agile project planning system, Gantt charts, burndown charts, and real-time reporting and analytics to help you track progress and make informed decisions. Regarding pricing, we offer various options that are tailored to suit your specific needs.",Request,Customer Service,low,en,400,Feature,Sales,Feedback,Product,,,,
Concerns About Recent Products,There have been return issues stemming from customer dissatisfaction with the Codecademy Nuendo products. Our campaigns aimed at enhancing engagement helped to address this problem.,Please review the issues with the Codecademy Nuendo products and contact us at <tel_num> to discuss the steps for resolution. Your account number is <acc_num>.,Problem,Returns and Exchanges,high,en,400,Return,Product,Feedback,Disruption,,,,
Support Inquiry on Data Mismatches,"Our organization has detected inconsistencies in data while examining investment trends via Apache Hadoop. It might be due to irregular data inputs. Despite validating data origins and adjusting analytical models, the problem continues. We require your help to address this issue.",We have received your support inquiry related to data mismatches with Apache Hadoop. We will look into the issue. Please provide details about the discrepancies you are experiencing so we can assist you further.,Problem,Technical Support,low,en,400,Bug,Performance,IT,Tech Support,Documentation,,,
Hilfe bei Projektmanagement,Ich würde gern Anleitungen für das effiziente Projektmanagement mit Monday.com erhalten. Könnten Sie dies für mich tun? Vielen Dank!,"Sehr geehrte [name], wir freuen uns, Anleitungen für das effiziente Projektmanagement mit Monday.com bereitzustellen. Um Ihre Bedürfnisse besser zu verstehen, bitten wir Sie, uns mehr Informationen über Ihre aktuelle Konfiguration und die Herausforderungen zu geben, mit denen Sie sich auseinandersetzen müssen. Basierend auf diesen Informationen können wir personalisierte Ratschläge und Empfehlungen zur Verbesserung anbieten. Falls Sie weitere Gespräche auf diesem Thema wünschen, teilen Sie uns bitte Ihren Wunschtermin mit. Sie können das passende Zeitfenster unter [tel_num] vereinbaren. Wir freuen uns auf Ihr Feedback.",Request,IT Support,medium,de,400,Feedback,Documentation,Training,,,,,
Verletzung der medizinischen Datenschutzregeln,"Der Hospital-IT-System wurde eine Verletzung der medizinischen Datenschutzsicherheit festgestellt. Es scheint, dass ausgetrocknete Software-Schwachstellen dahinterstehen. Vorübergehend zeigten Scanoperationen mit McAfee und Bitdefender unmittelbare Bedrohungen an. Die Konfiguration der Google Nest Wifi Routers wurde geprüft und als sicher eingestuft.","Wir nehmen die gemeldete medizinische Datenschutzverletzung ernst und werden sie ermitteln. Bitte geben Sie weitere Details zur festgestellten Verletzung und ausgetrockneten Software-Schwachstellen. Wir bieten an, einen Anruf zu vereinbaren, um das Thema zu besprechen. Bitte geben Sie ein geeignetes Zeitfenster an, um uns zu kontaktieren: <tel_num>.",Incident,Returns and Exchanges,low,de,400,Security,Bug,Performance,Virus,,,,
System Downtime Impacting Various Products Today,"Encountered system downtime impacting several products. This might have been caused by server overload during peak usage. So far, we've restarted the servers and cleared temporary caches, but to no avail. We are still investigating the issue and will provide an update soon.","We apologize for the inconvenience caused by the system downtime affecting multiple products. We are continuing our investigation to resolve the issue as soon as possible. If you require urgent assistance, please reply with your email contact information so we can arrange a callback at a suitable time.",Incident,Technical Support,high,en,400,Outage,Disruption,Performance,Maintenance,IT,Tech Support,,
Performance Problem with SaaS Application Today,"The project management SaaS has experienced an unexpected performance drop during peak usage times. This could be due to increased traffic and insufficient resource allocation. Steps taken include scaling server resources and optimizing database queries, but the issue still persists. Assistance is needed to resolve this.","We are reviewing the performance issue with the SaaS application. To assist, please provide details of any error messages and server logs. We can schedule a call at <tel_num> to discuss the next steps for resolution.",Incident,IT Support,medium,en,400,Performance,Network,IT,Tech Support,,,,
Data Analytics Tools for Financial Firms,Seeking customer support to inquire about data analytics tools that can enhance investment optimization for financial firms. Would appreciate information on available options and their features. Looking for guidance to help in choosing a suitable tool for our organization. Thank you for your assistance.,"We offer a range of data analytics tools for financial firms. To provide a tailored solution, could you please provide details on your organization's specific needs and requirements? We would be happy to discuss these with you and are available for a call at your convenience to explore the options and features of the tools.",Request,IT Support,medium,en,400,Feature,Documentation,Feedback,Sales,Tech Support,,,
Boost Data Analytics Tools,"Submit request for enhancements to data analytics tools to optimize investment decisions. This will include improving data visualization, predictive modeling, and real-time reporting. To ensure minimal service interruptions, maintenance is crucial. I would appreciate it if you could look into this matter and provide a solution that meets our needs. Please let me know if there are any additional steps I need to take.",Review the request for enhancements to data analytics tools and contact <tel_num> to discuss how we can provide a solution that meets your needs while minimizing service interruptions.,Change,Service Outages and Maintenance,high,en,400,Feature,Performance,Maintenance,Feedback,IT,,,
Smart Home,Könnten Sie mehr Informationen zur Integration von Smart-Gartenbewässerung in Slack und Elasticsearch liefern? Danke!,"Sehr geehrte [name], wir können Ihnen Informationen zur Integration von Smart-Gartenbewässerung in Slack und Elasticsearch liefern. Um Ihnen besser zu helfen, könnten Sie bitte mehr Details zu Ihrem aktuellen Setup bereitstellen? Wir sind bereit, über mögliche Lösungen zu sprechen. Wären Sie darauf einverstanden, einen Anruf zu vereinbaren?",Request,Product Support,medium,de,400,Feature,Product,Feedback,,,,,
Request for Enhancements to Data Analytics Tools,"Dear Customer Support, I am writing to request enhancements to the data analytics tools that are currently used across our software and hardware products. The current tools have limited capabilities in providing real-time insights, which hinders our ability to optimize investments and reporting. I believe that by upgrading these tools, we can make more informed decisions and improve overall performance. The affected products include our flagship software and several hardware devices. I would greatly appreciate it if you could look into this matter and provide a solution as soon as possible. Thank you.",Your request for enhancements to the data analytics tools has been received. We will review it and need some additional information to proceed with a solution. Thank you.,Change,Technical Support,medium,en,400,Feature,Product,Feedback,,,,,
Healthcare Support Inquiry,"Hello, I am reaching out to inquire about the security solutions and services provided by your healthcare department. Could you please provide details on the types of services you offer, data encryption methods, secure storage practices, and network security measures? I would greatly appreciate if you could include information on the software and hardware solutions you provide. Additionally, could you let me know about the industry standards and regulations, specifically HIPAA, that your services comply with? Thank you for your time and assistance. I look forward to hearing from you.",The information will be sent to you via email shortly.,Request,Human Resources,low,en,400,Security,IT,Tech Support,Hardware,Network,Performance,,
Concerns About Video Conferencing,"A financial institution encountered connectivity problems during video conferencing. After resetting devices and verifying internet speed, the issues still exist.","Dear [name], we acknowledge the connectivity issues you are experiencing with video conferencing. Despite resetting devices and checking internet speed, the problems persist. To further troubleshoot, could you provide details on the error messages you are receiving and the exact nature of the connectivity problems? For your convenience, please let us know a suitable time for a call at [tel_num] to discuss this further regarding account [acc_num]. Thank you.",Incident,Customer Service,low,en,400,Network,Performance,IT,Tech Support,,,,
,"Seeking assistance to improve our digital strategy services for brand growth. Would like to know more about the services you offer, such as social media management, content creation, and campaign analysis. Also, could you share some case studies or success stories from previous clients? Additionally, I would like to know more about your team's expertise and experience in this field. Please let me know to schedule a call for further discussion.","Appreciate your interest in our digital strategy services. We would be happy to provide information on our services, including social media management, content creation, and campaign analysis. Our team consists of experienced professionals with expertise in this field, and we can share case studies and success stories with you. To discuss further, we would like to schedule a call at your convenience. You can reach me at <tel_num>; please let me know a suitable time for you.",Request,Billing and Payments,high,en,400,Feedback,Sales,IT,Tech Support,,,,
Support Request for Network Outage,The network outage has affected the data analysis tools used for investments. It might be due to a misconfiguration in the Google Nest Wifi Router. Restarting the router and rechecking connections were attempted to resolve the issue. Assistance is needed to resolve the problem as soon as possible.,"Acknowledging the network outage that has disrupted the data analysis tools. I'm sorry to hear about the issue and that restarting the router did not resolve it. I would like to assist in resolving it as soon as possible. To better understand the issue, could you please provide details about your network setup and any exact error messages you are seeing? Additionally, I would like to schedule a call to troubleshoot the issue with your Google Nest Wifi Router. I am available at your convenience.",Incident,Technical Support,high,en,400,Network,Outage,Disruption,IT,Tech Support,,,
Problem with System Crash,"Hello Customer Support, I have encountered an unexpected system crash during data analysis. It is possible that the data overload could have triggered this. After restarting the system and clearing the cache, the issue still persists. The crash happened while processing a large dataset, and I suspect the system might not be able to handle the volume of data. I have already tried troubleshooting by checking for software updates and ensuring hardware compatibility, but the problem still remains. I would greatly appreciate your assistance in resolving this issue.","Hi [name], we apologize for the system crash issue you are experiencing. To assist you better, please provide details about the dataset that was processed before the crash, including its size and any data analysis you performed. Additionally, we would like to schedule a call to discuss the issue and determine the best course of action. I am flexible with time and can suggest some options for you. Please let us know your preferred time.",Incident,Technical Support,high,en,400,Crash,Performance,Hardware,IT,Tech Support,,,
Inquiry About API Integration for Project Management SaaS,"Customer Support, we are reaching out to inquire about the API integration capabilities for the project management SaaS platform. Could you please provide detailed information on the types of APIs that are supported, the data that is integrated, and any specific requirements or restrictions for the integration process? We would greatly appreciate any documentation resources that could assist us with the integration process. Thank you for your time and assistance. We look forward to hearing back soon.","We appreciate your interest in the API integration capabilities of our project management SaaS platform. We support REST APIs for integrating with various third-party applications. The types of data that are integrated include projects, tasks, and user information. For detailed information, please visit our developer portal. If you need further assistance, we would be happy to schedule a call at your convenience to discuss specific requirements and restrictions for the integration process. Please let us know a suitable time for the call.",Request,Product Support,high,en,400,Feature,Documentation,Feedback,IT,Tech Support,,,
Problem with Delayed Load Speed,Noticing significant delays while loading the project management dashboard.,Acknowledged your concern about the delayed load speed on the project management dashboard. Kindly share more details so we can assist in troubleshooting and finding a solution.,Problem,Customer Service,medium,en,400,Performance,IT,Tech Support,,,,,
Trouble with Data Analytics Integration,"An error emerged during the integration of data analytics for investment optimization, impacting multiple connected products. This might be due to compatibility issues arising from recent updates. Efforts to resolve the issue included restarting systems and verifying network connections.","We are investigating the error in the data analytics integration process. To help us troubleshoot potential compatibility issues due to recent updates, could you please provide more details about the updates you have installed and the specific error message you are receiving? To discuss this further, we can schedule a call at a convenient time for you. Please let us know a suitable time to contact you at <tel_num> regarding account <acc_num>.",Incident,Product Support,medium,en,400,Bug,Performance,Network,IT,Tech Support,,,
Enhance Security for Medical Data in Hospital Systems,Request to improve security protocols for medical data within hospital IT systems has been received. This matter will be forwarded to the relevant department for review and implementation of necessary security updates. We will keep you informed on the progress and any required actions.,"Request to enhance security measures for medical data within hospital systems has been received. This will be reviewed by the appropriate department, who will implement necessary security updates. You will be informed of the progress and any required actions.",Change,Product Support,medium,en,400,Security,IT,Tech Support,Performance,,,,
Incident of Data Security,"A data security incident happened, which might have exposed medical information. We have reviewed the system logs and strengthened access controls.",We are investigating the incident and will provide an update on the status of your account <acc_num>.,Incident,Technical Support,medium,en,400,Security,Incident,IT,Tech Support,,,,
Concerning Incident: Data Exposure,"A data breach has happened, leading to the exposure of sensitive medical information. This might have resulted from vulnerabilities in outdated software and misconfigurations. Despite efforts to enhance access controls and update software, the issue continues to persist. We need your assistance to resolve this matter and prevent future breaches.","In response to your email regarding the data breach issue, we acknowledge the sensitivity of the matter and appreciate the steps already taken to implement stronger access controls and update software. To better assist you, could you please provide more details about the breach and the steps you have already taken? We would like to schedule a call at your convenience to discuss the issue and determine the next steps to resolve and prevent future breaches.",Incident,Returns and Exchanges,medium,en,400,Bug,Security,IT,Tech Support,,,,
"Brauche Hilfe bei der Sicherung medizinischer Daten in Notion. Welche besten Praktiken gibt es für Krankenhäuser? Suchen Sie nach Möglichkeiten, sensible Informationen während der Nutzung von Notion zu schützen.","Notion zur Sicherung medizinischer Daten anzuwenden, benötige ich die besten Praktiken, die Krankenhäuser einsetzen. Ich suche nach Möglichkeiten, um sensible Informationen während der Nutzung von Notion zu schützen.","Wir bieten Practices zur Sicherung medizinischer Daten in Notion an. Bitte kontaktieren Sie uns am angemessenen Zeitfenster unter <tel_num>, damit wir mehr Informationen zu Ihrem aktuellen Setup besprechen können.",Request,Billing and Payments,low,de,400,Backup,Security,Documentation,IT,Tech Support,,,
Required Assistance for Marketing Campaign Optimization,"Marketing campaigns are currently underperforming, which is causing a stagnant growth in brand visibility. This could be due to ineffective targeting and outdated strategies. Despite attempts to optimize digital ads and update content, the results have been minimal. I need your assistance to improve the campaign's performance and boost brand growth.","Understand your concern about the underperforming marketing campaigns and their impact on brand growth. To better assist you, could you provide details on the current marketing strategies and specific areas where you observed minimal results? This will help me understand the situation better and provide tailored guidance. I would like to schedule a call to discuss the marketing campaigns in depth and explore potential solutions. I am available at your convenience for this call. Additionally, I offer to review the current marketing strategies.",Problem,Customer Service,low,en,400,Feedback,Performance,Marketing,Sales,,,,
,"Exploring the integration of Zapier with current data analytics tools. Would appreciate detailed steps on the process. I am keen on learning how Zapier can help us streamline our data analysis and automate tasks. Specifically, I would like to know which types of data analytics tools are compatible with Zapier and what the integration requirements are. Thank you for your time and assistance. I look forward to hearing back soon.","Thank you for your interest in integrating Zapier with your data analytics tools. Zapier is compatible with a wide range of data analytics tools, facilitating streamlined data analysis and automation of tasks. To determine the best approach for integration, could you please provide specific details about your existing tools? This will help us achieve the desired outcome. I would be happy to discuss this further and can be available to call at <tel_num> to explore the options together.",Request,Billing and Payments,medium,en,400,Feature,Documentation,IT,Tech Support,,,,
Hilfe bei nicht autorisierter Zugriffsnachricht,"Die IT-Systeme des Krankenhauses haben eine Warnung wegen eines nicht autorisiereten Zugriffs ausgelöst, was möglicherweise auf eine Phishing-Attacke zurückzuführen ist. Temporäre Schritte umfassten das Ändern von Passwörtern und die Durchführung einer Malware-Suchaktion.","Für weitere Schritte rufen Sie bitte <tel_num> an, um die möglichen Lösungen zu besprechen.",Incident,IT Support,high,de,400,Security,Virus,Alert,IT,Tech Support,,,
Improve Data Analytics Integration Tools,There is a need for enhanced data analytics integration to develop better investment strategies.,"Dear [name], we appreciate your interest in improving data analytics integration tools. To better understand your requirements, could you please provide more details on the specific improvements you are looking for in your current investment strategies? We are happy to discuss and explore possible solutions to meet your needs.",Change,Technical Support,high,en,400,Feature,Feedback,IT,Tech Support,,,,
PostgreSQL Support Inquiry,"Seeking comprehensive details on PostgreSQL compatibility with ClickUp data integration, which would greatly assist in project planning. Appreciate your prompt assistance and look forward to your response soon.","Hello, thank you for reaching out to us regarding PostgreSQL compatibility with ClickUp data integration. We would be glad to provide detailed information to aid in your project planning. Could you please share specific requirements for the setup? We are happy to assist and provide the necessary information to ensure a smooth integration process for your project.",Request,Technical Support,high,en,400,IT,Tech Support,Feature,Documentation,,,,
Verschlüsselte medizinische Daten: Integrationsmöglichkeiten,"Könnten Anleitungen zur Verschlüsselung von medizinischen Daten und den Integrationsmöglichkeiten von Telegram und HelloSign geben, um Vorschriften Einhalt zu gebrauchen und sensible Informationen zu schützen? Vielen Dank für Ihre Unterstützung in dieser Angelegenheit.","Sehr geehrte/r [Name], ich danke für Ihre Besorgnis bezüglich der Verschlüsselung von medizinischen Daten und den Integrationsmöglichkeiten von Telegram und HelloSign. Um Vorschriften Einhalt zu gebrauchen und sensible Informationen zu schützen, empfehle ich Ihnen, die verschlüsselten Nachrichtenfunktion von Telegram und die sicheren elektronischen Unterschriftenlösung von HelloSign zu nutzen. Bitte bestätigen Sie, wie Sie spezifische medizinische Daten verwalten und welche aktiven Schutzmaßnahmen Sie eingeführt haben. Das wird mir helfen, eine genaue Anleitung zu geben. Wenn Sie dies vorziehen, können wir gerne einen konkreten Zeitpunkt vereinbaren, um die Details zu besprechen und konkrete Lösungen für die Situation zu finden.",Request,Technical Support,high,de,400,Feature,Documentation,Security,IT,Tech Support,,,
Campaigns with Low Engagement,"Customer Support, our marketing agency is facing issues with low engagement metrics for our digital campaigns. We suspect that improper audience targeting might be the cause. Despite analyzing demographics and adjusting ad placements, there has been no improvement. We have tried various targeting options, but the problem persists. Could you provide guidance on how to improve our audience targeting strategy? We have reviewed our data and would appreciate any expert advice on what might be going wrong.",Let's call to discuss,Problem,Product Support,medium,en,400,Feedback,Performance,Documentation,Sales,,,,
Backup of Medical Data Using Simulink MATLAB,"Please contact us to learn about the use of Simulink MATLAB for securing medical data in IT systems of hospitals. Could you provide details on best practices, protocols, and assurances for the confidentiality and integrity of sensitive medical information? I would be glad to share relevant resources and guidelines that are crucial for the IT systems of our hospital.",Guidelines for backing up medical data using Simulink MATLAB are provided. I recommend reviewing online resources and security documentation for best practices and protocols. Looking forward to further discussion; please share a suitable time window for a phone call at <tel_num>.,Request,Product Support,medium,de,400,Backup,Security,Documentation,IT,Tech Support,,,
Support for Engagement Issues,Engagement with customers has decreased.,Investigate the engagement issues of the customers and present a solution for improvement. Please provide more details for a faster approach to resolution.,Problem,Customer Service,low,de,400,Feedback,Tech Support,,,,,,
Projekt lädt nicht,Das Projektüberwachungsdashboard lädt unregelmäßig. Der Fehler wurde durch Aufräumen des Caches und Überprüfung der Internetverbindung beseitigt.,"Um das Problem mit dem Projektüberwachungsdashboard zu klären, bitte kontaktieren Sie uns, falls weitere Schritte erforderlich sind.",Incident,Customer Service,low,de,400,Bug,Performance,Network,IT,Tech Support,,,
Services for Brand Growth,"Customer Support, seeking details on digital strategies for brand growth services. Would be grateful if you could share the specifics of the services that can assist in enhancing our online presence and boosting brand awareness. Could you provide information on social media management, content creation, and search engine optimization? Looking forward to your response at your earliest convenience.","Dear [name], thank you for your inquiry regarding brand growth services. We will send you detailed information on our digital strategies, including social media management, content creation, and search engine optimization. Please contact us to discuss further.",Request,Sales and Pre-Sales,medium,en,400,Feedback,Sales,IT,Tech Support,,,,
