subject,body,answer,type,queue,priority,language,version,tag_1,tag_2,tag_3,tag_4,tag_5,tag_6,tag_7,tag_8
Sluggish Performance in Project Data Loading,"Users have reported delays in loading project data on the dashboard. This issue might be related to recent server updates causing stability problems. Despite clearing the cache and restarting services, the issue remains unresolved and requires attention.",Investigating the slow performance in project data loading on the dashboard. Please provide any detailed error messages or symptoms that users are experiencing. We will schedule a call at your convenience to discuss and explore potential solutions related to recent server updates and stability issues. Please let us know a suitable time for the call at <tel_num> to proceed with resolving the issue for your account <acc_num>.,Incident,Technical Support,high,en,400,Performance,Outage,Recovery,IT,Tech Support,,,
Occasional Login Issues,"We are currently encountering sporadic login difficulties with our SaaS platform. It may be related to a recent code deployment. Up to this point, clearing caches and restarting the affected services have not resolved the problem. Our team is actively working to resolve this issue and will provide updates as more information becomes available.","Dear [Name], we appreciate your reaching out to us regarding the intermittent login issues with our SaaS platform. We apologize for the inconvenience and appreciate the troubleshooting steps that your team has already taken. We would like to assist in resolving this issue. Could you please provide details on the recent code deployment and any specific error messages that users are experiencing? This information will help us better understand the issue and provide an effective solution. You can call us at [Tel Num] to discuss any further needed information.",Incident,Technical Support,high,en,400,Login,Performance,IT,Tech Support,,,,
Query Regarding Billing Inaccuracy - Customer Support,I have encountered a billing discrepancy affecting my subscription to various software tools. This might have happened due to processing errors. I have tried reaching out to support via email but have not received a response. I would greatly appreciate it if you could look into this matter and provide a resolution at your earliest convenience.,We will review the billing discrepancy and work towards resolving it. Please contact us at <tel_num> for assistance and verification of your account number <acc_num>.,Incident,Billing and Payments,low,en,400,Billing,Refund,Payment,Disruption,Account,Tech Support,,
Problem with Online Meetings,Facing connectivity problems with Google Meet and Cisco Webex because of a corrupted MicroSD card.,Replace the corrupted MicroSD card to resolve the connectivity issues.,Problem,IT Support,high,en,400,Network,Performance,IT,Tech Support,,,,
Inquiry on Pricing and Collaboration Features,"I am seeking detailed pricing information for the team collaboration features on your SaaS platform. Could you please provide a breakdown of the costs associated with these features? It would be greatly appreciated if you could also include any discounts or promotions that are currently available. Additionally, I would like to know more about the free trials and demos that are offered so I can test the features without committing to a purchase. This information will help me make an informed decision about whether the platform is the right fit for our team's needs.","We can provide you with the pricing details and any available discounts. Please allow us to send you an email with the necessary information, or you can prefer to call us at <tel_num> for a detailed discussion.",Request,Billing and Payments,high,en,400,Sales,Feedback,Feature,Documentation,,,,
Problem with Website Downtime Today,"The website faced an unexpected outage during a promotional event, possibly because of increased traffic. I attempted to restart the server and optimize load settings, but the issue still persists. Urgent assistance is needed to resolve this as soon as possible to minimize any impact on our business.","We have received your email about the website downtime issue. To assist further, could you please provide any error messages you are seeing and details of the steps you have taken so far? I am happy to schedule a call at your convenience to resolve the issue promptly.",Incident,IT Support,high,en,400,Outage,Disruption,Performance,Recovery,IT,Tech Support,,
Investment System Issue Detected,"The investment optimization system has encountered a problem with data analysis, causing it to crash.","Dear <name>, we apologize for the issue you experienced with the investment optimization system. We are taking immediate action to resolve the problem. To better assist you, could you please provide the details of the error message you received and the steps you took that led to the crash? We would also like to schedule a call at your convenience to discuss this further. Please let us know a suitable time to reach you at <tel_num>. We appreciate your patience and look forward to resolving this issue promptly. Your account number is <acc_num>.",Incident,IT Support,high,en,400,Bug,Performance,IT,Tech Support,,,,
Revise Sales Aids,Updating sales aids can boost client interaction.,"Dear [Name], thank you for the email about revising sales aids. Please review the current materials and make any necessary improvements to enhance client engagement. Kindly provide specific details on the types of updates you suggest. I am available to discuss this matter at your convenience; feel free to call me at <tel_num>. Best regards.",Change,Sales and Pre-Sales,low,en,400,Sales,Feedback,Product,,,,,
