subject,body,answer,type,queue,priority,language,version,tag_1,tag_2,tag_3,tag_4,tag_5,tag_6,tag_7,tag_8
,"Sehr geehrter Kundenservice, ich möchte einen Vorfall im Zusammenhang mit den digitalen Kampagnen unserer Marketingagentur melden. Unerwartet kam es zu einem Stillstand der Kampagnen, den wir auf mögliche Softwareintegrationsprobleme bei den gelisteten Produkten zurückführen. Unser Team versucht, das Problem durch Systemneustarts und Updates zu beheben, allerdings waren diese Maßnahmen erfolglos. Wir haben außerdem den Anbieter um Unterstützung gebeten, bisher jedoch keine Lösung erhalten. Wir sind besorgt über die Auswirkungen auf unser Geschäft und möchten so schnell wie möglich eine Lösung finden. Könnten Sie bitte die Angelegenheit prüfen und uns Ratschläge zum weiteren Vorgehen geben?","<name>, wir haben Ihre E-Mail bezüglich der Probleme mit den digitalen Kampagnen unserer Marketingagentur erhalten. Wir werden die Angelegenheit untersuchen und Ihnen Anweisungen für das weitere Vorgehen zukommen lassen. Um die Untersuchung zu erleichtern, könnten zusätzliche Informationen erforderlich sein. Falls notwendig, können wir Sie unter <tel_num> kontaktieren, um weitere Details zu besprechen. Bitte teilen Sie uns einen passenden Zeitpunkt für ein Gespräch mit. Wir bemühen uns, die Ursache schnell zu ermitteln und eine Lösung umzusetzen. Vielen Dank für Ihre Geduld und die Zusammenarbeit.",Incident,Product Support,high,de,52,Bug,Disruption,Software,Integration,System Restart,Update,Marketing,Agency
Effektive digitale Marketingstrategien für nachhaltiges Marktwachstum,"Sehr geehrter Kundenservice, ich bin daran interessiert, mehr über digitale Marketingstrategien zu erfahren, um das Marktwachstum effektiv zu fördern. Könnten Sie bitte detaillierte Informationen zu Taktiken und Techniken bereitstellen, die verwendet werden, um die Markenbekanntheit zu steigern und eine breitere Zielgruppe zu erreichen? Ich schätze Ihre Unterstützung bei der Entwicklung einer erfolgreichen digitalen Marketingkampagne, die mit den Unternehmenszielen übereinstimmt. Besonders möchte ich mehr über Social-Media-Marketing, E-Mail-Marketing und Suchmaschinenoptimierung erfahren. Bitte geben Sie Beispiele für erfolgreiche digitale Marketingkampagnen sowie relevante Daten und Statistiken an.","Sehr geehrter <name>, wir freuen uns über Ihr Interesse an digitalen Marketingstrategien zur Förderung des Marktwachstums. Gerne stellen wir Ihnen Informationen zu Taktiken und Techniken im Bereich Social-Media-Marketing, E-Mail-Marketing und Suchmaschinenoptimierung bereit. Für eine detailliertere Beratung vereinbaren Sie bitte einen Termin unter <tel_num>. Wir besprechen Ihre Geschäftsziele und passen die erfolgreiche digitale Marketingkampagne entsprechend Ihren Bedürfnissen an.",Request,Technical Support,medium,de,52,Marketing,Strategy,Growth,Branding,Campaign,Digital,Customer Support,
User Problem with SaaS Platform,"The SaaS platform experiences occasional crashes during periods of high user activity, potentially due to inadequate scaling. Attempts to resolve this by restarting services and clearing caches have not resolved the issue. The team is actively investigating the root cause and exploring potential solutions to enhance the user experience.","<name> is composing an acknowledgment email regarding the intermittent crashes of the SaaS platform under high user load. We recognize that the team has already tried restarting services and clearing caches, but the issue persists. We appreciate the efforts made so far in investigating and exploring solutions to improve the user experience. We would like to offer our support to help resolve this issue promptly. Could you please provide the error messages encountered?",Incident,Product Support,medium,en,52,Crash,Performance,Outage,Disruption,Recovery,Maintenance,,
,"Customer Support, I am reaching out to inquire about updating digital branding strategies for a marketing agency. Our objective is to improve our online visibility and engagement, which should help in the overall growth of our brand. I would like to learn about the services you offer that can be customized to meet the specific requirements of a marketing agency. Could you please share information about your services, including relevant case studies and testimonials? I would also appreciate guidance on how to begin updating our digital branding strategies.",We provide tailored digital branding solutions designed to boost online visibility and engagement. We would be happy to discuss our services and share case studies. Please let us know a convenient time for a call to explore how we can customize our services to suit your marketing agency's unique needs.,Change,IT Support,medium,en,52,Feedback,Sales,Lead,Marketing,Branding,Strategy,Online Visibility,Engagement
Sicherung medizinischer Daten in Krankenhäusern,"Sehr geehrter Kundendienst, ich bitte um Ratschläge zur Sicherung medizinischer Daten durch den Einsatz von Mesh-Netzwerken in Simulink für Krankenhausumgebungen. Es ist bekannt, dass der Schutz sensibler Patientendaten im Gesundheitswesen von höchster Bedeutung ist. Ich bin daran interessiert, mehr darüber zu erfahren, welche Werkzeuge genutzt werden können, um Vertraulichkeit, Integrität und Verfügbarkeit medizinischer Informationen sicherzustellen. Könnten Sie Empfehlungen zu bewährten Praktiken für die Implementierung von Mesh-Netzwerken in Krankenhäusern geben? Ich würde eine Einschätzung des Themas, einschließlich relevanter Dokumentationen und verfügbarer Ressourcen, sehr schätzen.","Ihre Anfrage bezüglich Empfehlungen zur Sicherung medizinischer Daten mit Mesh-Netzwerken in Simulink wird geprüft. Bitte erlauben Sie mir, <tel_num> zu kontaktieren, um weitere Details zu besprechen.",Request,Technical Support,high,de,52,Security,Backup,Healthcare,Data Privacy,Network,Confidentiality,,
Effektive Online-Wenbemaßnahmen für digitale Produkte in der heutigen Zeit,"Sehr geehrter Kundenservice, ich möchte mich erkundigen, wie man digitale Strategien einsetzt, um USB-Sticks und VR-Headsets zu bewerben. Könnten Sie bitte detaillierte Informationen zu Methoden bereitstellen, mit denen die Zielgruppe effektiv erreicht werden kann? Besonders interessieren mich Social-Media-Kampagnen, E-Mail-Marketing-Taktiken und Online-Werbestrategien. Außerdem wäre ich dankbar für Informationen darüber, wie man den Erfolg von Strategien misst und basierend auf den Ergebnissen Anpassungen vornimmt. Vielen Dank für Ihre Zeit und Unterstützung. Ich freue mich auf eine baldige Rückmeldung.","Es werden verschiedene digitale Ansätze genutzt, darunter Social-Media-Kampagnen und E-Mail-Marketing, um Produkte zu bewerben. Weitere Details können in einer Nachfass-E-Mail oder einem Telefonat geklärt werden. Bitte nennen Sie eine bevorzugte Kontaktzeit.",Request,Customer Service,medium,de,52,Marketing,Digital Strategy,Campaign,Email Marketing,Media,Online Advertising,Customer Service,
Revise Digital Marketing Plans,"Requesting an update on the digital marketing strategies. Our technology software products need a boost in brand visibility. I would like to discuss new methods to improve our online presence and expand our audience. This includes social media, content marketing, and search engine optimization. I look forward to hearing from you to explore ways to enhance our marketing efforts.","<name> acknowledges your request for an update on digital marketing strategies to increase brand growth for our tech software products. We are interested in discussing new approaches to strengthen our online presence and reach a broader audience. We would like to schedule a call with you to explore ways to improve social media, content marketing, and search engine optimization. Please let us know a convenient time for a call at <tel_num>. For details, refer to <acc_num>.",Change,Returns and Exchanges,low,en,52,Feedback,Marketing,Strategy,Digital,Social Media,Content,SEO,Brand Visibility
,"Sehr geehrter Kundenservice,<br><br>ich kontaktiere Sie bezüglich eines Problems mit unserem Projektmanagement-SaaS. Die Plattform verliert sporadisch die Verbindung zu Firebase, was zu Störungen im Arbeitsablauf führt. Wir haben versucht, das Problem durch einen Neustart der Dienste und eine Überprüfung der Firewall-Einstellungen zu beheben, jedoch blieb das Problem bestehen.<br><br>Wir vermuten, dass die Ursache möglicherweise mit den Netzwerkrichtlinien der Firewall zusammenhängt. Eine genaue Fehleranalyse ist erforderlich. Wir würden eine schnelle Untersuchung und Behebung des Problems sehr schätzen und bitten um Unterstützung.<br><br>Könnten Sie bitte das Problem prüfen, Lösungsvorschläge unterbreiten und Empfehlungen zur Behebung mitteilen? Ich stehe für Rückfragen zur Verfügung.","Sehr geehrter <Name>,<br><br>ich schreibe Ihnen bezüglich Ihrer E-Mail zum Problem mit unserem Projektmanagement-SaaS, bei dem die Verbindung zu Firebase intermittierend verloren geht. Ich bestätige, dass wir bereits versucht haben, das Problem durch einen Neustart der Dienste und eine Überprüfung der Firewall-Einstellungen zu beheben, jedoch besteht das Problem weiterhin.<br><br>Um die Ursache genauer zu untersuchen, bitten wir Sie, uns weitere Informationen zu Ihrer Netzwerkkonfiguration und den Firewall-Regeln zukommen zu lassen. Bitte stellen Sie die Firewall-Konfigurationsdetails sowie relevante Netzwerkprotokolle bereit. Wir werden diese Informationen prüfen, um Empfehlungen zur Lösung und Behebung des Problems zu erarbeiten. Falls notwendig, vereinbaren wir gern einen Anruf.",Incident,Technical Support,low,de,52,Network,Disruption,Maintenance,Security,Troubleshooting,Connectivity,,
Issue with Digital Tools at the Agency,"The digital tools used by the marketing agency are functioning correctly, but they are hindering brand growth initiatives. Possible causes include software conflicts or hardware issues. Attempts to restart devices and update software have not resolved the problem. Assistance in resolving this issue would be appreciated.",Investigate the problem with digital tools by calling <tel_num> to discuss further steps for resolution.,Incident,Technical Support,medium,de,52,Bug,Hardware,Performance,Disruption,Recovery,,,
Medical Records Data Breach,A healthcare organization encountered a data breach. Preliminary efforts to disable security measures were ineffective. An investigation is required to determine the source of the vulnerability.,"Proceed promptly to examine the data breach, pinpoint the weakness, and ensure the protection of medical records and customer account number <acc_num>.",Problem,Billing and Payments,medium,en,52,Security,Data Breach,Outage,Investigation,,,,
Payment Processing Problem on SaaS Platform,"The customer is unable to complete payments through the SaaS platform's billing portal. This issue may have arisen following a recent update to the payment gateway. The customer has tried clearing their browser cache, switching between different browsers, and retrying the payments, but the problem persists across multiple attempts. They are requesting assistance to resolve this issue and enable successful transactions.","<name>, thank you for informing us about the payment processing problem on the SaaS platform's billing portal. We appreciate the troubleshooting steps you've already undertaken. To assist you further, could you please specify the error message or any error codes you are encountering when attempting to make payments? If needed, we can arrange a call at a convenient time to discuss the issue and work towards a resolution. Please let us know a suitable time for you.",Incident,Billing and Payments,medium,en,52,Payment,Billing,Issue,SaaS,Platform,Gateway,Browser,Cache
Recent Payment Gateway Update Possibly Caused Billing Errors,Multiple users have experienced billing issues across various products. Efforts to resolve the problem were made but were unsuccessful.,"<name>, thank you for reporting the billing errors experienced by users. We apologize for the inconvenience caused by the recent updates to the payment gateways. To assist you further, could you please provide additional details about the errors, including any error messages received for the affected products? This information will help us investigate and resolve the issue more efficiently. If needed, we can also schedule a call to discuss further. Please let us know a suitable time.",Problem,Billing and Payments,high,de,52,Billing,Payment,Outage,Disruption,Recovery,,,
Problems with Marketing Agency Products,"Customer Support, I am contacting you concerning several product problems that our marketing agency is currently experiencing. These issues are severely affecting the execution of our campaigns and overall performance. We suspect that recent software updates might be causing conflicts, resulting in these problems. Our team has tried troubleshooting by rebooting and reinstalling the software, but unfortunately, these efforts did not resolve the issues. We would be grateful if you could help us identify the root causes and suggest solutions.","To assist with the product issues, please provide specific error messages and details about the current software version in use. This information will help us identify the root causes and offer an appropriate solution.",Incident,Technical Support,high,en,52,Product,Performance,Bug,Troubleshooting,Software Update,Customer Support,,
Probleme beim Zugriff auf Gesundheitsdaten,"Der Gesundheitsdienstleister erlebt Verzögerungen beim Zugriff auf die Daten. Trotz Aktualisierung der Firewall und des Antivirus-Programms besteht das Problem weiterhin. Wir benötigen dringend Unterstützung, um das Problem zu beheben. Bitte helfen Sie uns, die Ursache zu identifizieren und eine Lösung bereitzustellen, um einen rechtzeitigen Zugriff auf kritische Patientendaten sicherzustellen.","Vielen Dank für Ihre E-Mail bezüglich der Schwierigkeiten beim Zugriff auf Gesundheitsdaten. Um Ihnen besser helfen zu können, möchten wir weitere Informationen zu den Verzögerungen sammeln. Bitte teilen Sie uns Details zu Fehlermeldungen, beobachteten Symptomen sowie die bisher durchgeführten Schritte mit. Gerne vereinbaren wir auch einen Anruf zu einem passenden Zeitpunkt, um das Problem zu besprechen und eine Lösung zu erarbeiten. Bitte teilen Sie uns eine geeignete Zeit mit, unter <tel_num> anzurufen.",Problem,Customer Service,medium,de,52,Security,IT,Tech Support,Disruption,Performance,,,
,Intermittent disconnections of digital tools such as Chromebook and Skype are disrupting campaigns. There may be network-related issues. Restarting devices and resetting adapters have been attempted and appeared to resolve the problem.,"Sorry to hear about the intermittent disconnections affecting digital tools like Chromebook and Skype, which are impacting your campaigns. Since restarting devices and resetting adapters seemed to resolve the issue, it suggests the problem might be more complex. To troubleshoot further, could you please provide more details about your network setup, including specific error messages or logs of the disconnections? Additionally, it would be helpful to know if other devices on the same network are experiencing similar issues. If necessary,",Problem,IT Support,medium,de,52,Network,Disruption,Hardware,Performance,Outage,,,
System Instability Due to Multiple Product Integrations,"Integrating several products leads to system instability, likely caused by driver conflicts or resource overload. Attempts to resolve this by restarting and reinstalling have not succeeded.","<name>, we apologize for the system issues caused by multiple product integrations. To assist you more effectively, please share the list of integrated products along with their versions. Additionally, we would like to arrange a call at a convenient time to discuss this further. Please let us know a suitable time and contact number <tel_num>. We aim to help troubleshoot the problem and identify a solution to resolve driver conflicts and resource overload.",Incident,Technical Support,high,en,52,Performance,Disruption,Hardware,Software,Integration,,,
Problem with Website Speed Today,"Customer support is facing difficulties with the website due to digital marketing strategies implemented by the agency. The site is sluggish, and products cannot be accessed. Attempts to resolve by restarting servers and clearing caches have not succeeded. The issue is likely due to server overload or misconfiguration. Kindly assist in resolving this matter promptly.",Please investigate the website's performance issues. Provide the website URL and details of recent modifications. Contact <tel_num> to discuss how we can assist in resolving the problem as quickly as possible.,Incident,IT Support,high,en,52,Performance,Outage,Disruption,Recovery,,,,
,"I am seeking assistance from the customer support team regarding the stagnation of my marketing agency's brand growth despite our efforts. Although we have updated digital tools that enhanced our content, the issue continues. Our team is diligently working to create engaging campaigns and has seen some desired results, but the overall growth remains stalled. I would appreciate any guidance or recommendations that could help us identify the root cause of the problem and find an effective solution. Please let me know if additional information is required.","The <name> Service Desk team is here to assist with your concern. Thank you for reaching out about the stalled brand growth of your marketing agency. We understand that despite updating digital tools and boosting content, the issue persists. To better assist you, could you please provide details about your current marketing strategies and specific goals you are aiming to achieve? This will help us identify the root cause of the problem and offer relevant guidance and recommendations. We may also suggest a call if necessary.",Problem,Technical Support,medium,en,52,Customer Support,Marketing,Brand Growth,Digital Tools,Content Issue,Campaign,Guidance,Recommendation
,"Customer Support, I am reaching out to request detailed instructions on integrating the Smart-Rauchmelder with the Smartsheet scalable SaaS project management platform. I believe that this integration will significantly improve our project management capabilities and would like to understand the process. Could you please provide a step-by-step guide for the setup? Additionally, I would appreciate any further information regarding the benefits and limitations of this integration. Thank you for your time and support. I look forward to your response.","<name>, thank you for contacting the customer support team. I am happy to assist you with integrating the Smart-Rauchmelder with the Smartsheet platform. To provide detailed guidance, could you please share your current setup requirements? I would also like to schedule a call at <tel_num> to discuss and walk you through the step-by-step instructions. Please let me know a convenient time for the call.",Request,Customer Service,medium,en,52,Feature,Documentation,Feedback,IT,,,,
System Outage Notification,"Dear Customer Support,<br><br>I am submitting a report concerning a critical issue with a healthcare provider's system. The system is experiencing intermittent outages that hinder access to medical data and hospital services. An initial investigation indicates that the outages may be caused by conflicts in network equipment.<br><br>We attempted to reboot the affected devices, but unfortunately, the problem persists. We have verified the service status, and the issue still remains.<br><br>We would greatly appreciate it if you could look into this matter.","<name>, I am writing to acknowledge receipt of your email regarding the system outage issues faced by the healthcare provider. I understand the urgency and severity of this matter, especially given its impact on medical care services. Our team is actively investigating the potential cause, which has been identified as conflicts in network equipment. To facilitate a quick resolution, could you please provide detailed information about the outages, including their frequency, duration, and any error messages encountered? Additionally, any further relevant details would be helpful.",Incident,Service Outages and Maintenance,medium,en,52,Outage,Disruption,Recovery,IT,Tech Support,,,
Performance Issues with Multiple Products,"Sehr geehrter Kundensupport, ich möchte auf Performance-Probleme bei Finanzprodukten im Zusammenhang mit Datenanalyseaufgaben hinweisen. Trotz verschiedener Versuche zur Fehlerbehebung bestehen die Probleme weiterhin. Es wurden Verzögerungen bei mehreren Anwendungen festgestellt, die möglicherweise auf Softwarekonflikte oder Ressourceneinschränkungen zurückzuführen sind. Das Team unternimmt Schritte wie das Neustarten der Anwendungen, das Aktualisieren auf die neueste Softwareversion und die Überprüfung der Netzwerkverbindungen, um Störungen zu beheben. Diese Maßnahmen haben jedoch bislang keine Lösung gebracht. Es besteht die Befürchtung, dass diese Probleme die Fähigkeit beeinträchtigen könnten, wichtige Aufgaben erfolgreich abzuschließen.","Sehr geehrter <Name>, vielen Dank, dass Sie uns bezüglich der Leistungsprobleme bei Ihren Finanzprodukten kontaktiert haben. Wir entschuldigen uns für die entstandenen Unannehmlichkeiten und schätzen die bisherigen Fehlerbehebungsmaßnahmen unseres Teams sehr. Um Ihnen weiterhelfen zu können, würden wir gern einen Anruf vereinbaren, um das Problem genauer zu besprechen und zusätzliche Informationen zu sammeln. Wäre ein geeigneter Zeitpunkt für einen Anruf verfügbar? Bitte teilen Sie uns eine passende Zeit mit, damit unser technischer Support-Spezialist Kontakt mit Ihnen aufnehmen und die Ursache der Leistungsprobleme bei <acc_num> identifizieren kann.",Problem,IT Support,medium,de,52,Performance,Software,Bug,Disruption,,,,
Financial Company Facing Integration Challenges with Data Analytics Tools,"Customer support reports that a financial organization is encountering integration problems impacting data analytics functionalities across various products. These issues appear to have begun following recent updates, possibly due to compatibility conflicts. Basic troubleshooting steps such as system restarts have been attempted but were unsuccessful. The client is worried about operational impacts and requests prompt assistance to resolve the issue. Kindly advise on the next steps to address this matter. Thank you for your support.",Assess the integration problem by contacting <tel_num> to discuss the upcoming steps and explore potential solutions to fix the incompatibility affecting the data analytics products.,Incident,Sales and Pre-Sales,medium,en,52,Bug,Performance,Outage,Disruption,Support,,,
Inquiry Regarding Digital Strategies for Business Expansion,"Customer Support is seeking information about the digital strategies employed by your company to boost brand growth and improve customer engagement. Could you share specific methods used to accomplish these objectives? We are especially interested in understanding the roles of social media, content marketing, and email marketing within your overall digital strategy. Have these channels proven more effective than others in increasing engagement and conversions? Additionally, we would appreciate details on the metrics you utilize to evaluate success.","<name>, thank you for your interest in digital strategies. We would be happy to provide detailed information and discuss this further via phone. Please let us know a convenient time to call at <tel_num>.",Request,Customer Service,low,en,52,Feedback,Sales,Lead,Marketing,Digital Strategy,,,
