subject,body,answer,type,queue,priority,language,version,tag_1,tag_2,tag_3,tag_4,tag_5,tag_6,tag_7,tag_8
Concerns Over Digital Campaign Engagement,"Hello Customer Support, we are currently facing issues with lower engagement rates on our digital campaigns. This may be due to ineffective targeting or outdated strategies. After analyzing recent metrics and implementing changes such as updating ad creatives and refining audience segments, we have not seen any significant improvement. Our team has also tried refreshing ad content and exploring new channels, but the engagement metrics remain stagnant. Could you please provide more details on the current campaign setup, including targeting parameters and ad creatives? Additionally, knowing the campaign goals and key performance indicators would be very helpful.","Dear [name], we appreciate your concerns regarding the lower engagement rates on your digital campaigns. We understand that despite our efforts to update ad creatives, adjust audience segments, and explore new channels, the results have remained stagnant. To better assist you, could you please provide more information on the current campaign setup, including targeting parameters and ad creatives? Additionally, it would be very helpful to know the campaign goals and key performance indicators. We are happy to help.",Incident,Product Support,medium,en,400,Feedback,Performance,Product,Feature,IT,Tech Support,,
Probleme mit Mesh-Wi-Fi-System von Netgear Nighthawk,Finanzinstitut begegnet Verbindungsproblemen in einem Netgear Nighthawk Mesh Wi-Fi 6 System. Das Netzwerk wird von unangemessenen Datenanalyseverfahren belastet und durch unkompatibles Firmware-Update beeinträchtigt.,"Um das Problem mit dem Netgear Nighthawk Mesh Wi-Fi 6 System zu überprüfen, rufen Sie bitte <tel_num>. Wir bieten Schritt-für-Schritt-Richtlinien zur Lösung des Problems zur Verfügung.",Incident,Product Support,medium,de,400,Network,Performance,Hardware,Bug,Security,,,
Assistance with MongoDB,Request for detailed documentation on integrating MongoDB 4.4 for a project management SaaS. Seeking understanding of setup processes and support in case of any issues during integration. Thanks!,Will send the quickest available methods.,Request,Technical Support,medium,de,400,Documentation,IT,Tech Support,Feature,,,,
"Verbesserung der Leistung und Skalierbarkeit des SaaS-Project-Management-Systems, inklusive Update",Für die Verbesserung der Leistung und Skalierbarkeit unserer SaaS-Project-Management-Plattform ist ein Systemupdate notwendig. Dieses Update wird die allgemeine Benutzererfahrung verbessern und die Projektverwaltung effizienter gestalten.,"Vielen Dank für Ihre Mitteilung. Das Systemupdate wird die Leistung und Skalierbarkeit unseres SaaS-Project-Management-Systems verbessern. Wir freuen uns, dass die verbesserte Benutzererfahrung Benutzern einen Mehrwert bieten wird.",Change,Service Outages and Maintenance,high,de,400,Performance,Feature,Documentation,Feedback,,,,
Safe Medical Data Storage Options with Oracle Database 19c,Looking for secure methods to store hospital medical data using Oracle Database 19c. Could you provide details on best practices and configurations to ensure a secure system?,"To secure hospital medical data using Oracle Database 19c, it is recommended to enable encryption and access controls. Implementing Oracle Advanced Security and configuring Transparent Data Encryption can help protect sensitive information. It is suggested to set up auditing and monitoring to track database activity. For tailored guidance, we would be happy to discuss your specific system requirements and assist with the necessary practices and configurations.",Request,Product Support,medium,en,400,Security,Documentation,IT,Tech Support,,,,
Update unserer digitalen Marketing-Tools,"Ich schreibe, um eine Aktualisierung unserer digitalen Marketing-Tools zu beantragen. Eine aktuelle Strategie könnte die gewünschten Ergebnisse verbessern und Zeit für Innovationen anbieten. Ich möchte neue Methoden erkunden, um die Sichtbarkeit und das Engagement zu steigern. Bitte geben Sie Empfehlungen und Vorschläge, um unsere digitale Präsenz zu verbessern.","<name> des Service Desk-Teams freut sich, Ihnen bei der Aktualisierung Ihrer digitalen Marketing-Tools zu helfen. Um angemessene Empfehlungen zu geben, wäre es hilfreich, wenn Sie uns mehr Informationen zu Ihren spezifischen Anforderungen und Herausforderungen in Bezug auf Ihre aktuellen digitale Marketing-Anstrengungen bereitstellen könnten. Wenn Ihnen diese Option zustimmt, würde ich gerne telefonisch mit Ihnen sprechen, um neue Wege zu finden, um die Sichtbarkeit und das Engagement zu verbessern. Andernfalls, bitte geben Sie mir eine passende Zeit, um dies zu besprechen.",Change,IT Support,high,de,400,Feedback,Feature,Sales,,,,,
Request for Support Interruption,"Dear Customer Service, <br><br>We are writing to report an interruption in our services. The digital marketing tools, which are crucial for our brand's growth, are affected. The issue seems to have been caused by a server failure that was triggered by a recent software update. Our team has attempted to resolve the issue by restarting the affected devices and verifying the connections, but unfortunately, the problem persists.<br><br>We appreciate your attention to this matter and hope that you can address the issue as soon as possible and provide us with the necessary instructions to fix the problem.",We will immediately investigate the problem,Incident,Service Outages and Maintenance,high,de,400,Outage,Disruption,Performance,IT,Tech Support,,,
,"geehrte Kundenservice, ich möchte mich digitalen Marketingstrategien annehmen und erfahren, wie diese mit unseren Produkten integriert werden können. Ich bin daran interessiert, mehr über Ansätze zu erfahren, die Unternehmen dabei unterstützen, ihre Strategien zu verbessern. Bitte teilen Sie mir relevante Informationen und Ressourcen mit, die mir helfen, diese Strategien besser zu verstehen.","geehrte <name>, vielen Dank für Ihr Interesse an digitalen Marketingstrategien. Durch die Integration dieser Strategien können wir Markenbewusstheit und Kundennähe verbessern. Der Ansatz umfasst die Verwaltung von Sozialmedien, die Optimierung von Suchmaschinen und die Erstellung von Inhaltsmaterialien. Sie können sich hierüber mehr informieren, indem Sie das detaillierte Broschürenmaterial erhalten. Wir können einen Anruf vereinbaren, um über die Vorteile unserer Strategien für Unternehmen zu diskutieren. Wenn Sie einen Anruf vereinbaren möchten, lassen Sie uns wissen, wann es Ihnen geografisch bequem ist, oder rufen Sie uns unter <tel_num> an. Alternativ",Request,Customer Service,medium,de,400,Product,Feature,Feedback,Sales,,,,
Service Request Inquiry,"Experiencing compatibility issues with the Project Management SaaS on WooCommerce integrated with ESET NOD32 Antivirus 14. It is likely due to conflicting security protocols. If attempts have been made to adjust firewall settings or temporarily deactivate the antivirus, the issue persists. We would greatly appreciate your guidance on how to resolve this. Please inform us of any additional steps required for further assistance.","Dear Customer, thank you for reaching out. Our Service Team is in contact and is willing to assist with the compatibility issues involving the Project Management SaaS on WooCommerce with ESET NOD32 Antivirus 14. To better assist, please provide more details on the error messages and steps taken so far. If necessary, we can schedule a call to investigate the issue further. Please specify a convenient time window when you will be available for the call.",Problem,Technical Support,medium,de,400,Bug,Security,Network,Tech Support,,,,
Serverausfall bei Projektmanagement-System,"Der Projektmanagement-System hat plötzlich Ausfälle erfahren, was auf unerwartete Serverbelastung zurückzuführen sein könnte. Dieser Server wurde neu gestartet und die Systemleistung wird überwacht.","Sehr geehrte/r [Name], wir bestätigen, dass der Serverausfall des Projektmanagement-Systems auf unerwartete Belastung zurückzuführen ist. Die richtigen Schritte wurden unternommen, der betroffene Server wurde neu gestartet und die Systemleistung wird überwacht. Falls die Problematik weiterhin besteht, bitten wir um weitere Details, um weitergehende Unterstützung zu ermöglichen.",Incident,Service Outages and Maintenance,high,de,400,Outage,Performance,IT,Tech Support,,,,
,"geehrte Kundensupport, ich möchte mich um Rechnungslegungsprozesse, Puppet- Smartwatch-Integrationen und SaaS-Plattformen kümmern. Könnten Sie mir detaillierte Informationen zu diesen Bereichen zur Verfügung stellen? Es wäre sehr hilfreich, wenn Sie mir relevante Dokumentationen und Ressourcen zur Verfügung stellen könnten. Darüber hinaus würde ich gerne erfahren, ob es für bestimmte Anforderungen spezifische Einrichtungsmöglichkeiten gibt. Ich freue mich auf Ihre Rückmeldung. Vielen Dank für Ihr Verständnis und Ihre Unterstützung. Freundliche Grüße, [Ihr Name]","geehrte [Ihr Name], danke, dass Sie sich an uns gewandt haben. Wir haben detaillierte Informationen zu Rechnungslegungsprozessen, Puppet- Smartwatch-Integrationen und SaaS-Plattformen auf unserer Website bereitgestellt. Sie können den detaillierten Leitfaden per E-Mail erhalten lassen. Falls Sie weitere Fragen zur Nutzung oder Einrichtung haben, lassen Sie uns wissen, wann ein Telefonat geplant sein kann. Wir bedanken uns hiermit für Ihr Geschäft und freuen uns darauf, Ihnen zu helfen. Vielen Dank, freundliche Grüße, [Ihr Name]",Request,Billing and Payments,medium,de,400,Billing,Documentation,Feedback,Tech Support,,,,
Usage Analytics for Seagate 6TB Drive,"Dear Customer Support, I am seeking detailed analytics on the usage of the Seagate 6TB Drive. Specifically, I am interested in the investment efficiency and how it benefits the business. Could you provide me with relevant information and data statistics that demonstrate the drive's performance and return on investment? Additionally, I would appreciate any case studies or customer testimonials related to the use of this drive. I look forward to your prompt assistance and am available to discuss further at <tel_num>. Thank you.","Dear [Name], we will provide detailed usage analytics for the Seagate 6TB Drive, including investment efficiency and performance data. Relevant case studies and customer testimonials will also be shared. Please contact us at <Tel_Num> for further discussion.",Request,Billing and Payments,high,en,400,Product,Feature,Feedback,Performance,Documentation,,,
Assistance with Report Software Issue,"There has been an issue with the report writing software leading to disruptions in our project management. This has affected users and products. The problem might be due to incompatibility with recent software updates. Despite my attempts to troubleshoot by reinstalling applications and checking system compatibility, the issue still persists. I would greatly appreciate it if you could look into the matter and provide a solution as soon as possible. Please let me know if you need additional information to assist in resolving the issue. I am available to provide any necessary details.","<name>, thank you for reaching out to us regarding the software issue that is disrupting project management and affecting users and products. We apologize to hear that the problem persists despite your troubleshooting efforts. We would like to investigate the matter and provide a solution as soon as possible. To assist in resolving the issue, could you please provide us with details on the software updates that were recently installed and the exact error messages you are receiving? Additionally, it would be helpful if you could let us know your operating system version.",Incident,Returns and Exchanges,medium,en,400,Bug,Disruption,Performance,Product,Feature,Tech Support,,
Einbinden neuester Aktualisierungen für betroffene Produkte in Echtzeit,"Bitte die Anforderung für die Integration der neuesten Aktualisierungen für betroffene Produkte einreichen. Dieser Dienst soll Benutzern Bewusstsein über Dienstausfälle und Wartungsarbeiten verleihen und aktuelle Informationen zur Verfügung stellen, um Störungen minimieren zu können.","Die Anforderung zur Integration neuester Aktualisierungen für betroffene Produkte in Echtzeit wird berücksichtigt. Bitte kontaktieren Sie uns unter <tel_num>, um weitere Implementierungsdetails zu besprechen.",Change,Service Outages and Maintenance,high,de,400,Maintenance,Outage,Disruption,Product,Feature,,,
Support for Digital Strategies Integration,"Seeking assistance in implementing digital strategies with Wix and Mailchimp. Interested in detailed information on how these tools work together to support business growth. Specifically, looking for best practices and tips on integrating them. Looking forward to your response regarding digital strategies.","Thank you for your interest in digital strategies involving Wix and Mailchimp. Our team is specialized in helping businesses enhance their online presence and grow effectively through the use of digital tools. To provide tailored advice, could you please share more details about your current digital setup? This will help us understand your specific needs better and provide the necessary support. We would be happy to discuss best practices and tips for optimizing the integration of Wix and Mailchimp for your business. Please let us know a convenient time for a call at <tel_num>. ",Request,Product Support,high,en,400,Feedback,IT,Tech Support,Documentation,,,,
Concern About Delays in Analytical Reports,"Customer Support, I am encountering delays in receiving analytical reports, which is affecting my investment decision-making processes. Recently, software updates were implemented, which may have impacted data integration. Despite restarting my system and checking data pipelines, the issue still persists. I would greatly appreciate it if you could look into this matter and provide a solution as soon as possible. The delay is causing significant inconvenience and is impacting my ability to make informed decisions. Please","Hello, regarding the delay in receiving analytical reports. To better understand the issue, could you please provide details on the software updates and changes made to data integration recently? Additionally, could you confirm the exact timeframe of the delay you are experiencing? If necessary, we can schedule a call to discuss further; I am available at <tel_num> or any other preferred time. We aim to provide a solution as soon as possible to minimize the impact on your decision-making processes. Please let",Incident,Returns and Exchanges,medium,en,400,Performance,Disruption,IT,Tech Support,Feedback,,,
Problem with Investment Analysis App,The application crashed during data processing due to compatibility issues.,"We apologize for the crash issue. Please try updating the app to resolve compatibility issues. If you need assistance, contact us.",Incident,Product Support,high,en,400,Bug,Performance,Feature,IT,Tech Support,,,
Campaign Engagement Issues,The recent campaign was unsuccessful due to technical problems. Our troubleshooting attempts were not successful.,We apologize for the issues with the recent campaign and would like to investigate further. Could you please provide details on the technical glitches experienced and the troubleshooting steps you have taken? We are happy to assist in resolving the issue.,Incident,Returns and Exchanges,medium,en,400,Bug,Performance,IT,Tech Support,Feedback,,,
Concern Regarding Compromised Medical Data Security,"The healthcare provider's medical data security has been compromised due to outdated software and weak passwords. Despite implementing multi-factor authentication and updating the software, the issues continue.","Hello, we are addressing the issue of compromised medical data security. Although multi-factor authentication and software updates have been implemented, the issues persist. Could you provide more details on the current issues you are experiencing to assist us better? We are available to discuss this further via a call at <tel_num>.",Problem,Customer Service,low,en,400,Security,Virus,IT,Tech Support,,,,
Probleme mit der Integration Smartsheet,"Es gab Integrationsschäden, und Sync-Fehler zwischen Smartsheet und QuickBooks Online. Diese scheinen auf die neuesten API-Änderungen zurückzuführen sein. Versuche, die Daten manuell zu bereinigen und die Anwendungen neu zu starten, waren erfolglos. Ich benötige Unterstützung, um das Problem zu beheben.","Bitte geben Sie detaillierte Informationen zu den Fehlermeldungen an, um weitere Hilfe und mögliche Lösungen für das Integrationsproblem zu erhalten.",Incident,Product Support,medium,de,400,Bug,Integration,Tech Support,,,,,
Technische Probleme bei digitalen Strategie-Tools beeinträchtigen Marketingbüro,"Marketingbüro trifft technische Hindernisse bei digitalen Strategie-Tools, insbesondere bei korrekt verbundenem KVM-Schalter. Aufmerksamkeit auf diese Probleme lenken, dabei helfen, sie schnell zu lösen. Bitte teilen Sie weitere Details zum Problem, wie etwa potenzielle Fehlermeldungen und Schritte, die bereits unternommen wurden, um das Problem zu beheben. Dadurch kann die Situation besser verstanden und eine effektivere Lösung gefunden werden. Falls es hilfreich wäre, Zeit finden Sie, um zusätzliche Informationen bereitzustellen.","Aufmerksamkeit auf technische Probleme lenken, denen das Marketingbüro derzeit bei digitalen Strategie-Tools begegnet, insbesondere die Tatsache, dass der KVM-Schalter ordnungsgemäß verbunden ist. Hilfe bei der schnellen Problembehebung leisten. Bitte geben Sie mehr Details zum Problem, wie etwa eventuelle Fehlermeldungen und die Schritte, die bereits unternommen wurden, um das Problem zu lösen. Dieser Information können wir die Situation besser verstehen und eine effektivere Lösung finden. Falls es hilfreich wäre, Zeit finden Sie, um zusätzliche Informationen bereitzustellen.",Problem,Technical Support,high,de,400,Bug,Performance,IT,Tech Support,Feedback,,,
Seek Aid with Persistent Billing Variations Issues Identified,Facing billing inconsistencies with subscription services,"examine account <acc_num>, reach out at <tel_num> to address billing variations",Problem,Billing and Payments,high,en,400,Billing,Payment,Refund,Account,Support,,,
Optimieren Markenwachstumsdienstleistungen,"Kontaktieren Sie uns, um digitalen Strategien bezüglich des Markenwachstums nachzugehen. Möchten Sie mehr Informationen zu erfolgreichen Strategien ähnlicher Unternehmen erhalten? Die von uns bereitgestellten Ratschläge und Empfehlungen sind hochgeschätzt. Vielen Dank für Ihre Zeit und Unterstützung.","Unsere Dienstleistungen helfen bei der Förderung des Markenwachstums durch digitale Strategien. Wir bieten verschiedene Dienstleistungen an, darunter die Verwaltung sozialer Medien und die Erstellung von Inhaltsstoffen. Bitte rufen Sie uns an, um ein günstigeres Zeitgebot zu besprechen und Anpassungen an Ihre Geschäftsnöte vorzuschlagen.",Request,Billing and Payments,medium,de,400,Feedback,Sales,Feature,,,,,
Details on PrestaShop Integration,"I am interested in learning about the integration capabilities within the PrestaShop project management SaaS. Could you provide details on how the two systems work together seamlessly? What features and functionalities are integrated, and what benefits can I expect from this integration?","I would be happy to discuss the details of the PrestaShop integration with you. Please allow me to call at your convenience to provide the necessary information on features, benefits, and the integration process.",Request,Returns and Exchanges,high,en,400,Feature,Documentation,Feedback,Sales,,,,
Request for Information on SaaS Integration Capabilities,"Is it possible to integrate SAP ERP, Salesforce CRM with a SaaS solution? Could you provide details on the available APIs, implementation timelines, and any other relevant information?",We support integration with SAP ERP and Salesforce CRM via REST APIs. Please find attached a document outlining the capabilities and technical specifications. I would prefer to discuss the implementation timelines over a call at a mutually convenient time.,Request,Human Resources,low,en,400,Feature,Documentation,IT,Tech Support,,,,
Error in Billing Software Update Issues Today,"Billing errors occurred, leading to incorrect charges. The recent software update is suspected to be the cause. Support was contacted and the payment history was checked, but the issue needs to be resolved.","I am reporting the billing errors that were reported and would like to obtain more information about the incorrect charges. Please provide your account number and a detailed description of the error so that we can investigate the matter. We will also check the recent software update to determine the source of the problem. If necessary, please call <tel_num> to discuss the issue further and offer a solution.",Incident,Billing and Payments,low,de,400,Bug,Payment,Billing,Performance,IT,Tech Support,,
Query on Digital Strategies for Brand Enhancement,Seeking details on digital strategies that could boost brand growth. This would greatly aid in understanding how to enhance our brand's online presence. Appreciate your prompt assistance!,"Dear [name], I would be happy to provide information on digital strategies for brand growth. We can offer a range of services including social media management and online advertising. To better understand your needs, let's discuss them. I would be available to call at your convenience to explore how we can help improve your brand's online presence. Please let me know a suitable time for a call at [tel_num].",Request,Customer Service,high,en,400,Feedback,Sales,IT,Tech Support,,,,
Concern About Digital Engagement,"Facing an unexpected decline in digital engagement metrics, which is affecting our brand growth strategies. It seems the recent changes in digital ad algorithms might be the cause. After adjusting ad targeting and revising our content, we noticed some improvement. I need help in resolving this issue.","Please review the digital engagement issue. You can contact us at <tel_num> to discuss potential causes and solutions, including recent algorithm changes. Together, we will determine the next steps to resolve the issue affecting the <acc_num> account.",Incident,General Inquiry,high,en,400,Feedback,Performance,Product,Documentation,,,,
Issue with Project Management Software Downtime,"Customer Support, our team is facing frequent downtime with the project management software, which is affecting our workflow and deadlines. This might be due to server load or configuration issues. We have attempted to optimize the current server settings and monitor usage patterns, but without success. We would greatly appreciate it if you could investigate the matter and provide a solution to minimize downtime and ensure a smooth workflow.","<name>, we are investigating the frequent downtime with the project management software and would like to discuss to determine the root cause and provide a solution to minimize downtime. Please let us know if you are available to call at <tel_num> to discuss this matter with the team.",Problem,Customer Service,high,en,400,Outage,Disruption,Performance,IT,Tech Support,,,
Notification of Security Breach for Customer Support,"Customer Support, there is a report of a security incident that potentially exposed medical data within the hospital's systems. The issue might be due to outdated software vulnerabilities or misconfigured settings. Steps taken include attempting to reset security protocols and applying available patches, but the issue still persists. We kindly request your assistance in resolving this matter as soon as possible to ensure the security of our systems. Please inform us of the next steps to proceed.","Dear [Name], we appreciate your report of the security incident and understand the importance of addressing it promptly. To better assist you, we need additional information regarding the outdated software, misconfigured settings, and any specific details of the incident and steps taken thus far. Could you please provide us with a detailed description? Additionally, we would like to schedule a call to discuss this further at your convenience. We are available at [Tel_num] for your convenience. Our goal is to resolve the issue as soon as possible to ensure the integrity of our systems, specifically [Acc_num]. Thank you.",Incident,Technical Support,high,en,400,Security,Notification,IT,Tech Support,Bug,,,
Assistance with Analytics Tool,"Dear Customer Support Department,<br>The Analytics tool for Investment Optimization and Reporting has stopped working. This appears to be due to the latest software updates. I have tried restarting the program and checking user permissions, but the issue persists, and reports cannot be generated. I appreciate your prompt attention to this matter and look forward to a potential solution being offered soon. Please notify us if any additional information is required to resolve the issue.<br>I remain respectful,<br>[Your Name]",We will address the issue at number <tel_num>. Further assistance will be provided to resolve the matter.,Incident,Technical Support,medium,de,400,Bug,Performance,IT,Tech Support,Feature,,,
