subject,body,answer,type,queue,priority,language,version,tag_1,tag_2,tag_3,tag_4,tag_5,tag_6,tag_7,tag_8
Guidance on Securing Medical Data with AWS Terraform,"I am requesting guidance on securing medical data within AWS Terraform. Could you provide best practices to ensure security compliance for sensitive medical information? I would greatly appreciate recommendations on how to configure AWS Terraform to meet regulatory requirements, specifically focusing on encryption, access controls, and auditing. Your timely assistance would be greatly appreciated. I look forward to hearing from you soon.","I would be happy to provide guidance on securing medical data within AWS Terraform. For encryption, access controls, and auditing, I recommend enabling AWS Key Management Service, configuring IAM roles, and using AWS CloudTrail. I will send a detailed guide. If you would like to discuss this further, please let me know a convenient time to call.",Request,Human Resources,low,en,400,Security,Compliance,IT,Tech Support,Documentation,,,
Notwendige Unterstützung für Sicherheitsprobleme,"Erleidet Datenverletzungen, bei denen medizinische Patientendaten durch IT-Sicherheitsprobleme betroffen sind, was ein schlechtes Produktintegrationsszenario verursacht hat. Trotz Anwendung von Patches, durchgeführt Sicherheitsscans und Systemneustarts bestehen die Probleme weiterhin. Wir benötigen dringend Hilfe, um Schwachstellen zu beheben und sensible Informationen zu schützen.","Kontaktieren Sie dringend für Unterstützung bei den Sicherheitsproblemen, die das Unternehmen betreffen. Verstehe die Schwere der Situation und die Bedeutung des Schutzes sensibler Patientendaten. Um Ihnen besser zu helfen, möchte ich mehr Informationen zum Produktintegrationsszenario und spezifischen Sicherheitsproblemen sammeln, da wir derzeit nur begrenzte Details haben. Könnten Sie bitte mehr Details zu den Anwendungspatches, Sicherheitsscans und Systemneustarts geben, die bereits durchgeführt wurden? Wir planen ein Telefonat, um die Angelegenheit zu besprechen. Es wäre möglich, uns in der nächsten Zeit zu kontaktieren und ein Telefonat zu vereinbaren. Bitte geben Sie uns an, wann Sie verfügbar sind.",Problem,Product Support,high,de,400,Security,Bug,Performance,IT,Tech Support,,,
Marketing Agency Struggling with Low Engagement and Digital Strategies for Brand Growth,"Our analysis of the campaign metrics has revealed that inadequate audience targeting and ineffective content might be the causes of low engagement. By adjusting the social media posting times, we have seen significant improvements. To further identify the root cause and implement effective solutions, a detailed discussion is needed. Could you please provide a convenient time for a call at <tel_num> so we can discuss the issue in detail, ask relevant questions, and gather necessary information?","Understand that the marketing agency is facing challenges with low engagement through digital strategies aimed at brand growth. To better assist, a call is needed to discuss the issue in detail. Please provide a convenient time for a call at <tel_num>. The call will allow us to ask questions, gather information, and review the campaign metrics and the adjustments made so far. This will help us identify the root cause of the issue and provide effective solutions to improve engagement and achieve brand growth.",Problem,Technical Support,low,en,400,Feedback,Sales,Performance,Documentation,,,,
Probleme bei Systemcrashes,Viele Nutzer stoßen auf Systemcrashes und diese beeinträchtigen die Projektoverwaltungstools.,"Wir werden das Systemcrash-Problem untersuchen. Da die Projektoverwaltungstools betroffen sind, werden wir schnell eine Aktualisierung bereitstellen, um das Problem für die Benutzer zu lösen.",Incident,Technical Support,high,de,400,Bug,Crash,Performance,IT,Tech Support,,,
,"Noted the unexpected decline in investment returns, which may be due to outdated analytics models. We have recalibrated the existing models and analyzed recent market trends.","Acknowledging the unexpected decline in investment returns and appreciating the recalibration of the existing models and market trend analysis. We will review any updates and assess their impact on the portfolio, and we will provide you with information and recommendations.",Incident,Returns and Exchanges,low,en,400,Performance,Feedback,Documentation,,,,,
Rechnungsunterschied,"Es gibt einen Rechnungsunterschied in unserer Rechnung, die angezeigten Kosten sind unkorrekt. Die Kundenbetreuung hat die Kontoinformationen überprüft, aber das Problem behält sich bestehen. Bitte benötigen Sie unsere Unterstützung, um dies zu lösen.","Wir entschuldigen uns für den Rechnungsunterschied und danken Ihnen für Ihre Aufmerksamkeit. Wir werden zusammen mit der Kundenbetreuung die Kontoinformationen prüfen, um das Problem so schnell wie möglich zu lösen. Bitte lassen Sie uns die Aktualisierung der korrigierten Rechnung informieren. Wir schätzen Ihre Geduld und bemühen uns darum, das Problem zu lösen. Kontaktieren Sie uns für die Aktualisierung der Rechnung.",Incident,Billing and Payments,high,de,400,Billing,Account,Refund,Support,,,,
Services for Securing Medical Data,"Customer Support, seeking information on service offerings for securing medical data within hospital systems. Would like to know the types of security measures provided, such as encryption and access controls. Also, interested in the experience of the service in working with healthcare organizations and the relevant certifications and compliance standards they meet. Additionally, would like a detailed breakdown of the pricing and package deals offered. Looking forward to hearing back on how these services can help protect sensitive information.","Dear [Name], thank you for your inquiry regarding our medical data security services. We offer encryption, access controls, and other security measures to protect sensitive medical information. Our team has extensive experience working with healthcare organizations and meets relevant certifications and compliance standards. For detailed pricing and package information, we would be happy to discuss over the phone at your convenience. Please let us know a suitable time to call, or we can also send a detailed breakdown via email.",Request,Customer Service,low,en,400,Security,IT,Tech Support,Feedback,Documentation,,,
Datenprobleme," Schwierigkeiten bei der Datenzugriffsermächtigung für die Sicherung der Medikationsdatenverwaltung aufgrund von Server-Konfigurationsfehlern und Softwarekompabilitätsproblemen. Versucht, Netzwerkgeräte zu resetten und Sicherheitssoftware neu zu installieren, ohne dass sich das Problem löste. Dringend Hilfe benötigt, um das Problem zu lösen und die Integrität unserer Medizindaten zu gewährleisten.","Antwort auf die E-Mail bezüglich der Datenprobleme und der sicheren Medikationsdatenverwaltung, die erlitten wurden. Verstehe die Dringlichkeit dieser Angelegenheit und die Bedeutung, sicher und intakt Medizindaten zu garantieren. Um besser helfen zu können, bitte mehr Informationen zu den Server-Konfigurations- und Softwarekompabilitätsfehlern geben. Bitte geben Sie mehr Details zu den Fehlermeldungen und den Schritten, die bis jetzt unternommen wurden. Es ist notwendig, eine geeignete Anrufzeit zu vereinbaren, um das Problem zu diskutieren und eine Lösung zu finden. Geben Sie bitte eine geeignete Anrufzeit <tel_num> an, damit ich mit Ihnen Kontakt aufnehmen kann.",Problem,Product Support,medium,de,400,Bug,Hardware,Network,Security,IT,Tech Support,,
Concern with Project Management SaaS,"Customer Support, we are encountering major latency issues with our project management SaaS, which might be due to network misconfiguration or insufficient bandwidth. Steps already taken include rebooting the Aruba switch, resetting the Google Nest WiFi, and optimizing Redis configurations, but the issue remains unresolved and is impacting productivity. We would greatly appreciate a prompt review and solution. Please provide guidance on how to resolve this issue. If further details are needed, please let us know.",Received your email regarding the issue with the project management SaaS. We will investigate this matter urgently. Please provide your account number so we can discuss the details over a good call and explore possible solutions.,Problem,Technical Support,high,en,400,Performance,Network,Disruption,IT,Tech Support,,,
Problem with Video Rendering in Final Cut Pro X,"Video rendering in Final Cut Pro X is failing due to insufficient memory and software conflicts. I have restarted and updated the drivers, but the issue still persists. Please help me resolve this problem so that I can get video rendering working again.",We will assist with the video rendering issue in Final Cut Pro X. Please provide your system specifications and any error messages you are receiving so we can troubleshoot the problem.,Problem,IT Support,medium,en,400,Bug,Performance,Hardware,IT,Tech Support,,,
,"Customer Support, we are writing to request the implementation of enhanced data analytics features to improve investment optimization and decision-making efficiency. This would involve the development of advanced algorithms and models to analyze market trends and provide actionable insights. The goal is to enable informed decision-making and drive business growth. We believe this feature would be a valuable addition to the platform and look forward to hearing back soon. Thank you for your time and consideration.","<name>, thank you for reaching out with your request for enhanced data analytics features to improve investment optimization and decision-making efficiency. We appreciate your feedback and are constantly looking for ways to improve our platform. The development of advanced algorithms and models to analyze market trends and provide actionable insights is an interesting idea, and we would like to explore it further. Could you please provide us with more details about your proposal so we can better understand your specific requirements? We look forward to discussing this with you in more detail.",Change,Product Support,high,en,400,Feature,Feedback,Performance,Documentation,,,,
Frequent System Failures in SaaS Project Management Tool,"We are encountering frequent system failures with the SaaS project management tool, which are disrupting our workflows. Recent updates to Camtasia Vagrant might be the cause.","We sincerely apologize for the inconvenience caused by the frequent system failures in the SaaS project management tool. We will investigate this further. Could you please provide details on the error messages and the exact timing of the crashes? Additionally, we will need your account number to identify the issue and may call you at the earliest convenience to discuss further.",Problem,IT Support,high,en,400,Bug,Performance,Outage,Disruption,IT,Tech Support,,
Concerns Raised About Marketing Campaign Engagement,"Dear Customer Support, recently our marketing campaign did not achieve the anticipated engagement. This might be due to insufficient audience targeting. After reviewing the campaign analytics and adjusting the messaging, we noticed some improvement, but the campaign's performance still doesn't meet expectations. We believe a comprehensive analysis of the targeting strategy is necessary to identify the root cause of the issue. Could you assist us in reviewing the campaign settings and providing guidance to better target our audience?","Thank you for reaching out to us regarding the issue with the marketing campaign engagement levels. We understand that despite reviewing the campaign analytics and adjusting the messaging, the performance still does not meet expectations. We would be happy to assist in reviewing the campaign settings and provide guidance to better target the audience. Please proceed by providing details on the current targeting strategy and any specific adjustments made so far. Additionally, it would be helpful to know the type of campaign you are running.",Problem,Returns and Exchanges,high,en,400,Feedback,Performance,Documentation,Sales,IT,,,
Request for Detailed PyCharm Integration Information,Is it possible to receive comprehensive details on the integration with PyCharm Professional 2021.1 SaaS for project management?,"I can provide integration details for PyCharm Professional 2021.1 SaaS platform. Please visit the documentation website for more information. I prefer to discuss this via a call; my number is <tel_num>. Alternatively, you can send an email.",Request,Customer Service,high,en,400,Feature,Documentation,IT,Tech Support,,,,
