subject,body,answer,type,queue,priority,language,version,tag_1,tag_2,tag_3,tag_4,tag_5,tag_6,tag_7,tag_8
PyTorch Data Analytics,"Könnten detaillierte Anleitungen zur effektiven Nutzung von PyTorch für Datenaufbereitung, Optimierung und Investitionen bereitstellen, um informierte Entscheidungen zu treffen und die Rendite zu maximieren? Ich würde Ihre Unterstützung sehr schätzen.","Wir freuen uns, Anleitungen zur Nutzung von PyTorch für Datenaufbereitung, Optimierung und Investitionen zu geben. Um Ihnen besser zu assistieren, könnten Sie bitte mehr Informationen über Ihr aktuelles Setup und spezifische Ziele geben. Ich kann individuelle Vorschläge machen und relevante Ressourcen empfehlen. Falls Sie möchten, können wir einen Anruf vereinbaren (<tel_num>), um diese Angelegenheit weiterzudenken. Bitte stellen Sie sicher, dass eine passende Zeit für den Anruf (<acc_num>) für Sie frei ist, und ich werde dann gerne über PyTorch-Datenaufbereitung sprechen.",Request,Billing and Payments,high,de,400,Documentation,Feedback,Product,Feature,,,,
Enhancing Investment Data Analytics,"Could you provide more details on optimizing investment data analytics products, similar to those found at Codecademy Elasticsearch? I'm interested in learning data analytics to better inform my investment decisions and improve returns. Specifically, I would like to know about the tools and techniques used to analyze data and make predictions about future market trends.","I would be happy to discuss optimizing investment data analytics. Please provide some information about your current investment goals, and we can discuss the tools and techniques used to analyze data and make predictions about future market trends during a convenient call.",Request,Returns and Exchanges,medium,en,400,Feature,Feedback,Product,Tech Support,,,,
Verbessern von Digitalen Marketingstrategien mit ClickUp,Könnten Sie bitte mehr Details zur Verbesserung der digitalen Marketingstrategie mit ClickUp bereitstellen? Vielen Dank für Ihre Unterstützung!,"Sehr geehrte [name], vielen Dank für Ihre Nachricht. Sie möchten Ihre digitale Marketingstrategie mit ClickUp verbessern. ClickUp dient als zentrale Arbeitsumgebung für die Kooperation des Teams, die Automatisierung von Aufgaben und das Projektmanagement. Ich freue mich, Ihnen näher zu erläutern, wie ClickUp Ihnen helfen kann. Sollten Sie ein Telefonat über [tel_num] ermöglichen, gerne gebe ich Ihnen mehr Informationen. Bitte geben Sie mir einen geeigneten Zeitpunkt, wenn Sie sich melden möchten.",Request,IT Support,medium,de,400,Feedback,Product,Feature,Sales,,,,
Request for Updating Digital Marketing Strategies Online,"Dear support team, I am requesting an update to our digital marketing strategies to enhance brand growth and engagement across online platforms. This will involve analyzing our current online presence, devising new plans to improve reach and customer interaction. I believe this would greatly benefit the company, and I look forward to hearing from you.","Dear [Name], thank you for reaching out to the support team regarding the update of your digital marketing strategies to enhance brand growth and engagement online. We appreciate your interest in improving your online presence and customer interaction. To better understand your current situation and provide effective solutions, could you please provide details on your current digital marketing efforts and specific areas where you would like to improve? This information will help us analyze your online presence and devise new strategies. ",Change,IT Support,high,en,400,Feedback,Sales,IT,Tech Support,,,,
Data Analytics in Investment Strategies,Enhancing investment approaches through data analytics,Thank you for your interest in using data analytics for investment strategies. We would be pleased to discuss this further. Could you please share more details about your current investment goals and any challenges you are facing? We would be happy to schedule a call at a convenient time to explore potential solutions that meet your needs. Please let us know a suitable time to contact you at <tel_num>.,Request,Product Support,medium,en,400,Feedback,Sales,Lead,Documentation,,,,
Fehler bei Investment-Optimierung heutetagig aufgetreten,Investment-Optimierung-Fehler mit falscher Analyse-Ausgabe gemeldet,"Sehr geehrte/r [name], bedauere, dass Sie einen Fehler in der Investment-Optimierung mit einer falschen Analyse-Ausgabe erlebt haben. Könnten Sie bitte mehr Details zum Fehler geben und die Schritte, die Sie eingeschlagen haben, zur Reproduktion des Fehlers? Ich möchte den Fehler genauer untersuchen. Es wäre in Ordnung, Sie anzurufen und das Problem ausführlich zu besprechen, um eine Lösung für Konto-Nr. [acc_num] zu finden. [tel_num]",Incident,Returns and Exchanges,high,de,400,Bug,Performance,Feature,Feedback,,,,
,"Beobachtet niedrige Beteiligungsraten in digitalen Kampagnen, was auf Änderungen in den Algorithmen und uneffektiven Zieleinschränkungen zurückzuführen sind. Ergebnisse sind weiterhin unzufriedenstellend.","Verstehe Ihre Sorge bezüglich der niedrigen Beteiligungsraten in digitalen Kampagnen, die auf Algorithmenänderungen und uneffektiven Zieleinschränkungen zurückzuführen sind. Um die Ergebnisse zu verbessern, empfehle ich Ihnen, Ihre aktuelle Zieleinschränkungsstrategie anhand der neuesten Algorithmen-Updates anzupassen. Bitte geben Sie mehr Details zu Ihren aktuellen Kampagnen, einschließlich der verwendeten Zieleinschränkungsoptionen und der Werbung, um konkretere Ratschläge zu geben. Wenn Sie möchten, können wir telefonisch einen geeigneten Zeitpunkt für eine Diskussion vereinbaren, sagen Sie mir, wann Sie verfügbar sind.",Incident,Product Support,low,de,400,Feedback,Performance,Feature,,,,,
Guide on Integrating DocuSign SaaS,"Customer Support, inquiring about integrating the DocuSign project management SaaS. Could you provide information on the integration process, its benefits, requirements, and necessary setup steps? I would greatly appreciate any resources or guidance to help me get started. Thank you for your time and assistance. I look forward to hearing from you soon.","Dear [Name], we can guide you on integrating DocuSign SaaS, which offers benefits such as streamlined workflows and enhanced security. We will provide you with documentation and setup instructions. Please let us know if you need a call to discuss further.",Request,Product Support,low,en,400,Documentation,Feature,Feedback,IT,Tech Support,,,
,"Dear Customer Support, I am inquiring about the payment options for the SaaS project management software. Could you provide detailed information on the available plans, payment methods, and any potential discounts for long-term commitments? I am particularly interested in understanding the pricing structure that is tailored to meet my specific needs. Additionally, I would appreciate any information on free trials or demos that might be available. Thank you for your time and assistance. I look forward to hearing back soon.","Greetings, thank you for reaching out to our customer support team. We appreciate your interest in our SaaS project management software. We offer various billing and payment options, including monthly and annual plans, with discounts available for long-term commitments. We also provide free trials for new customers. We would be happy to discuss the specific information you need and can schedule a call at a convenient time for you. Please let us know a suitable time to reach you at <tel_num>. Thank you.",Request,Billing and Payments,high,en,400,Payment,Sales,Pricing,Feature,,,,
Enhance Data Analytics Infrastructure,Seek assistance in optimizing the data analytics tools infrastructure to make better investment decisions and improve analysis efficiency.,"Dear [name],\n\nI am glad to assist in optimizing your data analytics tools infrastructure. To better understand your current setup and requirements, could you please provide information on the existing tools and infrastructure? This will enable me to provide a tailored solution. Additionally, it would be helpful to know the specific improvements you are looking for, such as faster data processing and enhanced data visualization. If available, I would like to schedule a call at <tel_num> to discuss the next steps for optimization.",Change,General Inquiry,medium,en,400,Feature,Performance,Feedback,IT,Tech Support,,,
Unterstützung für intelligente CPAP-Ausrüstungen,Können detaillierte Dokumentationen und Ressourcen zur Integration von Smart-CPAP-Geräten und Projektmanagement-SaaS bereitgestellt werden? Vielen Dank.,"Sehr geehrte/r [Name], danken Sie für Ihr Interesse an der Integration von Smart-CPAP-Geräten und dem Projektmanagement-SaaS. Sie können detaillierte Dokumentationen und Ressourcen im Support-Bereich unserer Website finden, wo umfassende Leitfäden und API-Dokumentationen verfügbar sind. Wenn Sie weitere Hilfe benötigen, stehen wir Ihnen gerne telefonisch zur Verfügung, um spezifische Anforderungen zu besprechen. Bitte teilen Sie mit, wann ein geeignetes Gesprächstermin für Sie ist, [Telefonnummer].",Request,Technical Support,high,de,400,Documentation,Product,Feature,IT,Tech Support,,,
,"geehrte Kundenservice, ich schreibe Ihnen, um zu melden, dass zeitweise Verbindungsprobleme beim Projektmanagement-Software-as-a-Service (SaaS) bestehen. Die Probleme könnten aufgrund des neuesten Systemupgrades und Serverbelastung entstanden sein. Trotz des Servers neu startens und Caches lösrens blieben die Probleme bestehen. Benutzer haben Schwierigkeiten, die Plattform zu erreichen, und Produktivität wurde beeinträchtigt. Ich schätze, wenn Sie die Angelegenheit dringend zuwenden und mögliche Workarounds zur Lösung der Verbindungsprobleme anbieten könnten. Bitte informieren Sie mich, falls Sie weitere Informationen benötigen.","geehrte <name>, vielen Dank für Ihren Brief und die Anfrage zur Behebung der zeitweilen Verbindungsprobleme beim Projektmanagement-Software-as-a-Service (SaaS). Es tut uns leid, dass trotz unserer Bemühungen, den Server neu zu starten und die Caches zu lösren, die Probleme bestehen bleiben. Die Angelegenheit wird dringend zuwenden, um die Ursache zu festzustellen, die möglicherweise auf die letzten Systemupgrades und Serverbelastung zurückgeht. Um den Fehlerbehebungsprozess zu unterstützen, bitten wir Sie, weitere Details der Fehlermeldung zu teilen, genaue Zeitpunkte zu nennen, zu denen die Probleme auftreten, und uns die genauen Benutzereingaben zur Verfügung zu stellen, die zu den Problemen geführt haben. Zusätzlich wäre es hilfreich, wenn Sie uns weitere Informationen zu diesem Thema zur Verfügung stellen könnten.",Incident,Technical Support,high,de,400,Network,Performance,IT,Tech Support,Bug,,,
Request for Software Update and Optimization,"Customer Support, we are writing to request an update to our software tools for better optimization and digital strategies. This will enable us to enhance our brand growth and increase our efficiency. Our current software is outdated and is hindering our ability to compete in the market. We believe that the right tools and strategies will help us improve our online presence and reach a wider audience. We would greatly appreciate it if you could look into this matter and provide a solution as soon as possible. Please let us know if you need any additional information from me.","Dear [name], thank you for reaching out to us regarding your request for software updates and optimization of digital strategies. We understand the importance of having the right tools to enhance brand growth and increase efficiency. We would be happy to assist you with this matter. To better understand your current setup and provide a tailored solution, could you please provide us with information about your current software and digital strategies? Additionally, it would be helpful to know which specific features and functionalities you are looking to update.",Change,IT Support,low,en,400,Feature,Performance,Feedback,IT,Tech Support,,,
Assistance in Optimizing Investments Using Data Analytics,"Do you require help in optimizing your investments using data analytics tools such as Scikit-learn and Smartsheet? We can provide detailed insights. Please share your current setup and goals, and provide details about the investment data you are working with to achieve your objectives. We are happy to schedule a call at your convenience to discuss further.","We can assist in optimizing your investments using data analytics tools like Scikit-learn and Smartsheet. We can provide detailed insights. Please provide us with information about your current setup and goals, and share the investment data you are working with to achieve your objectives. We are happy to schedule a call at your convenience to discuss further.",Request,Returns and Exchanges,low,en,400,Feedback,IT,Tech Support,,,,,
Frage zur digitalen Strategie-Dienstleistung,"Ich interessiere mich für digitale Strategie-Dienstleistungen und möchte mehr darüber erfahren, um Markenwachstum zu fördern. Könnten Sie mehr Details über die angebotenen Dienstleistungen und deren Vorteile für Unternehmen bereitstellen? Ich wäre sehr erfreut, über Ansätze und Erfolgsgeschichten zu hören.","Ich würde mich gerne über digitale Strategie-Dienstleistungen informieren und einen geeigneten Zeitpunkt vereinbaren, um zurückzurufen. Ich kann Ihnen mehr Details und Erfolgsgeschichten geben. Sollten Sie heute verfügbar sein, erhalten Sie dann einen Anruf? <tel_num>",Request,Product Support,high,de,400,Feedback,Sales,Feature,,,,,
