subject,body,answer,type,queue,priority,language,version,tag_1,tag_2,tag_3,tag_4,tag_5,tag_6,tag_7,tag_8
Multiple System Security Alerts Detected Today,"Customer Support, I am composing a report regarding simultaneous security alerts identified across several network systems. These alerts indicate a potential coordinated cyberattack, raising concerns about possible impacts on data and operations. Our initial response involved running firewall and antivirus scans; however, issues persist. We seek guidance on additional measures to resolve the situation and would appreciate your support recommendations. Could you please advise on further steps or resources available to address this issue?","<name>, thank you for reporting the security alerts across your systems. To assist you more effectively, please provide details about the alerts and the results of the firewall and antivirus scans conducted. Based on this information, we can suggest additional actions or support resources to help resolve the situation. If needed, we can also schedule a call at <tel_num> to discuss the matter further. Please let us know a convenient time for you.",Incident,Technical Support,high,en,52,Security,Network,Outage,Disruption,Alert,Virus,,
SaaS Subscription Billing Information,"Dear Customer Support, I am interested in integrating SaaS solutions with Microsoft Office 365 and WooCommerce. Could you provide detailed information about billing and payment options? I would like to learn about the available plans, pricing structures, and any discounts that may be offered. Additionally, I would appreciate details on how the billing process functions and which payment methods are accepted. Please supply a comprehensive overview of billing and payment options so I can make an informed decision. Thank you for your assistance. I look forward to your response.","<name>, we offer a variety of plans and pricing options for SaaS integration with Microsoft Office 365 and WooCommerce. Please visit our website for detailed information or contact us at <tel_num> to discuss your requirements and receive further details about billing and payment options.",Request,Billing and Payments,high,en,52,Billing,Payment,Subscription,Pricing,Discount,Process,Overview,
Azure Assistance Inquiry,A financial organization encountered delays in data processing that affected their investment analysis. The probable cause was issues with Azure Docker integration. Restarting the services and clearing the cache temporarily resolved the delays.,"We acknowledge the Azure support request concerning data processing delays impacting investment analytics, likely due to problems with Azure Docker integration. Initial measures such as restarting services and clearing caches have been implemented. If the issues continue, please provide detailed logs to assist in resolving the problem.",Incident,Technical Support,high,en,52,IT,Tech Support,Performance,Disruption,,,,
Challenges in Brand Expansion,Marketing approaches are effective despite recent modifications and testing.,"Examining the email concerning brand expansion challenges and the effectiveness of marketing strategies. To better understand the situation, please share details about the adjustments and testing conducted so far. This will enable us to provide customized advice and assistance to address the issue.",Incident,Product Support,low,en,52,Marketing,Brand Expansion,Strategy,Testing,Campaign,,,
Assistance Needed for Data Analytics Tools,"I am reaching out to inquire about data analytics tools that can assist in optimizing investment strategies. Could you please provide detailed information about the types of tools available, such as predictive modeling and portfolio optimization software? I would also appreciate case studies or examples demonstrating how these tools have helped clients achieve their investment objectives. Additionally, do you offer training or support to help users effectively utilize these tools?","<name> offers a range of data analytics tools designed to optimize investment strategies, including predictive modeling and portfolio optimization software. They provide case studies and examples illustrating how these tools have helped clients reach their goals. Support services include dedicated customer support and training. To discuss your specific needs and schedule a convenient call, please let us know a suitable time to reach you at <tel_num>.",Request,Product Support,medium,en,52,Feature,Documentation,Training,Feedback,,,,
Marketing Strategies for LG AMD Products Online,Looking for detailed insights on the digital marketing approach for promoting LG PF50KA AMD Ryzen products online? Interested in learning more about the marketing plan to increase sales and brand awareness.,I am pleased to discuss the digital marketing strategies for promoting LG AMD products online. Please let's schedule a call to provide more details and address any questions you may have.,Request,Customer Service,medium,de,52,Marketing,Strategy,Digital Marketing,Brand Awareness,Sales,Product Promotion,,
Effektive Digitale Marketingstrategien für Markenerweiterung,"Sehr geehrter Kundendienst, ich bin daran interessiert, mehr über digitale Marketingstrategien zu erfahren, um das Wachstum meiner Marke effektiv zu fördern. Könnten Sie bitte detaillierte Informationen zu Taktiken und Techniken bereitstellen, die die Markenbekanntheit steigern und eine größere Zielgruppe erreichen? Ich schätze eine Anleitung zur Erstellung erfolgreicher digitaler Marketingkampagnen, die mit den Geschäftszielen übereinstimmen. Besonders möchte ich mehr über Social-Media-Marketing, E-Mail-Marketing und Suchmaschinenoptimierung erfahren. Bitte fügen Sie Beispiele erfolgreicher digitaler Kampagnen sowie relevante Daten und Statistiken zur Wirksamkeit bei.","Sehr geehrter <name>, wir schätzen Ihr Interesse an digitalen Marketingstrategien zur Markenentwicklung. Gerne stellen wir Ihnen Informationen zu Taktiken und Techniken im Bereich Social Media, E-Mail-Marketing und Suchmaschinenoptimierung bereit. Für eine detailliertere Beratung möchten wir einen Anruf unter <tel_num> vereinbaren, um Ihre Geschäftsziele zu besprechen und die passende digitale Marketingkampagne auf Ihre Bedürfnisse zuzuschneiden.",Request,Technical Support,medium,de,52,Marketing,Strategy,Brand Expansion,Campaign,Growth,Audience,Tactics,Techniques
Systemabstürze,"Sehr geehrter Kundendienst, ich möchte ein Problem mit unserer Projektmanagement-Software melden. Nutzer berichten wiederholt von Abstürzen beim Aktualisieren von Aufgaben. Wir vermuten, dass dies auf einen Konflikt mit einem kürzlich installierten IntelliJ IDEA-Plugin zurückzuführen sein könnte. Trotz Neustarts der Dienste und erneuter Installation des betroffenen Plugins besteht das Problem weiterhin. Bitte um Unterstützung bei der Problemlösung. Die Abstürze beeinträchtigen den Arbeitsablauf erheblich, daher bitten wir um eine Ursachenanalyse und eine entsprechende Lösung.","<name>, vielen Dank, dass Sie sich wegen des Problems mit der Projektmanagement-Anwendung an uns gewandt haben. Wir entschuldigen uns für die Störungen, die Ihren Arbeitsablauf beeinträchtigt haben. Um Ihnen besser helfen zu können, wären detaillierte Angaben zu dem IntelliJ IDEA-Plugin sowie genaue Fehlermeldungen sehr hilfreich. Wir werden die Angelegenheit gemeinsam untersuchen, die Ursache ermitteln und eine Lösung finden. Wäre es in Ordnung, wenn wir Sie unter <tel_num> anrufen, um alles zu besprechen?",Incident,Product Support,medium,de,52,Crash,Software,Performance,Bug,Update,Plugin,,
Medienverstoß,"Sehr geehrter Kundenservice, ich schreibe Ihnen, um Sie über einen verdächtigen Sicherheitsverstoß bei medizinischen Daten des Krankenhauses zu informieren. Erste Überprüfungen und Firewall-Anpassungen wurden bereits durchgeführt, leider konnte bisher keine Lösung gefunden werden. Es wird vermutet, dass der Verstoß entweder auf einen Hacking-Angriff oder eine Fehlkonfiguration unserer Sicherheitssysteme zurückzuführen ist. Wir sind uns der Schwere des Problems bewusst und arbeiten unermüdlich daran, die Angelegenheit so schnell wie möglich zu beheben. Wir möchten Sie versichern, dass wir alle notwendigen Maßnahmen ergreifen, um die sensiblen Patientendaten zu schützen und weiteren unbefugten Zugriff zu verhindern.","<name>, hiermit bestätige ich den Erhalt Ihrer E-Mail bezüglich des verdächtigen Sicherheitsverstoßes bei medizinischen Daten des Krankenhauses. Ich verstehe die Ernsthaftigkeit des Problems und schätze die Bemühungen Ihres Teams, die Situation zu lösen. Um Ihnen weiterhelfen zu können, bitten wir Sie, uns weitere Details zum Vorfall mitzuteilen, beispielsweise das Datum der Entdeckung, die spezifischen Systeme oder Daten, die betroffen sind. Diese Informationen helfen uns, die Lage besser zu verstehen und eine effektivere Unterstützung zu leisten. Falls notwendig, können wir einen Termin unter <tel_num> vereinbaren, um die Angelegenheit persönlich zu besprechen. Bitte",Incident,Technical Support,high,de,52,Security,Disruption,Outage,,,,,
Digital Service Disruption,"Customer support has documented a widespread outage affecting multiple digital products. Initial troubleshooting measures, including system restarts and network diagnostics, failed to resolve the problem. Consequently, an urgent high-priority incident report was filed to prompt immediate technical action. The outage appears to be caused by a server network failure; we request the technical team to investigate this matter promptly. Kindly inform us of the next steps to resolve the issue.","<name>, we apologize for the digital service disruption and appreciate your submission of a high-priority incident report. Our team will promptly review the report and investigate the root cause, which may be related to a server network failure. To assist you more effectively, please provide the incident report number and confirm which products are affected by the outage. Feel free to contact <tel_num> to discuss the next steps and ensure a timely resolution to minimize disruptions. Let us know a convenient time for further assistance.",Incident,Service Outages and Maintenance,high,en,52,Disruption,Outage,Network,Performance,IT,Tech Support,,
Digitale Kampagnen erzielen plattformübergreifend schlechte Ergebnisse,"Die digitalen Kampagnen unserer Marketingagentur erzielen schlechte Resultate auf verschiedenen Plattformen. Wir haben versucht, das Problem zu beheben und Unterstützung zu suchen, doch das Problem besteht weiterhin.","Die digitalen Kampagnen überprüfen, Telefonnummer <tel_num> anrufen, um mögliche Lösungen zu besprechen, und die nächsten Schritte mit der Kontonummer <acc_num> klären.",Problem,Product Support,high,de,52,"Performance,Disruption,Support",,,,,,,
Pricing Plans for Scalability Features,Could you kindly supply comprehensive details regarding the pricing plans for SaaS scalability features?,Please provide information about the pricing plans for SaaS scalability features. Feel free to send a detailed email or schedule a call at your convenience to discuss the available options based on your requirements.,Request,Customer Service,low,en,52,Feature,Scalability,Pricing,Performance,,,,
,"Ich möchte Sie darüber informieren, dass es mögliche Datenlecks in den IT-Systemen des Krankenhauses betrifft. Das Problem scheint mit einem möglicherweise veralteten Sicherheitssystem auf dem NAS-Netzwerkknoten zusammenzuhängen. Erste Scans wurden mit McAfee durchgeführt und aktualisiert, wobei bisher Verstöße bestätigt wurden. Wir nehmen die Angelegenheit ernst und überwachen die Situation weiterhin. Weitere Updates werden bei Bedarf bereitgestellt.","Sehr geehrter <name>, vielen Dank, dass Sie uns über die mögliche Datenexposition in den Krankenhaus-IT-Systemen informiert haben. Wir verstehen, dass erste Scans mit McAfee durchgeführt und aktualisiert wurden. Für weitere Untersuchungen und Sicherheitsmaßnahmen benötigen wir Ihre Unterstützung. Bitte lassen Sie uns wissen, wenn wir helfen können. Wir sind hier, um die Sicherheit der Systeme zu gewährleisten. Wenn Sie das Thema besprechen möchten, teilen Sie uns bitte eine passende Zeit mit. Sie können uns unter <tel_num> anrufen, um entsprechend zu unterstützen.",Incident,Sales and Pre-Sales,low,de,52,Security,Outage,Disruption,Recovery,,,,
Report of Security Breach Incident,"A security breach has taken place, resulting in the compromise of medical data systems. An initial vulnerability assessment was conducted, and password reset attempts were made.",The incident is being investigated promptly,Incident,Technical Support,high,en,52,Security,Vulnerability,Incident,Alert,,,,
Inquiry About Billing Data Integration,"Customer support team, I am reaching out to inquire about the options for integrating billing information between Microsoft SQL Server 2019 and Zoho CRM. Could you please provide detailed details on how to connect these two systems? I would also appreciate information about the costs involved in the integration process. Thank you for your time and assistance. I look forward to your prompt response.","<name> replying to your email regarding billing data integration options between Microsoft SQL Server 2019 and Zoho CRM. To provide precise information, I need to understand your current setup requirements. Could you please share details about your existing infrastructure and what you aim to achieve with the integration? Regarding the costs, they will depend on the complexity of the setup and the services needed. We offer various integration solutions and would be happy to discuss the options in detail.",Request,Billing and Payments,medium,en,52,Billing,Integration,Customer Support,Cost,Assistance,Prompt Response,,
Problem with SaaS Platform,"Customer Support reports a problem with a scalable SaaS platform used for writing reports. The platform is experiencing sporadic outages, which are impacting project management features. Initial investigations indicate that the issue might be related to indexing errors in Elasticsearch 7.13. Attempts to restart the Elasticsearch service and clear caches have been unsuccessful. The outages are significantly disrupting operations, and immediate assistance is required to resolve the problem. Please provide guidance on troubleshooting and fixing Elasticsearch.","<name>, thank you for contacting us regarding the SaaS platform issue. We apologize for the inconvenience caused by the intermittent downtime. To assist in resolving the Elasticsearch 7.13 indexing errors, please provide detailed information about the platform configuration and the specific error messages encountered. Kindly share a detailed description of the errors at <acc_num>. We would also like to schedule a call at your earliest convenience to discuss the issue and offer troubleshooting guidance to prevent future occurrences.",Incident,Technical Support,medium,en,52,Bug,Outage,Performance,Disruption,Recovery,IT,Tech Support,
Access Data Error,"Healthcare provider encountered data access issues across multiple devices and software, potentially caused by conflicts in security protocols. Recent security updates may have disrupted integrations, leading to problems with Eclipse IDE, Excel, and scanner functionalities.",We received an email regarding data access errors possibly resulting from security protocol conflicts. We would be happy to assist further and discuss the issue in detail. Would a phone call at a convenient time be possible to clarify additional details and discuss the next steps for resolving the problem?,Incident,Product Support,high,de,52,Security,IT,Bug,Performance,,,,
Failures in Data Integration Across Various Tools,The organization encountered issues with data integration among multiple analytics platforms. Recent updates to the software led to compatibility problems. Troubleshooting efforts involved rebooting systems and applying software patches.,"We acknowledge receipt of your email concerning data integration issues across analytics tools following recent software updates. To assist further, could you please share detailed information about the specific tools and updates involved? We can then arrange a call at your convenience to explore potential solutions and compatibility adjustments.",Incident,Technical Support,high,en,52,Bug,Performance,Outage,Disruption,Recovery,Maintenance,,
Problem with Investment Analysis Tool,The investment optimization software terminates unexpectedly during data analysis.,We apologize for the inconvenience caused by the investment optimization tool. Kindly share the specific error message you receive when it crashes. We are happy to assist in resolving this issue and can arrange a call at your convenience to troubleshoot further.,Problem,Technical Support,high,en,52,Bug,Performance,Feature,Documentation,,,,
Meldung eines kritischen Problems im Multi-Produkt-System unserer Marketingagentur,"Bitte melden Sie ein ernsthaftes Problem im Multi-Produkt-System unserer Marketingagentur. Wir erleben wiederkehrende Ausfälle, die die Umsetzung unserer digitalen Strategie erheblich beeinträchtigen. Trotz unserer intensiven Bemühungen konnten wir das Problem bisher nicht beheben. Mögliche Ursachen könnten Softwarekonflikte oder Netzwerkprobleme sein. Wir haben Geräte neu gestartet, Software aktualisiert und die Konfigurationen überprüft, doch das Problem besteht weiterhin. Wir schätzen, dass die Identifizierung der Ursachen uns bei der Entwicklung einer Lösung unterstützen und den reibungslosen Betrieb des Systems wiederherstellen könnte. Vielen Dank im Voraus.","Vielen Dank für Ihre E-Mail bezüglich des kritischen Problems im Multi-Produkt-System. Ich helfe gern bei der Ursachenfindung und der Bereitstellung einer Lösung. Um den Lösungsprozess zu erleichtern, benötige ich möglicherweise zusätzliche Informationen von Ihnen. Könnten Sie bitte weitere Details zu den Fehlermeldungen sowie die bisherigen Troubleshooting-Schritte bereitstellen? Falls notwendig, können wir auch einen Anruf vereinbaren, um das weitere Vorgehen zu besprechen. Bitte teilen Sie mir eine passende Zeit mit, unter <tel_num> anzurufen.",Incident,IT Support,high,de,52,Bug,Outage,Disruption,Network,Software,Hardware,,
Performance Challenges with the System,"Customer Support, I am highlighting ongoing performance problems that our company is facing across several products. These issues appear to originate from system conflicts. Our initial troubleshooting included system restarts and basic diagnostic tests. However, despite these efforts, the problems continue, and we are unable to determine the underlying cause. These performance challenges are impacting overall productivity and efficiency, making it urgent to find a resolution. We would appreciate any guidance or support you can provide to assist us.","<name>, thank you for reaching out regarding the performance issues your company is experiencing. We understand how this impacts your productivity and efficiency. To better assist you, please provide details about the specific products affected, along with the exact errors or symptoms observed. It would also be helpful to know the results of any basic diagnostics performed so far. If needed, we can schedule a call at a convenient time to discuss this further. Please let us know a suitable time to contact you at <tel_num>.",Incident,Technical Support,low,en,52,Performance,Bug,System,Troubleshooting,Issue,,,
Schneller Support erbeten,"Sehr geehrter Kundenservice, ich möchte einen Fehler bei mehreren Produktintegrationen melden, darunter JIRA, RapidMiner, SQL Server, die nicht ordnungsgemäß synchronisieren. Dies beeinträchtigt das digitale Kampagnenmanagement. Das Problem scheint durch kürzliche Updates verursacht worden zu sein, die Konflikte mit Express.js und der Microsoft Office-Kompatibilität verursachen. Ich habe versucht, das Problem durch Rollbacks der Updates und Neustarts der betroffenen Systeme zu beheben, doch die Probleme bestehen weiterhin. Ich würde es sehr schätzen, wenn Sie die Angelegenheit schnellstmöglich prüfen und eine Lösung finden könnten. Bitte lassen Sie mich wissen, falls Sie weitere Informationen benötigen.","Sehr geehrter <name>, vielen Dank, dass Sie das Problem mit fehlerhaften Produktsynchronisierungen gemeldet haben. Ich verstehe die Auswirkungen auf das digitale Kampagnenmanagement. Um die Angelegenheit zu untersuchen, benötige ich möglicherweise zusätzliche Informationen. Bitte stellen Sie weitere Details zu den Fehlermeldungen sowie die kürzlich durchgeführten Updates bereit. Ich werde einen Anruf zu Ihrer frühestmöglichen Verfügbarkeit planen, um die Angelegenheit zu besprechen. Teilen Sie mir bitte eine passende Zeit mit, unter <tel_num> anzurufen.",Problem,Technical Support,high,de,52,Customer Service,Product Integration,Compatibility,Update,System Issue,Support Request,Rapid Resolution,
Request for Software Update,Require assistance with updating to ensure smooth integration and management.,We have received your request for a software update to support seamless integration and management. Your request has been escalated to the development team. Please expect us to contact you within the next 24 hours to discuss the details and provide a resolution.,Change,Returns and Exchanges,high,en,52,Feature,IT,Tech Support,,,,,
Report on Data Breach Incident,"Customer Support, I am composing a report regarding a serious incident involving a data breach at a healthcare provider. A suspected phishing attack occurred, leading to the exposure of sensitive medical information. Immediate steps have been taken, including password resets and malware scans to contain the breach. However, I need assistance to ensure that security systems effectively safeguard patient data. I would appreciate guidance on additional measures we should implement to prevent similar incidents in the future. Thank you.","<name> acknowledges receipt of your email concerning the data breach incident at the healthcare provider and appreciates the prompt actions taken, such as resetting passwords and scanning for malware to contain the breach. We recognize the seriousness of the situation and the importance of protecting sensitive medical information. To further ensure security and prevent future incidents, we recommend conducting a comprehensive investigation to determine the full extent of the breach, as well as implementing additional security measures such as multi-factor authentication and employee training.",Problem,Technical Support,medium,en,52,Security,Data Breach,Malware,Outage,,,,
Simultaneous Failure of Multiple Software and Hardware Products During Development,"Problem: Several software and hardware products are failing concurrently during development, potentially due to system overload or compatibility issues. Efforts such as rebooting, updating drivers, and reinstalling the affected software have been attempted as solutions.","We are investigating the issue with multiple software and hardware products failing during development. To assist you more effectively, please provide detailed information about your system configuration and the specific error messages you are encountering. To discuss this further and work towards a resolution, please schedule a call at your convenience using account number <acc_num>.",Problem,IT Support,high,en,52,Bug,Hardware,Performance,Outage,Disruption,Recovery,,
Data processing system encountered a total malfunction,The system was not able to optimize investments efficiently.,We apologize for the issue with the data processing system. Could you please provide details on the error you are experiencing so we can assist in optimizing your investments account <acc_num>?,Incident,Technical Support,medium,en,52,Bug,Crash,Performance,Outage,Disruption,,,
Current Disruptions in Digital Tools,Experiencing interruptions in workflow caused by tool outages.,We apologize for the inconvenience caused by the tool failures. We are investigating the issue. Please provide additional details and error messages you have received. Contact <tel_num> for prompt assistance in resolving the problem.,Incident,Technical Support,high,de,52,Disruption,Outage,Digital Tools,Workflow,,,,
Unterstützung beim Schutz sensibler medizinischer Daten,"Sehr geehrter Kundendienst, ich bitte um Informationen zu bewährten Methoden zum Schutz medizinischer Daten bei WhatsApp Desktop und Krankenhausinformationssystemen. Medizinische Daten sind äußerst sensibel und erfordern sorgfältige Handhabung sowie sichere Speicherung. Ich würde gerne Ratschläge erhalten, wie Vertraulichkeit, Integrität und Verfügbarkeit der Daten sichergestellt werden können. Besonders interessiere ich mich für Verschlüsselungstechniken, Zugriffskontrollmaßnahmen und Backup-Verfahren zum Schutz der medizinischen Informationen. Zudem möchte ich mehr über regulatorische Compliance-Anforderungen erfahren, die bei der Handhabung solcher Daten zu beachten sind.","Kontaktieren Sie uns, um bewährte Verfahren zum Schutz medizinischer Daten zu besprechen",Request,Human Resources,low,de,52,Security,Data Protection,Healthcare,Confidentiality,Encryption,IT,Tech Support,
