subject,body,answer,type,queue,priority,language,version,tag_1,tag_2,tag_3,tag_4,tag_5,tag_6,tag_7,tag_8
Verletzung der Datenbindungssicherheit,"Es wurde eine Verletzung der Datenbindungssicherheit bei den medizinischen Akten festgestellt. Dies hängt mit einem Fehler in den Sicherheitsstellungen der alten Software zusammen. Durch die Aktualisierung auf PostgreSQL, die Implementierung von Firewallregeln und die Änderung von Benutzerzugriffskennwörtern wurde das Problem behoben.","Wir bestätigen die Verletzung der Datenbindungssicherheit und danken für die unternehmenen Maßnahmen zur Behebung des Problems. Bitte überprüfen Sie den Vorfall und geben Sie uns Ratschläge, wie wir die Sicherstellung der medizinischen Akten verbessern können. Geben Sie uns bitte Bescheid, wenn Sie Unterstützung benötigen.",Problem,Customer Service,medium,de,400,Security,Bug,IT,Tech Support,,,,
Enhanced Security for Medical Data Protection,"It is essential to implement advanced security protocols to safeguard the medical data protection infrastructure in the hospital setting. This must guarantee the confidentiality, integrity, and availability of sensitive patient information. The measures should encompass data encryption, secure authentication methods, and access control mechanisms. Regular security audits and staff training are crucial for preventing breaches and sustaining patient trust.","Thank you for your email concerning the implementation of enhanced security measures for medical data protection within the hospital environment. We will review the current infrastructure to ensure it meets the necessary standards for protecting sensitive patient information. This includes data encryption, secure authentication, and access controls. We will also schedule regular security audits and provide staff training to prevent breaches and maintain patient trust. Please contact us at <tel_num> to discuss the implementation details and provide a timeline for completion.",Change,Returns and Exchanges,medium,en,400,Security,Performance,Documentation,,,,,
Significant Issue with Hospital IT System,"Dear Customer Service,\nWe would like to report a critical issue with the hospital's IT system. Unauthorized access has been detected, and outdated security protocols are suspected. Despite our attempts to update the software and enhance firewall settings, the problem persists. We appreciate your support in resolving this issue to ensure the integrity and security of the system.",Please call <tel_num> to discuss the IT system issue and arrange a suitable meeting for further assistance.,Incident,Product Support,medium,de,400,Security,Bug,IT,Tech Support,Performance,,,
Leistungsschwierigkeit bei Datenanalyse-Software,"Die Datenanalyse-Software stürzt während Hochlastzeiten ab, obwohl Investitionen zur Optimierung unterbrochen wurden. Nach der letzten Softwareaktualisierung ist die Serverbelastung zurückgegangen. Das Tool wurde neu gestartet, die Serverleistung wurde überwacht und Cache-Clearing durchgeführt, jedoch blieben die Probleme bestehen. Wir freuen uns, eine schnelle Lösung zu finden. Bitte geben Sie uns weitere Informationen, falls erforderlich, um das Problem zu lösen.","Sehr geehrte(n) [Name],\n\nich möchte Sie informieren, dass ich den E-Mail-Bericht über die Leistungsschwierigkeit bei der Datenanalyse-Software erhalten habe. Entschuldigen Sie bitte die Unterbrechungen, die Investitionsoptimierung verursacht hat. Um das Problem genauer zu untersuchen, benötige ich zusätzliche Informationen. Könnten Sie bitte den genauen Fehlerhinweis und den Zeitstempel der Problematik bereitstellen? Darüber hinaus würde ich gerne ein Telefonat vereinbaren, um eine Lösung zu finden. Bitte teilen Sie mir geeignete Zeitfenster für den Anruf mit dem Nummern [Tel Nummer] mit, oder geben Sie alternative Vorschläge an.\n\nVielen Dank für Ihr Verständnis und die Unterstützung.\nMit freundlichen Grüßen",Incident,Technical Support,high,de,400,Performance,IT,Tech Support,Maintenance,,,,
Detected Unauthorized Access Attempt to Medical Data Systems,"An unauthorized access attempt has been detected on our medical data systems, likely due to outdated software and network vulnerabilities. Although we have reviewed our security protocols and configurations, deficiencies still exist. Immediate actions taken include updating software patches and changing passwords on affected devices to prevent breaches and ensure data protection.",<name> received the report regarding the unauthorized access attempt on the medical data systems. We understand the gravity of the situation and appreciate the immediate actions taken to update software patches and change passwords on affected devices. We would like to schedule a thorough review of the network vulnerabilities and security protocols to assist in identifying and addressing existing deficiencies. We would be happy to discuss this further at your earliest convenience. I am available.,Incident,Technical Support,high,en,400,Security,Network,Bug,Performance,IT,Tech Support,,
Support Request for Digital Strategy Information,"Dear Customer Support, I am reaching out to request information on digital strategies for boosting brand size. Could you provide guidance on methods and techniques to enhance brand awareness and engagement? I am particularly interested in the approach to social media marketing, content creation, and partnerships with influencers. Additionally, I would appreciate any insights on how to measure the success of digital campaigns and the metrics to evaluate their effectiveness. Looking forward to your response and hope to hear back soon. Please provide instructions on how to schedule a call for further details on these methods and techniques.",Please allow us an appropriate time to call you so we can discuss the methods and techniques for digital strategies in more detail.,Request,Product Support,medium,de,400,Feedback,IT,Tech Support,,,,,
Issues with Analytics Dashboards,Analytics Dashboard has updated metrics.,Investigate the Analytics Dashboard issue. Please provide more details about the metrics and their updates for further support.,Incident,Product Support,low,de,400,Bug,Performance,Documentation,Feedback,IT,Tech Support,,
Notification of Security Incident for Customer Support,"Customer Support, please note a security incident has been reported where potentially sensitive medical data within hospital systems might have been exposed. This issue could be due to outdated software vulnerabilities or misconfigured settings. We have attempted to reset security protocols and applied available patches, but the issue persists. We kindly request your assistance in resolving this matter as soon as possible to ensure the security integrity of our systems. Please inform us of the next steps to be taken. Thank you.","Thank you for reporting the security incident to us. We take this matter very seriously and are committed to resolving it promptly. To better assist you, we need more details on the outdated software and misconfigured settings mentioned. Could you please provide us with a detailed description of the incident and the steps you have taken so far? We would also like to schedule a call to discuss this further. I am available at <tel_num> at your convenience. Our goal is to resolve the issue as soon as possible to ensure the security integrity of systems specifically <acc_num>. Thank you.",Incident,Technical Support,high,en,400,Security,Notification,IT,Tech Support,Bug,Performance,,
Enhancing Investment Techniques,"Customer Support, seeking advice on optimizing investment strategies using Wolfram Mathematica within a data analytics framework. Interested in leveraging Wolfram Mathematica to enhance investment decisions. Would like to know if it can integrate with our current data analytics workflow and provide insights. Appreciate any guidance on how to start using Wolfram Mathematica for investment strategy optimization. Also, would like to know about specific tools.",Review your inquiry and contact us at <tel_num> to discuss integrating Wolfram Mathematica into your data analytics workflow and receive guidance on optimizing investment strategies.,Request,Technical Support,medium,en,400,Feedback,IT,Tech Support,,,,,
Support Security Issue,"Experienced unauthorized access attempts on medical data systems. This may be due to outdated security protocols. After updating passwords and reviewing access logs, concerns still persist. The issue is causing disruptions to operations and urgent assistance is needed to resolve it. Could you please look into the matter and provide a solution or guidance to improve security measures?","Writing an acknowledgment email regarding the security issue on medical data systems, I assure you that we will take the matter seriously. Understanding the importance of maintaining the security and integrity of our systems, especially given the sensitive nature of the data contained, is crucial. To better assist you, could you please provide details on the unauthorized access attempts, including the dates and times they occurred, and any relevant information from the access logs that have been reviewed. Knowing the specific security concerns will be very helpful.",Problem,Product Support,medium,en,400,Security,Bug,Disruption,IT,Tech Support,,,
Problems with Device Connectivity,"Facing connectivity issues with several devices and services, such as the Kodak ScanMate i940, as a result of recent updates or network changes. So far, I have restarted the affected devices and checked the firewall settings. I would greatly appreciate your help in resolving this issue, which is impacting my productivity.","<name>, I am writing to acknowledge your email regarding connectivity issues with multiple devices and services. To better assist you, could you please provide more details on the recent updates or network changes you made, as well as any specific error messages you are receiving? I would like to schedule a call to troubleshoot this issue; I am available at <tel_num> for your convenience. Alternatively, please let me know a suitable time that works for you to contact you. Thank you for your assistance in resolving this issue and restoring your productivity as soon as possible.",Incident,Technical Support,medium,en,400,Network,Performance,IT,Tech Support,,,,
Sicherheitslücke-Fall,"Es gibt eine Sicherheitslücke im IT-System des Krankenhauses, die medizinische Daten preisgibt. Der wahrscheinliche Ursprung der Schwachstelle könnte im Software-Code liegen, insbesondere in iTunes und Adobe Creative Cloud. Wir versuchen, das Software-Problem zu beheben, aber das Zugriffssteuerungssystem zeigt immer noch Unregelmäßigkeiten auf. Wir benötigen Ihre Hilfe, um das Problem so schnell wie möglich zu lösen.","<name> kann Ihnen bei dem Sicherheitslücke-Fall helfen. Um die Situation besser zu verstehen, wären wir auf mehr Details über die Unregelmäßigkeiten im Zugriffssteuerungssystem gespannt. Wir können gerne telefonisch mit Ihnen verbinden, um die nächsten Schritte zur Lösung des Problems zu besprechen. Bitte geben Sie geeignete Zeitfenster an, damit unser Team die Schwachstelle im Software-Code, einschließlich iTunes und Adobe Creative Cloud, adressieren kann.",Problem,Technical Support,medium,de,400,Security,Bug,IT,Tech Support,,,,
Clarification on AR Brille Integration Compatibility,"Hi Customer Support, I'm writing to inquire about the compatibility of the AR-Brille project management software with other systems. Could you provide detailed information on how these systems can work together seamlessly? I am particularly interested in understanding the technical requirements as well as any potential limitations. Additionally, I would appreciate any documentation or resources that could help me better understand the integration process. I am looking forward to your response as we explore how AR-Brille can enhance our project management capabilities. Thank you for your time and assistance. I am excited to learn more about this innovative solution.","Thank you for reaching out to our customer support team regarding the compatibility of the AR-Brille project management software. We would be happy to provide you with the technical requirements and details about potential limitations. For a seamless integration, please provide us with your account number and any relevant documentation or resources. If needed, we can schedule a call at <tel_num> to discuss this further. We look forward to assisting you as you explore how AR-Brille can enhance your project management capabilities.",Request,Human Resources,low,en,400,Documentation,Feature,IT,Tech Support,,,,
Query on Security Measures for Medical Data on QNAP TS-453D NAS,"Hello Customer Support, I am seeking detailed information on the security features and protocols implemented by the QNAP TS-453D NAS to protect medical data. Specifically, I would like to know about the encryption methods, access controls, and compliance certifications the product offers. I would greatly appreciate any detailed documentation or guidance that could help me better understand these aspects.","Thank you for your inquiry regarding the security measures for medical data on the QNAP TS-453D NAS. The product supports various encryption methods and access controls to protect sensitive data, and it meets several compliance certifications. For detailed information and documentation, please schedule a call at <tel_num> for a further discussion. We are available at your convenience.",Request,Customer Service,medium,en,400,Security,Product,Documentation,IT,Tech Support,,,
Inquiry on Customer Support,Can you provide information on optimizing investments through the use of data analytics services? I am interested in knowing which tools can assist in making informed decisions. Thanks for your assistance.,"<name>, thank you for reaching out to the Service Desk regarding the optimization of investments using data analytics services. The tools we offer provide actionable insights to help make informed decisions. They include detailed analyses of market trends and performance metrics, as well as well-personalized recommendations based on your investment goals. We can discuss services tailored to meet your specific needs and would be happy to schedule a call with one of our experts. Please let us know a convenient time.",Request,Customer Service,medium,en,400,Feedback,IT,Tech Support,,,,,
"System Update, Multiple Software Applications Failed Secure Medical Data","During the system update, several software applications experienced issues with secure medical data. Attempts to reinstall security updates were unsuccessful.","I will draft an acknowledgment email regarding the issue where multiple software applications failed during the secure medical data update. I understand that the security updates reinstallation attempts were not successful. I would appreciate assistance in resolving this matter as soon as possible.<br><br>To better understand the issue, could you please provide information on the software applications that were affected and any error messages received? Additionally, knowing the version of the operating system used would be helpful.<br><br>If",Incident,Sales and Pre-Sales,low,en,400,Bug,Security,IT,Tech Support,Performance,Disruption,,
Experienced Data Breach in Hospital Systems Affecting Medical Data,"A data breach has occurred, impacting medical data in hospital systems and compromising sensitive patient information. Outdated firewall configurations and insufficient software security measures might be the cause. Despite attempts to reset firewall settings, updating Avast Premium Security, and conducting a full systems check, vulnerabilities persist. Assistance is needed to resolve the issue and prevent future breaches.","I understand the severity of the situation and the importance of protecting sensitive patient information. We will assist in resolving the issue and preventing future breaches. We recommend conducting a thorough investigation to identify the root cause of the vulnerability. Our team will help assess the current security measures and provide recommendations for improvements. We suggest implementing a robust firewall configuration, regularly updating software security patches, and conducting regular security audits. Additionally, we will assist in implementing a comprehensive incident response plan.",Problem,Technical Support,high,en,400,Security,Outage,Bug,Performance,IT,,,
Sicherheitsverletzung in der Klinik,"Es gibt eine Sicherheitsverletzung im IT-System der Klinik, was möglicherweise auf veraltete Software zurückzuführen ist.","Ich nehme die Sicherheitsverletzung ernst und werde sie unverzüglich untersuchen. Um Ihnen besser zu helfen, benötige ich weitere Informationen über die aktuelle Systemkonfiguration. Könnten Sie bitte Details über die veraltete Software und eventuelle Fehlernachrichten geben, die Sie bisher erhalten haben? Ich möchte gerne telefonisch mit Ihnen darüber sprechen und besprechen, wann es für Sie passt, anzurufen. Bitte geben Sie mir die geeignete Zeit an, und ich kann Ihnen <tel_num> anweisen.",Problem,Technical Support,high,de,400,Security,Bug,IT,Tech Support,,,,
Query on Billing Cycles and Payment Options for SaaS Project Management Service,"Looking to clarify billing cycles and payment options for the SaaS project management service. Could you provide details on the available plans and their corresponding prices? I would greatly appreciate any information on discounts or promotions that might be available. Also, could you inform me about the payment methods accepted and any additional fees associated with certain payment options? I look forward to receiving your response.","Glad to provide information on billing cycles and payment options for the SaaS project management service. We offer various plans with corresponding prices, which can be found on our website. We also offer discounts for annual payments and promotions for new customers. We accept major credit cards and bank transfers as payment methods. There may be additional fees associated with certain payment options. Would be happy to discuss the plans and pricing in more detail. Please feel free to call for convenience.",Request,Billing and Payments,high,en,400,Billing,Payment,Refund,Sales,Product,Feature,Documentation,
Problem with Unstable Model Results Identified,"There are inconsistencies in the outcomes of our investment prediction models, which might be related to recent data integration problems. We have checked the data sources and restarted the analytics platform, but the issue still exists. We need help to resolve this.",Received your email concerning the inconsistent model results. Will review the case and contact you at <tel_num> to discuss and schedule a suitable time for the technical team to investigate the issue.,Problem,Product Support,medium,en,400,Bug,Performance,IT,Tech Support,Documentation,,,
,"Hello, I am seeking recommendations on how to utilize Zapier Drupal Commerce to enhance our digital marketing strategies. Could you please provide some guidance?","I can assist with utilizing Zapier Drupal Commerce for digital marketing. Please provide details about your current setup and goals, and I will be happy to offer guidance and recommendations.",Request,Product Support,high,en,400,Feedback,Sales,Documentation,,,,,
"Problem mit Rechnungsdaten mehrerer Produkte, einschließlich Smart-Thermometer Scrivener","Wir haben unerwartete Verschiedenheiten in den Rechnungsdaten mehrerer Produkte, einschließlich Smart-Thermometer Scrivener, bemerkt. Dies scheint auf ein neueres Update des Rechnungssystems zurückzuführen sein. Wir haben die Kontoeinstellungen überprüft und die Transaktionsgeschichte geprüft, um eine Lösung zu finden. Das Team arbeitet aktiv daran, das Problem zu beheben. Bitte bedanke dich bei deiner Geduld und Verständnis während dieser Angelegenheit.","Wir arbeiten daran, die Rechnungsdatenverschiedenheiten zu beheben und bedanken uns für deine Geduld. Das Problem wird so schnell wie möglich untersucht und korrigiert.",Incident,Billing and Payments,medium,de,400,Billing,Account,Refund,Product,Feature,IT,Tech Support,
Urgent Assistance Required for Project Management Software,"We require immediate support for our project management software, as there are critical compatibility issues affecting several products. These issues are causing significant disruptions and are severely impacting our ability to manage projects effectively. We would greatly appreciate it if you could look into this matter soon and provide a solution as promptly as possible. Please let us know if you need any additional information to facilitate the process. Thank you for your attention to this matter.","Thank you for reaching out to us regarding the compatibility issues you are experiencing with the project management software updates. We apologize for the disruptions this has caused. To assist further, could you please provide details on the errors you are encountering and the specific products affected? Once we have this information, we will work to provide a prompt solution. If you need to discuss this matter further, you may contact us at <tel_num>.",Change,Service Outages and Maintenance,high,en,400,Bug,Disruption,Performance,IT,Tech Support,,,
Concerns About Low Engagement in Digital Campaigns,"Customer Support, we are facing issues with lower engagement rates in our digital campaigns. This could be due to ineffective targeting or outdated strategies. After analyzing recent metrics, we updated ad creatives and adjusted audience segments, but the results have not improved. Our team has tried various adjustments, including refreshing ad content, refining targeting parameters, and exploring new channels. Despite these efforts, we have not seen significant improvements in engagement metrics.","Dear [name], we are addressing the concerns about the low engagement rates in your digital campaigns. We understand that despite updating ad creatives, adjusting audience segments, and exploring new channels, the results have remained stagnant. To better assist you, could you please provide information on the current setup of your campaign, including targeting parameters and ad creatives? Additionally, it would be helpful to know your campaign goals and key performance indicators. We are happy to help.",Incident,Product Support,medium,en,400,Feedback,Performance,Documentation,IT,Tech Support,,,
Verbesserung Investitionen IBM-Software,"Könnten detaillierte Informationen zu der Optimierung der Investitionen mit IBM SPSS Statistics 28 liefern? Ich möchte mehr über die verfügbaren Funktionen und Werkzeuge des Softwarepaketes erfahren, um fundierte Investitionsentscheidungen treffen zu können. Ich freue mich auf Ihre Unterstützung und darauf, bald eine Rückmeldung zu erhalten.","Ich freue mich, Ihnen detaillierte Informationen zur Optimierung der Investitionen mit IBM SPSS Statistics 28 zu geben. Das Softwarepaket bietet verschiedene Werkzeuge und Funktionen für Datenanalyse, um fundierte Entscheidungen zu treffen. Ich bin gerne bereit, zum angegebenen Zeitpunkt anzurufen, um diese Punkte zu besprechen. Bitte geben Sie mir eine geeignete Zeit, um Sie zu erreichen. Sie können mich unter <tel_num> erreichen.",Request,Product Support,medium,de,400,Feedback,Product,Feature,,,,,
Trouble with Marketing Campaign,"Marketing campaign was disrupted due to software integration issues across various platforms. These issues are likely caused by compatibility problems arising from recent updates. I have restarted the affected applications and checked API connections, but the problems persist. I am requesting assistance to resolve this issue.","We are addressing the software integration issues that are affecting your marketing campaign. To better assist you, please provide details on the platforms and applications involved. It would also be helpful to know about any recent updates made. We can schedule a call at your earliest convenience to discuss and work towards a resolution for your account <acc_num>.",Incident,IT Support,high,en,400,Bug,Performance,Feature,IT,Tech Support,,,
Google Nest Wifi Integration Guidance,Could you provide assistance with integrating Google Nest Wifi Router into a project management SaaS solution? Thank you!,"Thank you for reaching out to our service desk regarding the integration of Google Nest Wifi Router into a project management SaaS solution. We would be happy to provide guidance on this matter, but we need more information about your current setup. Could you please provide us with the necessary details to achieve the integration? It would be convenient to schedule a call at <tel_num> to discuss and reply with any necessary information to assist you accordingly with account number <acc_num>.",Request,Returns and Exchanges,low,en,400,Feature,Documentation,Tech Support,,,,,
Support for Brand Engagement Issues,"determine, impact on brand engagement via platforms exists.","Address the issue, contact <tel_num>, discuss potential solutions for enhancing brand engagement on platforms.",Problem,Returns and Exchanges,high,de,400,Bug,Performance,Feedback,IT,Tech Support,,,
