subject,body,answer,type,queue,priority,language,version,tag_1,tag_2,tag_3,tag_4,tag_5,tag_6,tag_7,tag_8
Enquiries on Integrating IBM SPSS Statistics Analytics Tools,"Inquiring about the integration of IBM SPSS Statistics with existing data analytics tools. Seeking information on the topic, particularly interested in understanding its capabilities, limitations, and the types of data that can be shared. Would like to know how such integration can benefit the organization. Any guidance and resources provided would be greatly appreciated.","Thank you for your interest in integrating IBM SPSS Statistics with existing data analytics tools. Integration allows you to leverage the predictive analytics capabilities of IBM SPSS Statistics within your current analytics workflow. We can share various types of data, including spreadsheets, databases, and data warehouses. Integration brings numerous benefits to the organization, such as enhanced predictive modeling, improved data-driven decision-making, and increased productivity. Specific guidance will be provided.",Request,Technical Support,high,en,400,Feature,Documentation,Feedback,IT,Tech Support,,,
Medizinische Datenschutzlösungen für Krankenhäuser,"Könnten wir mehr über Lösungen zur Sicherung medizinischer Daten für Krankenhäuser erfahren? Es geht darum, wie wir besser verstehen und vertrauliche Patientendaten schützen können. Wir suchen eine zuverlässige Lösung, um die Vertraulichkeit und Integrität medizinischer Akten sicherzustellen. Vielen Dank für Ihre Unterstützung.","Vielen Dank für Ihre Anfrage bezüglich Lösungen zur Sicherung medizinischer Daten für Krankenhäuser. Unsere Lösungen sichern die Vertraulichkeit und Integrität medizinischer Akten. Wir freuen uns, diese Themen weiter zu besprechen. Bitte teilen Sie ein geeignetes Zeitfenster für einen Anruf mit, damit wir weitere Details erteilen und Ihre Fragen zu medizinischen Datensicherheitslösungen klären können.",Request,Customer Service,low,de,400,Security,Feedback,Documentation,,,,,
Fehlerschätzung bei Abonnementdienstleistungen,"Es wurde ein Verrechnungsfehler bei den Abonnementdienstleistungen festgestellt, der sich wahrscheinlich auf mehrfache Kontozusammenfusionen zurückführen lässt.","Das Konto <acc_num> wird überprüft, um den Verrechnungsfehler zu untersuchen. Bitte lassen Sie es wissen, wenn Sie sich um dieses Problem bemühen; ich werde bald eine Rückmeldung abgeben.",Problem,Billing and Payments,medium,de,400,Bug,Account,Refund,Billing,Performance,,,
Sicherung von Patientendaten mit Malwarebytes in Krankenhaus-IT-Systemen,"Geehrte Kundenservice, ich möchte fragen, ob es Möglichkeiten gibt, Patientendaten in den Krankenhaus-IT-Systemen mit Malwarebytes zu sichern. Könnten Sie hierbei Rat geben? Wir suchen nach Möglichkeiten, unsere Cyber-Sicherheitsmaßnahmen zu verbessern und sensible Patientendaten zu schützen. Es wäre großartig, wenn Sie Empfehlungen zu den besten Praktiken geben könnten. Ich freue mich auf Ihre Rückmeldung und danke Ihnen im Voraus für Ihre Hilfe.",Rat zur Sicherung von Patientendaten mit Malwarebytes-Lösungen geben.,Request,Product Support,low,de,400,Security,Virus,IT,Tech Support,Feedback,Maintenance,,
Support for Data Analysis Solutions,I am keen on learning more about available tools for data analysis to help make informed decisions. Thank you for your time and support. Looking forward to your response.,We offer customizable data analysis solutions and optimization strategies.,Request,Technical Support,medium,de,400,Feedback,IT,Tech Support,,,,,
Anbieter für Sicherung medizinischer Daten,Details zur Sicherung medizinischer Daten für Gesundheitsdienstleister mit SAP ERP liefern?,"Sehr geehrte(r) <name>, wir danken Ihnen für Ihr Interesse an der Sicherung medizinischer Daten für Gesundheitsdienstleister mithilfe von SAP ERP. Um die Sicherheit und Integrität dieser Daten zu gewährleisten, empfehlen wir die Nutzung der eingebauten Sicherheitsfunktionen von SAP, einschließlich Rollenbasiertes Zugriffssteuerung und Datenschutzverschlüsselung. Zudem tragen regelmäßige Audits und Überwachungen dazu bei, unautorisierten Zugriff zu verhindern. Für weitere Informationen empfehlen wir Ihnen, uns telefonisch unter den Nummern <tel_num> zu kontaktieren, um individuelle Anleitungen zu erhalten und spezifische Anforderungen zu besprechen. Wir freuen uns auf Ihre Rückmeldung.",Request,Customer Service,medium,de,400,Security,Backup,IT,Tech Support,,,,
Issue with Website Analysis,There is an issue with the Website Analysis Participation certificates due to algorithm changes. There are inconsistencies in the campaigns.,"To address the issue with the Website Analysis, please call <tel_num> to discuss potential causes and solutions for the Participation certificates and the campaigns.",Problem,Technical Support,high,de,400,Bug,Performance,Documentation,Feedback,,,,
,I am eager to learn about digital marketing strategies. Could you provide more details on how to enhance brand growth? I am particularly interested in understanding techniques to increase brand visibility and engagement. Your expertise would be greatly appreciated. Thank you!,"Customer, thank you for your interest in digital marketing strategies. We can use a combination of social media, content creation, and search engine optimization to enhance brand growth. I would be happy to discuss this with you. I am available for a call at your convenience to provide more details and help increase brand visibility and engagement.",Request,Product Support,medium,en,400,Feedback,Sales,Marketing,Product,,,,
Assistance Request for Docker Integration,"Please contact regarding the connection of the query about information on Docker integration for the 20.10 version of our Project Management SaaS. It would be helpful if you could provide additional details on the process and necessary steps, as well as any relevant documentation. I would greatly appreciate any advice to ensure a successful integration.","To assist with the Docker integration, please first review the documentation. I can forward the necessary materials via email or you can call me at <tel_num> for this request.",Request,Customer Service,low,de,400,Feature,Documentation,IT,Tech Support,,,,
,"I am seeking information about the customization options available for the project management SaaS platform. Could you provide details on the types of customizations that are offered? Additionally, I would appreciate it if you could include the process for requesting customizations and the associated costs. This will help me better understand how the platform can be tailored to meet my specific needs. Thank you for your assistance. I look forward to hearing back from you soon.","We offer a variety of customization options for our project management SaaS platform to meet specific needs. Customizations can include tailored workflows, custom fields, and integrations with third-party tools. To request customizations, please contact our support team with your requirements. We will assess your request and provide a quote based on the work involved. Costs vary depending on the complexity of the customization. Once we understand your needs, we can provide a solution that fits your budget. Our team will be happy to discuss your requirements in detail.",Request,Product Support,high,en,400,Feature,Feedback,IT,Tech Support,,,,
Inquiry About Project Management Software Pricing,Interested in learning more about project management software. Please provide details on the pricing tiers and the features included in each. I would like to know about the different options available to help me determine which one fits my needs.,"We appreciate your interest in our project management software and would be happy to provide more details. Our software offers three pricing tiers, each designed to meet the unique needs of our customers. The basic tier includes features such as project tracking and team collaboration, while the premium tier offers advanced features like reporting and analytics. We also offer a customized tier for businesses with specific requirements. To determine which tier best fits your needs, we recommend considering the following.",Request,Billing and Payments,medium,en,400,Sales,Product,Feature,Feedback,,,,
Verbesserung von digitalem Marketingtools,"Mussigung von Kundenservice, bitte kontaktieren Sie mich. Ich benötige Hilfe bei der Optimierung unserer digitalen Werkzeuge. Die Software hat unsere Markterfolgsrate erhöht, aber wir streben nach einer strategischen Ausbreitung der Marke, um ein größeres Publikum zu erreichen. Die aktuelle Einstellung bringt leider nicht die gewünschten Ergebnisse. Ich glaube, dass eine richtige Leitung unserer online Präsenz und eine Anpassung unserer digitalen Werkzeuge nötig ist, um das Ziel zu erreichen, eine effektivere Marke auszubauen. Insbesondere möchte ich Vorschläge zu Verbesserungen in den Bereichen soziale Medien-Beteiligung, E-Mail-Marketing-Kampagnen und Suchmaschinenoptimierung erhalten.","Mussigung von <name>, danke, Kundenservice erreicht haben. Freuen wir uns, Ihnen bei der Optimierung von digitalen Marketingtools zu helfen. Um die besten Empfehlungen zu geben, benötigen wir mehr Informationen über den aktuellen Aufbau Ihrer sozialen Medien, E-Mail-Marketing und Suchmaschinenoptimierung-Strategien. Es wäre schön, wenn wir telefonieren könnten, um diese Dinge zu besprechen. Die Telefonnummer <tel_num> steht für Sie zur Verfügung. Welche Uhrzeit passt Ihnen am besten? Wir freuen uns darauf, Ihnen bei dem Marketingziel zu helfen.",Change,IT Support,high,de,400,Feedback,Product,Feature,IT,Tech Support,,,
,"customer support, seeking information on data analytics to enhance investment optimization strategies, particularly in portfolio management and risk assessment. Would greatly appreciate any guidance or resources you can offer. Looking forward to hearing soon for further discussion. Thank you for your time and assistance.","will provide information on how data analytics enhances investment optimization strategies, specifically in portfolio management and risk assessment, and look forward to discussing these topics further soon.",Request,Customer Service,medium,en,400,Feedback,IT,Tech Support,,,,,
Report on Unlawful Access Event,"We are currently dealing with an unauthorized access event in our hospital systems, which has potentially exposed medical data. The issue might be due to outdated security measures or user negligence. We have attempted to reset passwords and reinforce access controls, but the problem persists. We urgently need your help to resolve this matter and prevent further breaches.","Dear [Name],\n\nThank you for your email regarding the unauthorized access event within our hospital systems. We understand the severity of the situation and the potential compromise of medical data. To better assist you, could you please provide us with more information about the incident, including the date and time it occurred and any error messages you received? We would also like to schedule a call to discuss the issue in detail and determine the appropriate course of action.\n\nI am available for a call at your convenience. Please let us know a time that works for you.\n\nBest regards,\n[Your Name]",Incident,Customer Service,high,en,400,Security,Network,Bug,IT,Tech Support,Alert,,
Langsame Reaktion Datenanalysetool,"Das Datenanalysetool reagiert auf Datenverarbeitungsaufgaben langsamer, da sich kürzlich aufgrund erhöhter Datenaufcharge die Marktteilung geändert hat.","Betreuer/in <name>, wir entschuldigen uns für die langsame Reaktion des Datenanalysetools. Es ist möglicherweise die erhöhte Datenaufcharge und die kürzlich stattfindende Marktteilung, die Ursache. Um die Leistung zu verbessern, empfehlen wir Ihnen, die Aktualisierung des aktuellen Pakets durchzuführen, was Ihnen ermöglicht, größere Datenvolumen zu verarbeiten. Alternativ können wir Optimierungen vorschlagen, um die Effizienz Ihrer Datenverarbeitungsaufgaben zu steigern. Bitte geben Sie uns mehr Details zu Ihren aktuellen Paket-Datenverarbeitungsaufgaben, damit wir eine individuell angepasste Lösung anbieten können. Falls Sie möchten, können Sie sich telefonisch unter <tel_num> mit uns in Verbindung setzen, um die Lösung zu besprechen.",Incident,Technical Support,medium,de,400,Performance,Bug,IT,Tech Support,,,,
Concerns About Ad Performance,"Facing inconsistent ad performance across various platforms, which may be related to recent algorithm updates. Although I have adjusted targeting settings and reallocated budget resources, there has been no significant improvement. I need help to resolve and optimize ad performance.","Dear [Name], we acknowledge the ad performance issue you are experiencing across different platforms. Despite your efforts to adjust targeting settings and reallocate budget resources, the issue persists. To better assist you, we would appreciate detailed information about your current ad campaigns, including the target audience and budget allocation. This will enable us to investigate the matter and provide a tailored solution. Please let us know your availability to discuss this in detail via a call at <tel_num>. Thank you.",Problem,Technical Support,low,en,400,Performance,Feedback,Feature,Tech Support,,,,
,"Wir haben sporadische Ausfälle bei der Investitionsoptimierungssoftware und erneuerte Systemupdates lösen das Problem nicht. Ein potenzieller Grund könnte ein Traffic-Spike sein, aber die Anwendung läuft wieder, und die Logs zeigen aktuell keine Fehler. Bitte geben Sie mehr Details zu den neuesten Systemupdates und Traffic-Spikes. Wir müssen die Logs überprüfen, und falls erforderlich, können wir uns per Anruf auf <tel_num> zur Sprache bringen, um das Problem zu besprechen.","Um das Problem mit der Investitionsoptimierungssoftware zu untersuchen, benötigen wir zusätzliche Informationen zu den neuesten Systemupdates und Traffic-Spikes. Bitte geben Sie diese Details an. Wir müssen die Logs überprüfen, und falls erforderlich, können wir uns per Anruf auf <tel_num> zur Verfügung stellen, um das Problem zu besprechen.",Incident,Service Outages and Maintenance,high,de,400,Outage,Performance,Network,IT,Tech Support,,,
,"geehrte Kundenservice, ich schreibe in Bezug auf das Problem mit der Projektmanagement-Software. Wir bemerken intermittente Ausfälle, insbesondere in Spitzenzeiten, die möglicherweise auf Server-Überlast oder Netzwerkkonflikte zurückzuführen sein könnten. Trotz unserer Bemühungen, die Server zu optimieren und die Ressourcen zu erhöhen, besteht das Problem leider weiterhin. Ich schätze es, wenn Sie die Angelegenheit umsehen und eine mögliche Lösung anbieten könnten. Bitte lassen Sie mich wissen, falls Sie weitere Informationen benötigen, um die Untersuchung zu unterstützen. Ich stehe Ihnen gerne zur Verfügung, um alle notwendigen Details bereitzustellen. Danke für Ihre Beachtung der Angelegenheit.","geehrte <name>, Ihre E-Mail zur Behandlung des Problems mit der Projektmanagement-Software erhalten. Wir werden die intermittierenden Ausfälle untersuchen. Bitte geben Sie mehr Details und Fehlermeldungen an, um die genauen Zeiten der Ausfälle zu bestimmen. Bald werden wir Sie kontaktieren, um die Besprechung der möglichen Lösung vorzunehmen.",Problem,Returns and Exchanges,medium,de,400,Network,Performance,Outage,Disruption,IT,Tech Support,,
Enhancements for Data Analysis Tools,"Dear Customer Support, I am writing to request improvements to the Data Analysis Tools. I need better optimization of investment strategies and improved performance monitoring. The current tools lack the detailed insights necessary for informed decision-making. I would like to see more advanced features such as predictive data analysis and machine learning. These would help in better monitoring of services and making data-driven decisions. I believe these enhancements would significantly benefit the company. I look forward to hearing back soon.","Dear [Name], thank you for your message. Customer Support will address your request for improvements to the Data Analysis Tools. We appreciate your feedback and would like to discuss the specific features you are interested in, such as predictive data analysis and machine learning. Could you please provide more details about the desired features? We will keep your request in mind and discuss it with the development team. You can contact us at [Phone Number] to discuss this matter further.",Change,Technical Support,low,de,400,Feature,Performance,Feedback,,,,,
Unplanned Outage Impacting Digital Marketing Solutions,There was an unexpected outage impacting digital marketing solutions because of server overload.,We apologize for the inconvenience. Our team is working to resolve the server overload issue. Please feel free to inform us if you need an update on the status of the downtime.,Incident,Technical Support,low,en,400,Outage,Disruption,Recovery,Performance,IT,Tech Support,,
Aktualisierung der digitalen Strategiestrukturen,"Bewährte Damen des Kundenservice, ich schreibe Ihnen, um eine Aktualisierung der digitalen Strategiestrukturen für unsere Kundenkampagnen zu bitten. Die Überprüfung und Aktualisierung der aktuellen Strukturen könnten das Markenwachstum effektiver fördern. Ich glaube, dass eine Aktualisierung der Strukturen die Effektivität unserer Kampagnen verbessern könnte. Die neuen Strukturen sollten die neuesten Trends und besten Praktiken des digitalen Marking einbeziehen, um die Dienstleistungen für unsere Kunden zu verbessern. Es wäre sehr freundlich, wenn Sie uns so schnell wie möglich über Ihre Bemühungen in dieser Angelegenheit informieren könnten. Vielen Dank.","Bewährte <name>, vielen Dank für Ihren Wunsch, die digitalen Strategiestrukturen zu aktualisieren. Wir werden die aktuellen Strukturen überprüfen und sie mit den neuesten Trends und besten Praktiken des digitalen Marking einbeziehen. Als erstes werden wir so schnell wie möglich darauf antworten. Wenn Sie weitere Hilfe benötigen oder über dieses Thema sprechen möchten, lassen Sie uns bitte am gewünschten Zeitpunkt über <tel_num> kontaktieren.",Change,Product Support,high,de,400,Feedback,Feature,Documentation,,,,,
Anleitung zur Integration von KlickUp in QuickBooks Online erforderlich,"Sehr geehrte Kundensupport, ich benötige detaillierte Anleitungen, um die Integration von KlickUp in QuickBooks Online für mein Projektmanagement zu realisieren. Ich möchte den Schritt-für-Schritt-Prozess zur Verbindung beider Plattformen kennen, um den Datenaustausch zu glätten. Könnten Sie bitte einen umfassenden Leitfaden und Ressourcen bereitstellen, die mir bei der Integration helfen? Zudem schätze ich zusätzliche Tipps und Empfehlungen. Vielen Dank für Ihr Engagement und Ihre Unterstützung. Ich freue mich darauf, bald von Ihnen zu hören.","Sehr geehrte <name>, wir bieten Ihnen einen Schritt-für-Schritt-Leitfaden zur Integration von KlickUp in QuickBooks Online. Bitte kontaktieren Sie uns telefonisch unter <tel_num>, um einen geeigneten Termin für eine Live-Anleitung auszusuchen, falls Sie dies benötigen. ",Request,Customer Service,high,de,400,Documentation,Feature,Tech Support,,,,,
Optimierung von Investitionen durch Datenanalyse-Dienstleistungen,"Ich würde gerne mehr Informationen über die Datenanalyse-Dienstleistungen für die Optimierung von Investitionen erhalten. Die Dienstleistungen könnten mir dabei helfen, ein informiertes Entscheidungsteam zu treffen. Vielen Dank für Ihre Unterstützung. Ich freue mich darauf, bald von Ihnen zu hören.","Guten Tag <name>, wir freuen uns, dass Sie mehr Informationen über unsere Datenanalyse-Dienstleistungen für die Optimierung von Investitionen benötigen. Unsere Dienstleistungen unterstützen Sie dabei, detaillierte Analysen und wertvolle Einblicke in Marktentwicklungen und Investitionschancen zu erhalten, um informierte Entscheidungen treffen zu können. Sollten Sie möchten, diskutieren wir dies gerne telefonisch weiter. Bitte geben Sie einen geeigneten Zeitpunkt für einen Anruf an. Ich freue mich darauf, gemeinsam Ihre Investitionsziele zu erörtern.",Request,Customer Service,medium,de,400,Performance,Documentation,Feedback,Sales,,,,
IT-Security Issue Support,An unauthorized access to the hospital's IT system has been detected.,"Please take immediate action, rectify the unauthorized access issue, and provide further details for the investigation and resolution.",Incident,IT Support,medium,de,400,Security,IT,Tech Support,Outage,,,,
,"Hello Customer Support, I am inquiring about digital strategies to promote our brand effectively. Could you provide some information on the topics and tools available that could help us increase our online presence and reach our target audience? I look forward to your assistance and am open to discussing this further at your convenience. Thank you for your time and I look forward to hearing back from you soon.","Dear [name], thank you for reaching out to our customer support team. We would be happy to assist you with digital strategies to promote your brand. Our team can provide you with information on various practices and tools that can help increase your online presence. Please let us know a convenient time to discuss this further over the phone. We look forward to assisting you with your inquiry regarding digital strategies.",Request,Billing and Payments,medium,en,400,Feedback,Documentation,IT,Tech Support,,,,
Probleme mit der Verbindung zum Projektmanagement-SaaS,"Lieber Kundenservice, ich erhebe mich gegen Verbindungsprobleme beim ProjektverwaltungssaaS, die auf mehreren Geräten aufgetreten sind. Die Konflikte scheinen auf Software-Produkte zurückzuführen sein. Ich habe versucht, betroffene Geräte neu zu starten und die Browser-Caches zu leeren, leider half dies dem Problem nicht. Ich schätze Ihre Unterstützung bei der Behebung des Problems. Bitte informieren Sie mich, falls weitere Informationen benötigt werden, um das Problem zu beheben. Vielen Dank für Ihr Verständnis und Ihre Unterstützung.",Wir werden das Problem bald untersuchen und Ihnen Details zu seiner Behebung kommunizieren.,Incident,Technical Support,medium,de,400,Network,Performance,IT,Tech Support,Bug,Product,,
Issues with Engagement Metrics of Recent Campaigns,"We are observing a decline in engagement metrics for the most recent campaigns. This trend suggests potential changes in the algorithms of social media platforms. We have adjusted the input for our content strategies, but the results have been unsatisfactory.","The Service Desk team is here to assist with the issue regarding the decline in engagement metrics for the most recent campaigns. To better understand the situation, could you please provide additional details on the specific metrics that have decreased, as well as the social media platforms where the campaigns are active? Additionally, any further adjustments made to the content strategies would be helpful. This information will aid in providing a precise solution to the problem and improve the campaign's performance.",Incident,Product Support,high,de,400,Feedback,Performance,Feature,,,,,
Message about Service Outage,"Experienced a service outage, multiple applications, including CCleaner and Symantec Endpoint Protection, were affected. Server overload due to a scheduled maintenance operation. Tried restarting the affected systems to address the basic issues, but the problem persists. The team is currently working to identify the cause and resolve it, with services expected to be restored soon. Apologize for any inconvenience caused and appreciate your understanding. If you have further questions or concerns, please do not hesitate to contact us.","Dear <name>, thank you for reporting the service outage. Please contact <tel_num> for further discussions if needed. Please share if you require additional information regarding the issue.",Incident,Service Outages and Maintenance,low,de,400,Outage,Disruption,Maintenance,Performance,IT,Tech Support,,
Concern about Dashboard Load Speed,"Dear Support Team, I am encountering occasional delays in loading the dashboard. This could be due to higher user traffic or server performance. Clearing my cache and refreshing the page hasn't resolved the issue. I would greatly appreciate your help in addressing this to maintain a smooth user experience. Kindly provide any additional steps I can take to troubleshoot and ensure the known issue is resolved. Thank you for your support in handling this matter.","To address this, please contact us at <tel_num> to discuss potential steps for troubleshooting and improving server performance, which may help resolve the slow loading times.",Problem,Product Support,low,en,400,Performance,Network,IT,Tech Support,,,,
Support Required for Frequent Application Crashes,"Our team is facing frequent crashes while using the SaaS project management tool. The issues might be due to integration conflicts with IBM SPSS Statistics and Adobe Photoshop. We have already tried clearing the cache and restarting the application, but the problem still persists. Despite our efforts, the crashes continue to occur, disrupting our workflow and productivity. We would greatly appreciate your assistance and guidance to help resolve this issue.","Please investigate the crash issue related to the SaaS project management tool, considering potential integration conflicts with IBM SPSS Statistics and Adobe Photoshop. Contact us at <tel_num> to discuss the steps needed to resolve the issue and minimize workflow disruption.",Problem,Customer Service,medium,en,400,Bug,Crash,Performance,IT,Tech Support,,,
