subject,body,answer,type,queue,priority,language,version,tag_1,tag_2,tag_3,tag_4,tag_5,tag_6,tag_7,tag_8
Issue with Monthly Subscription Payment,"The monthly subscription fee was charged twice, which has significantly affected my account balance. This might have occurred due to a billing processing error or system glitch. I have already checked my payment method and contacted my bank, confirming that there are duplicate transactions. I would appreciate it if you could look into this matter and correct the error as soon as possible.","Dear [Name], we apologize for the inconvenience caused by the error in the monthly subscription payment. We are happy to assist in resolving this issue. We will investigate the matter and review your account [acc_num] to determine the cause of the duplicate charge. Please allow us to look into this and resolve it as soon as possible. If necessary, we may need to contact you at [tel_num] to discuss the issue further. Thank you for bringing this to our attention and we appreciate your patience while we address this matter.",Problem,Billing and Payments,high,en,400,Billing,Payment,Account,Disruption,Refund,,,
Request for Enhanced Reporting Features,Seeking to integrate advanced reporting features into the project management platform to improve analytics and enable data-driven decisions for optimizing operations. Current reporting limitations make it difficult to track key performance indicators and identify areas for improvement. Implementing advanced reporting features will provide a deeper understanding of product performance and drive business growth. Please clarify the specific reporting capabilities needed and types of analytics to track.,"Acknowledging the request for enhanced reporting features in the project management platform. Recognizing the importance of advanced analytics for informed decision-making and operational optimization. The development team will review the feasibility of integrating these features and provide a timeline for implementation. To better understand your requirements, could you please provide more details on the specific reporting capabilities you need and the types of analytics you wish to track? This information will be very helpful.",Change,Technical Support,low,en,400,Feature,Feedback,Documentation,,,,,
,"Kundendienst, bei unserer Finanzfirma zeigen die Investitionen trotz der Implementierung der Datenanalyse weiterhin unterdurchschnittliche Leistungen. Die ungenauen Dateneingaben und Einschränkungen beim Modellieren der Analysen sind wahrscheinlich die Ursachen. Das Team hat die Quellen der Daten überarbeitet und die Analysemodelle umgestellt, um signifikante Verbesserungen zu erzielen. Alternativen Datensätze wurden untersucht, und Beratung von externen Experten wurde durchgeführt. Trotz dieser Bemühungen hält die Unterperformance an, und es wird ein weiterer Überblick über die Analysestrategie und die bisherigen Schritte gewünscht, um mögliche Überarbeitungen und Beheizungen der Grundursache des Problems zu identifizieren.","Sehr geehrte [name], vielen Dank, dass Sie sich an unseren Kundendienst gewandt haben, um Ihre Befürchtungen bezüglich unterdurchschnittlicher Investitionsleistungen Ihrer Finanzfirma zu teilen, obwohl die Datenanalyse bereits implementiert wurde. Wir verstehen, dass Ihr Team bisher mehrere Schritte unternommen hat, um signifikante Verbesserungen zu erzielen. Um die Analysestrategie sowie die bisherigen Schritte zu besprechen, möchten wir einen Telefonfall vereinbaren. Könnten Sie uns bitte sagen, wann Sie telefonisch erreicht werden können, anhand Ihrer Verfügbarkeit? Bitte geben Sie dazu Ihre Telefonnummer an: [tel_num].",Problem,Returns and Exchanges,medium,de,400,Bug,Performance,Documentation,Feedback,IT,Tech Support,,
Datenschutzverstoß,"Es gab einen Datenschutzverstoß im Krankenhaus-IT-System. Die Sicherheit der medizinischen Daten wurde beeinträchtigt. Möglicherweise verursacht das Verwenden veralteter Software und schwacher Passwortschutzprotokolle diesen Verstoß. Wir haben versucht, die Sicherheit durch Audits zu überprüfen, aber es gab nur geringe Erfolge. Bitte helfen Sie uns, das Problem zu lösen und zukünftige Verstöße zu verhindern.","Rufen Sie uns unter <tel_num> an, um den Datenschutzverstoß zu besprechen und das Problem zu lösen.",Incident,Customer Service,low,de,400,Security,Bug,Performance,IT,Tech Support,,,
Support Required for Medical Data Security,"Facing unauthorized access attempts on medical data systems. This might be due to insufficient security protocols. Despite implementing firewalls and updating passwords, access attempts continue. The team has tried various measures, but the issue still persists. We kindly request your assistance to resolve this matter and enhance the system's security to prevent potential breaches. Please provide guidance on the necessary steps to take.","I will assist in enhancing the security of your medical data system to prevent unauthorized access attempts. To better understand the issue, I would like to discuss it with you. Please let me know a suitable time to call at <tel_num> so we can proceed with the necessary steps to secure the system and protect the data.",Problem,IT Support,high,en,400,Security,IT,Tech Support,Alert,,,,
,"A marketing agency is facing delays in campaign metrics reporting. Recent platform updates might be causing integration issues. Cache has been cleared and settings checked, but the problem persists.","Please investigate the campaign metrics reporting issue for the marketing agency. Kindly provide the account number and a good time for a callback to discuss further. Also, check if recent platform updates are related to the integration issues.",Incident,Product Support,high,en,400,Bug,Performance,Feature,IT,Tech Support,,,
,Asking for an update on digital strategy tools hardware to boost performance and advance brand growth initiatives.,We are reviewing your request to update digital strategy tools hardware for improved performance and enhanced brand growth initiatives. Please contact us at <tel_num> to discuss the details and explore possible solutions.,Change,IT Support,high,en,400,Hardware,Performance,Product,Feature,Feedback,,,
Concern Regarding Data Analytics Software Efficiency,"The company's data analytics software frequently experiences crashes, which interferes with our investment optimization processes. It is suspected that these crashes are due to compatibility problems with Android 12 software versions. Steps taken such as restarting devices, clearing cache, and updating applications have not resolved the issue. We require your assistance in resolving this problem.","We acknowledge the issues with the data analytics software and apologize for any disruptions to your investment optimization efforts. To better assist you, we would like to gather more information about your devices and the software versions they are running. Could you please provide us with the specific device models and software versions? Alternatively, please let us know a convenient time for a call at <tel_num>. This would be preferable.",Incident,Technical Support,medium,en,400,Bug,Crash,Performance,IT,Tech Support,,,
Verbesserung der Datenanalyse in Produkten,"Gestresste Kundenservice, hier ist ein Antrag auf Verbesserungen in der Datenanalyseintegration für betroffene Produkte. Erhebliche Verbesserungen in Investitionsoptimierung und Entscheidungsfindungseffizienz sind zu erwarten. Mitarbeiter verbringen einen beträchtlichen Teil ihrer Zeit damit, Daten manuell zu sammeln und zu analysieren, was zu Fehlern und Verzögerungen führen kann. Die Integration fortschrittlicher Datenanalysetools könnte besser informierte Entscheidungen ermöglichen, Investitionen effektiver zu optimieren. Ich schätze Ihre Unterstützung und hoffe, dass Sie diese Angelegenheit schnell und effizient behandeln können. Vielen Dank.","Gestresste <name>, vielen Dank für Ihren Brief zum Thema Verbesserung der Datenanalyseintegration in Produkten. Wir werden den Antrag prüfen und mögliche Lösungen für Verbesserungen in Investitionsoptimierung und Entscheidungsfindungseffizienz erkunden. Bald werden wir Sie kontaktieren, um weitere Details zu besprechen und einen Umsetzungszeitplan zu bereitstellen.",Change,Product Support,high,de,400,Feedback,Product,Feature,Performance,IT,,,
Support for Project Management Onboarding,"Is there a way to get details about the onboarding process for new users of the project management SaaS tool? I am keen to learn how the tool can assist teams in getting started with their projects. Could you kindly offer information on the onboarding process, including any available tutorials or guides that can help new users become familiar with the platform?","Dear [Name], thank you for your email regarding the onboarding process for our project management SaaS tool. We offer a comprehensive guide and tutorial to help new users get started. Our support team is available to assist with the onboarding process. For more information, please visit our website or schedule a call at [tel_num] to discuss further.",Request,Human Resources,low,en,400,Training,Documentation,Tech Support,,,,,
Enhancing Investment Strategies with DataRobot,"Hello, you have contacted Customer Support to inquire about optimizing investments using DataRobot's financial analytics tools. We would be glad to provide detailed information on how to leverage DataRobot's capabilities to make data-driven investment decisions. Could you kindly guide me through the following topics: data preparation, model selection, and deployment? Additionally, I would like to know about the benefits of using DataRobot's financial analytics, including improved forecasting and risk management. Could you share any success stories or case studies that demonstrate its effectiveness?","Thank you for reaching out to our support team regarding the optimization of investments using DataRobot's financial analytics. We will provide detailed information on how to leverage DataRobot's capabilities. We would like to schedule a call with one of our experts to guide you through the process of data preparation, model selection, and deployment. We will also share some success stories and case studies to demonstrate its effectiveness. Please let us know a convenient time for the call, and we can contact you at <tel_num>. In the meantime, you can visit our website for additional resources to help you get started.",Request,Billing and Payments,medium,en,400,Feature,Documentation,Feedback,IT,Tech Support,,,
Reduction in Campaign Engagement Sudden,"The metrics for the brand's campaign engagement have unexpectedly decreased. Various factors, such as changes in the target audience and ineffective advertising strategies, may be contributing to this decline. I believe that addressing the issue through a detailed analysis could help us better understand the problem and identify potential solutions.","Dear [name], I am writing to confirm the unexpected drop in campaign engagement metrics for Marketing Campaign related to Account Number [acc_num]. I understand the importance of analyzing the problem to identify the cause and potential solutions. To assist you better, I need additional information about the campaign, such as the start date, target audience, and any recent changes in advertising tactics. This information will help me conduct a comprehensive analysis of the issue, including audience behavior and advertising impact. If necessary, we can arrange a call to discuss further.",Incident,General Inquiry,low,de,400,Feedback,Performance,Documentation,Sales,,,,
Required Solutions for Safeguarding Medical Data in Hospital Settings,Could you provide detailed solutions for securing medical data in hospital environments? We are seeking a reliable and efficient way to protect sensitive patient information. Your expertise in this area would be greatly appreciated. Please share relevant information and resources to help us enhance our data security measures.,"Dear [Name], I would be happy to provide information on medical data security solutions for hospital environments. We offer a range of services including data encryption, access controls, and monitoring systems to protect sensitive patient information. Our solutions are designed to be reliable and efficient, ensuring the confidentiality, integrity, and availability of medical data. I will share relevant resources with you, including case studies and whitepapers, to help improve your data security measures. We look forward to your response.",Request,General Inquiry,low,en,400,Security,Documentation,IT,Tech Support,,,,
Problem with Software Crash During Peak Analysis,"Encountered frequent crashes during peak analysis times, which might be related to resource usage incompatibility.","We are investigating the software crash issues experienced during peak analysis times, which might be related to resource usage incompatibility. Please contact us soon for further discussion. Kindly provide details about your system configuration and the error message received.",Incident,Product Support,medium,en,400,Bug,Crash,Performance,IT,Tech Support,,,
Advice for Securing Medical Data in Ubiquiti PostgreSQL Environments,"I am seeking customer support to secure medical data in PostgreSQL systems used at hospitals managed by Ubiquiti. Could you provide guidance on best practices to ensure the confidentiality, integrity, and availability of sensitive medical information? I would greatly appreciate any recommendations or resources you can share on this topic. Specifically, I am interested in learning more about encryption methods, access controls, and data backup procedures. Thank you for your assistance, and I look forward to hearing from you soon.","We will provide guidance on securing medical data in Ubiquiti PostgreSQL environments, including encryption methods and access controls. Please contact us soon so we can discuss these further.",Request,Billing and Payments,medium,en,400,Security,Documentation,IT,Tech Support,,,,
Improve Data Analytics Features,Submit request for enhancement of data analytics features. Require optimization of the integration between Cisco IOS and Elasticsearch to obtain better investment insights. This will enable us to make informed decisions and enhance overall performance.,Acknowledged request to enhance data analytics features and optimize the integration with Cisco IOS and Elasticsearch. Will review your request and contact <tel_num> to discuss the details and determine the next steps for implementation.,Change,Technical Support,medium,en,400,Feature,Feedback,Performance,,,,,
Support for Hospital Data Breach Incident,"A data breach has affected the hospital's systems, posing a risk to patient information security. It may be due to outdated software and insufficient encryption protocols. Despite initial security measures, such as updating access controls, the issue still persists.",We are reaching out regarding the data breach in your hospital's systems and need details about the current situation. We would appreciate it if you could schedule a call at your earliest convenience to discuss and provide assistance in resolving the issue.,Problem,Customer Service,medium,en,400,Security,Virus,IT,Tech Support,,,,
Problem with Adobe Effects 2021,"The marketing team is encountering software crashes when using Adobe Effects 2021 with OBS Studio 27. This might be due to compatibility issues or hardware limitations, possibly related to a gaming monitor. They have already tried updating the software, checking hardware settings, and reinstalling the programs, but the issues continue to persist. The team is seeking assistance to resolve this matter, which is impacting their productivity. Could you please provide a guide for troubleshooting the issue?","I will assist the marketing team with their Adobe Effects 2021 issue. Please provide the system specifications and any crash logs. Additionally, a detailed troubleshooting resolution guide would be helpful.",Incident,Technical Support,high,en,400,Bug,Crash,Hardware,Performance,IT,Tech Support,,
,"An employee has reported a decline in productivity due to overlapping responsibilities following recent restructuring. Please acknowledge receipt of this issue and express your understanding of the importance of resolving it to ensure smooth workflow. To better understand the situation, could you provide specific details on the roles and responsibilities that are overlapping and impacting productivity? Additionally, it would be helpful to know which departments or teams are involved. I would like to schedule a call to discuss this further and am available at your convenience.","Dear [Name],\n\nI acknowledge receipt of your email regarding the issue of overlapping responsibilities that are affecting employee productivity following recent restructuring. Understanding the importance of addressing this matter to ensure a smooth workflow, I kindly request you to provide specific details on the roles and responsibilities that are overlapping and impacting productivity. Additionally, it would be helpful to know which departments or teams are involved. I would like to schedule a call to discuss this further and am available at your convenience.\n\nBest regards,\n[Your Name]",Incident,Human Resources,medium,en,400,HR,Employee,Feedback,IT,,,,
Anfrage nach Umsetzungsdetails für PyTorch,"Könnten Sie weitere Details zur Integration von PyTorch in unsere Projektmanagement-Cloud bereitstellen? Diese Informationen helfen mir, den Benutzungsprozess besser zu verstehen. Ich freue mich, wenn Sie Ressourcen und Anleitungen zur Verfügung stellen könnten. Vielen Dank für Ihre Unterstützung. Ich freue mich darauf, bald von Ihnen zu hören.","Wir bereitstellen Ressourcen und Anleitungen für die PyTorch-Integration, um die Nutzung unserer Projektmanagement-Cloud-Dienste effektiver zu machen. Bitte rufen Sie uns später an, um die Details zu besprechen und mögliche Fragen zu den Integrationsprozessen zu erörtern. ",Request,Human Resources,medium,de,400,Documentation,Feature,IT,Tech Support,,,,
Project Management Concern,Project is experiencing high activity crashes,"Regarding the project management concern reported, specifically the high activity crashes, please provide any details or error messages you are receiving for further assistance.",Problem,Technical Support,high,en,400,Bug,Crash,Performance,IT,Tech Support,,,
Request for Assistance with Data Security Vulnerabilities in Hospital System,"Customer support, we have identified critical issues related to data security in the hospital system, which may be due to outdated software components. Despite recent software updates, the problems continue to persist. We kindly request your assistance in resolving this matter as soon as possible to ensure the security and integrity of the system. Please inform us of the next steps and appreciate your prompt attention to this urgent matter. We look forward to hearing from you soon.",We will assist in addressing the data security vulnerabilities in the hospital system. Could you please provide more details on the issues and the software updates that have been applied? Please contact us at <tel_num> to discuss the next steps and resolve this matter as soon as possible.,Problem,Customer Service,low,en,400,Security,IT,Tech Support,Maintenance,,,,
Rat für die Optimierung von Adobe Photoshop Markenstrategien,Könnten Sie Rat zur Optimierung von Adobe Photoshop CC 2021 für verbesserte Markenstrategien geben? Wir suchen nach Verbesserungen unserer Arbeitsabläufe und der Erstellung ansprechenderer Inhalte. Ich freue mich auf Ihre Rückmeldung und Ihre Unterstützung in dieser Angelegenheit und hoffe auf eine baldige Antwort.,"Für Rat zur Optimierung von Adobe Photoshop CC Markenstrategien, bitten wir um mehr Details zum aktuellen Arbeitsablauf und den Zielen. Sie können sich gerne an Nummer <tel_num> wenden, um eine umfassendere Unterstützung zu besprechen.",Request,Billing and Payments,medium,de,400,Feedback,Feature,Documentation,IT,Tech Support,,,
Support for Delays in Performance Measurement Campaigns Due to System Weaknesses,"Our agency is experiencing delays in performance measurement campaigns due to system weaknesses, which are causing high server load during peak traffic. We have already cleared the cache and restarted the system, but the issue persists. The team is concerned as this might affect our capabilities to provide timely insights. We appreciate your patience and value your business. We believe a solution to this problem would be greatly appreciated. Please share any further steps or details that could help in troubleshooting. If the issue requires an easy fix, we will provide a simple solution. We would like to discuss possible solutions and are available for a call at your convenience. Please provide a suitable time slot for the call, and we will work together to determine the best approach to resolve the issue and prevent future delays, related to account <acc_num>. ","We understand that system weaknesses are affecting the performance measurement of campaigns. We have already cleared the cache and restarted the system, but the issue still persists. We will continue to troubleshoot and would appreciate if you could provide current server load and usage patterns. Additionally, we are willing to arrange a call to discuss potential solutions. Please provide a suitable time slot for the call, and we will work together to determine the best approach to resolve the issue and prevent future delays, related to account <acc_num>. ",Incident,Technical Support,low,de,400,Performance,Disruption,IT,Tech Support,,,,
Urgent: Potentially Reported Data Breach in Medication Log System,"A potential data breach was identified, possibly due to outdated security protocols. Access logs have been reviewed and passwords have been updated.",Acknowledged the report of a potential data breach in the Medication Log System. Immediate actions are being taken to investigate the systems and ensure security. Further updates will be provided as more information becomes available.,Incident,Technical Support,medium,de,400,Security,Alert,IT,Tech Support,,,,
Incident of Unauthorized Access to Medical Data,"Over the recent period, several cases of unauthorized access to medical data have been reported, putting patient confidentiality at risk. Possible reasons for this include deficiencies in security protocols and insufficient staff training in data protection. Efforts to secure the data include applying immediate software updates and reviewing current security measures to prevent similar incidents in the future.","I am writing to acknowledge the recent incident of unauthorized access to medical data and understand the seriousness of the situation and its potential consequences for patient confidentiality. We take data security very seriously and are taking immediate action to address this issue. Our team is currently reviewing existing security measures and implementing additional protocols to prevent such incidents from happening again. If you have any concerns, please let us know a convenient time to discuss this matter further at <tel_num>.",Problem,Sales and Pre-Sales,high,en,400,Security,Incident,Feedback,Training,IT,,,
Enhancing Investment Strategies with Wolfram Mathematica,"I am inquiring about optimizing investment strategies using Wolfram Mathematica within a data analytics framework. I am interested in leveraging the capabilities of Wolfram Mathematica to improve my investment decisions. Could you provide insights on how to integrate Wolfram Mathematica into my existing data analytics workflow? I would appreciate any guidance on how to get started with using Wolfram Mathematica for investment strategy optimization. Additionally, I would like to know about specific tools available.",Please review your inquiry and contact us at <tel_num> to discuss integrating Wolfram Mathematica into your data analytics workflow. We can provide guidance on optimizing investment strategies.,Request,Technical Support,medium,en,400,Feature,Documentation,Feedback,IT,,,,
Unprécises Prévisions d'Investissement - Demande d'Aide,"Notre entreprise financière rencontre des difficultés de précision dans les prévisions d'investissement. Les algorithmes obsolètes et la mauvaise qualité des données sont à l'origine de ce problème. Des essais pour re-calibrer le logiciel d'analytiques et actualiser les ensembles de données n'ont pas porté leurs fruits. Le groupe d'équipe a essayé diverses méthodes de résolution de problèmes, mais le problème persiste. Nous sollicitons aimablement votre équipe d'assistance clients pour résoudre ce problème et améliorer la précision de nos prévisions d'investissement.","Cher/<NAME>, je vous confirme qu'un demande d'aide pour des prévisions d'investissement imprecises est reçue. Je souhaite collecter plus d'informations pour mieux comprendre le problème. Pourriez-vous nous donner des détails sur les méthodes de résolution de problèmes que vous avez essayées, et spécifiquement quel type de erreurs vous avez rencontrées ? Je serais ravi de discuter de possibles solutions par téléphone au numéro <tel_num> et de discuter des détails de votre compte <acc_num>.",Problem,Technical Support,high,de,400,Feedback,Sales,Lead,IT,Tech Support,,,
