subject,body,answer,type,queue,priority,language,version,tag_1,tag_2,tag_3,tag_4,tag_5,tag_6,tag_7,tag_8
Issue with Digital Health Tools,"Previous outages have affected critical tools. Possible causes: network damage, system overload.","Dear <name>, we apologize for the issues with the digital health tools. Our team is working to resolve the outage as soon as possible. To assist, please provide more details about the affected tool and any error messages. You can call <tel_num> to discuss the next steps.",Incident,Service Outages and Maintenance,high,de,400,Outage,Network,Performance,Disruption,Recovery,,,
Technischer Fehler,"Die Datenanalyse-Tools funktionieren korrekt. Es gibt Auswirkungen auf die Optimierung der Investitionen. Die Geräte wurden neu gestartet und die Anwendungen erneut installiert, was das Problem gelöst hat.","Sollten Sie sich um dieses Problem kümmern, kontaktieren Sie uns unter <tel_num>. Dies betrifft ein Datenanalyse-Tools-Issue und die Optimierung der Investitionen.",Incident,Technical Support,high,de,400,Bug,Performance,IT,Tech Support,,,,
Support for Application Performance,"Dear <name>, we are aware of the slow response times encountered with the application, despite having taken steps to optimize database queries and clear caches. We would like to assist in resolving this issue. To better understand the problem, could you please provide more details on the current server configuration and the increased user traffic? It would be helpful to know the average number of simultaneous online users and server specifications. We propose scheduling a call to discuss this further at a convenient time.","Dear <name>, we understand that you are experiencing slow response times with the application, even though we have already optimized database queries and cleared caches. We would like to help resolve this issue. To better understand the problem, could you please provide more information about the current server configuration and the increased user traffic? It would be helpful to know the average number of simultaneous online users and server specifications. We suggest scheduling a call to discuss this further at a convenient time.",Incident,Technical Support,high,de,400,Performance,IT,Tech Support,,,,,
Request for Support Due to Data Leak,"Due to possible unauthorized access, a data leak has affected medical records. This is likely due to outdated security protocols. Since then, password updates have been performed, and antivirus scans on affected devices have been conducted.",Confirm the data leak incident. We will investigate the matter. Please provide further details on the affected systems for additional support.,Problem,Customer Service,low,de,400,Security,Virus,IT,Tech Support,Maintenance,,,
,"Hello Customer Support, I am reaching out to inquire about the scalability features and pricing options for your project. Could you provide information on how the project handles increased traffic and usage? What different pricing tiers are available, and what features do they include? I would greatly appreciate it if you could provide relevant documentation and resources. Thank you for your assistance, and I look forward to hearing back soon.","Hello, thank you for reaching out to our customer support team. We appreciate your interest in our project. Our project is designed to handle increased traffic and usage with scalable features that include load balancing and cloud infrastructure. We offer several pricing tiers to accommodate different needs and budgets. These tiers include basic, premium, and enterprise options, each with varying features such as storage and bandwidth, as well as support levels. We will provide a detailed breakdown of the pricing tiers and features, as well as relevant documentation for your reference.",Request,Customer Service,medium,en,400,Feature,Documentation,Feedback,Sales,Tech Support,,,
Strategies for Enhancing Brand Growth with Elasticsearch,"I am seeking insights to enhance brand growth using Elasticsearch, specifically in optimizing search to improve the customer experience. Could you provide strategies for this?","<name>, thank you for reaching out to us regarding Elasticsearch strategies for brand growth. To enhance brand growth and optimize search, we recommend analyzing user behavior and implementing relevant search filters. Additionally, improving the customer experience by personalizing search results with accurate and relevant information can be beneficial. Would you like to discuss these strategies in more detail? Please let us know a convenient time to call you at <tel_num> for a deeper exploration.",Request,Sales and Pre-Sales,medium,en,400,Feedback,Product,Feature,Sales,,,,
,"Dear Customer Support, I am reporting an issue with the SaaS platform while writing a report. There was an error saving project data, which might be related to integration problems with external tools. After refreshing the application and clearing the cache, the issue still persists. I would greatly appreciate your prompt attention to this matter and a quick solution. Please let me know if you need any additional information to resolve the issue. Thank you for your time and assistance. I look forward to hearing from you soon.","Dear [name], we apologize for the issue you're experiencing with the SaaS platform. Thank you for reporting it. We will investigate the problem and get back to you with a solution as soon as possible. If we need any additional information, please contact us at your earliest convenience. You can reach us at [tel_num]. Thank you.",Incident,Product Support,medium,en,400,Bug,Performance,IT,Tech Support,,,,
Guidelines for Securing Medical Data in Oracle,Could you provide detailed practices for securing medical data in Oracle Database 19c? I am particularly interested in learning about the latest security features and how to implement them effectively. What are the recommended steps for encrypting sensitive data and controlling access to it? Are there specific configurations or settings I should be aware of? I would appreciate any guidance or resources you can provide on this topic.,"We will provide information on securing medical data in Oracle Database 19c, including encryption and access control practices. We recommend reviewing Oracle's official documentation and security guidelines for the latest features and configurations. We can offer a call to discuss specific implementation steps and settings. Please let us know a convenient time to schedule this discussion.",Request,Human Resources,medium,en,400,Security,Documentation,IT,Tech Support,,,,
Verfügbare Data Analytics Tools,"Sehr geehrte Kundensupport, bitte nachfragen, welche Data Analytics Tools zur Optimierung der Investitionen zur Verfügung stehen. Ich würde gerne mehr Informationen zu den verwendeten Tools und deren Möglichkeiten erhalten, um informierte Investitionsentscheidungen treffen zu können. Zudem wäre ich interessiert, mehr über die Funktionen und Vorteile dieser Tools zu erfahren, sowie über jegliche Tutorials oder Unterstützungsmöglichkeiten, die zur Verfügung stehen. Zudem freue ich mich, Rat bei der Auswahl eines Tools zu erhalten, um mit dem Verwenden zu beginnen. Vielen Dank für Ihre Unterstützung.","Sehr geehrte [name], wir bieten verschiedene Data Analytics Tools zur Optimierung der Investitionen an, einschließlich Tutorials und Unterstützungsmöglichkeiten. Eine Liste mit den Tools und ihren Funktionen können wir Ihnen per E-Mail zukommen lassen. Falls Sie Präferenz haben, können Sie auch gerne an [tel_num] anrufen, um weiterzudenken.",Request,Customer Service,low,de,400,Feedback,Feature,Documentation,IT,Tech Support,,,
Issues with Software Crashes During High Load,"The data analytics software experiences crashes during high-load periods, which impacts investment optimization. Despite recent updates, cache clearances, and system reboots, the issue still persists. It could be due to inadequate workstation specifications or potential software conflicts. Assistance is needed to resolve this issue.","Dear [Name], acknowledging your email regarding software crashes during high-load periods. To better assist you, could you please provide details on your workstation specifications and software versions? We would like to schedule a call at a convenient time to discuss the issue and explore possible solutions. Please let us know a suitable time for the call at [Tel Num].",Problem,Customer Service,high,en,400,Bug,Crash,Performance,Hardware,IT,Tech Support,,
Leistungsprobleme bei SaaS-Plattform unter Windows 10 Pro,"Kundendienst, mehrere Benutzer melden Leistungsprobleme bei unserer SaaS-Plattform unter Microsoft Windows 10 Pro. Probleme könnten durch neueste Softwareupdates oder Konflikte mit drittanwendungen entstehen. Versucht, das Problem zu lösen, indem Sie Zwischenspeicherdateien löschen, betroffene Anwendungen neu installieren und den Netzwerkverbindungsstatus überprüfen, aber die Probleme bestehen weiterhin. Hilfe bei der Lösung der Angelegenheit wird geschätzt, und es ist wichtig, dass die Erfahrung unserer Benutzer nicht beeinträchtigt wird. Bitte geben Sie weitere Details über die neuesten Softwareupdates und drittanwendungen, die verwendet werden. Es wäre sehr hilfreich, wenn spezifische Fehlermeldungen oder Symptome bekannt gemacht werden könnten. Ich bin bereit, telefonisch aufzuklären, falls dies notwendig ist. Bitte geben Sie eine passende Zeit für eine Verbindung an <tel_num> an.","Bestätige, dass wir uns mit der E-Mail bezüglich der Leistungsprobleme bei der SaaS-Plattform unter Microsoft Windows 10 Pro beschäftigen. Danke für die unternehmenen Schritte zur Überwindung der Probleme. Wir werden die Angelegenheit untersuchen und bitten um weitere Details zur Nutzung der neuesten Softwareupdates und drittanwendungen. Es wäre sehr hilfreich, wenn spezifische Fehlermeldungen oder Symptome bekannt gemacht werden könnten. Ich bin bereit, telefonisch aufzuklären, falls dies notwendig ist. Bitte geben Sie eine passende Zeit für eine Verbindung an <tel_num> an.",Incident,Technical Support,high,de,400,Performance,Network,IT,Tech Support,Bug,,,
Problem with Access to Cloud-Based Tools,"Recently, users have encountered intermittent connectivity issues with cloud-based tools. These issues might be due to network instability or high usage. We have attempted to resolve the problem by resetting network connections and troubleshooting individual applications, but the issues still persist. The problems seem to arise randomly without any warning, causing disruptions to the workflow. We would greatly appreciate your assistance in resolving this matter as soon as possible to prevent further disruptions.","Acknowledging the issue with access to cloud-based tools, we assure you that it is being taken seriously. Please provide us with more details regarding the network instability and specify which tools are affected. It would be helpful to know the approximate time of day when these issues occur. You can contact us at <tel_num> to discuss the matter and schedule a suitable time to resolve the issue at your convenience. Please let us know a suitable time to call.",Problem,IT Support,low,en,400,Network,Disruption,Performance,IT,Tech Support,,,
Update der Server-Konfiguration,"Betreff: Antrag auf Aktualisierung der Server-Konfiguration\n\nSehr geehrte Kundenservice,\n\nich möchte Sie auf die Notwendigkeit hinweisen, unsere Server-Konfiguration zu aktualisieren, um die Leistung während Spitzenzeiten zu verbessern. Derzeitige Server-Setup-Parameter führen zu verlangsamen Loadzeiten und beeinträchtigen die Benutzererfahrung. Es wäre ratsam, die Serverressourcen zu erhöhen, um hohe Verkehrspeaken zu verkraften. Vorschläge für die Aktualisierung sind RAM und CPU zu aktualisieren sowie mehr Server in einen Clustergesamtzusammenhang hinzuzufügen. Ich schätze, dass die Aktualisierung die bestehenden Dienste beeinflussen könnte. Bitte geben Sie bekannt, sobald die nächsten Schritte bestimmt wurden.\n\nMit freundlichen Grüßen","Sehr geehrte <name>,\n\nvielen Dank für Ihre Anfrage zur Aktualisierung der Server-Konfiguration. Ich verstehe die Bedeutung der Leistungsbesserung während Spitzenzeiten. Um Ihren Antrag besser einzuordnen, könnten Sie bitte mehr Informationen über das aktuelle Server-Setup und Nutzungsmuster bereitstellen. Wir werden die Möglichkeiten der Aktualisierung, einschließlich der Hinzufügung von RAM, CPU und mehr Servern in einen Clustergesamtzusammenhang, sowie deren Auswirkungen auf die bestehenden Dienste prüfen. Falls erforderlich, können wir telefonisch an der Nummer <tel_num> über ein Gespräch verhandeln, um die genauen Anpassungen zu besprechen.\n\nMit freundlichen Grüßen",Change,Service Outages and Maintenance,medium,de,400,Maintenance,Performance,IT,Tech Support,,,,
Enhancing Investments with Elasticsearch,Could you provide guidance on optimizing investments using Elasticsearch and PyTorch for data analytics? I look forward to your assistance and a prompt response.,"I would be happy to help with optimizing investments using Elasticsearch and PyTorch for data analytics. To provide tailored guidance, could you please share more about your current setup and what you are trying to achieve? Additionally, it would be helpful to know the specific aspects of investments you are looking to optimize, such as portfolio management or risk analysis. Let's discuss further at your convenience. Please let me know a suitable time for a call.",Request,Technical Support,high,en,400,Feature,Feedback,IT,Tech Support,,,,
Unterstützung für Marketing-Kampagnen,"Eine digitale Marketing-Kampagne wurde gestartet, die jedoch niedrige Beteiligung und Konversionsraten aufwies. Die mangelnde Effektivität der Botschaften und das Zielgruppenansprechen könnte die Ursache sein. Obwohl die Werbung bislang angepasst wurde und Zielgruppensegmente verfeinert wurden, sind signifikante Verbesserungen noch notwendig. Bitte geben Sie weitere Informationen zu Ihrem aktuellen Zielgruppenansprechen und Botschaftenstrategie, damit wir die Kampagne optimieren können, um die Beteiligung und Konversionsraten zu erhöhen.","Ich freue mich, Ihnen bei der Optimierung Ihrer Marketing-Kampagne zu helfen. Um das Problem besser zu verstehen, bitte ich Sie, mehr Informationen zu Ihrem aktuellen Zielgruppenansprechen und Botschaftenstrategie zu teilen. Wir können uns telefonisch auf Nummer <tel_num> treffen, um die möglichen Optimierungsoptionen und die nächsten Schritte zur Verbesserung der Beteiligung und Konversionsraten in Ihrer Kampagne <acc_num> zu besprechen.",Problem,Sales and Pre-Sales,medium,de,400,Feedback,Performance,Documentation,Feature,,,,
Required: Strategies for Safeguarding Medical Data,"Inquiring about security solutions for medical data in hospital settings. Could you provide details on the types of security measures and services offered, such as encryption and access controls? I would greatly appreciate any case studies or whitepapers on this topic. Also, could you inform me about the compliance certifications that the solutions meet, specifically HIPAA? Please let me know if there are any webinars or demos available to learn more about these solutions. I look forward to your response and how it can assist me.",Please contact us at <tel_num> to discuss the medical data security solutions we offer and to provide you with the requested information.,Request,Sales and Pre-Sales,low,en,400,Security,Compliance,Documentation,,,,,
Security Incident in Hospital IT Systems,"Customer Support, <br>A security incident has been detected in the hospital's IT systems, leading to the exposure of sensitive medical data. <br>This might be due to outdated software vulnerabilities. <br>Initial efforts to resolve the issue, such as software updates and enhancing firewall protection, have not been successful. <br>The breach poses a risk to patient confidentiality and requires immediate assistance to address the situation. <br>We would appreciate further details on the outdated software and the firewall protection measures taken so far. Please schedule a call at <tel_num> to discuss the next steps and provide guidance on resolving the issue to prevent future breaches.","{name}, we acknowledge the security incident in the hospital's IT systems and take this matter very seriously. To assist further, could you please provide details on the outdated software and any firewall protection measures that have been taken so far? We will schedule a call at <tel_num> to discuss the next steps and provide guidance on resolving the issue to prevent future breaches.",Problem,Technical Support,medium,en,400,Security,IT,Performance,Bug,Maintenance,,,
Support for the Investment Optimization Tool,"Dear Customer Support,<br>There are problems with the investment optimization tool we are using. The tool is not generating accurate predictions, which might be due to outdated data in Magento. We have tried updating the data feeds and restarting the analytics service, but the issue still persists.<br>Could you please assist us in resolving this issue? We would greatly appreciate any guidance on how to update the data and troubleshoot the problem. Please let us know if you need any additional information from us.<br>Thank you for your help.","{name}, we are here to help with the issues you are experiencing with the investment optimization tool. To better assist you, could you please provide details on the steps you have taken so far and confirm your account number {acc_num} for further investigation? If needed, we can schedule a call at {tel_num} to discuss the issue in more detail. Please let us know a convenient time for you.",Problem,Customer Service,low,en,400,Bug,Performance,Documentation,IT,Tech Support,,,
Verletzung der Datensperre bei Medizinischen Systemen,"Es wurde eine Datensperrverletzung festgestellt, die die Datensicherheit im Bereich Medizin beeinträchtigt. Möglicherweise sind unpatchten Vunerbarkeiten in Ubuntu und Android die Ursache. Obwohl Versuche unternommen wurden, das System zu sichern, einschließlich Aktualisieren der Software und Stärken der Firewalls, bestehen weiterhin Probleme.","Bitte untersuchen Sie die gemeldete Datensperrverletzung. Sie können uns unter <tel_num> kontaktieren, um weitere Schritte zur Sicherung der medizinischen Systeme zu besprechen.",Incident,Technical Support,medium,de,400,Security,Bug,Performance,IT,Tech Support,,,
Login Issue with Projektfahrplan,"Users are experiencing login difficulties occasionally. Despite clearing the browser cache and using Incognito mode, the login issue persists.","Dear <name>, thank you for reporting the login issue with Projektfahrplan. We apologize and need to investigate further. Since the problem still exists even after clearing the browser cache and using Incognito mode, we would like to look into it. Could you please provide more information, such as any error messages you received and the browser you used? Additionally, if possible, we would be glad to discuss the problem over the phone. Please provide a suitable time at <tel_num>, as we can address and hopefully resolve the issue soon.",Incident,IT Support,low,de,400,Login,IT,Tech Support,Performance,,,,
Software for Project Management,"Customer Support, contacting to inquire about the features of a SaaS platform for project management and its scalability. Could you provide information on the platform's support for growth as the team tackles more complex projects? We are looking for a solution that will help us streamline our workflow, enhance collaboration, and improve overall productivity. Specifically, we would like to know about task assignment, progress tracking, and resource allocation features. Additionally, we would appreciate information on the customization options and integration tools provided.","Hello, thank you for reaching out to our customer support team regarding project management software. We can offer a range of features that support team growth as project complexity increases, including task assignment, progress tracking, and resource allocation. Our platform allows for customization and integration tools. We would be happy to provide more information that caters to your specific needs. We are available for a call at <tel_num> or you can email us for the information at <email>",Request,Customer Service,medium,en,400,Feature,Performance,Documentation,Feedback,IT,Tech Support,,
Problem with Login on SaaS Platform,"Experienced occasional login difficulties for users accessing the SaaS platform, which might be caused by backend server overload. We have already cleared the server caches and restarted the services, but the issue still persists. Assistance is needed to resolve this.",Investigate the login problem on the SaaS platform and contact +1-800-123-4567 for help with resolution.,Incident,IT Support,medium,en,400,Login,Performance,Network,Tech Support,,,,
Request for Guidance on Monday.com Integration,"We are reaching out for support in integrating the GNU Compiler Collection with our project tracking on Monday.com. We would appreciate detailed information on the benefits this integration can bring to our workflow. Your guidance and recommended resources would be greatly helpful as we aim to implement this integration successfully. Thank you for your assistance, and we look forward to hearing back from you soon.",Please review the details on integrating GNU Compiler Collection with Monday.com. Kindly provide a convenient time for us to discuss the benefits and further steps.,Request,Customer Service,low,en,400,Feature,Documentation,IT,Tech Support,,,,
Concern about Medical Data Access Delay,There has been a delay in accessing medical data. This could be due to network disruptions or server maintenance. Restarting affected devices and clearing caches might help. We are currently investigating the issue and will provide an update soon. Please let us know if this concerns you.,"Thank you for reporting the delay in accessing medical data. The cause is still under investigation and may be due to network disruptions or server maintenance. To assist us, please provide the time the issue occurred and any error messages you received. We will schedule a call at your convenience at <tel_num> to discuss further. Please let us know a suitable time to contact you regarding <acc_num>. We will provide an update as soon as possible.",Incident,Service Outages and Maintenance,low,en,400,Network,Disruption,Maintenance,IT,Tech Support,,,
Sicherung medizinischer Daten mit DocuSign und SAP,Bieten Sie Empfehlungen zur Sicherung medizinischer Daten.,"Empfehlen Sie, robuste Zugriffskontrolle umzusetzen, sensible Informationen zu verschlüsseln, eine sichere Integration von DocuSign und SAP zu nutzen, um die Konfidenzialität und Integrität medizinischer Daten zu garantieren.",Request,Customer Service,medium,de,400,Backup,Security,Documentation,IT,,,,
Details on Data Analytics Solutions,I am reaching out to customer support to inquire about the data analytics solutions that can enhance investment optimization. Could you provide information on the types of analytics your services offer to help optimize investment decisions? I would greatly appreciate additional details and examples of successful implementations to better understand the benefits for my business. Looking forward to your response and excited to learn more about your data analytics solutions.,"Thank you for reaching out to our customer support team. We appreciate your interest in our data analytics solutions. We offer various types of analytics that can help enhance investment optimization, including predictive portfolio analytics. To provide you with the most relevant information, could you please discuss your specific needs and requirements? I am available to call at your convenience to explore how our solutions can benefit your business and provide case studies and examples of successful implementations during our conversation.",Request,Sales and Pre-Sales,high,en,400,Feedback,Product,Feature,IT,Tech Support,,,
Issues with Data Discrepancies in Investment Analytics,"I am encountering data discrepancies in the investment analytics reports generated from the Oracle Database 19c. The issue might have arisen due to a recent update in the Express.js framework, which has affected the data integration. So far, I have tried reverting the update, clearing the database caches, and verifying the data sources, but the discrepancies still persist. I would greatly appreciate it if you could look into this matter and provide a solution at your earliest convenience.","I have received your email regarding the data discrepancies in the investment analytics reports from the Oracle Database 19c. To assist further, I would like to schedule a call to discuss the issue in detail. Please let me know a convenient time to call you at <tel_num> so we can proceed with troubleshooting and find a solution to the discrepancies you are experiencing.",Problem,Technical Support,high,en,400,Bug,Performance,IT,Tech Support,,,,
