subject,body,answer,type,queue,priority,language,version,tag_1,tag_2,tag_3,tag_4,tag_5,tag_6,tag_7,tag_8
Discovered Variability in Output from the Investment Data Analytics Tool,The investment data analytics tool is generating inconsistent output results.,"<name> sincerely regrets the inconvenience caused by the inconsistent output results from the investment data analytics tool. We take this issue very seriously and are committed to investigating and resolving the problem. Could you please provide details on the inconsistent results you are experiencing, including specific data points and metrics affected, as well as the expected output? Additionally, it would be helpful for us to know which version of the tool you are using and any recent changes made to your account settings. If necessary, we can schedule a call at a convenient time for further discussion.",Problem,Product Support,medium,en,400,Bug,Performance,Feature,Documentation,,,,
Bewertung von digitalen Marketingstrategien,"Ich würde gerne mehr Details über die Rolle digitaler Marketingstrategien im Markenwachstum erfahren, insbesondere wie sie Kundenengagement steigern. Besonders interessiert mich die Ausrichtung auf Sozialmedien und Contentmarketing. Ich freue mich auf Ihre Rückmeldung und danke Ihnen für Ihre Unterstützung.","Ich freue mich darauf, über digitale Marketingstrategien zu sprechen. Indem wir die Kombination von Sozialmedien- und Contentmarketing-Taktiken nutzen, können wir Markenwachstum und Kundenengagement fördern. Wenn Sie präzisere Informationen benötigen, lassen Sie uns bitte telefonisch vereinbaren, um auf Ihre spezifischen Fragen einzugehen.",Request,Technical Support,high,de,400,Feedback,Sales,Feature,,,,,
Problem with ClickUp Integration,"Facing issues with the integration of the ClickUp project management platform. It might be due to recent API changes. We have tried reconfiguring the integrations and checking the API credentials, but the problem still persists. Despite the team's efforts in troubleshooting, we are unable to resolve the issue. We would appreciate your assistance and guidance to help us resolve this matter.","The Service Desk team is assisting with the issue related to the ClickUp integration. We regret to hear that you are experiencing difficulties, especially after attempting to reconfigure the integrations and check the API credentials. To better understand the issue, we would like to gather more information. Please provide any error messages you are receiving and the specific steps you have taken so far. Additionally, it would be helpful to know the version of the ClickUp project management platform you are using. If needed, we can schedule a call at <tel_num>.",Incident,Technical Support,medium,en,400,Bug,Network,IT,Tech Support,Performance,,,
QuickBooks Integration and Pricing,"Could you provide details on the billing options, QuickBooks integration, project management, and SaaS services? I need to understand the available plans and pricing to make an informed decision.","We offer various billing options for QuickBooks integration, project management, and SaaS services. Our plans include monthly and annual subscriptions with different pricing tiers. For more detailed information and pricing, please provide, or call us for a convenient discussion to address your needs further.",Request,Billing and Payments,high,en,400,Billing,Payment,Product,Feature,Sales,,,
Systemanomalie,Wir bemerken häufige Systemabstürze bei der SaaS-Projektmanagement-Plattform nach den neuesten Updates.,"Entschuldigung für die bereitgestellte Unannehmlichkeit durch die Systemanomalie bei der SaaS-Projektmanagement-Plattform. Bitte geben Sie mehr Details und Fehlermeldungen an, damit wir das Problem untersuchen können. Sie können für weitere Diskussionen per E-Mail kontaktiert werden.",Incident,Technical Support,high,de,400,Bug,Crash,Performance,IT,Tech Support,,,
Support Inquiry about Investment Forecasting Tool,The investment optimization tool has been providing accurate forecasts following recent data integration modifications.,"We have received a support inquiry regarding an issue with the investment optimization tool. To assist you, we need details on the recent data integration changes and any error messages you are receiving. Please provide these details so we can provide a solution or suggest scheduling a call to discuss further.",Problem,IT Support,low,en,400,Feature,Documentation,Feedback,Tech Support,,,,
Properly Safeguarding Medical Data,Seeking details on securing medical data with Surface Pro and SQL Server integration.,"Thank you for your concern about safeguarding medical data. To ensure its security during Surface Pro and SQL Server integration, we recommend enabling encryption and secure authentication. Please provide details on your current setup and configuration, as I am happy to provide specific guidance and recommendations. I prefer to discuss this further over a call at <tel_num>.",Request,General Inquiry,low,en,400,Security,IT,Tech Support,,,,,
Website Loading Times Are Slow,"The agency's website is experiencing slow loading times. Recent software updates and increased traffic might be the cause. We have cleared the cache and optimized images, but the issue still persists.",Received your email regarding the slow loading times of the agency's website. I would like to investigate further. Please provide details on the recent software updates and the optimization steps that have been taken so far.,Incident,IT Support,medium,en,400,Performance,Maintenance,IT,Tech Support,,,,
PrestaShop-Security-Guide,"Dear Customer Support, please guide me on securing medical data within PrestaShop Magento 2.4. Given the critical nature of medical data, I aim to ensure compliance with relevant regulations on my e-commerce platform. Could you provide best practices on how to secure medical data in such platforms? Specifically, I would like to know about the encryption methods, access controls, and data recovery procedures that should be implemented. I would also appreciate recommendations for security plugins and extensions. Thank you.","Dear <name>, thank you for reaching out regarding securing medical data within PrestaShop Magento 2.4. We take data security seriously and are here to assist you. To ensure compliance with relevant regulations, we recommend using encryption methods such as SSL/TLS, implementing role-based access controls, and regularly performing data recovery procedures. For enhanced security, consider using plugins and security patches, and implementing two-factor authentication. We also advise adhering to password protection policies and configuring secure protocols.",Request,Returns and Exchanges,medium,de,400,Security,Compliance,IT,Tech Support,,,,
Support for Critical System Failure,"A critical system failure occurred, which has affected the access to investment data and the analysis tools. It seems to have been caused by a server failure or a network disruption. Attempts to restart affected services and debug network connections were unsuccessful. Please help us address the issue quickly to minimize its impact on operations.","Dear [Name],\n\nI am writing to inform you about the critical system failure that has impacted the access to investment data and the analysis tools. I understand the urgency of the problem and its potential impact on operations.\n\nTo address this issue swiftly, I need to gather more information about the server failure or network disruption, and consider the possible causes of the failure. Could you please provide any details or logs of the errors and any observations made during the debugging process? If necessary, we can schedule a call to discuss further.",Incident,Service Outages and Maintenance,high,de,400,Bug,Network,Performance,Outage,Disruption,IT,Tech Support,
Anfrage zu Sicherheitsmaßnahmen für medizinische Daten,"Sehr geehrte Kundenservice, ich schreibe Ihnen, um Informationen über Sicherheitsmaßnahmen bei Krankenhausauftrags-IT-Lösungen zu erhalten. Könnten Sie detaillierte Informationen zu Verwendung, Protokollen und Technologien geben, die zur Sicherstellung der Vertraulichkeit, Integrität und Verfügbarkeit sensibler Patientendaten dienen? Es würde mich freuen, wenn Sie Hinweise geben könnten, die Lösungen anwendbaren Gesundheits-Regulierungen und Standards entsprechen. Zusätzlich interessiere ich mich für weitere Sicherheitsfunktionen und Dienstleistungen, die die Schutzmaßnahmen für medizinische Daten verbessern. Vielen Dank für Ihre Zeit und Unterstützung bei dieser Angelegenheit. Ich freue mich darauf, bald von Ihnen zu hören.","Sehr geehrter [Name], wir verwenden robuste Protokolle und Technologien, um die Sicherheit medizinischer Daten zu gewährleisten und Vertraulichkeit, Integrität und Verfügbarkeit zu sichern. Unsere Lösungen entsprechen strengen Standards und bieten zusätzliche Sicherheitsfunktionen, um den Schutz zu verbessern. Sie können uns unter [Telefonnummer] anrufen, um detaillierte Informationen zu Sicherheitsmaßnahmen und Protokollen zu erhalten. ",Request,Billing and Payments,medium,de,400,Security,Documentation,Feedback,IT,,,,
Potenzielle Sicherheitslücke in Krankenhaus-Systemen,"Ein potenzielles Sicherheitslückenproblem wurde in den IT-Systemen des Krankenhauses erkennbar, da ältere Software verwendet wird.","Wir nehmen das potenzielle Sicherheitslückenproblem ernst und werden sofort eine Untersuchung starten. Bitte geben Sie mehr Informationen zu der alten Software und dem Erkennungsmechanismus an. Das werde uns helfen, weitergehende Unterstützung bei der Lösung der Situation bereitzustellen.",Incident,Billing and Payments,high,de,400,Security,IT,Tech Support,,,,,
Sicherheit medizinischer Daten in IT-Systemen von Krankenhäusern,"Lieber Kundensupport, ich hoffe, Sie sind in bester Gesundheit. Ich wende mich an Sie, um umfassende Informationen über die Datensicherheit medizinischer Daten in unseren IT-Systemen zu erhalten. Könnten Sie Ratschläge geben, welche Funktionen und Praktiken unserer Produkte sicherstellen, dass die Vertraulichkeit, Integrität und Verfügbarkeit sensibler medizinischer Informationen gewährleistet werden? Ich wäre sehr dankbar, wenn Sie mir Zugriff auf Ressourcen und Whitepapers zu diesem Thema geben könnten, die zeigen, wie unsere Produkte in Krankenhäusern erfolgreich eingesetzt wurden. Ich freue mich darauf, bald von Ihnen zu hören und spezifische Fragen zur Datensicherheit medizinischer Daten zu klären.","Lieber <name>, ich danke Ihnen für Ihre Anfrage bezüglich der Datensicherheit medizinischer Daten in unseren Produkten. Wir legen großen Wert auf die Sicherstellung der Vertraulichkeit, Integrität und Verfügbarkeit sensibler medizinischer Informationen. Unsere Produkte bieten Funktionen wie Verschlüsselung, Zugriffssteuerungen und Auditing, um die Sicherheit zu gewährleisten. Sie haben Zugriff auf detaillierte Informationen zu Datensicherheits-Whitepapers und Fallstudien, die zeigen, wie unsere Produkte in Krankenhäusern erfolgreich eingesetzt wurden. Ich würde gerne einen Gesprächstermin vereinbaren, um spezifische Fragen zur Datensicherheit medizinischer Daten in unseren Produkten zu klären.",Request,Product Support,low,de,400,Security,IT,Tech Support,Documentation,Feedback,Performance,,
Query Regarding Brand Support with Adobe Creative Cloud and Grammarly,Is it possible to share information on digital strategies employed by brands utilizing Adobe Creative Cloud and Grammarly? We are keen to learn about the tools that can enhance our brand's content creation and editing processes.,I would be delighted to discuss digital strategies involving Adobe Creative Cloud and Grammarly. Please allow me to schedule a call to provide you with detailed information.,Request,Customer Service,low,en,400,Feedback,Product,Feature,Documentation,IT,Tech Support,,
Issues with Software,"Continuous software integration is causing delays in the project updates. Recent software updates and API changes are contributing to the problem. I attempted to resolve it by reinstalling the software and clearing caches, but unfortunately, it has not improved.","Notified about software issues via email. To be more helpful, could you please provide more details about the API changes? Looking forward to a timely meeting to solve the problem.",Incident,Product Support,low,de,400,Bug,Performance,IT,Tech Support,,,,
Unerlaubte Zugriffsanfrage auf medizinisches Datenystem melden,"Ich mache Ihnen auf veraltete Sicherheitsprotokolle und Vernetzungsinfrastrukturen hin, die möglicherweise durch unerlaubte Zugriffsanfragen auf medizinisches Datenystem verursacht werden. Trotz aktualisierter Passwörter und verstärkter Firewalls werden Versuche weiterhin registriert. Bitte unterstützen Sie uns bei der Untersuchung und Lösung dieser Angelegenheit. Geben Sie Anweisungen für die weiteren Handlungen sowie notwendige Maßnahmen, um die Systeme sicherzustellen.","Wir nehmen unerlaubte Zugriffsanfragen sehr ernst und werden sie unverzüglich untersuchen. Für die Fortsetzung der Untersuchung benötigen wir zusätzliche Informationen über die Anfragen, einschließlich des Datums, der Uhrzeit und eventuell empfangener Fehlermeldungen. Es wäre mir eine Freude, telefonisch mit Ihnen zusammenzuarbeiten, sobald es passend ist. Bitte geben Sie mir eine geeignete Zeit, um Sie anzurufen: <tel_num>. In Zusammenarbeit mit Ihnen werden wir die Ursache identifizieren und die notwendigen Maßnahmen zur Sicherstellung des Systems und der Schutz der medizinischen Daten empfehlen.",Problem,Technical Support,high,de,400,Security,Network,IT,Tech Support,,,,
Verbessern der Unterstützung in der Datenanalyse für die Investitionsbewirtschaftung,Ich würde gerne mehr Details zu den Beiträgen des NAS-Systems in der Datenanalyse und Investitionsoptimierung erfahren. Welche Funktionen und Vorteile bietet das System?,"Sehr geehrte [Name], wir bedanken uns für Ihr Interesse an den Fähigkeiten des NAS-Systems in der Datenanalyse für die Investitionsbewirtschaftung. Das System bietet fortschrittliche Funktionen wie realzeitbasierte Datenverarbeitung, -analyse, maschinelles Lernen und Datenvisualisierungswerkzeuge, die dabei helfen, informierte Investitionsentscheidungen zu treffen. Das NAS-System unterstützt Sie dabei, tief in Marktentwicklungen einzusteigen und Ihr Investitionsportefeuille zu optimieren, um Risiken zu reduzieren. Die Vorteile des Systems umfassen eine erhöhte Investitionszukunft, reduzierte Risiken und verbesserte Entscheidungsfindungsfähigkeiten. Wir freuen uns, eine detaillierte Demonstration der Funktionen des Systems für Sie zu übermitteln. Falls Sie ein Telefongespräch wünschen, stehen wir Ihnen gerne zur Verfügung.",Request,Sales and Pre-Sales,high,de,400,Feedback,Feature,Documentation,,,,,
Beim Betrieb des Programms kommt es zu Stürzen,Ich bitte um Hilfe,"Sehr geehrter Kundendienst, wir benötigen Unterstützung bei einem Sturz des Programms. Könnten Sie bitte mehr Details zum Problem liefern? Wir freuen uns darauf, eine Lösung für Ihr Problem zu finden. Möchten Sie, dass wir uns bald darüber unterhalten und weitere Details besprechen?",Incident,IT Support,high,de,400,Bug,Crash,IT,Tech Support,,,,
Concern with SaaS Project Management Tool,"Have encountered connectivity problems with the SaaS project management tool, which integrates various devices such as external storage and smart home gadgets. The issue might be related to recent software updates or device compatibility. Steps taken include restarting devices and reconfiguring network settings, but the problem still persists. Assistance in resolving this matter would be greatly appreciated. Please provide any additional information if needed.","In response to your email regarding the SaaS project management tool issue. To assist further, could you please provide details on the software updates that were installed on your devices and the exact models being used? Additionally, knowing the specific error messages you are receiving would be very helpful. We would like to schedule a call at your convenience to discuss this matter further; please let us know a suitable time to contact you at <tel_num>.",Incident,Technical Support,medium,en,400,Network,Performance,Bug,Hardware,IT,Tech Support,,
Support for Marketing Strategy,"Customer Support, <br><br>I am working on a report about the marketing strategy. The digital strategies from the marketing agency are not yielding the expected brand growth. Possible reasons include poor targeting and ineffective platforms. I have tried adjusting ad spends and reviewing analytics, but the results are still unsatisfactory. Our team has invested significant time and resources, and we are disappointed with the lack of progress. I would appreciate any guidance to help improve the strategy to achieve the desired outcomes.","I would be happy to help with your marketing strategy concerns. To better understand the issue, could you please provide specific information about the current strategy and the results you are seeing? Based on this information, I can provide recommendations to improve brand growth. If needed, we can schedule a call at a time that suits you. Please let me know a convenient time for the call. You can reach me at <tel_num>.",Incident,Technical Support,high,en,400,Feedback,Sales,IT,Tech Support,,,,
Inquiry About Billing Options for Adobe Sign and HelloSign Subscriptions,Could you please give me comprehensive details on the billing options for Adobe Sign and HelloSign subscriptions?,"Dear [Name], I would be delighted to provide you with detailed information about the billing options for Adobe Sign and HelloSign subscriptions. We offer various plans with different pricing structures and billing cycles. To discuss this in more detail, we can arrange a convenient call. Please let me know a suitable time for you to contact me at [Tel Number].",Request,Billing and Payments,medium,en,400,Billing,Subscription,Payment,Documentation,,,,
Concern About Sharp Decline in Website Traffic,"Noticed a significant decrease in website traffic over the past 48 hours. This might be due to recent algorithm updates or technical glitches. So far, I have cleared the cache, reviewed the analytics settings, and attempted to troubleshoot. I would greatly appreciate your prompt assistance in resolving this issue. Could you please let me know if there are any additional steps I should take to resolve the problem?","Received your email about the sudden drop in website traffic. To assist you better, could you please provide details on the recent algorithm changes and the current analytics settings? Once you have provided this information, we can review it together and discuss the appropriate next steps to resolve the issue.",Incident,Technical Support,low,en,400,Performance,Network,Bug,IT,Tech Support,,,
'Problem with Data Analytics Software',The financial firm's software experienced a crash during the investment optimization process. The system was rebooted and updated.,"Dear [name], thank you for reporting the issue with the data analytics software. We are sorry to hear that the investment optimization process was affected. Since the updated software has already been rebooted, could you please confirm if the issue still persists? If it does, we would like to investigate further and may need your contact information for a follow-up. If convenient, we would be available to discuss further by phone at a time that suits you. Please let us know a suitable time.",Problem,Technical Support,high,en,400,Bug,Crash,Performance,IT,Tech Support,,,
Potential Compromise of Medical Data Due to Security Breach,"A security breach has been detected, which may be compromising medical data due to outdated firewall settings. Despite running updated security protocols and system scans, the issue still persists.","Regarding the security breach reported and its potential impact on medical data, we would like to discuss this issue with you. Please let us know a suitable time to call at <tel_num> to proceed with the next steps concerning <acc_num>.",Problem,Technical Support,high,en,400,Security,Virus,Bug,IT,,,,
Unerlaubten Zugriff auf medizinische Daten bei dem Krankenhaus-IT-System entdeckt,"Es wurde ein unerlaubter Zugriff auf medizinische Daten im IT-System des Krankenhauses festgestellt. Dies scheint auf veraltete Sicherheitsprotokolle zurückzuführen sein. Bislang wurden Passwortsicherheitsrichtlinien und das Überwachen von Zugriffsmustern berücksichtigt. Wir bitten höflich um Unterstützung bei einem gründlichen Sicherheitsaudit und der Implementierung zusätzlicher Maßnahmen, um zukünftige Vorfälle zu verhindern.",Unterstützung für das Audit wird unverzüglich geleistet.,Problem,IT Support,high,de,400,Security,IT,Tech Support,Bug,,,,
Update des Rechnungsverfassungsverfahrens für Marketingdienstleistungen,"Bitte aktualisieren Sie unser Rechnungsverfassungsverfahren für Zahlungsverfahren bei Marketingdienstleistungen, da wir eine Anfrage für die Zusammenarbeit in der digitalen Strategieentwicklung erhalten haben. Das Unternehmen hat kürzlich den Rechnungsverfassungsort und Zahlungsverfahren geändert. Könnten Sie uns die neuesten Informationen zur Verfügung stellen, um mögliche Störungen unserer Dienstleistungen zu vermeiden? Wir danken Ihnen für Ihre schnelle Rückmeldung und freuen uns auf Ihre Antwort baldigst.","Um den neuen Rechnungsverfassungsprozess zu unterstützen, bitte geben Sie uns die neue Adresse und Zahlungsweise zur Bestätigung der Bearbeitung an.",Change,Billing and Payments,medium,de,400,Billing,Payment,Feedback,Sales,IT,Tech Support,,
Inquiry on Pricing Tiers and Payment Options,"Hello Customer Support, I am reaching out to inquire about the pricing tiers and payment options available for the SaaS product. Could you please provide detailed information on the different plans, including any discounts, long-term commitments, and special promotions that might be available? I would greatly appreciate it if you could explain the payment process and any potential additional fees associated with the service. Additionally, I would like to know more about free trials and demonstrations to see if committing to a paid plan is the right choice for me.","Thank you for reaching out to our customer support team, <name>. Our SaaS product offers several pricing tiers with discounts available, especially for long-term commitments and special promotions. The payment process is straightforward with no hidden fees. We offer a free trial to test the product before committing to a paid plan. If you would like to discuss this further, please call <tel_num> to answer any questions you may have and provide you with detailed information on our pricing plans.",Request,Billing and Payments,low,en,400,Billing,Payment,Product,Feature,Feedback,Sales,,
Google Cloud Support,"Sehr geehrte Kundenservice-Abteilung, ich wende mich an Sie, um detaillierte Dokumentation zur Integration von Google Cloud Platform in Projektmanagement-Software-as-a-Service (SaaS) zu erhalten. Könnten Sie mir bitte Schritt-für-Schritt-Anweisungen liefern und mich auf die entsprechende Quelle hinweisen? Ich freue mich auf jegliche Leitung, die mir geben können. Vielen Dank für Ihre Unterstützung. Ich freue mich darauf, bald von Ihnen zu hören.","Sehr geehrte [Name], wir bedanken uns für Ihre E-Mail bezüglich der Google Cloud Support Integration in Google Cloud Platform für Projektmanagement-SaaS. Wir freuen uns, Ihnen die notwendige Dokumentation zur Verfügung stellen zu können und Ihnen dabei zu helfen. In unserer Wissensbasis finden Sie eine umfassende Anleitung zur Integration von Google Cloud Platform in SaaS, einschließlich Schritt-für-Schritt-Anweisungen und Problemlösungstipps. Informationen zum Anmelden Ihres Konto [acc_num] und zur Navigation in der Unterstützungssektion unserer Website sind ebenfalls verfügbar. Wenn Sie Informationen finden, melden Sie bitte uns einen direkten Link.",Request,Product Support,medium,de,400,Documentation,Feature,IT,Tech Support,,,,
Analysis of Issue Tracking Metrics,The tracking analytics indicate precise campaign performance metrics following the recent software updates.,We apologize for any discrepancies in the issue tracking metrics. Please provide details as we are seeing inaccurate data post the recent software updates. Our technical team will investigate and work to resolve the issue. Kindly contact +1-800-123-4567 to discuss further. Please let us know a convenient time for a call.,Problem,Technical Support,low,en,400,Performance,Documentation,Bug,Feature,,,,
Langsame Ladezeiten SaaS-Plattform,"Erleben Sie momentan langsame Ladezeiten auf Ihrer SaaS-Plattform. Möglicherweise sind die neuesten Datenbank-Updates oder Spitzenzeiten des Verkehrs die Ursache. Bitte geleeren Sie den Cache und optimieren Sie die Abfragen. Das Problem behält sich jedoch bestehen. Bitte benötigen Sie Unterstützung, um das Problem zu lösen.","Überprüfen Sie bitte Ihren Antrag bezüglich der langsam laufenden Ladezeiten auf Ihrer SaaS-Plattform. Um besser helfen zu können, freue ich mich auf weitere Details und Informationen über die neuesten Datenbank-Updates und die Spitzenzeiten des Verkehrs, die Sie erlebt haben. Es wäre außerdem sehr hilfreich, wenn Sie genaue Fehlermeldungen und Symptome angeben könnten. Bitte vereinbaren Sie eine Anrufzeit für Beratung. Teilen Sie mir bitte ein geeignetes Zeitfenster für die Anrufung (<tel_num>) mit.",Problem,Technical Support,high,de,400,Performance,Network,IT,Tech Support,,,,
