subject,body,answer,type,queue,priority,language,version,tag_1,tag_2,tag_3,tag_4,tag_5,tag_6,tag_7,tag_8
Anfrage zu Daten-Sicherheit,"Sehr geehrte Kundenservice, könnten Sie mir Informationen zu Daten-Sicherheitsmaßnahmen geben, die zur Bewahrung medizinischer Informationen dienen? Ich möchte mehr über Protokolle erfahren, wie sie eingesetzt und wie sensible Daten geschützt werden können. Die Protokolle sollten Verschlüsselungsmethoden, Zugriffskontrolle und Datenlagerungsverfahren umfassen. Ich schätze Ihre Zeit und freue mich auf eine Rückmeldung. Vielen Dank für Ihre Unterstützung bei dieser Angelegenheit.","Wir nehmen Daten-Sicherheit sehr ernst und haben robuste Maßnahmen, um medizinische Informationen sicher zu bewahren. Unsere Protokolle umfassen Verschlüsselung, sichere Zugriffskontrolle und kompliantes Datenlagerung. Ich freue mich, detaillierte Informationen mit Ihnen zu diskutieren. Bitte lassen Sie mich wissen, wann Sie sich für einen Anruf verbinden möchten.",Request,Billing and Payments,medium,de,400,Security,Documentation,Feedback,IT,Tech Support,,,
Scaling,"Dear Customer Support, I am writing to seek additional details about the scaling features of the billing statement functions in our project management SaaS platform. Could you please provide more information on how these features can meet growing project demands? I would be grateful for any guidance or resources you can offer to help navigate this process. Thank you for your time and assistance. I look forward to hearing back from you soon.","Dear [Name], thank you for your message. We have noted your request to assist with the scaling of billing statement functions in our project management SaaS platform. Could you please provide more details about your current setup and how these features should meet growing project requirements? I am happy to offer guidance and resources to help you scale these functions effectively. If further assistance is needed, we can arrange a call; please contact us at [Phone Number].",Request,Billing and Payments,medium,de,400,Feature,Billing,Performance,Documentation,Feedback,IT,,
Assistance Required for Unauthorized Access to Medical Data Systems,"There have been experienced unauthorized access attempts to our medical data systems. These attempts may be due to outdated security protocols. Despite enhancing firewall settings and resetting credentials, the access attempts continue to persist. I need assistance in resolving this issue to ensure the security of our data systems.","I am concerned about the unauthorized access attempts to our medical data systems. To assist you better, could you please provide information on the current security protocols in place and any specific details about the access attempts made? Additionally, it would be helpful if you could provide me with details about the issue. Once I have this information, I will schedule a call at your convenience to discuss and determine the best course of action to ensure the security of our data systems. Please let me know a suitable time for the call.",Incident,Product Support,medium,en,400,Security,IT,Tech Support,Bug,,,,
Support for Integrating Digital Marketing Tools to Drive Business Growth,"I need assistance in integrating digital marketing tools to enhance existing systems, boost brand size, and improve business processes.",Integrating digital marketing tools can be beneficial. Please provide more details on your existing systems and the specific tools you wish to integrate. This will help us guide you through the next steps towards achieving better brand size and improved business processes.,Change,Technical Support,high,de,400,Feedback,IT,Tech Support,,,,,
Support Problem with Data Analytics Tool,"The data analytics tool encountered a crash, disrupting investment analysis because of incompatible software updates.","Investigating the crash issue with the data analytics tool, it appears to be caused by incompatible software updates. To resolve this, I recommend rolling back the recent updates and installing the patch. If the issue persists, please provide details of the error message and schedule a call at a convenient time for you to troubleshoot further.",Incident,Human Resources,low,en,400,Bug,Crash,Performance,IT,Tech Support,,,
Request for Support on Funding Assistance,"We are encountering unexpected billing discrepancies and payment processing issues that seem to affect multiple products. We believe these issues might be due to recent software updates and integration settings. We have attempted to resolve the matter by contacting customer support, but the problem remains unresolved. We highly value your prompt attention to this matter and would appreciate your assistance in implementing a solution to resolve the discrepancies. Please provide any additional information from our website that could help in the investigation.","I will immediately look into the billing discrepancies and issues affecting the products. To facilitate the investigation, please provide any additional details regarding the suspected software updates and integration settings. Additionally, it would be helpful to know the account numbers involved, such as <acc_num>. We would like to schedule a discussion. If a phone conference is available at a convenient time, please share the appropriate time. You can reach us at <tel_num>.",Incident,Billing and Payments,high,de,400,Billing,Payment,Bug,Support,Performance,Documentation,Feedback,
Versicherte Medizinische Daten,"Brauche Anleitungen zur Sicherung medizinischer Daten auf Google Cloud Platform für die Klinik-IT. Könnten detaillierte Anweisungen zur Erstellung einer sicheren Umgebung mit Datenverschlüsselung, Zugriffskontrolle und Einhaltung der HIPAA-Vorschriften liefern?","Versicherte Anleitungen zur Sicherung medizinischer Daten auf Google Cloud Platform anbieten. Eine sichere Umgebung einzurichten, benötigen wir mehr Informationen über die aktuellen Anforderungen. Wären bereit, telefonisch mit Ihnen zu diskutieren und detaillierte Anweisungen zu liefern.",Request,Billing and Payments,medium,de,400,Security,Documentation,IT,Tech Support,,,,
Berichtsgenerierungs-System Fehlermeldung,Finanzfirma erlebt Verzögerungen bei Investitionsberichten aufgrund von Datenintegrationsschwierigkeiten.,"Datenintegrationsschwierigkeiten analysieren, Verzögerungen bei Investitionsberichten verursachen, wenden Sie sich an <tel_num> für weitere Diskussionen und Lösungen.",Incident,Customer Service,low,de,400,Bug,Performance,Disruption,IT,Tech Support,,,
Suche nach Optimierung von Investitionen mit MATLAB R2021a,"Sehr geehrte Kundensupport, ich möchte mich erkundigen, wie ich die Funktionen von MATLAB R2021a für die Datenbasierte Investitionsanalyse und Optimierung nutzen kann. Könnten Sie mir erläutern, welche Werkzeuge und Funktionalitäten MATLAB R2021a zur Verfügung stellen, um Investitionsportfolios zu analysieren und zu optimieren? Insbesondere interessiert mich die Anwendung verschiedener Funktionen wie Datenvisualisierung, statistische Modellierung und Maschinelles Lernen in der Investitionsanalyse. Zudem würde ich mich freuen, Empfehlungen zu Tutorials, Webinaren und Online-Kursen zu erhalten, die mir bei der Nutzung von MATLAB R2021a zur Investitionsoptimierung helfen können.","Sehr geehrte [name], MATLAB R2021a bietet umfangreiche Werkzeuge zur Investitionsoptimierung, einschließlich Funktionen zur Datenvisualisierung, statistischen Modellierung und Maschinellem Lernen. Bitte rufen Sie mich gerne unter [tel_num] an, um diese Themen weiter zu besprechen und Empfehlungen zu Tutorials, Webinaren und Online-Kursen zu erhalten, die Ihnen bei der Nutzung von MATLAB R2021a zur Investitionsoptimierung helfen können.",Request,Customer Service,medium,de,400,Feature,Documentation,Feedback,Training,IT,Tech Support,,
,"Sehr geehrte Kundenservice, ich wende mich an Sie im Anschluss an meine Anfrage nach digitalen Marketingdienstleistungen, um Möglichkeiten zu erkunden, wie wir das Markenwachstum fördern können. Ich bin interessiert, mehr über Strategien und Techniken zu erfahren, die Online-Visibilität und Engagements steigern. Könnten Sie mir Details zu den angebotenen Dienstleistungen liefern, wie z.B. Social-Media-Management, Suchmaschinenoptimierung und Inhaltserstellung? Zusätzlich würde ich gerne Informationen zu Methoden erhalten, mit denen der Erfolg von Kampagnen gemessen wird, und die Art der Resultate, die ich erwarten kann. Bitte teilen Sie mir auch Fallstudien oder Beispiele erfolgreicher digitaler Marketingkampagnen mit.","Wir bieten Social-Media-Management, Suchmaschinenoptimierung und Inhaltserstellung an. Zögern Sie nicht, uns zeitgerecht anzurufen, um Details zu besprechen und Fallstudien zu teilen.",Request,IT Support,medium,de,400,Sales,Feature,Feedback,Tech Support,,,,
,"Sehr geehrte Kundensupport, ich begegne einem Leistungsriss bei der Projekt-Protokolldatei, der den Benutzerbelastung Spitzenzeiten zu verdanken ist. Trotz des Versuchs, den Cache zu löschen und die Seite neu zu laden, besteht der Fehler weiterhin. Ich schätze es, wenn Sie die Angelegenheit annehmen und einen Lösungsansatz zur Verbesserung der Leistung und der Protokolldatei anbieten. Bitte lassen Sie mich wissen, falls Sie weitere Informationen benötigen, um das Problem zu lösen. Vielen Dank für Ihre Unterstützung. Ich freue mich darauf, bald von Ihnen zu hören.","Wir haben Ihre E-Mail über den Leistungsriss bei der Projekt-Protokolldatei erhalten und werden uns um die Angelegenheit kümmern. Bitte geben Sie uns die genaue Kontonummer und die Zeitfenster an, in denen das Problem auftritt, damit wir Ihnen besser helfen können.",Problem,Technical Support,low,de,400,Performance,Bug,Feedback,IT,Tech Support,,,
Mögliche Datensperrverletzung im Medizinischen Datensystem,"Bewährten Sie sich, geachtete Kundensupport-Team,<br><br>Wir informieren Sie über mögliche Datensperrverletzungen im Medizinischen Datensystem. Diese könnten auf veralteten Sicherheitsprotokollen zurückzuführen sein. Wir haben bereits erste Einschätzungen durchgeführt, um Schwachstellen zu finden und mögliche Probleme zu identifizieren. Jedoch nehmen wir den Fall ernst und führen eine eingehende Untersuchung durch, um den Umfang der Verletzung und die Ursachen zu bestimmen.<br><br>Wir teilen Ihnen weitere Informationen unten mit. Zwischenzeitlich raten wir unseren Kunden, ihre Konten aufmerksam zu überwachen und verdächtige Aktivitäten zu melden.<br><br>Vielen Dank für Ihr Verständnis und die Zusammenarbeit.",Wir danken Ihnen für Ihre detaillierte Mitteilung bezüglich möglicher Datensperrverletzungen. Wir werden weiterhin die Konten überprüfen und verdächtige Aktivitäten identifizieren. Sie erhalten weitere Updates.,Incident,Product Support,medium,de,400,Security,Bug,IT,Tech Support,,,,
Langsame Leistung von Abfragen in der Datenbank,"Wir haben beobachtet, dass die Abfrageleistung in Ihrer MySQL-Datenbank langsam ist.","Sehr geehrte [Name],\n\nwir haben Ihre E-Mail über die langsame Abfrageleistung in Ihrer MySQL-Datenbank erhalten. Um Ihnen besser helfen zu können, bitten wir Sie, weitere Details zu den betroffenen Abfragen sowie die aktuelle Datenbankkonfiguration bereitzustellen. Diese Informationen helfen uns, die Ursache des Problems zu identifizieren und eine angemessene Lösung anzubieten.\n\nfalls es notwendig ist, können wir telefonisch Kontakt aufnehmen (Tel. [Telefonnummer]), um weitere Details zu besprechen. Bitte geben Sie ein geeignetes Zeitfenster an.\n\nVielen Dank und beste Grüße",Incident,Product Support,low,de,400,Performance,IT,Tech Support,,,,,
Rechnungsübereinstimmung,"Gestresste Kundenservice, es sind Rechnungsfehler entstanden, die Konto nicht korrekt abgerechnet wurde. Aufgrund eines jüngsten Software-Updates könnte dies passiert sein. Ich habe die Zahlungsdetails bereits überprüft und versucht, das Problem durch Anpassung der Konto-Einstellungen zu lösen. Allerdings bestand das Problem weiterhin, daher bitte ich um weitere Unterstützung. Könnten Sie bitte schnellstmöglich nachgehen, ob eine Lösung möglich ist? Ich danke Ihnen im Voraus für Ihre Hilfe bei der Behebung des Problems und in der Verhinderung zukünftiger Fehler. Bitte geben Sie Bescheid, falls weitere Informationen erforderlich sind. Vielen Dank.","Gestresste [name], entschuldigen Sie die Rechnungsübereinstimmung, danken Sie für Ihre Aufmerksamkeit. Um das Problem zu lösen, könnten Sie bitte die Kontonummer <acc_num> und eine ausführliche Beschreibung des Fehlers zur Verfügung stellen. Falls nötig, könnten wir telefonisch Kontakt aufnehmen (<tel_num>) und das Problem diskutieren. Wir bemühen uns, schnellstmöglich eine Lösung zu finden, um zukünftige Fehler zu vermeiden. Vielen Dank für Ihr Verständnis und Ihre Zusammenarbeit. Bald werden wir Kontakt aufnehmen, um das Problem zu lösen.",Problem,Billing and Payments,high,de,400,Billing,Account,Payment,Tech Support,Feedback,,,
Concerns About Investment Data Integration Procedure,"Dear Customer Support, <br />We are encountering issues with the financial firm's data analytics tool when integrating investment data from multiple sources, which is leading to discrepancies. It is possible that this might be due to compatibility issues between the upgraded software versions. Despite our attempts to reconfigure the data connections and update the software, the problem still persists. We need your assistance to resolve this issue to ensure accurate data analysis. Please provide a solution and guide us through the troubleshooting process. We appreciate your prompt response.","Hello, <br />I am <name> and I am acknowledging your concern regarding the investment data integration process. To better understand the issue, could you please provide information on the specific software versions you are currently using and the exact error messages you are receiving? This will be very helpful in discussing the issue further. I am available to call at your convenience at <tel_num>. Let's arrange a suitable time to talk. We look forward to resolving this issue and ensuring accurate data analysis for your financial needs.",Problem,Customer Service,low,en,400,Bug,Performance,IT,Tech Support,Documentation,,,
,"gehrte Kundenservice, würde gerne eine Erweiterung der Datenanalysetools beantragen, um bessere Investitionsoptimierung zu ermöglichen. Die aktuellen Tools bieten leider nicht ausreichende Einblicke, um informierte Entscheidungen zu treffen. Ich sehne mich danach, mehr fortschrittliche Funktionen in meine bestehende Software zu integrieren, um die Gesamtnutzererfahrung erheblich zu verbessern und einen wettbewerbsfähigen Vorteil zu schaffen. Ich freue mich auf Ihre Rückmeldung.","gehrte [name], möchten Sie danken für Ihre Rückmeldung bezüglich der Datenanalysetools. Ihre Anfrage zur Erweiterung der fortschrittlichen Funktionen werde ich prüfen. Ein Vertreter wird sich bald mit Ihnen in Verbindung setzen, um die Details genauer zu besprechen.",Change,Product Support,high,de,400,Feedback,Product,Feature,,,,,
Critical Error in Data Syncing Process,"A critical error has occurred during the data syncing process for Google Cloud Platform Redis 6.2, due to API configuration issues and network disruptions. The API credentials were checked, and services were restarted.",<name> received an email regarding the error in the data syncing process for Google Cloud Platform Redis 6.2. An investigation is needed to understand the API configuration and network setup. Please provide the error message details so we can proceed. A call is scheduled at <tel_num> to discuss and find a solution. <acc_num> is available to assist in resolving the issue as soon as possible.,Problem,IT Support,medium,en,400,Bug,Network,Disruption,IT,Tech Support,,,
Notification of Hospital System Security Incident,detected security breach in hospital IT systems,We take the reported security breach in hospital IT systems very seriously and require additional details to assist. Please provide the necessary information and we will contact you at your earliest convenience to discuss further. Kindly inform us of a suitable time to reach out.,Incident,Human Resources,high,en,400,Security,Notification,Alert,IT,,,,
Sichere Medizinische Daten Systeme,"geehrte Kundensupport, ich möchte mich bei Ihnen rüsten, um die angemessenen Sicherheitsmaßnahmen für den Schutz medizinischer Daten in der IT-Infrastruktur eines Krankenhauses umzusetzen. Es ist dringend erforderlich, dass die IT-Systeme des Krankenhauses eine robuste Sicherheitsstruktur besitzen, um vertrauliche Patientendaten vor potenziellen Cyber-Threats zu schützen. Ich freue mich, Ratschläge zu den besten Praktiken und Lösungen für die Sicherung medizinischer Daten zu erhalten, einschließlich Verschlüsselungsmethoden, Zugriffskontrollen und Netzwerksicherheitsprotokollen. Darüber hinaus würde ich Informationen zur regelmäßigen Durchführung von Sicherheitsaudits und Schwachstellenbewertungen zu schätzen wissen, um sicherzustellen, dass das Krankenhaus-IT-System stets den neuesten Sicherheitsstand erreicht. Bitte lassen Sie mich wissen, wann wir uns gerne über diese Angelegenheit weiter besprechen können.","geehrter <name>, Ihre E-Mail enthält eine ausführliche Beschreibung des Wunsches, maßstäbliche Sicherheitsmaßnahmen für die Schutzmedizinischer Daten in der IT-Infrastruktur eines Krankenhauses umzusetzen. Um vertrauliche Patientendaten vor Cyber-Threats zu schützen, empfehle ich die Implementierung robuste Verschlüsselungsmethoden, mehrstufiger Zugriffskontrollen und Netzwerksicherheitsprotokolle. Regelmäßige Sicherheitsaudits und Schwachstellenbewertungen sind entscheidend, um sicherzustellen, dass das Krankenhaus-IT-System den neuesten Sicherheitsstand erreicht. Ich freue mich darauf, weitere detaillierte Informationen und Ratschläge zur Sicherheitsstruktur und Lösungen zu geben. Ich freue mich, eine passende Zeit für eine weitere Diskussion mit Ihnen zu vereinbaren.",Change,Product Support,medium,de,400,Security,IT,Tech Support,Feedback,,,,
Problem with Billing Adjustment,An unexpected billing discrepancy has been noticed in the investment analytics software following the latest system update.,"We apologize for the billing discrepancy in the investment analytics software. Please provide details of the issue, including your account number and the date of the system update. We are committed to resolving this matter and would appreciate it if you could contact us at your convenience to discuss this further.",Incident,Billing and Payments,high,en,400,Billing,Payment,Performance,Bug,,,,
Integrating Microsoft SQL Server 2019,Please contact us to obtain information regarding the integration of Microsoft SQL Server 2019 with our SaaS project management solution. Could you provide additional details required for the integration process? We would be glad to share relevant documentation and guidelines to ensure a smooth integration.,"We are providing guidelines for integrating Microsoft SQL Server 2019 with our SaaS project management solution. To initiate the process, please provide your customer number and a brief description of your current system. Relevant documentation and instructions will be sent to you as required. If you prefer to speak by phone, please specify a convenient communication time and call us at <tel_num>. This will help us guide you through the integration process to ensure a smooth transition.",Request,Technical Support,high,de,400,Documentation,Feature,IT,Tech Support,,,,
Urgent: Incident Involving Data Breach in Medical Records Security,"A data breach has occurred, which might be related to outdated procedures.","Dear [Name], we acknowledge the urgency of the situation and apologize for any inconvenience caused by the data breach in the Medical Records Security System. We take security very seriously and are committed to assisting with the resolution of this matter. To better understand the issue and determine the cause, could you please provide us with information regarding the breach, including the date and time it occurred and any error messages you may have received? Additionally, we would like to know if outdated protocols are suspected to be the cause. If necessary, we will schedule a meeting to discuss this further.",Problem,Product Support,medium,en,400,Security,Incident,Bug,Performance,,,,
Probleme mit dem neuesten Projektmanagement-Tool nach der Aktualisierung,Probleme mit dem Projektmanagement-Tool in der Software.,"Verstanden, Sie haben Kompatibilitätsprobleme mit dem Projektmanagement-Tool in der Software. Könnten Sie bitte mehr Details über das Problem und das genutzte Produkt geben? Ich freue mich darauf, bei der Lösung des Problems behilflich zu sein.",Problem,Returns and Exchanges,medium,de,400,Bug,Performance,Product,Feature,IT,Tech Support,,
Performance Problem with Data Analytics Tool,The data analytics tool experiences sluggish performance during peak times.,"We are addressing the performance issue with the data analytics tool. Please provide specific details on the slow performance during peak periods, including the time of day and any features that are particularly affected. We will investigate and work to find a solution.",Incident,Technical Support,high,en,400,Performance,IT,Tech Support,,,,,
Datensperrung in der Kundschaftsbetreuung,"Es gab einen Datensperrungsunfall, bei dem ungeschützte medizinische Daten durch Krankenhaus-IT-Systeme betroffen waren. Dieses Ereignis wurde auf veraltete Sicherheitsprotokolle zurückgeführt, die Schwachstellen aufgewiesen haben. Wir haben versucht, die Sicherheitssoftware zu aktualisieren und Systemscans durchzuführen, aber die Probleme bestehen weiterhin. Sie benötigen Unterstützung, um das Problem zu lösen.","Ich kann Ihnen bei dem Datensperrungsunfall helfen. Um eine bessere Unterstützung zu bieten, benötige ich Informationen über den aktuellen Zustand der IT-Systeme und die Updates, die bereits angewendet wurden. Könnten wir bitte telefonisch darüber sprechen? Geben Sie mir eine geeignete Zeit an, um Sie an dem <tel_num> anzurufen, damit wir die nächsten Schritte für die Lösung des Falles fortsetzen können.",Incident,Product Support,high,de,400,Security,IT,Tech Support,Bug,,,,
Problem mit der Videokonferenz-Software heute,"Wichtigere Sitzungen wurden unterbrochen durch Fehlfunktionen der Videokonferenz-Software. Das Neustart von betroffenen Geräten könnte den Fehler beheben, möglicherweise sind Verbindungsprobleme mit dem Netgear Nighthawk-System verknüpft.","Sehr geehrte/r [Name], leider wurde das Problem mit der Videokonferenz-Software gemeldet, das wichtige Sitzungen störte. Verstehe die Bedeutung dieses Problems. Wie vorhergesagt, hat das Neustart von Geräten den Fehler möglicherweise beheben können, was möglicherweise auf das Netgear Nighthawk-System zurückzuführen ist. Ich möchte dies genauer untersuchen. Könnten Sie bitte mehr Informationen zur Fehlermeldung geben und den genauen Modellnamen des Netgear Nighthawk-Systems? Es wäre mir ein Vergnügen, telefonisch im [Tel-Nummer] Kontakt aufzunehmen, um die Planung der Lösung zu besprechen.",Incident,Human Resources,low,de,400,Bug,Performance,Network,IT,Tech Support,,,
Update Request for SaaS Platform Integration Features,"Requesting an update on the integration features for our SaaS platform. We need enhanced compatibility with Shopware, QuickBooks, and Figma to improve our workflow. Could you please provide a timeline for implementation? This would greatly benefit our team's productivity and efficiency.","Received your request for updates on the integration features for the SaaS platform with Shopware, QuickBooks, and Figma. We will provide a timeline for implementation shortly. Please allow us to conduct some research and make the necessary updates as soon as possible.",Change,IT Support,high,en,400,Feature,IT,Tech Support,,,,,
Inquiry About Project Management Features,"Looking for detailed information on the project management SaaS features and customization options available on your platform. Specifically, I am interested in learning about the various tools and functionalities the platform offers, as well as the workflow automation and reporting capabilities. Additionally, I would like to know about the third-party app and service integrations. Thank you for your assistance, and I look forward to hearing back soon. Please let me know if there is any additional information you need.","Dear [Name], thank you for your email regarding the project management SaaS features. Our platform offers various tools and functionalities, including workflow automation and reporting. We are able to integrate with several third-party apps and services. We would be happy to provide more detailed information and discuss your specific needs. Please call us at [Tel Num] to discuss and answer any questions you may have.",Request,Technical Support,low,en,400,Feature,Documentation,Feedback,IT,,,,
