subject,body,answer,type,queue,priority,language,version,tag_1,tag_2,tag_3,tag_4,tag_5,tag_6,tag_7,tag_8
Informationen zu DatenaNALYSE-Lösungen,"Sehr geehrte Kundensupport, ich bitte Sie, mir mehr Informationen zu den DatenaNALYSE-Lösungen zu geben. Diese Lösungen sollen dazu beitragen, unsere Investitionen zu optimieren. Könnten Sie mir mehr über die Art und den Umfang der angebotenen Lösungen erzählen, insbesondere in Bezug auf die Merkmale und Preise? Zudem wäre ich sehr dankbar, wenn Sie mir erklären könnten, wie benutzeranpassbare Lösungen für spezifische Branchen unternehmensnah sind. Ich freue mich auf Ihre Rückmeldung und stehe Ihnen jederzeit zur Verfügung, falls Sie weitere Informationen benötigen. Vielen Dank für Ihre Unterstützung.","Sehr geehrte [Name], wir bedanken uns bei Ihnen für Ihr Interesse an unseren DatenaNALYSE-Lösungen. Wir freuen uns, Ihnen mehr Informationen zu geben, die die Möglichkeiten unserer Dienstleistungen betreffen und die Investitionen optimieren helfen. Unsere DatenaNALYSE-Lösungen umfassen eine Reihe von Werkzeugen und Dienstleistungen, die Unternehmen unterstützen, informierte Entscheidungen zu treffen und Wachstum zu fördern. Wir bieten mehrere Lösungen mit unterschiedlichen Merkmalen und Preisplänen an, die die Bedürfnisse verschiedener Branchen bedienen. Darüber hinaus bieten wir benutzeranpassbare Lösungen an, die spezifische Anforderungen von Branchen und Unternehmen erfüllen. Ihr Team von Experten steht Ihnen gerne zur Verfügung, um Ihre einzigartigen Anforderungen zu verstehen. Wir freuen uns auf Ihre Rückmeldung.",Request,Sales and Pre-Sales,high,de,400,Feature,Feedback,Sales,Documentation,,,,
Issue with Software Compatibility,"Marketing agency's digital strategies are hindered by software and hardware compatibility issues. Despite recent updates, high-priority tools function smoothly.","Dear <name>, I understand that software and hardware compatibility issues are hindering your digital strategies at the marketing agency. I would like to assist you in resolving this problem as quickly as possible. To better help you, please provide more details about the high-priority tools that function smoothly after the recent updates. This will enable me to investigate and offer an appropriate solution. We may need to schedule a call to discuss further. Please provide a suitable time to call at <tel_num>. Thank you.",Incident,Technical Support,high,de,400,Bug,Hardware,Performance,IT,Tech Support,,,
Anfrage zur Aktualisierung von Datenanalyse-Tools,Wir möchten die Integration von Airtable zu unseren Datenanalyse-Tools sowie die Optimierung unserer Investitionen aktualisieren.,"Sehr geehrte(r) [Name], wir bedanken uns für Ihre Anfrage zur Aktualisierung der Datenanalyse-Tools-Integration mit Airtable und zur Optimierung der Investitionen. Wir werden Ihre Anfrage prüfen und Ihnen einen Lösungsansatz zur Verbesserung der Investitionsoptimierung anbieten. Wir freuen uns, den Vorgang fortzusetzen und Ihnen mehr Informationen zur spezifischen Integrierung der verwendeten Analysesoftware bereitzustellen. Falls dies notwendig ist, können Sie uns telefonisch kontaktieren unter [Telefonnummer]. Wir freuen uns darauf, unsere Dienstleistungen bald zur Verfügung zu stellen.",Change,Technical Support,low,de,400,Feature,Feedback,IT,Tech Support,,,,
Challenge in Investment Optimization,Noticing inconsistencies in investment optimization results due to the use of outdated algorithms and data discrepancies.,"<name>, we are addressing the issue with your investment optimization outputs. To better understand the specific errors you are encountering, could you please provide more details on when these started to occur? We need to investigate account number <acc_num> further. To discuss this matter more effectively, could you schedule a call at your convenience and let us know a suitable time. You can reach me at <tel_num>.",Problem,Customer Service,medium,en,400,Bug,Performance,Product,Feature,Feedback,,,
Assistance with Technical Problems,"The data analytics tools for investment optimization are experiencing malfunctions, leading to delays in processing financial models. This could be due to compatibility issues with software versions or hardware performance limitations. After attempting to reboot the systems and re-install the affected software, the issues still persist.","In response to your email regarding technical issues with the investment optimization data analytics tools, we would like to assist you better. Could you please provide details on the software versions and hardware specifications you are currently using? Additionally, it would be helpful to know the exact error messages you are receiving. We would like to schedule a call to discuss this further. Please let us know a time that is convenient for you to call at <tel_num> and we will work to troubleshoot the issue and find a resolution. Your account number is <acc_num>.",Incident,Returns and Exchanges,high,en,400,Bug,Performance,Hardware,IT,Tech Support,,,
Wünsche nach weiteren Details zu digitalen Strategien für Wachstum,"Ich bin am Interesse, mehr über digitalen Strategien und deren Beiträge zum Markenwachstum zu lernen. Könnten Sie mehr Details und Beispiele erfolgreicher Kampagnen bereitstellen? Ich freue mich darauf, die bereitgestellten Informationen zu erhalten.","Ich freue mich darauf, über digitalen Strategien und ihr Potenzial für Wachstum zu sprechen. Bitte geben Sie einen geeigneten Zeitpunkt an, um telefonisch mehr Informationen über Beispiele erfolgreicher Kampagnen zu erhalten. <tel_num> wäre ein passender Zeitpunkt für späteres Telefonieren, um einen Termin zu vereinbaren.",Request,Customer Service,high,de,400,Feedback,Sales,Feature,,,,,
Problem with App,"Facing difficulties in saving project files in the web application. The issue might be related to PostgreSQL connectivity. Restarted the application and checked the network connections, but the problem still persists. Please assist in resolving this issue.","Investigating the web application issue, as the problem continues, please provide more details on your network connections and PostgreSQL setup to better assist in resolving the connectivity issue.",Problem,Technical Support,low,en,400,Bug,Network,Performance,Disruption,IT,Tech Support,,
Support for Digital Strategy Enhancements,Request for implementation of advanced digital strategies utilizing Zapier integration to improve support for game controller functionalities. This would significantly enhance user experience and offer greater flexibility and automation options. Consideration of this request would be greatly valued and appreciated.,"<name>, thank you for reaching out to our service desk. We appreciate your feedback on implementing enhanced digital strategies using Zapier integration for game controller functionalities. We will review your request and consider it for future product development. If you need further assistance, please do not hesitate to contact us at <tel_num> or reply to this email.",Change,IT Support,medium,en,400,Feature,Feedback,IT,Tech Support,,,,
Unbefugtes Zugriffskonto auf das Krankenhaus-System,Support Anfrage: Sicherheitsverletzung gemeldet,Die Sicherheitsverletzung soll sofort untersucht werden und Sie werden bald kontaktiert.,Problem,Returns and Exchanges,low,de,400,Security,Account,IT,Tech Support,,,,
Request for Enhanced Data Security Protocols,"Dear Customer Support Team, we are reaching out to request updates to our data security infrastructure. With the increasing amount of sensitive medical data being shared and stored across various applications, it is imperative that we prioritize the protection of this data. We believe that implementing robust security measures, such as encryption and multi-factor authentication, will help prevent unauthorized access and ensure the confidentiality of medical records. Additionally, regular software updates and patch management are essential for identifying vulnerabilities. ","We appreciate your concern regarding data security. We can guide you in implementing encryption, multi-factor authentication, and patch management to safeguard your medical records. Please contact us at <tel_num> to discuss our recommendations and plan for enhancing your data security protocols. Your account number is <acc_num>.",Change,Customer Service,low,en,400,Security,Feedback,IT,Tech Support,,,,
Sicherung medizinischer Daten in Krankenhaus-IT-Systemen,"Liebe Kundensupport, ich bitte Sie um Informationen zur Sicherung medizinischer Daten in IBM Cloud Krankenhaus-IT-Systemen. Könnten Sie Rat, Praktiken und Protokolle geben, um die Vertraulichkeit, Integrität und Verfügbarkeit sensibler medizinischer Informationen sicherzustellen? Ich würde gerne Empfehlungen zu Verschlüsselungsverfahren, Zugriffskontrollen und der Einhaltung regulatorischer Anforderungen (HIPAA) erhalten. Darf ich fragen, welche speziellen Dienste und Werkzeuge von IBM Cloud zur Datenschutz- und Sicherheitsbewältigung zur Verfügung stehen? Ich freue mich auf Ihre Rückmeldung und stehe Ihnen gerne zur Verfügung, um eine genaue Anleitung telefonisch zu besprechen, sobald es Ihnen passt.","Liebe [Name], vielen Dank, dass Sie sich an unseren Kundensupport wenden. Um die Sicherung medizinischer Daten in Krankenhaus-IT-Systemen zu klären, empfehlen wir die Implementierung robuster Verschlüsselungsverfahren, Zugriffskontrollen sowie die Einhaltung regulatorischer Anforderungen (HIPAA). IBM Cloud bietet verschiedene Dienste und Werkzeuge zur Datenschutz- und Sicherheitsbewältigung, darunter den IBM Cloud Security Compliance Center. Eine genaue Anleitung können wir gerne telefonisch besprechen, sobald Ihnen ein passender Zeitpunkt zur Verfügung steht.",Request,Technical Support,high,de,400,Backup,Security,IT,Tech Support,Documentation,,,
Sicherheitsprobleme bei den Datenspeicherungen,"Sehr geehrte Kundensupport, ich schreibe Ihnen wegen eines Datenverlusts in unserem Krankenhaus-IT-System. Die Medizindatensicherheit scheint gefährdet zu sein und scheint mit falsch konfigurierten Netzwerkeinstellungen des Aruba-Switches zusammenhängen. Trotz des Versuchs, den Switch zurückzusetzen und die Firewalls zu aktualisieren, behält das Problem anhaltend an. Es wäre sehr freundlich, wenn Sie uns helfen könnten, die Angelegenheit schnellstmöglich zu lösen und die Integrität unserer Patientendaten sicherzustellen. Bitte geben Sie uns die nächsten Schritte an, die wir unternehmen sollten. Vielen Dank für Ihre schnelle Auseinandersetzung mit diesem dringenden Problem.","Sehr geehrter <name>, wir nehmen das Datensicherheitsproblem in unserem Krankenhaus-IT-System ernst und benötigen Ihre Hilfe, um eine Lösung zu finden. Um die Lösung der Angelegenheit zu unterstützen, benötigen wir zusätzliche Informationen über die falsch konfigurierten Netzwerkeinstellungen des Aruba-Switches. Könnten Sie uns bitte die aktuelle Konfiguration und die genauen Schritte, die Sie bisher unternommen haben, zur Verfügung stellen? Wir können einen Anruf vereinbaren, um die nächsten Schritte und die Bereitstellung der Lösung zu besprechen, um die Sicherheit unserer Patientendaten zu gewährleisten. Bitte geben Sie uns einen geeigneten Zeitpunkt an, wann wir anrufen können, <tel_num>.",Problem,Technical Support,high,de,400,Security,Network,Performance,IT,Tech Support,,,
Inquiry About Digital Strategies for Brand Growth,Is there information available on digital strategies that drive brand growth? Thank you.,"Dear [Name], we appreciate your interest in digital strategies that drive brand growth. Typically, such approaches involve a combination of social media marketing, content creation, and email campaigns. For detailed information, I would be happy to schedule a call at your convenience to discuss strategies that could benefit your business. Please let us know a suitable time, and we can discuss the matter further at [Tel Num].",Request,Technical Support,high,en,400,Feedback,Sales,IT,Tech Support,,,,
Verbessern der digitalen Markenpräsenz,"Erweitern Sie die Markenpräsenz und steigern Sie die Engagementstiefe auf verschiedenen Plattformen. Sollten Sie digitale Marketingstrategien verbessern, überwachen Sie den Fortschritt regelmäßig.",Oversee and implement improved digital marketing strategies to enhance brand presence and engagement levels across various platforms.,Change,General Inquiry,medium,de,400,Feedback,Sales,Feature,Documentation,,,,
Technical Challenge,"Customers have been facing sporadic connectivity problems during the SaaS platform's busiest times. This could be due to high server load or configuration errors. Steps like limiting user sessions and optimizing database queries have been taken, but the issues still persist. Assistance is required to resolve this.","We have received your email about the intermittent access issues with the SaaS platform. To proceed, we need information such as error messages and server logs. Please provide these details at your earliest convenience by calling <tel_num>. This will help us discuss the next steps and possible solutions to resolve the issue. Your account number is <acc_num>.",Problem,Product Support,high,en,400,Network,Performance,Outage,Tech Support,,,,
Seeking Assistance with Analytics,"A marketing firm is facing difficulties in assessing the effectiveness of their digital strategies aimed at driving brand growth. The issue might stem from inadequate integration of analytics tools across various platforms. So far, they have attempted to use JIRA and Notion for project tracking, but the results are still unclear. They are in search of a comprehensive solution to track digital strategies and measure their impact on brand growth. They need a tool that can integrate various platforms and provide clear insights.","It's clear that the marketing firm is having trouble measuring the effectiveness of their digital strategies and is looking for a comprehensive analytics solution. To better assist you, could you please provide specific information about the platforms and tools you are currently using and any insights you've gathered so far? This will help us narrow down the options and recommend a suitable analytics tool that meets your needs. I would also be willing to schedule a call at your convenience to discuss this further. Please let me know a time that works for you.",Problem,Product Support,medium,en,400,Feedback,IT,Tech Support,Performance,Documentation,,,
Issue Identified with Payment Discrepancies,The billing system has detected discrepancies that have affected product subscriptions renewals following the integration of a recent software update. We have reviewed payment logs and contacted the payment processor for further clarification.,"Dear [name], we apologize for the inconvenience caused by the payment discrepancy issue that has impacted your product subscriptions renewals. Our team is currently investigating the matter and will notify you shortly with an update on the resolution. If you have any questions or concerns, please do not hesitate to contact us at [tel_num] or reply to this email at [acc_num] for expedited assistance. We appreciate your patience and understanding as we address this matter.",Incident,Billing and Payments,high,en,400,Billing,Payment,Refund,Bug,Performance,Documentation,,
Request for Scaling Features,I am keen to learn more about the scaling features and integration options available for the project. Could you please provide detailed information on how the project can process increased operational volumes and handle data? What types of integrations are available and how do they function? I would appreciate it if you could share relevant documentation and resources to gain a better understanding of the project's capabilities.,"Dear <name>, thank you for your interest in the scaling features and integration options of the project. We appreciate your keenness to explore further. The project is designed to support both horizontal and vertical scaling to meet growing requirements, implementing various load balancing and caching techniques to ensure high performance and reliability. The integration options we offer include a range of choices such as APIs and webhooks, which facilitate seamless integration with third-party systems. We look forward to providing you with detailed documentation and resources to help you better understand the project's functionalities.",Request,Customer Service,high,de,400,Feature,Documentation,Feedback,IT,Tech Support,,,
Incident of Data Breach in Medical Systems,"A data breach has been identified, posing a threat to the security of medical information. Unresolved vulnerabilities in Ubuntu and Android systems may be contributing factors. Efforts to secure the systems, such as updating software and enhancing firewall settings, have been made but the issues continue to persist.",We are currently investigating the reported data breach. Please contact +1-800-555-1234 to discuss the measures needed to secure your medical systems.,Incident,Technical Support,medium,en,400,Security,Bug,Performance,IT,Tech Support,,,
Fakturauebersicht für England mehrerer Produkte,"Im Magento SAP ERP-System wurden Fakturen für England mehrerer Produkte erfasst. Ein neuer Software-Update scheint Zahlungsaufarbeitungfehler verursacht zu haben. Kundenkonten wurden überprüft, aber Transaktionen sind wiederholt, und das Problem behält sich fort. Unmittelbare Hilfe ist erforderlich, um das Problem zu lösen und weitere Störungen zu verhindern.","Das Problem mit der Nummer <acc_num> wird überprüft. Bitte kontaktieren Sie uns unter <tel_num>, um weitere Hilfe in Anspruch zu nehmen.",Incident,Billing and Payments,high,de,400,Billing,Payment,Account,Bug,Disruption,Tech Support,,
Concern Regarding Security Breach of Medical Data,"Customer Support, we are reporting an incident of unauthorized access to medical data within the hospital's systems. A preliminary audit indicates a potential security vulnerability possibly linked to third-party applications. Despite recent software updates, the issue continues. We kindly request your assistance in investigating and resolving this matter. Please inform us of the next steps to take, as this is of utmost importance for protecting sensitive medical information.","We are in contact regarding the reported medical data security issue at the hospital. To assist in the investigation, could you please provide detailed information on the affected systems and third-party applications involved? We will schedule a call to discuss and determine the next steps to resolve the matter.",Problem,Returns and Exchanges,medium,en,400,Security,Bug,IT,Tech Support,,,,
"Versuch autorisierter Zugriffe auf medizinische Daten erfasst, potenzielle Datenschutzprobleme bestehen. Passwörter wurden zurückgesetzt, Zugriffsnachweise überprüft, weiteres Engagement erforderlich.","Es wurde versucht, unerlaubten Zugriff auf die medizinischen Daten-Systeme durchgeführt. Dies könnte zu potenziellen Datenschutzbedenken führen. Die Passwörter wurden zurückgesetzt, und der Zugriff wurde überprüft. Wir benötigen jedoch weitere Unterstützung.","Ich freue mich, Ihnen bei den potenziellen Datenschutzzuwendungen zu helfen. Bitte geben Sie mehr Details zu dem autorisierten Zugriff. Unsere Spezialisten werden den Fall in dem geeigneten Zeitpunkt telefonisch überprüfen und mit Ihnen über weitere Schritte sprechen. Wäre ein früher Anruf möglich, sind wir verfügbar. <tel_num>",Incident,Technical Support,high,de,400,Security,Privacy,Data Protection,IT,Tech Support,,,
,"Customer Support, seeking guidance on securing medical data with DocuSign and MySQL 8.0 integration. A healthcare provider needs to ensure the protection of sensitive patient information. Currently using DocuSign for electronic signatures and MySQL 8.0 for database management. Would appreciate information on how to integrate these systems while maintaining HIPAA compliance. Specifically, looking for details on encryption methods, access controls, and audit trails.","Appreciate your inquiry regarding securing medical data with DocuSign and MySQL 8.0 integration. To ensure HIPAA compliance, recommend using encryption methods such as TLS and AES to protect data both in transit and at rest. Access controls and audit trails can be implemented using MySQL 8.0's built-in features, including role-based access control and logging. DocuSign also offers features like document encryption and access controls. Would be happy to discuss and provide more detailed guidance.",Request,Customer Service,high,en,400,Security,Documentation,IT,Tech Support,,,,
Boost Data Analytics Support,Requesting an enhancement in our data analytics capabilities. We are aiming to optimize our investment strategies using the appropriate software and hardware tools to improve our data-driven decision-making and stay ahead of the competition. We believe that the right tools can support us in achieving our goal and driving business growth. I would greatly appreciate your guidance and recommendations on the tools to use. Thank you for your time and assistance.,"I would be happy to help enhance your data analytics capabilities, <name>. To provide suitable recommendations for software and hardware tools, could you please share more information about your current setup and specific requirements? You can contact <tel_num> to discuss and receive guidance on the tools that can support your investment strategies.",Change,Sales and Pre-Sales,high,en,400,Feature,Documentation,Feedback,IT,Tech Support,,,
Marketing Firm Experiences Reduced Brand Interaction,We have refreshed the content and reviewed audience data.,"I acknowledge your concern about decreased brand interaction even after updating content and analyzing audience data. To better assist you, I can provide details on the changes made and specific metrics indicating the decline. This will help us identify potential causes and offer tailored guidance. If you're available for a call at your convenience, please let me know a suitable time.",Problem,Customer Service,low,en,400,Performance,Feedback,Sales,,,,,
System Performance Challenges,"A sharp rise in user sign-ups has resulted in diminished system performance due to unexpected load. We have optimized database queries and restarted application servers, but the issues continue.","Dear [Name], acknowledging receipt of your email regarding the system performance challenges faced by our team due to a sudden increase in user sign-ups. Despite our efforts to optimize database queries and restart application servers, the issues persist. We would appreciate your assistance in resolving this matter. To better understand the situation and provide an effective solution, please provide detailed information about the nature of the performance issues, any error messages, and specific symptoms you are observing. Thank you.",Incident,Technical Support,high,en,400,Performance,Network,IT,Tech Support,,,,
Major Medical Service Outage,A significant service disruption has impacted medical data security and hospital operations. It may have resulted from compatibility issues or system failures. Efforts to reboot affected devices and update software were unsuccessful. We kindly request your assistance in resolving this matter as soon as possible to prevent further disruptions to services.,"<name> acknowledges receipt of the email regarding the major medical service outage affecting the hospital's operations and medical data security. We understand the urgency of the matter and are ready to assist in resolving it as soon as possible. To better assist, could you please provide details on the specific devices and software that are affected, as well as any error messages received and the steps taken so far? We can schedule a call at a time that suits you; please let us know a convenient time.",Incident,Service Outages and Maintenance,high,en,400,Outage,Disruption,Security,Performance,IT,Tech Support,,
Verschleierung von medizinischen Daten,"Sehr geehrte Kundenservice-Abteilung, ich melde einen schwerwiegenden Vorfall, der mit einem unbefugten Zugriff auf medizinische Daten einherging. Vorläufige Untersuchungen deuten darauf hin, dass möglicherweise Schwachstellen in den Sicherheitsprotokollen unserer integrierten Softwareprodukte bestehen. Das Team versucht, das Problem zu beheben, indem es die Software aktualisiert und Netzwerk-Sicherheitsmaßnahmen verstärkt hat. Bedauerlicherweise behält das Problem jedoch weiterhin bestanden. Ich bin besorgt um mögliche Konsequenzen und schätze eine schnelle Unterstützung für die Lösung des Problems ein. Könnten wir telefonisch über die nächsten Schritte sprechen?","Ich nehme sofort Anlass zu Ihrer E-Mail-Mitteilung über die Verschleierung medizinischer Daten. Um Ihnen besser behilflich zu sein, möchte ich dieses Thema telefonisch weiter vertiefen. Bitte sagen Sie mir, wann wir telefonieren können. Zwischenzeitlich bitten wir Sie, die betroffenen Systeme abzutrennen, um weiteren unbefugten Zugriff zu verhindern. Ich werde Ihnen Rat geben und die nächsten Schritte sowie zusätzliche Maßnahmen vorschlagen, die ergreifen können, um solche Vorfälle in der Zukunft zu vermeiden.",Incident,Billing and Payments,high,de,400,Security,Bug,Network,IT,Tech Support,,,
