subject,body,answer,type,queue,priority,language,version,tag_1,tag_2,tag_3,tag_4,tag_5,tag_6,tag_7,tag_8
Boosting Growth with Adobe Photoshop CC 2021,Looking for customer support to explore digital strategies that enhance brand growth through the use of Adobe Photoshop CC 2021. Can your team use this software to create engaging content that promotes brand awareness? I would greatly appreciate any insights on how to leverage Adobe Photoshop CC 2021 for marketing purposes. Thank you for your time and assistance. I'm looking forward to hearing from you soon.,<name> thanks for your inquiry regarding digital strategies to enhance brand growth with Adobe Photoshop CC 2021. Our team can certainly use this software to create engaging visual content that promotes brand awareness. We would be happy to discuss this approach in detail and could provide you with more information on specific aspects of the strategy once you let us know what you need. Please schedule a call at <tel_num> to discuss your questions and we will provide a detailed response.,Request,Customer Service,medium,en,400,Feedback,Sales,IT,Tech Support,,,,
Probleme mit SaaS Projektmanagement-Tools: Verzögerungen und unübersichtliche Leistung,"Im SaaS Projektmanagement-Tool treten Probleme auf: Verzögerungen und unübersichtliche Leistung. Trotz Optimierung der Serverkonfigurationen und des Aufräumens der Caches bestehen die Probleme weiter. Es wird vermutet, dass starke Datenbelastungen und unzureichende Ressourcenallokation Ursachen sind.","Wir untersuchen aktuell das Problem mit dem SaaS Projektmanagement-Tool, das Verzögerungen und unübersichtliche Leistung aufweist. Um Ihnen besser helfen zu können, würde ich gerne mehr Informationen über starke Datenbelastungen und Ressourcenallokation einholen. Mögliche Lösungen besprechen wir gerne telefonisch. Für einen Anruf steht der angegebene Termin <tel_num> zur Verfügung. Die Konto-Nr. <acc_num> können wir im Zusammenhang mit der besprochenen Angelegenheit anrufen.",Problem,Technical Support,high,de,400,Performance,Network,IT,Tech Support,,,,
,"Dear Customer Support, we are experiencing technical issues with our data analysis tools due to software conflicts with incompatible hardware, potential system updates, and misconfigurations. We have already tried restarting the devices, updating the software, and clearing the cache, but the problems persist.","Hello, this is the Service Desk. We have noted the technical issues you are experiencing with your data analysis tools. Please provide more details about the software updates and misconfigurations that may be causing the problems. We will investigate the cause and be happy to assist you further if needed. Please call us at the number <tel_num> if you prefer to speak with us directly.",Problem,Technical Support,medium,de,400,Bug,Hardware,Performance,IT,Tech Support,,,
Effective Security Measures for Medical Data,Seeking guidance on securing medical data for a D-Link DIR-895L router used in a hospital's IT system. Kindly provide the necessary steps to ensure data safety and security.,Steps to secure medical data on a D-Link DIR-895L router include ensuring the firmware is up to date and enabling WPA2 encryption. Please send detailed instructions to assist with implementing robust data safety and security measures.,Request,Technical Support,high,en,400,Security,IT,Tech Support,Documentation,,,,
Data Leak in Medical Records Reported,"There was a data leak involving medical records due to unauthorized access, which might indicate issues with encryption protocols. We have already updated the security software and changed access credentials. We require support to guarantee the system's safety.",We are reaching out regarding the data leak in medical records. We would like to schedule a call to discuss the necessary assistance to ensure the system's security. Please let us know a convenient time to call at <tel_num> for the next steps in securing the system.,Problem,Technical Support,medium,en,400,Security,Bug,Performance,IT,Tech Support,,,
Healthcare Data Protection Issues,"There has been an issue with the security measures protecting the medical data of a healthcare provider. Potential reasons for this issue could be the use of outdated software or internal errors. As a first step, access logs were reviewed and security protocols were updated to prevent future incidents.","<name> recognizes the concerns about the medical data security breach at the healthcare provider. We will be investigating the incident and would appreciate a review of the access logs and updates to the security protocols. Please provide specific details about the breach, including the date and time it occurred, and the actions taken to address it. We are open to discussing this matter further and can be reached at <tel_num> at your preferred time.",Incident,IT Support,medium,en,400,Security,Bug,Performance,IT,Tech Support,,,
Kundendienstleistungen,"Lieber Kundendienstleistungsabteilung, ich hoffe, es geht Ihnen gut. Ich schreibe an, um die Aktualisierung unserer aktuellen Software und die Optimierung unserer Netzwerkeinstellungen zu beantragen. Die Aktualisierung der Software ist notwendig, um die Effizienz und Leistung unserer digitalen Werkzeuge zu verbessern. Das aktuelle System ist veraltet und verursacht Verzögerungen, was zu einem Effizienzverlust im Arbeitsablauf führt. Ich glaube, dass die Aktualisierung unserer Prozesse die Produktivität erhöhen kann. Ich freue mich auf eine baldige Betrachtung und die Möglichkeit, eine mögliche Lösung anzubieten. Vielen Dank für Ihre Unterstützung und ich freue mich darauf, bald von Ihnen zu hören.","Lieber [Name], vielen Dank, dass Sie gemeldet haben. Wir verstehen die Notwendigkeit der Software-Aktualisierung und der Netzwerkoptimierung, um die Effizienz und Leistung zu verbessern. Wir bearbeiten Ihren Antrag bald und werden eine mögliche Lösung anbieten. Bitte geben Sie uns Ihre Kontonummer [acc_num], damit wir Ihnen weitere Unterstützung zu einem geeigneten Zeitpunkt anbieten können, um die Details zu besprechen.",Change,IT Support,high,de,400,Bug,Performance,Network,IT,Tech Support,Feedback,Product,
Problem mit Adobe Premiere Pro 2021,"Sehr geehrte Kundensupport-Team, <br>Ich melde ein Problem mit Adobe Premiere Pro 2021. Bei der Bearbeitung von Videos trat ein Systemausfall auf, was zu einem Verlust gespeicherter Werke führte. Es scheint, dass der Mangel an RAM und ein Softwarefehler die Ursache sein könnte. Ein Systemneustart und die Aktualisierung der Software hat versucht, das Problem zu lösen, aber es behält seinen Ursprung. Der Ausfall tritt plötzlich auf, und es ist nicht möglich, die verlorenen Werke wiederherzustellen. Verschiedene Troubleshooting-Schritte wurden unternommen, aber das Problem bleibt bestehen. Könnten Sie bitte weitere Informationen zur Systemkonfiguration und den bereits durchgeführten Schritten geben, um besser helfen zu können?","Leider haben wir Probleme mit Adobe Premiere Pro 2021. Um Ihnen besser zu helfen, könnten Sie bitte weitere Details zur Systemkonfiguration und den bisherigen Schritten geben, die Sie unternommen haben? Ich würde gerne einen passenden Zeitpunkt vereinbaren, um die Ratgebersituation zu besprechen und Maßnahmen zu ergreifen, um zukünftige Ausfälle zu vermeiden. Lassen Sie mich wissen, wann Ihnen ein Anruf passt, um <tel_num> anzurufen.",Incident,Technical Support,medium,de,400,Bug,Crash,Performance,Software,IT,Tech Support,,
Support for Technical Problem,"Facing connectivity issues with digital tools, which is hindering brand growth efforts. This might be due to recent updates or configuration changes. I have already restarted my devices and checked network settings, but the problem persists. I would greatly appreciate your help in resolving this matter as soon as possible.","We have received your email regarding the connectivity issues with digital tools. We understand the urgency of the matter and its impact on your brand growth efforts. To better assist you, could you please provide details on any recent updates or configuration changes you have made? Additionally, it would be helpful to know any specific error messages you are encountering. It would be convenient to schedule a call at your preferred time to discuss the issue and work towards a resolution. Please let us know a suitable time for the call.",Problem,Technical Support,high,en,400,Network,Performance,IT,Tech Support,,,,
Concerns About Service Outages,"Noted intermittent service outages impacting various applications, likely caused by recent updates or server overload. Services have been restarted and server load is being monitored.","Understood that the organization faced intermittent service outages affecting multiple applications and appreciated the steps taken to address the issue by restarting affected services and monitoring server load. To investigate the cause of the outages and prevent future occurrences, we would like to gather information on recent updates and current server load metrics. Could you please provide us with the details and server load metrics? Additionally, is it necessary to schedule a meeting for further discussion?",Incident,Service Outages and Maintenance,low,en,400,Outage,Disruption,Performance,Recovery,Maintenance,IT,Tech Support,
Assistance Required for Security Breach,"A security breach has been detected in the hospital's system, potentially compromising medical data. This issue might be due to outdated software vulnerabilities. Despite attempted system updates and firewall enhancements, the problem persists. Urgent assistance is needed to resolve this matter.","I acknowledge the security breach in the hospital's system, specifically the potential compromise of medical data due to outdated software vulnerabilities. I understand the urgency of this matter and am committed to providing assistance. To better address the issue, could you please provide details on the system updates and firewall enhancements that have been implemented so far? Additionally, it would be helpful to know which specific software systems are affected. I would like to schedule a call at your earliest convenience to discuss this further.",Incident,Customer Service,medium,en,400,Security,IT,Tech Support,Bug,,,,
Sicherheitsfall in Bezug auf medizinische Daten,"Sehr geehrte Kundensupport,<br>Wir haben festgestellt, dass eine Sicherheitslage besteht, die potenziellen unautorisierten Zugriff auf medizinische Daten betreffen könnte. Dies wurde aufgrund eines misstimmigen Netzwerkbrustwechsels verursacht.<br>Bislang wurden Zugriffsschemata überarbeitet und das Bogensetup vorläufig verschärft.<br>Wir nehmen den Fall ernst und arbeiten an der Nachforschung der Ursachen, um die Situation zu klären.<br>Wir führen eine gründliche Überprüfung unserer Sicherheitsprotokolle durch, um zukünftig vergleichbare Fälle zu vermeiden.<br>Bitte teilen Sie uns mit, falls weitere Informationen benötigt werden, um Ihnen besser zu assistance.<br>Wir bedanken uns für Ihre schnelle Auseinandersetzung mit der Angelegenheit.","Vielen Dank für Ihre Mitteilung über die bereits eingeleiteten Maßnahmen. Bitte kontaktieren Sie uns, falls zusätzliche Informationen erforderlich sind, um Ihnen besser zu assistieren.",Incident,IT Support,medium,de,400,Security,Network,Bug,IT,,,,
Query Concerning Disruption in Support Service,Faced a substantial disruption in the project management application resulting from server overload. Efforts to restart the affected services and scale resources were unavailing. Urgently require support to address this matter.,"<name> is writing to acknowledge the receipt of the email pertaining to the disruption in the project management application, which is due to server overload. Apologies for the inconvenience and assure you that we will assist in resolving this matter as soon as possible. To better understand the issue, please provide any details of the error messages received during attempts to restart the affected services and scale resources. Additionally, we would like to schedule a call at your earliest convenience. Available at <tel_num>. ",Incident,Service Outages and Maintenance,high,en,400,Disruption,Performance,IT,Tech Support,,,,
Änderung der Rückgabeverordnungen,"Lieber Kundensupport, ich bitte um Änderungen an den Rückgabeverordnungen für Produkte im SaaS-Projektmanagementframework. Derzeitige Verordnungen verursachen Unannehmlichkeiten für unsere Kunden und glaube, dass eine erhöhte Flexibilität die Kundenzufriedenheit steigern wird. Wir möchten Rückmeldungen von unseren Kunden einholen, um zu verstehen, wann sie Produktbewertungen vornehmen, bevor sie entscheiden, ob sie die Produkte behalten oder zurückgeben möchten. Eine erweiterte Rückgabefrist wird die Flexibilität unserer Kunden erhöhen und letztendlich unser Vertrauen und Engagement stärken.","Den Antrag zur Änderung der Rückgabeverordnungen haben wir erhalten. Kontaktieren Sie uns bitte telefonisch unter <tel_num>, um die möglichen Änderungen und die nächsten Schritte zu besprechen.",Change,Returns and Exchanges,medium,de,400,Return,Feedback,Product,Customer,Warranty,Documentation,,
Kundenservice-Wirtschaftsanalysetool,"Kontaktieren Sie uns, um Informationen zu Wirtschaftsanalysetools zu erhalten, die bei der Optimierung von Finanzinvestitionen helfen können. Könnten Sie Details zu den verfügbaren Tools und ihren Funktionen geben? Ich freue mich auf die Erhalten von Informationen, die uns bei der Fehlernamelungsentscheidung und dem Portfolio-Management unterstützen können. Zudem gibt es Anwendungen, die neue Nutzer bei der Vertrautheit mit der Wirtschaftsanalyse leiten, einschließlich Tutorials und anderen Unterstützungsressourcen. Vielen Dank für Ihre Zeit und Ihr Engagement. Ich freue mich darauf, bald von Ihnen zu hören.","Sehr geehrter <name>, wir bieten eine Reihe von Wirtschaftsanalysetools, die bei der Optimierung von Finanzinvestitionen, einschließlich Portfolio-Management und Investitionsentscheidungen, helfen. Diese Tools bieten Funktionen wie Datavisualisierung, Berichterstellung und prognostische Analyse. Für neue Nutzer bieten wir Tutorials und weitere Unterstützungsressourcen wie Online-Routinetexte und Kundensupport an. Ich freue mich, mehr Informationen zu den Tools und den Ressourcen bereitzustellen. Wenn Sie verfügbar sind, können wir telefonisch zusammenarbeiten, um spezifische Bedürfnisse und Fragen bezüglich eines Wirtschaftsanalysetools zu besprechen.",Request,Product Support,medium,de,400,Feature,Documentation,Feedback,Tech Support,,,,
,"Encountering performance problems with the SaaS platform. Several devices are impacted. Higher user load could lead to potential integration conflicts. Steps like restarting devices, clearing cache, and reviewing server metrics have been taken, but the issue continues.","Received your email about performance issues with the SaaS platform. Please investigate further and provide details on any errors observed. After reviewing server metrics, contact us at <tel_num> to discuss the next steps.",Incident,Sales and Pre-Sales,medium,en,400,Performance,Network,IT,Tech Support,,,,
Exploring QuickBooks Online Integration Possibilities,"I am interested in knowing the integration options available for QuickBooks Online with a SaaS project management tool. Could you provide detailed information on available integrations, API connections, and third-party connectors? I would greatly appreciate any information provided, including setup instructions and potential limitations.","<name>, QuickBooks Online offers API connections and third-party connectors for integration with a SaaS project management tool. For detailed information and setup instructions, please visit our website or contact us at <tel_num> for assistance. We are happy to discuss available options and potential limitations in more detail.",Request,Customer Service,low,en,400,Feature,Documentation,IT,Tech Support,,,,
Datensperre in Gesundheitsbetriebsystem,"Es wurde eine Datensperre in dem Gesundheitsbetriebsystem festgestellt, was möglicherweise zu einer Datenverletzung führen könnte. Das Ereignis könnte auf veraltete Sicherheitsprotokolle und Softwarevulnerabilitäten zurückzuführen sein. Ursprüngliche Bemühungen, das Problem zu beheben, umfassten Sicherheitsaudits durchzuführen und die Software zu aktualisieren, aber das Problem behielt seine Existenz. Weitere Untersuchungen und sofortige Maßnahmen sind erforderlich, um sensible Informationen zu schützen und zukünftige Datensperrungen zu verhindern.","Bereiten Sie sofort Maßnahmen für den Bericht über den gemeldeten Datenverlust im Gesundheitsbetriebsystem vor. Führen Sie eine umfassende Untersuchung durch und kooperieren Sie mit der Sicherheitsabteilung, um verstärkte Sicherheitsmaßnahmen zu implementieren, die die Patientendaten schützen und zukünftige Datensperrungen verhindern. Kontaktieren Sie bitte <tel_num> für weitere Diskussionen.",Incident,Billing and Payments,medium,de,400,Security,Bug,Performance,IT,Tech Support,,,
Incident of Unauthorized Access in Healthcare System,"A recent incident of unauthorized access has occurred within the healthcare system, which may have compromised medical data. The cause is suspected to be outdated security protocols and a recent software vulnerability. A security audit has been initiated, and software has been updated, but concerns remain.","Dear [Name], we acknowledge the recent incident of unauthorized access in the healthcare system and express concern over the potential compromise of medical data. We appreciate the steps that have been taken, including the initiation of a security audit and the updating of software. We would like to offer our support in addressing this incident and mitigating potential risks. Could you please provide information regarding the security audit and the updates that have been implemented so far? Additionally, it would be helpful to know the detailed specifics. Thank you.",Incident,Returns and Exchanges,medium,en,400,Security,Bug,Performance,IT,Tech Support,,,
Support for Digital Marketing with DaVinci Resolve 17,"In need of assistance from Customer Support to understand how to use DaVinci Resolve 17 for effective digital marketing strategies. As a marketer, I recognize the importance of creating engaging content to capture the attention of the target audience. DaVinci Resolve 17 provides a wide array of features that can be utilized to create stunning visuals and compelling narratives. I would greatly appreciate any insights or tips you can provide to help enhance our digital marketing campaigns. Specifically, I am interested in learning about color grading techniques.","I would be happy to provide guidance on using DaVinci Resolve 17 for digital marketing purposes. Please allow me to schedule a call at <tel_num> so we can discuss your specific needs and provide tips on color grading, audio editing, and visual effects.",Request,Customer Service,medium,en,400,Feedback,IT,Tech Support,Feature,,,,
ASUS Sound Card Details,Is it possible to get details on digital strategies for promoting the ASUS Xonar AE Sound Card VR-Controller?,Would be happy to discuss digital strategies for promoting ASUS products. Please allow me to call at your earliest convenience to provide the information.,Request,Customer Service,low,en,400,Product,Feature,Feedback,IT,,,,
Required Support for Integrating RapidMiner,"We are seeking your support for detailed guidance on integrating the RapidMiner SaaS project management solution. We would like a step-by-step process for connecting the RapidMiner platform, including the necessary API key credentials. Also, we would appreciate information on how to configure the integration to meet specific project needs. Could you please provide documentation that outlines the integration process? We look forward to hearing back and successfully integrating RapidMiner.","For assistance, contact us at <tel_num>",Request,IT Support,medium,en,400,Documentation,IT,Tech Support,Feature,,,,
Query on Pricing and Features Support,Is there any detail you could share?,"Hello, thanks for contacting our support team. We would be pleased to provide information on pricing and features. Could you please specify the particular product or service you are interested in? To make this process more convenient for you, if you prefer to discuss over the phone, please let us know a suitable time to call you at <tel_num>. We look forward to assisting your inquiry related to <acc_num>.",Request,Billing and Payments,medium,en,400,Feedback,Feature,Support,,,,,
Leitung des Xero-Integration-Projekts,"Könnten Sie detaillierte Informationen zum Xero-Integration-Projektmanagement-SaaS-Anbieter bereitstellen? Ich danke Ihnen für Ihre Unterstützung und freue mich darauf, Ihre Rückmeldung bald zu erhalten.","Sehr geehrte [Name], wir bedanken uns im Namen des Unternehmens für Ihr Interesse an unserem Projektmanagement-SaaS-System, das sich mit der Xero-Integration beschäftigt. Diese Systeme ermöglichen eine glatte Integration in das Xero-System und vereinfachen damit die Verwaltung finanzieller Angelegenheiten und Projektkosten. Die Integration bietet automatische Synchronisierung von Rechnungen, das Verfolgen von Projektkosten und vieles mehr. Falls Sie weitere detaillierte Informationen benötigen, um die spezifischen Aspekte der Integration besser zu verstehen, stehe ich Ihnen gerne zur Verfügung. Falls Sie lieber telefonisch über diese Angelegenheit sprechen möchten, können Sie mich gerne an der angegebenen Telefonnummer erreichen. Ich freue mich, bald von Ihnen zu hören.",Request,Billing and Payments,medium,de,400,IT,Tech Support,Feature,Documentation,Feedback,,,
,"Customer support, please provide an inquiry regarding the steps our company is taking to ensure the confidentiality, integrity, and availability of sensitive medical data by implementing enhanced security measures in the medical data management infrastructure. In today's digital age, data breaches can have severe consequences. Could you also share the specific protocols and technologies used to safeguard against cyber threats? Your attention to this matter is greatly appreciated, and I look forward to hearing back soon.","We take data security seriously and have implemented various measures to protect medical data, including encryption and intrusion detection. We will provide a detailed response regarding the specific protocols and technologies used to safeguard against cyber threats.",Change,Returns and Exchanges,high,en,400,Security,Performance,IT,Tech Support,,,,
Details on Integration with Subversion SaaS,"Looking for support in understanding the integration capabilities between our systems and Subversion SaaS for project management. Can you provide more details on how these systems work together? Specifically, I am interested in knowing the features and benefits of the integration, particularly focusing on version control and collaboration functionalities. I look forward to hearing back with the necessary information. Thank you for your time and assistance.","We will provide detailed information on the integration of Subversion SaaS, including its version control and collaboration features, and contact you for further discussion.",Request,Technical Support,medium,en,400,Feature,Documentation,IT,Tech Support,,,,
Troubleshooting Connectivity Problems with Logitech K780 Keyboard,"Reporting connectivity issues with the Logitech K780 keyboard. The problem arises while using various SaaS applications, and it could be due to Bluetooth interference or driver incompatibility. I have already tried restarting the keyboard and laptop, as well as ensuring the software is up to date. Despite these efforts, the issue still persists. I would greatly appreciate a guide or steps to troubleshoot and resolve this issue. Please let me know if there is any additional information needed.",Please review the issue and contact us at +1-800-123-4567 for assistance with troubleshooting.,Problem,IT Support,medium,en,400,Network,Performance,Hardware,IT,Tech Support,,,
Security of Medical Data in Simulink MATLAB,"Please contact us to determine how the medical data in Simulink MATLAB is secured within the IT systems of the hospital. Could you provide detailed information on best practices, protocols, security measures, and assurance of the confidentiality and integrity of sensitive medical information? We would be glad to offer any resources or assistance, especially for the most critical IT systems of the hospital.","Advice on securing medical data in Simulink MATLAB. I recommend reviewing online resources and security documentation for best practices. If you wish to discuss further, please provide a specific time window for a call at <tel_num>.",Request,Product Support,medium,de,400,Security,IT,Tech Support,,,,,
Inquiry Regarding Data Analytics Services,Is it possible to get information on data analytics services that optimize investment strategies? This would greatly assist us in making informed decisions and potentially enhancing our portfolio performance. Thank you for your assistance!,"<name>, thank you for your inquiry regarding data analytics services. We offer a range of solutions that can help optimize investment strategies, including data visualization, predictive modeling, and portfolio performance analysis. Our services are designed to help you make informed decisions and improve your portfolio performance. We can provide tailored information based on your needs. Could you please provide us with more details about your current investment portfolio and specific goals? We would be happy to schedule a call at your convenience to discuss this further. Please let us know.",Request,Billing and Payments,low,en,400,Feedback,Sales,Feature,IT,,,,
