subject,body,answer,type,queue,priority,language,version,tag_1,tag_2,tag_3,tag_4,tag_5,tag_6,tag_7,tag_8
Probleme bei der Daten-Synchronisierung in Tools,"Finanzinstitut erlebt Schwierigkeiten bei der Daten-Synchronisierung über mehrere Anwendungen, möglicherweise verursacht durch Softwarekonflikte. Neustarts und Updates wurden bereits versucht, jedoch ohne dauerhaften Erfolg.","Ich werde die Ursachen der Daten-Synchronisationsprobleme in den verschiedenen Tools weiter untersuchen. Um das Problem besser zu verstehen, bitte ich um zusätzliche Details zu den beteiligten Anwendungen und der verwendeten Software. Gerne können wir einen Anruf planen, um das Thema zu besprechen und mögliche Lösungen zu erörtern. Teilen Sie mir bitte eine passende Zeit mit, unter <tel_num> werde ich Sie anrufen.",Incident,Billing and Payments,high,de,52,Performance,Disruption,Recovery,Software,,,,
Connectivity Problems with Videoconferencing System StreamCam,"A financial organization has been facing recurrent connectivity problems with their Logitech StreamCam videoconferencing system. Despite rebooting the devices and updating the software, the issues continue to occur. These disruptions are impacting the workflow related to investment data analysis. Kindly assist in resolving this matter.","<name> replying to your email regarding the connectivity problems with the Logitech StreamCam videoconferencing system experienced by the financial organization. We understand that restarting devices and updating the software have not resolved the issue, which is affecting investment data analysis processes. To assist effectively, we would like to gather more details about the problem, including any error messages received and the specific steps already taken. Please let us know a convenient time for a call to discuss the troubleshooting process in detail.",Problem,Customer Service,low,en,52,Network,Disruption,Hardware,Software,Performance,,,
Issue with Financial Data Synchronization,"The financial firm experienced data synchronization errors that impacted investment optimization analyses, potentially due to software incompatibility. Restarting the systems, updating the software, and checking network connections resolved the issue.","Dear <name>, we are investigating the reported issue with financial data synchronization. Please verify software compatibility and provide additional details such as the software versions and system configurations used. Would you be available for a call at <tel_num> to discuss possible solutions?",Incident,Technical Support,high,de,52,Bug,Network,Performance,Disruption,Recovery,,,
Data Security Notification,"Dear Customer Support, I am informing you that a healthcare provider has detected unusual access to medical records. This incident may be linked to insufficient authentication measures. As a precaution, initial password resets have been carried out on affected accounts. Protecting patient data is our highest priority, and we are taking this matter very seriously. We recognize the potential risks posed by data breaches and are acting swiftly to resolve the issue. Our team is working diligently to strengthen security protocols.","<name>, thank you for informing us about the data security alert and the steps being taken to address it. We appreciate your proactive efforts to safeguard sensitive information. If you need assistance with password resets or have any concerns, please do not hesitate to contact us at <tel_num> or reply via email. We are here to support you and value your commitment to maintaining data security.",Incident,General Inquiry,medium,en,52,Security,IT,Notification,Incident,Data Breach,,,
Synchronization Error,Several integration devices ceased syncing with the SaaS platform following recent update conflicts. Restarting the services and verifying the API keys have temporarily resolved the problem. Assistance is required to further troubleshoot and fix the synchronization failure.,Please reach out for troubleshooting support,Incident,Technical Support,medium,en,52,Bug,Crash,Network,Performance,Disruption,Recovery,Security,
Healthcare System Data Security Incident,"Customer Support is preparing a report concerning a serious data security incident within the healthcare system. The healthcare provider experienced unauthorized access to sensitive medical records. The suspected cause of the breach is outdated versions of MySQL and Firebase integrated into the system. Despite applying patch updates and rebooting the system, the problem continues. Immediate assistance is requested to address this issue and prevent further unauthorized access. The breach has compromised personal medical information.","<name> is drafting an acknowledgment email regarding the reported healthcare system data breach. We recognize the seriousness of this matter and the need for urgent support to prevent further unauthorized access. To assist with the investigation and resolution, please provide details on the system configuration, including the specific versions of MySQL and Firebase in use, as well as information on the patch updates and system reboots performed. Kindly send this information at your earliest convenience. We would also like to arrange a meeting to discuss the situation further.",Incident,Technical Support,high,en,52,Security,Data Breach,Hardware,Outage,Recovery,,,
Digital Marketing Pricing Options,"Customer Support is inquiring about digital marketing services. Could you please share details regarding pricing structures, billing periods, and the services offered? They are interested in understanding the different packages available and how they can benefit their business. Specifically, they would like to know the costs associated with each package, what services are included, and the billing frequency. Additionally, they would appreciate information on any discounts for long-term commitments or current promotions. Looking forward to your response to discuss further.","<name> is happy to provide information about our digital marketing service pricing options. We offer several packages tailored to different business sizes and budgets. Our pricing plans include a basic package starting at <amount> per month, a premium package at <amount> per month, and an enterprise package at <amount> per month. These packages include a variety of services such as social media management, search engine optimization, and content creation. The billing cycle varies depending on the chosen plan.",Request,Billing and Payments,medium,en,52,Billing,Pricing,Customer Support,Digital Marketing,Packages,Discounts,Cost,Billing Period
Wiederholte Abstürze auf mehreren Plattformen,"Häufige Abstürze treten bei Surface Pro, ClickUp und JIRA nach dem letzten Update auf.","Sehr geehrte/r <name>,\n\nwir bedauern die Unannehmlichkeiten, die durch die wiederholten Abstürze bei Surface Pro, ClickUp und JIRA nach dem letzten Update entstanden sind. Wir nehmen diese Probleme ernst und möchten bei der Lösung helfen. Um das Problem besser zu verstehen, bitten wir Sie, uns weitere Details zu den Fehlermeldungen, die Sie erhalten haben, sowie die Schritte, die Sie bisher unternommen haben, mitzuteilen. Zudem wäre es hilfreich, die aktuellen Versionsnummern der verwendeten Software zu kennen. Falls notwendig, können wir auch einen passenden Zeitpunkt für einen Anruf vereinbaren.",Incident,Technical Support,high,de,52,Crash,Performance,Bug,Outage,,,,
Investment Platform Experienced Crash Today,"Dear Customer Support, I am submitting a report regarding an issue with the firm's investment analytics platform. The platform crashed during data processing, likely due to server overload. I attempted to resolve the problem by restarting services and clearing the cache, but these efforts were unsuccessful. The crash happened while processing a large dataset, leading me to believe the server may have been overwhelmed. I would greatly appreciate it if you could look into this matter and provide a solution as soon as possible. Please let me know if you need any additional information.","<name>, thank you for reporting the issue with the investment analytics platform. We apologize for the inconvenience caused by the crash. To assist further, could you please provide details about the dataset processed and the exact error message displayed? If necessary, we can schedule a call at <tel_num> to discuss this in more detail. Please let us know a convenient time for the call. We will investigate the matter and aim to provide a solution promptly. Your account <acc_num> has been updated with the latest progress.",Incident,Technical Support,high,en,52,Crash,Performance,Outage,Disruption,Recovery,,,
Security Protocols for Microsoft Dynamics 365,"I am seeking advice on security protocols for managing healthcare data within Microsoft Dynamics 365. I want to explore ways to enhance data security and ensure compliance with industry standards. Specifically, I am interested in learning about encryption techniques, access management, and auditing processes. Any resources or guidance you can provide would be highly valuable.","I can offer general advice on security measures for healthcare data management in Microsoft Dynamics 365. To strengthen data protection and ensure regulatory compliance, I recommend using encryption methods such as TLS and field-level encryption, implementing access controls like role-based permissions and authentication protocols, and establishing auditing procedures to monitor system activities. If you'd like more detailed guidance, please let me know a suitable time for a call to discuss further.",Request,Customer Service,medium,en,52,Security,Compliance,Encryption,Access Management,Auditing,Industry Standard,,
System Crash in Investment Optimization Platform,"Dear Customer Support, the investment optimization system used by our financial firm unexpectedly crashed. This may have been triggered by recent software updates causing data overload. We have restarted the affected devices, verified network connectivity, and optimized data flow, but the system continues to be unstable. We are worried about potential data loss and financial impact due to the downtime. We kindly request your prompt assistance in resolving this issue. Please advise us on the next steps.",Please review the issue by contacting <tel_num> to discuss troubleshooting procedures and explore potential solutions to restore the system as quickly as possible.,Problem,Technical Support,high,en,52,Crash,Performance,Network,Outage,Disruption,Recovery,,
,"Das Vertriebsteam berichtet über verzögerte Reaktionszeiten beim Zugriff auf Moodle, HubSpot CRM und bei Kundendemonstrationen. Mögliche Ursachen könnten Netzwerkverzögerungen oder Serverüberlastungen sein, die zu Verzögerungen führen. Es wird empfohlen, die betroffenen Anwendungen neu zu starten und die Netzwerkverbindungen zu überprüfen. Sobald das Problem behoben ist, sollte die Angelegenheit bestätigt werden. Das Team ist frustriert aufgrund der Auswirkungen auf die Arbeit. Wir begrüßen die Meldung und werden die Angelegenheit so bald wie möglich bearbeiten, um eine Lösung bereitzustellen.","Wir haben eine Meldung über langsame Reaktionszeiten bei Moodle, HubSpot CRM und Kundendemonstrationen erhalten. Die Angelegenheit wird geprüft; hierfür benötigen wir weitere Informationen zu den Netzwerkverbindungen, Serverauslastung und den Demonstrationen. Bitte teilen Sie uns die genauen Zeiten mit, zu denen das Problem aufgetreten ist, sowie die Anzahl der Nutzer und die Zeitpunkte, zu denen die Anwendungen aufgerufen wurden. Wir werden die Fehlerprotokolle überprüfen und die Problemlösung fortsetzen, um eine geeignete Lösung zu finden.",Incident,Sales and Pre-Sales,medium,de,52,Network,Performance,Disruption,Server,Application,IT,Tech Support,
Data Access Security Concern,"A healthcare organization has encountered possible data access problems impacting several products; a security breach due to potential misconfiguration is suspected. The preliminary troubleshooting included system diagnostics, network assessments, and software updates, but the issue remains unresolved. An investigation is requested to verify the security of medical information and maintain hospital integrity. Please prioritize this matter and conduct an urgent inquiry.",Conduct a prompt investigation into the data access security concern. Contact <tel_num> to discuss the necessary steps to safeguard medical data and uphold hospital integrity.,Incident,Sales and Pre-Sales,medium,en,52,Security,Data Access,Outage,Disruption,Diagnostic,Network,,
Support for Avast Security,"Dear Customer Support Team, I am seeking guidance on integrating digital marketing strategies with Avast Premium Security to boost my brand's growth. As a business owner, I recognize the significance of online security in shaping my brand's reputation. I am currently using Avast Premium Security and am impressed with its features and capabilities. However, I believe that utilizing digital marketing strategies could elevate my brand further. Could you please provide guidance on how to integrate digital marketing strategies effectively?","Hello <name>, thank you for reaching out to the support team regarding integrating digital marketing strategies with Avast Premium Security to enhance your brand's growth. We appreciate your trust in our product's capabilities. To provide you with effective guidance, could you please share details about your current digital marketing efforts and specific areas of online security you wish to focus on? This information will help us offer tailored advice to leverage Avast Premium Security for protecting and growing your business.",Request,Technical Support,medium,en,52,Security,Feedback,IT,Tech Support,,,,
Problem with Data Analytics Software,"We are facing an issue with the data analytics tools that is affecting our investment optimization processes. The possible cause might be a misconfiguration in the network software. We have attempted to reboot the systems, verify the connections, and reset the affected applications, but the problem remains unresolved. We would appreciate your prompt assistance to resolve this issue and minimize operational disruptions.","<name>, we acknowledge the problem with the data analytics tools and understand its impact on investment optimization. Please investigate the issue and provide details of any error messages you encounter, along with the specific steps you have taken so far. We would like to arrange a call at your convenience to discuss the situation and work towards a resolution. If you are available for a call at <tel_num>, that would be ideal; otherwise, please suggest an alternate time. Kindly inform us of a suitable time so we can ensure contact and assist in resolving the issue.",Incident,IT Support,medium,en,52,Bug,Performance,Network,Software,Disruption,Support,,
Incident Report: Integration Failures,"Dear Customer Support,<br>I am submitting an incident report regarding multiple integration failures within our scalable SaaS project management system. The issue commenced following the recent update to Node.js 14.17, which appears to conflict with our current configuration.<br>I have attempted to revert the update and restart the services; however, the problem persists. These failed integrations are impacting our critical daily operations, and we require assistance to resolve this matter promptly.<br>Could you please review the situation and provide a solution?","<name>, thank you for reporting the incident concerning integration failures in your SaaS project management platform. We understand the urgency, as the issue is affecting your daily operations. To better assist you, could you please provide additional details in your incident report, specifically the date and time the incident occurred, the affected services, and any error messages encountered? Additionally, please confirm the current version of Node.js running after the recent changes to your setup. This information will help us expedite the troubleshooting process.",Incident,Product Support,medium,en,52,Bug,Outage,Disruption,Recovery,IT,Tech Support,,
Cloud-based Project Management Solutions,Can you supply comprehensive documentation on how to integrate third-party collaboration tools with your SaaS project management platform?,We will send you detailed documentation on integrating third-party collaboration tools with our SaaS project management platform via email. Please allow us 24 hours to prepare the information.,Request,Product Support,medium,en,52,Documentation,Product,Feature,,,,,
Analysis Required for Crash Report,"The data analytics system investment optimization experienced an unexpected crash, potentially due to software incompatibility or resource overload. Efforts to resolve the issue included rebooting servers, updating drivers, and increasing system memory. Despite these actions, the problem remains unresolved. We are concerned that this may be a complex issue requiring technical support investigation. Could you please prioritize this matter and offer guidance on how to proceed? Your assistance in resolving this issue would be greatly appreciated.",Please review the crash report and contact <tel_num> to discuss and provide a solution to resolve the data analytics system issue.,Incident,Product Support,medium,en,52,Crash,Performance,Hardware,Software Compatibility,Server,Memory,Tech Support,
Hilfe für WLAN-Router,"Sehr geehrte Kundensupport, kontaktieren Sie mich, um eine detaillierte Dokumentation und Anleitungen zu erhalten, die Funktionalitäten des WLAN-Router und des Mesh-Netzwerks, sowohl als integrierter Teil als auch in Verbindung mit der SaaS-Plattform, erläutern. Als wertvoller Kunde ist es unerlässlich, ein vollständiges Verständnis der Funktionen zu haben, um effektiv mit der Netzwerkinfrastruktur umzugehen. Die Integration des WLAN-Router in ein Mesh-Netzwerk kann das Netzwerkübertragungsvermögen verbessern, Dead Spots verringern und die Gesamtnebelkraft des Netzwerks erhöhen. Ich schätze, wenn Sie detaillierte Anweisungen, Tutorials und Webinare zur Verfügung stellen, die mir dabei helfen, den Prozess zu navigieren.","Ich werde eine Dokumentation und Anleitungen zur Integration der WLAN-Router-Funktionalitäten in das Mesh-Netzwerk und die SaaS-Plattform zur Verfügung stellen. Bitte rufen Sie mich an, um weitere Details und Anforderungen zu besprechen.",Request,Product Support,high,de,52,Network,Hardware,Documentation,Support,,,,
Challenges with Digital Marketing Campaigns,"Dear Customer Support, I am writing to express my concern regarding the recent digital marketing campaigns conducted by our agency. Unfortunately, these campaigns have not performed as expected, and we are having difficulty understanding the underlying reasons. Our initial review indicates that ineffective audience targeting and platform-related issues might be the main factors contributing to the subpar results. Although we have made some modifications to ad creatives and adjusted budgets, we have not seen notable improvements. I would greatly appreciate it if you could investigate this matter and offer guidance on how to enhance and optimize our digital campaigns.","<name>, I am writing to acknowledge your email regarding the challenges faced with recent digital campaigns. I understand your concerns and appreciate the efforts you've made so far to analyze and modify the campaigns. To assist you more effectively, I would like to request additional information, including the specific platforms used and the targeting options selected. Could you also provide details about the adjustments made to ad creatives and budgets? This information will help us investigate the issue thoroughly and offer appropriate guidance to optimize your digital campaigns.",Incident,Sales and Pre-Sales,medium,en,52,Marketing,Campaign,Digital,Audience,Platform,Issue,,
,"Customer Support, I am reaching out to request comprehensive documentation on the integration practices for the Kubernetes Smart-Licht scalable SaaS project management platform. Currently, we are designing and implementing a resilient infrastructure to support our growing user base, and we believe that Kubernetes Smart-Licht will play a vital role in this effort. Could you please share available resources, tutorials, guides, and case studies to help us get started with the integration? Your assistance would be highly appreciated.","<name>, thank you for contacting the support team. We appreciate your interest in integrating the Kubernetes Smart-Licht SaaS project management platform. We can provide general documentation on integration practices. However, for specific guidance tailored to your project, please share details about your current infrastructure and particular requirements. This will allow us to offer targeted resources and assistance. If needed, we can also schedule a call at <tel_num> to discuss further. We look forward to assisting you with the integration to ensure success.",Request,Human Resources,medium,en,52,Documentation,Feedback,IT,Tech Support,Performance,,,
,Kindly supply guidelines for safeguarding medical information in accordance with hospital security procedures.,"To protect medical data, it is advisable to adopt encryption methods and access controls. Make sure staff are trained to adhere to security policies and procedures. Perform periodic risk evaluations and security audits to detect potential weaknesses. Additionally, consider deploying two-factor authentication and establishing an incident response plan. I would appreciate detailed information and would like to discuss a suitable time for a call to review specific guidelines and recommendations.",Request,Technical Support,high,en,52,Security,Documentation,,,,,,
Healthcare Data Accessibility Problem,The healthcare provider encountered difficulties accessing data. Potential reasons may involve recent system updates or credential discrepancies. Multiple login attempts and reboots have been attempted without resolution.,"We are currently examining the healthcare data access problem. To assist you better, please share the specific error messages encountered and the steps already undertaken. It might be necessary to contact <tel_num> for further discussion. Please let us know a convenient time for a call.",Problem,Product Support,low,en,52,Security,IT,Tech Support,Outage,,,,
Tägliche Meldungen über sporadische Serviceunterbrechungen,"Sehr geehrter Kundenservice, ich erfahre regelmäßig sporadische Serviceausfälle, die das Projektmanagement beeinträchtigen. Die Ausfälle treten scheinbar zu Stoßzeiten auf und könnten auf eine Serverüberlastung zurückzuführen sein. Ich habe versucht, den Server neu zu starten und temporäre Lastverteilungsmaßnahmen zu ergreifen, die teilweise Verbesserungen brachten. Das Problem besteht jedoch weiterhin, weshalb wir eine dauerhafte Lösung benötigen. Könnten Sie sich bitte schnellstmöglich um die Angelegenheit kümmern und eine Lösung bereitstellen? Ich schätze Ihre zügige Aufmerksamkeit und freue mich auf eine baldige Rückmeldung bezüglich der Ausfälle.","Sehr geehrter <name>, wir haben Ihre E-Mail bezüglich der wiederkehrenden Serviceunterbrechungen erhalten, die das Projektmanagement beeinträchtigen. Wir arbeiten an einer dauerhaften Lösung und werden die Angelegenheit untersuchen. Um Ihnen besser helfen zu können, könnten Sie uns möglicherweise kontaktieren, um weitere Informationen zu erhalten? Wäre es möglich, einen passenden Zeitpunkt für einen Anruf zu vereinbaren? Bitte teilen Sie uns eine geeignete Zeit mit. Sie erreichen uns unter <tel_num> bezüglich Ihres Kontos <acc_num>.",Problem,IT Support,high,de,52,Outage,Disruption,Performance,Server,Maintenance,,,
Dringender Zugriff auf das Sicherheitssystem für medizinische Daten im Krankenhaus problematisch,"Sehr geehrter Kundenservice, das Sicherheitssystem für medizinische Daten im Krankenhaus weist intermittierende Zugriffsprobleme auf, möglicherweise verursacht durch Netzwerk-Konfigurationsfehler oder Softwarekonflikte. Das IT-Team arbeitet daran, die Serverdienste neu zu starten und die Sicherheitseinstellungen erneut zu überprüfen, um das Problem zu beheben. Diese Schwierigkeiten bestehen seit gestern und beeinträchtigen die Fähigkeit, auf wichtige Patientendaten zuzugreifen. Trotz grundlegender Fehlerbehebungsschritte ist das Problem weiterhin ungelöst. Wir bitten um Ihre Unterstützung bei der Ursachenanalyse und der schnellen Umsetzung einer Lösung, um weitere Unterbrechungen zu vermeiden.","<name>, ich bestätige den Erhalt Ihrer E-Mail bezüglich des dringenden Problems mit dem Zugriff auf das Sicherheitssystem für medizinische Daten im Krankenhaus. Ich verstehe die Ernsthaftigkeit der Situation und die Auswirkungen auf die Fähigkeit, auf wichtige Patientendaten zuzugreifen. Die Fehlerbehebung wird fortgesetzt. Bitte senden Sie uns weitere Details zur Netzwerk-Konfiguration sowie die genauen Fehlermeldungen. Könnten Sie außerdem die Serverprotokolle und die Sicherheitseinstellungen bereitstellen? Ich möchte außerdem ein Gespräch vereinbaren, sobald es Ihnen am besten passt, um die Angelegenheit persönlich zu besprechen. Bitte teilen Sie mir Ihre Verfügbarkeit mit.",Problem,Product Support,low,de,52,Security,Network,Hardware,Outage,Disruption,,,
